ID,Region,Regulated.Dam,Primary.Purpose,Primary.Type,Height..m.,Length..km.,Volume..m3.,Year.Completed,Years.Modified,Surface..km2.,Drainage..km2.,Spillway,Last.Inspection.Date,Inspection.Frequency,Distance.to.Nearest.City..km.,Hazard,Assessment,Assessment.Date,Probability.of.Failure,Loss.given.failure...prop..Qm.,Loss.given.failure...liab..Qm.,Loss.given.failure...BI..Qm.,Height_clean,Length_clean,Length_missing,Volume_clean,Volume_missing,Volume_log,n_modifications,last_modification_year,Height..m._missing,Length..km._missing,Volume..m3._missing,Drainage..km2._missing,Surface..km2._missing,Distance.to.Nearest.City..km._missing
SOAD02906,Flumevale,Yes,Unknow,Earth,10.731485326055509,0.082,15650.0,1947,,0.01773,31.87653237996222,,05/08/2020,1,0.0,High,Not Available,,0.1355,30.6,651.4,20.284086148314113,,0.082,0,15650.0,0,9.6582900916905,0,Unknow,1,0,0,1,0,0
SOAD05705,Flumevale,No,Recreation,Earth,8.746,0.1,15000.0,1950,,0.5458120043374093,100.19999169984011,Uncontrolled,22/10/2015,5,83.19,Significant,Not Rated,,0.1355,107.0,74.2,6.1,8.746,0.1,0,15000.0,0,9.61587214452889,0,Unknow,0,0,0,1,1,0
SOAD07112,Flumevale,No,Irrigation,Earth,7.961,0.262,9180.0,1918,,0.5641098134986925,95.44316467299062,Controlled,28/09/2015,5,25.285731808019854,Significant,Not Rated,,0.1108,219.6,160.6,38.9,7.961,0.262,0,9180.0,0,9.1248914101437,0,Unknow,0,0,0,1,1,1
SOAD10770,Flumevale,No,Fish and Wildlife Pond,Earth,10.525,0.05,52521.1259051468,1875,,27.68844016730051,709.8150809445893,Uncontrolled,26/02/2020,1,1.873232782484948,High,Not Rated,,0.1203,851.5,772.2,18.04711350354907,10.525,0.05,0,,1,,0,Unknow,0,0,1,1,1,1
SOAD11108,Flumevale,No,Flood Risk Reduction,Earth,6.122,0.307,24934.179650812363,2005,,0.6088083235242734,96.97785261718062,,11/09/2018,5,11.49447599930191,Significant,Not Available,,0.1411,256.9,461.9,20.637925816445797,6.122,0.307,0,,1,,0,Unknow,0,0,1,1,1,1
SOAD18122,Flumevale,No,Other,Earth,13.878,0.073,67055.79650021413,1949,,25.026330148472326,703.2499068827814,Uncontrolled,26/02/2020,1,0.16,High,Not Rated,,0.102,925.1,619.9,18.970800005693768,13.878,0.073,0,,1,,0,Unknow,0,0,1,1,1,0
SOAD19425,Flumevale,No,Flood Risk Reduction,Earth,27.419,0.347,220000.0,1971,,0.00788,83.5361065310492,,06/07/2023,1,6.32,High,Satisfactory,2023-09-29,0.1104,16.4,201.5,15.30620293701443,27.419,0.347,0,220000.0,0,12.3013873707787,0,Unknow,0,0,0,1,0,0
SOAD03833,Flumevale,Yes,"Fire Protection, Stock, Or Small Fish Pond",Earth,3.977,0.115,2773.0,1983,1996,0.00788,264.78101894395434,Uncontrolled,18/06/2020,2,11.26,Significant,Satisfactory,2020-06-18,0.1354,39.8,121.9,17.634306416084186,3.977,0.115,0,2773.0,0,7.92804560087478,1,1996,0,0,0,1,0,0
SOAD14182,Flumevale,No,Tailings,Earth,8.658,0.267,27926.031922358095,Unknow,,6.122549206925403,317.20189173406357,,,Unknow,4.75,High,Not Available,,0.1235,844.9,374.4,17.01565956333216,8.658,0.267,0,,1,,0,Unknow,0,0,1,1,1,0
SOAD02312,Flumevale,No,Other,Earth,10.679,0.08,21140.888306382094,Unknow,,0.7401049170753207,298.52392344756646,,,Unknow,1.67,Significant,Not Available,,0.1661,306.3,365.5,18.255063647817696,10.679,0.08,0,,1,,0,Unknow,0,0,1,1,1,0
SOAD01247,Flumevale,No,Water Supply,Earth,7.299,0.253,24960.625378100114,Unknow,,0.6886129170607689,318.94428966604903,,,Unknow,1.67,Significant,Not Available,,0.1451,312.7,887.2,47.5,7.299,0.253,0,,1,,0,Unknow,0,0,1,1,1,0
SOAD11867,Flumevale,Yes,Water Supply,Earth,4.43,0.083,10010.690517769921,1999,2000,0.00788,41.35951863597684,Uncontrolled,24/05/2013,2,11.38,Significant,Fair,2013-05-24,0.1314,18.3,151.7,15.0,4.43,0.083,0,,1,,1,2000,0,0,1,1,0,0
SOAD15152,Flumevale,Yes,Flood Risk Reduction,Earth,11.071,0.095,21140.0,2005,,0.00788,649.6398187717358,Uncontrolled,17/09/2020,1,1.0336290781047437,High,Fair,2020-09-17,0.1114,43.7,816.2,20.545031404647652,11.071,0.095,0,21140.0,0,9.95896956199513,0,Unknow,0,0,0,1,0,1
SOAD02714,Flumevale,No,Water Supply,Earth,13.753,0.033,28490.182705934203,Unknow,,1.1670906992750096,133.48959376247356,,,Unknow,7.67,High,Not Available,,0.1083,672.7,452.4,51.7,13.753,0.033,0,,1,,0,Unknow,0,0,1,1,1,0
SOAD05372,Flumevale,Yes,Irrigation,Earth,5.634,0.08,3550.0,1960,,0.00788,7.98987,Uncontrolled,21/06/2021,2,16.56,Significant,Fair,2021-06-21,0.1503,8.1,260.9,24.6,5.634,0.08,0,3550.0,0,8.17498453294309,0,Unknow,0,0,0,0,0,0
SOAD11286,Flumevale,Yes,Recreation,Earth,3.498,0.133,10741.147649816528,1966,,0.00788,7.98987,Uncontrolled,29/08/2022,2,1.59,Significant,Fair,2022-08-29,0.1333,11.7,704.8,4.9,3.498,0.133,0,,1,,0,Unknow,0,0,1,0,0,0
SOAD03788,Flumevale,Yes,Recreation,Earth,2.778,0.1,698.0,1933,,0.01773,7.98987,Uncontrolled,24/08/2022,2,0.0,Significant,Satisfactory,2022-08-24,0.1303,43.8,343.5,5.8,2.778,0.1,0,698.0,0,6.54965074223381,0,Unknow,0,0,0,0,0,0
SOAD08746,Flumevale,Yes,Flood Risk Reduction,Earth,13.48,0.12,8900.0,2005,,0.00788,39.13607631391382,Uncontrolled,17/09/2020,1,0.0,High,Fair,2020-09-17,0.0965,8.6,531.1,17.721505502737937,13.48,0.12,0,8900.0,0,9.09391890895893,0,Unknow,0,0,0,1,0,0
SOAD10234,Flumevale,Yes,Water Supply,Earth,7.349,0.06,90922.90516377908,2007,2016,0.00788,5340.166634669629,Uncontrolled,28/09/2021,2,3.35,Significant,Satisfactory,2021-09-28,0.1222,33.1,879.3,54.1,7.349,0.06,0,,1,,1,2016,0,0,1,1,0,0
SOAD12835,Flumevale,Yes,Water Supply,Earth,7.45,0.093,7400.0,1964,2011H,0.00788,1474.1245700307845,Uncontrolled,05/05/2021,2,4.63,Significant,Satisfactory,2021-05-05,0.1031,39.9,162.8,46.6,7.45,0.093,0,7400.0,0,8.90937040519747,1,2011,0,0,0,1,0,0
SOAD01805,Flumevale,No,Debris Control,Earth,24.241,0.167,107411.38389708323,1938,,0.00788,13.31645,Uncontrolled,18/05/2022,5,1.1243059949663932,High,Not Available,,0.078,32.3,681.5,18.365484123738906,24.241,0.167,0,,1,,0,Unknow,0,0,1,0,0,1
SOAD13805,Flumevale,No,Fish and Wildlife Pond,Earth,4.377,0.058,2461.0,1934,,0.09873318821431552,34.877697670701,Uncontrolled,18/08/2010,Unknow,25.04,Significant,Not Rated,,0.1194,5.0,123.9,22.77155381491422,4.377,0.058,0,2461.0,0,7.8087293067444,0,Unknow,0,0,0,1,1,0
SOAD03137,Flumevale,Yes,Hydroelectric,Earth,9.44,0.136,14880.607592397238,1983,,0.0197,32.261701905568735,,11/09/2019,2,60.284389877028495,Low,Satisfactory,2023-04-11,0.0644,15.0,8.5,63.99972301587311,9.44,0.136,0,,1,,0,Unknow,0,0,1,1,0,1
SOAD18509,Flumevale,Yes,Recreation,Earth,5.384,0.193,19562.92165581253,Unknow,,0.01576,48.540850052937806,,16/11/2021,2,6.48,Significant,Satisfactory,2021-11-16,0.1246,38.9,358.6,4.3,5.384,0.193,0,,1,,0,Unknow,0,0,1,1,0,0
SOAD10593,Flumevale,Yes,Unknow,Earth,8.948,0.16,16489.6095486508,1953,,0.03349,45.27593,Uncontrolled,13/07/2018,6,1.61,Low,Unsatisfactory,2011-05-18,0.0936,5.4,953.9,16.209447069718074,8.948,0.16,0,,1,,0,Unknow,0,0,1,0,0,0
SOAD12130,Flumevale,Yes,Irrigation,Earth,13.105,0.1,32083.80570152054,1990,,0.01576,39.87296486341631,,21/02/2023,1,29.592767969230373,Significant,Fair,2017-09-01,0.1522,46.3,199.0,9.4,13.105,0.1,0,,1,,0,Unknow,0,0,1,1,0,1
SOAD20636,Flumevale,Yes,Water Supply,Earth,9.271,0.167,600.0,1982,,0.01773,43.31511888489559,,23/10/2018,6,1.61,Low,Satisfactory,2016-07-22,0.0438,8.9,821.9,13.7,9.271,0.167,0,600.0,0,6.39859493453521,0,Unknow,0,0,0,1,0,0
SOAD00507,Flumevale,Yes,Water Supply,Earth,16.582,0.087,16850.0,1989,,0.00788,29.35103370321573,Uncontrolled,25/03/2019,6,9.41,Low,Not Rated,,0.0624,31.2,217.4,11.0,16.582,0.087,0,16850.0,0,9.73216528120054,0,Unknow,0,0,0,1,0,0
SOAD14947,Flumevale,Yes,Irrigation,Earth,11.707,0.037,24687.789594381324,1973,,0.00788,30.559341239256877,Uncontrolled,21/04/2004,0,13.27,Low,Not Rated,,0.0843,26.7,123.1,23.4,11.707,0.037,0,,1,,0,Unknow,0,0,1,1,0,0
SOAD18593,Flumevale,Yes,Water Supply,Earth,14.382,0.209,42500.0,1922,,0.00788,5518.546525871355,,16/03/2022,1,66.00587993598265,Low,Satisfactory,2017-09-01,0.0786,34.9,17.3,67.0,14.382,0.209,0,42500.0,0,10.6572828840475,0,Unknow,0,0,0,1,0,1
SOAD20352,Flumevale,Yes,Flood Risk Reduction,Earth,13.481,0.05,145.0,1974,1977,0.00788,82.31701286542999,,02/12/2016,3,1.69,Low,Not Rated,,0.1019,8.8,357.6,18.709109158831197,13.481,0.05,0,145.0,0,4.98360662170834,1,1977,0,0,0,1,0,0
SOAD02117,Flumevale,Yes,Recreation,Earth,11.511,0.14,34155.81292495167,Unknow,,0.01576,48.14959707908906,Uncontrolled,24/06/2021,6,56.74329376062056,Low,Fair,2018-09-25,0.0524,28.1,23.7,3.9,11.511,0.14,0,,1,,0,Unknow,0,0,1,1,0,1
SOAD06483,Flumevale,No,Unknow,Earth,8.502,1.0068257679709793,470080.3903486368,1944,,0.0197,1078.63245,,07/12/2022,Unknow,20.53937902110291,Significant,Not Available,,0.1584,30.1,235.0,16.829619947143257,8.502,,1,,1,,0,Unknow,0,1,1,0,0,1
SOAD09248,Flumevale,Yes,Other,Earth,15.568,0.133,42562.0,1979,,0.00788,37.450514559821585,,01/01/1991,6,24.89,Low,Not Rated,,0.0225,20.2,171.7,18.947286780780917,15.568,0.133,0,42562.0,0,10.6587406102531,0,Unknow,0,0,0,1,0,0
SOAD12911,Flumevale,Yes,Water Supply,Earth,31.238,0.1,57000.0,1940,,0.00788,48.899195158920996,,24/08/2022,1,0.16,High,Satisfactory,2017-09-01,0.069,31.5,144.8,32.6,31.238,0.1,0,57000.0,0,10.9508240905224,0,Unknow,0,0,0,1,0,0
SOAD20752,Flumevale,Yes,Water Supply,Earth,12.74,0.111,17065.0,1962,,0.01773,31.7947833137811,,11/08/2022,1,0.47,High,Satisfactory,2017-09-01,0.0782,18.6,665.2,62.6,12.74,0.111,0,17065.0,0,9.74484345909653,0,Unknow,0,0,0,1,0,0
SOAD02445,Flumevale,Yes,Irrigation,Earth,9.043,0.243,8100.0,2006,,0.02364,34.11013338228045,Uncontrolled,01/10/2018,6,61.525744520664546,Low,Satisfactory,2015-10-23,0.0523,38.9,14.7,36.4,9.043,0.243,0,8100.0,0,8.99974278983049,0,Unknow,0,0,0,1,0,1
SOAD02894,Flumevale,Yes,Debris Control,Earth,13.579,0.088,28000.0,1962,,0.00788,2.66329,,20/10/2021,1,0.0,High,Satisfactory,2017-09-01,0.0753,16.4,234.3,17.359418911568365,13.579,0.088,0,28000.0,0,10.2399955028053,0,Unknow,0,0,0,0,0,0
SOAD19913,Flumevale,No,Other,Earth,5.106,0.033,77321.35685182389,Unknow,,24.62018508538577,1050.9269737271832,,,Unknow,1.01,High,Not Available,,0.1051,885.0,246.6,16.619646823399737,5.106,0.033,0,,1,,0,Unknow,0,0,1,1,1,0
SOAD00632,Flumevale,Yes,Irrigation,Earth,8.833,0.067,12029.987049543752,1946,,0.01576,34.160615375421756,Uncontrolled,06/06/2014,6,6.58,Low,Not Rated,,0.0804,25.1,330.2,20.9,8.833,0.067,0,,1,,0,Unknow,0,0,1,1,0,0
SOAD01721,Flumevale,Yes,Water Supply,Earth,10.502,0.347,11400.0,1954,,0.01576,537.4118773650312,,17/03/2022,1,2.235138958539945,High,Satisfactory,2017-09-01,0.0723,25.1,850.6,13.4,10.502,0.347,0,11400.0,0,9.34145634983372,0,Unknow,0,0,0,1,0,1
SOAD08116,Flumevale,Yes,Hydroelectric,Earth,14.519,0.15,39375.43990526833,1906,,0.02364,32.8200917276607,Uncontrolled,08/09/2022,3,3.27,Low,Fair,2023-09-29,0.081,26.4,328.2,79.0,14.519,0.15,0,,1,,0,Unknow,0,0,1,1,0,0
SOAD08173,Flumevale,Yes,Debris Control,Earth,23.083,0.082,62000.0,1957,,0.01773,31.846454421110643,,17/02/2022,1,0.16,High,Satisfactory,2017-09-01,0.0867,41.5,699.0,20.74867436546289,23.083,0.082,0,62000.0,0,11.0349057929294,0,Unknow,0,0,0,1,0,0
SOAD11011,Flumevale,Yes,Recreation,Earth,7.912,0.07,3641.0,1955,,0.08738945695686545,15.97974,Uncontrolled,14/09/2010,Unknow,0.0,Significant,Not Rated,,0.1786,5.9,554.8,4.3,7.912,0.07,0,3641.0,0,8.20028826028755,0,Unknow,0,0,0,0,1,0
SOAD19635,Flumevale,Yes,Flood Risk Reduction,Earth,13.349,0.07,10875.0,1959,,0.01576,34.2640707753544,Uncontrolled,05/11/2013,3,12.74,Low,Satisfactory,2019-04-15,0.0613,7.7,425.9,22.028644880828445,13.349,0.07,0,10875.0,0,9.29431380575236,0,Unknow,0,0,0,1,0,0
SOAD06018,Flumevale,Yes,Recreation,Earth,6.087,0.083,10078.00176367975,Unknow,2016,0.01773,7.98987,,31/10/2019,2,27.72,Significant,Satisfactory,2019-10-31,0.1228,18.5,472.8,3.1,6.087,0.083,0,,1,,1,2016,0,0,1,0,0,0
SOAD06333,Flumevale,Yes,Irrigation,Earth,14.307,0.07,25838.067797182055,1973,,0.00788,538.7800134605739,Uncontrolled,21/04/2004,0,12.97,Low,Fair,2019-10-08,0.0768,41.0,372.3,42.0,14.307,0.07,0,,1,,0,Unknow,0,0,1,1,0,0
SOAD07705,Flumevale,Yes,Unknow,Earth,11.951,0.077,26238.19275106629,1950,,0.01379,31.922454786482593,,10/08/2022,1,2.3,High,Fair,2017-09-01,0.1022,16.9,449.3,20.928636499924625,11.951,0.077,0,,1,,0,Unknow,0,0,1,1,0,0
SOAD12420,Flumevale,Yes,Water Supply,Earth,14.684,0.097,19400.0,1969,,0.01576,34.50085781815035,,06/04/2022,0.5,60.900292817922804,Low,Satisfactory,2017-09-01,0.0489,47.3,22.6,12.9,14.684,0.097,0,19400.0,0,9.8730798901147,0,Unknow,0,0,0,1,0,1
SOAD02075,Flumevale,No,Other,Earth,26.928,0.133,90920.42962180522,Unknow,,2.671084991919631,247.52323293149195,,,Unknow,6.39,High,Not Available,,0.0841,520.5,161.2,20.241401339192876,26.928,0.133,0,,1,,0,Unknow,0,0,1,1,1,0
SOAD03528,Flumevale,Yes,Water Supply,Earth,14.85,0.117,9600.0,1962,,0.00788,644.0722920205448,,27/05/2022,1,0.0,High,Satisfactory,2017-09-01,0.1102,45.6,595.7,5.3,14.85,0.117,0,9600.0,0,9.16962253869762,0,Unknow,0,0,0,1,0,0
SOAD04421,Flumevale,Yes,Recreation,Earth,8.878,0.043,5108.0,1935,1975S;1984S;1995,0.01576,55.018258210797235,Uncontrolled,14/05/2020,6,8.11,Low,Satisfactory,2009-03-20,0.0345,29.4,364.8,5.4,8.878,0.043,0,5108.0,0,8.5387589693308,3,1995,0,0,0,1,0,0
SOAD09829,Flumevale,No,Recreation,Earth,9.463,0.07,12982.545841752113,1955,,0.0794269444004064,53.9722879498636,Uncontrolled,09/06/2014,10,28.59,Low,Not Rated,,0.057,19.8,210.7,2.9,9.463,0.07,0,,1,,0,Unknow,0,0,1,1,1,0
SOAD14395,Flumevale,Yes,Water Supply,Earth,24.015,0.08,75722.0,1980,,0.00788,42.61264,Uncontrolled,21/10/2003,0,3.2,Low,Not Rated,,0.1188,23.7,914.3,20.7,24.015,0.08,0,75722.0,0,11.2348372241898,0,Unknow,0,0,0,0,0,0
SOAD01676,Flumevale,Yes,Unknow,Earth,9.449,0.08,13021.773621913893,1982,,0.00788,42.54556198806959,Uncontrolled,20/03/2019,6,0.0,Low,Satisfactory,2020-07-28,0.0327,20.7,105.1,18.969080283905466,9.449,0.08,0,,1,,0,Unknow,0,0,1,1,0,0
SOAD03436,Flumevale,Yes,Other,Earth,10.554,0.063,20244.571621461644,1974,,0.01576,28.022874695523903,Uncontrolled,30/04/1992,0,0.0,Low,Not Rated,,0.0814,47.1,910.2,19.964424893392817,10.554,0.063,0,,1,,0,Unknow,0,0,1,1,0,0
SOAD05014,Flumevale,Yes,Debris Control,Earth,13.242,0.127,31365.339716256498,1962,,0.01773,5.32658,,04/11/2021,1,0.0,High,Satisfactory,2017-09-01,0.0812,28.7,772.7,17.159521341099982,13.242,0.127,0,,1,,0,Unknow,0,0,1,0,0,0
SOAD11258,Flumevale,Yes,Other,Earth,13.153,0.117,22260.0,1950,,0.0197,4446.960020504053,,10/08/2022,1,2.35,High,Fair,2017-09-01,0.1139,46.1,848.3,18.102923953705474,13.153,0.117,0,22260.0,0,10.0105915474503,0,Unknow,0,0,0,1,0,0
SOAD14220,Flumevale,Yes,Water Supply,Earth,10.841,0.094,26000.0,2006,,0.01576,29.748662897398543,Uncontrolled,15/02/2019,6,1.63,Low,Not Rated,,0.0568,46.1,930.7,15.7,10.841,0.094,0,26000.0,0,10.1658902778025,0,Unknow,0,0,0,1,0,0
SOAD18608,Flumevale,Yes,Water Supply,Earth,52.641,0.339,1025494.7944171375,1958,,0.01773,403.0330716302249,,26/10/2021,1,0.14,High,Satisfactory,2017-09-01,0.0899,27.4,602.3,12.9,52.641,0.339,0,,1,,0,Unknow,0,0,1,1,0,0
SOAD06890,Flumevale,Yes,Irrigation,Earth,10.521,0.108,25666.974679479088,1960,,0.01773,32.2632865200167,Uncontrolled,24/09/2009,6,31.99,Low,Not Rated,,0.0862,31.4,230.2,16.8,10.521,0.108,0,,1,,0,Unknow,0,0,1,1,0,0
SOAD07167,Flumevale,Yes,"Fire Protection, Stock, Or Small Fish Pond",Earth,10.485,0.073,6700.0,1992,,0.00788,35.98627424085332,Uncontrolled,09/08/2017,6,17.91,Low,Not Rated,,0.0478,16.7,213.8,18.926443512931325,10.485,0.073,0,6700.0,0,8.81001204797317,0,Unknow,0,0,0,1,0,0
SOAD11290,Flumevale,Yes,Irrigation,Earth,10.449,0.055,13605.0,1953,,0.00788,7.98987,,19/07/2007,6,9.78,Low,Not Rated,,0.0363,46.6,253.5,21.2,10.449,0.055,0,13605.0,0,9.51826615090501,0,Unknow,0,0,0,0,0,0
SOAD12393,Flumevale,Yes,Irrigation,Earth,11.377,0.091,24415.852065295254,1965,1973;1993,0.01773,47.01754005996567,Uncontrolled,14/05/2019,6,3.22,Low,Satisfactory,2020-05-20,0.0319,34.2,780.8,44.8,11.377,0.091,0,,1,,2,1993,0,0,1,1,0,0
SOAD20735,Flumevale,Yes,Recreation,Earth,4.735,0.073,9866.383343046831,1967,2016,0.01773,13.31645,Uncontrolled,12/08/2022,2,1.54,Significant,Satisfactory,2022-08-12,0.1176,22.7,569.7,6.0,4.735,0.073,0,,1,,1,2016,0,0,1,0,0,0
SOAD01605,Flumevale,Yes,Water Supply,Earth,15.335,0.147,27333.0,1948,,0.01576,31.98518008530342,,11/07/2023,0.5,68.45262329700516,Low,Poor,2018-07-20,0.1049,6.7,16.4,41.3,15.335,0.147,0,27333.0,0,10.2158866275247,0,Unknow,0,0,0,1,0,1
SOAD01826,Flumevale,Yes,Water Supply,Earth,11.195,0.072,22022.373100041255,1969,,0.00788,7.98987,Uncontrolled,27/09/2013,6,3.07,Low,Fair,2019-08-22,0.0568,5.9,621.6,32.0,11.195,0.072,0,,1,,0,Unknow,0,0,1,0,0,0
SOAD02825,Flumevale,Yes,Flood Risk Reduction,Earth,9.257,0.149,14850.00531322447,1957,,0.01576,32.37713717301741,Uncontrolled,05/10/2020,6,13.92,Low,Satisfactory,2013-11-05,0.0506,20.9,383.3,20.61007365545892,9.257,0.149,0,,1,,0,Unknow,0,0,1,1,0,0
SOAD03914,Flumevale,Yes,Recreation,Earth,8.851,0.134,8000.0,1984,,0.00788,7.98987,Uncontrolled,11/12/2018,6,3.3,Low,Not Rated,,0.058,30.3,391.5,9.1,8.851,0.134,0,8000.0,0,8.98732181285012,0,Unknow,0,0,0,0,0,0
SOAD18320,Flumevale,Yes,Water Supply,Earth,15.01,0.067,11000.0,1890,,0.01576,2.66329,,23/06/2022,1,0.79,High,Satisfactory,2017-09-01,0.0941,33.6,569.5,15.0,15.01,0.067,0,11000.0,0,9.30574145673943,0,Unknow,0,0,0,0,0,0
SOAD02366,Flumevale,Yes,Debris Control,Earth,26.889,0.619,379000.0,1980,,0.02364,26.6329,,27/01/2022,1,0.0,High,Satisfactory,2017-09-01,0.1031,27.1,952.3,19.345173396929304,26.889,0.619,0,379000.0,0,12.8452941225835,0,Unknow,0,0,0,0,0,0
SOAD04740,Flumevale,No,"Fire Protection, Stock, Or Small Fish Pond",Earth,8.287,0.8407693251996705,812520.1376102435,1954,,10.508920329503548,4337.141624939079,,06/12/2022,Unknow,12.659356440027016,Significant,Not Available,,0.1843,28.9,448.7,19.085950244712564,8.287,,1,,1,,0,Unknow,0,1,1,1,1,1
SOAD05331,Flumevale,Yes,Water Supply,Earth,7.127,0.56,11822.0,1996,,0.01576,35.61872720161235,,18/06/2020,2,11.47,Significant,Fair,2020-06-18,0.142,42.4,176.2,22.3,7.127,0.56,0,11822.0,0,9.37780206586311,0,Unknow,0,0,0,1,0,0
SOAD08968,Flumevale,Yes,Irrigation,Earth,18.088,0.117,32000.0,Unknow,,0.01576,32.083711514895896,,09/03/2023,1,11.309804312564166,Significant,Fair,2017-09-01,0.1225,5.4,179.7,30.2,18.088,0.117,0,32000.0,0,10.3735224312936,0,Unknow,0,0,0,1,0,1
SOAD09486,Flumevale,Yes,Water Supply,Earth,12.535,0.067,23542.70184717317,Unknow,,0.01576,32.8094462170383,,14/03/2018,1,28.866609857088672,Significant,Not Rated,2022-02-15,0.1499,19.8,155.4,62.8,12.535,0.067,0,,1,,0,Unknow,0,0,1,1,0,1
SOAD10560,Flumevale,Yes,Other,Earth,17.26,0.09,18300.0,1962,,0.01773,32.069546638228786,,03/05/2022,0.5,69.42146201513889,Low,Satisfactory,2017-09-01,0.0746,43.6,19.5,22.4378960552829,17.26,0.09,0,18300.0,0,9.81471098214528,0,Unknow,0,0,0,1,0,1
SOAD10701,Flumevale,Yes,Recreation,Earth,9.345,0.09,13408.890404651413,1955,,0.01773,47.93922,,18/11/1992,0,144.73,Low,Fair,2014-09-25,0.0886,19.7,176.4,2.9,9.345,0.09,0,,1,,0,Unknow,0,0,1,0,0,0
SOAD14640,Flumevale,Yes,Irrigation,Earth,12.453,0.077,23899.77538921218,1958,,0.01576,13.31645,,02/11/1988,0,22.22,Low,Satisfactory,2016-09-19,0.0694,45.5,307.6,5.5,12.453,0.077,0,,1,,0,Unknow,0,0,1,0,0,0
SOAD00298,Flumevale,Yes,Hydroelectric,Earth,11.238,0.073,22214.0090627387,1904,,0.01576,74.57212,,13/09/2012,6,23.39,Low,Satisfactory,2015-10-05,0.0429,18.9,127.3,74.5,11.238,0.073,0,,1,,0,Unknow,0,0,1,0,0,0
SOAD04543,Flumevale,Yes,Flood Risk Reduction,Earth,7.983,0.082,11167.481044899185,1958,,0.01773,33.66378605052852,Uncontrolled,01/11/2021,3,0.0,Significant,Satisfactory,2021-11-01,0.1271,19.6,809.3,19.89786937150751,7.983,0.082,0,,1,,0,Unknow,0,0,1,1,0,0
SOAD11269,Flumevale,Yes,Debris Control,Earth,15.13,0.088,33000.0,1986,,0.01773,5.32658,,09/08/2022,1,4.99,Significant,Satisfactory,2017-09-01,0.0987,12.4,722.7,17.950867175970984,15.13,0.088,0,33000.0,0,10.4042931430198,0,Unknow,0,0,0,0,0,0
SOAD20505,Flumevale,Yes,Recreation,Earth,9.89,0.071,15448.062970445953,1954,,0.01576,13.31645,Uncontrolled,06/10/2022,6,8.37,Low,Fair,2022-09-27,0.0356,7.4,233.2,8.4,9.89,0.071,0,,1,,0,Unknow,0,0,1,0,0,0
SOAD03390,Flumevale,No,Recreation,Earth,8.866,0.072,2891.0,1938,,0.08721397644951279,26.6329,Controlled,07/08/2013,10,19.44,Low,Not Rated,,0.0195,8.3,302.5,6.2,8.866,0.072,0,2891.0,0,7.96970358327866,0,Unknow,0,0,0,0,1,0
SOAD04757,Flumevale,Yes,Irrigation,Earth,9.706,0.07,13582.938423781126,1953,,0.01773,33.04784560431454,Uncontrolled,29/09/2022,6,23.17,Low,Not Rated,,0.0821,25.6,280.5,11.7,9.706,0.07,0,,1,,0,Unknow,0,0,1,1,0,0
SOAD01286,Flumevale,Yes,Water Supply,Earth,10.164,0.344,2500.0,1964,,0.01773,35.28991470819233,,16/03/2022,1,1.1746307411544732,High,Satisfactory,2017-09-01,0.0855,11.3,601.4,68.7,10.164,0.344,0,2500.0,0,7.82444593087762,0,Unknow,0,0,0,1,0,1
SOAD06818,Flumevale,Yes,Irrigation,Earth,12.671,0.133,2015.0,1936,2004H;2004S,0.01773,21.30632,Uncontrolled,23/06/2022,2,3.31,Significant,Fair,2022-06-23,0.1386,41.9,113.4,12.7,12.671,0.133,0,2015.0,0,7.60887062919126,2,2004,0,0,0,0,0,0
SOAD09813,Flumevale,Yes,Flood Risk Reduction,Earth,12.88,0.179,17400.0,1959,,0.02561,31.7947833137811,Uncontrolled,15/04/2014,3,8.19,Low,Satisfactory,2020-06-05,0.0821,28.7,436.8,22.106412118321227,12.88,0.179,0,17400.0,0,9.76428295481558,0,Unknow,0,0,0,1,0,0
SOAD12655,Flumevale,Yes,Debris Control,Earth,18.056,0.308,83000.0,1966,,0.00788,2.66329,,01/12/2021,1,0.16,High,Satisfactory,2017-09-01,0.0912,26.6,764.5,17.226356852281675,18.056,0.308,0,83000.0,0,11.3266079348989,0,Unknow,0,0,0,0,0,0
SOAD16968,Flumevale,Yes,Irrigation,Earth,12.899,0.088,12587.0,1955,,0.01576,33.24793834765479,,30/08/2017,6,10.88,Low,Not Rated,,0.0835,39.5,433.0,40.3,12.899,0.088,0,12587.0,0,9.4404992581843,0,Unknow,0,0,0,1,0,0
SOAD05259,Flumevale,Yes,Fish and Wildlife Pond,Earth,9.762,0.227,26960.86893409427,1970,,0.03349,31.81064829033899,,20/09/2001,0,16.59,Low,Fair,2018-12-11,0.097,39.7,245.9,21.424691044497475,9.762,0.227,0,,1,,0,Unknow,0,0,1,1,0,0
SOAD10322,Flumevale,Yes,Water Supply,Earth,13.184,0.367,38500.0,1965,,0.01576,32.38441401715349,,25/05/2022,1,0.0,High,Satisfactory,2017-09-01,0.0951,39.8,562.7,48.2,13.184,0.367,0,38500.0,0,10.5584394939645,0,Unknow,0,0,0,1,0,0
SOAD15752,Flumevale,Yes,Irrigation,Earth,9.213,0.267,32706.34305915175,1979,,0.01576,32.57275067257896,Uncontrolled,23/05/2022,2,0.0,Significant,Satisfactory,2022-05-23,0.1212,26.4,833.8,24.0,9.213,0.267,0,,1,,0,Unknow,0,0,1,1,0,0
SOAD19994,Flumevale,Yes,Irrigation,Earth,10.12,0.092,22870.33036878564,1990,,0.01576,41.23665343275122,Uncontrolled,06/10/2020,6,1.58,Low,Satisfactory,2019-07-19,0.0406,45.1,576.7,16.9,10.12,0.092,0,,1,,0,Unknow,0,0,1,1,0,0
SOAD04121,Flumevale,Yes,Irrigation,Earth,11.601,0.062,6800.0,2015,,0.01773,37.28606,Uncontrolled,31/12/2015,0,14.46,Low,Not Rated,,0.0808,36.7,257.4,37.4,11.601,0.062,0,6800.0,0,8.82482493917564,0,Unknow,0,0,0,0,0,0
SOAD16350,Flumevale,Yes,Flood Risk Reduction,Earth,22.189,0.11,63000.0,1964,,0.02561,2.66329,,24/02/2022,1,0.4,High,Satisfactory,2017-09-01,0.0932,44.4,933.6,17.970049585677078,22.189,0.11,0,63000.0,0,11.0509058782636,0,Unknow,0,0,0,0,0,0
SOAD02195,Flumevale,Yes,Other,Earth,12.833,0.06,6726.0,1909,,0.03349,7.98987,,10/02/2022,0.5,68.66564851345537,Low,Satisfactory,2017-09-01,0.0764,10.1,22.2,19.29838968934367,12.833,0.06,0,6726.0,0,8.81388455802561,0,Unknow,0,0,0,0,0,1
SOAD10076,Flumevale,Yes,Other,Earth,12.06,0.223,29900.0,1938,,0.04334,32.23805335937106,,21/10/1992,6,0.0,Low,Not Rated,,0.0668,24.2,544.7,20.97916781429263,12.06,0.223,0,29900.0,0,10.3056472036356,0,Unknow,0,0,0,1,0,0
SOAD10957,Flumevale,Yes,Other,Earth,14.258,0.059,22400.0,1892,,0.01576,32.204189949753975,,14/09/2021,0.5,65.90354308656744,Low,Satisfactory,2017-09-01,0.071,24.2,20.9,23.009370578760787,14.258,0.059,0,22400.0,0,10.0168608797038,0,Unknow,0,0,0,1,0,1
SOAD01737,Flumevale,Yes,"Fire Protection, Stock, Or Small Fish Pond",Earth,11.262,0.3,32482.0,1963,,0.01576,32.70186588357671,Uncontrolled,23/09/2013,6,0.0,Low,Fair,2016-05-24,0.0666,22.6,283.5,20.483982501356802,11.262,0.3,0,32482.0,0,10.3884721545423,0,Unknow,0,0,0,1,0,0
SOAD05134,Flumevale,Yes,Water Supply,Earth,21.131,0.073,70870.0,1949,,0.00788,1860.4887385343236,,24/08/2022,1,0.0,High,Satisfactory,2017-09-01,0.0912,37.0,166.1,49.0,21.131,0.073,0,70870.0,0,11.1686166020476,0,Unknow,0,0,0,1,0,0
SOAD10224,Flumevale,Yes,Water Supply,Earth,6.177,0.32,31752.26663297065,Unknow,,0.01576,32.4775745530314,Uncontrolled,14/04/2022,2,0.0,Significant,Satisfactory,2022-04-14,0.1062,24.2,231.8,33.1,6.177,0.32,0,,1,,0,Unknow,0,0,1,1,0,0
SOAD18724,Flumevale,Yes,Water Supply,Earth,11.673,0.079,9500.0,1974,,0.01773,47.35184647888097,,21/04/2022,0.5,65.4172885220798,Low,Satisfactory,2017-09-01,0.0751,35.5,21.8,7.8,11.673,0.079,0,9500.0,0,9.15915233520675,0,Unknow,0,0,0,1,0,1
SOAD01677,Flumevale,Yes,Water Supply,Earth,13.931,0.377,60381.88284557979,1958,,0.01773,42.447668053820344,,24/04/2023,1,0.48,High,Fair,2017-09-01,0.1039,39.1,106.5,8.4,13.931,0.377,0,,1,,0,Unknow,0,0,1,1,0,0
SOAD04534,Flumevale,Yes,Water Supply,Earth,10.394,0.07,210.0,1982,,0.01773,7.98987,,29/08/2016,6,6.65,Low,Fair,2017-03-22,0.0387,32.8,225.9,67.2,10.394,0.07,0,210.0,0,5.35185813347607,0,Unknow,0,0,0,0,0,0
SOAD06267,Flumevale,Yes,Water Supply,Earth,15.703,0.076,13900.0,1989,,0.01576,2.66329,,08/06/2022,0.5,69.6144255661249,Low,Satisfactory,2017-09-01,0.0774,35.8,10.4,18.9,15.703,0.076,0,13900.0,0,9.53971605897709,0,Unknow,0,0,0,0,0,1
SOAD06282,Flumevale,Yes,Water Supply,Earth,18.628,0.277,81500.0,1964,,0.01773,27.628850753093637,,17/11/2021,1,0.0,High,Satisfactory,2017-09-01,0.0961,41.5,893.6,37.4,18.628,0.277,0,81500.0,0,11.3083705690923,0,Unknow,0,0,0,1,0,0
SOAD11458,Flumevale,Yes,Water Supply,Earth,19.035,0.067,29000.0,1967,,0.01576,32.092885401717034,,12/05/2022,1,0.84,High,Satisfactory,2017-09-01,0.076,13.7,834.5,38.0,19.035,0.067,0,29000.0,0,10.2750855911327,0,Unknow,0,0,0,1,0,0
SOAD04159,Flumevale,Yes,Recreation,Earth,19.17,0.135,36606.0,Unknow,,0.00788,40.925308366853365,,25/04/1988,6,4.78,Low,Fair,2015-07-14,0.0423,16.3,529.7,6.7,19.17,0.135,0,36606.0,0,10.5079947579328,0,Unknow,0,0,0,1,0,0
SOAD04617,Flumevale,No,Hydroelectric,Earth,6.838,0.58,37000.0,1913,,0.03546,41.68910542545172,Uncontrolled,08/08/2023,1,5.07,High,Satisfactory,2023-09-29,0.0943,28.0,341.4,88.1,6.838,0.58,0,37000.0,0,10.5187002182882,0,Unknow,0,0,0,1,0,0
SOAD05907,Flumevale,Yes,Water Supply,Earth,19.254,0.05,10000.0,1925,,0.03349,23.96961,,13/09/2023,0.5,65.64553870465306,Low,Fair,2023-06-12,0.0864,40.6,20.8,67.0,19.254,0.05,0,10000.0,0,9.21044036697652,0,Unknow,0,0,0,0,0,1
SOAD19896,Flumevale,Yes,Recreation,Earth,11.004,0.083,22165.645614859935,1965,,0.01773,29.29619,Uncontrolled,29/07/2011,6,65.73,Low,Not Rated,,0.0612,30.5,97.4,6.9,11.004,0.083,0,,1,,0,Unknow,0,0,1,0,0,0
SOAD00053,Flumevale,Yes,Water Supply,Earth,11.742,0.113,60000.0,1978,,0.03546,31.747922991518166,,11/05/2022,0.5,1.26,Low,Satisfactory,2017-09-01,0.0719,22.7,263.4,32.4,11.742,0.113,0,60000.0,0,11.002116507732,0,Unknow,0,0,0,1,0,0
SOAD03085,Flumevale,Yes,Irrigation,Earth,9.576,0.308,23483.0,1911,,0.03349,42.61264,Uncontrolled,04/10/2017,6,16.2,Low,Fair,2014-02-12,0.06,30.7,459.9,23.8,9.576,0.308,0,23483.0,0,10.0640746171841,0,Unknow,0,0,0,0,0,0
SOAD12442,Flumevale,Yes,Water Supply,Earth,18.78,0.101,48390.0,1950,,0.01773,2.66329,,25/05/2023,1,1.0806676408649267,High,Fair,2017-09-01,0.1025,30.3,725.2,33.1,18.78,0.101,0,48390.0,0,10.7870691250006,0,Unknow,0,0,0,0,0,1
SOAD17712,Flumevale,Yes,Flood Risk Reduction,Earth,14.355,0.184,37900.0,2011,,0.02364,2.66329,,08/02/2022,1,0.16,High,Satisfactory,2017-09-01,0.0798,15.3,558.2,18.091368089150773,14.355,0.184,0,37900.0,0,10.5427327759467,0,Unknow,0,0,0,0,0,0
SOAD19568,Flumevale,Yes,Hydroelectric,Earth,15.643,0.113,40911.93861925766,1953,,0.02561,18.64303,Controlled,31/05/2023,1,1.54,High,Satisfactory,2023-09-29,0.115,39.1,455.0,77.8,15.643,0.113,0,,1,,0,Unknow,0,0,1,0,0,0
SOAD00262,Flumevale,Yes,Water Supply,Earth,18.45,0.063,34500.0,1931,,0.00788,5519.292073992835,,16/02/2022,0.5,59.747386287625645,Low,Satisfactory,2017-09-01,0.0656,30.1,9.8,60.3,18.45,0.063,0,34500.0,0,10.4487435881066,0,Unknow,0,0,0,1,0,1
SOAD07256,Flumevale,Yes,Water Supply,Earth,34.514,0.077,50000.0,1930,,0.00788,118.8667692629195,,24/08/2022,1,0.0,High,Satisfactory,2017-09-01,0.084,28.0,609.1,22.6,34.514,0.077,0,50000.0,0,10.8197982842103,0,Unknow,0,0,0,1,0,0
SOAD07664,Flumevale,Yes,Fish and Wildlife Pond,Earth,6.366,0.193,6549.0,1990,2001H;2009H,0.02561,33.97529813298264,Uncontrolled,28/09/2021,2,4.6,Significant,Fair,2021-09-28,0.1182,42.2,464.4,21.077141321481196,6.366,0.193,0,6549.0,0,8.7872203286293,2,2009,0,0,0,1,0,0
SOAD13849,Flumevale,Yes,Other,Earth,5.778,0.033,1680.0,1907,,0.03152,332.9699224827386,Uncontrolled,02/09/2020,2,8.22,Significant,Unsatisfactory,2020-09-02,0.1715,44.5,327.4,19.66519781478545,5.778,0.033,0,1680.0,0,7.42714413340862,0,Unknow,0,0,0,1,0,0
SOAD15126,Flumevale,Yes,Irrigation,Earth,8.951,0.095,9606.0,1952,,0.01773,7.98987,Uncontrolled,02/10/2003,6,9.54,Low,Not Rated,,0.0509,34.7,455.8,1.0,8.951,0.095,0,9606.0,0,9.17024727840974,0,Unknow,0,0,0,0,0,0
SOAD02369,Flumevale,Yes,Water Supply,Earth,10.67,0.175,525.0,1982,,0.01773,34.61120658751537,,08/09/2015,6,10.1,Low,Fair,2012-07-19,0.0634,35.9,359.9,44.8,10.67,0.175,0,525.0,0,6.26530121273771,0,Unknow,0,0,0,1,0,0
SOAD03084,Flumevale,Yes,Fish and Wildlife Pond,Earth,10.235,0.087,21766.49292006438,1959,,0.02561,42.61264,Uncontrolled,28/09/2005,6,44.86,Low,Not Rated,,0.049,18.3,122.1,19.83113882021742,10.235,0.087,0,,1,,0,Unknow,0,0,1,0,0,0
SOAD03938,Flumevale,Yes,Water Supply,Earth,12.983,0.11,18672.0,1980,,0.01773,38.71313065280836,,22/06/2022,0.5,61.43512587353924,Low,Satisfactory,2017-09-01,0.0796,27.9,14.1,9.3,12.983,0.11,0,18672.0,0,9.83483390921908,0,Unknow,0,0,0,1,0,1
SOAD08269,Flumevale,Yes,Other,Earth,12.457,0.09,11674.0,1932,,0.02561,2.66329,,06/04/2022,0.5,69.72484978329663,Low,Satisfactory,2017-09-01,0.0702,5.8,12.8,20.033573551484736,12.457,0.09,0,11674.0,0,9.3652050825371,0,Unknow,0,0,0,0,0,1
SOAD17154,Flumevale,Yes,Water Supply,Earth,13.3,0.19,37000.0,1912,,0.01576,31.922454786482593,,01/09/2022,1,0.0,High,Satisfactory,2017-09-01,0.1,14.8,608.1,30.9,13.3,0.19,0,37000.0,0,10.5187002182882,0,Unknow,0,0,0,1,0,0
SOAD00750,Flumevale,Yes,Recreation,Earth,8.045,0.26,17967.0,2005,,0.02561,64.95206875855138,Uncontrolled,30/06/2021,2,13.0,Significant,Satisfactory,2021-06-30,0.1037,14.1,397.0,5.4,8.045,0.26,0,17967.0,0,9.79634767697822,0,Unknow,0,0,0,1,0,0
SOAD01479,Flumevale,Yes,Debris Control,Earth,11.962,1.412,277000.0,1980,,0.03546,18.64303,,27/01/2022,1,0.16,High,Satisfactory,2017-09-01,0.0935,45.6,921.7,19.033259748911007,11.962,1.412,0,277000.0,0,12.5317763952713,0,Unknow,0,0,0,0,0,0
SOAD06428,Flumevale,Yes,Recreation,Earth,6.408,0.063,3384.0,1972,2005H;2005S,0.01773,138.49108,Uncontrolled,15/05/2017,2,4.68,Significant,Unsatisfactory,2017-05-15,0.1786,31.1,470.0,7.2,6.408,0.063,0,3384.0,0,8.12710918534638,2,2005,0,0,0,0,0,0
SOAD06719,Flumevale,Yes,Recreation,Earth,15.431,0.074,13620.0,1964,,0.02561,13.31645,Uncontrolled,20/06/2018,6,4.78,Low,Fair,2017-05-17,0.0676,11.9,657.6,6.8,15.431,0.074,0,13620.0,0,9.51936799844734,0,Unknow,0,0,0,0,0,0
SOAD06781,Flumevale,No,Water Supply,Earth,8.992,0.099,13024.404943908725,1961,,0.02167,33.72451774756387,Uncontrolled,09/05/2023,4,41.98,Low,Poor,2023-05-09,0.0546,47.3,181.3,18.5,8.992,0.099,0,,1,,0,Unknow,0,0,1,1,0,0
SOAD10792,Flumevale,Yes,Water Supply,Earth,8.369,0.376,38420.0103380128,1992,2013,0.02561,32.76703681015372,Uncontrolled,14/04/2022,2,0.0,Significant,Satisfactory,2022-04-14,0.1324,7.3,170.4,15.0,8.369,0.376,0,,1,,1,2013,0,0,1,1,0,0
SOAD15281,Flumevale,No,Irrigation,Earth,4.363,0.17,15050.029670656922,Unknow,,0.06895,32.9974217210193,,20/04/2022,1,20.57153130731601,Significant,Fair,2017-09-01,0.1311,34.6,134.0,14.6,4.363,0.17,0,,1,,0,Unknow,0,0,1,1,0,1
SOAD08445,Flumevale,No,Recreation,Earth,3.717,0.073,1591.0,1939,,0.09188994465451704,7.98987,Controlled,06/09/1964,Unknow,1.13,Significant,Not Rated,,0.1283,32.9,160.1,5.0,3.717,0.073,0,1591.0,0,7.37274636640433,0,Unknow,0,0,0,0,1,0
SOAD09286,Flumevale,Yes,Water Supply,Earth,12.729,0.467,184800.0,1983,,0.0197,41.63392404061028,,10/02/2022,0.5,67.62965613141489,Low,Satisfactory,2017-09-01,0.0618,20.8,22.0,16.9,12.729,0.467,0,184800.0,0,12.1270348494305,0,Unknow,0,0,0,1,0,1
SOAD12831,Flumevale,Yes,Irrigation,Earth,12.085,0.273,43725.77324647747,1895,,0.01576,32.76459118239753,Uncontrolled,08/08/2019,6,10.93,Low,Not Rated,,0.0515,14.2,95.5,34.8,12.085,0.273,0,,1,,0,Unknow,0,0,1,1,0,0
SOAD17692,Flumevale,Yes,Flood Risk Reduction,Earth,9.012,0.12,7252.0,1955,,0.02561,33.86025693574633,Uncontrolled,06/10/2020,3,18.44,Low,Fair,2020-05-14,0.0763,29.1,389.8,20.746285168173504,9.012,0.12,0,7252.0,0,8.88917045536341,0,Unknow,0,0,0,1,0,0
SOAD17849,Flumevale,Yes,Water Supply,Earth,14.9,0.14,24000.0,1937,,0.01576,32.0498901150358,,01/06/2022,0.5,66.4881115690109,Low,Satisfactory,2017-09-01,0.0686,16.2,11.4,31.8,14.9,0.14,0,24000.0,0,10.0858507751287,0,Unknow,0,0,0,1,0,1
SOAD10163,Flumevale,Yes,Water Supply,Earth,19.695,0.077,22000.0,1962,,0.01773,32.276956651098054,,01/06/2022,1,4.05,Significant,Satisfactory,2017-09-01,0.1294,39.9,788.1,13.4,19.695,0.077,0,22000.0,0,9.99884318585288,0,Unknow,0,0,0,1,0,0
SOAD17871,Flumevale,Yes,Irrigation,Earth,13.436,0.25,69140.0,1966,,0.01773,29.311254045080744,Uncontrolled,30/09/2016,6,3.25,Low,Fair,2020-05-13,0.0639,38.2,856.9,31.7,13.436,0.25,0,69140.0,0,11.1439031767786,0,Unknow,0,0,0,1,0,0
SOAD19875,Flumevale,No,Fish and Wildlife Pond,Earth,8.062,0.09,11626.647353813332,Unknow,1997,0.03349,29.96202711636378,,09/05/2022,Unknow,0.9688502924191855,High,Not Available,,0.1234,28.0,931.5,20.586333196488365,8.062,0.09,0,,1,,1,1997,0,0,1,1,0,1
SOAD20096,Flumevale,Yes,Water Supply,Earth,10.56,0.167,32629.673948303665,1928,,0.02561,32.011752490878955,Uncontrolled,06/08/2001,6,16.72,Low,Not Rated,,0.0996,46.1,147.0,25.9,10.56,0.167,0,,1,,0,Unknow,0,0,1,1,0,0
SOAD02051,Flumevale,Yes,Irrigation,Earth,10.661,0.094,23191.969925435227,1903,2007,0.02561,21.30632,Uncontrolled,30/06/2021,6,31.87,Low,Not Rated,,0.0657,9.2,162.9,41.9,10.661,0.094,0,,1,,1,2007,0,0,1,0,0,0
SOAD04526,Flumevale,Yes,Flood Risk Reduction,Earth,19.351,0.075,51794.9256029634,1982,,0.00788,45.27593,Uncontrolled,04/10/1995,3,23.35,Low,Not Rated,,0.0566,35.2,261.1,19.462634280527695,19.351,0.075,0,,1,,0,Unknow,0,0,1,0,0,0
SOAD16367,Flumevale,Yes,Flood Risk Reduction,Earth,8.804,0.14,8146.0,1955,,0.02561,38.3808436352061,Uncontrolled,05/10/2020,6,12.57,Low,Not Rated,,0.0466,34.1,276.3,18.976971401119354,8.804,0.14,0,8146.0,0,9.00540504031064,0,Unknow,0,0,0,1,0,0
SOAD08774,Flumevale,Yes,Irrigation,Earth,11.547,0.11,27226.0,1968,,0.02561,32.15574505579004,,19/04/2017,6,18.57,Low,Not Rated,,0.0567,32.2,208.4,45.5,11.547,0.11,0,27226.0,0,10.2119644069946,0,Unknow,0,0,0,1,0,0
SOAD11724,Flumevale,Yes,Water Supply,Earth,12.88,0.07,1240.0,1965,,0.01576,30.415794854947684,,08/09/2022,1,1.0389043393970434,High,Satisfactory,2017-09-01,0.1121,43.2,938.9,48.2,12.88,0.07,0,1240.0,0,7.12367278520461,0,Unknow,0,0,0,1,0,1
SOAD16333,Flumevale,Yes,Flood Risk Reduction,Earth,9.163,0.112,8266.0,1956,,0.02561,34.49871786252206,Uncontrolled,05/10/2020,3,16.4,Low,Satisfactory,2015-04-13,0.0672,46.3,157.0,21.16564458491904,9.163,0.112,0,8266.0,0,9.02002696525268,0,Unknow,0,0,0,1,0,0
SOAD06223,Flumevale,Yes,Water Supply,Earth,10.68,0.493,66233.46957801642,1928,,0.01773,33.81757266789766,,24/02/2022,1,0.0,High,Satisfactory,2017-09-01,0.1004,25.4,783.6,26.7,10.68,0.493,0,,1,,0,Unknow,0,0,1,1,0,0
SOAD09159,Flumevale,Yes,Flood Risk Reduction,Earth,8.692,0.16,15686.52201995656,1972,,0.03349,31.89608306117271,Uncontrolled,21/02/2017,3,51.46,Low,Satisfactory,2022-12-01,0.0708,23.2,159.5,22.646871146568078,8.692,0.16,0,,1,,0,Unknow,0,0,1,1,0,0
SOAD14757,Flumevale,Yes,Other,Earth,11.72,0.192,41273.55505578808,1975,,0.02364,43.93664062047755,,24/08/2017,6,0.0,Low,Satisfactory,2021-06-09,0.0292,16.3,599.4,17.91686725117546,11.72,0.192,0,,1,,0,Unknow,0,0,1,1,0,0
SOAD15025,Flumevale,Yes,Fish and Wildlife Pond,Earth,9.477,0.048,13200.861292620253,1970,,0.02561,42.61264,Uncontrolled,11/10/2017,6,26.13,Low,Satisfactory,2020-10-05,0.043,18.1,239.8,18.60918445535937,9.477,0.048,0,,1,,0,Unknow,0,0,1,0,0,0
SOAD19322,Flumevale,Yes,Flood Risk Reduction,Earth,10.397,0.123,25597.247640592424,1957,,0.02561,31.747922991518166,Uncontrolled,05/11/2013,3,1.56,Low,Fair,2005-08-30,0.0811,34.6,233.8,20.52603233904532,10.397,0.123,0,,1,,0,Unknow,0,0,1,1,0,0
SOAD03031,Flumevale,Yes,Water Supply,Earth,15.857,0.107,47194.75579694471,1908,,0.01773,2.66329,,08/03/2023,1,0.48,High,Fair,2017-09-01,0.1328,18.8,375.0,45.4,15.857,0.107,0,,1,,0,Unknow,0,0,1,0,0,0
SOAD08339,Flumevale,Yes,Fish and Wildlife Pond,Earth,10.519,0.083,21043.888871705625,1958,,0.02561,33.16186135118863,Uncontrolled,10/11/2022,2,1.59,Significant,Not Rated,,0.1535,12.0,607.8,20.340047564549717,10.519,0.083,0,,1,,0,Unknow,0,0,1,1,0,0
SOAD08628,Flumevale,Yes,Hydroelectric,Earth,16.272,0.091,35780.095599874454,1980,,0.03546,181.10372,,15/09/2022,1,21.83,Low,Satisfactory,2023-04-11,0.0674,35.1,369.7,56.6,16.272,0.091,0,,1,,0,Unknow,0,0,1,0,0,0
SOAD09233,Flumevale,Yes,Water Supply,Earth,8.958,0.817,56177.04589056154,1980,,0.03349,78.59708005667038,Uncontrolled,23/10/2015,6,5.04,Low,Satisfactory,2018-09-14,0.0414,45.0,108.3,32.8,8.958,0.817,0,,1,,0,Unknow,0,0,1,1,0,0
SOAD09849,Flumevale,Yes,Irrigation,Earth,8.817,0.111,5610.0,1948,2009,0.04137,35.51505780765921,Uncontrolled,17/09/2009,6,13.48,Low,Satisfactory,2015-10-23,0.0511,35.2,370.8,10.4,8.817,0.111,0,5610.0,0,8.63248423575097,1,2009,0,0,0,1,0,0
SOAD12193,Flumevale,Yes,Irrigation,Earth,8.867,0.08,12141.367623674802,1930,2008,0.03349,35.08175267486613,Uncontrolled,09/09/2021,6,15.83,Low,Not Rated,,0.0635,39.7,344.6,35.2,8.867,0.08,0,,1,,1,2008,0,0,1,1,0,0
SOAD12677,Flumevale,Yes,Irrigation,Earth,10.352,0.11,20047.0,1988,,0.02561,31.747922991518166,Uncontrolled,23/09/2022,1,4.63,High,Fair,2022-09-23,0.0997,8.2,242.6,33.9,10.352,0.11,0,20047.0,0,9.90588467713585,0,Unknow,0,0,0,1,0,0
SOAD14449,Flumevale,Yes,Debris Control,Earth,29.717,0.126,117000.0,1963,,0.01773,7.98987,,01/12/2021,1,0.0,High,Satisfactory,2017-09-01,0.1015,27.4,931.9,16.856900175097994,29.717,0.126,0,117000.0,0,11.6699377607519,0,Unknow,0,0,0,0,0,0
SOAD05026,Flumevale,Yes,Recreation,Earth,6.284,0.146,8461.0,1954,,0.09911369005319655,13.31645,Uncontrolled,14/09/2010,Unknow,0.0,Significant,Not Rated,,0.1268,6.5,761.1,9.5,6.284,0.146,0,8461.0,0,9.04334083128001,0,Unknow,0,0,0,0,1,0
SOAD15351,Flumevale,Yes,Irrigation,Earth,12.665,0.126,30698.281234981256,1955,,0.02561,7.98987,,15/07/1992,0,24.68,Low,Fair,2019-08-08,0.0794,35.5,452.4,11.8,12.665,0.126,0,,1,,0,Unknow,0,0,1,0,0,0
SOAD17910,Flumevale,Yes,Water Supply,Earth,19.859,0.04,112233.11878492315,Unknow,,0.08261684539233254,38.406251746997754,,09/05/2023,0.5,58.581520388892486,Low,Fair,2017-09-01,0.074,8.2,10.6,12.2,19.859,0.04,0,,1,,0,Unknow,0,0,1,1,1,1
SOAD13472,Flumevale,Yes,Fish and Wildlife Pond,Earth,9.248,0.129,13857.086795931878,1987,,0.03152,36.47331563097861,Uncontrolled,10/06/2020,6,12.66,Low,Satisfactory,2013-09-26,0.0467,27.6,378.7,17.24867109660133,9.248,0.129,0,,1,,0,Unknow,0,0,1,1,0,0
SOAD14419,Flumevale,Yes,Recreation,Earth,9.128,0.101,10000.0,1964,,0.02364,29.29619,Uncontrolled,20/05/2020,6,0.0,Low,Satisfactory,2016-09-30,0.0415,6.5,906.0,4.7,9.128,0.101,0,10000.0,0,9.21044036697652,0,Unknow,0,0,0,0,0,0
SOAD14737,Flumevale,Yes,Water Supply,Earth,14.168,0.052,5713.0,1860,,0.04334,35.072986861518785,,28/01/2022,1,1.0,High,Satisfactory,2017-09-01,0.0779,24.2,730.7,59.2,14.168,0.052,0,5713.0,0,8.65067458279072,0,Unknow,0,0,0,1,0,0
SOAD15998,Flumevale,Yes,Irrigation,Earth,11.149,0.248,28500.0,1895,1994,0.03349,56.730504745652276,Uncontrolled,08/08/2019,6,10.72,Low,Unsatisfactory,2017-05-08,0.0839,11.1,116.2,2.3,11.149,0.248,0,28500.0,0,10.2576944533605,1,1994,0,0,0,1,0,0
SOAD02339,Flumevale,Yes,Water Supply,Earth,13.988,0.218,713.0,1982,,0.02561,34.34422901857361,Uncontrolled,15/12/2022,1,1.66,High,Satisfactory,2022-12-15,0.1075,33.6,332.8,61.8,13.988,0.218,0,713.0,0,6.57088296233958,0,Unknow,0,0,0,1,0,0
SOAD03269,Flumevale,Yes,Irrigation,Earth,9.145,0.213,63279.0,1912,1960,0.03546,39.35108850187235,Uncontrolled,09/07/2012,6,29.98,Low,Not Rated,,0.0269,34.5,127.8,19.6,9.145,0.213,0,63279.0,0,11.0553246024415,1,1960,0,0,0,1,0,0
SOAD08642,Flumevale,Yes,Irrigation,Earth,11.582,0.099,28943.0,Unknow,1973,0.02561,31.81064829033899,Uncontrolled,19/10/2018,6,12.7,Low,Unsatisfactory,2011-05-18,0.0971,21.7,386.4,37.2,11.582,0.099,0,28943.0,0,10.2731182076351,1,1973,0,0,0,1,0,0
SOAD10875,Flumevale,Yes,Other,Earth,12.865,0.102,22000.0,1964,,0.02561,2.66329,,21/02/2022,1,0.0,High,Satisfactory,2017-09-01,0.0917,42.2,793.6,18.219990557558067,12.865,0.102,0,22000.0,0,9.99884318585288,0,Unknow,0,0,0,0,0,0
SOAD17721,Flumevale,Yes,Flood Risk Reduction,Earth,11.845,0.144,14570.0,1958,,0.03349,31.857508612601922,Uncontrolled,04/06/2015,3,11.28,Low,Not Rated,,0.1154,21.8,416.0,22.224726108664466,11.845,0.144,0,14570.0,0,9.58678853101385,0,Unknow,0,0,0,1,0,0
SOAD00406,Flumevale,Yes,"Fire Protection, Stock, Or Small Fish Pond",Earth,11.784,0.105,44754.0,1957,,0.02561,32.23805335937106,Uncontrolled,15/09/2021,6,8.42,Low,Satisfactory,2020-10-13,0.0526,27.1,418.6,22.271043097081638,11.784,0.105,0,44754.0,0,10.708958449305,0,Unknow,0,0,0,1,0,0
SOAD02064,Flumevale,Yes,Flood Risk Reduction,Earth,10.912,0.115,26144.0,1958,,0.02561,31.747922991518166,Uncontrolled,01/11/2021,3,1.54,Significant,Satisfactory,2021-11-01,0.1182,29.7,393.4,20.981097120564147,10.912,0.115,0,26144.0,0,10.1714132466222,0,Unknow,0,0,0,1,0,0
SOAD02488,Flumevale,No,Irrigation,Earth,11.277,0.20387015203652734,41000.0,1953,2003,0.02561,7.98987,Uncontrolled,26/08/2020,1,3.33,High,Not Available,,0.1295,39.7,651.9,36.5,11.277,4.507,0,41000.0,0,10.6213517356329,1,2003,0,1,0,0,0,0
SOAD06671,Flumevale,Yes,Recreation,Earth,5.899,0.06,5919.0,1890,2006H;2006M;2006S,0.03152,191.00064808699105,Uncontrolled,23/09/2021,2,1.69,Significant,Satisfactory,2021-09-23,0.1239,19.9,936.9,3.4,5.899,0.06,0,5919.0,0,8.68609172787805,3,2006,0,0,0,1,0,0
SOAD12481,Flumevale,Yes,Irrigation,Earth,8.354,0.083,7280.0,1962,,0.03349,35.65273630784643,Uncontrolled,11/11/1990,0,6.31,Low,Not Rated,,0.0895,12.5,458.3,13.4,8.354,0.083,0,7280.0,0,8.89302349439471,0,Unknow,0,0,0,1,0,0
SOAD13873,Flumevale,Yes,Debris Control,Earth,15.415,0.133,94000.0,1965,,0.02561,7.98987,,01/12/2021,1,0.0,High,Satisfactory,2017-09-01,0.1193,35.2,849.6,17.78884705898852,15.415,0.133,0,94000.0,0,11.4510606994934,0,Unknow,0,0,0,0,0,0
SOAD14813,Flumevale,Yes,Water Supply,Earth,11.616,0.16,23000.0,1965,,0.04334,31.81064829033899,,14/03/2022,0.5,28.37,Low,Satisfactory,2017-09-01,0.0809,29.1,245.9,24.8,11.616,0.16,0,23000.0,0,10.043292972227,0,Unknow,0,0,0,1,0,0
SOAD19297,Flumevale,Yes,Hydroelectric,Earth,11.431,0.3,41848.5050425782,Unknow,,0.0197,32.445025785031255,Uncontrolled,07/07/2022,3,94.5834218218676,Low,Satisfactory,2023-09-29,0.0644,13.9,22.1,60.369561111111274,11.431,0.3,0,,1,,0,Unknow,0,0,1,1,0,1
SOAD20625,Flumevale,Yes,Irrigation,Earth,8.762,0.333,33072.78073474197,1967,,0.04137,32.51461090583979,,17/10/2013,0,1.66,Low,Not Rated,,0.1158,22.4,187.3,19.0,8.762,0.333,0,,1,,0,Unknow,0,0,1,1,0,0
SOAD03573,Flumevale,Yes,Irrigation,Earth,9.202,0.423,44689.36619216849,2006,,0.02561,34.23557366717412,Uncontrolled,05/04/2021,6,9.88,Low,Fair,2009-08-12,0.0544,40.8,262.6,17.2,9.202,0.423,0,,1,,0,Unknow,0,0,1,1,0,0
SOAD03857,Flumevale,Yes,Water Supply,Earth,25.949,0.255,74000.0,1961,,0.02364,44.019551986874966,,08/09/2022,1,1.0385969445413215,High,Satisfactory,2017-09-01,0.081,23.2,792.1,8.9,25.949,0.255,0,74000.0,0,11.2118338856085,0,Unknow,0,0,0,1,0,1
SOAD15427,Flumevale,Yes,Recreation,Earth,7.911,0.142,24908.0,1974,,0.03546,52.74810197468712,Uncontrolled,11/04/2022,2,0.0,Significant,Satisfactory,2022-04-11,0.0992,13.0,933.6,7.4,7.911,0.142,0,24908.0,0,10.1229844629301,0,Unknow,0,0,0,1,0,0
SOAD15727,Flumevale,Yes,Irrigation,Earth,9.84,0.087,16528.20330943844,1964,,0.03546,21.30632,Uncontrolled,09/09/2013,6,17.81,Low,Fair,2021-10-28,0.049,18.7,333.7,21.5,9.84,0.087,0,,1,,0,Unknow,0,0,1,0,0,0
SOAD18973,Flumevale,Yes,Water Supply,Earth,20.635,0.093,19200.0,1885,,0.03349,2.66329,,23/06/2022,1,1.2824584109179575,High,Satisfactory,2017-09-01,0.0807,7.7,620.6,50.2,20.635,0.093,0,19200.0,0,9.86271763999292,0,Unknow,0,0,0,0,0,1
SOAD02418,Flumevale,Yes,Water Supply,Earth,33.52,0.435,526051.9950080174,1962,,0.01576,232.58999184293896,,18/10/2022,1,0.0,Significant,Fair,2017-09-01,0.125,42.6,162.3,45.4,33.52,0.435,0,,1,,0,Unknow,0,0,1,1,0,0
SOAD10703,Flumevale,Yes,Water Supply,Earth,13.567,0.71,780455.2979652982,Unknow,,60.09574872153318,5093.706124088803,,06/03/2023,1,0.0,High,Fair,2018-07-23,0.109,743.0,948.4,70.7,13.567,0.71,0,,1,,0,Unknow,0,0,1,1,1,0
SOAD18939,Flumevale,Yes,Fish and Wildlife Pond,Earth,8.983,0.265,26447.27533921105,1970,,0.03349,32.0999290195802,,20/09/2001,0,16.3,Low,Satisfactory,2017-02-21,0.0754,38.9,292.4,21.454567347420678,8.983,0.265,0,,1,,0,Unknow,0,0,1,1,0,0
SOAD02700,Flumevale,No,Unknow,Earth,10.363,0.6157519323862075,1628609.812265494,Unknow,,58.81831467498434,4945.486940554013,,07/12/2022,Unknow,1.479179765412044,High,Not Available,,0.0996,878.6,896.0,19.852176323385763,10.363,,1,,1,,0,Unknow,0,1,1,1,1,1
SOAD04787,Flumevale,Yes,Water Supply,Earth,17.183,0.095,11430.0,1971,,0.03546,2.66329,,19/10/2021,1,8.27,Significant,Satisfactory,2017-09-01,0.115,31.5,268.3,48.0,17.183,0.095,0,11430.0,0,9.34408424202578,0,Unknow,0,0,0,0,0,0
SOAD11046,Flumevale,Yes,Recreation,Earth,17.895,0.117,20000.0,1958,,0.03546,2.66329,,15/09/2021,0.5,66.94534845598847,Low,Satisfactory,2017-09-01,0.0666,45.0,21.0,5.9,17.895,0.117,0,20000.0,0,9.90353755128617,0,Unknow,0,0,0,0,0,1
SOAD15266,Flumevale,Yes,Flood Risk Reduction,Earth,11.354,0.158,18670.0,1963,,0.04137,31.99079358752005,,03/04/2019,3,13.9,Low,Not Rated,,0.0696,26.9,465.7,22.279147539923386,11.354,0.158,0,18670.0,0,9.83472679696534,0,Unknow,0,0,0,1,0,0
SOAD15580,Flumevale,Yes,Flood Risk Reduction,Earth,8.618,0.309,29445.64862141791,1961,,0.05319,32.520275663585544,,13/07/2017,3,26.45,Low,Fair,2020-06-17,0.0805,44.2,316.8,21.2942491904756,8.618,0.309,0,,1,,0,Unknow,0,0,1,1,0,0
SOAD16461,Flumevale,Yes,Debris Control,Earth,22.152,0.26,139950.0,1944,,0.02561,13.31645,,03/11/2021,1,0.0,High,Satisfactory,2017-09-01,0.0892,47.4,793.5,18.203481553731937,22.152,0.26,0,139950.0,0,11.8490476403271,0,Unknow,0,0,0,0,0,0
SOAD19117,Flumevale,Yes,Irrigation,Earth,9.556,0.104,14711.579303237504,1957,,0.04334,32.66237945515759,Uncontrolled,13/01/2017,6,3.23,Low,Unsatisfactory,2020-07-14,0.1094,44.7,114.2,11.5,9.556,0.104,0,,1,,0,Unknow,0,0,1,1,0,0
SOAD00084,Flumevale,Yes,Water Supply,Earth,9.147,0.368,38681.37904822383,2009,,0.04137,32.27260752100988,,,0,100.31028516145197,Low,Not Rated,,0.0866,39.9,23.2,36.6,9.147,0.368,0,,1,,0,Unknow,0,0,1,1,0,1
SOAD00963,Flumevale,Yes,Recreation,Earth,7.852,0.066,9600.0,1966,2007,0.02561,29.29619,Uncontrolled,13/07/2022,2,0.0,Significant,Unsatisfactory,2022-07-13,0.1875,42.0,578.1,8.8,7.852,0.066,0,9600.0,0,9.16962253869762,1,2007,0,0,0,0,0,0
SOAD05825,Flumevale,Yes,Other,Earth,17.514,0.433,99908.0,1979,,0.02561,34.934340895516705,,01/01/1991,6,24.84,Low,Fair,2014-08-11,0.0769,12.2,182.6,21.634600735138804,17.514,0.433,0,99908.0,0,11.5120150506689,0,Unknow,0,0,0,1,0,0
SOAD07198,Flumevale,Yes,Other,Earth,19.098,0.177,65346.0,1979,,0.03349,32.25427648538251,,01/01/1991,6,24.05,Low,Not Rated,,0.0606,32.3,355.0,21.99415707584067,19.098,0.177,0,65346.0,0,11.0874668113422,0,Unknow,0,0,0,1,0,0
SOAD00171,Flumevale,No,Water Supply,Earth,6.444,0.333,27076.83508826891,Unknow,,0.9199374564306595,99.84574454306245,,,Unknow,25.02,High,Not Available,,0.1099,686.6,189.9,15.0,6.444,0.333,0,,1,,0,Unknow,0,0,1,1,1,0
SOAD01058,Flumevale,Yes,Irrigation,Earth,9.711,0.16,280.0,1980,,0.04334,51.25617190054238,,10/07/2019,0,22.96,Low,Fair,2021-05-12,0.0789,32.7,393.7,39.9,9.711,0.16,0,280.0,0,5.63835466933375,0,Unknow,0,0,0,1,0,0
SOAD08932,Flumevale,Yes,Water Supply,Earth,12.059,0.453,88392.20593774492,1966,,0.02561,34.160422637314134,,26/10/2021,1,0.34,High,Satisfactory,2017-09-01,0.0824,7.4,440.8,68.4,12.059,0.453,0,,1,,0,Unknow,0,0,1,1,0,0
SOAD18527,Flumevale,Yes,Water Supply,Earth,23.339,0.067,16700.0,1951,,0.03546,2.66329,,21/06/2022,0.5,65.55545527511961,Low,Satisfactory,2017-09-01,0.0656,25.4,21.0,25.7,23.339,0.067,0,16700.0,0,9.72322387685162,0,Unknow,0,0,0,0,0,1
SOAD20657,Flumevale,Yes,Water Supply,Earth,14.531,0.08,14500.0,1969,,0.02561,27.56912722831877,,01/12/2021,1,0.0,High,Satisfactory,2017-09-01,0.0944,37.4,902.8,41.4,14.531,0.08,0,14500.0,0,9.5819728915479,0,Unknow,0,0,0,1,0,0
SOAD11678,Flumevale,Yes,Water Supply,Earth,10.023,0.2,22000.0,1880,,0.02561,40.21791603126835,,05/08/2022,1,1.266147610076741,High,Satisfactory,2017-09-01,0.08,25.2,836.9,8.7,10.023,0.2,0,22000.0,0,9.99884318585288,0,Unknow,0,0,0,1,0,1
SOAD15068,Flumevale,Yes,Flood Risk Reduction,Earth,10.173,0.133,80000.0,1986,,0.02561,32.21484158330579,,25/03/2022,0.5,63.39515837035773,Low,Satisfactory,2017-09-01,0.0638,34.3,10.1,22.614666275767753,10.173,0.133,0,80000.0,0,11.2897944135779,0,Unknow,0,0,0,1,0,1
SOAD01162,Flumevale,Yes,Irrigation,Earth,10.955,0.08,12942.0,1903,,0.02561,66.58225,Uncontrolled,28/08/2017,6,20.19,Low,Fair,2018-09-07,0.0532,36.4,469.1,36.8,10.955,0.08,0,12942.0,0,9.46831038044244,0,Unknow,0,0,0,0,0,0
SOAD01341,Flumevale,Yes,Unknow,Earth,5.576,0.208,19082.32824628699,Unknow,,0.10559111193633182,34.10344498370476,,31/08/2020,6,64.56718610734792,Low,Fair,2018-10-03,0.049,14.5,14.3,22.518651043860675,5.576,0.208,0,,1,,0,Unknow,0,0,1,1,1,1
SOAD05723,Flumevale,Yes,Recreation,Earth,9.666,0.062,12257.0,1955,,0.03546,47.13903974511683,Uncontrolled,12/09/2008,0,6.73,Low,Satisfactory,2020-08-26,0.0645,37.6,173.4,5.3,9.666,0.062,0,12257.0,0,9.41393406404568,0,Unknow,0,0,0,1,0,0
SOAD07146,Flumevale,Yes,Fish and Wildlife Pond,Earth,3.507,0.142,2911.0,1966,,0.09652700668422107,13.31645,Uncontrolled,22/08/2019,10,4.65,Low,Not Rated,,0.0404,10.4,529.0,20.17203757632497,3.507,0.142,0,2911.0,0,7.97659540931658,0,Unknow,0,0,0,0,1,0
SOAD12066,Flumevale,No,"Fire Protection, Stock, Or Small Fish Pond",Earth,8.521,0.097,2602.0,1961,,0.07486,33.86025693574633,Uncontrolled,09/05/2023,4,42.59,Low,Poor,2023-05-09,0.081,29.8,211.3,23.528748828109997,8.521,0.097,0,2602.0,0,7.86441990499457,0,Unknow,0,0,0,1,0,0
SOAD13188,Flumevale,Yes,Irrigation,Earth,16.055,0.17,30895.0,1963,,0.02364,40.57722463167868,Uncontrolled,12/08/2016,6,6.39,Low,Satisfactory,2017-10-11,0.0335,39.6,471.5,10.3,16.055,0.17,0,30895.0,0,10.3383820046683,0,Unknow,0,0,0,1,0,0
SOAD16381,Flumevale,Yes,Irrigation,Earth,3.58,0.083,1580.0,1898,,0.04137,63.91896,Uncontrolled,29/03/2012,6,25.15,Low,Not Rated,,0.0755,41.7,118.2,34.4,3.58,0.083,0,1580.0,0,7.36581283720947,0,Unknow,0,0,0,0,0,0
SOAD18720,Flumevale,Yes,Flood Risk Reduction,Earth,8.668,0.153,6900.0,1973,,0.03349,33.797531636925505,Uncontrolled,17/11/2020,3,5.07,Low,Not Rated,,0.1099,24.5,125.7,21.203258420410936,8.668,0.153,0,6900.0,0,8.8394216076206,0,Unknow,0,0,0,1,0,0
SOAD02308,Flumevale,Yes,Flood Risk Reduction,Earth,13.077,0.083,34564.0,1958,,0.02561,28.00698622869746,Uncontrolled,01/11/2021,3,1.63,Significant,Satisfactory,2021-11-01,0.1108,26.5,928.3,22.07772244096538,13.077,0.083,0,34564.0,0,10.4505968883794,0,Unknow,0,0,0,1,0,0
SOAD03455,Flumevale,Yes,Fish and Wildlife Pond,Earth,4.038,0.067,9838.431859115075,1910,,0.0591,34.51513357921351,,07/08/1990,0,48.61,Low,Satisfactory,2020-10-05,0.067,17.5,115.5,23.395176613576552,4.038,0.067,0,,1,,0,Unknow,0,0,1,1,0,0
SOAD13864,Flumevale,Yes,Recreation,Earth,12.905,0.25,91174.0,1963,,0.02561,52.89978814794222,,12/08/2016,6,6.47,Low,Fair,2019-05-13,0.0686,13.5,475.8,5.3,12.905,0.25,0,91174.0,0,11.4205360156769,0,Unknow,0,0,0,1,0,0
SOAD15385,Flumevale,Yes,Recreation,Earth,6.781,0.035,1421.0,1947,1968M,0.08274,7.98987,Uncontrolled,24/08/2016,Unknow,7.19,Low,Not Rated,,0.0704,42.4,190.2,8.8,6.781,0.035,0,1421.0,0,7.25981961036319,1,1968,0,0,0,0,0,0
SOAD17825,Flumevale,Yes,Water Supply,Earth,9.375,0.128,14000.0,1936,2007,0.02364,63.91896,Uncontrolled,25/05/2021,2,55.54,Significant,Satisfactory,2021-05-25,0.1068,22.5,96.4,57.3,9.375,0.128,0,14000.0,0,9.54688403461792,1,2007,0,0,0,0,0,0
SOAD18330,Flumevale,Yes,Debris Control,Earth,15.748,0.195,37800.0,1954,,0.02167,5.32658,,30/11/2021,1,0.0,High,Satisfactory,2017-09-01,0.1034,20.0,591.8,16.133873658197242,15.748,0.195,0,37800.0,0,10.5400908362842,0,Unknow,0,0,0,0,0,0
SOAD20147,Flumevale,Yes,Recreation,Earth,10.149,0.113,25469.84035555347,1964,,0.02561,7.98987,Uncontrolled,27/08/2021,2,17.15,Significant,Satisfactory,2021-08-27,0.1244,28.9,147.8,3.8,10.149,0.113,0,,1,,0,Unknow,0,0,1,0,0,0
SOAD00329,Flumevale,Yes,Irrigation,Earth,9.155,0.067,3901.0,1912,,0.08636586422610602,13.31645,Uncontrolled,29/06/2017,10,16.85,Low,Not Rated,,0.0466,39.3,179.7,30.7,9.155,0.067,0,3901.0,0,8.26924452118306,0,Unknow,0,0,0,0,1,0
SOAD03814,Flumevale,Yes,Fish and Wildlife Pond,Earth,12.185,0.125,30597.692918178065,1973,,0.02561,7.98987,,31/08/1989,0,22.96,Low,Fair,2009-09-17,0.0727,38.6,348.8,17.09929135439457,12.185,0.125,0,,1,,0,Unknow,0,0,1,0,0,0
SOAD04504,Flumevale,Yes,Water Supply,Earth,25.154,0.11,72003.15880948352,2008,,0.03349,31.909179719931466,Uncontrolled,12/08/2022,1,15.19,High,Satisfactory,2022-08-12,0.0774,11.1,255.4,58.2,25.154,0.11,0,,1,,0,Unknow,0,0,1,1,0,0
SOAD05966,Flumevale,Yes,Irrigation,Earth,8.318,0.225,24073.074313230925,1949,,0.05319,33.499107312134086,Uncontrolled,22/09/2016,6,149.27,Low,Fair,2015-07-30,0.0625,32.1,191.0,30.0,8.318,0.225,0,,1,,0,Unknow,0,0,1,1,0,0
SOAD07666,Flumevale,Yes,Water Supply,Earth,11.536,0.24,38428.04589264914,1974,,0.02364,45.04688577571395,Uncontrolled,12/07/2016,6,4.7,Low,Not Rated,,0.0695,22.4,639.8,6.6,11.536,0.24,0,,1,,0,Unknow,0,0,1,1,0,0
SOAD12897,Flumevale,Yes,Water Supply,Earth,16.528,0.233,26500.0,1957,,0.36642,2.66329,,04/03/2022,1,5.18,High,Satisfactory,2017-09-01,0.0839,274.4,300.5,55.7,16.528,0.233,0,26500.0,0,10.1849377471114,0,Unknow,0,0,0,0,0,0
SOAD13771,Flumevale,Yes,Irrigation,Earth,4.335,0.095,10081.056410717041,1935,,0.0591,58.59238,Uncontrolled,22/07/2016,6,0.0,Low,Satisfactory,2016-06-01,0.0308,19.1,101.3,26.3,4.335,0.095,0,,1,,0,Unknow,0,0,1,0,0,0
SOAD15115,Flumevale,Yes,Irrigation,Earth,2.888,0.667,54784.0,1888,,0.24428,71.4204719062549,,21/02/1979,6,7.92,Low,Fair,2019-08-05,0.0529,203.2,422.1,5.9,2.888,0.667,0,54784.0,0,10.9111717128395,0,Unknow,0,0,0,1,0,0
SOAD15406,Flumevale,Yes,Irrigation,Earth,7.247,0.3,25864.549969642056,1887,,0.04334,32.76782588349023,,,6,9.43,Low,Fair,2018-09-25,0.06,42.2,286.0,32.2,7.247,0.3,0,,1,,0,Unknow,0,0,1,1,0,0
SOAD18637,Flumevale,Yes,Other,Earth,12.998,0.183,19392.0,1956,,0.03349,31.829672057699288,,08/06/2022,1,6.44,Significant,Satisfactory,2017-09-01,0.1382,31.0,394.6,22.373823149825796,12.998,0.183,0,19392.0,0,9.87266745519624,0,Unknow,0,0,0,1,0,0
SOAD01035,Flumevale,No,"Fire Protection, Stock, Or Small Fish Pond",Earth,4.281,0.42,34841.49925628706,1934,,0.34898104561205995,79.8987,Uncontrolled,31/08/2010,10,85.11710461383926,Low,Not Rated,,0.075,10.0,14.6,20.522926439867796,4.281,0.42,0,,1,,0,Unknow,0,0,1,0,1,1
SOAD04307,Flumevale,No,Irrigation,Earth,7.716,0.366,33707.31878715147,Unknow,,0.6347459920389028,99.30777080469096,,27/02/2020,1,0.0,Significant,Not Rated,,0.127,431.6,656.4,31.2,7.716,0.366,0,,1,,0,Unknow,0,0,1,1,1,0
SOAD06593,Flumevale,Yes,Unknow,Earth,13.295,0.104,31553.57570817884,Unknow,2018,0.02561,7.98987,Uncontrolled,,6,12.9,Low,Unsatisfactory,2009-09-24,0.0914,45.0,156.2,19.539183812112377,13.295,0.104,0,,1,,1,2018,0,0,1,0,0,0
SOAD06620,Flumevale,Yes,Irrigation,Earth,11.774,0.157,17735.0,1958,,0.03349,7.98987,,14/08/1991,0,0.0,Low,Fair,2022-07-06,0.0857,22.7,605.3,18.2,11.774,0.157,0,17735.0,0,9.78335175129615,0,Unknow,0,0,0,0,0,0
SOAD07600,Flumevale,Yes,Fish and Wildlife Pond,Earth,13.199,0.116,38867.0,1969,,0.02364,15.97974,Uncontrolled,18/10/2019,6,20.06,Low,Satisfactory,2021-06-09,0.0349,32.9,418.6,18.406527011059506,13.199,0.116,0,38867.0,0,10.5679265689593,0,Unknow,0,0,0,0,0,0
SOAD07939,Flumevale,Yes,Recreation,Earth,8.628,0.36,195000.0,1967,,0.01773,133.96106264814662,Uncontrolled,01/05/2019,5,6.61,Low,Not Available,,0.0828,29.0,377.5,6.6,8.628,0.36,0,195000.0,0,12.1807599657379,0,Unknow,0,0,0,1,0,0
SOAD09150,Flumevale,Yes,Irrigation,Earth,3.463,0.317,22945.050105351642,1895,2011,0.03349,48.61072444978631,Uncontrolled,08/08/2019,6,11.17,Low,Not Rated,,0.0544,14.4,111.8,28.7,3.463,0.317,0,,1,,1,2011,0,0,1,1,0,0
SOAD11344,Flumevale,Yes,Irrigation,Earth,2.716,0.067,1527.0,1925,,0.11229,41.42664946918751,,16/08/1979,0,87.19,Low,Not Rated,,0.0657,7.7,217.0,15.8,2.716,0.067,0,1527.0,0,7.33171496972647,0,Unknow,0,0,0,1,0,0
SOAD12151,Flumevale,Yes,Irrigation,Earth,10.147,0.049,20132.847765032453,1969,,0.03546,53.2658,Uncontrolled,05/10/2017,6,1.54,Low,Not Rated,,0.0476,8.3,262.6,12.8,10.147,0.049,0,,1,,0,Unknow,0,0,1,0,0,0
SOAD12207,Flumevale,Yes,Irrigation,Earth,3.599,0.4,18768.0,1882,,0.07289,35.9250574911523,,11/03/1980,6,17.23,Low,Not Rated,,0.0994,24.4,253.1,10.3,3.599,0.4,0,18768.0,0,9.83996185165625,0,Unknow,0,0,0,1,0,0
SOAD13040,Flumevale,Yes,Flood Risk Reduction,Earth,20.434,0.233,330000.0,1998,,0.04925,10.65316,,25/03/2022,1,0.0,High,Satisfactory,2017-09-01,0.1041,41.3,344.8,17.650918875342242,20.434,0.233,0,330000.0,0,12.7068509637411,0,Unknow,0,0,0,0,0,0
SOAD14767,Flumevale,Yes,Water Supply,Earth,18.045,0.188,263.0,1932,,0.03349,50.99208609402408,Uncontrolled,04/08/2022,6,42.54,Low,Satisfactory,2019-09-17,0.0354,28.2,92.4,47.8,18.045,0.188,0,263.0,0,5.57594910314632,0,Unknow,0,0,0,1,0,0
SOAD17817,Flumevale,No,Irrigation,Earth,4.658,0.23,19514.192579400504,Unknow,,0.5375062264374553,145.46661932457363,,15/01/2020,1,9.73,Significant,Not Rated,,0.1149,116.7,261.6,4.7,4.658,0.23,0,,1,,0,Unknow,0,0,1,1,1,0
SOAD18005,Flumevale,Yes,Irrigation,Earth,4.572,0.2,1350.0,1935,,0.04334,40.70604204434347,Uncontrolled,24/09/2013,6,12.49,Low,Satisfactory,2019-04-03,0.0353,42.5,327.9,24.5,4.572,0.2,0,1350.0,0,7.2086003379602,0,Unknow,0,0,0,1,0,0
SOAD18490,Flumevale,Yes,Irrigation,Earth,9.314,0.56,41078.0,1962,,0.04334,39.68399389476771,Uncontrolled,12/08/2021,6,8.21,Low,Satisfactory,2017-02-21,0.0336,15.0,373.6,24.9,9.314,0.56,0,41078.0,0,10.6232523210003,0,Unknow,0,0,0,1,0,0
SOAD04255,Flumevale,Yes,Water Supply,Earth,4.129,0.267,21044.36221803151,1969,,0.08077,32.57970284708846,,02/07/2010,6,0.0,Low,Not Rated,,0.0726,32.0,301.8,50.1,4.129,0.267,0,,1,,0,Unknow,0,0,1,1,0,0
SOAD04329,Flumevale,No,"Fire Protection, Stock, Or Small Fish Pond",Earth,7.529,0.093,2222.0,1960,,0.02758,33.987359672558604,,09/05/2023,4,16.28,Low,Poor,2023-05-09,0.0734,39.0,356.4,21.465784937653858,7.529,0.093,0,2222.0,0,7.7066129139642,0,Unknow,0,0,0,1,0,0
SOAD08332,Flumevale,Yes,Irrigation,Earth,3.597,0.182,5572.0,1910,,0.02561,36.57765533278139,,,6,13.47,Low,Not Rated,,0.0705,23.7,356.6,10.3,3.597,0.182,0,5572.0,0,8.62568878756954,0,Unknow,0,0,0,1,0,0
SOAD09560,Flumevale,Yes,Irrigation,Earth,8.707,0.067,12073.49407807078,Unknow,,0.07980792492624565,36.263038094941756,Uncontrolled,,6,51.24273645815595,Low,Fair,2016-02-08,0.0635,20.1,12.9,19.3,8.707,0.067,0,,1,,0,Unknow,0,0,1,1,1,1
SOAD10063,Flumevale,Yes,Irrigation,Earth,10.784,0.118,26156.78550360627,1954,,0.03349,44.50858670694071,,29/06/1992,0,15.12,Low,Not Rated,,0.125,22.7,438.4,5.2,10.784,0.118,0,,1,,0,Unknow,0,0,1,1,0,0
SOAD10430,Flumevale,Yes,Water Supply,Earth,11.532,0.208,37551.85295745871,1968,,0.03546,31.81064829033899,,18/07/1978,0,72.26,Low,Fair,2009-10-27,0.0847,33.4,105.3,51.0,11.532,0.208,0,,1,,0,Unknow,0,0,1,1,0,0
SOAD14189,Flumevale,Yes,Water Supply,Earth,17.561,0.303,50000.0,1980,,0.02561,32.19846044917268,,05/04/2022,0.5,74.29017926887929,Low,Satisfactory,2017-09-01,0.0765,40.0,16.9,32.5,17.561,0.303,0,50000.0,0,10.8197982842103,0,Unknow,0,0,0,1,0,1
SOAD18784,Flumevale,Yes,Recreation,Earth,9.022,0.067,8955.0,1967,,0.04137,15.97974,Uncontrolled,21/09/2021,6,30.23,Low,Satisfactory,2019-08-08,0.0582,19.9,108.9,2.9,9.022,0.067,0,8955.0,0,9.10007897771865,0,Unknow,0,0,0,0,0,0
SOAD19207,Flumevale,Yes,Water Supply,Earth,14.054,0.18,35000.0,1990,,0.03349,32.19189778806001,,05/04/2022,0.5,67.45040733259923,Low,Satisfactory,2017-09-01,0.0698,46.8,19.8,54.3,14.054,0.18,0,35000.0,0,10.463131911492,0,Unknow,0,0,0,1,0,1
SOAD02055,Flumevale,No,"Fire Protection, Stock, Or Small Fish Pond",Earth,6.946,0.2,1111.0,1964,,0.0591,33.97529813298264,Uncontrolled,09/05/2023,4,8.21,High,Poor,2023-05-09,0.0942,32.4,468.5,21.118796421007122,6.946,0.2,0,1111.0,0,7.01391547481053,0,Unknow,0,0,0,1,0,0
SOAD02401,Flumevale,Yes,Irrigation,Earth,4.606,0.163,10532.0,1900,,0.03546,46.248785910428275,Uncontrolled,15/10/2020,6,9.57,Low,Not Rated,,0.055,26.8,200.8,4.2,4.606,0.163,0,10532.0,0,9.26226846483654,0,Unknow,0,0,0,1,0,0
SOAD04180,Flumevale,Yes,Water Supply,Earth,17.902,0.163,36700.0,1973,,0.02561,32.16938044798718,,03/05/2022,0.5,67.34745788815471,Low,Satisfactory,2017-09-01,0.0761,45.1,6.6,38.5,17.902,0.163,0,36700.0,0,10.5105592816278,0,Unknow,0,0,0,1,0,1
SOAD04681,Flumevale,Yes,Water Supply,Earth,6.386,0.04,50.0,1981,,0.04137,129.81464929880414,Uncontrolled,29/09/2022,6,1.58,Low,Satisfactory,2013-09-26,0.0481,38.6,312.1,10.3,6.386,0.04,0,50.0,0,3.93182563272433,0,Unknow,0,0,0,1,0,0
SOAD07940,Flumevale,Yes,Flood Risk Reduction,Earth,14.198,0.069,10320.0,1956,,0.02561,33.62829274455759,Uncontrolled,05/11/2013,3,6.26,Low,Not Rated,,0.0878,36.5,202.7,22.39975232375973,14.198,0.069,0,10320.0,0,9.24193593356593,0,Unknow,0,0,0,1,0,0
SOAD08886,Flumevale,Yes,Fish and Wildlife Pond,Earth,26.571,0.083,63923.86991501041,Unknow,,0.08077,31.909179719931466,,20/09/1989,0,66.47,Low,Not Rated,,0.1071,37.1,129.6,22.632978450318884,26.571,0.083,0,,1,,0,Unknow,0,0,1,1,0,0
SOAD10327,Flumevale,No,Hydroelectric,Earth,3.72,0.037,100.0,1855,,0.07486,2.66329,Uncontrolled,12/08/2019,3,51.3769347182692,Low,Satisfactory,2023-09-29,0.0616,42.2,19.7,61.24542222222231,3.72,0.037,0,100.0,0,4.61512051684126,0,Unknow,0,0,0,0,0,1
SOAD13828,Flumevale,Yes,Flood Risk Reduction,Earth,8.834,0.194,12629.0,1956,,0.03349,32.84849691144383,Uncontrolled,10/11/2016,3,1.53,Low,Satisfactory,2022-09-29,0.075,30.2,447.7,20.395133636239056,8.834,0.194,0,12629.0,0,9.44383021534454,0,Unknow,0,0,0,1,0,0
SOAD14400,Flumevale,Yes,Flood Risk Reduction,Earth,10.273,0.134,10219.0,1956,,0.03349,33.62829274455759,Uncontrolled,25/09/2014,3,5.05,Low,Not Rated,,0.0876,38.9,129.6,20.9200029341821,10.273,0.134,0,10219.0,0,9.23210186375769,0,Unknow,0,0,0,1,0,0
SOAD15750,Flumevale,Yes,Flood Risk Reduction,Earth,7.122,0.127,13511.0,1961,,0.04137,7.98987,Uncontrolled,11/04/2018,3,30.54,Low,Fair,2018-07-24,0.0691,9.7,145.4,18.899103246030734,7.122,0.127,0,13511.0,0,9.51133345848764,0,Unknow,0,0,0,0,0,0
SOAD16365,Flumevale,Yes,Fish and Wildlife Pond,Earth,3.556,0.249,9099.0,1968,,0.06107,13.31645,,,6,39.26,Low,Not Rated,,0.0374,29.3,179.1,20.424120811723224,3.556,0.249,0,9099.0,0,9.11602969250494,0,Unknow,0,0,0,0,0,0
SOAD17708,Flumevale,Yes,Recreation,Earth,9.125,0.107,13311.875248687007,1957,2017,0.0394,106.5316,Uncontrolled,24/09/2019,6,9.88,Low,Satisfactory,2010-06-04,0.0287,15.0,303.8,7.4,9.125,0.107,0,,1,,1,2017,0,0,1,0,0,0
SOAD00202,Flumevale,Yes,Water Supply,Earth,8.289,0.137,12980.0,1949,,0.0925899999999999,34.30605769874342,,09/03/2022,0.5,49.940462464041914,Low,Satisfactory,2017-09-01,0.0733,32.0,14.4,64.7,8.289,0.137,0,12980.0,0,9.47124202889299,0,Unknow,0,0,0,1,0,1
SOAD03423,Flumevale,Yes,Irrigation,Earth,3.598,0.05,2222.0,1907,,0.06698,43.82643399454531,,07/09/1990,6,4.73,Low,Not Rated,,0.0426,31.0,812.5,23.5,3.598,0.05,0,2222.0,0,7.7066129139642,0,Unknow,0,0,0,1,0,0
SOAD03726,Flumevale,No,Other,Earth,28.961,0.267,353954.3617169476,Unknow,,3.4581055804152268,286.14510273001446,,,Unknow,1.69,High,Not Available,,0.1087,610.9,536.2,20.553371149547573,28.961,0.267,0,,1,,0,Unknow,0,0,1,1,1,0
SOAD05759,Flumevale,Yes,Water Supply,Earth,3.209,0.07,1604.0,1889,2000,0.05713,38.22966869245881,Uncontrolled,28/09/2022,2,14.67,Significant,Not Rated,,0.1534,17.4,192.5,17.1,3.209,0.07,0,1604.0,0,7.38087903556412,1,2000,0,0,0,1,0,0
SOAD08131,Flumevale,Yes,Irrigation,Earth,4.051,0.103,5860.0,1927,,0.03152,49.17880239778445,,24/09/2013,6,7.76,Low,Fair,2020-10-05,0.0445,26.0,142.1,6.9,4.051,0.103,0,5860.0,0,8.67607551647643,0,Unknow,0,0,0,1,0,0
SOAD10751,Flumevale,Yes,Fish and Wildlife Pond,Earth,3.635,0.175,15186.660657605977,1967,,0.04137,7.98987,,18/09/1996,6,164.09,Low,Not Rated,,0.0869,45.8,86.7,19.896754690515465,3.635,0.175,0,,1,,0,Unknow,0,0,1,0,0,0
SOAD11086,Flumevale,Yes,Water Supply,Earth,11.049,0.167,24855.0,1959,,0.03546,5.32658,,12/11/2021,0.5,67.34330410869349,Low,Satisfactory,2017-09-01,0.0692,32.1,6.5,67.2,11.049,0.167,0,24855.0,0,10.1208544510729,0,Unknow,0,0,0,0,0,1
SOAD12566,Flumevale,Yes,Water Supply,Earth,17.062,0.099,29857.0,1967,,0.02561,31.959155734481275,,10/05/2022,0.5,65.97476140306576,Low,Satisfactory,2017-09-01,0.0831,10.0,8.3,66.6,17.062,0.099,0,29857.0,0,10.3042080896135,0,Unknow,0,0,0,1,0,1
SOAD13408,Flumevale,Yes,Irrigation,Earth,5.357,0.119,9764.0,1906,,0.0591,35.27124935919137,,17/08/2022,6,36.62,Low,Fair,2020-10-19,0.054,7.8,219.3,29.9,5.357,0.119,0,9764.0,0,9.18655984331078,0,Unknow,0,0,0,1,0,0
SOAD17818,Flumevale,Yes,Unknow,Earth,5.695,0.067,9928.600220058708,Unknow,,0.04925,34.27433438652679,Uncontrolled,,6,57.15431054838208,Low,Fair,2018-07-19,0.0705,9.9,13.0,23.38665097591835,5.695,0.067,0,,1,,0,Unknow,0,0,1,1,0,1
SOAD18155,Flumevale,Yes,Water Supply,Earth,8.036,0.21,21604.211343763636,Unknow,,0.839914028420316,142.18098184181878,,05/12/2022,1,2.28,Significant,Fair,2017-09-01,0.1521,54.0,826.4,68.4,8.036,0.21,0,,1,,0,Unknow,0,0,1,1,1,0
SOAD01361,Flumevale,Yes,Water Supply,Earth,13.064,0.072,14000.0,1959,,0.03349,31.87653237996222,,09/03/2022,1,0.16,Significant,Satisfactory,2017-09-01,0.1353,38.6,364.0,55.3,13.064,0.072,0,14000.0,0,9.54688403461792,0,Unknow,0,0,0,1,0,0
SOAD04228,Flumevale,Yes,Water Supply,Earth,7.63,0.242,12500.0,1906,1994H;1996S,0.03349,42.11301636123658,Uncontrolled,07/06/2021,6,18.47,Low,Not Rated,,0.0307,23.3,376.9,57.2,7.63,0.242,0,12500.0,0,9.43356392009056,2,1996,0,0,0,1,0,0
SOAD06948,Flumevale,Yes,Recreation,Earth,12.78,0.112,62483.0,1972,,0.03546,45.717066772570156,,23/07/2019,6,37.22,Low,Not Rated,,0.0998,20.4,186.2,4.5,12.78,0.112,0,62483.0,0,11.0426658029509,0,Unknow,0,0,0,1,0,0
SOAD11993,Flumevale,Yes,Irrigation,Earth,5.389,0.267,60910.0,1955,,0.0886499999999999,7.98987,Uncontrolled,11/03/2020,6,16.85,Low,Not Rated,,0.0537,19.4,217.7,13.2,5.389,0.267,0,60910.0,0,11.0171690613612,0,Unknow,0,0,0,0,0,0
SOAD16500,Flumevale,Yes,Irrigation,Earth,8.995,0.213,700.0,1929,,0.03349,90.55186,,19/04/2017,6,14.46,Low,Not Rated,,0.039,25.8,191.5,45.9,8.995,0.213,0,700.0,0,6.55250788703459,0,Unknow,0,0,0,0,0,0
SOAD00445,Flumevale,Yes,Fish and Wildlife Pond,Earth,9.105,0.111,24086.0,1940,,0.03349,13.31645,,08/05/2018,0,28.01,Low,Satisfactory,2014-09-25,0.0638,17.0,457.4,18.8316357396236,9.105,0.111,0,24086.0,0,10.0894275548528,0,Unknow,0,0,0,0,0,0
SOAD00587,Flumevale,Yes,Water Supply,Earth,10.012,0.2,26032.3994653365,1899,,0.03349,7.98987,,16/11/1988,0,56.27,Low,Not Rated,,0.0839,37.5,212.4,4.9,10.012,0.2,0,,1,,0,Unknow,0,0,1,0,0,0
SOAD01446,Flumevale,Yes,Irrigation,Earth,6.4,0.15,14400.0,1954,,0.04137,21.30632,Uncontrolled,18/05/2011,6,73.64,Low,Fair,2020-08-11,0.0589,25.9,208.7,4.2,6.4,0.15,0,14400.0,0,9.57505292759738,0,Unknow,0,0,0,0,0,0
SOAD01465,Flumevale,Yes,Irrigation,Earth,5.849,0.372,30844.972740751447,1945,,0.04925,7.98987,,26/10/1979,0,24.89,Low,Not Rated,,0.08,29.6,446.7,8.0,5.849,0.372,0,,1,,0,Unknow,0,0,1,0,0,0
SOAD07861,Flumevale,Yes,Water Supply,Earth,13.322,0.092,21157.0,1945,,0.05122,5.32658,,19/04/2022,1,13.31,High,Satisfactory,2017-09-01,0.0793,5.2,407.4,70.6,13.322,0.092,0,21157.0,0,9.95977336354672,0,Unknow,0,0,0,0,0,0
SOAD14047,Flumevale,Yes,Irrigation,Earth,17.689,0.153,77405.99948895746,1917,,0.02561,32.12930768783172,Uncontrolled,12/04/2023,1,0.0,High,Unsatisfactory,2023-04-12,0.1359,45.8,341.5,42.5,17.689,0.153,0,,1,,0,Unknow,0,0,1,1,0,0
SOAD14520,Flumevale,Yes,Irrigation,Earth,8.166,0.173,17980.318627256496,1996,,0.03349,36.741792902773966,Controlled,19/09/2019,6,32.52,Low,Not Rated,,0.0854,26.3,48.0,9.9,8.166,0.173,0,,1,,0,Unknow,0,0,1,1,0,0
SOAD14731,Flumevale,Yes,"Fire Protection, Stock, Or Small Fish Pond",Earth,5.446,0.15,11411.345730107536,1939,,0.04925,34.096195556642144,,21/11/1991,0,11.7,Low,Fair,2017-10-11,0.0836,38.9,410.9,22.271305162333782,5.446,0.15,0,,1,,0,Unknow,0,0,1,1,0,0
SOAD16400,Flumevale,Yes,Flood Risk Reduction,Earth,7.123,0.152,12124.22747060431,1957,,0.04137,34.055009124363075,Uncontrolled,25/09/2014,3,6.26,Low,Fair,2018-08-29,0.0806,44.7,100.9,21.033554585050997,7.123,0.152,0,,1,,0,Unknow,0,0,1,1,0,0
SOAD17882,Flumevale,Yes,Flood Risk Reduction,Earth,8.649,0.138,13295.448501350453,1957,,0.04334,32.949928049400086,Uncontrolled,10/11/2016,3,3.09,Low,Fair,2018-06-20,0.0946,46.8,228.5,20.303237252521082,8.649,0.138,0,,1,,0,Unknow,0,0,1,1,0,0
SOAD00703,Flumevale,Yes,Flood Risk Reduction,Earth,8.683,0.185,14340.0,1958,,0.04925,31.7947833137811,Uncontrolled,25/07/2013,3,1.69,Low,Not Rated,,0.1083,26.1,330.7,20.807664736088928,8.683,0.185,0,14340.0,0,9.57087784672921,0,Unknow,0,0,0,1,0,0
SOAD02561,Flumevale,Yes,Flood Risk Reduction,Earth,14.004,0.096,134000.0,1969,,0.02561,5.32658,,22/06/2022,1,0.77,High,Satisfactory,2017-09-01,0.0768,6.8,539.6,18.0847834979522,14.004,0.096,0,134000.0,0,11.8056025415918,0,Unknow,0,0,0,0,0,0
SOAD03382,Flumevale,Yes,Irrigation,Earth,4.208,0.395,16853.0,1904,,0.06107,34.258819942436396,,24/09/2013,6,8.16,Low,Fair,2011-11-01,0.0622,15.4,151.5,42.2,4.208,0.395,0,16853.0,0,9.7323432963323,0,Unknow,0,0,0,1,0,0
SOAD04646,Flumevale,Yes,Tailings,Earth,7.079,0.617,1100.0,1989,1999,0.0886499999999999,35.990795169202165,Uncontrolled,30/11/1995,6,4.81,Low,Satisfactory,2008-12-12,0.0498,38.6,516.0,19.662247071003083,7.079,0.617,0,1100.0,0,7.00397413672268,1,1999,0,0,0,1,0,0
SOAD06763,Flumevale,Yes,Irrigation,Earth,5.819,0.192,5700.0,1961,,0.04925,50.427993732470846,Uncontrolled,05/11/2019,6,0.0,Low,Satisfactory,2017-06-22,0.0229,8.6,786.4,44.6,5.819,0.192,0,5700.0,0,8.64839687703158,0,Unknow,0,0,0,1,0,0
SOAD10632,Flumevale,Yes,Flood Risk Reduction,Earth,7.125,0.56,48149.797645656334,2000,,0.15366,34.34324685885246,Uncontrolled,04/01/2019,6,0.0,Low,Not Rated,,0.0771,17.6,150.8,21.25143617684574,7.125,0.56,0,,1,,0,Unknow,0,0,1,1,0,0
SOAD19808,Flumevale,Yes,Water Supply,Earth,17.287,0.085,24800.0,1956,,0.03349,31.928203487291764,,19/04/2022,1,0.48,Significant,Satisfactory,2017-09-01,0.1393,21.0,598.4,52.6,17.287,0.085,0,24800.0,0,10.1186392539208,0,Unknow,0,0,0,1,0,0
SOAD01626,Flumevale,Yes,Irrigation,Earth,6.792,0.136,5200.0,1952,2003H;2003M;2003S,0.04137,21.30632,Uncontrolled,28/07/2021,6,31.25,Low,Not Rated,,0.0619,33.9,235.6,24.1,6.792,0.136,0,5200.0,0,8.55660619377307,3,2003,0,0,0,0,0,0
SOAD02937,Flumevale,Yes,Unknow,Earth,4.28,0.867,50857.779656271,Unknow,,0.08077,36.98299102306803,Uncontrolled,,6,106.15481292536919,Low,Fair,2020-10-07,0.0558,5.5,23.4,20.727614291446056,4.28,0.867,0,,1,,0,Unknow,0,0,1,1,0,1
SOAD03843,Flumevale,Yes,Recreation,Earth,6.465,0.098,10132.820776630806,1958,,0.05122,61.981674292690286,Uncontrolled,10/09/2019,6,23.46,Low,Satisfactory,2021-10-20,0.039,38.0,309.6,7.7,6.465,0.098,0,,1,,0,Unknow,0,0,1,1,0,0
SOAD18341,Flumevale,Yes,Flood Risk Reduction,Earth,10.345,0.211,19630.0,1959,,0.04925,31.747922991518166,Uncontrolled,04/06/2015,3,7.88,Low,Not Rated,,0.1105,28.2,469.1,20.950985430222527,10.345,0.211,0,19630.0,0,9.88486522840803,0,Unknow,0,0,0,1,0,0
SOAD00814,Flumevale,Yes,Water Supply,Earth,14.145,0.133,48300.0,1999,,0.04925,32.25887973631665,,14/03/2022,1,8.191864162283572,Significant,Satisfactory,2017-09-01,0.1183,29.2,264.6,17.5,14.145,0.133,0,48300.0,0,10.7852075433601,0,Unknow,0,0,0,1,0,1
SOAD03190,Flumevale,Yes,Flood Risk Reduction,Earth,8.305,0.083,5234.0,1957,,0.0394,7.98987,Uncontrolled,02/04/2002,3,5.04,Low,Satisfactory,2017-10-30,0.0671,27.2,200.8,19.830205647202387,8.305,0.083,0,5234.0,0,8.56312212330464,0,Unknow,0,0,0,0,0,0
SOAD06303,Flumevale,Yes,"Fire Protection, Stock, Or Small Fish Pond",Earth,10.119,0.01,19755.61164955191,1982,,0.0394,7.98987,Uncontrolled,19/10/2018,6,24.91,Low,Fair,2019-03-25,0.0557,44.5,271.3,17.809871883525965,10.119,0.01,0,,1,,0,Unknow,0,0,1,0,0,0
SOAD07281,Flumevale,Yes,Irrigation,Earth,13.006,0.108,31685.681257001404,1973,,0.03546,23.96961,,27/09/2012,6,6.74,Low,Satisfactory,2021-08-24,0.0424,18.6,234.8,43.3,13.006,0.108,0,,1,,0,Unknow,0,0,1,0,0,0
SOAD07518,Flumevale,Yes,Water Supply,Earth,11.242,0.157,27938.0,1961,,0.03349,32.11469062541007,,25/04/2022,6,6.61,Low,Not Rated,,0.0803,36.1,228.8,20.3,11.242,0.157,0,27938.0,0,10.2377788411898,0,Unknow,0,0,0,1,0,0
SOAD07702,Flumevale,Yes,Water Supply,Earth,12.109,0.117,13000.0,1980,,0.0591,5.32658,,07/06/2022,1,8.066457644611914,Significant,Satisfactory,2017-09-01,0.1192,8.9,331.9,39.5,12.109,0.117,0,13000.0,0,9.47278155656217,0,Unknow,0,0,0,0,0,1
SOAD16557,Flumevale,Yes,Flood Risk Reduction,Earth,7.762,0.134,11740.855156881478,1964,,0.01773,33.86596646339907,Uncontrolled,28/05/2021,6,9.35,Low,Not Rated,,0.0828,27.0,332.1,20.555302086217363,7.762,0.134,0,,1,,0,Unknow,0,0,1,1,0,0
SOAD18263,Flumevale,Yes,Unknow,Earth,4.493,0.42,35228.40196042808,2018,,0.05122,39.56526306452938,Uncontrolled,,6,91.69076990193568,Low,Satisfactory,2022-10-12,0.0417,43.1,14.2,20.670740540809604,4.493,0.42,0,,1,,0,Unknow,0,0,1,1,0,1
SOAD19463,Flumevale,Yes,"Fire Protection, Stock, Or Small Fish Pond",Earth,4.703,0.243,19592.667271576793,1901,,0.10047,32.52823021592631,,13/11/1991,0,26.21,Low,Fair,2014-10-28,0.0812,19.0,428.5,21.47139357348096,4.703,0.243,0,,1,,0,Unknow,0,0,1,1,0,0
SOAD14008,Flumevale,Yes,Flood Risk Reduction,Earth,14.496,0.133,69100.0,2005,,0.03546,7.98987,Uncontrolled,21/07/2005,3,0.0,Low,Not Rated,,0.1166,29.8,780.8,18.470374502940434,14.496,0.133,0,69100.0,0,11.1433244814311,0,Unknow,0,0,0,0,0,0
SOAD19271,Flumevale,Yes,Flood Risk Reduction,Earth,8.174,0.357,40810.0,1984,,0.06698,21.30632,Uncontrolled,01/05/2015,3,15.46,Low,Satisfactory,2012-11-09,0.0618,24.6,165.4,20.405248187594008,8.174,0.357,0,40810.0,0,10.6167069318977,0,Unknow,0,0,0,0,0,0
SOAD19363,Flumevale,Yes,Irrigation,Earth,9.275,0.7,57526.49886933832,1904,,0.05122,82.87993207764819,Uncontrolled,18/06/2019,6,1.54,Low,Satisfactory,2020-10-05,0.0513,34.6,530.1,7.3,9.275,0.7,0,,1,,0,Unknow,0,0,1,1,0,0
SOAD20596,Flumevale,Yes,Water Supply,Earth,14.053,0.087,24500.0,1953,,0.05713,15.97974,,01/09/2021,1,9.96315092569994,Significant,Satisfactory,2017-09-01,0.1379,41.5,474.4,27.3,14.053,0.087,0,24500.0,0,10.1064692120264,0,Unknow,0,0,0,0,0,1
SOAD07997,Flumevale,Yes,Recreation,Earth,8.353,0.113,4291.0,1964,2014S,0.10594037925314904,53.2658,Uncontrolled,10/06/2014,Unknow,4.09,Significant,Not Rated,,0.1415,12.5,230.6,9.3,8.353,0.113,0,4291.0,0,8.36450810375059,1,2014,0,0,0,0,1,0
SOAD10372,Flumevale,Yes,Other,Earth,14.511,0.107,26300.0,1948,,0.02364,31.829672057699288,,04/03/2022,1,6.258844758316356,Significant,Satisfactory,2017-09-01,0.1398,39.0,307.2,22.728549717027715,14.511,0.107,0,26300.0,0,10.1773622402567,0,Unknow,0,0,0,1,0,1
SOAD11027,Flumevale,Yes,Recreation,Earth,7.906,0.12,5867.0,1964,,0.05122,50.60251,,02/10/1979,6,24.34,Low,Not Rated,,0.062,29.3,212.1,3.8,7.906,0.12,0,5867.0,0,8.67726913926287,0,Unknow,0,0,0,0,0,0
SOAD12560,Flumevale,Yes,Irrigation,Earth,7.921,0.115,6628.0,1926,1988H;1988M;1988S,0.05319,7.98987,,08/07/2021,6,17.07,Low,Fair,2012-03-29,0.0758,19.1,383.3,33.1,7.921,0.115,0,6628.0,0,8.79920924224139,3,1988,0,0,0,0,0,0
SOAD03273,Flumevale,Yes,Fish and Wildlife Pond,Earth,7.158,0.042,6214.0,1978,,0.05122,7.98987,,03/08/2021,6,19.37,Low,Not Rated,,0.0664,16.1,405.0,18.464431937831566,7.158,0.042,0,6214.0,0,8.73472100394481,0,Unknow,0,0,0,0,0,0
SOAD04186,Flumevale,Yes,Irrigation,Earth,3.412,0.15,11236.237151033649,1901,,0.05122,21.30632,,15/11/1979,0,75.45,Low,Not Rated,,0.0929,25.5,110.6,42.0,3.412,0.15,0,,1,,0,Unknow,0,0,1,0,0,0
SOAD04245,Flumevale,Yes,Fish and Wildlife Pond,Earth,7.496,0.081,10774.275102605385,1946,,0.04137,114.52147,,06/08/1991,0,4.79,Low,Satisfactory,2016-12-12,0.0695,16.3,604.2,18.370787539406273,7.496,0.081,0,,1,,0,Unknow,0,0,1,0,0,0
SOAD05304,Flumevale,Yes,Irrigation,Earth,9.484,0.5,61757.682650928706,1952,,0.03349,32.463156301437195,Uncontrolled,19/05/2022,6,0.0,Low,Not Rated,,0.1017,45.6,930.1,17.8,9.484,0.5,0,,1,,0,Unknow,0,0,1,1,0,0
SOAD05817,Flumevale,Yes,Flood Risk Reduction,Earth,11.517,0.453,85381.0,1955,2005,0.02561,33.52845669668446,Uncontrolled,09/02/2021,3,0.0,High,Satisfactory,2021-02-09,0.1005,8.7,278.7,20.41039771045072,11.517,0.453,0,85381.0,0,11.3548905847272,1,2005,0,0,0,1,0,0
SOAD11529,Flumevale,Yes,Water Supply,Earth,12.719,0.183,36000.0,1965,,0.05122,2.66329,,10/02/2022,1,0.16,High,Satisfactory,2017-09-01,0.0942,45.9,418.2,17.4,12.719,0.183,0,36000.0,0,10.4913019948302,0,Unknow,0,0,0,0,0,0
SOAD11925,Flumevale,Yes,Water Supply,Earth,14.659,0.315,54200.0,1955,,0.02561,48.780975439921704,,08/09/2022,1,0.8661475431057164,High,Satisfactory,2017-09-01,0.1033,40.8,682.5,6.2,14.659,0.315,0,54200.0,0,10.900454637442,0,Unknow,0,0,0,1,0,1
SOAD12926,Flumevale,Yes,Recreation,Earth,6.053,1.1907729808315195,1314518.9610154813,1983,,0.06107,1449.1553446864825,Uncontrolled,30/03/1999,0,1.61,Low,Fair,2018-08-08,0.0744,5.1,616.4,5.2,6.053,,1,,1,,0,Unknow,0,1,1,1,0,0
SOAD13339,Flumevale,Yes,"Fire Protection, Stock, Or Small Fish Pond",Earth,8.156,0.267,25518.269573482554,1963,,0.05713,33.443291275924246,,05/03/1987,0,122.2,Low,Fair,2019-08-29,0.0785,36.9,236.2,22.294767424105537,8.156,0.267,0,,1,,0,Unknow,0,0,1,1,0,0
SOAD17012,Flumevale,Yes,Other,Earth,14.269,0.383,87000.0,2006,,0.03546,34.1966168558682,,12/05/2020,6,102.41,Low,Not Rated,,0.0745,13.3,70.3,22.577750081076548,14.269,0.383,0,87000.0,0,11.3736748918235,0,Unknow,0,0,0,1,0,0
SOAD18025,Flumevale,Yes,Irrigation,Earth,4.658,0.083,6481.0,1917,,0.08668,34.75009559577498,,31/08/1989,0,55.35,Low,Satisfactory,2013-09-25,0.061,5.4,81.4,24.7,4.658,0.083,0,6481.0,0,8.77678438370149,0,Unknow,0,0,0,1,0,0
SOAD19276,Flumevale,Yes,Fish and Wildlife Pond,Earth,10.356,0.072,7505.0,1965,,0.04137,23.96961,Uncontrolled,18/10/2018,6,4.89,Low,Fair,2017-04-19,0.0515,30.8,859.6,20.468518975852263,10.356,0.072,0,7505.0,0,8.92345797969497,0,Unknow,0,0,0,0,0,0
SOAD20385,Flumevale,Yes,Irrigation,Earth,11.629,0.143,42522.0,1953,,0.04137,7.98987,Uncontrolled,07/05/2019,6,23.73,Low,Satisfactory,2021-06-09,0.0357,8.3,228.0,21.2,11.629,0.143,0,42522.0,0,10.6578003849999,0,Unknow,0,0,0,0,0,0
SOAD05410,Flumevale,Yes,Other,Earth,14.291,0.117,25300.0,1958,,0.05122,31.747922991518166,,08/06/2022,1,1.58,High,Satisfactory,2017-09-01,0.0904,38.6,569.6,21.45390443386323,14.291,0.117,0,25300.0,0,10.1385991996262,0,Unknow,0,0,0,1,0,0
SOAD07609,Flumevale,Yes,Flood Risk Reduction,Earth,8.52,0.203,16020.0,1957,,0.04137,32.05861281314189,Uncontrolled,06/10/2020,3,25.04,Low,Fair,2019-05-16,0.0863,45.0,288.9,21.52412724195208,8.52,0.203,0,16020.0,0,9.68165564064671,0,Unknow,0,0,0,1,0,0
SOAD08765,Flumevale,Yes,Flood Risk Reduction,Earth,8.185,0.18,13773.0,1967,,0.04334,33.20087086894597,Uncontrolled,18/07/1991,0,54.71,Low,Not Rated,,0.0897,17.3,83.2,22.421879030320515,8.185,0.18,0,13773.0,0,9.53053803610464,0,Unknow,0,0,0,1,0,0
SOAD09488,Flumevale,Yes,Irrigation,Earth,3.364,0.35,11753.0,1902,,0.16154,48.117648868304585,,27/08/1984,6,4.96,Low,Not Rated,,0.059,17.7,627.9,46.6,3.364,0.35,0,11753.0,0,9.3719488871726,0,Unknow,0,0,0,1,0,0
SOAD10853,Flumevale,Yes,"Fire Protection, Stock, Or Small Fish Pond",Earth,5.087,0.23,19840.07570527575,1924,,0.08471,53.2658,,30/09/1988,0,5.02,Low,Satisfactory,2019-06-28,0.0688,44.6,429.4,12.644924186087431,5.087,0.23,0,,1,,0,Unknow,0,0,1,0,0,0
SOAD13338,Flumevale,Yes,Fish and Wildlife Pond,Earth,11.362,0.262,38871.15939739446,1957,,0.0394,38.792330444693434,,03/05/2013,6,19.05,Low,Fair,2020-10-29,0.0463,7.8,205.7,19.203038814547686,11.362,0.262,0,,1,,0,Unknow,0,0,1,1,0,0
SOAD15188,Flumevale,Yes,Irrigation,Earth,4.957,0.083,5588.0,1951,,0.05122,7.98987,Uncontrolled,07/07/2017,6,46.98,Low,Not Rated,,0.0787,34.2,236.3,27.6,4.957,0.083,0,5588.0,0,8.6285556592697,0,Unknow,0,0,0,0,0,0
SOAD17045,Flumevale,Yes,Irrigation,Earth,5.113,0.28,10500.0,1931,1962H;1962M;1962S,0.07486,35.13211333641468,Uncontrolled,08/08/2018,6,13.1,Low,Satisfactory,2020-07-20,0.0549,26.9,376.8,42.3,5.113,0.28,0,10500.0,0,9.25922576970599,3,1962,0,0,0,1,0,0
SOAD01862,Flumevale,Yes,Irrigation,Earth,12.085,0.083,5560.0,1970,,0.04334,29.29619,Uncontrolled,01/11/2017,6,32.1,Low,Satisfactory,2022-06-08,0.0388,28.5,91.8,33.9,12.085,0.083,0,5560.0,0,8.62353322718756,0,Unknow,0,0,0,0,0,0
SOAD04495,Flumevale,Yes,Irrigation,Earth,4.224,0.033,9838.431859115075,1904,,0.08077,35.013658150921955,,23/08/1979,6,14.11,Low,Satisfactory,2012-02-01,0.053,12.5,269.4,25.4,4.224,0.033,0,,1,,0,Unknow,0,0,1,1,0,0
SOAD05002,Flumevale,Yes,Water Supply,Earth,15.013,0.335,60009.593938775004,1929,1929S;2001M;2004O,0.02561,33.771662826667566,Uncontrolled,26/05/2022,1,3.11,High,Fair,2022-05-26,0.1248,34.6,798.0,46.0,15.013,0.335,0,,1,,3,2004,0,0,1,1,0,0
SOAD05298,Flumevale,Yes,Irrigation,Earth,3.028,0.31,8680.0,1868,,0.05122,47.08797012247268,Uncontrolled,11/01/1980,6,6.18,Low,Not Rated,,0.0435,9.8,317.5,20.2,3.028,0.31,0,8680.0,0,9.06889200839181,0,Unknow,0,0,0,1,0,0
SOAD12657,Flumevale,Yes,Water Supply,Earth,3.855,0.367,62578.0,1888,,0.10441,33.480878402611744,Uncontrolled,09/10/2012,2,0.0,Significant,Fair,2012-10-09,0.1204,46.0,657.7,20.3,3.855,0.367,0,62578.0,0,11.044185037549,0,Unknow,0,0,0,1,0,0
SOAD12760,Flumevale,Yes,Water Supply,Earth,16.813,0.09,15000.0,1952,,0.03349,2.66329,,26/04/2022,0.5,67.30147416160352,Low,Satisfactory,2017-09-01,0.0749,28.7,5.9,63.3,16.813,0.09,0,15000.0,0,9.61587214452889,0,Unknow,0,0,0,0,0,1
SOAD16224,Flumevale,Yes,Irrigation,Earth,9.898,0.133,18657.865574119605,1947,,0.04925,7.98987,,24/06/2016,6,14.22,Low,Fair,2022-09-27,0.052,26.2,238.6,4.3,9.898,0.133,0,,1,,0,Unknow,0,0,1,0,0,0
SOAD19727,Flumevale,Yes,Water Supply,Earth,13.704,0.073,23903.218896095244,1959,,0.03349,32.15574505579004,,21/04/2022,0.5,63.24362212209828,Low,Satisfactory,2017-09-01,0.0644,19.2,14.5,48.6,13.704,0.073,0,,1,,0,Unknow,0,0,1,1,0,1
SOAD01572,Flumevale,Yes,Water Supply,Earth,10.601,0.6,25932.0,1982,,0.07683,40.979400487850405,,26/08/2020,6,22.37,Low,Satisfactory,2022-09-29,0.0269,34.3,224.9,10.3,10.601,0.6,0,25932.0,0,10.1632715679453,0,Unknow,0,0,0,1,0,0
SOAD02230,Flumevale,Yes,Irrigation,Earth,5.174,0.153,5330.0,1911,,0.07486,39.625067677444,,26/09/2022,6,11.75,Low,Fair,2016-08-15,0.0447,40.7,277.6,46.4,5.174,0.153,0,5330.0,0,8.58129411682276,0,Unknow,0,0,0,1,0,0
SOAD04017,Flumevale,Yes,Hydroelectric,Earth,23.742,0.105,80669.34269659825,1953,,0.02561,7.98987,Uncontrolled,31/05/2023,1,1.61,High,Satisfactory,2023-09-29,0.0909,24.1,738.2,81.9,23.742,0.105,0,,1,,0,Unknow,0,0,1,0,0,0
SOAD11493,Flumevale,Yes,Irrigation,Earth,7.259,0.092,10794.66163155128,1960,,0.04137,34.3830911579614,Uncontrolled,25/08/2015,6,39.95,Low,Not Rated,,0.0615,24.7,153.0,41.2,7.259,0.092,0,,1,,0,Unknow,0,0,1,1,0,0
SOAD12118,Flumevale,No,Water Supply,Earth,10.562,0.1,28721.684974285283,Unknow,,6.441411266946273,302.4853956913059,,,Unknow,2.385787729149716,High,Not Available,,0.1108,821.7,477.8,29.3,10.562,0.1,0,,1,,0,Unknow,0,0,1,1,1,1
SOAD14584,Flumevale,Yes,Irrigation,Earth,4.439,0.24,19592.667271576793,1916,,0.07486,47.761895038158336,,,6,4.67,Low,Satisfactory,2007-03-15,0.0426,28.3,910.9,20.2,4.439,0.24,0,,1,,0,Unknow,0,0,1,1,0,0
SOAD15876,Flumevale,Yes,Irrigation,Earth,9.847,0.12,29060.0,1905,1988S,0.03152,13.31645,Uncontrolled,18/10/2018,6,3.19,Low,Unsatisfactory,2013-09-21,0.0875,39.2,232.3,36.7,9.847,0.12,0,29060.0,0,10.2771523480945,1,1988,0,0,0,0,0,0
SOAD18296,Flumevale,Yes,Water Supply,Earth,11.834,0.266,78195.0,1977,,0.04137,34.62277,,14/07/2020,6,14.08,Low,Satisfactory,2021-11-18,0.0288,37.0,374.9,48.2,11.834,0.266,0,78195.0,0,11.26697377433,0,Unknow,0,0,0,0,0,0
SOAD20570,Flumevale,Yes,Other,Earth,11.378,0.067,11434.0,1975,,0.08471,33.48872836324374,,25/06/2020,6,7.88,Low,Not Rated,,0.0769,29.6,330.2,21.817581447284898,11.378,0.067,0,11434.0,0,9.34443410645688,0,Unknow,0,0,0,1,0,0
SOAD01188,Flumevale,Yes,Water Supply,Earth,14.635,0.063,22300.0,1930,,0.01576,31.922454786482593,,08/12/2021,1,3.36,Significant,Satisfactory,2017-09-01,0.1306,15.1,131.9,32.5,14.635,0.063,0,22300.0,0,10.0123867994921,0,Unknow,0,0,0,1,0,0
SOAD02487,Flumevale,Yes,Irrigation,Earth,4.24,0.267,650.0,1882,,0.0925899999999999,37.28606,Uncontrolled,11/10/2013,6,0.0,Low,Not Rated,,0.0764,8.1,604.3,34.8,4.24,0.267,0,650.0,0,6.47850964220857,0,Unknow,0,0,0,0,0,0
SOAD08596,Flumevale,No,Water Supply,Earth,44.519,0.143,146000.0,1956,2007,0.02561,226.65880088709054,Uncontrolled,22/08/2020,1,0.0,High,Not Available,,0.0937,39.8,427.2,66.1,44.519,0.143,0,146000.0,0,11.8913687499821,1,2007,0,0,0,1,0,0
SOAD09743,Flumevale,Yes,Irrigation,Earth,6.929,0.113,28000.0,2006,,0.03349,32.13090837659721,Uncontrolled,22/06/2022,2,0.0,Significant,Satisfactory,2022-06-22,0.1317,34.8,831.3,36.8,6.929,0.113,0,28000.0,0,10.2399955028053,0,Unknow,0,0,0,1,0,0
SOAD10447,Flumevale,Yes,Recreation,Earth,6.613,0.117,4261.0,1963,,0.10199870689225843,70.26391297215717,Uncontrolled,15/09/2010,Unknow,25.28,Significant,Not Rated,,0.1587,15.9,339.5,5.8,6.613,0.117,0,4261.0,0,8.35749381265856,0,Unknow,0,0,0,1,1,0
SOAD12532,Flumevale,Yes,Water Supply,Earth,12.411,0.351,40000.0,1947,,0.03349,32.27260752100988,,11/05/2022,0.5,77.98784147426649,Low,Satisfactory,2017-09-01,0.0739,15.2,12.0,40.5,12.411,0.351,0,40000.0,0,10.5966597327836,0,Unknow,0,0,0,1,0,1
SOAD17484,Flumevale,Yes,Recreation,Earth,5.278,0.133,10728.875703264557,1957,,0.08471,46.671332284622835,,07/10/2022,6,21.71,Low,Fair,2017-10-19,0.0517,47.6,328.7,5.4,5.278,0.133,0,,1,,0,Unknow,0,0,1,1,0,0
SOAD17774,Flumevale,Yes,Hydroelectric,Earth,9.236,0.138,14154.17958959825,1953,,0.02561,7.98987,Uncontrolled,31/05/2023,1,1.66,High,Satisfactory,2023-09-29,0.1079,22.4,158.6,83.8,9.236,0.138,0,,1,,0,Unknow,0,0,1,0,0,0
SOAD19044,Flumevale,Yes,Irrigation,Earth,10.464,0.127,8738.0,1963,2001H;2001S,0.02364,35.04809144842533,Uncontrolled,25/07/2018,6,21.48,Low,Not Rated,,0.049,38.4,372.1,21.0,10.464,0.127,0,8738.0,0,9.07555104562754,2,2001,0,0,0,1,0,0
SOAD00168,Flumevale,Yes,Flood Risk Reduction,Earth,11.699,0.253,43897.90344003311,1984,,0.02561,32.41332928111419,,06/07/1999,3,0.0,Low,Not Rated,,0.095,41.9,669.6,20.81030132789755,11.699,0.253,0,,1,,0,Unknow,0,0,1,1,0,0
SOAD00925,Flumevale,Yes,Irrigation,Earth,6.465,0.25,32726.0,1951,,0.06501,15.97974,Uncontrolled,11/03/2020,6,15.58,Low,Fair,2018-08-02,0.0474,23.8,247.9,47.5,6.465,0.25,0,32726.0,0,10.3959557042659,0,Unknow,0,0,0,0,0,0
SOAD02613,Flumevale,Yes,Water Supply,Earth,21.448,0.083,32290.0,1905,,0.02364,31.947754168502247,,17/03/2022,0.5,67.24347086434527,Low,Satisfactory,2017-09-01,0.0704,27.4,17.1,42.6,21.448,0.083,0,32290.0,0,10.3825438326131,0,Unknow,0,0,0,1,0,1
SOAD04044,Flumevale,Yes,Water Supply,Earth,16.884,0.137,21000.0,1959,,0.03349,2.66329,,03/11/2021,0.5,26.34,Low,Satisfactory,2017-09-01,0.0704,32.7,184.3,32.9,16.884,0.137,0,21000.0,0,9.95232533461943,0,Unknow,0,0,0,0,0,0
SOAD06033,Flumevale,Yes,Water Supply,Earth,8.489,0.08,7000.0,1869,,0.0906199999999999,2.66329,,25/04/2022,1,10.84391672792745,Significant,Satisfactory,2017-09-01,0.1261,12.0,432.2,64.2,8.489,0.08,0,7000.0,0,8.8538082749772,0,Unknow,0,0,0,0,0,1
SOAD10801,Flumevale,Yes,Irrigation,Earth,4.205,0.267,15171.0,1915,,0.0394,80.34996496608227,,,6,11.6,Low,Satisfactory,2015-06-04,0.0361,22.0,157.8,4.3,4.205,0.267,0,15171.0,0,9.62720690280879,0,Unknow,0,0,0,1,0,0
SOAD14539,Flumevale,Yes,Irrigation,Earth,4.052,0.138,10806.278628817894,Unknow,,0.06501,29.29619,,28/10/1987,0,16.38,Low,Satisfactory,2011-11-01,0.0695,42.8,373.0,24.2,4.052,0.138,0,,1,,0,Unknow,0,0,1,0,0,0
SOAD14783,Flumevale,Yes,Flood Risk Reduction,Earth,10.09,0.162,15130.0,1960,,0.06107,7.98987,,11/04/2018,3,39.39,Low,Satisfactory,2007-03-20,0.073,47.6,233.3,20.07058665940138,10.09,0.162,0,15130.0,0,9.62450089845157,0,Unknow,0,0,0,0,0,0
SOAD15246,Flumevale,Yes,Water Supply,Earth,7.172,0.143,12037.295416881227,1984,,0.05319,7.98987,Uncontrolled,16/11/2022,2,6.4,Significant,Fair,2022-11-16,0.1434,43.3,429.1,16.8,7.172,0.143,0,,1,,0,Unknow,0,0,1,0,0,0
SOAD16568,Flumevale,Yes,Irrigation,Earth,4.159,0.5,35981.0,1906,,0.09456,39.18093930365805,,25/09/2013,6,8.0,Low,Satisfactory,2015-06-04,0.0345,7.4,298.4,34.2,4.159,0.5,0,35981.0,0,10.4907740923966,0,Unknow,0,0,0,1,0,0
SOAD02111,Flumevale,Yes,Water Supply,Earth,7.925,0.243,29910.0,1952,,0.04137,32.568112845268324,,10/06/2020,6,23.11,Low,Not Rated,,0.0989,18.8,215.7,11.8,7.925,0.243,0,29910.0,0,10.3059815846993,0,Unknow,0,0,0,1,0,0
SOAD03029,Flumevale,Yes,Irrigation,Earth,5.892,0.673,26596.0,1912,2001,0.04137,35.07032674365695,Uncontrolled,23/09/2013,6,0.0,Low,Not Rated,,0.0532,20.0,668.9,42.5,5.892,0.673,0,26596.0,0,10.1885537064545,1,2001,0,0,0,1,0,0
SOAD03967,Flumevale,Yes,Water Supply,Earth,13.772,0.16,23500.0,1956,,0.04334,31.829672057699288,,11/08/2022,1,6.437575275569598,Significant,Satisfactory,2017-09-01,0.1364,11.1,382.7,60.3,13.772,0.16,0,23500.0,0,10.0647982524184,0,Unknow,0,0,0,1,0,1
SOAD14025,Flumevale,Yes,Recreation,Earth,3.663,0.533,43459.03453891431,1984,,0.05122,57.61964016220391,Uncontrolled,08/09/2022,2,1.69,Significant,Fair,2022-09-08,0.1233,25.8,711.1,7.1,3.663,0.533,0,,1,,0,Unknow,0,0,1,1,0,0
SOAD16872,Flumevale,Yes,Other,Earth,8.745,0.06,16600.0,1951,,0.07486,2.66329,,14/03/2022,0.5,50.04151386268958,Low,Satisfactory,2017-09-01,0.0605,41.7,21.1,22.417935660183577,8.745,0.06,0,16600.0,0,9.71721821349408,0,Unknow,0,0,0,0,0,1
SOAD18136,Flumevale,Yes,Fish and Wildlife Pond,Earth,3.689,0.233,4194.0,1885,,0.06501,34.832403899355995,Uncontrolled,17/03/2010,6,1.66,Low,Not Rated,,0.0599,10.2,647.2,21.885514382451056,3.689,0.233,0,4194.0,0,8.34164861890131,0,Unknow,0,0,0,1,0,0
SOAD20803,Flumevale,Yes,Irrigation,Earth,3.929,0.078,3634.0,1911,,0.09621971616959336,35.003784571701495,,11/05/1992,6,30.36,Low,Satisfactory,2022-09-12,0.0508,32.4,67.5,22.9,3.929,0.078,0,3634.0,0,8.19836438996762,0,Unknow,0,0,0,1,1,0
SOAD03361,Flumevale,Yes,Irrigation,Earth,7.894,0.114,16596.0,1946,,0.05713,63.91896,Uncontrolled,13/05/2019,6,40.48,Low,Fair,2020-05-12,0.047,41.0,100.3,2.4,7.894,0.114,0,16596.0,0,9.71697723512072,0,Unknow,0,0,0,0,0,0
SOAD04079,Flumevale,Yes,Recreation,Earth,3.407,0.233,12657.0,1968,2002,0.10638,55.511712692014854,Uncontrolled,19/11/1997,6,38.68,Low,Not Rated,,0.0388,14.1,226.4,4.8,3.407,0.233,0,12657.0,0,9.44604470533525,1,2002,0,0,0,1,0,0
SOAD04616,Flumevale,Yes,Irrigation,Earth,6.055,0.042,4444.0,1907,,0.04137,49.253319422092744,,25/07/2018,6,21.79,Low,Fair,2015-07-22,0.0474,38.8,167.7,17.5,6.055,0.042,0,4444.0,0,8.399535147948,0,Unknow,0,0,0,1,0,0
SOAD06395,Flumevale,Yes,Irrigation,Earth,7.736,0.367,31963.565686331316,1989,1989,0.05713,32.62718832775253,Uncontrolled,24/08/2021,6,16.44,Low,Not Rated,,0.0515,13.7,320.6,46.1,7.736,0.367,0,,1,,1,1989,0,0,1,1,0,0
SOAD06844,Flumevale,Yes,"Fire Protection, Stock, Or Small Fish Pond",Earth,8.742,0.15,13974.035753954706,1960,,0.0394,36.867779721286,Uncontrolled,25/11/2019,6,9.8,Low,Satisfactory,2019-06-06,0.0373,24.8,107.1,17.936948164170403,8.742,0.15,0,,1,,0,Unknow,0,0,1,1,0,0
SOAD13640,Flumevale,Yes,Fish and Wildlife Pond,Earth,5.497,0.713,53690.244455445194,1928,,0.06895,34.26218008403187,,10/08/1978,0,0.0,Low,Fair,2019-06-11,0.0799,37.0,529.1,21.676882029838854,5.497,0.713,0,,1,,0,Unknow,0,0,1,1,0,0
SOAD18800,Flumevale,Yes,Irrigation,Earth,5.72,0.035,9885.09319153168,1950,,0.0591,50.10351347779026,,21/05/2021,6,33.89,Low,Fair,2012-10-30,0.0612,31.0,169.1,4.8,5.72,0.035,0,,1,,0,Unknow,0,0,1,1,0,0
SOAD00861,Flumevale,Yes,"Fire Protection, Stock, Or Small Fish Pond",Earth,4.661,0.133,7875.0,1949,,0.04137,15.97974,,16/08/1979,6,14.71,Low,Fair,2020-08-31,0.0717,8.2,177.9,19.513687775599706,4.661,0.133,0,7875.0,0,8.97157543975902,0,Unknow,0,0,0,0,0,0
SOAD04967,Flumevale,Yes,Water Supply,Earth,6.722,0.117,14000.0,1987,,0.05122,32.2078782322092,,10/10/2022,0.5,55.46869257093789,Low,Fair,2017-09-01,0.0733,43.6,8.0,54.5,6.722,0.117,0,14000.0,0,9.54688403461792,0,Unknow,0,0,0,1,0,1
SOAD13497,Flumevale,Yes,Irrigation,Earth,3.902,0.067,9838.431859115075,1909,,0.08274,34.496579221872146,,26/08/1979,6,64.92,Low,Not Rated,,0.0839,43.5,90.3,41.9,3.902,0.067,0,,1,,0,Unknow,0,0,1,1,0,0
SOAD15930,Flumevale,Yes,Irrigation,Earth,7.809,0.1,10974.616311026097,1895,,0.05122,74.57212,Uncontrolled,13/08/2020,6,48.85,Low,Not Rated,,0.0552,5.2,143.9,22.7,7.809,0.1,0,,1,,0,Unknow,0,0,1,0,0,0
SOAD17385,Flumevale,Yes,Irrigation,Earth,2.486,0.67,26471.0,1886,,0.05713,196.538223741211,,30/09/2013,6,13.24,Low,Not Rated,,0.0745,36.5,330.9,12.7,2.486,0.67,0,26471.0,0,10.1838428496014,0,Unknow,0,0,0,1,0,0
SOAD01167,Flumevale,Yes,Irrigation,Earth,8.106,0.2,28848.0,1913,,0.05122,32.41818855773828,,27/07/2020,6,36.25,Low,Not Rated,,0.0684,29.6,167.4,25.6,8.106,0.2,0,28848.0,0,10.2698306092904,0,Unknow,0,0,0,1,0,0
SOAD02745,Flumevale,Yes,Irrigation,Earth,7.643,0.207,20110.804677500753,1978,,0.05713,32.28284779260232,Uncontrolled,19/02/2016,6,26.26,Low,Fair,2022-09-29,0.0585,39.4,119.0,28.3,7.643,0.207,0,,1,,0,Unknow,0,0,1,1,0,0
SOAD03342,Flumevale,Yes,Water Supply,Earth,10.376,0.152,30906.00485513124,1974,,0.05122,31.747922991518166,,01/12/2021,1,0.0,Significant,Satisfactory,2017-09-01,0.1213,18.9,795.1,55.9,10.376,0.152,0,,1,,0,Unknow,0,0,1,1,0,0
SOAD04433,Flumevale,Yes,Water Supply,Earth,29.956,0.103,16000.0,1963,,0.02561,33.5974256327212,Uncontrolled,17/05/2022,1,3.27,High,Fair,2022-05-17,0.1138,25.5,144.3,68.7,29.956,0.103,0,16000.0,0,9.68040649926887,0,Unknow,0,0,0,1,0,0
SOAD04566,Flumevale,Yes,Irrigation,Earth,5.377,1.2,95276.07115110323,1951,,0.06304,54.928806336596075,,04/10/1979,0,77.07,Low,Fair,2020-08-31,0.0809,40.9,139.7,45.3,5.377,1.2,0,,1,,0,Unknow,0,0,1,1,0,0
SOAD06235,Flumevale,Yes,Recreation,Earth,7.985,0.32,35842.0,1912,,0.01576,55.732183641717405,Uncontrolled,09/07/1992,6,0.0,Low,Not Rated,,0.057,44.8,355.5,2.9,7.985,0.32,0,35842.0,0,10.4869035689429,0,Unknow,0,0,0,1,0,0
SOAD08162,Flumevale,Yes,Irrigation,Earth,5.801,0.115,4898.0,1934,,0.0394,48.04813139041468,Uncontrolled,26/10/2016,6,64.87,Low,Fair,2010-10-15,0.0554,27.6,207.3,4.5,5.801,0.115,0,4898.0,0,8.49678638163858,0,Unknow,0,0,0,1,0,0
SOAD14034,Flumevale,Yes,Flood Risk Reduction,Earth,16.144,0.173,92000.0,1974,,0.04334,10.65316,,10/03/2022,1,0.0,High,Satisfactory,2017-09-01,0.0818,33.8,469.6,17.784025562081187,16.144,0.173,0,92000.0,0,11.4295547255373,0,Unknow,0,0,0,0,0,0
SOAD00390,Flumevale,Yes,Flood Risk Reduction,Earth,9.74,0.097,5052.0,1955,,0.02561,33.86025693574633,Uncontrolled,16/10/2014,6,15.9,Low,Not Rated,,0.0942,36.2,203.5,21.38314721336945,9.74,0.097,0,5052.0,0,8.52773740529191,0,Unknow,0,0,0,1,0,0
SOAD03934,Flumevale,Yes,Water Supply,Earth,15.559,0.175,45000.0,1953,,0.03349,5.32658,,08/12/2021,1,0.31,High,Satisfactory,2017-09-01,0.0977,29.4,722.6,23.0,15.559,0.175,0,45000.0,0,10.7144399907278,0,Unknow,0,0,0,0,0,0
SOAD11129,Flumevale,Yes,Flood Risk Reduction,Earth,13.266,0.226,21600.0,1963,,0.00788,36.32645876665587,Uncontrolled,28/09/2020,3,0.0,Low,Fair,2016-07-26,0.0913,8.4,342.5,18.544910462958537,13.266,0.226,0,21600.0,0,9.98049488889691,0,Unknow,0,0,0,1,0,0
SOAD12395,Flumevale,Yes,Irrigation,Earth,12.393,0.22,27882.0,1967,,0.0591,7.98987,Uncontrolled,14/06/2019,6,33.16,Low,Not Rated,,0.0658,11.8,55.5,9.9,12.393,0.22,0,27882.0,0,10.2357724631028,0,Unknow,0,0,0,0,0,0
SOAD13583,Flumevale,Yes,Irrigation,Earth,2.56,0.048,9838.431859115075,1926,,0.12608,234.49299380592453,,16/09/1985,6,25.99,Low,Not Rated,,0.0886,14.7,241.0,5.2,2.56,0.048,0,,1,,0,Unknow,0,0,1,1,0,0
SOAD18698,Flumevale,Yes,Water Supply,Earth,5.846,0.1,10082.497214526473,2016,,0.06107,34.72242016570097,Uncontrolled,,6,7.87,Low,Not Rated,,0.0848,43.6,152.9,39.7,5.846,0.1,0,,1,,0,Unknow,0,0,1,1,0,0
SOAD20039,Flumevale,Yes,Irrigation,Earth,14.177,0.118,25900.0,1951,,0.03546,7.98987,Uncontrolled,06/10/2021,6,27.05,Low,Fair,2007-03-27,0.0452,23.1,271.2,44.6,14.177,0.118,0,25900.0,0,10.1620368569809,0,Unknow,0,0,0,0,0,0
SOAD11232,Flumevale,Yes,Irrigation,Earth,5.124,0.183,11154.0,1964,,0.0591,221.05307,,08/04/1993,6,17.02,Low,Unsatisfactory,2011-12-14,0.0948,22.4,276.8,4.2,5.124,0.183,0,11154.0,0,9.31964310686663,0,Unknow,0,0,0,0,0,0
SOAD11301,Flumevale,Yes,Debris Control,Earth,11.519,0.421,62151.69685997503,1963,,0.10441,33.449637016761486,,09/08/2022,1,0.0,High,Satisfactory,2017-09-01,0.0903,15.1,445.9,20.044105094060754,11.519,0.421,0,,1,,0,Unknow,0,0,1,1,0,0
SOAD17914,Flumevale,Yes,Irrigation,Earth,3.553,0.157,4564.0,1910,,0.07486,39.049555073083624,,,6,25.73,Low,Not Rated,,0.0398,44.9,96.6,34.9,3.553,0.157,0,4564.0,0,8.42617379302907,0,Unknow,0,0,0,1,0,0
SOAD00630,Flumevale,Yes,Flood Risk Reduction,Earth,9.682,0.2,66672.0,1887,,0.02364,31.747922991518166,Uncontrolled,09/10/2012,3,0.0,Low,Not Rated,,0.0879,43.0,795.3,20.596715960737594,9.682,0.2,0,66672.0,0,11.1075553523499,0,Unknow,0,0,0,1,0,0
SOAD01724,Flumevale,Yes,Irrigation,Earth,4.739,0.083,10028.75913503501,1890,,0.08668,35.03379722930952,,13/08/1987,6,21.08,Low,Not Rated,,0.0499,37.6,135.0,47.2,4.739,0.083,0,,1,,0,Unknow,0,0,1,1,0,0
SOAD06608,Flumevale,Yes,Irrigation,Earth,10.583,0.133,7327.0,1947,,0.04334,33.86025693574633,,08/06/2022,6,27.67,Low,Not Rated,,0.0774,14.2,144.8,25.8,10.583,0.133,0,7327.0,0,8.89945790635397,0,Unknow,0,0,0,1,0,0
SOAD07257,Flumevale,Yes,Irrigation,Earth,3.432,0.525,42481.0,1906,,0.08668,41.93847923243626,,25/09/2013,6,8.42,Low,Not Rated,,0.0583,10.4,389.6,36.7,3.432,0.525,0,42481.0,0,10.6568357357868,0,Unknow,0,0,0,1,0,0
SOAD08758,Flumevale,Yes,Fish and Wildlife Pond,Earth,5.407,0.138,14921.0,1912,2002S,0.09504428559031468,7.98987,Uncontrolled,29/06/2017,10,18.04,Low,Not Rated,,0.0246,19.0,150.5,18.98698258737661,5.407,0.138,0,14921.0,0,9.61059191303146,1,2002,0,0,0,0,1,0
SOAD09490,Flumevale,Yes,Irrigation,Earth,8.589,0.143,29600.0,1976,,0.04728,2.66329,,28/09/2021,0.5,0.0,Low,Satisfactory,2017-09-01,0.0631,31.9,197.6,29.2,8.589,0.143,0,29600.0,0,10.2955634235253,0,Unknow,0,0,0,0,0,0
SOAD10127,Flumevale,Yes,Water Supply,Earth,13.952,0.158,17500.0,1978,,0.05122,31.857508612601922,,14/03/2022,1,56.24792873205745,Significant,Satisfactory,2017-09-01,0.1065,23.1,39.5,33.9,13.952,0.158,0,17500.0,0,9.77001330113616,0,Unknow,0,0,0,1,0,1
SOAD12250,Flumevale,Yes,Water Supply,Earth,14.537,0.098,19700.0,1953,,0.03349,35.057721363855656,,02/11/2021,1,1.0596881389386583,High,Satisfactory,2017-09-01,0.0805,29.5,598.1,9.7,14.537,0.098,0,19700.0,0,9.88842467485908,0,Unknow,0,0,0,1,0,1
SOAD12595,Flumevale,Yes,Irrigation,Earth,7.749,0.15,12000.0,1986,,0.03546,35.20885541167841,,01/01/1997,0,31.46,Low,Not Rated,,0.0572,29.0,140.8,38.8,7.749,0.15,0,12000.0,0,9.39274525863144,0,Unknow,0,0,0,1,0,0
SOAD15349,Flumevale,Yes,Hydroelectric,Earth,5.196,0.524,42788.631704248335,1896,,0.0591,34.231575328316296,Uncontrolled,05/09/2023,3,28.45,Low,Satisfactory,2023-09-29,0.0645,17.4,377.9,51.6,5.196,0.524,0,,1,,0,Unknow,0,0,1,1,0,0
SOAD16688,Flumevale,Yes,Debris Control,Earth,16.117,0.189,158000.0,1961,,0.02561,10.65316,,01/12/2021,1,0.0,High,Satisfactory,2017-09-01,0.0979,17.5,360.8,18.121442231476504,16.117,0.189,0,158000.0,0,11.970356641103,0,Unknow,0,0,0,0,0,0
SOAD19569,Flumevale,Yes,"Fire Protection, Stock, Or Small Fish Pond",Earth,9.602,0.275,27367.483596971655,Unknow,,0.09653,32.18855458154864,,15/11/1979,0,21.61,Low,Fair,2021-05-28,0.0827,10.5,160.3,21.108368900424683,9.602,0.275,0,,1,,0,Unknow,0,0,1,1,0,0
SOAD02757,Flumevale,Yes,Irrigation,Earth,4.22,0.163,13367.0,1936,1977;1993,0.06501,7.98987,Uncontrolled,06/10/2016,6,1.61,Low,Satisfactory,2017-02-16,0.039,4.8,250.9,13.9,4.22,0.163,0,13367.0,0,9.50061907027523,2,1993,0,0,0,0,0,0
SOAD09642,Flumevale,Yes,Water Supply,Earth,38.852,0.207,93600.0,1960,,0.02561,31.846454421110643,,16/03/2022,1,0.8744999817197657,High,Satisfactory,2017-09-01,0.0987,29.8,507.7,27.1,38.852,0.207,0,93600.0,0,11.4467963461693,0,Unknow,0,0,0,1,0,1
SOAD12162,Flumevale,Yes,Other,Earth,11.199,0.25,26600.0,1951,,0.06501,10.65316,,18/04/2022,0.5,49.09926335402009,Low,Satisfactory,2017-09-01,0.0631,31.9,17.4,21.84403919951906,11.199,0.25,0,26600.0,0,10.1887040880481,0,Unknow,0,0,0,0,0,1
SOAD15107,Flumevale,Yes,Irrigation,Earth,7.122,0.067,3333.0,1904,1945,0.04334,42.13211322997442,Uncontrolled,09/06/2021,6,16.81,Low,Not Rated,,0.0468,17.0,113.9,34.3,7.122,0.067,0,3333.0,0,8.11192806331074,1,1945,0,0,0,1,0,0
SOAD06515,Flumevale,Yes,Water Supply,Earth,11.314,0.1,31700.0,1955,,0.05122,7.98987,,16/06/2022,0.5,53.37114995128904,Low,Satisfactory,2017-09-01,0.0746,33.8,13.4,54.8,11.314,0.1,0,31700.0,0,10.3641035051091,0,Unknow,0,0,0,0,0,1
SOAD07547,Flumevale,Yes,Irrigation,Earth,4.633,0.069,9838.431859115075,1930,,0.05319,34.98416023371062,Uncontrolled,24/08/1987,6,112.68,Low,Fair,2008-08-18,0.0678,44.9,148.2,40.1,4.633,0.069,0,,1,,0,Unknow,0,0,1,1,0,0
SOAD08870,Flumevale,Yes,Irrigation,Earth,9.731,0.13,7389.0,1914,,0.04334,34.62277,Uncontrolled,30/07/1998,0,41.75,Low,Fair,2018-09-05,0.0879,46.4,58.1,41.8,9.731,0.13,0,7389.0,0,8.90788301394225,0,Unknow,0,0,0,0,0,0
SOAD09694,Flumevale,No,"Fire Protection, Stock, Or Small Fish Pond",Earth,2.816,0.21,4107.0,1955,,0.10983023085970657,44.22089316499071,Uncontrolled,14/08/2008,10,55.94626515117351,Low,Not Rated,,0.0323,7.9,16.1,19.95519003154954,2.816,0.21,0,4107.0,0,8.32069157104845,0,Unknow,0,0,0,1,1,1
SOAD11408,Flumevale,Yes,Water Supply,Earth,29.116,0.2,190000.0,1988,,0.09456,34.91767732092385,,21/06/2022,1,13.07,High,Satisfactory,2017-09-01,0.1056,22.6,136.9,34.2,29.116,0.2,0,190000.0,0,12.1547846142867,0,Unknow,0,0,0,1,0,0
SOAD12038,Flumevale,Yes,Water Supply,Earth,6.186,0.27,15095.0,1939,,0.09653,32.758278165319766,,08/06/2022,0.5,49.87395532371707,Low,Satisfactory,2017-09-01,0.0572,33.1,13.0,62.3,6.186,0.27,0,15095.0,0,9.62218508704839,0,Unknow,0,0,0,1,0,1
SOAD12732,Flumevale,Yes,Irrigation,Earth,4.21,0.12,5973.0,1964,,0.06698,226.37965,,08/04/1993,6,17.84,Low,Fair,2011-11-01,0.0656,45.1,243.7,20.0,4.21,0.12,0,5973.0,0,8.69517199877606,0,Unknow,0,0,0,0,0,0
SOAD14050,Flumevale,Yes,"Fire Protection, Stock, Or Small Fish Pond",Earth,4.674,0.374,28935.622708832125,1903,,0.05122,53.2658,,15/11/1979,0,30.41,Low,Fair,2021-09-21,0.083,32.6,220.6,12.146785364536159,4.674,0.374,0,,1,,0,Unknow,0,0,1,0,0,0
SOAD17380,Flumevale,Yes,Flood Risk Reduction,Earth,10.527,0.867,59500.0,1964,,0.19306,13.31645,,17/02/2022,1,0.16,High,Satisfactory,2017-09-01,0.0976,19.6,744.3,19.18934369345651,10.527,0.867,0,59500.0,0,10.9937483981152,0,Unknow,0,0,0,0,0,0
SOAD18167,Flumevale,Yes,Irrigation,Earth,16.724,0.297,91000.0,1961,2006,0.03349,32.56522808306458,Uncontrolled,01/11/2020,1,15.04,High,Not Available,,0.1111,29.1,300.4,20.1,16.724,0.297,0,91000.0,0,11.4186257744496,1,2006,0,0,0,1,0,0
SOAD19075,Flumevale,Yes,Irrigation,Earth,4.124,0.367,28851.188961677562,1915,,0.07683,32.724341175699834,Uncontrolled,21/09/2013,6,1.58,Low,Fair,2019-07-23,0.0704,17.5,400.7,32.0,4.124,0.367,0,,1,,0,Unknow,0,0,1,1,0,0
SOAD20004,Flumevale,Yes,Water Supply,Earth,3.757,0.193,16370.969451516401,1923,,0.28762,29.29619,,15/06/2022,0.5,77.57098140551565,Low,Satisfactory,2017-09-01,0.0726,323.2,8.7,29.9,3.757,0.193,0,,1,,0,Unknow,0,0,1,0,0,1
SOAD01199,Flumevale,Yes,Water Supply,Earth,10.594,0.167,33877.66084841539,1980,,0.03349,31.747922991518166,Uncontrolled,29/04/2021,2,0.0,Significant,Fair,2021-04-29,0.1319,31.8,639.0,36.2,10.594,0.167,0,,1,,0,Unknow,0,0,1,1,0,0
SOAD03321,Flumevale,Yes,Irrigation,Earth,2.789,0.2,6005.0,1890,,0.12411,53.04151600143332,,,6,14.63,Low,Not Rated,,0.049,26.9,97.1,4.0,2.789,0.2,0,6005.0,0,8.70051424854327,0,Unknow,0,0,0,1,0,0
SOAD09169,Flumevale,Yes,Irrigation,Earth,4.482,0.35,18649.0,1908,,0.06698,32.795352348212816,,20/05/1985,6,15.82,Low,Not Rated,,0.0882,23.8,458.4,42.8,4.482,0.35,0,18649.0,0,9.83360142507196,0,Unknow,0,0,0,1,0,0
SOAD11213,Flumevale,Yes,Irrigation,Earth,3.628,0.025,44725.0,1894,,0.06501,1996.3496231744523,Uncontrolled,02/08/2022,2,8.21,Significant,Satisfactory,2022-08-02,0.1109,39.1,423.5,31.4,3.628,0.025,0,44725.0,0,10.7083102669867,0,Unknow,0,0,0,1,0,0
SOAD11619,Flumevale,Yes,Irrigation,Earth,4.095,0.14,7965.0,1915,,0.03152,35.15594848209296,,,6,11.76,Low,Satisfactory,2014-04-15,0.0557,31.9,179.2,42.2,4.095,0.14,0,7965.0,0,8.98293776374159,0,Unknow,0,0,0,1,0,0
SOAD16907,Flumevale,Yes,Fish and Wildlife Pond,Earth,10.969,0.067,25780.0,1956,,0.05713,32.15574505579004,Uncontrolled,01/07/2015,6,52.1,Low,Fair,2021-06-18,0.0537,7.0,52.5,23.325051960824894,10.969,0.067,0,25780.0,0,10.1573930655004,0,Unknow,0,0,0,1,0,0
SOAD00237,Flumevale,Yes,Irrigation,Earth,7.602,0.147,22816.0,1898,,0.0394,7.98987,Uncontrolled,27/09/2005,6,8.03,Low,Not Rated,,0.051,9.0,296.1,40.9,7.602,0.147,0,22816.0,0,10.0352611511456,0,Unknow,0,0,0,0,0,0
SOAD02756,Flumevale,Yes,Irrigation,Earth,9.321,0.179,20464.09704235189,1959,,0.05713,21.30632,,05/03/1987,0,231.6,Low,Satisfactory,2016-04-19,0.0732,40.9,91.1,17.5,9.321,0.179,0,,1,,0,Unknow,0,0,1,0,0,0
SOAD05230,Flumevale,Yes,Fish and Wildlife Pond,Earth,3.173,0.133,7111.0,1904,,0.07486,37.21631154134111,,25/09/2013,6,46.71,Low,Not Rated,,0.0594,15.3,199.8,20.624691133216583,3.173,0.133,0,7111.0,0,8.86953877719374,0,Unknow,0,0,0,1,0,0
SOAD06780,Flumevale,Yes,"Fire Protection, Stock, Or Small Fish Pond",Earth,6.952,0.1,10536.30870910636,1979,,0.07486,7.98987,,16/09/1992,0,17.91,Low,Fair,2017-06-23,0.0885,10.9,296.1,17.84627781361981,6.952,0.1,0,,1,,0,Unknow,0,0,1,0,0,0
SOAD10233,Flumevale,Yes,"Fire Protection, Stock, Or Small Fish Pond",Earth,2.911,0.141,11144.033324772674,1901,,0.06107,37.253624967958565,,17/07/1978,0,27.98,Low,Satisfactory,2021-09-09,0.0811,36.1,456.3,19.49533775588296,2.911,0.141,0,,1,,0,Unknow,0,0,1,1,0,0
SOAD13423,Flumevale,Yes,Irrigation,Earth,2.84,0.71,17111.0,1893,,0.08274,53.82616041847941,,,6,3.22,Low,Not Rated,,0.0321,19.8,460.4,27.8,2.84,0.71,0,17111.0,0,9.74753525076224,0,Unknow,0,0,0,1,0,0
SOAD15912,Flumevale,Yes,Water Supply,Earth,9.311,0.123,13846.847417770436,1953,,0.06501,5.32658,,27/05/2022,0.5,70.58273355543844,Low,Satisfactory,2017-09-01,0.0598,19.1,9.4,47.5,9.311,0.123,0,,1,,0,Unknow,0,0,1,0,0,1
SOAD19383,Flumevale,Yes,Irrigation,Earth,5.704,0.397,30117.67235946542,1895,,0.06698,34.31705444333014,,08/08/2019,6,3.3,Low,Not Rated,,0.0978,7.3,373.2,16.4,5.704,0.397,0,,1,,0,Unknow,0,0,1,1,0,0
SOAD03570,Flumevale,Yes,"Fire Protection, Stock, Or Small Fish Pond",Earth,11.539,0.272,38989.41540379926,1963,,0.0591,7.98987,,05/03/1987,0,117.07,Low,Fair,2016-10-19,0.0949,10.6,148.4,18.682787029582116,11.539,0.272,0,,1,,0,Unknow,0,0,1,0,0,0
SOAD04219,Flumevale,Yes,Other,Earth,12.592,0.083,24936.252403164846,Unknow,,0.0730303401283039,32.528256251918776,,25/05/2023,0.5,10.89,Low,Fair,2018-07-11,0.0831,12.3,195.5,22.256656363390423,12.592,0.083,0,,1,,0,Unknow,0,0,1,1,1,0
SOAD08825,Flumevale,Yes,Debris Control,Earth,16.8,0.389,339400.0,1997,,0.05122,2.66329,,23/02/2022,0.5,54.89859400645648,Low,Satisfactory,2017-09-01,0.0628,29.0,18.1,18.4320163539512,16.8,0.389,0,339400.0,0,12.7349375781539,0,Unknow,0,0,0,0,0,1
SOAD10164,Flumevale,Yes,Water Supply,Earth,11.693,0.067,22900.224366647137,1885,,0.0788,2.66329,,14/06/2023,0.5,72.34751312867711,Low,Fair,2017-09-01,0.0899,25.7,16.3,54.0,11.693,0.067,0,,1,,0,Unknow,0,0,1,0,0,1
SOAD10317,Flumevale,Yes,Water Supply,Earth,8.351,0.646,78297.0,2002,,0.04137,58.178218682351215,,23/09/2021,1,1.08,Significant,Satisfactory,2017-09-01,0.1099,10.5,272.1,7.1,8.351,0.646,0,78297.0,0,11.2682773388685,0,Unknow,0,0,0,1,0,0
SOAD10623,Flumevale,Yes,Water Supply,Earth,4.161,0.4,4000.0,1912,,0.28565,122.51134,,09/09/2021,0.5,45.29851288186284,Low,Satisfactory,2017-09-01,0.0717,438.3,8.8,53.6,4.161,0.4,0,4000.0,0,8.29429960885724,0,Unknow,0,0,0,0,0,1
SOAD11708,Flumevale,Yes,Flood Risk Reduction,Earth,9.946,0.142,9560.0,1956,,0.04925,33.702311318008576,Uncontrolled,01/11/2011,3,8.24,Low,Fair,2017-07-13,0.0773,36.3,179.2,21.022775114431923,9.946,0.142,0,9560.0,0,9.16544760308545,0,Unknow,0,0,0,1,0,0
SOAD12803,Flumevale,Yes,Irrigation,Earth,6.006,0.128,10622.129557866047,1960,,0.04137,45.87604539511314,Uncontrolled,16/05/2018,6,43.36,Low,Satisfactory,2019-08-22,0.0495,5.8,189.2,8.0,6.006,0.128,0,,1,,0,Unknow,0,0,1,1,0,0
SOAD13966,Flumevale,Yes,Irrigation,Earth,8.288,0.268,30055.0,1956,,0.06501,33.78838804137531,,06/10/2022,6,19.21,Low,Not Rated,,0.0554,28.4,147.3,39.4,8.288,0.268,0,30055.0,0,10.3108175872538,0,Unknow,0,0,0,1,0,0
SOAD17186,Flumevale,Yes,Water Supply,Earth,11.88,0.147,27961.0,1949,,0.06501,2.66329,,28/07/2022,0.5,45.52628919856709,Low,Satisfactory,2017-09-01,0.0616,15.4,12.8,10.0,11.88,0.147,0,27961.0,0,10.2386017245478,0,Unknow,0,0,0,0,0,1
SOAD18288,Flumevale,Yes,Unknow,Earth,11.116,1.0663277933597581,487248.8035925859,1948,,0.06107,674.6284436313736,,,0,82.24088945566245,Low,Fair,2020-08-13,0.0914,28.6,19.0,16.297332748616622,11.116,,1,,1,,0,Unknow,0,1,1,1,0,1
SOAD18611,Flumevale,Yes,Water Supply,Earth,25.916,0.323,5600.0,1964,,0.04137,30.588350202312572,,26/07/2022,1,1.58,High,Satisfactory,2017-09-01,0.0941,23.1,901.8,10.4,25.916,0.323,0,5600.0,0,8.63070043220983,0,Unknow,0,0,0,1,0,0
SOAD20358,Flumevale,Yes,Irrigation,Earth,3.668,0.067,9838.431859115075,1946,,0.10047,7.98987,Uncontrolled,28/06/1990,6,45.95,Low,Not Rated,,0.0789,14.0,226.1,13.4,3.668,0.067,0,,1,,0,Unknow,0,0,1,0,0,0
SOAD05876,Flumevale,Yes,Irrigation,Earth,3.49,0.8,48672.0,1892,,0.12017,34.810977631914426,,09/03/1993,6,15.61,Low,Not Rated,,0.1063,42.5,179.6,40.1,3.49,0.8,0,48672.0,0,10.7928797405416,0,Unknow,0,0,0,1,0,0
SOAD07321,Flumevale,Yes,Irrigation,Earth,15.523,0.25,88989.0,1983,2001,0.04137,32.15574505579004,,23/07/2019,6,45.13,Low,Not Rated,,0.0546,14.2,188.6,27.3,15.523,0.25,0,88989.0,0,11.3962792828509,1,2001,0,0,0,1,0,0
SOAD11794,Flumevale,Yes,Water Supply,Earth,11.525,0.24,18000.0,1969,,0.0591,13.31645,,24/05/2022,0.5,59.46907175293025,Low,Satisfactory,2017-09-01,0.0849,17.8,18.0,23.3,11.525,0.24,0,18000.0,0,9.7981825908907,0,Unknow,0,0,0,0,0,1
SOAD16819,Flumevale,No,Fish and Wildlife Pond,Earth,11.926,0.267,43097.346600124685,1972,,0.10047,32.52082868430352,Uncontrolled,09/05/2023,4,54.77,Low,Poor,2023-05-09,0.0882,43.8,218.4,22.058946562122575,11.926,0.267,0,,1,,0,Unknow,0,0,1,1,0,0
SOAD18062,Flumevale,Yes,Irrigation,Earth,6.804,0.15,11854.913472015905,Unknow,,0.07092,15.97974,Uncontrolled,28/10/2016,6,29.67,Low,Not Rated,,0.0553,20.7,291.3,45.9,6.804,0.15,0,,1,,0,Unknow,0,0,1,0,0,0
SOAD19956,Flumevale,Yes,Water Supply,Earth,12.262,0.134,24700.0,1951,,0.07486,2.66329,,28/07/2022,1,8.13,High,Satisfactory,2017-09-01,0.0925,20.9,179.2,35.4,12.262,0.134,0,24700.0,0,10.1145990076265,0,Unknow,0,0,0,0,0,0
SOAD01872,Flumevale,Yes,"Fire Protection, Stock, Or Small Fish Pond",Earth,9.544,0.075,11163.0,1974,,0.05122,21.30632,Uncontrolled,04/06/2015,6,30.94,Low,Unsatisfactory,2013-10-11,0.0968,11.1,219.8,20.493926005579286,9.544,0.075,0,11163.0,0,9.32044959465621,0,Unknow,0,0,0,0,0,0
SOAD03895,Flumevale,Yes,Water Supply,Earth,10.876,0.25,36779.259041046775,1882,,0.03546,31.908319266425522,,19/10/2021,0.5,105.96473970546555,Low,Satisfactory,2017-09-01,0.0707,9.9,5.8,39.2,10.876,0.25,0,,1,,0,Unknow,0,0,1,1,0,1
SOAD05037,Flumevale,Yes,Recreation,Earth,13.392,0.118,16000.0,2006,,0.04334,21.30632,Uncontrolled,06/08/2010,0,64.38,Low,Satisfactory,2021-06-07,0.0593,10.7,52.6,3.2,13.392,0.118,0,16000.0,0,9.68040649926887,0,Unknow,0,0,0,0,0,0
SOAD06332,Flumevale,Yes,Irrigation,Earth,4.117,0.25,15088.0,1918,,0.08668,33.177699544613674,Uncontrolled,15/10/2020,6,9.36,Low,Satisfactory,2013-09-26,0.0502,45.7,277.2,34.2,4.117,0.25,0,15088.0,0,9.62172128051365,0,Unknow,0,0,0,1,0,0
SOAD07862,Flumevale,No,Unknow,Earth,7.176,0.093,10642.447468494483,1956,,0.04728,34.62490568398774,,06/12/2022,Unknow,11.424148993359012,Significant,Not Available,,0.1486,41.6,295.4,21.23811770298344,7.176,0.093,0,,1,,0,Unknow,0,0,1,1,0,1
SOAD09846,Flumevale,Yes,Water Supply,Earth,7.643,0.022,4867.0,1888,,0.03152,583.8955812161896,Uncontrolled,12/05/2020,6,1.69,Low,Fair,2017-02-21,0.0614,36.6,416.8,25.5,7.643,0.022,0,4867.0,0,8.49043845410742,0,Unknow,0,0,0,1,0,0
SOAD13567,Flumevale,Yes,Flood Risk Reduction,Earth,20.192,0.183,76000.0,1979,1996,0.01773,5.32658,Uncontrolled,20/10/2011,2,4.81,Low,Not Available,,0.0989,41.2,744.9,18.61762218762995,20.192,0.183,0,76000.0,0,11.2385017770766,1,1996,0,0,0,0,0,0
SOAD18492,Flumevale,Yes,Water Supply,Earth,5.974,0.043,5211.0,1940,,0.05319,39.89492046330808,,29/09/2022,6,54.06,Low,Satisfactory,2017-06-26,0.039,42.8,211.3,32.2,5.974,0.043,0,5211.0,0,8.55871893824474,0,Unknow,0,0,0,1,0,0
SOAD07869,Flumevale,Yes,Irrigation,Earth,5.693,0.328,33320.0,1946,,0.06895,33.35002699817814,,01/10/1984,6,3.35,Low,Not Rated,,0.0501,30.3,653.8,35.6,5.693,0.328,0,33320.0,0,10.4139431078352,0,Unknow,0,0,0,1,0,0
SOAD11950,Flumevale,No,Hydroelectric,Earth,7.149,0.868,53011.77753778257,1911,,0.12656856641040934,40.118753519124,Uncontrolled,07/09/2017,3,11.21,Low,Poor,2023-09-29,0.0974,9.7,404.8,71.7,7.149,0.868,0,,1,,0,Unknow,0,0,1,1,1,0
SOAD16179,Flumevale,Yes,Irrigation,Earth,4.282,0.025,28835.78391155719,1889,,0.08668,1398.9815392211174,,17/01/1974,0,0.0,Low,Fair,2016-08-29,0.0791,19.7,595.5,24.1,4.282,0.025,0,,1,,0,Unknow,0,0,1,1,0,0
SOAD16261,Flumevale,Yes,Irrigation,Earth,4.074,0.167,13979.621206854967,1921,,0.12805,32.985084122761414,Uncontrolled,13/08/1987,6,21.75,Low,Unsatisfactory,2013-11-05,0.0901,31.4,355.0,39.4,4.074,0.167,0,,1,,0,Unknow,0,0,1,1,0,0
SOAD17018,Flumevale,Yes,Other,Earth,17.678,0.433,155000.0,1971,,0.05122,36.75486196505858,,23/06/2022,0.5,59.268934108206544,Low,Satisfactory,2017-09-01,0.0692,6.3,14.7,19.50150227773961,17.678,0.433,0,155000.0,0,11.9511868474935,0,Unknow,0,0,0,1,0,1
SOAD18547,Flumevale,Yes,Water Supply,Earth,10.168,0.324,27200.0,2004,,0.04334,32.18800156083066,Uncontrolled,27/05/2021,2,44.6279961778769,Significant,Satisfactory,2021-05-27,0.1216,6.4,94.5,24.4,10.168,0.324,0,27200.0,0,10.2110090163142,0,Unknow,0,0,0,1,0,1
SOAD18634,Flumevale,Yes,Flood Risk Reduction,Earth,9.027,0.167,17798.500659117642,1971,,0.06698,7.98987,,15/12/1993,0,119.24,Low,Satisfactory,2008-05-28,0.0695,21.6,87.9,19.944074887323893,9.027,0.167,0,,1,,0,Unknow,0,0,1,0,0,0
SOAD02907,Flumevale,Yes,Irrigation,Earth,4.902,0.533,80641.0,1895,,0.06107,34.011785578491924,Uncontrolled,29/04/2021,2,15.61,Significant,Satisfactory,2021-04-29,0.1241,8.9,221.2,22.8,4.902,0.533,0,80641.0,0,11.2977748845849,0,Unknow,0,0,0,1,0,0
SOAD08067,Flumevale,Yes,Recreation,Earth,3.664,0.083,10010.690517769921,1966,,0.0394,44.5056651052837,,27/08/1979,6,35.41,Low,Not Rated,,0.0839,43.6,170.4,9.3,3.664,0.083,0,,1,,0,Unknow,0,0,1,1,0,0
SOAD09907,Flumevale,Yes,Unknow,Earth,6.11,0.633,47546.530719603994,1952,,0.10441,33.67857787971127,Uncontrolled,19/07/1988,0,4.68,Low,Fair,2017-09-25,0.0909,7.4,445.2,21.66128857955923,6.11,0.633,0,,1,,0,Unknow,0,0,1,1,0,0
SOAD15330,Flumevale,Yes,Debris Control,Earth,14.063,0.43,93000.0,1963,,0.08077,13.31645,,19/05/2022,0.5,52.53425109047709,Low,Satisfactory,2017-09-01,0.0657,43.8,5.8,18.216523786088217,14.063,0.43,0,93000.0,0,11.4403655247658,0,Unknow,0,0,0,0,0,1
SOAD04945,Flumevale,No,"Fire Protection, Stock, Or Small Fish Pond",Earth,3.244,0.25,7626.0,1954,,0.1463733880992807,59.9338085544333,Uncontrolled,14/08/2008,10,56.26508397753763,Low,Not Rated,,0.0539,7.7,8.5,14.419329920966678,3.244,0.25,0,7626.0,0,8.93944986216424,0,Unknow,0,0,0,1,1,1
SOAD17630,Flumevale,Yes,Flood Risk Reduction,Earth,10.449,0.208,20990.0,1957,,0.04925,31.747922991518166,Uncontrolled,10/04/2014,3,4.71,Low,Fair,2020-09-15,0.0926,31.6,540.1,20.871124966372776,10.449,0.208,0,20990.0,0,9.95184905341401,0,Unknow,0,0,0,1,0,0
SOAD19828,Flumevale,Yes,Flood Risk Reduction,Earth,10.576,0.116,19010.0,1957,,0.05122,32.15574505579004,Uncontrolled,07/10/2020,6,18.33,Low,Fair,2020-09-15,0.0516,21.2,277.0,21.438398379046724,10.576,0.116,0,19010.0,0,9.85277303799163,0,Unknow,0,0,0,1,0,0
SOAD20638,Flumevale,Yes,Debris Control,Earth,10.811,0.566,121700.0,1991,,0.04137,33.52845669668446,,20/04/2022,1,0.16,High,Satisfactory,2017-09-01,0.0999,13.2,518.3,19.77595746236792,10.811,0.566,0,121700.0,0,11.7093224958687,0,Unknow,0,0,0,1,0,0
SOAD00524,Flumevale,Yes,Flood Risk Reduction,Earth,10.964,0.153,21000.0,1956,,0.06895,7.98987,,28/06/2022,0.5,50.055959662954116,Low,Satisfactory,2017-09-01,0.0684,34.7,19.9,19.651934476826693,10.964,0.153,0,21000.0,0,9.95232533461943,0,Unknow,0,0,0,0,0,1
SOAD02248,Flumevale,Yes,Irrigation,Earth,5.4,0.217,22010.0,Unknow,1976,0.03349,33.05913096497626,Uncontrolled,28/08/2020,6,6.56,Low,Satisfactory,2019-06-19,0.05,39.2,468.5,27.6,5.4,0.217,0,22010.0,0,9.9992976073821,1,1976,0,0,0,1,0,0
SOAD03768,Flumevale,Yes,Recreation,Earth,5.222,0.117,5072.0,1926,1952S;1968S;1999S,0.06107,7.98987,Uncontrolled,19/06/2001,6,14.26,Low,Satisfactory,2016-08-17,0.051,19.5,205.1,3.1,5.222,0.117,0,5072.0,0,8.53168763756669,3,1999,0,0,0,0,0,0
SOAD06316,Flumevale,Yes,Water Supply,Earth,18.205,0.093,37600.0,1964,,0.04925,7.98987,,08/11/2021,1,15.412195557088113,Significant,Satisfactory,2021-11-12,0.1088,30.9,193.0,23.1,18.205,0.093,0,37600.0,0,10.534785924769,0,Unknow,0,0,0,0,0,1
SOAD06843,Flumevale,Yes,Recreation,Earth,2.494,0.058,8762.0,1906,,0.08077,204.8693575784259,,25/09/2013,6,44.71,Low,Not Rated,,0.0381,8.2,231.8,9.2,2.494,0.058,0,8762.0,0,9.07829359105585,0,Unknow,0,0,0,1,0,0
SOAD07685,Flumevale,Yes,"Fire Protection, Stock, Or Small Fish Pond",Earth,4.292,0.233,11200.0,1950,,0.08077,7.98987,,27/07/1979,6,28.91,Low,Satisfactory,2013-07-25,0.0416,8.6,169.2,18.797673380558432,4.292,0.233,0,11200.0,0,9.32375833901174,0,Unknow,0,0,0,0,0,0
SOAD12185,Flumevale,Yes,Flood Risk Reduction,Earth,29.546,0.133,46960.0,1876,,0.03152,2.66329,,23/06/2022,1,0.8,High,Satisfactory,2017-09-01,0.0864,13.2,396.2,17.860329491178657,29.546,0.133,0,46960.0,0,10.7570727489942,0,Unknow,0,0,0,0,0,0
SOAD13773,Flumevale,Yes,Flood Risk Reduction,Earth,6.392,0.417,37494.121794794875,1990,,0.08668,7.98987,Uncontrolled,11/12/2018,3,1.69,Low,Not Rated,,0.1204,18.8,234.3,20.100682881704817,6.392,0.417,0,,1,,0,Unknow,0,0,1,0,0,0
SOAD16462,Flumevale,Yes,Irrigation,Earth,4.736,0.21,400.0,1931,,0.07683,40.369122892764196,,15/10/1984,6,31.12,Low,Satisfactory,2017-09-06,0.0441,30.4,197.9,13.6,4.736,0.21,0,400.0,0,5.99396142730657,0,Unknow,0,0,0,1,0,0
SOAD20032,Flumevale,Yes,Water Supply,Earth,7.224,0.173,15665.0,1966,,0.12805,7.98987,,08/09/2021,0.5,49.70744539237117,Low,Satisfactory,2017-09-01,0.0755,43.8,15.3,15.0,7.224,0.173,0,15665.0,0,9.65924803792718,0,Unknow,0,0,0,0,0,1
SOAD03048,Flumevale,Yes,Irrigation,Earth,8.063,0.05,6790.0,1911,,0.12411,36.31741856541285,Uncontrolled,06/08/2015,6,18.09,Low,Fair,2017-05-25,0.0493,36.9,452.5,16.3,8.063,0.05,0,6790.0,0,8.82335348511379,0,Unknow,0,0,0,1,0,0
SOAD05618,Flumevale,Yes,Debris Control,Earth,34.609,0.156,214800.0,1978,,0.04334,26.6329,,20/04/2022,1,1.56,High,Satisfactory,2017-09-01,0.1041,25.5,613.3,20.590706431091796,34.609,0.156,0,214800.0,0,12.2774672970995,0,Unknow,0,0,0,0,0,0
SOAD06371,Flumevale,Yes,Irrigation,Earth,4.868,0.2,15902.0,1961,,0.03152,32.48646497622081,,27/07/1979,6,36.86,Low,Fair,2020-10-29,0.0726,35.5,205.4,26.6,4.868,0.2,0,15902.0,0,9.67426304965592,0,Unknow,0,0,0,1,0,0
SOAD06526,Flumevale,Yes,Irrigation,Earth,4.344,0.2,10657.0,1900,,0.11032,13.31645,,26/09/2013,6,6.18,Low,Satisfactory,2019-04-03,0.0492,43.3,243.2,39.1,4.344,0.2,0,10657.0,0,9.27406606285673,0,Unknow,0,0,0,0,0,0
SOAD08835,Flumevale,Yes,Water Supply,Earth,12.337,0.3,52000.0,1986,,0.0925899999999999,32.125829282727814,,23/03/2022,1,0.0,High,Satisfactory,2017-09-01,0.0852,15.2,660.3,57.2,12.337,0.3,0,52000.0,0,10.8590182281479,0,Unknow,0,0,0,1,0,0
SOAD10963,Flumevale,Yes,Water Supply,Earth,8.898,0.133,13543.659272079138,1983,,0.04925,33.74305062201528,,07/03/2023,1,18.89139466913241,Significant,Fair,2017-09-01,0.1353,46.6,201.6,69.9,8.898,0.133,0,,1,,0,Unknow,0,0,1,1,0,1
SOAD12950,Flumevale,Yes,Other,Earth,5.263,1.097,33339.0,1934,,0.10441,45.27593,,05/01/2022,1,0.63,High,Satisfactory,2017-09-01,0.0931,18.8,388.5,18.63532121897244,5.263,1.097,0,33339.0,0,10.4145131563048,0,Unknow,0,0,0,0,0,0
SOAD02295,Flumevale,Yes,Fish and Wildlife Pond,Earth,5.325,0.2,15557.0,1948,,0.11032,13.31645,,01/08/1988,0,35.06,Low,Fair,2022-10-06,0.094,44.4,192.4,19.0489138174819,5.325,0.2,0,15557.0,0,9.65233025476672,0,Unknow,0,0,0,0,0,0
SOAD09223,Flumevale,Yes,Water Supply,Earth,14.584,0.125,36800.0,Unknow,,0.05122,5.32658,,01/03/2022,1,3.02,Significant,Satisfactory,2017-09-01,0.1134,25.2,202.1,30.1,14.584,0.125,0,36800.0,0,10.5132802977009,0,Unknow,0,0,0,0,0,0
SOAD09352,Flumevale,Yes,Water Supply,Earth,21.908,0.098,24000.0,1950,,0.04334,5.32658,,09/02/2023,1,23.832463810129067,Significant,Poor,2023-06-29,0.1569,19.2,134.6,6.7,21.908,0.098,0,24000.0,0,10.0858507751287,0,Unknow,0,0,0,0,0,1
SOAD12682,Flumevale,Yes,Irrigation,Earth,4.28,0.173,15042.974405403245,1951,,0.08077,32.913870045252885,,29/08/1979,6,5.02,Low,Fair,2019-06-14,0.0587,23.2,389.0,37.6,4.28,0.173,0,,1,,0,Unknow,0,0,1,1,0,0
SOAD13074,Flumevale,Yes,Other,Earth,11.311,0.06,21109.381058472864,1978,2008,0.0591,13.31645,Uncontrolled,18/08/2021,2,50.49,Significant,Satisfactory,2021-08-18,0.1074,8.0,114.0,19.83097316147868,11.311,0.06,0,,1,,1,2008,0,0,1,0,0,0
SOAD14062,Flumevale,Yes,Irrigation,Earth,9.961,0.157,13362.0,1926,2002,0.05122,7.98987,Uncontrolled,27/08/2021,2,7.77,Significant,Fair,2021-08-27,0.1243,15.1,327.9,26.8,9.961,0.157,0,13362.0,0,9.50024497278106,1,2002,0,0,0,0,0,0
SOAD15565,Flumevale,Yes,Irrigation,Earth,6.745,0.149,22460.0,1907,,0.04334,33.008772187998005,,23/07/2015,6,20.13,Low,Satisfactory,2013-09-25,0.0568,24.0,427.0,15.0,6.745,0.149,0,22460.0,0,10.0195357508988,0,Unknow,0,0,0,1,0,0
SOAD18883,Flumevale,Yes,Recreation,Earth,8.674,0.028,1951.0,1965,,0.0591,69.1896157489728,Uncontrolled,27/09/2009,10,0.0,Low,Not Rated,,0.056,31.8,258.5,3.1,8.674,0.028,0,1951.0,0,7.57660976697304,0,Unknow,0,0,0,1,0,0
SOAD01611,Flumevale,Yes,Irrigation,Earth,2.721,0.45,42846.99019057806,1870,,0.04334,7.98987,,08/03/1991,0,12.31,Low,Not Rated,,0.1217,28.8,257.0,36.2,2.721,0.45,0,,1,,0,Unknow,0,0,1,0,0,0
SOAD03830,Flumevale,Yes,Fish and Wildlife Pond,Earth,6.954,0.067,10338.904686111571,1910,,0.08471,34.213881304886606,,26/09/2016,6,29.43,Low,Not Rated,,0.0654,10.2,301.1,21.8098807962222,6.954,0.067,0,,1,,0,Unknow,0,0,1,1,0,0
SOAD05609,Flumevale,Yes,Water Supply,Earth,6.093,0.117,3400.0,1978,,0.07683,2.66329,,02/06/2022,0.5,53.6046845317427,Low,Satisfactory,2017-09-01,0.0739,43.4,18.8,32.6,6.093,0.117,0,3400.0,0,8.1318247850072,0,Unknow,0,0,0,0,0,1
SOAD07474,Flumevale,Yes,Debris Control,Earth,16.367,0.388,55000.0,1975,,0.12608,806.97687,,28/03/2022,1,0.9606322104119185,High,Satisfactory,2017-09-01,0.1086,43.8,694.5,15.807425236733774,16.367,0.388,0,55000.0,0,10.9151066458675,0,Unknow,0,0,0,0,0,1
SOAD09279,Flumevale,Yes,Water Supply,Earth,19.75,0.168,47000.0,1964,,0.04925,2.66329,,22/09/2021,1,2.46,High,Satisfactory,2017-09-01,0.0847,31.2,537.4,13.9,19.75,0.168,0,47000.0,0,10.7579241570616,0,Unknow,0,0,0,0,0,0
SOAD11372,Flumevale,Yes,Flood Risk Reduction,Earth,10.229,0.203,23170.0,1958,,0.05713,31.747922991518166,Uncontrolled,25/07/2013,3,4.76,Low,Not Rated,,0.0847,37.8,151.9,21.16887383059225,10.229,0.203,0,23170.0,0,10.0506567757527,0,Unknow,0,0,0,1,0,0
SOAD11926,Flumevale,Yes,Recreation,Earth,5.889,0.053,9885.09319153168,1909,,0.06895,40.954889232607705,,07/08/1990,0,48.0,Low,Fair,2021-07-23,0.0865,29.0,119.8,8.4,5.889,0.053,0,,1,,0,Unknow,0,0,1,1,0,0
SOAD00911,Flumevale,Yes,Recreation,Earth,11.292,0.18,34815.55899411976,1939,,0.0591,7.98987,,14/10/2020,6,78.94,Low,Fair,2015-05-26,0.0531,45.5,173.7,2.9,11.292,0.18,0,,1,,0,Unknow,0,0,1,0,0,0
SOAD01005,Flumevale,Yes,Flood Risk Reduction,Earth,9.171,0.124,6916.0,1971,,0.05713,7.98987,Uncontrolled,17/11/2020,3,4.81,Low,Unsatisfactory,2014-06-05,0.1186,14.2,95.5,20.1369852255964,9.171,0.124,0,6916.0,0,8.84173742860058,0,Unknow,0,0,0,0,0,0
SOAD06667,Flumevale,Yes,Water Supply,Earth,7.158,0.143,12086.345829183134,Unknow,,0.16351,35.11588780756626,,16/02/2023,1,1.0853023594465812,High,Fair,2017-09-01,0.1039,25.1,721.3,62.5,7.158,0.143,0,,1,,0,Unknow,0,0,1,1,0,1
SOAD08964,Flumevale,Yes,Water Supply,Earth,8.246,0.679,53000.0,1979,,0.05122,35.46332189562267,,30/11/2021,1,0.16,High,Satisfactory,2017-09-01,0.0939,22.8,414.5,16.8,8.246,0.679,0,53000.0,0,10.8780660602808,0,Unknow,0,0,0,1,0,0
SOAD10286,Flumevale,Yes,Recreation,Earth,3.124,0.283,21394.3615685563,1930,,0.06895,66.65369112617611,,26/07/1979,6,5.05,Low,Not Rated,,0.0916,34.5,129.7,8.2,3.124,0.283,0,,1,,0,Unknow,0,0,1,1,0,0
SOAD13088,Flumevale,Yes,Irrigation,Earth,3.429,0.107,14982.0,1888,,0.06107,40.435548284224396,Uncontrolled,15/08/1991,6,8.38,Low,Not Rated,,0.0626,35.6,147.0,15.4,3.429,0.107,0,14982.0,0,9.61467150404314,0,Unknow,0,0,0,1,0,0
SOAD19208,Flumevale,Yes,Water Supply,Earth,10.147,0.2,40000.0,1970,,0.04925,2.66329,,02/08/2022,1,0.843227944332098,High,Satisfactory,2017-09-01,0.1044,13.5,642.9,31.8,10.147,0.2,0,40000.0,0,10.5966597327836,0,Unknow,0,0,0,0,0,1
SOAD20007,Flumevale,Yes,Water Supply,Earth,6.513,0.07,2332.0,1954,,0.13987,34.77013131153879,,27/04/2022,1,5.84,Significant,Satisfactory,2017-09-01,0.1309,46.5,344.6,41.9,6.513,0.07,0,2332.0,0,7.75491027202143,0,Unknow,0,0,0,1,0,0
SOAD01936,Flumevale,Yes,Fish and Wildlife Pond,Earth,7.296,0.07,9402.0,1889,,0.0591,34.237236119092735,Uncontrolled,29/08/2019,6,61.95,Low,Fair,2018-10-22,0.0593,25.0,234.2,22.89398536615525,7.296,0.07,0,9402.0,0,9.14878406627708,0,Unknow,0,0,0,1,0,0
SOAD08196,Flumevale,Yes,Irrigation,Earth,5.548,0.11,10274.44632503649,1932,,0.04728,34.235759937956004,Uncontrolled,14/06/1994,0,21.46,Low,Fair,2014-10-09,0.0753,23.4,420.8,28.0,5.548,0.11,0,,1,,0,Unknow,0,0,1,1,0,0
SOAD13292,Flumevale,Yes,Irrigation,Earth,6.442,0.109,12246.0,1904,,0.02364,15.97974,,01/01/1997,0,6.73,Low,Fair,2022-07-12,0.072,26.7,185.5,28.6,6.442,0.109,0,12246.0,0,9.41303628802129,0,Unknow,0,0,0,0,0,0
SOAD13649,Flumevale,Yes,Irrigation,Earth,3.281,0.1,10045.718748776535,1903,,0.08471,103.86831,,26/10/1979,0,35.45,Low,Not Rated,,0.0563,18.4,165.7,23.9,3.281,0.1,0,,1,,0,Unknow,0,0,1,0,0,0
SOAD01221,Flumevale,Yes,Irrigation,Earth,5.863,0.067,4139.0,1914,1966S,0.08274,34.62277,Uncontrolled,08/05/2019,6,4.78,Low,Satisfactory,2020-10-15,0.0392,30.7,147.8,36.7,5.863,0.067,0,4139.0,0,8.32845106681936,1,1966,0,0,0,0,0,0
SOAD07644,Flumevale,Yes,Water Supply,Earth,17.754,0.2,92997.57813982415,1961,,0.04925,2.66329,,14/03/2022,0.5,101.92193800960736,Low,Satisfactory,2017-09-01,0.0692,29.8,17.0,61.1,17.754,0.2,0,,1,,0,Unknow,0,0,1,0,0,1
SOAD11188,Flumevale,Yes,Irrigation,Earth,8.366,0.108,5777.0,1950,,0.03546,36.171108930037256,Uncontrolled,03/08/2017,6,10.78,Low,Fair,2013-09-24,0.0499,46.3,266.1,14.8,8.366,0.108,0,5777.0,0,8.66181288102618,0,Unknow,0,0,0,1,0,0
SOAD13983,Flumevale,Yes,Irrigation,Earth,4.116,0.5,42831.886146498604,1971,,0.12608,53.2658,,09/11/1976,0,13.26,Low,Satisfactory,2020-10-06,0.0656,25.8,220.5,39.1,4.116,0.5,0,,1,,0,Unknow,0,0,1,0,0,0
SOAD16856,Flumevale,Yes,Water Supply,Earth,13.633,0.1,40000.0,1971,,0.06698,32.21261083237478,,11/01/2022,0.5,53.08386885340541,Low,Satisfactory,2017-09-01,0.0776,23.9,12.3,69.1,13.633,0.1,0,40000.0,0,10.5966597327836,0,Unknow,0,0,0,1,0,1
SOAD19167,Flumevale,No,"Fire Protection, Stock, Or Small Fish Pond",Earth,9.088,0.117,4167.0,1965,,0.0906199999999999,34.20535370119739,Uncontrolled,09/05/2023,4,20.23,Low,Poor,2023-05-09,0.0556,30.4,311.4,21.316882193839024,9.088,0.117,0,4167.0,0,8.3351915834332,0,Unknow,0,0,0,1,0,0
SOAD20414,Flumevale,Yes,Other,Earth,15.041,0.087,46572.0,1951,,0.03349,2.66329,,22/07/2021,1,0.0,Significant,Satisfactory,2017-09-01,0.1194,41.0,104.8,20.13407940955112,15.041,0.087,0,46572.0,0,10.7487762530556,0,Unknow,0,0,0,0,0,0
SOAD01801,Flumevale,Yes,Flood Risk Reduction,Earth,7.163,0.367,14840.0,1998,,0.08274,2.66329,,20/04/2022,1,0.16,High,Satisfactory,2017-09-01,0.0772,19.7,757.5,17.7765873502464,7.163,0.367,0,14840.0,0,9.60514889989582,0,Unknow,0,0,0,0,0,0
SOAD06345,Flumevale,Yes,Irrigation,Earth,3.298,0.733,46178.04732758421,1910,,0.15957,39.16056440195364,,23/10/1990,6,1.67,Low,Not Rated,,0.0781,41.6,566.8,23.3,3.298,0.733,0,,1,,0,Unknow,0,0,1,1,0,0
SOAD07529,Flumevale,Yes,Other,Earth,8.836,0.241,22250.0,1967,,0.0886499999999999,31.81064829033899,,10/08/2022,1,56.1166799358057,Significant,Satisfactory,2017-09-01,0.1252,34.9,55.1,21.77234046056958,8.836,0.241,0,22250.0,0,10.0101422304047,0,Unknow,0,0,0,1,0,1
SOAD01566,Flumevale,Yes,Water Supply,Earth,13.165,0.117,23315.0,1959,,0.07683,2.66329,,12/11/2021,0.5,53.124384216826144,Low,Satisfactory,2017-09-01,0.0716,24.8,21.0,54.8,13.165,0.117,0,23315.0,0,10.0568950991654,0,Unknow,0,0,0,0,0,1
SOAD02060,Flumevale,Yes,Irrigation,Earth,3.397,0.2,13830.0,1902,,0.13987,40.221414656438974,,31/07/1980,6,4.73,Low,Fair,2003-05-15,0.0746,32.7,610.2,17.5,3.397,0.2,0,13830.0,0,9.53466772862471,0,Unknow,0,0,0,1,0,0
SOAD03225,Flumevale,Yes,Other,Earth,8.222,0.533,49166.18839046492,2008,,0.04334,44.58298445993535,Uncontrolled,17/05/2017,6,90.91638398202223,Low,Satisfactory,2019-08-17,0.0414,6.9,9.7,17.79154422934898,8.222,0.533,0,,1,,0,Unknow,0,0,1,1,0,1
SOAD04218,Flumevale,Yes,Irrigation,Earth,5.717,0.117,10676.0,1964,,0.06501,13.31645,,09/08/2017,6,19.79,Low,Unsatisfactory,2016-06-14,0.0835,21.3,450.7,41.3,5.717,0.117,0,10676.0,0,9.2758471741783,0,Unknow,0,0,0,0,0,0
SOAD05633,Flumevale,Yes,Flood Risk Reduction,Earth,9.983,0.147,18050.0,1965,,0.06501,7.98987,,11/04/2018,3,40.5,Low,Unsatisfactory,2016-12-02,0.1271,36.4,228.5,20.73183409886944,9.983,0.147,0,18050.0,0,9.80095636388846,0,Unknow,0,0,0,0,0,0
SOAD07211,Flumevale,Yes,Water Supply,Earth,17.573,1.2,452745.4361921212,1999,,0.0886499999999999,251.02779659522994,,16/09/2021,0.5,95.17882567813662,Low,Satisfactory,2017-09-01,0.075,16.8,13.0,26.6,17.573,1.2,0,,1,,0,Unknow,0,0,1,1,0,1
SOAD13719,Flumevale,Yes,Unknow,Earth,6.634,0.533,18661.0,Unknow,,0.10698279249239062,34.49941110746859,Uncontrolled,21/08/2019,1,0.0,High,Not Rated,,0.1118,24.9,271.9,21.878657388254233,6.634,0.533,0,18661.0,0,9.83424464979397,0,Unknow,0,0,0,1,1,0
SOAD20302,Flumevale,No,Fish and Wildlife Pond,Earth,3.053,0.413,29950.599695280667,1965,,0.1315216840151715,5.32658,Controlled,07/09/2010,10,105.65735685185201,Low,Not Rated,,0.0027,20.4,17.0,16.84812204058045,3.053,0.413,0,,1,,0,Unknow,0,0,1,0,1,1
SOAD00908,Flumevale,Yes,Flood Risk Reduction,Earth,3.944,0.567,48023.07608474965,2006,,0.08471,21.30632,Uncontrolled,,3,0.0,Significant,Not Rated,,0.1384,28.4,185.6,19.94843702143554,3.944,0.567,0,,1,,0,Unknow,0,0,1,0,0,0
SOAD01929,Flumevale,No,"Fire Protection, Stock, Or Small Fish Pond",Earth,18.651,0.197,124278.96457933167,1900,1978,0.03152,31.846454421110643,Uncontrolled,23/06/2017,3,0.0,Low,Fair,2017-06-23,0.0748,40.0,783.2,21.955991034929742,18.651,0.197,0,,1,,1,1978,0,0,1,1,0,0
SOAD06688,Flumevale,Yes,"Fire Protection, Stock, Or Small Fish Pond",Earth,7.444,0.148,15427.0,1896,,0.05713,40.50083211196688,Uncontrolled,25/05/2017,6,4.73,Low,Not Rated,,0.0427,30.4,875.0,18.567546247603623,7.444,0.148,0,15427.0,0,9.64393931932812,0,Unknow,0,0,0,1,0,0
SOAD07054,Flumevale,Yes,Irrigation,Earth,6.359,0.1,10132.820776630806,1898,,0.00788,41.484432961187906,Uncontrolled,,0,16.59,Low,Fair,2018-07-11,0.0688,16.5,130.4,29.9,6.359,0.1,0,,1,,0,Unknow,0,0,1,1,0,0
SOAD12258,Flumevale,Yes,Irrigation,Earth,6.389,0.267,22639.887725617038,1951,,0.07486,29.29619,,,0,97.39,Low,Fair,2016-09-30,0.0865,40.6,114.4,39.2,6.389,0.267,0,,1,,0,Unknow,0,0,1,0,0,0
SOAD13446,Flumevale,Yes,Water Supply,Earth,24.145,0.104,34130.0,1947,,0.04137,104.49039957106214,,03/11/2021,1,1.08,High,Satisfactory,2017-09-01,0.0909,45.9,843.5,28.4,24.145,0.104,0,34130.0,0,10.4379613412078,0,Unknow,0,0,0,1,0,0
SOAD13710,Flumevale,Yes,Water Supply,Earth,12.566,0.17,24000.0,1961,,0.04728,33.442245112973794,,24/08/2022,1,4.75,High,Satisfactory,2017-09-01,0.0903,11.9,866.7,14.5,12.566,0.17,0,24000.0,0,10.0858507751287,0,Unknow,0,0,0,1,0,0
SOAD18990,Flumevale,Yes,Flood Risk Reduction,Earth,7.463,0.32,12813.0,1998,,0.05122,7.98987,Uncontrolled,14/12/2018,3,0.0,Significant,Satisfactory,2018-12-14,0.1196,17.4,422.9,18.1981024332751,7.463,0.32,0,12813.0,0,9.45829360219897,0,Unknow,0,0,0,0,0,0
SOAD00315,Flumevale,Yes,"Fire Protection, Stock, Or Small Fish Pond",Earth,8.807,0.25,24992.255913112556,1943,,0.04925,7.98987,,11/05/1998,6,18.55,Low,Not Rated,,0.0511,46.3,177.3,17.86083567716331,8.807,0.25,0,,1,,0,Unknow,0,0,1,0,0,0
SOAD00415,Flumevale,Yes,Recreation,Earth,9.721,0.227,18638.0,1968,,0.07289,271.65558,,,6,81.95,Low,Fair,2013-09-24,0.0653,24.2,112.5,5.8,9.721,0.227,0,18638.0,0,9.8330114387318,0,Unknow,0,0,0,0,0,0
SOAD08493,Flumevale,Yes,Irrigation,Earth,3.953,1.25,83317.88998403346,1972,,0.11623,173.41685678711298,,27/08/1986,6,32.58,Low,Not Rated,,0.0458,31.8,191.4,26.5,3.953,1.25,0,,1,,0,Unknow,0,0,1,1,0,0
SOAD11538,Flumevale,Yes,Water Supply,Earth,14.719,0.047,7750.0,1955,,0.06895,2.66329,,19/08/2022,1,1.61,High,Satisfactory,2017-09-01,0.0853,39.1,755.9,18.0,14.719,0.047,0,7750.0,0,8.95557714628151,0,Unknow,0,0,0,0,0,0
SOAD12593,Flumevale,Yes,Tailings,Earth,3.527,0.6,39539.0,1991,,0.07486,34.70246545182526,,15/07/2022,1,59.11419280864189,Significant,Fair,2017-09-01,0.1302,31.8,34.4,22.65115928919209,3.527,0.6,0,39539.0,0,10.5850680967246,0,Unknow,0,0,0,1,0,1
SOAD13525,Flumevale,Yes,Irrigation,Earth,13.2,0.139,36789.72706606301,1906,,0.05122,90.3019133105999,Uncontrolled,29/09/2015,6,30.04,Low,Not Rated,,0.0456,37.5,213.3,1.0,13.2,0.139,0,,1,,0,Unknow,0,0,1,1,0,0
SOAD03379,Flumevale,Yes,Recreation,Earth,3.381,0.233,24535.0,1878,,0.10638,54.228134543839126,Uncontrolled,03/11/1999,6,12.66,Low,Fair,2022-10-18,0.0525,16.3,198.2,5.5,3.381,0.233,0,24535.0,0,10.1078967057941,0,Unknow,0,0,0,1,0,0
SOAD09129,Flumevale,Yes,Flood Risk Reduction,Earth,6.154,0.853,57494.261386402526,2005,,0.05713,35.001656318388115,Uncontrolled,08/08/2019,3,0.0,Significant,Satisfactory,2019-08-08,0.117,39.8,404.3,21.838435151044788,6.154,0.853,0,,1,,0,Unknow,0,0,1,1,0,0
SOAD09691,Flumevale,Yes,Water Supply,Earth,6.08,0.333,22270.0,1990,,0.07683,2.66329,,21/06/2022,0.5,55.361902877177634,Low,Satisfactory,2017-09-01,0.0805,46.9,18.8,20.8,6.08,0.333,0,22270.0,0,10.0110406627009,0,Unknow,0,0,0,0,0,1
SOAD13514,Flumevale,Yes,Recreation,Earth,18.489,0.093,17585.0,1974,,0.05122,37.28606,Uncontrolled,22/10/2020,6,9.7,Low,Fair,2019-09-03,0.0584,44.6,125.5,4.5,18.489,0.093,0,17585.0,0,9.77485840993895,0,Unknow,0,0,0,0,0,0
SOAD19199,Flumevale,Yes,Water Supply,Earth,11.405,0.083,8000.0,1955,,0.0906199999999999,5.32658,,17/02/2022,1,1.1741211662883682,High,Satisfactory,2017-09-01,0.077,42.8,777.6,45.4,11.405,0.083,0,8000.0,0,8.98732181285012,0,Unknow,0,0,0,0,0,1
SOAD19878,Flumevale,Yes,Recreation,Earth,11.025,0.104,30940.389651780657,1966,,0.06107,15.97974,Uncontrolled,01/10/2019,6,24.36,Low,Satisfactory,2016-03-30,0.0471,31.8,458.7,5.0,11.025,0.104,0,,1,,0,Unknow,0,0,1,0,0,0
SOAD04862,Flumevale,Yes,Other,Earth,12.231,0.175,13000.0,1951,,0.04925,33.156645913131996,,09/03/2022,0.5,53.807178073561374,Low,Satisfactory,2017-09-01,0.0653,5.6,17.7,23.035794327979694,12.231,0.175,0,13000.0,0,9.47278155656217,0,Unknow,0,0,0,1,0,1
SOAD04887,Flumevale,Yes,Other,Earth,4.266,0.117,3350.0,1872,,0.26989,53.26728294673158,,14/09/2021,0.5,42.354244994292436,Low,Satisfactory,2017-09-01,0.0602,429.6,8.0,15.6672548499486,4.266,0.117,0,3350.0,0,8.11701408773731,0,Unknow,0,0,0,1,0,1
SOAD05129,Flumevale,Yes,Irrigation,Earth,7.192,0.25,31608.0,1951,,0.08077,170.45056,Uncontrolled,21/11/2022,6,19.2,Low,Not Rated,,0.0536,27.0,378.3,8.3,7.192,0.25,0,31608.0,0,10.3611971691509,0,Unknow,0,0,0,0,0,0
SOAD05361,Flumevale,Yes,Irrigation,Earth,10.673,0.333,40604.463590589075,1980,,0.07486,13.31645,,01/06/1989,0,42.14,Low,Not Rated,,0.0853,22.9,90.2,19.8,10.673,0.333,0,,1,,0,Unknow,0,0,1,0,0,0
SOAD05530,Flumevale,Yes,Water Supply,Earth,15.545,0.142,50000.0,1987,,0.05713,2.66329,,27/04/2022,1,1.0466452099639922,High,Satisfactory,2017-09-01,0.1109,23.8,550.2,47.8,15.545,0.142,0,50000.0,0,10.8197982842103,0,Unknow,0,0,0,0,0,1
SOAD11904,Flumevale,Yes,Recreation,Earth,2.769,0.256,24063.0,1974,,0.08077,60.954849886050326,Uncontrolled,22/06/2022,2,0.0,Significant,Satisfactory,2022-06-22,0.1139,44.1,661.7,6.8,2.769,0.256,0,24063.0,0,10.0884722267496,0,Unknow,0,0,0,1,0,0
SOAD12691,Flumevale,Yes,Irrigation,Earth,12.25,0.172,20800.0,1971,,0.04334,31.81064829033899,Uncontrolled,23/07/2019,6,45.02,Low,Not Rated,,0.0792,29.9,121.5,34.2,12.25,0.172,0,20800.0,0,9.94275634145683,0,Unknow,0,0,0,1,0,0
SOAD12953,Flumevale,Yes,Irrigation,Earth,5.762,0.333,25811.0,1896,,0.06895,55.02667090482812,,27/06/2018,6,26.9,Low,Unsatisfactory,2019-07-05,0.1062,13.0,402.4,2.0,5.762,0.333,0,25811.0,0,10.1585947790557,0,Unknow,0,0,0,1,0,0
SOAD14411,Flumevale,Yes,Water Supply,Earth,26.199,0.167,330000.0,1941,,0.08077,23.96961,,16/02/2022,1,1.56,High,Satisfactory,2017-09-01,0.0839,31.9,162.3,63.5,26.199,0.167,0,330000.0,0,12.7068509637411,0,Unknow,0,0,0,0,0,0
SOAD16152,Flumevale,Yes,Recreation,Earth,12.683,0.103,16374.0,1964,,0.04728,114.52147,Uncontrolled,15/06/2021,6,4.94,Low,Not Rated,,0.0829,9.0,312.5,4.4,12.683,0.103,0,16374.0,0,9.70351106050345,0,Unknow,0,0,0,0,0,0
SOAD16255,Flumevale,Yes,Other,Earth,11.323,0.733,68633.78720930948,1982,,0.03152,33.78629557909187,,,0,15.49,Low,Unsatisfactory,2012-10-11,0.108,31.5,143.7,21.998056950125257,11.323,0.733,0,,1,,0,Unknow,0,0,1,1,0,0
SOAD06752,Flumevale,Yes,Irrigation,Earth,4.089,0.1,5689.0,1965,,0.14775,239.6961,Uncontrolled,09/11/1999,6,14.22,Low,Fair,2011-11-01,0.0682,14.8,331.4,4.3,4.089,0.1,0,5689.0,0,8.64646552712038,0,Unknow,0,0,0,0,0,0
SOAD06819,Flumevale,Yes,Unknow,Earth,7.345,1.4696737176605006,831302.1754399022,Unknow,,2.6310201945959637,767.1837968283695,,12/05/2022,1,1.3058290387068292,High,Unsatisfactory,2021-02-23,0.1301,486.4,658.4,17.442712607952473,7.345,,1,,1,,0,Unknow,0,1,1,1,1,1
SOAD11832,Flumevale,Yes,Recreation,Earth,9.714,0.154,17726.202727287327,1950,,0.05122,7.98987,,15/04/2019,6,0.0,Low,Fair,2007-06-22,0.0675,25.5,583.0,7.1,9.714,0.154,0,,1,,0,Unknow,0,0,1,0,0,0
SOAD13216,Flumevale,Yes,Irrigation,Earth,10.17,0.118,30186.0,1918,,0.04137,31.81064829033899,Uncontrolled,16/07/2015,6,75.49,Low,Not Rated,,0.0885,40.2,65.2,28.5,10.17,0.118,0,30186.0,0,10.3151666471108,0,Unknow,0,0,0,1,0,0
SOAD16606,Flumevale,Yes,Irrigation,Earth,9.149,0.25,46286.0,1966,2006,0.06698,58.94714452396113,Uncontrolled,01/06/2022,2,0.0,Significant,Satisfactory,2022-06-01,0.1237,45.6,668.5,3.7,9.149,0.25,0,46286.0,0,10.7426164231111,1,2006,0,0,0,1,0,0
SOAD19953,Flumevale,Yes,Irrigation,Earth,9.81,0.313,31876.18988980053,1893,,0.06698,37.332345862609124,,11/10/2011,6,16.85,Low,Not Rated,,0.0457,46.0,229.1,39.3,9.81,0.313,0,,1,,0,Unknow,0,0,1,1,0,0
SOAD00867,Flumevale,Yes,Fish and Wildlife Pond,Earth,4.006,0.207,17608.400506593527,1960,,0.07683,32.423739677399986,Controlled,,6,3.17,Low,Not Rated,,0.1025,33.4,579.2,20.442293579431407,4.006,0.207,0,,1,,0,Unknow,0,0,1,1,0,0
SOAD02562,Flumevale,Yes,Irrigation,Earth,6.379,0.183,19067.0,1908,,0.03349,31.98841478639612,,18/07/2014,6,38.62,Low,Not Rated,,0.0886,34.2,171.9,41.4,6.379,0.183,0,19067.0,0,9.85576681632472,0,Unknow,0,0,0,1,0,0
SOAD03748,Flumevale,No,Fish and Wildlife Pond,Earth,4.644,0.063,721.0,1904,,0.01773,21.30632,Uncontrolled,20/07/2012,10,1.59,Low,Not Rated,,0.0259,25.6,221.8,18.50488755038022,4.644,0.063,0,721.0,0,6.58202513889283,0,Unknow,0,0,0,0,0,0
SOAD03751,Flumevale,Yes,Water Supply,Earth,7.943,0.043,10908.211051075185,1980,,0.03349,42.61264,Uncontrolled,23/07/1996,0,42.24,Low,Satisfactory,2017-06-26,0.0644,11.2,95.8,34.6,7.943,0.043,0,,1,,0,Unknow,0,0,1,0,0,0
SOAD04940,Flumevale,Yes,Recreation,Earth,18.039,0.111,24382.0,1969,,0.04728,44.507831813698814,Uncontrolled,16/12/2020,6,8.24,Low,Not Rated,,0.0546,7.9,259.0,6.0,18.039,0.111,0,24382.0,0,10.1016414471467,0,Unknow,0,0,0,1,0,0
SOAD06802,Flumevale,Yes,Recreation,Earth,3.997,0.092,10045.718748776535,1933,,0.10047,37.28606,,25/09/1986,6,70.15,Low,Not Rated,,0.0417,39.9,139.2,3.3,3.997,0.092,0,,1,,0,Unknow,0,0,1,0,0,0
SOAD16315,Flumevale,Yes,Flood Risk Reduction,Earth,7.512,1.0,90000.0,1971,,0.22261,5.32658,,17/02/2022,1,0.16,High,Satisfactory,2017-09-01,0.0798,42.3,881.2,19.624388376743134,7.512,1.0,0,90000.0,0,11.4075760603618,0,Unknow,0,0,0,0,0,0
SOAD19281,Flumevale,Yes,Flood Risk Reduction,Earth,12.969,0.123,41258.0,1957,,0.04137,31.747922991518166,Uncontrolled,01/11/2021,3,0.0,Significant,Satisfactory,2021-11-01,0.1224,42.0,432.5,21.717921176450176,12.969,0.123,0,41258.0,0,10.6276245497828,0,Unknow,0,0,0,1,0,0
SOAD19711,Flumevale,Yes,Irrigation,Earth,4.393,0.283,21868.466774727167,1956,,0.1182,42.61264,,,0,57.65,Low,Not Rated,,0.0906,30.3,78.6,40.7,4.393,0.283,0,,1,,0,Unknow,0,0,1,0,0,0
SOAD20049,Flumevale,Yes,Flood Risk Reduction,Earth,10.524,0.167,32629.673948303665,1972,,0.0591,13.31645,Uncontrolled,01/06/2016,3,75.69,Low,Not Rated,,0.1061,34.8,91.7,21.119177056105155,10.524,0.167,0,,1,,0,Unknow,0,0,1,0,0,0
SOAD00458,Flumevale,Yes,Flood Risk Reduction,Earth,9.37,0.214,15541.0,1956,,0.05713,7.98987,Uncontrolled,05/10/2020,6,14.43,Low,Satisfactory,2018-10-25,0.0286,39.7,375.8,18.95022182003535,9.37,0.214,0,15541.0,0,9.65130131576919,0,Unknow,0,0,0,0,0,0
SOAD02534,Flumevale,Yes,Debris Control,Earth,16.972,0.222,155000.0,1961,,0.04334,18.64303,,20/10/2021,1,0.0,High,Satisfactory,2017-09-01,0.089,41.2,508.1,17.87101869486322,16.972,0.222,0,155000.0,0,11.9511868474935,0,Unknow,0,0,0,0,0,0
SOAD05718,Flumevale,Yes,Fish and Wildlife Pond,Earth,6.729,0.107,10294.8952989837,1984,,0.06895,42.61264,Uncontrolled,20/12/2017,6,31.21,Low,Not Rated,,0.0713,25.7,93.4,17.71980960124465,6.729,0.107,0,,1,,0,Unknow,0,0,1,0,0,0
SOAD07209,Flumevale,Yes,Irrigation,Earth,5.995,0.345,27696.97953594652,1944,,0.0886499999999999,57.61652385865371,,09/06/2021,6,159.68,Low,Not Rated,,0.0748,17.9,62.3,2.7,5.995,0.345,0,,1,,0,Unknow,0,0,1,1,0,0
SOAD07417,Flumevale,Yes,Other,Earth,14.924,0.097,21653.0,1909,,0.06107,10.65316,,20/12/2021,1,0.0,High,Satisfactory,2017-09-01,0.0761,12.0,597.9,17.158776010661676,14.924,0.097,0,21653.0,0,9.98294547387084,0,Unknow,0,0,0,0,0,0
SOAD08747,Flumevale,Yes,Water Supply,Earth,5.03,0.5,43287.73151209486,1987,,0.04925,34.37660893071814,,09/09/1994,6,12.7,Low,Satisfactory,2018-09-05,0.0561,18.0,244.1,39.3,5.03,0.5,0,,1,,0,Unknow,0,0,1,1,0,0
SOAD17582,Flumevale,Yes,Flood Risk Reduction,Earth,8.103,0.235,23957.43957427916,1971,,0.07486,31.93775102715126,,15/12/1993,0,148.2,Low,Not Rated,,0.0746,13.3,54.4,22.71542508795433,8.103,0.235,0,,1,,0,Unknow,0,0,1,1,0,0
SOAD17833,Flumevale,No,Recreation,Earth,9.757,0.057,4431.0,1911,,0.08959148236620393,7.98987,Uncontrolled,,Unknow,0.0,Significant,Not Rated,,0.1487,19.9,165.2,6.8,9.757,0.057,0,4431.0,0,8.39660622842712,0,Unknow,0,0,0,0,1,0
SOAD18681,Flumevale,Yes,Water Supply,Earth,18.795,0.163,150000.0,1975,,0.05713,2.66329,,11/02/2022,0.5,58.148326785356474,Low,Satisfactory,2017-09-01,0.0742,10.2,19.0,66.2,18.795,0.163,0,150000.0,0,11.9183972397228,0,Unknow,0,0,0,0,0,1
SOAD19851,Flumevale,Yes,Water Supply,Earth,5.437,0.289,12400.0,1983,,0.12805,2.66329,,20/10/2021,0.5,55.417341346251646,Low,Satisfactory,2017-09-01,0.069,45.3,15.9,8.0,5.437,0.289,0,12400.0,0,9.42553239350277,0,Unknow,0,0,0,0,0,1
SOAD05659,Flumevale,Yes,Flood Risk Reduction,Earth,9.139,0.273,21700.0,1956,,0.06698,7.98987,Uncontrolled,01/11/2011,6,4.94,Low,Satisfactory,2003-10-10,0.0438,17.7,349.3,19.13839108153162,9.139,0.273,0,21700.0,0,9.98511362141607,0,Unknow,0,0,0,0,0,0
SOAD13232,Flumevale,Yes,Water Supply,Earth,15.403,0.163,80000.0,2002,,0.0591,2.66329,,28/09/2021,1,6.19,High,Satisfactory,2017-09-01,0.0988,12.0,190.7,34.7,15.403,0.163,0,80000.0,0,11.2897944135779,0,Unknow,0,0,0,0,0,0
SOAD13457,Flumevale,Yes,Irrigation,Earth,5.753,0.133,10324.0,1916,,0.0985,39.88900608305949,,29/09/2020,6,26.66,Low,Fair,2019-10-01,0.0428,31.6,182.7,37.3,5.753,0.133,0,10324.0,0,9.24232341782923,0,Unknow,0,0,0,1,0,0
SOAD16273,Flumevale,Yes,Irrigation,Earth,6.163,0.107,6933.0,1947,,0.09456,101.20502,,,6,20.6,Low,Unsatisfactory,2017-11-01,0.0851,11.4,286.9,11.1,6.163,0.107,0,6933.0,0,8.84419212624497,0,Unknow,0,0,0,0,0,0
SOAD16642,Flumevale,Yes,Flood Risk Reduction,Earth,8.783,0.201,19326.0,1959,,0.06698,31.747922991518166,Uncontrolled,01/02/2012,3,4.88,Low,Fair,2018-10-18,0.0815,15.5,484.1,20.88769240089619,8.783,0.201,0,19326.0,0,9.86925836098547,0,Unknow,0,0,0,1,0,0
SOAD18765,Flumevale,Yes,Recreation,Earth,3.536,0.062,2253.0,1919,,0.0906199999999999,52.25235906067046,,25/09/2013,6,42.77,Low,Not Rated,,0.0868,7.2,110.5,3.0,3.536,0.062,0,2253.0,0,7.72046169459972,0,Unknow,0,0,0,1,0,0
SOAD01260,Flumevale,Yes,Other,Earth,17.269,0.733,132584.08476919838,1982,,0.03546,37.07141945370317,,25/06/2002,6,15.98,Low,Not Rated,,0.0495,26.7,386.3,21.175282305217387,17.269,0.733,0,,1,,0,Unknow,0,0,1,1,0,0
SOAD05685,Flumevale,Yes,Recreation,Earth,10.728,0.148,40691.0,1940,,0.04728,46.90362081880586,,29/09/2022,6,49.73,Low,Not Rated,,0.0549,38.4,184.1,4.8,10.728,0.148,0,40691.0,0,10.6137867919136,0,Unknow,0,0,0,1,0,0
SOAD11282,Flumevale,Yes,Irrigation,Earth,8.051,0.143,12743.664347928534,1913,,0.06895,45.858960842138956,Uncontrolled,29/07/1991,0,38.54,Low,Not Rated,,0.0878,26.1,219.8,5.0,8.051,0.143,0,,1,,0,Unknow,0,0,1,1,0,0
SOAD15677,Flumevale,Yes,Water Supply,Earth,13.114,0.25,10250.0,1938,,0.03546,30.26928156048567,Uncontrolled,19/05/2022,1,3.28,High,Satisfactory,2022-05-19,0.0741,35.1,920.5,14.8,13.114,0.25,0,10250.0,0,9.2351305407834,0,Unknow,0,0,0,1,0,0
SOAD16366,Flumevale,Yes,Unknow,Earth,9.525,0.4,38948.747653310544,1986,2009,0.0394,33.41811208527019,Uncontrolled,31/03/2022,2,1.66,Significant,Satisfactory,2022-03-31,0.1161,9.3,456.6,20.120217259617405,9.525,0.4,0,,1,,1,2009,0,0,1,1,0,0
SOAD16797,Flumevale,Yes,Water Supply,Earth,6.791,0.25,14800.0,1955,,0.0985,5.32658,,22/07/2022,1,5.62,High,Satisfactory,2017-09-01,0.0971,10.0,207.4,22.2,6.791,0.25,0,14800.0,0,9.60245002503719,0,Unknow,0,0,0,0,0,0
SOAD19201,Flumevale,Yes,Flood Risk Reduction,Earth,4.301,1.502,81700.0,1981,,0.16942,7.98987,,10/03/2022,1,0.16,High,Satisfactory,2017-09-01,0.0851,42.0,186.8,20.504809774221933,4.301,1.502,0,81700.0,0,11.3108215206753,0,Unknow,0,0,0,0,0,0
SOAD00338,Flumevale,Yes,Recreation,Earth,5.034,0.158,15800.0,1967,,0.02955,44.89761008900001,Uncontrolled,01/05/2019,5,6.34,Low,Not Available,,0.0766,36.6,464.4,4.8,5.034,0.158,0,15800.0,0,9.6678285081515,0,Unknow,0,0,0,1,0,0
SOAD04062,Flumevale,Yes,Irrigation,Earth,8.821,0.06,2738.0,1895,,0.04925,7.98987,Uncontrolled,26/07/2022,6,12.34,Low,Satisfactory,2019-08-08,0.0436,40.7,381.0,33.2,8.821,0.06,0,2738.0,0,7.91534816926308,0,Unknow,0,0,0,0,0,0
SOAD08113,Flumevale,Yes,Water Supply,Earth,12.387,0.681,246200.0,1996,,0.04137,51.05179170092067,,30/11/2021,1,0.16,High,Satisfactory,2017-09-01,0.0963,32.2,399.0,48.5,12.387,0.681,0,246200.0,0,12.4139035544627,0,Unknow,0,0,0,1,0,0
SOAD10429,Flumevale,Yes,Irrigation,Earth,6.545,0.267,22703.90482206364,1919,,0.06501,65.56349367795345,,28/10/1987,0,16.7,Low,Not Rated,,0.097,40.3,333.8,4.4,6.545,0.267,0,,1,,0,Unknow,0,0,1,1,0,0
SOAD11811,Flumevale,Yes,Water Supply,Earth,10.307,0.203,21000.0,1925,,0.11229,7.98987,,11/01/2022,0.5,9.763345450616846,Significant,Satisfactory,2017-09-01,0.1333,23.3,253.7,66.5,10.307,0.203,0,21000.0,0,9.95232533461943,0,Unknow,0,0,0,0,0,1
SOAD14294,Flumevale,Yes,Irrigation,Earth,6.229,0.62,66136.0,1907,,0.12017,34.05084560880495,,24/09/2013,6,3.09,Low,Fair,2015-08-06,0.0669,21.5,201.3,40.0,6.229,0.62,0,66136.0,0,11.0994836271762,0,Unknow,0,0,0,1,0,0
SOAD14525,Flumevale,Yes,Irrigation,Earth,7.734,0.217,22417.256493080524,2002,2007,0.03546,13.31645,,,0,1.61,Low,Not Rated,,0.1085,45.6,316.6,25.1,7.734,0.217,0,,1,,1,2007,0,0,1,0,0,0
SOAD20421,Flumevale,Yes,Flood Risk Reduction,Earth,7.892,0.391,5755.0,1966,,0.16154,7.98987,Uncontrolled,23/10/2001,3,0.0,Low,Fair,2021-10-25,0.0846,16.3,571.4,18.384278711156107,7.892,0.391,0,5755.0,0,8.65799806800726,0,Unknow,0,0,0,0,0,0
SOAD02963,Flumevale,Yes,Irrigation,Earth,2.69,0.86,23785.0,1907,,0.14775,143.64915000095445,,,6,3.06,Low,Not Rated,,0.0423,26.6,876.0,47.1,2.69,0.86,0,23785.0,0,10.0768524512872,0,Unknow,0,0,0,1,0,0
SOAD04610,Flumevale,Yes,Recreation,Earth,5.991,1.2195484425166203,1428746.5857176357,1983,,0.06895,1610.8064779305694,Uncontrolled,,0,1.63,Low,Fair,2018-08-08,0.0691,20.2,808.7,6.6,5.991,,1,,1,,0,Unknow,0,1,1,1,0,0
SOAD05192,Flumevale,Yes,Irrigation,Earth,5.468,0.193,17343.739347350813,1940,,0.08668,32.423739677399986,,19/08/1991,6,8.11,Low,Not Rated,,0.1037,13.1,156.0,23.7,5.468,0.193,0,,1,,0,Unknow,0,0,1,1,0,0
SOAD05899,Flumevale,Yes,Water Supply,Earth,8.408,0.183,17280.0,1947,,0.14381,32.80813587298982,,25/08/2022,0.5,51.35178158748697,Low,Satisfactory,2017-09-01,0.0803,6.4,15.6,12.0,8.408,0.183,0,17280.0,0,9.75736291105399,0,Unknow,0,0,0,1,0,1
SOAD06440,Flumevale,Yes,Fish and Wildlife Pond,Earth,5.344,0.08,8534.0,1913,,0.914181601369559,102.1098257639997,Uncontrolled,01/09/2015,0,10.75,High,Not Available,,0.101,593.0,395.4,17.491616840812597,5.344,0.08,0,8534.0,0,9.05193063522854,0,Unknow,0,0,0,1,1,0
SOAD07723,Flumevale,Yes,Recreation,Earth,12.045,0.667,79008.70455416956,1980,2007,0.05713,51.65552895379298,Uncontrolled,10/06/2020,6,15.69,Low,Satisfactory,2018-11-06,0.0531,17.1,448.9,4.2,12.045,0.667,0,,1,,1,2007,0,0,1,1,0,0
SOAD08648,Flumevale,No,"Fire Protection, Stock, Or Small Fish Pond",Earth,2.383,0.16,12511.343718960166,1890,,0.1887687941158659,199.272616585155,Uncontrolled,31/08/2010,10,69.1405631027478,Low,Not Rated,,0.0554,12.7,15.4,21.515295131903304,2.383,0.16,0,,1,,0,Unknow,0,0,1,1,1,1
SOAD14912,Flumevale,Yes,Other,Earth,13.859,0.25,52600.0,2004,,0.04728,27.324816812336884,,01/11/2021,1,1.22,High,Satisfactory,2017-09-01,0.1066,24.8,852.9,20.698089134584166,13.859,0.25,0,52600.0,0,10.8704904099519,0,Unknow,0,0,0,1,0,0
SOAD00102,Flumevale,Yes,Irrigation,Earth,5.504,0.233,21014.893442947407,1984,,0.06895,36.74240141619303,,22/03/2017,6,32.02,Low,Not Rated,,0.045,6.0,63.2,25.0,5.504,0.233,0,,1,,0,Unknow,0,0,1,1,0,0
SOAD03231,Flumevale,Yes,Irrigation,Earth,5.434,0.683,46825.28252502935,1896,,0.0906199999999999,34.83832867177383,Uncontrolled,11/12/2012,6,70.97,Low,Not Rated,,0.0597,8.6,100.7,20.9,5.434,0.683,0,,1,,0,Unknow,0,0,1,1,0,0
SOAD04143,Flumevale,Yes,Irrigation,Earth,6.371,0.347,28179.500737813258,1909,,0.07092,33.66778880197969,,16/09/1992,0,7.74,Low,Unsatisfactory,2016-09-16,0.1119,47.3,209.5,17.4,6.371,0.347,0,,1,,0,Unknow,0,0,1,1,0,0
SOAD04715,Flumevale,Yes,Water Supply,Earth,12.63,0.302,34200.0,1951,,0.04925,2.66329,,08/04/2022,1,0.0,Significant,Satisfactory,2017-09-01,0.1094,18.9,268.2,65.3,12.63,0.302,0,34200.0,0,10.4400101623893,0,Unknow,0,0,0,0,0,0
SOAD04990,Flumevale,Yes,Fish and Wildlife Pond,Earth,5.448,0.136,24237.0,1908,2002,0.10835,7.98987,Uncontrolled,04/11/2015,6,10.96,Low,Satisfactory,2020-10-15,0.0288,23.7,316.1,19.265195286754228,5.448,0.136,0,24237.0,0,10.0956769285284,1,2002,0,0,0,0,0,0
SOAD08697,Flumevale,Yes,Irrigation,Earth,8.484,0.287,40134.0,1950,,0.06501,32.0999290195802,Uncontrolled,12/07/2022,6,101.5,Low,Not Rated,,0.0886,18.3,143.7,38.9,8.484,0.287,0,40134.0,0,10.6000040505657,0,Unknow,0,0,0,1,0,0
SOAD11138,Flumevale,Yes,Recreation,Earth,12.69,0.186,72218.0,1962,,0.06698,46.87292058975913,Uncontrolled,24/05/2017,6,30.41,Low,Satisfactory,2019-02-14,0.029,21.3,136.3,8.4,12.69,0.186,0,72218.0,0,11.1874584481557,0,Unknow,0,0,0,1,0,0
SOAD03397,Flumevale,Yes,Water Supply,Earth,10.048,0.242,15000.0,1959,,0.08471,5.32658,,14/09/2022,1,1.53,High,Satisfactory,2017-09-01,0.0885,13.0,687.6,54.0,10.048,0.242,0,15000.0,0,9.61587214452889,0,Unknow,0,0,0,0,0,0
SOAD04142,Flumevale,Yes,Recreation,Earth,9.07,0.1,13134.335923209846,1956,,0.04925,29.29619,Uncontrolled,05/09/2018,6,36.73,Low,Satisfactory,2016-09-30,0.0569,6.5,78.2,5.8,9.07,0.1,0,,1,,0,Unknow,0,0,1,0,0,0
SOAD06706,Flumevale,Yes,Irrigation,Earth,3.149,0.15,9001.0,1886,,0.12214,37.90167120460523,,,6,13.9,Low,Not Rated,,0.0755,39.6,250.2,13.6,3.149,0.15,0,9001.0,0,9.10520205385288,0,Unknow,0,0,0,1,0,0
SOAD12739,Flumevale,Yes,Water Supply,Earth,14.976,0.14,150000.0,1978,,0.06501,2.66329,,11/05/2022,1,1.09,High,Satisfactory,2017-09-01,0.0722,27.0,944.6,20.1,14.976,0.14,0,150000.0,0,11.9183972397228,0,Unknow,0,0,0,0,0,0
SOAD13695,Flumevale,Yes,Water Supply,Earth,6.795,0.057,1550.0,1966,,0.10244,34.62277,,15/04/2022,0.5,55.94026827709755,Low,Satisfactory,2018-07-20,0.0695,5.2,6.3,14.8,6.795,0.057,0,1550.0,0,7.34665516317654,0,Unknow,0,0,0,0,0,1
SOAD15255,Flumevale,Yes,Other,Earth,19.286,0.104,23000.0,1950,,0.04334,7.98987,,12/11/2021,0.5,58.118744316146866,Low,Satisfactory,2017-09-01,0.0739,21.2,14.6,18.9147780148894,19.286,0.104,0,23000.0,0,10.043292972227,0,Unknow,0,0,0,0,0,1
SOAD02947,Flumevale,Yes,Water Supply,Earth,10.817,0.13,20600.0,1954,,0.0985,13.31645,,19/04/2022,1,0.0,High,Satisfactory,2017-09-01,0.0816,41.1,866.7,13.9,10.817,0.13,0,20600.0,0,9.93309489728879,0,Unknow,0,0,0,0,0,0
SOAD14963,Flumevale,Yes,Irrigation,Earth,7.548,0.217,34368.0,1964,,0.10441,114.52147,Uncontrolled,08/09/2016,6,53.42,Low,Fair,2018-07-05,0.0695,19.1,111.9,9.3,7.548,0.217,0,34368.0,0,10.4449102742795,0,Unknow,0,0,0,0,0,0
SOAD15740,Flumevale,Yes,Flood Risk Reduction,Earth,7.703,0.283,25241.39326373702,1973,,0.07092,32.22703175639247,,09/10/2014,3,26.53,Low,Fair,2015-09-29,0.0777,29.9,192.9,21.82366529191044,7.703,0.283,0,,1,,0,Unknow,0,0,1,1,0,0
SOAD20612,Flumevale,Yes,Flood Risk Reduction,Earth,5.751,0.206,7351.0,1955,,0.09653,61.25567,,,3,25.1,Low,Satisfactory,2013-09-25,0.0532,20.1,151.1,12.41115777721663,5.751,0.206,0,7351.0,0,8.90272766403552,0,Unknow,0,0,0,0,0,0
SOAD06209,Flumevale,Yes,Other,Earth,7.21,0.328,30000.0,1948,,0.1379,21.30632,,14/06/2022,0.5,47.07755119084701,Low,Satisfactory,2017-09-01,0.0622,25.0,14.5,20.75153852133802,7.21,0.328,0,30000.0,0,10.3089859934221,0,Unknow,0,0,0,0,0,1
SOAD09718,Flumevale,Yes,Other,Earth,36.359,0.149,107000.0,1923,,0.03349,31.846454421110643,,19/05/2022,1,5.82,Significant,Satisfactory,2017-09-01,0.1305,15.6,454.6,22.173776167062385,36.359,0.149,0,107000.0,0,11.5805934591948,0,Unknow,0,0,0,1,0,0
SOAD13885,Flumevale,Yes,Water Supply,Earth,5.766,0.303,13600.0,1955,,0.24428,10.65316,,27/04/2022,0.5,50.284845302032764,Low,Satisfactory,2017-09-01,0.0705,195.2,5.4,47.9,5.766,0.303,0,13600.0,0,9.51789859843275,0,Unknow,0,0,0,0,0,1
SOAD15784,Flumevale,Yes,Recreation,Earth,5.381,0.133,9778.0,1877,,0.03546,7.98987,,15/06/2007,6,12.71,Low,Satisfactory,2020-10-15,0.0408,35.9,106.4,3.8,5.381,0.133,0,9778.0,0,9.18799250831228,0,Unknow,0,0,0,0,0,0
SOAD18809,Flumevale,No,"Fire Protection, Stock, Or Small Fish Pond",Earth,3.411,0.177,15133.729904418933,1970,,0.11202095512406686,41.00548555873469,Uncontrolled,07/09/2010,10,76.59767974150657,Low,Not Rated,,0.0291,8.0,15.1,19.713991548001392,3.411,0.177,0,,1,,0,Unknow,0,0,1,1,1,1
SOAD19629,Flumevale,Yes,Irrigation,Earth,6.79,0.283,34700.0,1939,,0.06895,7.98987,,21/11/2014,6,79.87,Low,Satisfactory,2012-11-06,0.0571,34.5,148.3,45.4,6.79,0.283,0,34700.0,0,10.4545237839635,0,Unknow,0,0,0,0,0,0
SOAD03360,Flumevale,Yes,Water Supply,Earth,6.718,0.223,10000.0,1938,,0.13987,5.32658,,13/05/2022,0.5,45.12941223401394,Low,Satisfactory,2017-09-01,0.0579,43.2,21.4,10.8,6.718,0.223,0,10000.0,0,9.21044036697652,0,Unknow,0,0,0,0,0,1
SOAD14069,Flumevale,Yes,Water Supply,Earth,17.047,0.103,30000.0,1954,,0.0591,2.66329,,02/11/2021,1,0.61,High,Satisfactory,2017-09-01,0.0757,39.4,662.8,34.0,17.047,0.103,0,30000.0,0,10.3089859934221,0,Unknow,0,0,0,0,0,0
SOAD16905,Flumevale,Yes,Water Supply,Earth,6.08,0.103,3700.0,1870,,0.19306,2.66329,,05/05/2022,1,29.52775616549224,Significant,Satisfactory,2017-09-01,0.1363,32.9,211.6,7.8,6.08,0.103,0,3700.0,0,8.21635833238616,0,Unknow,0,0,0,0,0,1
SOAD17249,Flumevale,Yes,Flood Risk Reduction,Earth,10.844,0.19,34546.89614881607,1974,,0.09456,37.28606,,05/03/1992,0,161.22,Low,Not Rated,,0.0876,5.5,55.5,19.556377701634272,10.844,0.19,0,,1,,0,Unknow,0,0,1,0,0,0
SOAD19740,Flumevale,Yes,Water Supply,Earth,14.931,0.3,51000.0,1965,,0.07486,2.66329,,29/09/2021,1,1.0,High,Satisfactory,2017-09-01,0.0884,14.1,782.1,14.1,14.931,0.3,0,51000.0,0,10.8396005193574,0,Unknow,0,0,0,0,0,0
SOAD02836,Flumevale,Yes,Recreation,Earth,11.823,0.042,14232.0,1939,,0.06304,135.82779,,15/10/2019,6,37.88,Low,Not Rated,,0.0804,24.5,233.1,7.9,11.823,0.042,0,14232.0,0,9.56331849107062,0,Unknow,0,0,0,0,0,0
SOAD02886,Flumevale,Yes,Fish and Wildlife Pond,Earth,8.788,0.026,10400.0,1981,,0.12455684722481596,1282.3114719891012,Uncontrolled,16/09/2008,10,26.47,Low,Not Rated,,0.0303,20.4,149.7,17.89517815352897,8.788,0.026,0,10400.0,0,9.24965723435313,0,Unknow,0,0,0,1,1,0
SOAD05507,Flumevale,Yes,Water Supply,Earth,10.007,0.532,60950.81861150214,1924,,0.04137,33.52845669668446,,17/02/2022,1,0.16,High,Satisfactory,2017-09-01,0.0847,14.7,137.3,37.0,10.007,0.532,0,,1,,0,Unknow,0,0,1,1,0,0
SOAD10493,Flumevale,Yes,Flood Risk Reduction,Earth,8.986,0.182,34421.0,1904,2005H;2005S,0.05122,37.12582066324027,Uncontrolled,15/04/2019,6,7.8,Low,Satisfactory,2020-10-05,0.0453,24.5,321.7,18.926634976471398,8.986,0.182,0,34421.0,0,10.4464511738299,2,2005,0,0,0,1,0,0
SOAD00401,Flumevale,Yes,Water Supply,Earth,39.86,0.151,97000.0,1953,,0.02561,31.846454421110643,,13/09/2022,1,0.48,High,Satisfactory,2017-09-01,0.0922,42.6,422.6,37.7,39.86,0.151,0,97000.0,0,11.4824765667107,0,Unknow,0,0,0,1,0,0
SOAD03744,Flumevale,Yes,Debris Control,Earth,4.827,0.5090609280402999,1952038.6132439976,Unknow,,74.26571848031749,11432.356165990295,,27/01/2023,1,1.543903537042259,High,Not Rated,,0.1318,948.9,809.8,19.351947225461643,4.827,,1,,1,,0,Unknow,0,1,1,1,1,1
SOAD07129,Flumevale,Yes,Water Supply,Earth,10.2,0.697,109000.0,1977,,0.04925,33.78629557909187,,08/02/2022,0.5,0.0,Low,Satisfactory,2017-09-01,0.0729,28.4,689.7,52.3,10.2,0.697,0,109000.0,0,11.5991123354811,0,Unknow,0,0,0,1,0,0
SOAD17525,Flumevale,Yes,Water Supply,Earth,8.016,0.161,14588.174589420352,1962,,0.11229,2.66329,,16/06/2022,0.5,93.11774780147024,Low,Satisfactory,2017-09-01,0.0654,5.3,10.0,57.7,8.016,0.161,0,,1,,0,Unknow,0,0,1,0,0,1
SOAD01490,Flumevale,Yes,Recreation,Earth,13.739,0.047,11130.0,1968,,0.05516,106.5316,,01/01/1994,0,65.2,Low,Not Rated,,0.1111,14.0,172.1,7.7,13.739,0.047,0,11130.0,0,9.31748928749323,0,Unknow,0,0,0,0,0,0
SOAD04023,Flumevale,Yes,Water Supply,Earth,6.587,0.107,10258.583184077399,Unknow,,0.09653,34.17926007696136,,10/09/2021,0.5,55.385365342399965,Low,Satisfactory,2017-09-01,0.0719,31.3,12.0,42.8,6.587,0.107,0,,1,,0,Unknow,0,0,1,1,0,1
SOAD05643,Flumevale,Yes,Other,Earth,7.488,0.567,44416.01154575798,2008,,0.07486,34.2529766790351,Uncontrolled,17/05/2017,6,85.42985747246387,Low,Fair,2019-06-18,0.05,46.3,18.8,22.47735704026822,7.488,0.567,0,,1,,0,Unknow,0,0,1,1,0,1
SOAD12681,Flumevale,Yes,Fish and Wildlife Pond,Earth,4.033,0.1,1621.0,1967,,0.09796377349854826,48.766158763624446,Uncontrolled,02/08/2017,10,38.34,Low,Not Rated,,0.0474,5.1,145.7,13.022059442858557,4.033,0.1,0,1621.0,0,7.39141523467536,0,Unknow,0,0,0,1,1,0
SOAD13172,Flumevale,Yes,Water Supply,Earth,9.337,0.143,18800.0,1956,,0.09653,2.66329,,04/10/2021,1,1.58,High,Satisfactory,2017-09-01,0.0897,16.6,704.0,23.5,9.337,0.143,0,18800.0,0,9.84166533889278,0,Unknow,0,0,0,0,0,0
SOAD15475,Flumevale,Yes,Fish and Wildlife Pond,Earth,3.633,0.05,1605.0,1900,,0.11229,35.53848598050014,,,6,51.41,Low,Not Rated,,0.0896,43.8,84.9,21.38101938857245,3.633,0.05,0,1605.0,0,7.38150189450671,0,Unknow,0,0,0,1,0,0
SOAD16218,Flumevale,Yes,Irrigation,Earth,7.221,0.175,16566.342727799256,1945,,0.0886499999999999,33.43665582351189,Uncontrolled,30/10/2012,6,10.1,Low,Fair,2003-10-21,0.0606,17.8,364.3,11.3,7.221,0.175,0,,1,,0,Unknow,0,0,1,1,0,0
SOAD20163,Flumevale,Yes,Water Supply,Earth,19.485,0.283,196500.0,1952,,0.05122,46.302302191238816,,24/02/2022,1,0.0,High,Satisfactory,2017-09-01,0.0882,13.0,649.8,9.4,19.485,0.283,0,196500.0,0,12.188422799337,0,Unknow,0,0,0,1,0,0
SOAD01415,Flumevale,Yes,Irrigation,Earth,2.891,0.4,10588.0,1910,,0.12805,57.83682688761901,,01/10/2013,6,17.3,Low,Not Rated,,0.0561,18.6,237.5,9.3,2.891,0.4,0,10588.0,0,9.26757100543045,0,Unknow,0,0,0,1,0,0
SOAD07567,Flumevale,Yes,Other,Earth,11.529,0.207,68575.0,Unknow,,0.05122,31.92799191413317,,13/10/2021,0.5,55.46766198469657,Low,Satisfactory,2017-09-01,0.0702,25.9,18.6,22.113663777745256,11.529,0.207,0,68575.0,0,11.1356978982733,0,Unknow,0,0,0,1,0,1
SOAD07731,Flumevale,Yes,Irrigation,Earth,12.332,0.087,26846.616925316088,1947,,0.06895,21.30632,,23/09/2019,6,16.22,Low,Not Rated,,0.0478,39.4,319.8,47.5,12.332,0.087,0,,1,,0,Unknow,0,0,1,0,0,0
SOAD09580,Flumevale,Yes,Irrigation,Earth,5.088,0.207,19040.0,1949,,0.0925899999999999,15.97974,Uncontrolled,26/08/2016,6,52.73,Low,Satisfactory,2020-07-20,0.0349,16.0,133.0,5.4,5.088,0.207,0,19040.0,0,9.85434982797458,0,Unknow,0,0,0,0,0,0
SOAD12904,Flumevale,Yes,Water Supply,Earth,6.947,0.3,26000.0,1964,,0.13593,32.77631466217794,,15/02/2022,0.5,52.9356142877809,Low,Satisfactory,2017-09-01,0.0818,12.2,16.9,45.7,6.947,0.3,0,26000.0,0,10.1658902778025,0,Unknow,0,0,0,1,0,1
SOAD14037,Flumevale,Yes,Irrigation,Earth,5.631,0.133,10957.0,1920,,0.08077,34.14415050711466,Uncontrolled,26/09/2017,6,44.97,Low,Not Rated,,0.0799,6.9,52.9,37.9,5.631,0.133,0,10957.0,0,9.30182506209836,0,Unknow,0,0,0,1,0,0
SOAD14669,Flumevale,Yes,Water Supply,Earth,4.755,0.117,10394.397558655033,1980,,0.1182,96.99834853821004,,08/02/2023,0.5,52.83513760729672,Low,Fair,2017-09-01,0.0872,32.6,10.3,7.2,4.755,0.117,0,,1,,0,Unknow,0,0,1,1,0,1
SOAD15910,Flumevale,Yes,Flood Risk Reduction,Earth,9.343,0.3,17336.0,1956,,0.06501,32.14678934184314,Uncontrolled,05/10/2020,6,12.32,Low,Not Rated,,0.09,18.5,202.4,21.517125978557917,9.343,0.3,0,17336.0,0,9.76059822498589,0,Unknow,0,0,0,1,0,0
SOAD19498,Flumevale,Yes,Irrigation,Earth,3.257,0.3,730.0,1965,,0.12608,44.19481669166558,,,6,12.97,Low,Not Rated,,0.0746,6.8,144.4,33.3,3.257,0.3,0,730.0,0,6.59441345974978,0,Unknow,0,0,0,1,0,0
SOAD20128,Flumevale,Yes,Irrigation,Earth,18.361,0.297,82000.0,1983,,0.04925,483.0281833152083,,06/12/2022,2,1.54,Significant,Fair,2022-12-06,0.1418,10.6,851.1,7.8,18.361,0.297,0,82000.0,0,11.314486721294,0,Unknow,0,0,0,1,0,0
SOAD02616,Flumevale,Yes,Water Supply,Earth,11.548,0.533,75317.81040518456,Unknow,,0.04728,33.52845669668446,,11/08/2022,1,0.0,High,Fair,2017-09-01,0.0891,20.2,211.8,49.1,11.548,0.533,0,,1,,0,Unknow,0,0,1,1,0,0
SOAD02824,Flumevale,Yes,Irrigation,Earth,4.157,0.781,79305.0,1966,,0.09653,279.4180937718106,Uncontrolled,11/05/1995,6,0.0,Low,Not Rated,,0.0441,33.8,893.2,9.3,4.157,0.781,0,79305.0,0,11.2810690668036,0,Unknow,0,0,0,1,0,0
SOAD09912,Flumevale,Yes,Flood Risk Reduction,Earth,29.891,0.387,340569.0089859179,2014,2014,0.08668,7.98987,Uncontrolled,07/04/2022,3,1.64,Significant,Satisfactory,2022-04-07,0.1162,22.5,150.0,17.835709497329688,29.891,0.387,0,,1,,1,2014,0,0,1,0,0,0
SOAD14163,Flumevale,Yes,Flood Risk Reduction,Earth,9.07,0.14,14630.0,1957,,0.06895,31.857508612601922,Uncontrolled,07/10/2020,3,19.24,Low,Satisfactory,2017-01-13,0.0785,25.0,446.0,21.58633880192582,9.07,0.14,0,14630.0,0,9.59089784437816,0,Unknow,0,0,0,1,0,0
SOAD03451,Flumevale,Yes,Other,Earth,1.735,0.12,10329.055897467022,Unknow,,0.10756952715642186,151.65114892635674,,,Unknow,18.62,Significant,Not Available,,0.1225,24.0,185.7,18.853404324207037,1.735,0.12,0,,1,,0,Unknow,0,0,1,1,1,0
SOAD09180,Flumevale,Yes,Unknow,Earth,3.808,0.065,2590.0,1904,,0.0788,39.0262400852618,,28/08/2020,6,14.11,Low,Satisfactory,2018-06-27,0.038,28.4,205.3,20.50712087150994,3.808,0.065,0,2590.0,0,7.85979918056211,0,Unknow,0,0,0,1,0,0
SOAD12155,Flumevale,Yes,Water Supply,Earth,13.096,0.092,25400.0,1959,,0.08077,10.65316,,25/01/2022,1,0.5,High,Satisfactory,2017-09-01,0.116,47.0,827.9,38.5,13.096,0.092,0,25400.0,0,10.1425438223104,0,Unknow,0,0,0,0,0,0
SOAD12724,Flumevale,Yes,Flood Risk Reduction,Earth,16.856,0.367,100400.0,1961,,0.05122,34.62277,Uncontrolled,01/10/2018,2,10.97,Significant,Not Available,,0.1583,21.2,334.7,21.34624425325799,16.856,0.367,0,100400.0,0,11.5169274463495,0,Unknow,0,0,0,0,0,0
SOAD18660,Flumevale,Yes,Fish and Wildlife Pond,Earth,6.814,0.225,8711.0,1971,,0.10740133406577457,39.171152004821806,Uncontrolled,07/09/2008,10,12.87,Low,Not Rated,,0.0453,44.8,401.1,20.643465574577743,6.814,0.225,0,8711.0,0,9.0724566646128,0,Unknow,0,0,0,1,1,0
SOAD20290,Flumevale,Yes,Water Supply,Earth,13.707,0.046,7000.0,1974,,0.0591,35.34454963125332,,04/02/2022,0.5,1.59,Low,Satisfactory,2017-09-01,0.0847,13.6,222.6,27.5,13.707,0.046,0,7000.0,0,8.8538082749772,0,Unknow,0,0,0,1,0,0
SOAD03024,Flumevale,Yes,Irrigation,Earth,7.385,0.232,13357.0,1959,,0.07092,15.97974,Uncontrolled,12/08/2021,6,0.0,Low,Not Rated,,0.0414,9.9,505.2,2.1,7.385,0.232,0,13357.0,0,9.49987073528558,0,Unknow,0,0,0,0,0,0
SOAD04642,Flumevale,Yes,Other,Earth,13.828,0.277,46500.0,1947,,0.06107,21.30632,,03/02/2022,1,6.65,Significant,Satisfactory,2017-09-01,0.1234,43.4,464.2,19.072624053151348,13.828,0.277,0,46500.0,0,10.7472290967206,0,Unknow,0,0,0,0,0,0
SOAD06590,Flumevale,Yes,Flood Risk Reduction,Earth,12.751,0.274,32200.0,1963,,0.05713,32.03720372075938,Uncontrolled,15/09/2022,3,0.0,High,Satisfactory,2022-09-15,0.0906,38.2,198.9,20.872070930505217,12.751,0.274,0,32200.0,0,10.3797527869509,0,Unknow,0,0,0,1,0,0
SOAD07005,Flumevale,Yes,Water Supply,Earth,7.774,0.322,43000.0,1982,,0.2561,61.85566508257576,,02/08/2022,1,0.0,Significant,Satisfactory,2017-09-01,0.1263,439.5,799.7,5.6,7.774,0.322,0,43000.0,0,10.6689786502192,0,Unknow,0,0,0,1,0,0
SOAD07659,Flumevale,Yes,Other,Earth,13.911,0.168,41800.0,2003,,0.04137,32.15574505579004,,10/08/2022,0.5,60.7854148722817,Low,Satisfactory,2017-09-01,0.0659,11.4,13.1,22.41481411105807,13.911,0.168,0,41800.0,0,10.6406755416717,0,Unknow,0,0,0,1,0,1
SOAD08358,Flumevale,Yes,Irrigation,Earth,19.367,0.083,22361.0,1947,,0.04137,29.29619,Uncontrolled,26/08/1999,0,7.79,Low,Not Rated,,0.0763,23.3,255.9,27.3,19.367,0.083,0,22361.0,0,10.0151183687073,0,Unknow,0,0,0,0,0,0
SOAD09358,Flumevale,Yes,Irrigation,Earth,4.461,0.133,8132.0,1892,,0.06698,38.438692223582144,,12/07/2017,6,15.03,Low,Not Rated,,0.0479,12.6,293.4,23.2,4.461,0.133,0,8132.0,0,9.00368513816677,0,Unknow,0,0,0,1,0,0
SOAD09524,Flumevale,Yes,Irrigation,Earth,6.251,0.167,14610.662616588887,2006,,0.07289,45.57467636597012,Uncontrolled,08/10/2019,6,30.72,Low,Fair,2012-09-14,0.0428,29.4,117.9,9.1,6.251,0.167,0,,1,,0,Unknow,0,0,1,1,0,0
SOAD14752,Flumevale,Yes,Irrigation,Earth,3.038,0.3,12001.0,1882,,0.22852,405.0250050910196,,22/07/2010,6,18.55,Low,Not Rated,,0.0905,31.3,395.4,24.2,3.038,0.3,0,12001.0,0,9.39282858154946,0,Unknow,0,0,0,1,0,0
SOAD16782,Flumevale,Yes,Water Supply,Earth,16.232,0.52,182300.0,1996,,0.13002,42.11283383486239,,30/11/2021,1,0.0,Significant,Satisfactory,2017-09-01,0.1155,44.4,340.8,48.6,16.232,0.52,0,182300.0,0,12.1134144461152,0,Unknow,0,0,0,1,0,0
SOAD20294,Flumevale,Yes,Irrigation,Earth,6.81,0.179,24610.0,1905,,0.0591,39.47203251672893,,29/09/2020,6,34.37,Low,Satisfactory,2020-07-20,0.026,13.4,104.8,21.0,6.81,0.179,0,24610.0,0,10.1109487764482,0,Unknow,0,0,0,1,0,0
SOAD01145,Flumevale,Yes,Water Supply,Earth,5.461,0.127,5972.0,1952,,0.18321,7.98987,,11/01/2022,0.5,48.0266567492937,Low,Satisfactory,2017-09-01,0.0688,31.1,21.6,64.3,5.461,0.127,0,5972.0,0,8.69500459273231,0,Unknow,0,0,0,0,0,1
SOAD04299,Flumevale,Yes,Irrigation,Earth,8.604,0.087,5993.0,1950,,0.09456,149.14424,,19/09/1979,6,16.09,Low,Satisfactory,2016-08-12,0.0413,44.2,213.6,21.2,8.604,0.087,0,5993.0,0,8.69851424787661,0,Unknow,0,0,0,0,0,0
SOAD07376,Flumevale,Yes,Flood Risk Reduction,Earth,9.4,0.208,18230.0,1960,,0.08077,13.31645,Uncontrolled,11/04/2018,3,36.3,Low,Satisfactory,2016-08-11,0.071,29.3,188.2,18.30287077169321,9.4,0.208,0,18230.0,0,9.81087872080347,0,Unknow,0,0,0,0,0,0
SOAD09866,Flumevale,Yes,Irrigation,Earth,7.01,0.373,31377.459585962766,2008,,0.08274,7.98987,Uncontrolled,15/04/2019,6,93.02218182299202,Low,Not Rated,,0.0243,25.5,17.9,19.7,7.01,0.373,0,,1,,0,Unknow,0,0,1,0,0,1
SOAD11491,Flumevale,Yes,Irrigation,Earth,5.602,0.133,9692.0,1952,,0.03349,39.24251103522255,,26/09/2013,6,11.81,Low,Not Rated,,0.0494,45.3,177.8,29.4,5.602,0.133,0,9692.0,0,9.17915925449261,0,Unknow,0,0,0,1,0,0
SOAD14046,Flumevale,No,Irrigation,Earth,21.647,0.667,20000.0,1966,,0.00788,108.95127043144497,Uncontrolled,22/08/2022,3,7.92,Low,Satisfactory,2023-09-29,0.0644,25.7,275.0,5.0,21.647,0.667,0,20000.0,0,9.90353755128617,0,Unknow,0,0,0,1,0,0
SOAD00665,Flumevale,Yes,Irrigation,Earth,2.38,0.317,7116.0,1908,,0.2167,180.023634760509,,17/06/1992,6,20.05,Low,Not Rated,,0.0668,46.1,285.0,41.8,2.38,0.317,0,7116.0,0,8.87024156729927,0,Unknow,0,0,0,1,0,0
SOAD05070,Flumevale,Yes,Water Supply,Earth,15.545,0.333,20000.0,1951,,0.07289,4447.0843593336685,,06/04/2022,1,1.401668315626806,High,Satisfactory,2017-09-01,0.0796,18.3,847.5,62.0,15.545,0.333,0,20000.0,0,9.90353755128617,0,Unknow,0,0,0,1,0,1
SOAD09357,Flumevale,Yes,Irrigation,Earth,3.49,0.033,9838.431859115075,1924,,0.08274,35.91521798366969,Uncontrolled,17/08/1986,6,31.62,Low,Not Rated,,0.0958,42.8,125.6,25.6,3.49,0.033,0,,1,,0,Unknow,0,0,1,1,0,0
SOAD10730,Flumevale,Yes,Irrigation,Earth,11.483,0.111,30587.0,1946,,0.05122,37.28606,,16/11/2020,6,31.97,Low,Satisfactory,2021-06-09,0.0346,37.8,223.6,3.9,11.483,0.111,0,30587.0,0,10.3283630541641,0,Unknow,0,0,0,0,0,0
SOAD11767,Flumevale,Yes,Water Supply,Earth,22.82,0.14,51000.0,1951,,0.06107,2.66329,,14/04/2022,1,16.83,Significant,Satisfactory,2017-09-01,0.1253,26.3,411.1,13.2,22.82,0.14,0,51000.0,0,10.8396005193574,0,Unknow,0,0,0,0,0,0
SOAD11909,Flumevale,Yes,Irrigation,Earth,6.861,0.233,21295.866661260297,2020,,0.06895,27.426311964958835,Uncontrolled,11/08/2022,1,1.2156615296125872,High,Satisfactory,2022-08-11,0.0972,14.8,908.9,30.4,6.861,0.233,0,,1,,0,Unknow,0,0,1,1,0,1
SOAD12457,Flumevale,Yes,Flood Risk Reduction,Earth,14.308,0.275,37847.0,1958,,0.06698,32.725400152569065,Uncontrolled,05/10/2020,3,9.88,Low,Not Rated,,0.0684,37.9,458.7,21.81415111000846,14.308,0.275,0,37847.0,0,10.541333417311,0,Unknow,0,0,0,1,0,0
SOAD17202,Flumevale,Yes,Water Supply,Earth,16.693,0.16,200000.0,1978,,0.08077,5.32658,,11/05/2022,1,1.32,High,Satisfactory,2017-09-01,0.0838,10.6,338.3,21.7,16.693,0.16,0,200000.0,0,12.2060776455177,0,Unknow,0,0,0,0,0,0
SOAD17555,Flumevale,Yes,Flood Risk Reduction,Earth,13.837,0.083,33500.0,1949,,0.06107,13.31645,,10/08/2022,1,0.0,High,Satisfactory,2017-09-01,0.0906,27.0,125.0,18.283951425435554,13.837,0.083,0,33500.0,0,10.4193305681139,0,Unknow,0,0,0,0,0,0
SOAD04889,Flumevale,Yes,Irrigation,Earth,7.426,0.305,79323.0,1906,,0.17336,7.98987,,21/04/2022,6,17.91,Low,Fair,2015-08-06,0.0437,17.7,224.1,4.6,7.426,0.305,0,79323.0,0,11.2812960100057,0,Unknow,0,0,0,0,0,0
SOAD05764,Flumevale,Yes,Irrigation,Earth,4.763,0.533,43571.10071844407,1914,,0.04925,34.231575328316296,Uncontrolled,22/03/2017,6,17.6,Low,Satisfactory,2018-08-23,0.0544,41.7,232.2,31.7,4.763,0.533,0,,1,,0,Unknow,0,0,1,1,0,0
SOAD08154,Flumevale,No,Fish and Wildlife Pond,Earth,6.092,0.05,1671.0,1929,,0.09275637444960137,7.98987,Uncontrolled,17/07/2017,10,6.13,Low,Not Rated,,0.0654,25.1,390.7,20.113726205175052,6.092,0.05,0,1671.0,0,7.42177579364465,0,Unknow,0,0,0,0,1,0
SOAD10215,Flumevale,Yes,Water Supply,Earth,11.309,0.225,29225.0,1953,,0.18715,5.32658,,25/08/2022,0.5,52.634214120881495,Low,Satisfactory,2017-09-01,0.0734,17.0,5.2,36.7,11.309,0.225,0,29225.0,0,10.2828140030346,0,Unknow,0,0,0,0,0,1
SOAD14557,Flumevale,Yes,Flood Risk Reduction,Earth,7.446,0.333,28415.353111891425,1990,,0.09653,37.278641001729824,Uncontrolled,09/06/2021,6,7.93,Low,Not Rated,,0.0435,35.7,370.4,20.53056799842697,7.446,0.333,0,,1,,0,Unknow,0,0,1,1,0,0
SOAD17477,Flumevale,Yes,Irrigation,Earth,5.808,0.275,28601.0,1904,,0.04137,34.051416755345265,,27/07/2020,6,36.52,Low,Fair,2021-09-13,0.0489,4.8,183.3,32.2,5.808,0.275,0,28601.0,0,10.2612319244329,0,Unknow,0,0,0,1,0,0
SOAD19545,Flumevale,Yes,Flood Risk Reduction,Earth,8.597,0.197,20990.41922387488,1964,,0.06895,7.98987,,13/05/1998,6,0.0,Low,Satisfactory,2019-07-23,0.0531,32.3,601.0,18.7212438103,8.597,0.197,0,,1,,0,Unknow,0,0,1,0,0,0
SOAD20251,Flumevale,Yes,Irrigation,Earth,5.711,0.22,20165.0,1956,,0.06501,32.92973502181077,,19/10/2017,6,13.39,Low,Fair,2020-05-04,0.0599,23.2,194.3,31.5,5.711,0.22,0,20165.0,0,9.91175329695316,0,Unknow,0,0,0,1,0,0
SOAD04655,Flumevale,Yes,Water Supply,Earth,13.178,0.2,56154.0,1949,,0.04334,5.32658,,10/08/2022,1,0.8031098208817766,High,Satisfactory,2017-09-01,0.1001,16.9,788.6,63.8,13.178,0.2,0,56154.0,0,10.9358710033971,0,Unknow,0,0,0,0,0,1
SOAD06838,Flumevale,Yes,"Fire Protection, Stock, Or Small Fish Pond",Earth,6.406,0.292,23963.52407878703,1950,,0.08077,7.98987,Uncontrolled,18/10/2022,6,6.56,Low,Unsatisfactory,2018-05-25,0.0706,46.8,175.0,20.328790657348396,6.406,0.292,0,,1,,0,Unknow,0,0,1,0,0,0
SOAD12276,Flumevale,Yes,Unknow,Earth,3.435,0.15,11236.237151033649,Unknow,,0.09988382619531742,41.41482418904296,Uncontrolled,21/10/2017,6,97.2574742417186,Low,Not Rated,,0.0785,5.4,16.6,20.007628366474925,3.435,0.15,0,,1,,0,Unknow,0,0,1,1,1,1
SOAD18864,Flumevale,Yes,Water Supply,Earth,3.907,0.067,9838.431859115075,1920,,0.11229,34.546235475481815,,19/09/1986,6,43.96,Low,Not Rated,,0.084,13.1,208.9,49.6,3.907,0.067,0,,1,,0,Unknow,0,0,1,1,0,0
SOAD00919,Flumevale,Yes,Water Supply,Earth,21.151,0.152,61000.0,1975,,0.05713,2.66329,,24/05/2023,0.5,56.89169500638254,Low,Fair,2017-09-01,0.0853,14.8,11.3,25.9,21.151,0.152,0,61000.0,0,11.0186455364637,0,Unknow,0,0,0,0,0,1
SOAD04049,Flumevale,Yes,Water Supply,Earth,13.813,0.057,8770.0,1951,,0.0906199999999999,34.61249292910917,,02/11/2021,1,22.6295057926433,Significant,Satisfactory,2017-09-01,0.1355,16.3,219.2,58.8,13.813,0.057,0,8770.0,0,9.07920610395138,0,Unknow,0,0,0,1,0,1
SOAD06220,Flumevale,Yes,Irrigation,Earth,7.009,0.093,10946.0,1946,,0.07683,42.290428190682746,,15/05/2020,6,36.46,Low,Fair,2016-03-30,0.0499,18.9,222.3,8.1,7.009,0.093,0,10946.0,0,9.30082072510456,0,Unknow,0,0,0,1,0,0
SOAD08243,Flumevale,Yes,Fish and Wildlife Pond,Earth,7.114,0.133,1600.0,1889,,0.05713,34.584224397794486,Uncontrolled,29/08/2019,6,60.03,Low,Not Rated,,0.063,47.1,101.9,22.622283498730525,7.114,0.133,0,1600.0,0,7.37838371299671,0,Unknow,0,0,0,1,0,0
SOAD10270,Flumevale,No,Flood Risk Reduction,Earth,7.054,0.178,25600.0,1961,,0.09653,13.31645,Uncontrolled,15/09/2022,5,0.0,Significant,Not Available,,0.1138,25.9,334.8,18.329878464247145,7.054,0.178,0,25600.0,0,10.1503866922047,0,Unknow,0,0,0,0,0,0
SOAD11187,Flumevale,Yes,Water Supply,Earth,18.244,0.158,49600.0,1952,,0.06895,31.846454421110643,,03/05/2022,1,0.0,High,Satisfactory,2017-09-01,0.0807,33.7,624.9,64.1,18.244,0.158,0,49600.0,0,10.8117662738001,0,Unknow,0,0,0,1,0,0
SOAD11221,Flumevale,Yes,Irrigation,Earth,12.631,0.04,13595.0,1904,,0.05122,114.52147,Uncontrolled,10/06/2022,6,14.13,Low,Fair,2004-04-21,0.0666,32.0,459.8,8.3,12.631,0.04,0,13595.0,0,9.51753091081601,0,Unknow,0,0,0,0,0,0
SOAD19602,Flumevale,Yes,Flood Risk Reduction,Earth,10.494,0.301,18876.0,1955,,0.0788,7.98987,Uncontrolled,04/06/2015,3,6.24,Low,Satisfactory,2011-08-09,0.0697,5.8,328.9,18.814073225514747,10.494,0.301,0,18876.0,0,9.84569952876873,0,Unknow,0,0,0,0,0,0
SOAD20068,Flumevale,Yes,"Fire Protection, Stock, Or Small Fish Pond",Earth,5.042,0.37,55160.0,1925,,0.11032,15.97974,Uncontrolled,12/11/2008,6,48.99,Low,Fair,2022-10-03,0.0484,16.7,66.1,19.91507189213445,5.042,0.37,0,55160.0,0,10.918011460822,0,Unknow,0,0,0,0,0,0
SOAD01865,Flumevale,Yes,Water Supply,Earth,10.575,0.263,26700.0,1955,,0.08274,10.65316,,21/06/2022,1,0.5,High,Satisfactory,2017-09-01,0.0841,7.6,559.0,16.7,10.575,0.263,0,26700.0,0,10.1924562968705,0,Unknow,0,0,0,0,0,0
SOAD02298,Flumevale,Yes,Debris Control,Earth,19.28,0.093,23000.0,2004,,0.04137,37.28606,,20/10/2021,1,0.0,High,Satisfactory,2017-09-01,0.1107,34.4,588.1,19.03534158019381,19.28,0.093,0,23000.0,0,10.043292972227,0,Unknow,0,0,0,0,0,0
SOAD03708,Flumevale,Yes,Irrigation,Earth,6.718,0.477,55591.0,1927,,0.08471,38.03398445288482,,25/09/2013,6,12.95,Low,Fair,2015-07-16,0.0432,20.4,244.1,28.6,6.718,0.477,0,55591.0,0,10.9257945849942,0,Unknow,0,0,0,1,0,0
SOAD05384,Flumevale,Yes,Flood Risk Reduction,Earth,9.477,0.212,22611.0,1955,,0.07092,7.98987,Uncontrolled,24/10/2013,3,7.74,Low,Not Rated,,0.0798,12.3,194.4,19.561040557649758,9.477,0.212,0,22611.0,0,10.0262360177952,0,Unknow,0,0,0,0,0,0
SOAD09032,Flumevale,Yes,Irrigation,Earth,4.523,0.167,13979.621206854967,1951,,0.12608,45.45667455178421,,29/08/1979,6,3.28,Low,Satisfactory,2016-10-06,0.034,8.5,127.7,25.3,4.523,0.167,0,,1,,0,Unknow,0,0,1,1,0,0
SOAD09048,Flumevale,Yes,Flood Risk Reduction,Earth,13.93,0.093,27162.867542356915,1964,,0.1182,13.31645,Uncontrolled,28/08/1998,3,55.83,Low,Satisfactory,2008-08-13,0.0773,35.4,145.3,19.755347695122282,13.93,0.093,0,,1,,0,Unknow,0,0,1,0,0,0
SOAD12179,Flumevale,Yes,Water Supply,Earth,14.561,0.362,93000.0,1980,,0.04728,2.66329,,28/01/2022,0.5,59.395484956052655,Low,Satisfactory,2017-09-01,0.0777,33.4,16.3,49.1,14.561,0.362,0,93000.0,0,11.4403655247658,0,Unknow,0,0,0,0,0,1
SOAD20411,Flumevale,Yes,Irrigation,Earth,9.082,0.2,33319.0,Unknow,1979,0.0591,32.50188285873185,Uncontrolled,19/04/2019,6,13.02,Low,Satisfactory,2021-09-10,0.0556,47.7,472.9,23.7,9.082,0.2,0,33319.0,0,10.4139130962808,1,1979,0,0,0,1,0,0
SOAD03678,Flumevale,Yes,Fish and Wildlife Pond,Earth,3.723,0.55,42827.15139763147,Unknow,2002,0.14578,34.54170324017181,Uncontrolled,,6,39.5,Low,Not Rated,,0.0534,20.8,110.0,23.671497228643343,3.723,0.55,0,,1,,1,2002,0,0,1,1,0,0
SOAD14622,Flumevale,No,Recreation,Earth,4.582,0.1,100.0,1938,,0.5912284265943945,7.98987,Uncontrolled,01/08/2011,Unknow,0.8,Significant,Not Rated,,0.1363,414.1,607.8,9.3,4.582,0.1,0,100.0,0,4.61512051684126,0,Unknow,0,0,0,0,1,0
SOAD15591,Flumevale,Yes,Irrigation,Earth,7.279,0.08,12196.0,1889,,0.11426,39.9914769223737,,03/10/2022,6,37.15,Low,Satisfactory,2020-02-25,0.0419,7.9,187.6,23.0,7.279,0.08,0,12196.0,0,9.40894529884324,0,Unknow,0,0,0,1,0,0
SOAD17702,Flumevale,Yes,Flood Risk Reduction,Earth,12.613,0.242,16000.0,1970,,0.06304,37.48936381530172,Uncontrolled,21/02/2017,6,54.74,Low,Not Rated,,0.0362,40.5,120.7,19.78876640622643,12.613,0.242,0,16000.0,0,9.68040649926887,0,Unknow,0,0,0,1,0,0
SOAD18805,Flumevale,Yes,Water Supply,Earth,10.022,0.12,17000.0,1964,,0.11426,2.66329,,04/10/2021,1,18.54,Significant,Satisfactory,2017-09-01,0.1453,10.3,224.2,39.3,10.022,0.12,0,17000.0,0,9.74102744483773,0,Unknow,0,0,0,0,0,0
SOAD04549,Flumevale,Yes,Water Supply,Earth,16.681,0.157,65000.0,1959,,0.07486,5.32658,,14/09/2022,1,1.69,High,Satisfactory,2017-09-01,0.1002,38.6,739.1,52.5,16.681,0.157,0,65000.0,0,11.0821579333748,0,Unknow,0,0,0,0,0,0
SOAD07550,Flumevale,Yes,Other,Earth,21.885,0.717,138000.0,2005,,0.0591,37.21937834415436,,25/05/2022,0.5,64.30920206082493,Low,Satisfactory,2017-09-01,0.0734,28.3,6.0,20.04842202596126,21.885,0.717,0,138000.0,0,11.8350162104899,0,Unknow,0,0,0,1,0,1
SOAD13817,Flumevale,Yes,"Fire Protection, Stock, Or Small Fish Pond",Earth,5.363,0.167,15276.0,1941,,0.1379,41.1866673282553,,13/10/2020,6,3.25,Low,Satisfactory,2020-10-15,0.0394,21.7,600.4,19.530625306978834,5.363,0.167,0,15276.0,0,9.63410370836572,0,Unknow,0,0,0,1,0,0
SOAD13886,Flumevale,Yes,Flood Risk Reduction,Earth,8.836,0.185,18618.0,1958,,0.07486,7.98987,Uncontrolled,04/06/2015,3,4.86,Low,Satisfactory,2009-12-16,0.0729,13.0,530.2,19.583595643113775,8.836,0.185,0,18618.0,0,9.83193784369605,0,Unknow,0,0,0,0,0,0
SOAD16923,Flumevale,Yes,Irrigation,Earth,12.717,0.11,32486.405913643066,1961,,0.06107,15.97974,Uncontrolled,19/06/2019,6,4.75,Low,Satisfactory,2016-09-26,0.0425,6.8,619.2,35.0,12.717,0.11,0,,1,,0,Unknow,0,0,1,0,0,0
SOAD17909,Flumevale,Yes,Other,Earth,25.591,0.095,38000.0,1948,,0.04334,2.66329,,09/03/2022,0.5,55.42625356879239,Low,Satisfactory,2017-09-01,0.0768,38.2,12.8,18.98550426221144,25.591,0.095,0,38000.0,0,10.5453677541517,0,Unknow,0,0,0,0,0,1
SOAD01324,Flumevale,Yes,Other,Earth,7.677,0.787,43036.0,1851,,0.09653,33.88575300287382,,20/12/2021,1,4.63,High,Satisfactory,2017-09-01,0.0976,26.6,270.1,20.616037131741805,7.677,0.787,0,43036.0,0,10.6698154898041,0,Unknow,0,0,0,1,0,0
SOAD03584,Flumevale,Yes,Unknow,Earth,3.583,0.108,10127.974127696101,Unknow,,0.13002,34.76977383259601,Uncontrolled,17/07/1997,6,24.12,Low,Not Rated,,0.0833,44.3,459.6,22.349638410541573,3.583,0.108,0,,1,,0,Unknow,0,0,1,1,0,0
SOAD03960,Flumevale,Yes,Water Supply,Earth,30.47,0.125,84400.0,1931,,0.03152,31.846454421110643,,01/09/2022,1,0.19,High,Poor,2023-06-22,0.1162,40.0,100.5,23.4,30.47,0.125,0,84400.0,0,11.3433345288551,0,Unknow,0,0,0,1,0,0
SOAD04220,Flumevale,No,Recreation,Earth,5.087,0.2,17166.01519157147,1973,,0.07289,87.88857,Uncontrolled,07/09/2021,3,0.0,Low,Poor,2021-09-07,0.0984,6.4,609.6,8.6,5.087,0.2,0,,1,,0,Unknow,0,0,1,0,0,0
SOAD11009,Flumevale,Yes,Fish and Wildlife Pond,Earth,4.468,0.253,18027.0,1960,2002,0.13199,39.170799756193325,Uncontrolled,21/11/2017,6,40.29,Low,Not Rated,,0.0403,4.8,157.3,22.065024777104068,4.468,0.253,0,18027.0,0,9.79968138381054,1,2002,0,0,0,1,0,0
SOAD11726,Flumevale,Yes,Irrigation,Earth,7.323,0.715,8810.0,1905,,0.0985,35.3462830425646,Uncontrolled,23/09/2013,6,24.67,Low,Not Rated,,0.0872,27.7,473.6,42.9,7.323,0.715,0,8810.0,0,9.08375621986673,0,Unknow,0,0,0,1,0,0
SOAD14456,Flumevale,Yes,Water Supply,Earth,13.189,0.425,97450.0,1962,,0.03349,33.41811208527019,,17/11/2022,1,0.39,High,Fair,2021-01-08,0.1104,13.0,687.3,25.7,13.189,0.425,0,97450.0,0,11.4871049665557,0,Unknow,0,0,0,1,0,0
SOAD19840,Flumevale,Yes,Water Supply,Earth,15.186,0.12,40000.0,1935,,0.08077,2.66329,,28/01/2022,1,0.0,High,Satisfactory,2019-08-20,0.1057,12.8,348.1,25.4,15.186,0.12,0,40000.0,0,10.5966597327836,0,Unknow,0,0,0,0,0,0
SOAD00131,Flumevale,Yes,Irrigation,Earth,4.061,0.273,13606.0,1890,,0.1576,42.0317136019988,,27/01/1989,6,10.81,Low,Satisfactory,2013-10-24,0.0332,13.8,215.3,47.2,4.061,0.273,0,13606.0,0,9.51833964519086,0,Unknow,0,0,0,1,0,0
SOAD01931,Flumevale,Yes,Recreation,Earth,3.076,0.075,9936.772020405804,Unknow,,0.1576,111.85818,Uncontrolled,30/07/2014,0,46.81,Low,Not Rated,,0.0934,36.7,180.0,8.2,3.076,0.075,0,,1,,0,Unknow,0,0,1,0,0,0
SOAD15512,Flumevale,Yes,"Fire Protection, Stock, Or Small Fish Pond",Earth,4.916,0.067,9885.09319153168,1976,,0.13002,21.30632,Uncontrolled,04/06/2010,6,25.78,Low,Not Rated,,0.0641,34.4,416.5,19.666090047881223,4.916,0.067,0,,1,,0,Unknow,0,0,1,0,0,0
SOAD02053,Flumevale,Yes,Debris Control,Earth,18.106,0.302,488000.0,1958,,0.06501,10.65316,,03/11/2021,1,0.84,High,Satisfactory,2017-09-01,0.1002,20.1,454.2,17.448923978478348,18.106,0.302,0,488000.0,0,13.0980727340135,0,Unknow,0,0,0,0,0,0
SOAD02640,Flumevale,Yes,Water Supply,Earth,8.159,0.657,52545.17151596922,1975,,0.04925,35.89429108498964,,17/10/2022,2,4.79,Significant,Fair,2022-10-17,0.1174,34.5,98.5,10.8,8.159,0.657,0,,1,,0,Unknow,0,0,1,1,0,0
SOAD04836,Flumevale,Yes,Water Supply,Earth,7.471,0.413,20000.0,1928,,0.16548,34.20501765973744,,30/06/2022,1,12.6,High,Satisfactory,2021-08-26,0.1048,27.0,289.4,34.7,7.471,0.413,0,20000.0,0,9.90353755128617,0,Unknow,0,0,0,1,0,0
SOAD07610,Flumevale,Yes,Irrigation,Earth,3.789,0.118,10314.112064378067,1895,,0.08668,41.45587431470144,,24/09/1984,6,43.88,Low,Not Rated,,0.032,31.2,163.8,17.6,3.789,0.118,0,,1,,0,Unknow,0,0,1,1,0,0
SOAD08076,Flumevale,Yes,Irrigation,Earth,2.704,0.108,10127.974127696101,1895,,0.17533,49.09680620986453,Uncontrolled,22/05/2018,6,17.7,Low,Not Rated,,0.1014,8.8,120.2,17.3,2.704,0.108,0,,1,,0,Unknow,0,0,1,1,0,0
SOAD10564,Flumevale,Yes,Water Supply,Earth,11.111,0.123,28000.0,1968,,0.09456,13.31645,,10/05/2022,1,0.0,Significant,Satisfactory,2017-09-01,0.1199,22.6,663.2,44.9,11.111,0.123,0,28000.0,0,10.2399955028053,0,Unknow,0,0,0,0,0,0
SOAD00698,Flumevale,Yes,Water Supply,Earth,11.215,0.117,22000.0,1952,,0.08274,10.65316,,06/04/2022,1,1.08,High,Satisfactory,2017-09-01,0.0928,14.4,911.6,9.6,11.215,0.117,0,22000.0,0,9.99884318585288,0,Unknow,0,0,0,0,0,0
SOAD06889,Flumevale,Yes,Water Supply,Earth,10.112,0.183,31754.0,1959,,0.08668,2.66329,,21/04/2022,1,19.07,High,Satisfactory,2017-09-01,0.09,27.4,171.3,26.9,10.112,0.183,0,31754.0,0,10.3658054722371,0,Unknow,0,0,0,0,0,0
SOAD06984,Flumevale,Yes,Flood Risk Reduction,Earth,11.291,0.34,400.0,1956,,0.0591,61.25567,,25/09/1998,6,0.0,Low,Satisfactory,2016-10-31,0.0601,10.8,168.3,13.744773698761016,11.291,0.34,0,400.0,0,5.99396142730657,0,Unknow,0,0,0,0,0,0
SOAD07590,Flumevale,Yes,Water Supply,Earth,10.933,0.098,14455.0,1955,,0.06501,32.347638980454825,,03/10/2014,6,10.09,Low,Not Rated,,0.0607,8.5,383.9,24.4,10.933,0.098,0,14455.0,0,9.57886483227206,0,Unknow,0,0,0,1,0,0
SOAD02803,Flumevale,Yes,Other,Earth,11.605,0.155,35000.0,1940,,0.09456,2.66329,,12/04/2022,0.5,49.05797781410848,Low,Satisfactory,2017-09-01,0.0674,5.9,18.8,19.02430308464943,11.605,0.155,0,35000.0,0,10.463131911492,0,Unknow,0,0,0,0,0,1
SOAD09719,Flumevale,Yes,Debris Control,Earth,20.406,0.269,367800.0,1997,,0.06698,5.32658,,23/02/2022,0.5,57.526385100270076,Low,Satisfactory,2017-09-01,0.0686,14.2,13.7,18.62246962532315,20.406,0.269,0,367800.0,0,12.8152973100176,0,Unknow,0,0,0,0,0,1
SOAD11161,Flumevale,Yes,"Fire Protection, Stock, Or Small Fish Pond",Earth,10.803,0.2,34770.28774234737,1966,,0.06698,32.15574505579004,Uncontrolled,05/10/2015,6,101.5,Low,Fair,2009-10-15,0.0562,4.8,181.6,23.4263725277742,10.803,0.2,0,,1,,0,Unknow,0,0,1,1,0,0
SOAD11573,Flumevale,Yes,Irrigation,Earth,2.498,0.183,15999.454483500072,1915,,0.13593,242.7023934249131,,17/07/1978,0,18.17,Low,Not Rated,,0.0818,11.8,412.4,16.7,2.498,0.183,0,,1,,0,Unknow,0,0,1,1,0,0
SOAD12562,Flumevale,Yes,Recreation,Earth,13.418,0.123,19425.0,1937,1965H;1965M;1965S,0.05122,45.00466618764247,Uncontrolled,03/08/2021,2,33.76,Significant,Fair,2021-08-03,0.1197,47.1,212.8,5.3,13.418,0.123,0,19425.0,0,9.87436765396228,3,1965,0,0,0,1,0,0
SOAD12616,Flumevale,Yes,Flood Risk Reduction,Earth,8.851,0.102,11449.0,1959,,0.03349,15.97974,,10/05/1988,3,1.67,Low,Fair,2016-05-17,0.0926,7.1,284.0,17.66965738083868,8.851,0.102,0,11449.0,0,9.34574500898239,0,Unknow,0,0,0,0,0,0
SOAD15582,Flumevale,Yes,Irrigation,Earth,5.006,0.167,14276.585863909319,1910,,0.01773,33.942695120556586,,25/08/1989,0,1.59,Low,Not Rated,,0.0624,20.1,527.9,11.0,5.006,0.167,0,,1,,0,Unknow,0,0,1,1,0,0
SOAD16389,Flumevale,Yes,Flood Risk Reduction,Earth,13.438,0.233,31343.0,1979,,0.08274,7.98987,Uncontrolled,19/08/2009,3,9.53,Low,Unsatisfactory,2008-07-01,0.0977,5.1,213.3,18.66093533524853,13.438,0.233,0,31343.0,0,10.3527781401843,0,Unknow,0,0,0,0,0,0
SOAD01142,Flumevale,Yes,Recreation,Earth,9.434,0.187,17330.0,1955,1993S,0.0591,41.7793542966654,Uncontrolled,13/12/2022,6,3.07,Low,Not Rated,,0.0916,28.4,916.6,6.1,9.434,0.187,0,17330.0,0,9.76025208444937,1,1993,0,0,0,1,0,0
SOAD08663,Flumevale,Yes,Irrigation,Earth,5.722,0.192,17861.0,1948,,0.06501,415.47324,Uncontrolled,14/04/2016,6,13.24,Low,Fair,2017-08-03,0.0475,15.8,301.8,17.9,5.722,0.192,0,17861.0,0,9.79043083024383,0,Unknow,0,0,0,0,0,0
SOAD09020,Flumevale,Yes,Fish and Wildlife Pond,Earth,2.897,0.633,50533.99179894542,1962,1986,0.23443,61.52322782403582,Uncontrolled,28/08/2019,6,0.0,Low,Not Rated,,0.0839,42.8,157.9,18.541308537256814,2.897,0.633,0,,1,,1,1986,0,0,1,1,0,0
SOAD10497,Flumevale,Yes,Irrigation,Earth,3.276,0.4,18489.0,1886,1988,0.11229,38.64761344146101,Uncontrolled,25/09/2013,6,3.09,Low,Not Rated,,0.051,39.2,807.3,13.0,3.276,0.4,0,18489.0,0,9.82498532438117,1,1988,0,0,0,1,0,0
SOAD11428,Flumevale,Yes,Fish and Wildlife Pond,Earth,6.713,0.107,8581.0,1912,2003S,0.09146544871595114,7.98987,Controlled,29/06/2017,10,17.47,Low,Not Rated,,0.0293,10.4,413.5,18.020506127180898,6.713,0.107,0,8581.0,0,9.05742226555147,1,2003,0,0,0,0,1,0
SOAD14414,Flumevale,Yes,Irrigation,Earth,3.346,0.36,11062.0,1882,,0.0925899999999999,52.04807827087796,,,6,11.63,Low,Not Rated,,0.0338,27.8,392.0,9.7,3.346,0.36,0,11062.0,0,9.31136148603491,0,Unknow,0,0,0,1,0,0
SOAD01955,Flumevale,Yes,Irrigation,Earth,8.381,0.139,12962.006541385112,1947,,0.08668,7.98987,,20/10/2021,6,28.3,Low,Unsatisfactory,2009-08-20,0.0854,30.4,230.2,29.8,8.381,0.139,0,,1,,0,Unknow,0,0,1,0,0,0
SOAD04235,Flumevale,Yes,Water Supply,Earth,10.482,0.172,20000.0,1957,,0.11623,2.66329,,10/02/2022,0.5,0.66,Low,Satisfactory,2017-09-01,0.066,25.2,345.6,32.8,10.482,0.172,0,20000.0,0,9.90353755128617,0,Unknow,0,0,0,0,0,0
SOAD08383,Flumevale,Yes,Water Supply,Earth,19.929,0.1,40000.0,1970,,0.05122,31.846454421110643,,01/09/2022,1,6.21,High,Satisfactory,2017-09-01,0.0835,10.8,288.4,55.4,19.929,0.1,0,40000.0,0,10.5966597327836,0,Unknow,0,0,0,1,0,0
SOAD14096,Flumevale,Yes,Irrigation,Earth,5.043,0.11,9019.0,1888,,0.10244,54.69227320267537,,16/07/2020,6,12.68,Low,Not Rated,,0.0467,40.5,250.3,3.1,5.043,0.11,0,9019.0,0,9.10719961305667,0,Unknow,0,0,0,1,0,0
SOAD14536,Flumevale,Yes,Water Supply,Earth,13.052,0.095,22000.0,1950,,0.0788,45.27593,,05/01/2022,0.5,48.683677825956714,Low,Satisfactory,2017-09-01,0.0701,42.5,9.4,51.0,13.052,0.095,0,22000.0,0,9.99884318585288,0,Unknow,0,0,0,0,0,1
SOAD17901,Flumevale,Yes,Water Supply,Earth,3.171,0.333,6000.0,1912,,0.20685,5.32658,,12/05/2022,1,0.0,High,Satisfactory,2017-09-01,0.0866,24.9,484.8,26.6,3.171,0.333,0,6000.0,0,8.69968140098951,0,Unknow,0,0,0,0,0,0
SOAD04231,Flumevale,Yes,Flood Risk Reduction,Earth,12.098,0.252,32140.0,1961,,0.09456,13.31645,,11/04/2018,3,37.6,Low,Fair,2020-05-14,0.0677,26.9,222.2,18.7451228672288,12.098,0.252,0,32140.0,0,10.3778877526843,0,Unknow,0,0,0,0,0,0
SOAD08047,Flumevale,Yes,"Fire Protection, Stock, Or Small Fish Pond",Earth,2.519,0.2,2834.0,1895,,0.12214,276.6671833732623,,24/09/2013,6,14.88,Low,Not Rated,,0.0511,35.2,415.0,16.41454858875461,2.519,0.2,0,2834.0,0,7.94979721616185,0,Unknow,0,0,0,1,0,0
SOAD11130,Flumevale,Yes,Irrigation,Earth,4.095,0.5,37339.0,1898,,0.10835,34.6687816429721,Uncontrolled,05/04/1995,6,0.0,Low,Fair,2020-10-07,0.0677,38.4,627.4,42.2,4.095,0.5,0,37339.0,0,10.5278204170957,0,Unknow,0,0,0,1,0,0
SOAD17828,Flumevale,Yes,"Fire Protection, Stock, Or Small Fish Pond",Earth,7.239,0.133,15679.0,1987,,0.08471,26.6329,Uncontrolled,05/02/2013,6,72.05,Low,Fair,2019-05-13,0.0451,34.3,234.4,22.421620742458916,7.239,0.133,0,15679.0,0,9.6601412939044,0,Unknow,0,0,0,0,0,0
SOAD00628,Flumevale,Yes,Irrigation,Earth,4.01,0.25,17580.0,1887,,0.07683,32.79050731129189,,,6,7.74,Low,Not Rated,,0.072,34.5,440.8,20.1,4.01,0.25,0,17580.0,0,9.77457405244279,0,Unknow,0,0,0,1,0,0
SOAD02291,Flumevale,Yes,Irrigation,Earth,3.034,0.383,1300.0,1890,,0.10441,44.006862667096854,,22/10/1984,6,13.19,Low,Not Rated,,0.0861,40.8,310.7,30.9,3.034,0.383,0,1300.0,0,7.1708884785125,0,Unknow,0,0,0,1,0,0
SOAD07071,Flumevale,Yes,Water Supply,Earth,4.846,0.2,6300.0,1941,,0.2364,21.30632,,04/11/2021,1,23.150863120731003,Significant,Satisfactory,2017-09-01,0.1198,14.6,197.1,21.6,4.846,0.2,0,6300.0,0,8.74846362994206,0,Unknow,0,0,0,0,0,1
SOAD09016,Flumevale,Yes,Flood Risk Reduction,Earth,8.992,0.202,22270.0,1958,,0.07486,7.98987,Uncontrolled,25/07/2013,3,1.61,Low,Fair,2012-02-01,0.0883,40.2,296.4,18.415654085212623,8.992,0.202,0,22270.0,0,10.0110406627009,0,Unknow,0,0,0,0,0,0
SOAD09973,Flumevale,No,"Fire Protection, Stock, Or Small Fish Pond",Earth,7.388,0.233,10371.0,1948,,0.13651495371197916,29.29619,Uncontrolled,05/09/2013,10,0.0,Low,Not Rated,,0.0419,32.3,888.7,20.44628944303681,7.388,0.233,0,10371.0,0,9.24686514665856,0,Unknow,0,0,0,0,1,0
SOAD14885,Flumevale,Yes,Water Supply,Earth,17.362,0.091,33500.0,1963,,0.04137,32.04755862165061,,11/08/2022,1,0.32,High,Satisfactory,2017-09-01,0.093,46.5,133.9,34.5,17.362,0.091,0,33500.0,0,10.4193305681139,0,Unknow,0,0,0,1,0,0
SOAD15977,Flumevale,Yes,Irrigation,Earth,4.384,0.65,49241.881586343385,1898,,0.14775,85.22528,Uncontrolled,01/01/1997,0,67.82,Low,Fair,2013-09-05,0.0891,24.1,101.5,2.9,4.384,0.65,0,,1,,0,Unknow,0,0,1,0,0,0
SOAD17352,Flumevale,Yes,"Fire Protection, Stock, Or Small Fish Pond",Earth,5.438,0.13,10622.129557866047,1901,,0.03349,34.580856703407065,,18/11/1993,0,26.26,Low,Satisfactory,2019-07-23,0.0588,6.1,411.1,21.54043888652709,5.438,0.13,0,,1,,0,Unknow,0,0,1,1,0,0
SOAD20030,Flumevale,Yes,Water Supply,Earth,6.955,0.331,27183.16185255874,1882,2013,0.06895,32.71706592700298,Uncontrolled,25/04/2022,2,0.0,Significant,Fair,2022-04-25,0.1389,46.0,297.2,26.8,6.955,0.331,0,,1,,1,2013,0,0,1,1,0,0
SOAD20095,Flumevale,Yes,Fish and Wildlife Pond,Earth,2.821,0.1,3700.0,1912,,0.20094,38.631308881919516,Uncontrolled,12/09/2018,5,54.32691641286522,Low,Unsatisfactory,2018-09-12,0.0792,34.5,17.4,20.64284160359284,2.821,0.1,0,3700.0,0,8.21635833238616,0,Unknow,0,0,0,1,0,1
SOAD05506,Flumevale,Yes,Water Supply,Earth,17.382,0.13,30000.0,1960,,0.12017,27.505588332427614,,18/08/2022,1,1.0284472333930668,High,Satisfactory,2017-09-01,0.0872,22.6,927.6,11.7,17.382,0.13,0,30000.0,0,10.3089859934221,0,Unknow,0,0,0,1,0,1
SOAD06906,Flumevale,Yes,"Fire Protection, Stock, Or Small Fish Pond",Earth,8.02,0.11,20676.0,1974,,0.07683,36.438763902261314,Uncontrolled,01/08/2017,6,42.93,Low,Satisfactory,2013-09-29,0.0398,34.2,235.6,19.359780213943473,8.02,0.11,0,20676.0,0,9.93677725040077,0,Unknow,0,0,0,1,0,0
SOAD16308,Flumevale,Yes,Irrigation,Earth,2.551,0.042,9838.431859115075,1913,,0.16745,246.76510810804942,Uncontrolled,04/08/1993,0,16.81,Low,Not Rated,,0.0884,13.0,254.1,46.4,2.551,0.042,0,,1,,0,Unknow,0,0,1,1,0,0
SOAD19646,Flumevale,Yes,Water Supply,Earth,6.258,0.232,18660.0,1965,,0.1379,2.66329,,19/01/2023,1,0.0,High,Poor,2023-03-09,0.1127,26.0,355.6,6.9,6.258,0.232,0,18660.0,0,9.83419106353347,0,Unknow,0,0,0,0,0,0
SOAD20479,Flumevale,Yes,Water Supply,Earth,10.175,0.247,13700.0,1967,,0.11426,5.32658,,24/01/2022,0.5,55.749581050580325,Low,Satisfactory,2022-03-01,0.0726,36.6,14.6,15.5,10.175,0.247,0,13700.0,0,9.52522410185311,0,Unknow,0,0,0,0,0,1
SOAD02187,Flumevale,Yes,Irrigation,Earth,7.515,0.265,14187.0,1968,,0.10047,34.62277,Uncontrolled,14/06/2016,6,21.53,Low,Unsatisfactory,2021-10-25,0.1008,36.2,232.4,14.7,7.515,0.265,0,14187.0,0,9.56015181589351,0,Unknow,0,0,0,0,0,0
SOAD04100,Flumevale,Yes,Water Supply,Earth,16.749,0.106,34500.0,1976,,0.0591,2.66329,,02/08/2022,1,1.0063916572473728,High,Satisfactory,2017-09-01,0.0845,44.8,858.0,50.2,16.749,0.106,0,34500.0,0,10.4487435881066,0,Unknow,0,0,0,0,0,1
SOAD19231,Flumevale,Yes,Water Supply,Earth,8.576,0.075,12570.0,1934,,0.05713,37.73468996128256,Uncontrolled,16/09/2021,6,26.4,Low,Fair,2021-05-12,0.0465,40.1,212.6,43.0,8.576,0.075,0,12570.0,0,9.43914785291483,0,Unknow,0,0,0,1,0,0
SOAD04372,Flumevale,Yes,Water Supply,Earth,13.762,0.185,39000.0,1971,,0.08668,2.66329,,16/02/2022,1,0.0,Significant,Satisfactory,2017-09-01,0.1368,22.8,213.8,49.4,13.762,0.185,0,39000.0,0,10.5713425658087,0,Unknow,0,0,0,0,0,0
SOAD07018,Flumevale,Yes,Irrigation,Earth,12.414,0.265,43171.89545071136,1950,1961,0.06501,33.120286421182094,,09/09/2013,6,23.15,Low,Fair,2009-10-27,0.0599,23.5,228.5,16.2,12.414,0.265,0,,1,,1,1961,0,0,1,1,0,0
SOAD07242,Flumevale,Yes,Fish and Wildlife Pond,Earth,3.738,0.047,1622.0,1890,,0.10441,35.23255329689954,,24/09/2013,6,44.1,Low,Not Rated,,0.0581,39.8,165.9,24.238090909744827,3.738,0.047,0,1622.0,0,7.39203156751459,0,Unknow,0,0,0,1,0,0
SOAD08139,Flumevale,Yes,Other,Earth,10.627,0.133,9756.0,1937,,0.16942,207.73662,,27/04/2022,0.5,45.90721527045662,Low,Satisfactory,2017-09-01,0.0642,25.6,10.7,15.060578145625346,10.627,0.133,0,9756.0,0,9.18574025510795,0,Unknow,0,0,0,0,0,1
SOAD10443,Flumevale,Yes,Irrigation,Earth,3.455,0.087,10045.718748776535,1885,,0.13987,49.892815792690236,,30/05/1984,6,8.4,Low,Not Rated,,0.0764,5.1,122.0,26.7,3.455,0.087,0,,1,,0,Unknow,0,0,1,1,0,0
SOAD11684,Flumevale,Yes,Flood Risk Reduction,Earth,9.711,0.189,19854.0,1958,,0.08471,7.98987,Uncontrolled,04/06/2015,3,6.29,Low,Fair,2020-09-15,0.0944,45.0,98.5,18.74369341792604,9.711,0.189,0,19854.0,0,9.89621114356535,0,Unknow,0,0,0,0,0,0
SOAD16824,Flumevale,Yes,Water Supply,Earth,13.498,0.132,24000.0,1961,,0.08471,5.32658,,10/05/2022,1,0.0,High,Satisfactory,2017-09-01,0.1017,17.2,199.8,4.9,13.498,0.132,0,24000.0,0,10.0858507751287,0,Unknow,0,0,0,0,0,0
SOAD19219,Flumevale,Yes,Water Supply,Earth,7.739,0.13,13867.0,1929,,0.11229,39.027268327728166,,17/08/2017,6,27.02,Low,Not Rated,,0.0316,15.7,126.4,60.9,7.739,0.13,0,13867.0,0,9.53733930680491,0,Unknow,0,0,0,1,0,0
SOAD19755,Flumevale,Yes,Hydroelectric,Earth,10.853,0.148,9630.0,1908,,0.09653,237.03281,Uncontrolled,20/07/2023,1,23.35,Significant,Fair,2023-09-29,0.1471,7.3,167.1,78.7,10.853,0.148,0,9630.0,0,9.17274234156086,0,Unknow,0,0,0,0,0,0
SOAD00148,Flumevale,Yes,Irrigation,Earth,4.071,0.165,6464.0,1925,2001,0.20094,51.67778727103214,Uncontrolled,06/06/2019,6,14.55,Low,Satisfactory,2020-03-05,0.04,12.2,282.7,5.7,4.071,0.165,0,6464.0,0,8.77415829120596,1,2001,0,0,0,1,0,0
SOAD01445,Flumevale,Yes,Flood Risk Reduction,Earth,8.349,0.667,85000.0,2007,,0.09653,95.87844,,01/06/2022,0.5,54.12225480062499,Low,Satisfactory,2017-09-01,0.0609,28.7,5.3,12.196043368678867,8.349,0.667,0,85000.0,0,11.3504183001091,0,Unknow,0,0,0,0,0,1
SOAD09522,Flumevale,Yes,Flood Risk Reduction,Earth,10.539,0.247,19815.0,1964,,0.0788,21.30632,,15/03/2007,3,9.17,Low,Fair,2016-09-01,0.0865,10.2,377.0,18.96847162102876,10.539,0.247,0,19815.0,0,9.8942449711692,0,Unknow,0,0,0,0,0,0
SOAD10775,Flumevale,Yes,"Fire Protection, Stock, Or Small Fish Pond",Earth,7.922,0.23,23746.085088937663,1949,,0.17139,7.98987,,08/03/1991,0,28.61,Low,Not Rated,,0.0859,24.2,358.0,19.388966964579605,7.922,0.23,0,,1,,0,Unknow,0,0,1,0,0,0
SOAD11145,Flumevale,No,Irrigation,Earth,10.128,0.167,58000.0,1958,,0.08732137355128283,50.14821918055629,,17/09/2020,6,0.0,Low,Not Available,,0.027,30.1,462.4,45.4,10.128,0.167,0,58000.0,0,10.9682155307592,0,Unknow,0,0,0,1,1,0
SOAD11648,Flumevale,Yes,Water Supply,Earth,17.408,0.07,50000.0,Unknow,,0.06501,2.66329,,23/06/2022,1,0.0,High,Satisfactory,2017-09-01,0.1077,28.3,277.1,31.7,17.408,0.07,0,50000.0,0,10.8197982842103,0,Unknow,0,0,0,0,0,0
SOAD08342,Flumevale,Yes,"Fire Protection, Stock, Or Small Fish Pond",Earth,6.345,0.16,13029.722651057195,1909,,0.09653,7.98987,,13/04/1992,0,98.26,Low,Fair,2010-07-22,0.0767,34.6,140.8,21.585333993664477,6.345,0.16,0,,1,,0,Unknow,0,0,1,0,0,0
SOAD10556,Flumevale,Yes,Other,Earth,6.254,0.229,20244.0,1948,,0.14184,5.32658,,04/02/2022,1,7.601471018540868,Significant,Satisfactory,2017-09-01,0.1282,9.4,448.4,19.644601077105236,6.254,0.229,0,20244.0,0,9.91566312846626,0,Unknow,0,0,0,0,0,1
SOAD11276,Flumevale,Yes,"Fire Protection, Stock, Or Small Fish Pond",Earth,7.02,0.17,16065.877903744737,1907,,0.07486,32.035275108659064,,25/04/1991,0,9.64,Low,Not Rated,,0.1158,27.1,385.7,21.616651451787984,7.02,0.17,0,,1,,0,Unknow,0,0,1,1,0,0
SOAD17660,Flumevale,Yes,"Fire Protection, Stock, Or Small Fish Pond",Earth,7.174,0.26,36401.0,1908,,0.17336,34.39500575993328,,06/04/1988,6,8.13,Low,Fair,2015-07-01,0.057,46.4,438.5,20.884216170795295,7.174,0.26,0,36401.0,0,10.5023789971704,0,Unknow,0,0,0,1,0,0
SOAD19408,Flumevale,Yes,Recreation,Earth,13.532,0.207,55111.0,1940,,0.06698,7.98987,,23/09/2022,6,35.56,Low,Not Rated,,0.0542,32.4,225.5,8.6,13.532,0.207,0,55111.0,0,10.917122757273,0,Unknow,0,0,0,0,0,0
SOAD20675,Flumevale,Yes,Debris Control,Earth,18.749,0.318,454000.0,1960,,0.07289,90.55186,,12/10/2022,0.5,50.298079963333365,Low,Fair,2017-09-01,0.0871,38.6,22.9,11.292491971534483,18.749,0.318,0,454000.0,0,13.0258546796642,0,Unknow,0,0,0,0,0,1
SOAD02135,Flumevale,No,Other,Earth,5.405,0.4,30587.687379364274,Unknow,,0.10790723155265515,34.30679808364683,,,Unknow,6.37,Low,Not Available,,0.1266,8.2,425.1,21.79956099238147,5.405,0.4,0,,1,,0,Unknow,0,0,1,1,1,0
SOAD08590,Flumevale,No,Irrigation,Earth,10.008,0.29,58000.0,1959,,0.0906199999999999,7.98987,,23/10/2014,6,0.0,Low,Not Available,,0.0742,26.0,123.0,30.8,10.008,0.29,0,58000.0,0,10.9682155307592,0,Unknow,0,0,0,0,0,0
SOAD11068,Flumevale,Yes,Recreation,Earth,3.424,0.45,34452.0,1889,,0.13002,62.493207879935206,Uncontrolled,16/02/2021,2,0.0,Significant,Satisfactory,2021-02-16,0.1063,10.2,296.0,3.3,3.424,0.45,0,34452.0,0,10.4473513553789,0,Unknow,0,0,0,1,0,0
SOAD14567,Flumevale,Yes,Water Supply,Earth,28.082,0.168,38577.0,1980,,0.04137,7.98987,,06/08/2014,6,13.9,Low,Satisfactory,2019-06-05,0.0365,36.7,200.0,36.6,28.082,0.168,0,38577.0,0,10.5604374447842,0,Unknow,0,0,0,0,0,0
SOAD20277,Flumevale,Yes,Flood Risk Reduction,Earth,8.518,0.256,25222.302041620223,1970,,0.06895,32.47605457993501,,20/10/1992,3,134.88,Low,Fair,2018-10-26,0.0854,38.5,173.8,22.499305826258457,8.518,0.256,0,,1,,0,Unknow,0,0,1,1,0,0
SOAD02808,Flumevale,Yes,Other,Earth,9.867,0.17,40000.0,1967,,0.13002,2.66329,,22/02/2022,0.5,50.53889686337052,Low,Satisfactory,2017-09-01,0.0761,24.9,18.5,19.953809826140173,9.867,0.17,0,40000.0,0,10.5966597327836,0,Unknow,0,0,0,0,0,1
SOAD14728,Flumevale,Yes,Hydroelectric,Earth,3.059,0.112,300.0,1870,,0.20685,2.66329,Uncontrolled,18/08/2016,3,53.612089800051415,Low,Satisfactory,2023-09-29,0.0618,25.9,21.9,60.56326944444451,3.059,0.112,0,300.0,0,5.70711026474888,0,Unknow,0,0,0,0,0,1
SOAD15797,Flumevale,Yes,Irrigation,Earth,7.513,0.037,17889.0,1960,,0.06895,33.189820846364675,Uncontrolled,26/10/2018,6,4.62,Low,Not Rated,,0.0791,30.8,500.1,29.1,7.513,0.037,0,17889.0,0,9.79199717650276,0,Unknow,0,0,0,1,0,0
SOAD01849,Flumevale,Yes,Irrigation,Earth,9.662,0.253,29555.0,1901,1972H;1972M;1972S,0.06698,32.47605457993501,Uncontrolled,03/08/2021,2,16.4,Significant,Satisfactory,2021-08-03,0.1248,4.9,165.6,26.1,9.662,0.253,0,29555.0,0,10.2940420479085,3,1972,0,0,0,1,0,0
SOAD04727,Flumevale,Yes,Flood Risk Reduction,Earth,9.319,0.22,27325.0,1957,,0.07486,7.98987,Uncontrolled,06/10/2020,3,24.42,Low,Not Rated,,0.0712,46.9,358.3,18.59711775294799,9.319,0.22,0,27325.0,0,10.2155939088984,0,Unknow,0,0,0,0,0,0
SOAD04764,Flumevale,Yes,Water Supply,Earth,9.074,0.933,61107.4200848567,1978,,0.04925,92.16707370561195,Uncontrolled,15/09/2022,2,1.61,Significant,Fair,2022-09-15,0.1301,19.8,95.7,35.0,9.074,0.933,0,,1,,0,Unknow,0,0,1,1,0,0
SOAD05032,Flumevale,Yes,Fish and Wildlife Pond,Earth,3.117,0.053,9838.431859115075,1935,,0.12214,37.117546006560616,,22/10/1984,0,8.14,Low,Satisfactory,2018-12-11,0.0702,24.2,118.2,20.75210135236649,3.117,0.053,0,,1,,0,Unknow,0,0,1,1,0,0
SOAD06803,Flumevale,Yes,"Fire Protection, Stock, Or Small Fish Pond",Earth,6.584,0.308,24872.982000296353,1973,,0.16745,33.28672896881779,,13/11/1991,0,28.51,Low,Not Rated,,0.1087,37.4,254.5,22.69576572959919,6.584,0.308,0,,1,,0,Unknow,0,0,1,1,0,0
SOAD07688,Flumevale,Yes,Irrigation,Earth,3.79,0.567,61002.0,1902,,0.13396,46.07640880692168,,13/06/1986,6,4.91,Low,Not Rated,,0.0427,29.3,358.1,15.9,3.79,0.567,0,61002.0,0,11.018678322274,0,Unknow,0,0,0,1,0,0
SOAD12697,Flumevale,Yes,Flood Risk Reduction,Earth,11.433,0.38,36120.0,1961,,0.08668,7.98987,Uncontrolled,11/04/2018,3,36.11,Low,Fair,2019-08-08,0.0829,24.1,159.8,17.260514679543835,11.433,0.38,0,36120.0,0,10.4946296926405,0,Unknow,0,0,0,0,0,0
SOAD13357,Flumevale,Yes,Flood Risk Reduction,Earth,11.653,0.312,35400.0,1955,,0.09456,7.98987,Uncontrolled,22/04/2014,3,8.22,Low,Fair,2015-08-25,0.0901,32.3,314.4,18.18083551228654,11.653,0.312,0,35400.0,0,10.4744953473105,0,Unknow,0,0,0,0,0,0
SOAD15302,Flumevale,Yes,"Fire Protection, Stock, Or Small Fish Pond",Earth,9.822,0.328,32407.027576501874,1963,,0.10441,13.31645,,05/03/1987,0,118.36,Low,Unsatisfactory,2013-09-27,0.1247,22.6,85.3,19.191815591164207,9.822,0.328,0,,1,,0,Unknow,0,0,1,0,0,0
SOAD10142,Flumevale,Yes,Recreation,Earth,7.546,0.073,3681.0,1969,,0.09456,7.98987,Uncontrolled,01/09/2010,10,195.49,Low,Not Rated,2020-08-25,0.0704,16.9,104.6,6.1,7.546,0.073,0,3681.0,0,8.21121136179302,0,Unknow,0,0,0,0,0,0
SOAD10670,Flumevale,Yes,Flood Risk Reduction,Earth,12.807,0.233,27127.0,1956,,0.08077,7.98987,Uncontrolled,01/11/2011,6,6.23,Low,Satisfactory,2021-07-22,0.0285,23.8,283.6,18.22309538889449,12.807,0.233,0,27127.0,0,10.2083216838055,0,Unknow,0,0,0,0,0,0
SOAD11734,Flumevale,Yes,Water Supply,Earth,14.897,0.08,25000.0,1926,,0.0906199999999999,7.98987,,12/04/2023,1,11.181427371303693,Significant,Poor,2017-09-01,0.1489,42.3,248.1,55.0,14.897,0.08,0,25000.0,0,10.1266711030504,0,Unknow,0,0,0,0,0,1
SOAD12965,Flumevale,Yes,"Fire Protection, Stock, Or Small Fish Pond",Earth,10.411,0.117,25708.52636404122,1905,,0.15957,37.28606,Uncontrolled,16/08/2018,6,19.98,Low,Satisfactory,2018-10-23,0.0559,32.8,143.0,19.996179787931094,10.411,0.117,0,,1,,0,Unknow,0,0,1,0,0,0
SOAD13044,Flumevale,Yes,Water Supply,Earth,8.558,0.08,4452.0,Unknow,,0.10638,45.29619095903066,,18/07/2023,1,0.16,High,Fair,2017-09-01,0.1153,45.8,751.9,5.3,8.558,0.08,0,4452.0,0,8.4013333053217,0,Unknow,0,0,0,1,0,0
SOAD17134,Flumevale,Yes,Irrigation,Earth,6.292,0.212,20421.72540306574,Unknow,,0.08668,7.98987,Uncontrolled,24/08/2021,6,16.81,Low,Not Rated,,0.0935,35.7,197.3,34.6,6.292,0.212,0,,1,,0,Unknow,0,0,1,0,0,0
SOAD18649,Flumevale,Yes,Irrigation,Earth,8.495,0.057,2450.0,1959,,0.04925,39.36705517679488,Uncontrolled,30/09/2016,6,40.0,Low,Satisfactory,2019-07-16,0.0361,12.5,164.1,41.7,8.495,0.057,0,2450.0,0,7.80425138352811,0,Unknow,0,0,0,1,0,0
SOAD18900,Flumevale,Yes,Irrigation,Earth,3.429,0.757,39774.0,1887,,0.12608,45.433850143570155,,01/07/1987,6,11.04,Low,Not Rated,,0.0435,10.6,232.1,37.1,3.429,0.757,0,39774.0,0,10.590993853206,0,Unknow,0,0,0,1,0,0
SOAD00478,Flumevale,Yes,Water Supply,Earth,4.373,0.144,11580.0,1955,,0.21473,36.930669752304496,,11/05/2022,0.5,48.04755137310769,Low,Satisfactory,2017-09-01,0.0652,28.6,23.7,14.9,4.373,0.144,0,11580.0,0,9.35712110318438,0,Unknow,0,0,0,1,0,1
SOAD09072,Flumevale,Yes,Recreation,Earth,3.498,0.21,17699.23461397251,1965,,0.10441,50.60251,,11/06/2008,6,76.8,Low,Not Rated,,0.042,15.6,171.5,9.5,3.498,0.21,0,,1,,0,Unknow,0,0,1,0,0,0
SOAD13589,Flumevale,Yes,Irrigation,Earth,17.186,0.145,62574.96457699275,1922,,0.30141,48.317862731594836,Uncontrolled,23/04/1992,0,21.64,Low,Not Rated,,0.11,318.8,289.1,20.9,17.186,0.145,0,,1,,0,Unknow,0,0,1,1,0,0
SOAD14204,Flumevale,Yes,Irrigation,Earth,5.822,1.167,54675.0,1902,,0.10244,57.74693271333021,Uncontrolled,24/09/2013,6,11.25,Low,Not Rated,,0.0918,27.8,345.1,22.2,5.822,1.167,0,54675.0,0,10.9091801352725,0,Unknow,0,0,0,1,0,0
SOAD16001,Flumevale,Yes,Irrigation,Earth,8.018,0.275,16089.0,1963,,0.0985,80.28537022745172,,21/04/2022,6,27.51,Low,Fair,2022-10-18,0.0448,18.7,231.9,7.8,8.018,0.275,0,16089.0,0,9.68595323998643,0,Unknow,0,0,0,1,0,0
SOAD01621,Flumevale,Yes,Irrigation,Earth,4.71,0.31,21433.0,1893,,0.197,33.921010403023814,Uncontrolled,04/02/2021,2,3.19,Significant,Satisfactory,2021-02-04,0.1187,44.0,170.8,31.8,4.71,0.31,0,21433.0,0,9.97273372527294,0,Unknow,0,0,0,1,0,0
SOAD02733,Flumevale,No,Fish and Wildlife Pond,Earth,4.787,0.15,11254.946999518497,1907,,0.09718602899329194,39.924726637419916,Uncontrolled,08/08/2008,10,62.3580907924926,Low,Not Rated,,0.0143,17.1,16.2,20.364845667552746,4.787,0.15,0,,1,,0,Unknow,0,0,1,1,1,1
SOAD07628,Flumevale,Yes,Water Supply,Earth,5.851,1.2,47000.0,1954,,0.20291,18.64303,,26/04/2022,0.5,1.66,Low,Satisfactory,2017-09-01,0.0672,25.6,338.5,6.7,5.851,1.2,0,47000.0,0,10.7579241570616,0,Unknow,0,0,0,0,0,0
SOAD15279,Flumevale,No,Other,Earth,10.616,0.267,37842.20015206575,Unknow,,0.5978494770498503,95.4765852812782,,,Unknow,3.22,Significant,Not Available,,0.152,233.9,666.2,20.621492398286165,10.616,0.267,0,,1,,0,Unknow,0,0,1,1,1,0
SOAD01579,Flumevale,Yes,Fish and Wildlife Pond,Earth,11.591,0.067,10501.0,1967,,0.0886499999999999,13.31645,Controlled,09/07/2013,Unknow,17.84,Significant,Not Rated,,0.1435,41.7,252.2,16.240728888885332,11.591,0.067,0,10501.0,0,9.2593209941978,0,Unknow,0,0,0,0,0,0
SOAD04189,Flumevale,Yes,Irrigation,Earth,8.731,0.1,11736.0,1903,,0.11229,39.22990529287302,Uncontrolled,25/09/2018,6,13.87,Low,Satisfactory,2015-10-23,0.0367,34.3,461.4,33.4,8.731,0.1,0,11736.0,0,9.37050152410012,0,Unknow,0,0,0,1,0,0
SOAD13787,Flumevale,Yes,Water Supply,Earth,19.014,0.193,58835.0,1952,,0.06895,5.32658,,07/04/2022,1,0.0,High,Satisfactory,2017-09-01,0.0765,6.3,252.1,9.6,19.014,0.193,0,58835.0,0,10.9825091914392,0,Unknow,0,0,0,0,0,0
SOAD02019,Flumevale,Yes,Irrigation,Earth,6.514,0.173,6334.0,1896,,0.13002,13.31645,,29/10/1984,6,8.3,Low,Fair,2014-11-06,0.052,13.2,448.1,18.5,6.514,0.173,0,6334.0,0,8.75384509275524,0,Unknow,0,0,0,0,0,0
SOAD09312,Flumevale,Yes,Water Supply,Earth,6.33,0.24,9400.0,1948,,9.65891,34.62277,,16/06/2022,0.5,45.083803098148366,Low,Satisfactory,2017-09-01,0.0586,741.3,17.8,64.9,6.33,0.24,0,9400.0,0,9.14857134557855,0,Unknow,0,0,0,0,0,1
SOAD02372,Flumevale,Yes,Irrigation,Earth,4.188,0.093,1699.0,1922,,0.21473,36.256432299820105,Uncontrolled,23/07/2021,6,16.89,Low,Fair,2021-08-12,0.0607,18.3,304.2,14.3,4.188,0.093,0,1699.0,0,7.43838353004431,0,Unknow,0,0,0,1,0,0
SOAD04419,Flumevale,Yes,Unknow,Earth,5.435,1.093,64919.227160757175,Unknow,,0.09653,109.45096942073704,Uncontrolled,04/09/2020,6,81.24994304519525,Low,Fair,2021-06-30,0.0512,27.0,20.9,16.66862581363445,5.435,1.093,0,,1,,0,Unknow,0,0,1,1,0,1
SOAD06063,Flumevale,Yes,Fish and Wildlife Pond,Earth,6.528,0.091,10193.0,1920,,0.12411,13.31645,Uncontrolled,29/06/2017,6,46.82,Low,Satisfactory,2020-07-14,0.0502,29.4,127.6,22.207897848289356,6.528,0.091,0,10193.0,0,9.22955459089999,0,Unknow,0,0,0,0,0,0
SOAD08026,Flumevale,Yes,Flood Risk Reduction,Earth,10.518,0.235,31800.0,1957,,0.08077,7.98987,Uncontrolled,15/04/2014,3,8.14,Low,Fair,2018-10-31,0.0948,15.0,159.9,18.43267339782059,10.518,0.235,0,31800.0,0,10.3672530148147,0,Unknow,0,0,0,0,0,0
SOAD16090,Flumevale,Yes,Water Supply,Earth,7.198,0.952,72000.0,2005,,0.08668,65.73757537798626,Uncontrolled,22/07/2022,1,6.56,High,Satisfactory,2022-07-22,0.0868,26.1,383.0,8.7,7.198,0.952,0,72000.0,0,11.1844352867906,0,Unknow,0,0,0,1,0,0
SOAD01767,Flumevale,No,"Fire Protection, Stock, Or Small Fish Pond",Earth,16.067,0.13,58077.99705163408,1953,1980,0.05319,23.96961,Uncontrolled,23/06/2017,3,0.0,Low,Fair,2017-06-23,0.0941,30.1,781.2,19.740246182028873,16.067,0.13,0,,1,,1,1980,0,0,1,0,0,0
SOAD09843,Flumevale,Yes,Water Supply,Earth,12.036,0.113,16400.0,1958,,0.10441,7.98987,,29/06/2022,0.5,51.585139411631296,Low,Satisfactory,2017-09-01,0.0672,5.6,19.4,52.4,12.036,0.113,0,16400.0,0,9.70509758756311,0,Unknow,0,0,0,0,0,1
SOAD18139,Flumevale,Yes,Flood Risk Reduction,Earth,16.465,0.192,27170.0,1976,,0.08471,7.98987,Uncontrolled,01/06/2016,3,39.71,Low,Not Rated,,0.0801,37.9,137.6,19.195365268263757,16.465,0.192,0,27170.0,0,10.2099055070431,0,Unknow,0,0,0,0,0,0
SOAD03262,Flumevale,Yes,Water Supply,Earth,5.412,0.613,19000.0,1960,,0.32899,127.83792,,27/04/2022,1,3.23,High,Satisfactory,2017-09-01,0.1047,486.0,846.4,71.3,5.412,0.613,0,19000.0,0,9.85224688834253,0,Unknow,0,0,0,0,0,0
SOAD06516,Flumevale,Yes,Water Supply,Earth,6.187,0.36,31500.0,1985,,0.10244,32.874347499682145,,10/10/2022,0.5,52.25427794238245,Low,Fair,2017-09-01,0.0832,26.5,21.0,71.0,6.187,0.36,0,31500.0,0,10.3577745703416,0,Unknow,0,0,0,1,0,1
SOAD09527,Flumevale,Yes,Water Supply,Earth,7.441,0.1,10000.0,2013,,0.12608,37.13470105336337,,08/02/2023,0.5,48.12757258678192,Low,Fair,2017-09-01,0.0785,34.2,9.7,20.0,7.441,0.1,0,10000.0,0,9.21044036697652,0,Unknow,0,0,0,1,0,1
SOAD14241,Flumevale,Yes,Irrigation,Earth,11.266,0.108,14733.0,1946,,0.08077,7.98987,Uncontrolled,24/07/2018,6,26.87,Low,Not Rated,,0.0913,41.1,340.4,6.8,11.266,0.108,0,14733.0,0,9.59791302724276,0,Unknow,0,0,0,0,0,0
SOAD09119,Flumevale,Yes,Irrigation,Earth,10.627,0.089,23494.702375670622,1966,,0.0906199999999999,15.97974,Uncontrolled,16/05/2018,6,47.79,Low,Not Rated,,0.0658,5.6,83.0,45.9,10.627,0.089,0,,1,,0,Unknow,0,0,1,0,0,0
SOAD13835,Flumevale,Yes,"Fire Protection, Stock, Or Small Fish Pond",Earth,11.567,0.184,35486.08840354598,Unknow,1975;1985,0.07486,32.15574505579004,Uncontrolled,09/09/2013,0,27.69,Low,Satisfactory,2021-06-09,0.0636,6.0,282.5,21.979027506705382,11.567,0.184,0,,1,,2,1985,0,0,1,1,0,0
SOAD17802,Flumevale,Yes,Water Supply,Earth,7.986,0.167,12100.0,2004,,0.0591,29.76605002615185,,15/12/2021,1,0.9561395865677713,High,Satisfactory,2017-09-01,0.1093,26.5,898.5,56.2,7.986,0.167,0,12100.0,0,9.40104337279805,0,Unknow,0,0,0,1,0,1
SOAD07149,Flumevale,Yes,Water Supply,Earth,9.765,0.367,49000.0,1953,,0.10835,32.619332617691626,,22/03/2022,1,0.8,Significant,Satisfactory,2017-09-01,0.1173,39.6,201.4,64.8,9.765,0.367,0,49000.0,0,10.7995959850478,0,Unknow,0,0,0,1,0,0
SOAD12331,Flumevale,Yes,Irrigation,Earth,8.719,0.15,25369.0,1902,,0.07683,36.88117266673248,,29/10/2018,6,15.74,Low,Satisfactory,2018-04-11,0.044,16.5,383.0,15.1,8.719,0.15,0,25369.0,0,10.1413226525933,0,Unknow,0,0,0,1,0,0
SOAD15418,Flumevale,Yes,Recreation,Earth,4.324,0.283,22003.465066482753,1970,2015,0.11229,49.811373720508136,Controlled,,6,1.67,Low,Fair,2020-10-06,0.0647,29.6,714.8,6.3,4.324,0.283,0,,1,,1,2015,0,0,1,1,0,0
SOAD16131,Flumevale,Yes,Irrigation,Earth,8.703,0.232,31119.0,1950,1951,0.10244,32.95775614710423,Uncontrolled,24/09/2013,6,11.6,Low,Not Rated,,0.1014,45.3,317.7,10.7,8.703,0.232,0,31119.0,0,10.3456059782923,1,1951,0,0,0,1,0,0
SOAD16539,Flumevale,Yes,Water Supply,Earth,21.461,0.153,81777.0,1903,,0.04728,38.43218452355152,,19/07/2022,1,3.35,High,Satisfactory,2022-07-19,0.1071,20.4,818.5,21.7,21.461,0.153,0,81777.0,0,11.3117635377624,0,Unknow,0,0,0,1,0,0
SOAD19774,Flumevale,Yes,Flood Risk Reduction,Earth,5.868,0.564,21215.0,1957,,0.1379,7.98987,,23/07/1980,6,20.0,Low,Satisfactory,2022-04-21,0.0341,31.7,333.2,20.202623857363207,5.868,0.564,0,21215.0,0,9.96251089298559,0,Unknow,0,0,0,0,0,0
SOAD03373,Flumevale,Yes,Flood Risk Reduction,Earth,24.042,0.063,50610.0,1963,,0.0591,13.31645,,22/07/2022,1,0.0,High,Satisfactory,2017-09-01,0.092,25.5,214.6,17.508889058844883,24.042,0.063,0,50610.0,0,10.8319242229538,0,Unknow,0,0,0,0,0,0
SOAD03636,Flumevale,Yes,Irrigation,Earth,3.835,0.448,22164.0,1948,,0.10244,49.54192525207256,,05/04/1978,6,3.07,Low,Fair,2019-04-01,0.0509,26.8,815.6,6.9,3.835,0.448,0,22164.0,0,10.0062697471792,0,Unknow,0,0,0,1,0,0
SOAD06297,Flumevale,Yes,Water Supply,Earth,4.49,1.143,109000.0,1956,,0.02758,50.623718018938675,,29/03/2022,1,0.582187924050871,High,Fair,2017-09-01,0.1055,27.4,512.7,44.1,4.49,1.143,0,109000.0,0,11.5991123354811,0,Unknow,0,0,0,1,0,1
SOAD20733,Flumevale,Yes,Water Supply,Earth,7.794,0.152,10200.0,1941,,0.16942,2.66329,,28/06/2023,0.5,47.157188658125555,Low,Fair,2021-11-08,0.0807,29.0,8.8,50.3,7.794,0.152,0,10200.0,0,9.23024103368252,0,Unknow,0,0,0,0,0,1
SOAD00575,Flumevale,Yes,Water Supply,Earth,12.076,0.112,12160.0,1959,,0.10441,18.64303,,09/02/2022,1,2.1587398151267028,High,Satisfactory,2017-09-01,0.1001,18.6,487.9,42.5,12.076,0.112,0,12160.0,0,9.405989388981,0,Unknow,0,0,0,0,0,1
SOAD05240,Flumevale,Yes,Recreation,Earth,9.881,0.16,22343.55267768595,1956,,0.08668,79.8987,Uncontrolled,20/09/2021,2,32.15,Significant,Fair,2021-09-20,0.1453,24.1,98.1,3.7,9.881,0.16,0,,1,,0,Unknow,0,0,1,0,0,0
SOAD08739,Flumevale,Yes,Flood Risk Reduction,Earth,8.453,0.271,24480.0,1963,,0.11229,13.31645,,03/04/2019,3,16.75,Low,Fair,2018-09-20,0.0754,29.3,429.1,19.300319555375452,8.453,0.271,0,24480.0,0,10.1056525854651,0,Unknow,0,0,0,0,0,0
SOAD13020,Flumevale,Yes,Irrigation,Earth,6.846,0.08,10322.085159180295,1948,,0.03349,69.24554,Uncontrolled,14/08/2006,0,4.91,Low,Satisfactory,2017-10-11,0.0683,32.1,551.6,44.3,6.846,0.08,0,,1,,0,Unknow,0,0,1,0,0,0
SOAD02675,Flumevale,Yes,Recreation,Earth,14.725,0.108,32609.0,1971,,0.06895,21.30632,Uncontrolled,21/09/2021,6,4.92,Low,Fair,2022-10-25,0.066,23.5,729.4,4.0,14.725,0.108,0,32609.0,0,10.3923742687834,0,Unknow,0,0,0,0,0,0
SOAD20022,Flumevale,Yes,Fish and Wildlife Pond,Earth,4.838,0.1,10082.497214526473,1973,,0.0925899999999999,13.31645,Uncontrolled,04/09/1991,6,21.51,Low,Satisfactory,2020-07-20,0.0264,24.4,355.3,18.761708879297846,4.838,0.1,0,,1,,0,Unknow,0,0,1,0,0,0
SOAD01097,Flumevale,Yes,Unknow,Earth,3.714,0.767,49094.576449598906,Unknow,,0.18715,34.70797948912441,Uncontrolled,,0,53.29,Low,Not Rated,,0.0866,21.8,144.6,23.856786767124312,3.714,0.767,0,,1,,0,Unknow,0,0,1,1,0,0
SOAD03522,Flumevale,Yes,Irrigation,Earth,5.349,0.433,88271.0,1902,,0.14184,35.39620770646254,Uncontrolled,29/04/2021,6,0.0,Low,Not Rated,,0.0577,39.9,520.9,38.1,5.349,0.433,0,88271.0,0,11.3881782355122,0,Unknow,0,0,0,1,0,0
SOAD12225,Flumevale,Yes,"Fire Protection, Stock, Or Small Fish Pond",Earth,10.83,0.25,36705.21083622685,1915,,0.10835,33.40317213589416,,24/05/2023,1,24.044824694098022,Significant,Fair,2017-09-01,0.1465,22.9,139.8,20.83747369274248,10.83,0.25,0,,1,,0,Unknow,0,0,1,1,0,1
SOAD07006,Flumevale,Yes,Fish and Wildlife Pond,Earth,14.281,0.292,25200.0,1978,2004H,0.13396,151.80753,,22/08/2018,5,52.574353140364366,Low,Poor,2018-08-22,0.0707,8.5,19.8,14.3638092917419,14.281,0.292,0,25200.0,0,10.1346389552519,1,2004,0,0,0,0,0,1
SOAD11475,Flumevale,Yes,Irrigation,Earth,4.67,0.433,59925.0,1888,2001,0.0925899999999999,51.67744485358832,Controlled,16/05/2018,2,0.0,Significant,Satisfactory,2018-05-16,0.1158,27.4,396.0,4.1,4.67,0.433,0,59925.0,0,11.0008657466894,1,2001,0,0,0,1,0,0
SOAD13091,Flumevale,Yes,Irrigation,Earth,7.033,0.25,22050.71522031025,1920,,0.08077,13.31645,,13/04/1992,6,18.39,Low,Not Rated,,0.0816,28.0,189.3,5.5,7.033,0.25,0,,1,,0,Unknow,0,0,1,0,0,0
SOAD04656,Flumevale,Yes,"Fire Protection, Stock, Or Small Fish Pond",Earth,7.588,0.15,12315.02526449834,1939,,0.12017,15.97974,,27/02/1986,0,24.81,Low,Satisfactory,2016-09-08,0.0615,38.1,245.2,19.614485691493098,7.588,0.15,0,,1,,0,Unknow,0,0,1,0,0,0
SOAD02216,Flumevale,Yes,Irrigation,Earth,6.48,0.293,23957.673095867143,1981,,0.10047,38.53372435650387,,30/04/2020,6,9.46,Low,Satisfactory,2019-06-06,0.0423,41.5,420.3,13.6,6.48,0.293,0,,1,,0,Unknow,0,0,1,1,0,0
SOAD06627,Flumevale,Yes,Irrigation,Earth,9.009,0.117,13246.77266765824,1903,,0.08077,33.383592450677234,Uncontrolled,24/07/2018,6,32.1,Low,Unsatisfactory,2015-06-02,0.0837,5.0,121.4,11.8,9.009,0.117,0,,1,,0,Unknow,0,0,1,1,0,0
SOAD09062,Flumevale,Yes,Irrigation,Earth,4.94,0.645,47272.0,1910,,0.16745,7.98987,,22/10/1984,6,15.48,Low,Satisfactory,2020-12-16,0.0371,34.9,180.6,42.0,4.94,0.645,0,47272.0,0,10.7636945869734,0,Unknow,0,0,0,0,0,0
SOAD10037,Flumevale,Yes,Recreation,Earth,10.0,0.154,36463.0,1964,,0.08274,48.608763634171176,,01/01/1994,0,23.81,Low,Satisfactory,2018-10-05,0.0727,39.7,327.3,3.3,10.0,0.154,0,36463.0,0,10.5040807514855,0,Unknow,0,0,0,1,0,0
SOAD15734,Flumevale,No,"Fire Protection, Stock, Or Small Fish Pond",Earth,4.199,0.15,11236.237151033649,1970,,0.10169440503768623,23.96961,Uncontrolled,31/08/2010,10,60.63744029757146,Low,Not Rated,,0.0563,22.8,19.0,22.493126378219046,4.199,0.15,0,,1,,0,Unknow,0,0,1,0,1,1
SOAD02319,Flumevale,Yes,Flood Risk Reduction,Earth,7.088,0.27,63500.0,1999,,0.09456,5.32658,,23/02/2022,1,0.16,High,Satisfactory,2017-09-01,0.0873,7.5,685.2,17.770546532139996,7.088,0.27,0,63500.0,0,11.0588109327883,0,Unknow,0,0,0,0,0,0
SOAD03482,Flumevale,Yes,"Fire Protection, Stock, Or Small Fish Pond",Earth,6.179,0.167,14610.662616588887,1939,,0.12411,53.2658,,01/10/1987,0,67.26,Low,Unsatisfactory,2013-09-04,0.1178,5.8,130.8,12.023633836013694,6.179,0.167,0,,1,,0,Unknow,0,0,1,0,0,0
SOAD03953,Flumevale,Yes,Irrigation,Earth,10.275,0.14,35693.0,1937,1956,0.05713,7.98987,Uncontrolled,11/07/2017,6,14.09,Low,Satisfactory,2012-09-13,0.0438,18.9,437.2,38.0,10.275,0.14,0,35693.0,0,10.482737886416,1,1956,0,0,0,0,0,0
SOAD04674,Flumevale,Yes,Flood Risk Reduction,Earth,8.337,0.5,46000.0,1959,2020,0.02561,21.30632,,25/10/2022,3,25.52,Low,Satisfactory,2019-08-08,0.0674,43.9,369.7,19.334216572891435,8.337,0.5,0,46000.0,0,10.7364184143654,1,2020,0,0,0,0,0,0
SOAD14003,Flumevale,Yes,Debris Control,Earth,32.833,0.325,600000.0,1988,,0.11032,37.28606,,17/02/2022,1,0.0,High,Satisfactory,2017-09-01,0.0712,24.3,245.7,20.105789236757065,32.833,0.325,0,600000.0,0,13.3046866008636,0,Unknow,0,0,0,0,0,0
SOAD15779,Flumevale,Yes,Water Supply,Earth,37.781,0.207,166000.0,1984,,0.04137,42.55425267603047,,05/05/2022,1,0.0,High,Satisfactory,2017-09-01,0.091,34.8,130.3,65.2,37.781,0.207,0,166000.0,0,12.0197490914169,0,Unknow,0,0,0,1,0,0
SOAD17765,Flumevale,Yes,Irrigation,Earth,18.587,0.145,35681.0,1959,,0.06107,40.2107087656447,,08/06/2022,6,25.65,Low,Not Rated,,0.0241,44.0,127.1,43.9,18.587,0.145,0,35681.0,0,10.4824016389346,0,Unknow,0,0,0,1,0,0
SOAD03955,Flumevale,Yes,Irrigation,Earth,7.245,0.25,20557.0,1976,,0.24231,43.736199693064854,Uncontrolled,28/09/2016,6,29.48,Low,Satisfactory,2019-05-08,0.0542,38.0,105.7,42.1,7.245,0.25,0,20557.0,0,9.93100543857287,0,Unknow,0,0,0,1,0,0
SOAD10651,Flumevale,Yes,Flood Risk Reduction,Earth,19.221,0.177,77305.36797702659,1967,,0.06895,31.909179719931466,,19/09/2016,3,66.1,Low,Not Rated,,0.0848,19.2,74.9,22.909407930124242,19.221,0.177,0,,1,,0,Unknow,0,0,1,1,0,0
SOAD14637,Flumevale,Yes,Water Supply,Earth,11.29,0.212,28000.0,1955,,0.11623,2.66329,,02/08/2022,1,17.897336136486217,Significant,Satisfactory,2017-09-01,0.118,8.6,174.6,22.4,11.29,0.212,0,28000.0,0,10.2399955028053,0,Unknow,0,0,0,0,0,1
SOAD18140,Flumevale,Yes,Irrigation,Earth,8.323,0.082,12412.0,1930,,0.11032,362.20744,Uncontrolled,17/05/2011,6,9.56,Low,Not Rated,,0.0671,26.8,380.4,33.3,8.323,0.082,0,12412.0,0,9.42649958951595,0,Unknow,0,0,0,0,0,0
SOAD18991,Flumevale,Yes,Flood Risk Reduction,Earth,10.93,0.208,30174.0,1970,,0.09456,7.98987,Uncontrolled,01/06/2016,3,40.29,Low,Fair,2020-05-12,0.0958,27.9,219.9,20.388175191729932,10.93,0.208,0,30174.0,0,10.3147690459657,0,Unknow,0,0,0,0,0,0
SOAD19571,Flumevale,Yes,Irrigation,Earth,4.388,0.12,10329.055897467022,1895,,0.08471,34.43686413849596,,24/09/1984,6,39.18,Low,Not Rated,,0.0953,45.5,192.6,35.9,4.388,0.12,0,,1,,0,Unknow,0,0,1,1,0,0
SOAD04496,Flumevale,Yes,Water Supply,Earth,9.421,0.137,20300.0,1979,,0.07683,5.32658,,16/03/2022,1,0.8,High,Satisfactory,2017-09-01,0.0932,26.5,660.1,15.1,9.421,0.137,0,20300.0,0,9.91842542490033,0,Unknow,0,0,0,0,0,0
SOAD08438,Flumevale,Yes,Irrigation,Earth,6.805,0.133,11172.443445172928,1952,,0.06501,42.61264,Uncontrolled,22/08/2019,6,11.41,Low,Not Rated,,0.0437,11.8,383.2,31.1,6.805,0.133,0,,1,,0,Unknow,0,0,1,0,0,0
SOAD13217,Flumevale,Yes,Water Supply,Earth,34.196,0.165,125000.0,2001,,0.05319,32.21322205500254,,06/01/2022,1,1.59,High,Satisfactory,2017-09-01,0.1144,20.6,166.0,18.9,34.196,0.165,0,125000.0,0,11.7360770162524,0,Unknow,0,0,0,1,0,0
SOAD16056,Flumevale,Yes,"Fire Protection, Stock, Or Small Fish Pond",Earth,6.895,0.215,20842.71010650565,1944,,0.12214,32.170805633925006,Uncontrolled,06/11/2018,6,43.19,Low,Unsatisfactory,2021-06-24,0.096,31.2,66.9,23.761346089061682,6.895,0.215,0,,1,,0,Unknow,0,0,1,1,0,0
SOAD07212,Flumevale,Yes,Recreation,Earth,7.221,0.07,200.0,1957,,0.06895,801.65029,Uncontrolled,27/09/2013,6,14.95,Low,Not Rated,,0.0672,28.0,440.3,3.1,7.221,0.07,0,200.0,0,5.30330490805908,0,Unknow,0,0,0,0,0,0
SOAD08359,Flumevale,Yes,Other,Earth,12.629,0.167,30700.0,1951,,0.0788,90.55186,,18/08/2023,0.5,48.19708902880837,Low,Fair,2017-09-01,0.0863,41.0,22.4,12.532502884896964,12.629,0.167,0,30700.0,0,10.3320505063347,0,Unknow,0,0,0,0,0,1
SOAD14149,Flumevale,Yes,Irrigation,Earth,15.999,0.367,74570.0,1962,,0.0591,41.11150093372581,Uncontrolled,07/10/2020,6,6.65,Low,Satisfactory,2016-06-03,0.0304,38.6,194.1,33.2,15.999,0.367,0,74570.0,0,11.2195069706665,0,Unknow,0,0,0,1,0,0
SOAD01252,Flumevale,Yes,Flood Risk Reduction,Earth,24.858,0.148,111925.32159064437,1961,,0.06698,31.846454421110643,Uncontrolled,24/10/2022,3,0.0,High,Fair,2022-10-24,0.1053,26.5,551.6,21.289884884862843,24.858,0.148,0,,1,,0,Unknow,0,0,1,1,0,0
SOAD04297,Flumevale,Yes,Water Supply,Earth,10.993,0.783,80000.0,1991,,0.06698,34.54758941752287,,23/09/2021,1,1.13,High,Satisfactory,2017-09-01,0.1081,13.0,825.5,14.0,10.993,0.783,0,80000.0,0,11.2897944135779,0,Unknow,0,0,0,1,0,0
SOAD08924,Flumevale,Yes,Fish and Wildlife Pond,Earth,6.162,1.092,68240.0,Unknow,1977,0.11426,38.84579926653687,,15/10/2019,6,1.56,Low,Fair,2019-07-23,0.0579,34.6,521.1,20.94885364899949,6.162,1.092,0,68240.0,0,11.13080083622,1,1977,0,0,0,1,0,0
SOAD19337,Flumevale,Yes,Irrigation,Earth,2.435,0.446,8171.0,1889,,0.15366,154.9026379610223,,26/09/2013,6,14.05,Low,Not Rated,,0.076,24.6,333.2,45.8,2.435,0.446,0,8171.0,0,9.00846895593751,0,Unknow,0,0,0,1,0,0
SOAD03494,Flumevale,Yes,Irrigation,Earth,3.845,0.4,29096.128377461646,1917,,0.16942,34.62041404925426,Uncontrolled,16/05/2006,6,69.27,Low,Not Rated,,0.0827,34.3,147.2,26.9,3.845,0.4,0,,1,,0,Unknow,0,0,1,1,0,0
SOAD11534,Flumevale,Yes,Fish and Wildlife Pond,Earth,2.769,0.69,47648.08486514685,1932,,0.26989,218.38978,Uncontrolled,02/08/2006,0,64.04,Low,Not Rated,,0.0803,437.6,125.0,18.958937133947142,2.769,0.69,0,,1,,0,Unknow,0,0,1,0,0,0
SOAD18217,Flumevale,Yes,Flood Risk Reduction,Earth,12.787,0.367,55525.0,1961,,0.16942,15.97974,,23/09/2021,1,0.16,High,Satisfactory,2017-09-01,0.087,23.3,512.0,16.986193958163923,12.787,0.367,0,55525.0,0,10.9246066585059,0,Unknow,0,0,0,0,0,0
SOAD09517,Flumevale,Yes,Water Supply,Earth,11.372,0.202,35787.0,1962,,0.12214,2.66329,,04/02/2022,0.5,3.88,Low,Satisfactory,2017-09-01,0.0753,41.7,514.5,65.7,11.372,0.202,0,35787.0,0,10.4853679206675,0,Unknow,0,0,0,0,0,0
SOAD12480,Flumevale,Yes,Irrigation,Earth,12.677,0.095,29956.0,1960,,0.09456,7.98987,Uncontrolled,21/09/2018,6,4.6,Low,Satisfactory,2017-07-20,0.0407,34.1,588.2,5.3,12.677,0.095,0,29956.0,0,10.3075182991061,0,Unknow,0,0,0,0,0,0
SOAD12993,Flumevale,Yes,Water Supply,Earth,5.14,0.953,57571.23470890691,Unknow,,0.10244,56.9792040286222,,19/10/2022,1,0.16,High,Fair,2017-09-01,0.1053,36.3,492.7,67.4,5.14,0.953,0,,1,,0,Unknow,0,0,1,1,0,0
SOAD14271,Flumevale,Yes,Unknow,Earth,8.01,0.102,11288.89864702661,1910,,0.08077,29.29619,Uncontrolled,07/04/1995,0,41.96,Low,Not Rated,,0.127,44.5,172.8,24.001478707514405,8.01,0.102,0,,1,,0,Unknow,0,0,1,0,0,0
SOAD16416,Flumevale,Yes,Irrigation,Earth,14.179,0.092,28216.233696378968,1952,,0.06698,29.29619,Uncontrolled,13/09/2021,6,29.44,Low,Satisfactory,2020-05-12,0.0427,42.7,428.0,46.3,14.179,0.092,0,,1,,0,Unknow,0,0,1,0,0,0
SOAD17891,Flumevale,Yes,Water Supply,Earth,7.733,0.153,15000.0,1918,,0.17533,32.9619945063586,,09/06/2022,1,15.82,Significant,Satisfactory,2017-09-01,0.1149,39.8,242.1,63.4,7.733,0.153,0,15000.0,0,9.61587214452889,0,Unknow,0,0,0,1,0,0
SOAD11236,Flumevale,Yes,Flood Risk Reduction,Earth,7.656,0.583,33964.0,2009,,0.12411,21.30632,,28/02/2022,1,0.0,High,Satisfactory,2017-09-01,0.1023,23.1,882.1,18.235730313245657,7.656,0.583,0,33964.0,0,10.4330858616254,0,Unknow,0,0,0,0,0,0
SOAD17682,Flumevale,Yes,Irrigation,Earth,7.55,0.007,675.0,1913,,0.08274,1165.4868111218248,,30/07/2015,6,46.73,Low,Not Rated,,0.091,27.6,238.3,13.3,7.55,0.007,0,675.0,0,6.51619307604296,0,Unknow,0,0,0,1,0,0
SOAD02779,Flumevale,Yes,Flood Risk Reduction,Earth,8.816,0.16,38012.0,1958,,0.0886499999999999,7.98987,Uncontrolled,01/11/2021,3,1.59,Significant,Satisfactory,2021-11-01,0.1219,35.7,626.8,18.18716876271699,8.816,0.16,0,38012.0,0,10.545683485467,0,Unknow,0,0,0,0,0,0
SOAD04259,Flumevale,Yes,Flood Risk Reduction,Earth,12.122,0.667,200000.0,1979,,0.29156,45.27593,,10/03/2022,1,0.0,High,Satisfactory,2017-09-01,0.0924,446.0,358.7,19.30780905555004,12.122,0.667,0,200000.0,0,12.2060776455177,0,Unknow,0,0,0,0,0,0
SOAD02172,Flumevale,Yes,Irrigation,Earth,7.417,0.183,3043.0,1949,,0.20882,37.69955078882235,,08/06/2021,6,14.67,Low,Satisfactory,2016-04-08,0.062,30.0,473.8,21.0,7.417,0.183,0,3043.0,0,8.02092771898158,0,Unknow,0,0,0,1,0,0
SOAD11780,Flumevale,Yes,Irrigation,Earth,4.351,0.9,30003.0,1880,,0.16548,111.62668957122737,Uncontrolled,24/02/1995,6,3.14,Low,Not Rated,,0.0474,7.4,756.4,25.9,4.351,0.9,0,30003.0,0,10.3090859850895,0,Unknow,0,0,0,1,0,0
SOAD19040,Flumevale,Yes,Water Supply,Earth,10.442,0.533,62200.0,1963,1963;1963;1963;1984;2010,0.06501,33.930419238720255,Uncontrolled,09/11/2022,1,8.37,High,Fair,2022-11-09,0.0913,10.3,409.8,69.5,10.442,0.533,0,62200.0,0,11.0381263557685,5,2010,0,0,0,1,0,0
SOAD03276,Flumevale,Yes,Water Supply,Earth,17.117,0.197,69400.0,1964,,0.05713,5.32658,,13/04/2022,1,0.8518740062353886,High,Satisfactory,2017-09-01,0.0884,21.9,873.5,42.4,17.117,0.197,0,69400.0,0,11.147656555613,0,Unknow,0,0,0,0,0,1
SOAD03598,Flumevale,Yes,Irrigation,Earth,9.669,0.165,28518.0,1903,,0.08274,7.98987,Uncontrolled,21/07/2017,6,32.73,Low,Satisfactory,2020-06-16,0.0532,5.6,207.2,2.0,9.669,0.165,0,28518.0,0,10.2583258107999,0,Unknow,0,0,0,0,0,0
SOAD06336,Flumevale,Yes,Irrigation,Earth,4.314,0.417,66093.0,1871,,0.13002,38.784586766829364,Uncontrolled,14/06/1991,6,8.14,Low,Satisfactory,2014-04-10,0.0425,12.1,336.8,37.5,4.314,0.417,0,66093.0,0,11.0988332501615,0,Unknow,0,0,0,1,0,0
SOAD08451,Flumevale,Yes,Recreation,Earth,8.793,0.125,9000.0,1955,1962F;1962H;1962S;1986H;1986S,0.08077,95.87844,Uncontrolled,07/07/2022,2,13.42,Significant,Satisfactory,2022-07-07,0.1035,39.7,98.4,8.7,8.793,0.125,0,9000.0,0,9.10509096125709,5,1986,0,0,0,0,0,0
SOAD11016,Flumevale,Yes,Water Supply,Earth,9.513,0.31,18300.0,1954,,0.18124,55.92909,,14/06/2022,0.5,47.57998115279136,Low,Satisfactory,2017-09-01,0.0694,34.8,8.8,55.9,9.513,0.31,0,18300.0,0,9.81471098214528,0,Unknow,0,0,0,0,0,1
SOAD00683,Flumevale,Yes,Irrigation,Earth,12.065,0.32,70401.0,1950,,0.13002,32.68662070737127,,14/10/2011,6,19.37,Low,Not Rated,,0.0964,7.8,402.4,26.7,12.065,0.32,0,70401.0,0,11.1619769508335,0,Unknow,0,0,0,1,0,0
SOAD04798,Flumevale,Yes,Water Supply,Earth,22.999,0.117,30000.0,1966,,0.10638,2.66329,,09/02/2022,0.5,14.11,Low,Satisfactory,2017-09-01,0.0566,21.4,434.0,42.6,22.999,0.117,0,30000.0,0,10.3089859934221,0,Unknow,0,0,0,0,0,0
SOAD14675,Flumevale,Yes,Water Supply,Earth,6.58,0.4,11500.0,1879,,0.12411,36.314419699226725,,06/04/2022,0.5,53.02859962630129,Low,Satisfactory,2017-09-01,0.0671,18.6,5.7,69.9,6.58,0.4,0,11500.0,0,9.35018926709258,0,Unknow,0,0,0,1,0,1
SOAD14725,Flumevale,Yes,Water Supply,Earth,13.8,0.157,80445.0,1968,,0.10835,31.836548553486605,,03/11/2021,1,4.18,High,Satisfactory,2017-09-01,0.0925,10.4,340.1,58.3,13.8,0.157,0,80445.0,0,11.2953414308613,0,Unknow,0,0,0,1,0,0
SOAD17151,Flumevale,Yes,Irrigation,Earth,4.753,0.667,58538.0,1879,1991,0.14381,34.40070194865077,Uncontrolled,28/05/2021,2,8.21,Significant,Satisfactory,2021-05-28,0.1365,27.6,219.9,27.5,4.753,0.667,0,58538.0,0,10.9774484777631,1,1991,0,0,0,1,0,0
SOAD17422,Flumevale,Yes,Irrigation,Earth,3.65,0.081,1548.0,1912,1996H;1996M;1996S,0.15563,7.98987,Uncontrolled,21/05/2004,6,29.07,Low,Not Rated,,0.0948,30.1,177.2,23.8,3.65,0.081,0,1548.0,0,7.34536484041687,3,1996,0,0,0,0,0,0
SOAD18324,Flumevale,Yes,Other,Earth,10.497,0.128,22500.0,2003,,0.12017,2.66329,,15/03/2022,1,7.27,High,Satisfactory,2017-09-01,0.1036,17.1,351.4,18.019789603305597,10.497,0.128,0,22500.0,0,10.0213150316493,0,Unknow,0,0,0,0,0,0
SOAD19442,Flumevale,Yes,Irrigation,Earth,16.252,0.087,39803.73936901044,1953,,0.01773,35.36587865885409,,29/06/1992,0,3.07,Low,Satisfactory,2019-08-16,0.063,14.4,609.4,20.0,16.252,0.087,0,,1,,0,Unknow,0,0,1,1,0,0
SOAD02762,Flumevale,Yes,Irrigation,Earth,4.833,0.27,21191.073684805997,1892,,0.15169,34.24089177755265,Uncontrolled,17/01/1986,6,6.66,Low,Fair,2017-02-21,0.0572,6.5,375.9,18.8,4.833,0.27,0,,1,,0,Unknow,0,0,1,1,0,0
SOAD04631,Flumevale,Yes,Flood Risk Reduction,Earth,8.039,0.1,11288.89864702661,1962,,0.15957,7.98987,,18/11/2021,6,29.51,Low,Satisfactory,2013-09-26,0.0463,6.8,152.4,19.04203062343025,8.039,0.1,0,,1,,0,Unknow,0,0,1,0,0,0
SOAD08222,Flumevale,Yes,Water Supply,Earth,13.232,0.195,39000.0,1951,,0.10441,5.32658,,21/09/2021,1,0.16,Significant,Satisfactory,2017-09-01,0.1092,11.6,883.7,47.4,13.232,0.195,0,39000.0,0,10.5713425658087,0,Unknow,0,0,0,0,0,0
SOAD13948,Flumevale,Yes,Water Supply,Earth,6.88,0.517,32300.0,1980,,0.197,2.66329,,03/05/2022,0.5,47.516230942530484,Low,Satisfactory,2017-09-01,0.0631,40.6,15.5,63.9,6.88,0.517,0,32300.0,0,10.3828534684838,0,Unknow,0,0,0,0,0,1
SOAD16943,Flumevale,Yes,"Fire Protection, Stock, Or Small Fish Pond",Earth,2.517,0.267,4886.0,1936,,0.1182,269.9056083460805,,29/06/1988,0,72.55,Low,Not Rated,,0.1162,41.1,71.1,15.729223766606635,2.517,0.267,0,4886.0,0,8.49433389727015,0,Unknow,0,0,0,1,0,0
SOAD17417,Flumevale,Yes,Flood Risk Reduction,Earth,10.722,0.197,25640.0,1960,,0.11426,15.97974,,04/04/2019,3,32.78,Low,Not Rated,,0.0998,36.7,151.8,18.792421014279608,10.722,0.197,0,25640.0,0,10.1519479118341,0,Unknow,0,0,0,0,0,0
SOAD20538,Flumevale,Yes,Recreation,Earth,9.416,0.05,12863.904804921109,1964,2004,0.10441,159.7974,Uncontrolled,11/05/2009,6,3.14,Low,Satisfactory,2009-05-01,0.0528,38.3,738.4,6.4,9.416,0.05,0,,1,,1,2004,0,0,1,0,0,0
SOAD00546,Flumevale,Yes,Water Supply,Earth,7.29,0.067,4000.0,1925,,0.10441,34.217161223349336,,30/06/2022,0.5,47.73076138660085,Low,Satisfactory,2017-09-01,0.0686,19.6,23.2,35.0,7.29,0.067,0,4000.0,0,8.29429960885724,0,Unknow,0,0,0,1,0,1
SOAD02264,Flumevale,Yes,Other,Earth,27.187,0.173,76000.0,1983,,0.05122,31.846454421110643,,13/04/2022,1,1.59,High,Satisfactory,2017-09-01,0.0778,19.9,761.2,20.516183294975338,27.187,0.173,0,76000.0,0,11.2385017770766,0,Unknow,0,0,0,1,0,0
SOAD06281,Flumevale,Yes,Flood Risk Reduction,Earth,4.753,1.033,35000.0,1958,,0.29944,13.31645,,28/02/2022,1,2.021122985191565,High,Satisfactory,2017-09-01,0.0974,368.9,689.6,19.953613818851544,4.753,1.033,0,35000.0,0,10.463131911492,0,Unknow,0,0,0,0,0,1
SOAD07448,Flumevale,Yes,Water Supply,Earth,8.094,0.197,34600.0,1980,,0.08274,32.276988270366225,,09/02/2022,1,0.0,High,Satisfactory,2017-09-01,0.0948,14.0,277.3,67.9,8.094,0.197,0,34600.0,0,10.4516378623623,0,Unknow,0,0,0,1,0,0
SOAD13604,Flumevale,Yes,Irrigation,Earth,3.631,0.05,2123.0,1902,,0.17336,35.70612738339458,,22/09/2017,6,17.96,Low,Not Rated,,0.0871,35.4,150.1,46.0,3.631,0.05,0,2123.0,0,7.66105638236183,0,Unknow,0,0,0,1,0,0
SOAD07330,Flumevale,Yes,Water Supply,Earth,7.602,0.272,24623.6701798611,1889,1906,0.0906199999999999,32.28502483211154,Uncontrolled,18/08/2021,2,7.9,Significant,Satisfactory,2021-08-18,0.1393,5.2,171.5,27.6,7.602,0.272,0,,1,,1,1906,0,0,1,1,0,0
SOAD07607,Flumevale,Yes,Irrigation,Earth,2.536,0.43,6799.0,1900,1993,0.19109,299.74790961113604,Uncontrolled,11/02/2021,6,0.0,Low,Fair,2015-05-22,0.0471,6.2,480.4,6.7,2.536,0.43,0,6799.0,0,8.8246778911642,1,1993,0,0,0,1,0,0
SOAD12528,Flumevale,Yes,Irrigation,Earth,12.139,0.155,26643.0,1913,1989S,0.06895,21.30632,Uncontrolled,26/05/2022,6,41.22,Low,Not Rated,,0.0875,34.1,88.2,23.8,12.139,0.155,0,26643.0,0,10.1903192635331,1,1989,0,0,0,0,0,0
SOAD19451,Flumevale,Yes,Water Supply,Earth,5.617,0.417,14500.0,1962,,0.22261,5.32658,,18/04/2022,0.5,53.805602273244524,Low,Satisfactory,2017-09-01,0.0778,37.8,22.8,13.8,5.617,0.417,0,14500.0,0,9.5819728915479,0,Unknow,0,0,0,0,0,1
SOAD00282,Flumevale,Yes,Irrigation,Earth,6.217,0.13,11896.0,1964,,0.12214,13.31645,,19/07/2017,6,18.65,Low,Not Rated,,0.0703,13.2,98.1,9.7,6.217,0.13,0,11896.0,0,9.38404154647653,0,Unknow,0,0,0,0,0,0
SOAD04858,Flumevale,Yes,Flood Risk Reduction,Earth,20.063,0.147,71000.0,1963,,0.14381,45.27593,,22/07/2022,1,0.0,High,Satisfactory,2017-09-01,0.0897,37.4,788.3,16.10426507280875,20.063,0.147,0,71000.0,0,11.1704492404313,0,Unknow,0,0,0,0,0,0
SOAD07693,Flumevale,Yes,Flood Risk Reduction,Earth,10.119,0.25,35032.968367725676,1888,,0.08274,21.30632,,11/05/1998,6,20.08,Low,Not Rated,,0.0748,12.3,321.1,17.80111068041082,10.119,0.25,0,,1,,0,Unknow,0,0,1,0,0,0
SOAD08291,Flumevale,Yes,Irrigation,Earth,5.712,0.342,32937.0,1908,,0.0591,43.08036474017167,,27/06/2018,6,22.78,Low,Satisfactory,2019-05-15,0.0399,24.7,368.6,9.8,5.712,0.342,0,32937.0,0,10.4023822854342,0,Unknow,0,0,0,1,0,0
SOAD09342,Flumevale,Yes,Recreation,Earth,12.877,0.09,29299.7088964844,1957,2019,0.06107,133.1645,Uncontrolled,26/07/2021,6,8.21,Low,Fair,2013-10-08,0.0385,31.2,394.2,6.1,12.877,0.09,0,,1,,1,2019,0,0,1,0,0,0
SOAD11919,Flumevale,Yes,Water Supply,Earth,7.177,0.233,22188.147967683253,Unknow,,0.09653,32.01431504954373,,18/04/2023,1,3.81,High,Fair,2017-09-01,0.1046,34.6,794.8,54.2,7.177,0.233,0,,1,,0,Unknow,0,0,1,1,0,0
SOAD14054,Flumevale,Yes,Water Supply,Earth,15.772,0.11,12000.0,1961,,0.08668,10.65316,,07/04/2022,0.5,50.67620662122727,Low,Satisfactory,2017-09-01,0.0678,28.1,12.6,32.9,15.772,0.11,0,12000.0,0,9.39274525863144,0,Unknow,0,0,0,0,0,1
SOAD15641,Flumevale,Yes,Water Supply,Earth,8.717,0.78,58115.38800401875,1973,,0.07486,55.50624653722176,Uncontrolled,14/06/2012,6,1.56,Low,Satisfactory,2011-06-22,0.0484,8.6,753.6,5.5,8.717,0.78,0,,1,,0,Unknow,0,0,1,1,0,0
SOAD18792,Flumevale,Yes,Water Supply,Earth,15.109,0.299,42000.0,1955,,0.07486,32.03720372075938,,11/08/2022,1,5.790419860166608,Significant,Satisfactory,2017-09-01,0.1152,16.1,380.8,49.3,15.109,0.299,0,42000.0,0,10.6454487065059,0,Unknow,0,0,0,1,0,1
SOAD04469,Flumevale,Yes,Irrigation,Earth,6.573,2.107,27000.0,1974,,0.14184,15.97974,,,6,42.83,Low,Satisfactory,2016-06-15,0.0373,27.7,169.2,37.5,6.573,2.107,0,27000.0,0,10.2036291813376,0,Unknow,0,0,0,0,0,0
SOAD10310,Flumevale,Yes,Recreation,Earth,6.627,0.06,9935.416753636015,Unknow,,0.0394,66.58225,Uncontrolled,31/12/2019,6,67.27,Low,Not Rated,,0.1001,37.0,108.6,8.5,6.627,0.06,0,,1,,0,Unknow,0,0,1,0,0,0
SOAD11890,Flumevale,Yes,Other,Earth,12.515,0.112,16237.0,1958,,0.12214,13.31645,,16/11/2021,1,0.0,High,Satisfactory,2017-09-01,0.1035,13.3,260.1,16.78476749197651,12.515,0.112,0,16237.0,0,9.69510945342239,0,Unknow,0,0,0,0,0,0
SOAD08518,Flumevale,Yes,Recreation,Earth,5.824,0.025,63622.92461325499,1965,,0.14184,4157.39569,,,6,9.99,Low,Unsatisfactory,2015-08-20,0.0935,22.2,103.6,5.9,5.824,0.025,0,,1,,0,Unknow,0,0,1,0,0,0
SOAD14477,Flumevale,Yes,Irrigation,Earth,4.734,0.25,17275.0,1870,,0.15169,43.239903382776326,Uncontrolled,31/05/1991,6,3.33,Low,Satisfactory,2013-09-25,0.0294,41.2,448.7,29.3,4.734,0.25,0,17275.0,0,9.75707353408059,0,Unknow,0,0,0,1,0,0
SOAD18289,Flumevale,Yes,Recreation,Earth,2.798,0.125,15280.0,1889,,0.10441,42.245262173556114,Uncontrolled,29/09/2013,6,46.31,Low,Not Rated,,0.0644,39.4,71.3,8.4,2.798,0.125,0,15280.0,0,9.63436550560526,0,Unknow,0,0,0,1,0,0
SOAD03944,Flumevale,Yes,Recreation,Earth,13.491,0.167,42633.812934106245,1901,,0.10835,52.685020762405394,,06/04/2022,1,0.0,High,Unsatisfactory,2022-04-06,0.1545,13.8,305.6,3.5,13.491,0.167,0,,1,,0,Unknow,0,0,1,1,0,0
SOAD06928,Flumevale,Yes,Water Supply,Earth,9.856,0.553,94592.0,1981,,0.07683,33.86817517630681,Uncontrolled,20/04/2022,2,0.0,Significant,Satisfactory,2022-04-20,0.131,45.0,411.6,31.5,9.856,0.553,0,94592.0,0,11.4573387565305,0,Unknow,0,0,0,1,0,0
SOAD07348,Flumevale,Yes,Irrigation,Earth,2.878,0.25,2176.0,1892,,0.22655,92.93878465161897,Uncontrolled,22/10/1991,6,3.2,Low,Satisfactory,2006-09-20,0.0399,7.1,769.3,37.6,2.878,0.25,0,2176.0,0,7.68570306123455,0,Unknow,0,0,0,1,0,0
SOAD14113,Flumevale,Yes,Water Supply,Earth,11.985,0.153,26600.0,1959,,0.13199,47.93922,,24/05/2023,1,0.8890952338360584,High,Poor,2019-09-04,0.096,9.1,662.2,61.7,11.985,0.153,0,26600.0,0,10.1887040880481,0,Unknow,0,0,0,0,0,1
SOAD01861,Flumevale,Yes,Irrigation,Earth,7.166,0.187,12444.0,1941,,0.10638,7.98987,Uncontrolled,03/08/2017,6,9.4,Low,Satisfactory,2009-08-19,0.0605,12.0,468.5,12.2,7.166,0.187,0,12444.0,0,9.42907421480169,0,Unknow,0,0,0,0,0,0
SOAD05429,Flumevale,Yes,Irrigation,Earth,4.244,0.492,42866.52029462797,2018,2019,0.0985,7.98987,Uncontrolled,,6,86.11688669392348,Low,Fair,2020-11-17,0.0518,30.8,13.2,27.3,4.244,0.492,0,,1,,1,2019,0,0,1,0,0,1
SOAD10294,Flumevale,Yes,Irrigation,Earth,7.241,0.188,35104.0,1952,,0.12805,396.83021,Uncontrolled,14/04/2016,6,12.92,Low,Satisfactory,2008-07-02,0.0426,16.7,189.5,10.0,7.241,0.188,0,35104.0,0,10.4660988494513,0,Unknow,0,0,0,0,0,0
SOAD13599,Flumevale,Yes,Flood Risk Reduction,Earth,9.574,0.162,17920.0,1957,,0.10441,7.98987,Uncontrolled,07/10/2020,6,18.04,Low,Fair,2020-10-16,0.0717,8.7,180.1,17.74710530498121,9.574,0.162,0,17920.0,0,9.79372848854339,0,Unknow,0,0,0,0,0,0
SOAD16569,Flumevale,Yes,Water Supply,Earth,24.726,0.14,81000.0,1987,,0.06501,31.846454421110643,,26/01/2022,1,5.04,High,Satisfactory,2017-09-01,0.0948,40.1,348.0,49.0,24.726,0.14,0,81000.0,0,11.3022167792574,0,Unknow,0,0,0,1,0,0
SOAD07232,Flumevale,Yes,Irrigation,Earth,4.354,0.147,4404.0,1919,,0.12017,69.24554,Uncontrolled,,6,40.82,Low,Not Rated,,0.0552,21.4,208.7,11.6,4.354,0.147,0,4404.0,0,8.39049553837028,0,Unknow,0,0,0,0,0,0
SOAD07323,Flumevale,Yes,Flood Risk Reduction,Earth,9.696,0.7,59000.0,1958,,0.18518,37.28606,,16/02/2022,1,0.16,High,Satisfactory,2017-09-01,0.1044,15.6,189.5,19.68335570714159,9.696,0.7,0,59000.0,0,10.9853096718968,0,Unknow,0,0,0,0,0,0
SOAD09629,Flumevale,Yes,Flood Risk Reduction,Earth,8.705,0.256,23766.0,1955,1984S,0.05713,7.98987,Uncontrolled,13/12/2022,6,4.84,Low,Unsatisfactory,2006-08-02,0.0993,33.4,531.0,19.415665129634327,8.705,0.256,0,23766.0,0,10.0760533428814,1,1984,0,0,0,0,0,0
SOAD14417,Flumevale,Yes,Water Supply,Earth,12.01,0.207,80000.0,1967,,0.12017,36.84448715086803,,09/03/2022,1,1.5,High,Satisfactory,2017-09-01,0.0752,10.6,900.7,9.0,12.01,0.207,0,80000.0,0,11.2897944135779,0,Unknow,0,0,0,1,0,0
SOAD15074,Flumevale,Yes,Recreation,Earth,16.468,0.13,45939.05272271591,1963,,0.07289,45.15127990878367,Uncontrolled,20/10/2022,6,24.65,Low,Not Rated,,0.0435,46.7,187.3,9.1,16.468,0.13,0,,1,,0,Unknow,0,0,1,1,0,0
SOAD16089,Flumevale,Yes,Flood Risk Reduction,Earth,8.597,0.222,24324.921116901023,1962,,0.09456,7.98987,Uncontrolled,10/05/2000,3,9.48,Low,Satisfactory,2009-08-19,0.0589,7.4,283.0,19.0886799987651,8.597,0.222,0,,1,,0,Unknow,0,0,1,0,0,0
SOAD19107,Flumevale,Yes,Water Supply,Earth,15.892,0.292,86264.96901040757,1938,,0.07486,32.40951317330802,Uncontrolled,05/10/2022,2,4.89,Significant,Fair,2022-10-05,0.1458,20.0,217.3,30.0,15.892,0.292,0,,1,,0,Unknow,0,0,1,1,0,0
SOAD11198,Flumevale,Yes,Hydroelectric,Earth,6.495,0.062,2000.0,1870,,0.14184,2.66329,Uncontrolled,12/08/2019,3,47.06303291739709,Low,Satisfactory,2023-09-29,0.053,12.3,13.3,64.15160277777777,6.495,0.062,0,2000.0,0,7.60140233458373,0,Unknow,0,0,0,0,0,1
SOAD12383,Flumevale,Yes,Flood Risk Reduction,Earth,7.55,0.307,26765.768649453414,2009,,0.14775,87.88857,Uncontrolled,08/06/2021,3,0.0,Low,Unsatisfactory,2014-11-21,0.1116,25.2,708.4,13.84921692254484,7.55,0.307,0,,1,,0,Unknow,0,0,1,0,0,0
SOAD17504,Flumevale,Yes,Irrigation,Earth,7.315,0.303,25708.428134780297,1915,,0.14775,33.75903866604012,,25/10/1979,0,4.7,Low,Not Rated,,0.1021,44.6,706.0,12.9,7.315,0.303,0,,1,,0,Unknow,0,0,1,1,0,0
SOAD18034,Flumevale,Yes,Debris Control,Earth,29.92,0.173,200000.0,1955,,0.05319,21.30632,,21/09/2023,1,0.0,High,Fair,2017-09-01,0.0925,26.4,709.6,18.602923750667316,29.92,0.173,0,200000.0,0,12.2060776455177,0,Unknow,0,0,0,0,0,0
SOAD18574,Flumevale,Yes,Water Supply,Earth,12.349,0.45,140000.0,2003,,0.06107,30.994479536501693,,28/01/2022,1,0.16,Significant,Satisfactory,2017-09-01,0.1189,5.4,872.1,12.3,12.349,0.45,0,140000.0,0,11.8494048444231,0,Unknow,0,0,0,1,0,0
SOAD20017,Flumevale,Yes,Irrigation,Earth,11.194,0.129,18828.0,1957,,0.0886499999999999,38.10857102012189,,13/09/2021,2,24.88,Significant,Fair,2021-09-13,0.121,9.1,475.4,8.6,11.194,0.129,0,18828.0,0,9.84315351349643,0,Unknow,0,0,0,1,0,0
SOAD07082,Flumevale,Yes,Recreation,Earth,10.459,0.082,11118.0,1957,,0.07486,7.98987,Uncontrolled,07/07/2021,2,11.17,Significant,Satisfactory,2021-07-07,0.1204,11.3,349.7,5.9,10.459,0.082,0,11118.0,0,9.31641063570325,0,Unknow,0,0,0,0,0,0
SOAD07103,Flumevale,Yes,Other,Earth,6.957,0.455,23000.0,2003,,0.07092,34.34415040320107,,,0,1.66,Low,Satisfactory,2009-04-21,0.0637,43.9,255.3,20.940685618564558,6.957,0.455,0,23000.0,0,10.043292972227,0,Unknow,0,0,0,1,0,0
SOAD08988,Flumevale,Yes,Recreation,Earth,16.853,0.083,44800.0,1979,2015,0.07289,431.45298,Uncontrolled,26/08/2021,6,52.12,Low,Not Rated,,0.0702,33.6,121.5,3.7,16.853,0.083,0,44800.0,0,10.7099857395825,1,2015,0,0,0,0,0,0
SOAD16216,Flumevale,Yes,Other,Earth,16.441,0.433,145500.0,1997,,0.04137,33.16930589357201,Uncontrolled,09/08/2022,1,3.17,High,Satisfactory,2022-08-09,0.1,43.1,917.8,20.594165493235316,16.441,0.433,0,145500.0,0,11.8879382384223,0,Unknow,0,0,0,1,0,0
SOAD01368,Flumevale,Yes,Flood Risk Reduction,Earth,20.012,0.196,44920.0,1959,,0.07486,7.98987,Uncontrolled,13/05/2016,3,1.54,Low,Satisfactory,2021-08-18,0.0695,37.3,880.5,18.0578654655228,20.012,0.196,0,44920.0,0,10.7126606704033,0,Unknow,0,0,0,0,0,0
SOAD07703,Flumevale,Yes,Flood Risk Reduction,Earth,10.332,0.167,17324.0,1969,,0.0886499999999999,7.98987,,18/07/1991,0,51.49,Low,Not Rated,,0.0871,15.9,147.7,19.90621430543887,10.332,0.167,0,17324.0,0,9.7599058240581,0,Unknow,0,0,0,0,0,0
SOAD08729,Flumevale,Yes,Water Supply,Earth,8.644,0.087,38000.0,1951,,0.10244,74.57212,,01/11/2021,0.5,46.49285055114574,Low,Satisfactory,2017-09-01,0.0655,6.4,8.7,15.2,8.644,0.087,0,38000.0,0,10.5453677541517,0,Unknow,0,0,0,0,0,1
SOAD13169,Flumevale,Yes,Flood Risk Reduction,Earth,8.589,0.188,19381.0,1967,,0.11032,13.31645,Uncontrolled,18/07/1991,3,27.93,Low,Satisfactory,2003-10-10,0.0602,34.0,120.9,18.99265371419169,8.589,0.188,0,19381.0,0,9.8721000792945,0,Unknow,0,0,0,0,0,0
SOAD17402,Flumevale,Yes,Water Supply,Earth,49.492,0.207,300000.0,1963,,0.05122,189.75150835535987,,15/06/2022,1,0.0,High,Satisfactory,2017-09-01,0.0903,26.1,753.4,51.0,49.492,0.207,0,300000.0,0,12.6115410869661,0,Unknow,0,0,0,1,0,0
SOAD20376,Flumevale,Yes,Flood Risk Reduction,Earth,27.741,0.15,177500.0,1958,,0.05516,7.98987,Uncontrolled,01/11/2020,2,16.94,Low,Not Available,,0.1191,37.3,131.8,19.01438412175222,27.741,0.15,0,177500.0,0,12.0867315216846,0,Unknow,0,0,0,0,0,0
SOAD00308,Flumevale,Yes,Irrigation,Earth,8.676,0.179,25684.0,1910,,0.12214,32.33813590331892,,17/09/2018,6,35.14,Low,Fair,2018-10-19,0.0569,41.1,122.8,42.1,8.676,0.179,0,25684.0,0,10.1536624429014,0,Unknow,0,0,0,1,0,0
SOAD06003,Flumevale,Yes,Water Supply,Earth,8.214,0.167,16000.0,1958,,0.12411,2.66329,,12/01/2022,1,1.64,High,Satisfactory,2017-09-01,0.0883,35.0,811.3,47.2,8.214,0.167,0,16000.0,0,9.68040649926887,0,Unknow,0,0,0,0,0,0
SOAD06405,Flumevale,No,Recreation,Earth,7.495,0.5,44834.27712774576,1887,,0.02561,93.62602951165323,Uncontrolled,19/05/2021,4,53.24,Low,Unsatisfactory,2016-08-04,0.1035,14.3,121.9,7.3,7.495,0.5,0,,1,,0,Unknow,0,0,1,1,0,0
SOAD10333,Flumevale,Yes,Irrigation,Earth,4.346,0.17,14952.37075837622,2007,,0.20291,34.62277,Uncontrolled,23/04/2018,6,36.46,Low,Fair,2018-04-10,0.0738,8.8,76.2,5.0,4.346,0.17,0,,1,,0,Unknow,0,0,1,0,0,0
SOAD13466,Flumevale,Yes,Water Supply,Earth,13.494,0.158,29600.0,1877,,0.06895,31.747922991518166,,21/07/2021,1,0.0,Significant,Satisfactory,2017-09-01,0.1048,43.0,370.4,31.7,13.494,0.158,0,29600.0,0,10.2955634235253,0,Unknow,0,0,0,1,0,0
SOAD14130,Flumevale,Yes,Other,Earth,18.314,0.347,80960.0,1907,,0.14775,7.98987,,17/05/2022,1,6.34,Significant,Satisfactory,2017-09-01,0.1077,35.6,473.8,18.32108961377692,18.314,0.347,0,80960.0,0,11.3017228362237,0,Unknow,0,0,0,0,0,0
SOAD14299,Flumevale,Yes,Irrigation,Earth,6.244,0.048,2852.0,1889,1968H;1968M;1968S,0.16942,35.07833270095798,Uncontrolled,09/08/2018,6,12.73,Low,Not Rated,,0.0934,7.9,320.7,25.5,6.244,0.048,0,2852.0,0,7.9561263512135,3,1968,0,0,0,1,0,0
SOAD16175,Flumevale,Yes,Irrigation,Earth,7.837,0.233,23078.555017652594,1940,,0.14184,7.98987,,01/10/1987,0,45.02,Low,Not Rated,,0.066,41.1,194.6,31.9,7.837,0.233,0,,1,,0,Unknow,0,0,1,0,0,0
SOAD18588,Flumevale,Yes,Other,Earth,14.146,0.306,55500.0,2009,,0.08077,7.98987,,16/03/2022,0.5,51.704163247036405,Low,Satisfactory,2017-09-01,0.0582,30.6,19.1,18.12549981161027,14.146,0.306,0,55500.0,0,10.9241563175902,0,Unknow,0,0,0,0,0,1
SOAD07241,Flumevale,Yes,Water Supply,Earth,5.072,0.667,29730.0,1879,,0.13002,49.523587208914066,Uncontrolled,25/09/2013,6,3.12,Low,Satisfactory,2018-06-12,0.0418,21.6,766.8,65.6,5.072,0.667,0,29730.0,0,10.2999455514843,0,Unknow,0,0,0,1,0,0
SOAD08395,Flumevale,Yes,Irrigation,Earth,12.573,0.1,35455.05032208222,1969,,0.02561,55.92909,,17/07/1987,6,39.79,Low,Satisfactory,2015-09-08,0.0498,7.1,54.6,18.7,12.573,0.1,0,,1,,0,Unknow,0,0,1,0,0,0
SOAD09205,Flumevale,Yes,Water Supply,Earth,9.868,0.265,19125.0,1955,,0.16154,33.38765756540211,,22/07/2022,1,11.777546073889049,Significant,Satisfactory,2017-09-01,0.1252,14.6,276.3,19.0,9.868,0.265,0,19125.0,0,9.85880394490949,0,Unknow,0,0,0,1,0,1
SOAD13848,Flumevale,No,Other,Earth,28.539,0.1,314316.3804666911,Unknow,,8.45028446111265,531.5318647573357,,,Unknow,11.02,High,Not Available,,0.0994,703.2,352.4,19.949712748260275,28.539,0.1,0,,1,,0,Unknow,0,0,1,1,1,0
SOAD13897,Flumevale,Yes,Water Supply,Earth,6.853,0.233,20000.0,1875,,0.12411,32.170805633925006,,24/05/2023,0.5,52.361677754655155,Low,Poor,2021-11-10,0.0983,21.6,20.6,60.4,6.853,0.233,0,20000.0,0,9.90353755128617,0,Unknow,0,0,0,1,0,1
SOAD00230,Flumevale,Yes,Water Supply,Earth,13.235,0.39,44450.0,1957,,0.0925899999999999,50.957881106618146,,04/05/2020,6,3.23,Low,Satisfactory,2019-02-15,0.0411,37.5,480.9,58.8,13.235,0.39,0,44450.0,0,10.7021427378768,0,Unknow,0,0,0,1,0,0
SOAD06356,Flumevale,Yes,Water Supply,Earth,7.067,0.2,6500.0,1949,,0.06698,7.98987,,26/08/2020,6,23.31,Low,Satisfactory,2017-08-24,0.0365,21.4,186.9,30.5,7.067,0.2,0,6500.0,0,8.77971129020447,0,Unknow,0,0,0,0,0,0
SOAD16118,Flumevale,Yes,Water Supply,Earth,16.946,0.067,21000.0,1955,,0.0925899999999999,31.93507998307908,,21/04/2022,1,0.93,High,Satisfactory,2017-09-01,0.0863,35.6,791.0,48.4,16.946,0.067,0,21000.0,0,9.95232533461943,0,Unknow,0,0,0,1,0,0
SOAD17059,Flumevale,Yes,Water Supply,Earth,15.535,0.118,29500.0,1952,,0.10441,2.66329,,01/09/2022,1,6.5,High,Satisfactory,2017-09-01,0.1185,14.8,382.8,29.2,15.535,0.118,0,29500.0,0,10.2921794400585,0,Unknow,0,0,0,0,0,0
SOAD18127,Flumevale,Yes,Recreation,Earth,6.043,0.667,58398.607615546425,Unknow,1995,0.10047,205.93589289502808,Uncontrolled,13/04/2022,2,0.0,Significant,Unsatisfactory,2022-04-13,0.1532,18.6,896.0,7.7,6.043,0.667,0,,1,,1,1995,0,0,1,1,0,0
SOAD19001,Flumevale,Yes,Debris Control,Earth,19.728,0.123,140000.0,1996,,0.04925,18.64303,,09/08/2022,1,0.34,High,Satisfactory,2017-09-01,0.0899,11.6,420.2,18.36404028005922,19.728,0.123,0,140000.0,0,11.8494048444231,0,Unknow,0,0,0,0,0,0
SOAD02309,Flumevale,Yes,Water Supply,Earth,7.192,0.433,42961.533112608704,1918,,0.12805,34.73797652232031,Uncontrolled,09/08/1989,0,24.04,Low,Satisfactory,2017-08-09,0.0775,18.3,185.1,24.4,7.192,0.433,0,,1,,0,Unknow,0,0,1,1,0,0
SOAD06459,Flumevale,Yes,"Fire Protection, Stock, Or Small Fish Pond",Earth,11.032,0.15,45037.0,1970,,0.04137,7.98987,Uncontrolled,05/07/2018,6,42.54,Low,Not Rated,,0.0545,15.9,210.9,20.07460546375231,11.032,0.15,0,45037.0,0,10.7152618568543,0,Unknow,0,0,0,0,0,0
SOAD08458,Flumevale,No,Flood Risk Reduction,Earth,13.493,0.087,27178.89438460821,1915,1983,0.6086475215276359,99.35519574189556,Controlled,01/06/2022,Unknow,9.907483652605945,Significant,Not Available,,0.1317,344.1,309.9,20.12524190300917,13.493,0.087,0,,1,,1,1983,0,0,1,1,1,1
SOAD11471,Flumevale,Yes,Flood Risk Reduction,Earth,4.343,0.356,23084.0,1951,,0.07486,33.12489302085036,Uncontrolled,19/11/1998,6,0.0,Low,Fair,2020-10-06,0.0529,39.1,362.9,21.88393917003907,4.343,0.356,0,23084.0,0,10.0469383349411,0,Unknow,0,0,0,1,0,0
SOAD11924,Flumevale,Yes,Water Supply,Earth,14.203,0.11,30500.0,1956,,0.09456,5.32658,,18/04/2022,1,3.25,High,Satisfactory,2017-09-01,0.0732,29.7,878.2,52.4,14.203,0.11,0,30500.0,0,10.3255147489433,0,Unknow,0,0,0,0,0,0
SOAD16278,Flumevale,Yes,Water Supply,Earth,15.221,0.203,130000.0,1911,,0.08471,2.66329,,08/06/2022,0.5,57.76065388529351,Low,Satisfactory,2017-09-01,0.0704,18.4,16.9,22.4,15.221,0.203,0,130000.0,0,11.7752974217158,0,Unknow,0,0,0,0,0,1
SOAD17715,Flumevale,Yes,Water Supply,Earth,21.433,0.183,125000.0,1997,,0.07289,2.66329,,24/08/2022,0.5,49.37895481748511,Low,Satisfactory,2017-09-01,0.0617,11.6,23.3,12.5,21.433,0.183,0,125000.0,0,11.7360770162524,0,Unknow,0,0,0,0,0,1
SOAD19860,Flumevale,Yes,Irrigation,Earth,11.349,0.127,9395.0,1957,,0.12608,29.29619,Uncontrolled,11/03/2020,6,4.67,Low,Fair,2020-06-10,0.0578,34.8,244.5,33.3,11.349,0.127,0,9395.0,0,9.1480393457788,0,Unknow,0,0,0,0,0,0
SOAD00454,Flumevale,Yes,Irrigation,Earth,5.724,0.14,5227.0,1926,1985,0.11229,15.97974,Uncontrolled,14/06/2016,6,20.23,Low,Not Rated,,0.096,6.5,296.7,20.0,5.724,0.14,0,5227.0,0,8.56178407474411,1,1985,0,0,0,0,0,0
SOAD06444,Flumevale,Yes,Irrigation,Earth,6.339,0.45,43164.82694383153,1919,,0.16351,34.65319201154382,,14/11/1991,0,111.09,Low,Not Rated,,0.0968,21.9,159.2,20.7,6.339,0.45,0,,1,,0,Unknow,0,0,1,1,0,0
SOAD14458,Flumevale,Yes,Flood Risk Reduction,Earth,18.735,0.128,68674.29640075442,Unknow,,1.1045428205648429,127.49539556068429,,15/02/2023,1,0.77,High,Fair,2022-05-06,0.104,648.9,564.8,20.198749652415668,18.735,0.128,0,,1,,0,Unknow,0,0,1,1,1,0
SOAD00093,Flumevale,Yes,Water Supply,Earth,14.67,0.112,22196.0,1971,,0.18715,21.30632,,24/09/2021,1,9.832218398544564,Significant,Satisfactory,2017-09-01,0.1262,10.9,371.6,53.1,14.67,0.112,0,22196.0,0,10.0077124235937,0,Unknow,0,0,0,0,0,1
SOAD05738,Flumevale,Yes,Irrigation,Earth,3.421,0.3331534068904755,25000.0,2016,,0.08668,493.16528071972937,,,0,56.26123428841051,Low,Not Rated,,0.0959,47.6,6.3,7.6,3.421,,1,25000.0,0,10.1266711030504,0,Unknow,0,1,0,1,0,1
SOAD06512,Flumevale,Yes,Irrigation,Earth,8.899,0.207,43125.0,1915,1991S,0.08668,98.54173,Uncontrolled,26/05/2015,6,12.97,Low,Fair,2021-08-03,0.0457,43.8,277.5,4.7,8.899,0.207,0,43125.0,0,10.6718813424706,1,1991,0,0,0,0,0,0
SOAD10171,Flumevale,No,Recreation,Earth,5.348,0.05,971.0,Unknow,,0.09688601757982254,7.98987,Uncontrolled,02/08/2017,10,35.2,Low,Not Rated,,0.0365,14.4,186.1,9.3,5.348,0.05,0,971.0,0,6.87935580446044,0,Unknow,0,0,0,0,1,0
SOAD18938,Flumevale,Yes,Other,Earth,12.05,0.275,89611.0,1928,,0.12805,138.49108,,26/10/2021,1,0.0,High,Satisfactory,2017-09-01,0.095,25.9,652.8,14.425122652947529,12.05,0.275,0,89611.0,0,11.4032445185668,0,Unknow,0,0,0,0,0,0
SOAD19692,Flumevale,Yes,Irrigation,Earth,7.998,0.084,17115.0,1906,,0.12805,32.68949228033044,Uncontrolled,24/07/2018,6,38.44,Low,Satisfactory,2015-06-17,0.0523,35.3,178.9,32.3,7.998,0.084,0,17115.0,0,9.74776897753671,0,Unknow,0,0,0,1,0,0
SOAD09734,Flumevale,Yes,Water Supply,Earth,7.079,0.197,8600.0,1959,,0.30535,5.32658,,09/12/2021,0.5,46.915588740085546,Low,Satisfactory,2017-09-01,0.0731,284.6,10.0,18.3,7.079,0.197,0,8600.0,0,9.05963375455148,0,Unknow,0,0,0,0,0,1
SOAD17275,Flumevale,Yes,Water Supply,Earth,16.621,0.49,68000.0,1952,,0.05319,34.3383766276622,,19/01/2022,1,0.0,High,Satisfactory,2017-09-01,0.0988,43.6,417.5,32.1,16.621,0.49,0,68000.0,0,11.1272776899325,0,Unknow,0,0,0,1,0,0
SOAD03358,Flumevale,Yes,Water Supply,Earth,13.943,0.417,70000.0,1978,,0.1182,33.449637016761486,,22/03/2022,0.5,57.02264824744046,Low,Satisfactory,2017-09-01,0.0731,26.0,23.5,44.5,13.943,0.417,0,70000.0,0,11.1562648066437,0,Unknow,0,0,0,1,0,1
SOAD05249,Flumevale,Yes,Water Supply,Earth,22.931,0.253,86700.0,1938,,0.06895,5.32658,,18/05/2022,1,1.71,High,Satisfactory,2017-09-01,0.0953,38.6,514.0,18.4,22.931,0.253,0,86700.0,0,11.3702206967275,0,Unknow,0,0,0,0,0,0
SOAD06812,Flumevale,Yes,Flood Risk Reduction,Earth,19.065,0.35,124400.72775353646,1979,1996,0.07683,10.65316,Uncontrolled,20/10/2011,6,4.65,Low,Not Available,,0.0774,35.2,520.1,18.94692282530967,19.065,0.35,0,,1,,1,1996,0,0,1,0,0,0
SOAD18317,Flumevale,Yes,Irrigation,Earth,8.027,0.042,3160.0,1964,,0.08077,41.253501134542404,,06/09/2018,6,23.38,Low,Not Rated,,0.0654,16.7,420.1,8.8,8.027,0.042,0,3160.0,0,8.05864371221562,0,Unknow,0,0,0,1,0,0
SOAD18970,Flumevale,Yes,Irrigation,Earth,5.006,0.261,24942.0,1954,,0.09653,252.7487719814538,Uncontrolled,01/01/2010,0,3.23,Low,Fair,2021-09-20,0.0862,13.2,843.4,10.2,5.006,0.261,0,24942.0,0,10.1243485006928,0,Unknow,0,0,0,1,0,0
SOAD19836,Flumevale,Yes,Recreation,Earth,7.791,0.283,42891.0,1907,,0.14578,52.32831927773302,Uncontrolled,25/09/2013,6,6.69,Low,Fair,2015-05-28,0.0385,11.3,206.0,8.0,7.791,0.283,0,42891.0,0,10.66644060734,0,Unknow,0,0,0,1,0,0
SOAD03985,Flumevale,Yes,Recreation,Earth,5.102,0.177,1681.0,1939,,0.16351,7.98987,Uncontrolled,09/07/2014,10,9.36,Low,Not Rated,,0.0258,38.8,195.2,6.0,5.102,0.177,0,1681.0,0,7.42773884053289,0,Unknow,0,0,0,0,0,0
SOAD13880,Flumevale,Yes,Water Supply,Earth,28.349,0.317,160000.0,1981,,0.06501,45.96758956883795,,24/03/2022,1,0.5,High,Satisfactory,2017-09-01,0.0811,30.6,316.9,8.0,28.349,0.317,0,160000.0,0,11.9829353441964,0,Unknow,0,0,0,1,0,0
SOAD17709,Flumevale,Yes,Irrigation,Earth,6.345,0.083,10097.792545624194,1926,,0.0985,13.31645,,07/09/2018,6,30.06,Low,Fair,2007-06-15,0.0574,11.3,115.2,21.8,6.345,0.083,0,,1,,0,Unknow,0,0,1,0,0,0
SOAD08150,Flumevale,Yes,Flood Risk Reduction,Earth,9.537,0.183,20804.0,1957,,0.09653,15.97974,Uncontrolled,01/11/2011,3,7.76,Low,Not Rated,,0.1227,35.5,335.5,19.60958444472206,9.537,0.183,0,20804.0,0,9.94294862141704,0,Unknow,0,0,0,0,0,0
SOAD01146,Flumevale,Yes,Recreation,Earth,8.754,0.029,12029.987049543752,1930,,0.08077,37.28606,Uncontrolled,05/09/2018,6,34.83,Low,Fair,2013-09-25,0.0684,27.3,56.7,9.5,8.754,0.029,0,,1,,0,Unknow,0,0,1,0,0,0
SOAD01301,Flumevale,Yes,Irrigation,Earth,4.125,0.3,22617.111593474692,1991,2012,0.17336,34.22462959730813,Uncontrolled,14/07/2015,6,11.39,Low,Fair,2020-11-17,0.0664,27.3,160.5,20.4,4.125,0.3,0,,1,,1,2012,0,0,1,1,0,0
SOAD10366,Flumevale,Yes,Water Supply,Earth,10.213,0.135,16400.0,1964,,0.18715,7.98987,,02/11/2021,0.5,51.71083349301042,Low,Satisfactory,2017-09-01,0.0756,23.5,10.8,11.2,10.213,0.135,0,16400.0,0,9.70509758756311,0,Unknow,0,0,0,0,0,1
SOAD12574,Flumevale,Yes,Irrigation,Earth,4.369,0.367,18220.0,1885,,0.16548,39.47476970175644,Uncontrolled,01/10/2013,6,7.71,Low,Satisfactory,2013-09-24,0.0433,20.0,476.9,40.0,4.369,0.367,0,18220.0,0,9.81033005404988,0,Unknow,0,0,0,1,0,0
SOAD12867,Flumevale,Yes,Water Supply,Earth,7.77,0.533,62156.0,1964,,0.07289,7.98987,,10/06/2020,6,17.89,Low,Fair,2011-10-11,0.0715,15.6,218.4,22.8,7.77,0.533,0,62156.0,0,11.0374187213286,0,Unknow,0,0,0,0,0,0
SOAD14264,Flumevale,Yes,"Fire Protection, Stock, Or Small Fish Pond",Earth,5.412,0.353,18285.0,1954,,0.10244,50.60251,Uncontrolled,29/09/1994,6,61.0,Low,Satisfactory,2020-09-29,0.0408,15.3,237.7,14.733034165211585,5.412,0.353,0,18285.0,0,9.81389101872437,0,Unknow,0,0,0,0,0,0
SOAD15760,Flumevale,Yes,Recreation,Earth,11.416,0.22,38302.25078770178,1960,,0.0886499999999999,61.36720625112762,Uncontrolled,22/10/2021,6,1.61,Low,Satisfactory,2021-06-09,0.0344,41.2,744.5,3.1,11.416,0.22,0,,1,,0,Unknow,0,0,1,1,0,0
SOAD09341,Flumevale,Yes,Water Supply,Earth,16.983,0.183,28000.0,1968,,0.1182,2.66329,,08/06/2022,0.5,53.12548214814172,Low,Satisfactory,2017-09-01,0.0802,5.9,6.7,41.2,16.983,0.183,0,28000.0,0,10.2399955028053,0,Unknow,0,0,0,0,0,1
SOAD03987,Flumevale,Yes,Other,Earth,4.696,0.19,5807.0,1964,,0.42946,23.96961,,11/05/2022,0.5,43.45077732704641,Low,Satisfactory,2017-09-01,0.0644,393.3,17.0,22.087417834263125,4.696,0.19,0,5807.0,0,8.66699155650463,0,Unknow,0,0,0,0,0,1
SOAD10961,Flumevale,Yes,Water Supply,Earth,2.707,0.225,19161.313304834333,1909,2000,0.14972,42.53220729172492,,27/06/1979,6,1.56,Low,Not Rated,,0.0691,6.1,591.7,52.0,2.707,0.225,0,,1,,1,2000,0,0,1,1,0,0
SOAD13165,Flumevale,Yes,Other,Earth,11.792,0.17,14500.0,1962,,0.14184,23.96961,,21/06/2022,0.5,47.72592268589355,Low,Satisfactory,2017-09-01,0.0546,30.4,19.0,21.39215738152486,11.792,0.17,0,14500.0,0,9.5819728915479,0,Unknow,0,0,0,0,0,1
SOAD04082,Flumevale,Yes,Water Supply,Earth,24.697,0.16,93700.0,1943,,0.05122,32.04755862165061,,02/11/2021,1,0.82,High,Satisfactory,2017-09-01,0.0889,45.7,167.1,32.7,24.697,0.16,0,93700.0,0,11.4478641405282,0,Unknow,0,0,0,1,0,0
SOAD08680,Flumevale,Yes,Irrigation,Earth,6.59,0.098,10132.820776630806,1926,,0.08274,41.61674257471792,,07/09/2018,6,28.13,Low,Satisfactory,2018-08-29,0.0324,22.0,222.2,30.3,6.59,0.098,0,,1,,0,Unknow,0,0,1,1,0,0
SOAD15699,Flumevale,Yes,Irrigation,Earth,10.899,0.19,26840.0,1906,1962,0.11229,21.30632,Uncontrolled,14/12/2011,6,17.47,Low,Not Rated,,0.0394,8.7,378.2,23.3,10.899,0.19,0,26840.0,0,10.1976858482157,1,1962,0,0,0,0,0,0
SOAD19975,Flumevale,Yes,Fish and Wildlife Pond,Earth,6.184,0.343,27091.7570619446,1928,,0.25019,170.45056,,27/06/1989,0,88.3,Low,Not Rated,,0.0677,432.1,231.5,17.852251420880492,6.184,0.343,0,,1,,0,Unknow,0,0,1,0,0,0
SOAD06259,Flumevale,Yes,Fish and Wildlife Pond,Earth,15.797,0.103,38761.57586029796,1988,,0.06698,7.98987,Uncontrolled,08/09/2021,6,26.19,Low,Not Rated,,0.0437,25.0,176.4,18.622871362861844,15.797,0.103,0,,1,,0,Unknow,0,0,1,0,0,0
SOAD20679,Flumevale,Yes,Irrigation,Earth,6.89,0.364,31378.687572890587,1989,,0.06107,50.60251,Uncontrolled,03/06/2016,6,1.54,Low,Not Rated,,0.0804,41.7,481.7,15.3,6.89,0.364,0,,1,,0,Unknow,0,0,1,0,0,0
SOAD04723,Flumevale,Yes,Irrigation,Earth,10.138,0.163,47187.0,1918,,0.08274,31.81064829033899,Uncontrolled,16/07/2015,6,71.57,Low,Not Rated,,0.0877,13.7,66.1,23.2,10.138,0.163,0,47187.0,0,10.7618949019617,0,Unknow,0,0,0,1,0,0
SOAD12744,Flumevale,Yes,"Fire Protection, Stock, Or Small Fish Pond",Earth,3.46,1.167,10693.0,1909,,0.34475,1326.31842,,23/04/2009,6,36.22,Low,Not Rated,,0.0924,264.7,54.3,18.905428052792708,3.46,1.167,0,10693.0,0,9.27743811550868,0,Unknow,0,0,0,0,0,0
SOAD13896,Flumevale,Yes,Irrigation,Earth,5.83,0.233,7800.0,1912,2011,0.15366,35.87702901055688,Uncontrolled,09/07/2020,6,12.78,Low,Fair,2019-10-28,0.0756,26.7,185.3,17.3,5.83,0.233,0,7800.0,0,8.96200720958831,1,2011,0,0,0,1,0,0
SOAD15918,Flumevale,Yes,Flood Risk Reduction,Earth,11.402,0.188,22314.0,1971,,0.10835,21.30632,Uncontrolled,07/10/1998,0,8.29,Low,Fair,2019-06-05,0.0884,20.1,266.0,19.137457254759042,11.402,0.188,0,22314.0,0,10.0130143770634,0,Unknow,0,0,0,0,0,0
SOAD18797,Flumevale,Yes,Recreation,Earth,6.692,0.055,1683.0,1975,,0.14578,45.18155510245336,,03/10/2022,6,21.69,Low,Not Rated,,0.0498,43.5,128.4,7.1,6.692,0.055,0,1683.0,0,7.42892719480227,0,Unknow,0,0,0,1,0,0
SOAD05055,Flumevale,Yes,Fish and Wildlife Pond,Earth,8.356,0.2,20784.139076768093,1906,2014,0.1182,88.14441941527174,Uncontrolled,14/02/2019,6,0.0,Low,Satisfactory,2014-10-17,0.0455,20.4,239.4,13.459319467852028,8.356,0.2,0,,1,,1,2014,0,0,1,1,0,0
SOAD06852,Flumevale,Yes,Irrigation,Earth,4.936,0.279,7400.0,1973,,0.1379,37.28606,,09/05/1991,6,26.77,Low,Satisfactory,2020-08-26,0.04,37.0,284.7,21.6,4.936,0.279,0,7400.0,0,8.90937040519747,0,Unknow,0,0,0,0,0,0
SOAD07113,Flumevale,Yes,Water Supply,Earth,20.242,0.143,65039.41082615066,1939,,0.08668,2.66329,,28/02/2022,1,3.35,High,Satisfactory,2017-09-01,0.0959,16.2,280.1,19.3,20.242,0.143,0,,1,,0,Unknow,0,0,1,0,0,0
SOAD09581,Flumevale,Yes,Flood Risk Reduction,Earth,11.874,0.225,28000.0,1971,,0.11032,15.97974,Uncontrolled,29/04/2008,3,4.6,Low,Not Rated,,0.0653,8.0,593.1,18.844923464823285,11.874,0.225,0,28000.0,0,10.2399955028053,0,Unknow,0,0,0,0,0,0
SOAD12674,Flumevale,Yes,Flood Risk Reduction,Earth,10.098,0.068,18970.0,1962,,0.15366,15.97974,,23/09/2021,1,0.79,High,Satisfactory,2017-09-01,0.0858,45.0,524.2,17.334322977647403,10.098,0.068,0,18970.0,0,9.85066677635255,0,Unknow,0,0,0,0,0,0
SOAD19398,Flumevale,Yes,Irrigation,Earth,18.328,0.173,45000.0,2007,,0.06698,35.74394451468381,Uncontrolled,03/06/2022,2,36.14,Significant,Satisfactory,2022-06-03,0.1089,42.6,183.8,9.6,18.328,0.173,0,45000.0,0,10.7144399907278,0,Unknow,0,0,0,1,0,0
SOAD00504,Flumevale,No,Other,Earth,6.934,0.2,18305.05155219043,Unknow,,0.09287334780300076,32.778783333386464,,,Unknow,6.13,Low,Not Available,,0.1065,7.4,182.3,21.336771624576933,6.934,0.2,0,,1,,0,Unknow,0,0,1,1,1,0
SOAD04570,Flumevale,Yes,Flood Risk Reduction,Earth,7.741,0.45,35000.0,1983,,0.14381,101.93066629980508,,21/04/2022,1,0.0,High,Satisfactory,2017-09-01,0.0719,14.0,876.0,14.10145332226663,7.741,0.45,0,35000.0,0,10.463131911492,0,Unknow,0,0,0,1,0,0
SOAD07266,Flumevale,Yes,Flood Risk Reduction,Earth,14.08,0.32,52309.443421354794,1984,,0.04925,7.98987,Uncontrolled,07/04/2022,3,0.0,High,Satisfactory,2022-04-07,0.1093,12.6,368.7,17.95628228696597,14.08,0.32,0,,1,,0,Unknow,0,0,1,0,0,0
SOAD14853,Flumevale,Yes,Irrigation,Earth,9.998,0.14,25885.0,1961,,0.05122,7.98987,,15/06/2021,6,17.76,Low,Satisfactory,2016-09-22,0.0471,36.2,463.1,6.2,9.998,0.14,0,25885.0,0,10.1614575610024,0,Unknow,0,0,0,0,0,0
SOAD15934,Flumevale,Yes,Fish and Wildlife Pond,Earth,14.572,0.433,59441.0,1960,,0.05713,48.959305582750055,Uncontrolled,11/06/2019,6,1.64,Low,Satisfactory,2019-04-15,0.0285,39.1,603.5,13.096186646861959,14.572,0.433,0,59441.0,0,10.9927563262011,0,Unknow,0,0,0,1,0,0
SOAD16940,Flumevale,Yes,Flood Risk Reduction,Earth,10.109,0.253,28310.0,1958,,0.12411,15.97974,Uncontrolled,13/05/2016,3,5.02,Low,Not Rated,,0.1058,35.9,293.7,19.07587630523084,10.109,0.253,0,28310.0,0,10.2510057006894,0,Unknow,0,0,0,0,0,0
SOAD18464,Flumevale,Yes,Recreation,Earth,15.513,0.111,13158.0,1998,2018,0.0985,7.98987,Uncontrolled,19/07/2018,6,6.52,Low,Not Rated,,0.1054,45.8,476.5,5.3,15.513,0.111,0,13158.0,0,9.48486121415014,1,2018,0,0,0,0,0,0
SOAD01898,Flumevale,Yes,Recreation,Earth,6.567,1.267,120000.0,1991,,0.18321,42.61264,Uncontrolled,15/05/2019,6,38.5,Low,Satisfactory,2021-10-20,0.0602,46.3,145.2,5.2,6.567,1.267,0,120000.0,0,11.6952553550628,0,Unknow,0,0,0,0,0,0
SOAD14818,Flumevale,Yes,Irrigation,Earth,9.611,0.14,9507.0,1949,,0.0985,38.139028664734816,,13/09/2021,6,17.22,Low,Satisfactory,2013-09-24,0.0431,28.6,192.5,30.4,9.611,0.14,0,9507.0,0,9.15988882848009,0,Unknow,0,0,0,1,0,0
SOAD17527,Flumevale,Yes,Irrigation,Earth,9.909,0.158,10934.0,1962,,0.08077,46.18023130884434,,21/09/2011,6,83.41,Low,Not Rated,,0.0476,13.2,169.7,17.7,9.909,0.158,0,10934.0,0,9.29972393311087,0,Unknow,0,0,0,1,0,0
SOAD04005,Flumevale,Yes,Irrigation,Earth,4.352,0.167,7714.0,1890,,0.18124,42.01975397748947,,16/08/2022,6,15.03,Low,Satisfactory,2020-03-11,0.0483,12.4,344.7,39.0,4.352,0.167,0,7714.0,0,8.95092176479726,0,Unknow,0,0,0,1,0,0
SOAD10475,Flumevale,Yes,Fish and Wildlife Pond,Earth,3.74,0.35,32372.0,1930,2002,0.17533,45.27593,Uncontrolled,16/12/2009,6,39.73,Low,Not Rated,,0.0677,20.4,113.6,19.712613078459206,3.74,0.35,0,32372.0,0,10.3850800210318,1,2002,0,0,0,0,0,0
SOAD11365,Flumevale,Yes,Irrigation,Earth,18.195,0.167,71847.34960744811,Unknow,,0.11229,32.364572915791804,,09/05/2023,0.5,55.066031962787385,Low,Fair,2017-09-01,0.0859,25.7,22.9,19.4,18.195,0.167,0,,1,,0,Unknow,0,0,1,1,0,1
SOAD12268,Flumevale,Yes,Irrigation,Earth,13.607,0.079,31439.0,1948,,0.0788,36.95658739745112,,19/05/2022,6,14.19,Low,Fair,2022-08-26,0.0405,14.4,437.7,42.8,13.607,0.079,0,31439.0,0,10.3558362465431,0,Unknow,0,0,0,1,0,0
SOAD12913,Flumevale,Yes,Irrigation,Earth,8.841,0.1,12483.503174125519,1952,,0.0985,21.30632,,18/11/1993,0,95.78,Low,Fair,2020-10-05,0.1048,11.9,154.9,27.0,8.841,0.1,0,,1,,0,Unknow,0,0,1,0,0,0
SOAD05490,Flumevale,Yes,Irrigation,Earth,5.712,0.145,12603.0,1908,,0.13593,7.98987,Uncontrolled,21/07/2017,6,7.96,Low,Satisfactory,2020-09-29,0.0614,30.8,430.0,29.0,5.712,0.145,0,12603.0,0,9.44176950287716,0,Unknow,0,0,0,0,0,0
SOAD13623,Flumevale,Yes,Water Supply,Earth,4.809,0.2,6000.0,2000,,0.14184,93.21515,,24/02/2022,0.5,47.041559379300914,Low,Satisfactory,2017-09-01,0.0592,35.0,10.4,67.0,4.809,0.2,0,6000.0,0,8.69968140098951,0,Unknow,0,0,0,0,0,1
SOAD20134,Flumevale,Yes,Water Supply,Earth,5.841,1.146,63012.89134335265,1990,,0.09456,49.16588822332723,,30/11/2021,1,5.768734295482018,Significant,Satisfactory,2017-09-01,0.1341,35.8,351.3,46.8,5.841,1.146,0,,1,,0,Unknow,0,0,1,1,0,1
SOAD00561,Flumevale,Yes,Recreation,Earth,4.065,0.46,40896.0,1972,,0.21473,67.88701738274067,Uncontrolled,28/05/2015,6,3.3,Low,Satisfactory,2014-04-22,0.0461,14.2,453.4,3.1,4.065,0.46,0,40896.0,0,10.6188119897074,0,Unknow,0,0,0,1,0,0
SOAD04415,Flumevale,Yes,Flood Risk Reduction,Earth,11.194,0.197,37761.0,1976,,0.11623,13.31645,Uncontrolled,19/08/2009,6,49.17,Low,Unsatisfactory,2017-06-08,0.0775,35.5,228.6,20.26286836165463,11.194,0.197,0,37761.0,0,10.5390585849585,0,Unknow,0,0,0,0,0,0
SOAD04573,Flumevale,Yes,Hydroelectric,Earth,9.178,0.04,3150.0,1910,,0.09456,216.78925738291198,Uncontrolled,22/08/2018,3,26.85,Low,Satisfactory,2023-09-29,0.069,19.6,99.1,82.7,9.178,0.04,0,3150.0,0,8.05547514175727,0,Unknow,0,0,0,1,0,0
SOAD10268,Flumevale,Yes,Irrigation,Earth,12.967,0.119,18385.0,1948,,0.09653,37.01665855096386,,16/07/2015,6,40.0,Low,Satisfactory,2019-01-04,0.0444,12.2,218.5,14.5,12.967,0.119,0,18385.0,0,9.8193447844237,0,Unknow,0,0,0,1,0,0
SOAD12055,Flumevale,Yes,Irrigation,Earth,7.332,0.12,11111.189212436122,1920,,0.10835,7.98987,Uncontrolled,09/07/2020,6,14.83,Low,Not Rated,,0.042,22.3,369.0,20.1,7.332,0.12,0,,1,,0,Unknow,0,0,1,0,0,0
SOAD14422,Flumevale,Yes,Irrigation,Earth,3.348,0.123,4477.0,1923,,0.32111,79.31887005427545,,05/04/1991,6,19.23,Low,Not Rated,,0.0779,265.0,463.5,4.6,3.348,0.123,0,4477.0,0,8.4069317971587,0,Unknow,0,0,0,1,0,0
SOAD20286,Flumevale,Yes,Irrigation,Earth,12.476,0.287,18700.0,1948,,0.07486,7.98987,,27/07/2020,6,36.22,Low,Fair,2020-10-06,0.0472,47.1,105.6,27.0,12.476,0.287,0,18700.0,0,9.83633227734872,0,Unknow,0,0,0,0,0,0
SOAD12971,Flumevale,Yes,Irrigation,Earth,8.334,0.189,19812.28630327845,1961,,0.0925899999999999,53.49487316171604,Uncontrolled,16/05/2018,6,48.93,Low,Unsatisfactory,2012-12-11,0.095,10.3,100.7,2.2,8.334,0.189,0,,1,,0,Unknow,0,0,1,1,0,0
SOAD01496,Flumevale,Yes,Irrigation,Earth,10.682,0.45,63051.0,1902,2019,0.0985,34.36210841540305,Uncontrolled,28/05/2021,6,11.58,Low,Satisfactory,2015-09-22,0.0582,29.5,124.4,15.3,10.682,0.45,0,63051.0,0,11.0517150617464,1,2019,0,0,0,1,0,0
SOAD12218,Flumevale,Yes,Irrigation,Earth,13.281,0.06,10110.0,1947,,0.0925899999999999,7.98987,Uncontrolled,26/07/2022,2,11.31,Significant,Fair,2022-07-26,0.1436,25.0,149.5,21.9,13.281,0.06,0,10110.0,0,9.2213792190914,0,Unknow,0,0,0,0,0,0
SOAD12332,Flumevale,Yes,Flood Risk Reduction,Earth,8.355,0.15,13396.81553632241,2019,,0.06895,34.11399524471521,Uncontrolled,17/09/2019,6,58.670518673664205,Low,Fair,2018-05-16,0.0529,42.1,18.2,23.20940267535608,8.355,0.15,0,,1,,0,Unknow,0,0,1,1,0,1
SOAD16125,Flumevale,Yes,"Fire Protection, Stock, Or Small Fish Pond",Earth,4.731,0.29,22157.057140672332,1950,,0.17139,33.83293786177335,,21/11/1991,0,9.27,Low,Fair,2011-05-17,0.0835,45.0,100.4,21.56978858312212,4.731,0.29,0,,1,,0,Unknow,0,0,1,1,0,0
SOAD08178,Flumevale,Yes,Irrigation,Earth,5.681,0.448,27102.0,1946,,0.15957,49.16192862316648,Uncontrolled,,6,18.97,Low,Not Rated,,0.039,30.8,266.5,8.8,5.681,0.448,0,27102.0,0,10.2073997018479,0,Unknow,0,0,0,1,0,0
SOAD00100,Flumevale,Yes,Other,Earth,7.7,0.2,11590.0,1926,,0.15563,2.66329,,06/10/2021,0.5,50.663221843066744,Low,Satisfactory,2017-09-01,0.0715,31.5,23.0,20.659455324088288,7.7,0.2,0,11590.0,0,9.35798421388875,0,Unknow,0,0,0,0,0,1
SOAD03122,Flumevale,Yes,Irrigation,Earth,9.685,0.383,38956.78092201213,1939,,0.34475,362.20744,Uncontrolled,15/09/2022,6,92.49,Low,Satisfactory,2019-08-08,0.04,218.1,237.6,7.8,9.685,0.383,0,,1,,0,Unknow,0,0,1,0,0,0
SOAD04685,Flumevale,Yes,Water Supply,Earth,21.178,0.033,250840.0,1950,,0.05516,38.486446409018306,,24/08/2022,1,0.0,High,Satisfactory,2017-09-01,0.0973,24.1,522.3,21.8,21.178,0.033,0,250840.0,0,12.432574551254,0,Unknow,0,0,0,1,0,0
SOAD07130,Flumevale,Yes,Irrigation,Earth,11.128,0.366,78086.0,1973,,0.12214,29.29619,Uncontrolled,21/11/2022,6,4.62,Low,Fair,2017-10-05,0.0714,44.8,924.0,23.4,11.128,0.366,0,78086.0,0,11.2655788687079,0,Unknow,0,0,0,0,0,0
SOAD18730,Flumevale,Yes,Water Supply,Earth,12.746,0.313,54200.0,1982,,0.08077,33.20835896243255,,28/01/2022,0.5,54.3004629340518,Low,Satisfactory,2017-09-01,0.0605,8.2,12.7,16.3,12.746,0.313,0,54200.0,0,10.900454637442,0,Unknow,0,0,0,1,0,1
SOAD10080,Flumevale,Yes,Irrigation,Earth,10.287,0.317,8550.0,1947,,0.12017,34.13462639566895,,21/04/2021,6,45.47,Low,Fair,2018-10-05,0.0726,30.0,216.4,36.6,10.287,0.317,0,8550.0,0,9.05380351415596,0,Unknow,0,0,0,1,0,0
SOAD17266,Flumevale,Yes,Water Supply,Earth,10.459,0.64,36700.0,1932,,0.17139,2.66329,,19/05/2022,1,0.34,High,Satisfactory,2017-09-01,0.0869,13.5,426.9,42.3,10.459,0.64,0,36700.0,0,10.5105592816278,0,Unknow,0,0,0,0,0,0
SOAD00294,Flumevale,Yes,Irrigation,Earth,6.112,0.147,10667.0,1934,,0.09653,7.98987,Uncontrolled,12/08/2022,1,16.17,High,Not Rated,,0.1334,26.0,391.1,44.7,6.112,0.147,0,10667.0,0,9.2750038853019,0,Unknow,0,0,0,0,0,0
SOAD00768,Flumevale,Yes,Flood Risk Reduction,Earth,4.634,1.367,80815.3483492457,2012,,0.13987,59.333221692553366,Uncontrolled,,6,9.77,Low,Fair,2019-04-05,0.0582,16.6,241.7,16.79215489124179,4.634,1.367,0,,1,,0,Unknow,0,0,1,1,0,0
SOAD19703,Flumevale,Yes,Other,Earth,17.778,0.188,63426.0,1901,,0.15169,28.171813774299007,,13/10/2021,1,0.84,High,Satisfactory,2017-09-01,0.0941,13.3,912.3,20.566753804558793,17.778,0.188,0,63426.0,0,11.0576449172774,0,Unknow,0,0,0,1,0,0
SOAD02183,Flumevale,Yes,Irrigation,Earth,13.904,0.115,55415.0,1949,,0.0925899999999999,50.60251,Uncontrolled,26/08/2016,6,165.57,Low,Fair,2022-10-07,0.059,33.2,134.9,20.0,13.904,0.115,0,55415.0,0,10.9226236397024,0,Unknow,0,0,0,0,0,0
SOAD03298,Flumevale,Yes,Irrigation,Earth,15.978,0.15,61741.00592082626,1951,,0.06698,13.31645,Uncontrolled,20/07/2021,6,26.05,Low,Fair,2019-03-20,0.0466,18.5,387.5,44.9,15.978,0.15,0,,1,,0,Unknow,0,0,1,0,0,0
SOAD09614,Flumevale,Yes,Water Supply,Earth,15.382,0.3,82000.0,1981,,0.08274,32.03720372075938,,09/11/2021,1,0.84,High,Satisfactory,2017-09-01,0.0768,37.9,212.9,25.5,15.382,0.3,0,82000.0,0,11.314486721294,0,Unknow,0,0,0,1,0,0
SOAD16260,Flumevale,Yes,Flood Risk Reduction,Earth,4.081,0.467,45231.0,1889,2003,0.19503,35.004559120285,,02/11/2022,3,0.0,Significant,Satisfactory,2022-11-02,0.1417,34.9,794.4,21.074961577376172,4.081,0.467,0,45231.0,0,10.7195600799334,1,2003,0,0,0,1,0,0
SOAD16398,Flumevale,Yes,Irrigation,Earth,10.037,0.085,17055.618327349617,1972,,0.11032,103.86831,,18/07/2016,6,23.36,Low,Not Rated,,0.0792,28.7,99.4,42.7,10.037,0.085,0,,1,,0,Unknow,0,0,1,0,0,0
SOAD06953,Flumevale,Yes,Fish and Wildlife Pond,Earth,6.479,0.108,10215.07615555037,1895,,0.15169,34.846850176879556,Uncontrolled,20/06/2018,6,6.13,Low,Satisfactory,2022-04-21,0.052,33.0,376.6,21.63533224729359,6.479,0.108,0,,1,,0,Unknow,0,0,1,1,0,0
SOAD09363,Flumevale,Yes,Irrigation,Earth,10.536,0.39,39500.0,1951,,0.11426,36.26511310908907,,31/07/2015,6,38.66,Low,Not Rated,,0.0631,36.5,198.3,31.1,10.536,0.39,0,39500.0,0,10.5840812670245,0,Unknow,0,0,0,1,0,0
SOAD10129,Flumevale,Yes,Fish and Wildlife Pond,Earth,11.35,0.204,9200.0,2000,,0.12411,29.29619,Uncontrolled,20/07/2021,2,9.72,Significant,Satisfactory,2021-07-20,0.1227,45.0,335.1,21.58257799814862,11.35,0.204,0,9200.0,0,9.12706745278236,0,Unknow,0,0,0,0,0,0
SOAD10726,Flumevale,Yes,Flood Risk Reduction,Earth,9.926,0.23,16079.0,1974,,0.1576,7.98987,Uncontrolled,02/07/2008,3,63.56,Low,Fair,2020-03-05,0.0899,36.4,81.8,20.250026457091717,9.926,0.23,0,16079.0,0,9.68533154273296,0,Unknow,0,0,0,0,0,0
SOAD14599,Flumevale,Yes,Irrigation,Earth,14.096,0.173,29457.0,1906,,0.07486,21.30632,Uncontrolled,05/05/2021,2,14.32,Significant,Fair,2021-05-05,0.1383,34.5,131.8,36.3,14.096,0.173,0,29457.0,0,10.2907207990495,0,Unknow,0,0,0,0,0,0
SOAD18669,Flumevale,Yes,Irrigation,Earth,4.556,0.687,47716.09407091692,2007,,0.0906199999999999,77.1047919107698,Uncontrolled,14/01/2014,6,1.61,Low,Fair,2020-09-28,0.0482,42.5,665.0,7.6,4.556,0.687,0,,1,,0,Unknow,0,0,1,1,0,0
SOAD00519,Flumevale,No,"Fire Protection, Stock, Or Small Fish Pond",Earth,2.669,0.495,107438.83748823534,1951,,0.3616527582564452,180.79829884558032,Uncontrolled,01/08/2011,10,98.05454247659765,Low,Not Rated,,0.0471,5.6,8.1,21.274317609680057,2.669,0.495,0,,1,,0,Unknow,0,0,1,1,1,1
SOAD03950,Flumevale,Yes,Flood Risk Reduction,Earth,4.85,0.032,12000.0,2002,,0.20685,18.64303,,24/02/2022,0.5,0.4,Low,Satisfactory,2017-09-01,0.0729,31.2,138.3,17.513797249495795,4.85,0.032,0,12000.0,0,9.39274525863144,0,Unknow,0,0,0,0,0,0
SOAD06025,Flumevale,Yes,Water Supply,Earth,15.189,0.188,44300.0,2002,,0.12411,2.66329,,24/09/2021,1,0.0,High,Satisfactory,2017-09-01,0.0761,25.4,230.1,12.8,15.189,0.188,0,44300.0,0,10.6987625291419,0,Unknow,0,0,0,0,0,0
SOAD07064,Flumevale,Yes,"Fire Protection, Stock, Or Small Fish Pond",Earth,5.321,0.133,10371.0,1897,,0.03349,34.864269207528054,,24/08/1994,6,4.83,Low,Fair,2014-10-03,0.0592,44.6,348.1,21.69698816823758,5.321,0.133,0,10371.0,0,9.24686514665856,0,Unknow,0,0,0,1,0,0
SOAD09623,Flumevale,Yes,Water Supply,Earth,8.058,0.85,83000.0,1967,,0.33884,2.66329,,10/06/2022,1,9.41500730100363,Significant,Satisfactory,2017-09-01,0.122,414.0,412.8,38.5,8.058,0.85,0,83000.0,0,11.3266079348989,0,Unknow,0,0,0,0,0,1
SOAD10303,Flumevale,Yes,Water Supply,Earth,21.273,0.151,75000.0,1908,,0.06895,7.98987,,05/08/2022,1,3.3,High,Satisfactory,2017-09-01,0.0793,27.7,844.9,14.2,21.273,0.151,0,75000.0,0,11.2252567257629,0,Unknow,0,0,0,0,0,0
SOAD13046,Flumevale,Yes,Water Supply,Earth,8.826,0.09,3000.0,1913,,0.24231,2.66329,,14/06/2022,0.5,49.061616151769954,Low,Satisfactory,2017-09-01,0.0669,18.3,21.6,23.1,8.826,0.09,0,3000.0,0,8.00670084544037,0,Unknow,0,0,0,0,0,1
SOAD02590,Flumevale,Yes,Irrigation,Earth,6.966,0.139,13711.0,1908,,0.12017,7.98987,Uncontrolled,15/07/2019,6,35.56,Low,Satisfactory,2011-05-03,0.0329,15.7,158.0,9.3,6.966,0.139,0,13711.0,0,9.52602664083756,0,Unknow,0,0,0,0,0,0
SOAD05606,Flumevale,Yes,Irrigation,Earth,9.445,0.1,14066.989054336032,1968,,0.09456,29.29619,Uncontrolled,26/05/2015,6,25.33,Low,Fair,2013-09-22,0.0732,36.0,357.4,35.7,9.445,0.1,0,,1,,0,Unknow,0,0,1,0,0,0
SOAD05793,Flumevale,Yes,"Fire Protection, Stock, Or Small Fish Pond",Earth,6.908,0.117,9074.0,1947,,0.08471,58.59238,Uncontrolled,13/04/1995,6,23.31,Low,Not Rated,,0.0636,39.1,159.5,11.648053676669884,6.908,0.117,0,9074.0,0,9.11327865913305,0,Unknow,0,0,0,0,0,0
SOAD07190,Flumevale,Yes,Flood Risk Reduction,Earth,13.488,0.182,27950.0,1977,,0.0985,15.97974,Uncontrolled,05/03/2020,6,30.68,Low,Unsatisfactory,2013-11-18,0.0934,44.4,141.8,18.8607850662881,13.488,0.182,0,27950.0,0,10.2382082561185,0,Unknow,0,0,0,0,0,0
SOAD18993,Flumevale,Yes,"Fire Protection, Stock, Or Small Fish Pond",Earth,11.203,0.193,35933.94162400906,1965,,0.14184,42.61264,,13/02/1992,0,48.98,Low,Not Rated,,0.0745,32.9,62.5,18.458132818758436,11.203,0.193,0,,1,,0,Unknow,0,0,1,0,0,0
SOAD04367,Flumevale,Yes,Irrigation,Earth,12.373,0.233,10889.0,2020,2020,0.10047,33.90988415006288,Uncontrolled,21/06/2021,2,14.08,Significant,Satisfactory,2021-06-21,0.1248,30.5,178.1,40.4,12.373,0.233,0,10889.0,0,9.29560021592701,1,2020,0,0,0,1,0,0
SOAD05671,Flumevale,Yes,Irrigation,Earth,6.459,0.138,11002.410423050142,1906,,0.12805,15.97974,Uncontrolled,01/12/2022,6,17.04,Low,Satisfactory,2021-09-16,0.0361,11.9,448.9,30.2,6.459,0.138,0,,1,,0,Unknow,0,0,1,0,0,0
SOAD05794,Flumevale,Yes,Irrigation,Earth,8.91,0.227,24817.71584597365,Unknow,,0.11229,32.267050783474026,,05/12/2022,1,0.82,High,Fair,2017-09-01,0.1153,35.6,173.8,13.7,8.91,0.227,0,,1,,0,Unknow,0,0,1,1,0,0
SOAD12482,Flumevale,Yes,Irrigation,Earth,7.175,0.092,17282.0,1915,,0.12214,48.35164793912973,Uncontrolled,15/07/2019,6,27.55,Low,Not Rated,,0.085,39.7,451.7,3.0,7.175,0.092,0,17282.0,0,9.75747863840049,0,Unknow,0,0,0,1,0,0
SOAD14632,Flumevale,Yes,Other,Earth,21.606,0.122,42000.0,1971,,0.11229,53.2658,,05/01/2022,0.5,49.107290700473385,Low,Satisfactory,2017-09-01,0.0568,19.1,11.0,13.369377624540727,21.606,0.122,0,42000.0,0,10.6454487065059,0,Unknow,0,0,0,0,0,1
SOAD02627,Flumevale,Yes,Irrigation,Earth,4.209,0.353,26239.187056770337,1904,,0.18321,34.72560301343639,Uncontrolled,25/06/2014,6,63.67,Low,Fair,2022-09-29,0.0497,47.5,192.8,41.0,4.209,0.353,0,,1,,0,Unknow,0,0,1,1,0,0
SOAD04993,Flumevale,Yes,Water Supply,Earth,12.681,0.15,36326.56740481549,1906,,0.06501,7.98987,Uncontrolled,23/08/2022,2,11.28,Significant,Satisfactory,2022-08-23,0.1159,31.3,103.0,18.6,12.681,0.15,0,,1,,0,Unknow,0,0,1,0,0,0
SOAD07126,Flumevale,Yes,Irrigation,Earth,11.617,0.064,8281.0,1903,,0.10638,53.37744545498213,Uncontrolled,18/05/2022,1,4.7,High,Fair,2022-05-18,0.0964,43.6,177.9,1.6,11.617,0.064,0,8281.0,0,9.02183976410551,0,Unknow,0,0,0,1,0,0
SOAD01187,Flumevale,Yes,Irrigation,Earth,7.543,0.084,8450.0,1942,,0.11426,13.31645,Uncontrolled,04/09/2013,6,16.35,Low,Fair,2010-10-05,0.0489,20.3,439.1,31.7,7.543,0.084,0,8450.0,0,9.04204005654448,0,Unknow,0,0,0,0,0,0
SOAD01478,Flumevale,Yes,Water Supply,Earth,5.283,0.157,11862.413305215932,1920,,0.34081,66.58225,,04/11/2021,0.5,53.550950004034554,Low,Satisfactory,2017-09-01,0.0833,531.6,18.1,50.6,5.283,0.157,0,,1,,0,Unknow,0,0,1,0,0,1
SOAD10101,Flumevale,Yes,Irrigation,Earth,7.552,0.25,14722.0,1953,1996H;1996S,0.12214,32.67795894174157,Uncontrolled,17/06/2021,2,12.41,Significant,Fair,2021-06-17,0.1301,32.3,454.9,13.6,7.552,0.25,0,14722.0,0,9.59716617586541,2,1996,0,0,0,1,0,0
SOAD12775,Flumevale,Yes,Flood Risk Reduction,Earth,14.967,0.218,54930.0,1962,,0.0906199999999999,15.97974,,04/04/2019,3,3.31,Low,Fair,2013-05-17,0.0991,42.4,821.4,18.573110274930187,14.967,0.218,0,54930.0,0,10.9138331311591,0,Unknow,0,0,0,0,0,0
SOAD20564,Flumevale,Yes,Irrigation,Earth,6.056,0.6,56417.0,1925,,0.18124,7.98987,,17/09/1991,0,48.64,Low,Fair,2015-09-23,0.0909,36.8,74.9,43.0,6.056,0.6,0,56417.0,0,10.9405435355051,0,Unknow,0,0,0,0,0,0
SOAD04316,Flumevale,Yes,Water Supply,Earth,12.612,0.11,29000.0,1953,,0.12608,5.32658,,15/12/2021,1,6.469876658294681,Significant,Satisfactory,2017-09-01,0.1351,21.9,336.0,65.5,12.612,0.11,0,29000.0,0,10.2750855911327,0,Unknow,0,0,0,0,0,1
SOAD10408,Flumevale,Yes,Other,Earth,13.375,0.047,8000.0,1961,,0.0925899999999999,237.03281,,20/06/2023,0.5,48.45464296579734,Low,Poor,2021-08-18,0.1058,38.1,19.5,13.85472278863905,13.375,0.047,0,8000.0,0,8.98732181285012,0,Unknow,0,0,0,0,0,1
SOAD18118,Flumevale,Yes,Flood Risk Reduction,Earth,10.596,0.302,30600.0,1965,,0.13002,13.31645,,11/04/2018,3,40.37,Low,Satisfactory,2020-07-07,0.0641,11.7,187.3,20.21370362822155,10.596,0.302,0,30600.0,0,10.3287879671451,0,Unknow,0,0,0,0,0,0
SOAD04873,Flumevale,Yes,Recreation,Earth,11.725,0.6,86424.0,1972,,0.10441,45.31930516053769,Uncontrolled,15/06/2022,2,0.0,Significant,Satisfactory,2022-06-15,0.1209,33.6,952.6,4.0,11.725,0.6,0,86424.0,0,11.3670322647898,0,Unknow,0,0,0,1,0,0
SOAD05067,Flumevale,Yes,Water Supply,Earth,14.345,0.263,150000.0,1992,,0.07289,2.66329,,26/04/2022,1,1.01,High,Satisfactory,2017-09-01,0.1077,19.7,602.0,25.3,14.345,0.263,0,150000.0,0,11.9183972397228,0,Unknow,0,0,0,0,0,0
SOAD06358,Flumevale,Yes,Water Supply,Earth,33.915,0.172,158100.0,1973,,0.07486,7.98987,,11/08/2021,1,2.01,High,Satisfactory,2017-09-01,0.1083,5.7,582.7,55.9,33.915,0.172,0,158100.0,0,11.9709893482882,0,Unknow,0,0,0,0,0,0
SOAD14376,Flumevale,Yes,Water Supply,Earth,14.395,0.287,47000.0,1966,,0.10441,2.66329,,14/03/2022,0.5,23.81,Low,Satisfactory,2017-09-01,0.0702,33.2,215.7,26.8,14.395,0.287,0,47000.0,0,10.7579241570616,0,Unknow,0,0,0,0,0,0
SOAD00224,Flumevale,Yes,Irrigation,Earth,7.598,0.525,45109.25736766689,1906,2003,0.12411,7.98987,Uncontrolled,17/12/2021,1,5.05,High,Fair,2021-12-17,0.1051,37.5,133.6,13.5,7.598,0.525,0,,1,,1,2003,0,0,1,0,0,0
SOAD01287,Flumevale,Yes,Irrigation,Earth,5.673,0.013,2107.0,1962,2005,0.24034,801.1288462660333,Uncontrolled,19/10/2021,6,5.02,Low,Satisfactory,2020-10-15,0.0287,18.9,425.5,38.0,5.673,0.013,0,2107.0,0,7.65349490966125,1,2005,0,0,0,1,0,0
SOAD04905,Flumevale,Yes,Water Supply,Earth,6.484,0.443,45449.85697681103,1905,,0.18124,2.66329,,23/06/2022,0.5,104.6183419298248,Low,Satisfactory,2017-09-01,0.0762,8.5,13.9,12.9,6.484,0.443,0,,1,,0,Unknow,0,0,1,0,0,1
SOAD13630,Flumevale,Yes,Irrigation,Earth,3.811,0.2,10865.0,1948,,0.13987,42.778683256728876,Uncontrolled,26/09/2013,6,0.0,Low,Satisfactory,2016-06-09,0.0355,33.6,728.7,24.1,3.811,0.2,0,10865.0,0,9.29339392711147,0,Unknow,0,0,0,1,0,0
SOAD17507,Flumevale,Yes,Recreation,Earth,12.514,0.313,98536.0,1955,,0.08077,50.861181478456146,Uncontrolled,09/11/2022,2,7.88,Significant,Satisfactory,2022-11-09,0.1271,13.6,293.6,4.3,12.514,0.313,0,98536.0,0,11.498187391145,0,Unknow,0,0,0,1,0,0
SOAD18229,Flumevale,Yes,Irrigation,Earth,2.803,0.235,6560.0,1879,,0.13593,38.14533719975388,,09/09/1985,6,17.92,Low,Not Rated,,0.0641,38.1,181.0,33.8,2.803,0.235,0,6560.0,0,8.78889830934488,0,Unknow,0,0,0,1,0,0
SOAD19136,Flumevale,Yes,Water Supply,Earth,19.993,0.182,72000.0,1989,,0.0925899999999999,2.66329,,01/09/2021,1,9.72214148629613,Significant,Satisfactory,2017-09-01,0.1336,5.8,433.8,5.6,19.993,0.182,0,72000.0,0,11.1844352867906,0,Unknow,0,0,0,0,0,1
SOAD01237,Flumevale,Yes,Water Supply,Earth,12.371,0.139,22060.0,1936,,0.13199,13.31645,,04/05/2022,1,0.16,High,Satisfactory,2017-09-01,0.0956,33.2,913.6,62.5,12.371,0.139,0,22060.0,0,10.0015666226958,0,Unknow,0,0,0,0,0,0
SOAD01973,Flumevale,Yes,Irrigation,Earth,5.095,0.055,4522.0,1886,,0.1182,35.53421667043464,,26/08/2022,6,14.26,Low,Not Rated,,0.0585,40.7,117.2,14.9,5.095,0.055,0,4522.0,0,8.41693076947784,0,Unknow,0,0,0,1,0,0
SOAD06850,Flumevale,Yes,Irrigation,Earth,38.113,0.147,124000.0,1966,,0.06501,55.14646978801833,Uncontrolled,02/08/2021,3,0.0,Low,Satisfactory,2023-09-29,0.067,23.3,137.6,3.5,38.113,0.147,0,124000.0,0,11.7280449090708,0,Unknow,0,0,0,1,0,0
SOAD16975,Flumevale,Yes,Hydroelectric,Earth,18.468,0.36,135018.15967104817,1962,,0.12411,2.66329,Uncontrolled,11/07/2023,3,1.66,Low,Satisfactory,2023-09-29,0.0619,34.9,117.3,93.6,18.468,0.36,0,,1,,0,Unknow,0,0,1,0,0,0
SOAD18462,Flumevale,Yes,Hydroelectric,Earth,3.256,0.03,200.0,1855,,0.16371584608600584,118.08413856540083,Uncontrolled,10/08/2016,3,55.79966139740302,Low,Satisfactory,2023-09-29,0.0712,16.2,5.8,65.02165833333345,3.256,0.03,0,200.0,0,5.30330490805908,0,Unknow,0,0,0,1,1,1
SOAD03141,Flumevale,Yes,Other,Earth,9.266,0.373,38000.0,1968,,0.20094,21.30632,,27/04/2022,0.5,54.82749562386443,Low,Satisfactory,2017-09-01,0.0579,12.8,12.7,20.180685170408132,9.266,0.373,0,38000.0,0,10.5453677541517,0,Unknow,0,0,0,0,0,1
SOAD03661,Flumevale,Yes,Irrigation,Earth,7.138,0.163,14376.876387291944,1946,1999H,0.0886499999999999,33.05563251026095,,15/05/2020,6,38.46,Low,Fair,2016-09-16,0.0524,26.7,232.8,16.3,7.138,0.163,0,,1,,1,1999,0,0,1,1,0,0
SOAD05140,Flumevale,Yes,"Fire Protection, Stock, Or Small Fish Pond",Earth,8.144,0.16,15225.26094223063,1971,2000,0.13002,33.905751799862216,Uncontrolled,10/10/2019,6,18.41,Low,Fair,2017-08-23,0.0662,42.4,254.1,21.218281227822747,8.144,0.16,0,,1,,1,2000,0,0,1,1,0,0
SOAD05272,Flumevale,Yes,Unknow,Earth,4.424,0.167,13979.621206854967,Unknow,2018,0.12214,33.01395258920074,Uncontrolled,,0,49.053310977320585,Low,Satisfactory,2019-04-04,0.0628,24.6,20.1,22.660221984914056,4.424,0.167,0,,1,,1,2018,0,0,1,1,0,1
SOAD06954,Flumevale,Yes,Water Supply,Earth,18.218,0.133,36000.0,1954,,0.07683,111.85818,,23/02/2022,1,9.48,Significant,Satisfactory,2017-09-01,0.1372,14.7,196.8,10.9,18.218,0.133,0,36000.0,0,10.4913019948302,0,Unknow,0,0,0,0,0,0
SOAD09879,Flumevale,Yes,Water Supply,Earth,12.443,0.12,23000.0,1961,,0.18321,23.96961,,10/06/2022,0.5,49.531345420992324,Low,Satisfactory,2017-09-01,0.0754,38.0,19.8,67.7,12.443,0.12,0,23000.0,0,10.043292972227,0,Unknow,0,0,0,0,0,1
SOAD13943,Flumevale,Yes,Flood Risk Reduction,Earth,11.444,0.195,26980.0,1964,,0.21276,7.98987,,04/04/2019,3,32.71,Low,Fair,2004-10-08,0.0836,41.4,126.1,17.771734536800068,11.444,0.195,0,26980.0,0,10.2028881935671,0,Unknow,0,0,0,0,0,0
SOAD15660,Flumevale,Yes,Flood Risk Reduction,Earth,16.044,0.438,85340.0,1954,,0.13199,13.31645,,09/03/2022,1,0.5,High,Satisfactory,2017-09-01,0.0866,28.5,705.2,15.53605585908091,16.044,0.438,0,85340.0,0,11.3544102745079,0,Unknow,0,0,0,0,0,0
SOAD01139,Flumevale,Yes,Irrigation,Earth,15.907,0.202,47729.0,1961,,0.0886499999999999,13.31645,Uncontrolled,19/05/2018,6,4.68,Low,Not Rated,,0.0472,18.9,679.8,25.0,15.907,0.202,0,47729.0,0,10.7733154099999,0,Unknow,0,0,0,0,0,0
SOAD04006,Flumevale,Yes,Water Supply,Earth,9.672,1.083,69000.0,1961,,0.14775,38.24101031876966,,30/06/2022,1,2.22,High,Satisfactory,2017-09-01,0.0819,20.9,316.5,50.5,9.672,1.083,0,69000.0,0,11.141876276228,0,Unknow,0,0,0,1,0,0
SOAD15972,Flumevale,Yes,Flood Risk Reduction,Earth,10.097,0.3,28401.0,1969,,0.13199,13.31645,Uncontrolled,18/07/1991,0,48.72,Low,Satisfactory,2019-03-21,0.0757,43.2,135.5,20.619158709530396,10.097,0.3,0,28401.0,0,10.254214844205,0,Unknow,0,0,0,0,0,0
SOAD16686,Flumevale,Yes,Flood Risk Reduction,Earth,12.026,0.21,17248.0,1975,,0.13987,21.30632,Uncontrolled,05/10/2010,3,8.43,Low,Not Rated,,0.0939,13.5,160.7,19.510349872151252,12.026,0.21,0,17248.0,0,9.75550944976463,0,Unknow,0,0,0,0,0,0
SOAD03697,Flumevale,Yes,Irrigation,Earth,6.387,0.077,4857.0,1894,1966H;1966M;1966S,0.0886499999999999,79.8987,Uncontrolled,08/08/2018,6,18.47,Low,Satisfactory,2020-08-20,0.0335,17.6,185.4,44.9,6.387,0.077,0,4857.0,0,8.48838210956212,3,1966,0,0,0,0,0,0
SOAD04991,Flumevale,Yes,Irrigation,Earth,7.414,0.133,21959.0,1904,1990,0.13002,49.29938891327631,Uncontrolled,05/10/2021,6,40.31,Low,Satisfactory,2020-10-22,0.0336,39.8,102.5,6.6,7.414,0.133,0,21959.0,0,9.99697789562347,1,1990,0,0,0,1,0,0
SOAD11425,Flumevale,Yes,Water Supply,Earth,6.117,0.807,57669.71581778804,1885,,0.08668,179.50506516891153,,24/02/2022,1,0.0,High,Satisfactory,2017-09-01,0.0928,42.5,821.9,15.3,6.117,0.807,0,,1,,0,Unknow,0,0,1,1,0,0
SOAD01055,Flumevale,No,Fish and Wildlife Pond,Earth,3.639,0.073,9838.431859115075,1893,,0.09642285115867504,34.563467487333504,Uncontrolled,22/09/2008,10,64.6856800769631,Low,Not Rated,,0.0784,7.3,18.2,23.277619998998997,3.639,0.073,0,,1,,0,Unknow,0,0,1,1,1,1
SOAD09055,Flumevale,Yes,Irrigation,Earth,9.03,0.13,13468.634179178287,1913,,0.12017,32.838518225636044,Uncontrolled,05/06/2014,6,40.71,Low,Fair,2013-11-05,0.0697,45.7,148.0,45.1,9.03,0.13,0,,1,,0,Unknow,0,0,1,1,0,0
SOAD17176,Flumevale,Yes,Irrigation,Earth,7.295,0.133,19096.0,1911,,0.13002,32.886630057993585,,29/09/2020,6,25.99,Low,Fair,2016-06-29,0.0733,45.4,400.9,22.0,7.295,0.133,0,19096.0,0,9.85728653363541,0,Unknow,0,0,0,1,0,0
SOAD17713,Flumevale,Yes,Irrigation,Earth,9.668,0.1,12755.0,1951,,0.12411,7.98987,Uncontrolled,20/09/2018,6,46.3791897157376,Low,Fair,2020-07-14,0.0523,30.7,9.2,37.7,9.668,0.1,0,12755.0,0,9.45375702812995,0,Unknow,0,0,0,0,0,1
SOAD07626,Flumevale,Yes,Irrigation,Earth,6.143,0.121,13377.0,1914,,0.12214,7.98987,Uncontrolled,16/07/2019,6,39.11,Low,Fair,2017-07-31,0.0587,40.6,89.3,43.7,6.143,0.121,0,13377.0,0,9.50136684567835,0,Unknow,0,0,0,0,0,0
SOAD09079,Flumevale,Yes,Water Supply,Earth,13.725,0.118,41000.0,1966,,0.12214,2.66329,,19/08/2022,1,0.0,High,Satisfactory,2017-09-01,0.0779,36.1,244.6,56.2,13.725,0.118,0,41000.0,0,10.6213517356329,0,Unknow,0,0,0,0,0,0
SOAD13284,Flumevale,Yes,Irrigation,Earth,4.458,1.088,51085.0,1910,2001H;2001S,0.14381,38.90259028342182,Uncontrolled,22/11/2022,1,0.0,High,Satisfactory,2022-11-22,0.0725,12.4,405.5,27.9,4.458,1.088,0,51085.0,0,10.8412657660517,2,2001,0,0,0,1,0,0
SOAD04022,Flumevale,Yes,Tailings,Earth,23.274,0.3,90005.0,1977,,0.0886499999999999,7.98987,,01/01/1999,6,23.86,Low,Not Rated,,0.0673,30.4,393.0,17.346317355681467,23.274,0.3,0,90005.0,0,11.4076316137569,0,Unknow,0,0,0,0,0,0
SOAD03311,Flumevale,Yes,Water Supply,Earth,9.268,0.067,9000.0,1967,,0.18124,13.31645,,21/06/2022,1,0.0,High,Satisfactory,2017-09-01,0.1123,19.8,913.3,56.2,9.268,0.067,0,9000.0,0,9.10509096125709,0,Unknow,0,0,0,0,0,0
SOAD06309,Flumevale,Yes,Fish and Wildlife Pond,Earth,3.886,0.039,450.0,1951,,0.19503,71.90883,,12/10/2010,6,15.64,Low,Not Rated,,0.0409,44.8,192.0,14.6154880500041,3.886,0.039,0,450.0,0,6.11146733950268,0,Unknow,0,0,0,0,0,0
SOAD06445,Flumevale,Yes,Irrigation,Earth,3.941,0.55,16024.0,1905,,0.1576,34.99709546033761,Uncontrolled,23/05/2022,6,5.0,Low,Unsatisfactory,2006-09-29,0.0922,15.2,746.8,33.9,3.941,0.55,0,16024.0,0,9.68190528178887,0,Unknow,0,0,0,1,0,0
SOAD07875,Flumevale,Yes,Irrigation,Earth,4.724,0.17,38941.0,1892,,0.03546,33.05913096497626,Uncontrolled,02/07/1999,6,7.95,Low,Satisfactory,2013-09-25,0.0496,22.2,244.8,40.5,4.724,0.17,0,38941.0,0,10.5698286386756,0,Unknow,0,0,0,1,0,0
SOAD11576,Flumevale,Yes,Flood Risk Reduction,Earth,10.301,0.21,27960.0,1963,,0.14578,13.31645,,03/04/2019,3,27.92,Low,Not Rated,,0.1103,32.8,232.8,19.17453603234611,10.301,0.21,0,27960.0,0,10.2385659610873,0,Unknow,0,0,0,0,0,0
SOAD18460,Flumevale,Yes,Water Supply,Earth,15.923,0.077,18500.0,1929,,0.27777,39.94935,,26/10/2021,0.5,47.79829609227909,Low,Satisfactory,2017-09-01,0.0781,125.7,20.4,55.5,15.923,0.077,0,18500.0,0,9.8255800636596,0,Unknow,0,0,0,0,0,1
SOAD20060,Flumevale,Yes,Flood Risk Reduction,Earth,11.968,0.144,23730.0,1960,,0.11426,29.29619,,10/04/2018,3,33.58,Low,Fair,2012-05-03,0.0706,42.6,104.1,22.175441266505718,11.968,0.144,0,23730.0,0,10.074537489292,0,Unknow,0,0,0,0,0,0
SOAD02928,Flumevale,Yes,Water Supply,Earth,6.508,1.05,60150.36702267112,1990,,0.0906199999999999,61.163586332965316,,30/11/2021,1,0.0,Significant,Satisfactory,2017-09-01,0.1159,30.1,449.4,5.5,6.508,1.05,0,,1,,0,Unknow,0,0,1,1,0,0
SOAD06222,Flumevale,Yes,Water Supply,Earth,8.335,0.05,11560.655183344617,1927,,0.07289,40.293691154068846,,22/06/2011,6,15.37,Low,Not Rated,,0.0448,9.0,129.9,37.5,8.335,0.05,0,,1,,0,Unknow,0,0,1,1,0,0
SOAD10513,Flumevale,Yes,Water Supply,Earth,4.24,0.158,2150.0,1919,,0.35657,13.31645,,07/06/2022,0.5,47.865127324257315,Low,Satisfactory,2017-09-01,0.0727,283.7,13.5,24.8,4.24,0.158,0,2150.0,0,7.67368812926773,0,Unknow,0,0,0,0,0,1
SOAD14546,Flumevale,Yes,Water Supply,Earth,15.75,0.215,88000.0,1955,,0.11229,2.66329,,13/10/2021,1,7.71,High,Satisfactory,2017-09-01,0.0936,15.9,360.5,36.8,15.75,0.215,0,88000.0,0,11.3851034570321,0,Unknow,0,0,0,0,0,0
SOAD14095,Flumevale,Yes,Irrigation,Earth,17.669,0.2,52742.0,1955,,0.0985,31.997805281899904,,30/08/2017,6,11.6,Low,Not Rated,,0.0734,14.4,327.0,36.1,17.669,0.2,0,52742.0,0,10.8731863411109,0,Unknow,0,0,0,1,0,0
SOAD06085,Flumevale,Yes,Water Supply,Earth,16.206,0.081,17650.0,1965,,0.12805,10.65316,,28/03/2022,0.5,51.08662152605442,Low,Satisfactory,2017-09-01,0.0594,43.6,5.0,6.9,16.206,0.081,0,17650.0,0,9.77854771798028,0,Unknow,0,0,0,0,0,1
SOAD06143,Flumevale,Yes,Flood Risk Reduction,Earth,9.075,0.792,35750.0,2019,,0.16942,7.98987,Uncontrolled,28/03/2022,3,1.64,High,Satisfactory,2022-03-28,0.1062,42.1,797.6,19.630411286118775,9.075,0.792,0,35750.0,0,10.4843335197589,0,Unknow,0,0,0,0,0,0
SOAD16073,Flumevale,Yes,"Fire Protection, Stock, Or Small Fish Pond",Earth,19.546,0.267,140500.0,1958,2003H;2003S,0.05713,28.24595818891074,Uncontrolled,21/12/2022,1,1.58,High,Not Rated,,0.1273,31.0,926.3,20.638342158468713,19.546,0.267,0,140500.0,0,11.8529698851683,2,2003,0,0,0,1,0,0
SOAD19791,Flumevale,Yes,Other,Earth,13.003,0.195,41700.0,1954,,0.14775,10.65316,,11/01/2022,1,9.4,High,Satisfactory,2017-09-01,0.0903,28.7,137.8,16.29497251423686,13.003,0.195,0,41700.0,0,10.6382803883147,0,Unknow,0,0,0,0,0,0
SOAD01884,Flumevale,No,"Fire Protection, Stock, Or Small Fish Pond",Earth,2.761,0.44,41086.08953209923,1974,,0.1315712218169729,55.92909,Uncontrolled,07/09/2010,10,92.91536150713327,Low,Not Rated,,0.0403,12.5,11.1,16.496819698402792,2.761,0.44,0,,1,,0,Unknow,0,0,1,0,1,1
SOAD05185,Flumevale,Yes,Other,Earth,31.131,0.123,155400.0,1933,,0.06501,2.66329,,14/09/2022,0.5,50.60034847092735,Low,Satisfactory,2017-09-01,0.0579,45.1,5.0,18.961171997127035,31.131,0.123,0,155400.0,0,11.9537641519014,0,Unknow,0,0,0,0,0,1
SOAD11759,Flumevale,Yes,Water Supply,Earth,12.947,0.175,13581.0,1931,,0.20685,103.86831,,27/01/2022,1,2.538013015279935,High,Satisfactory,2017-09-01,0.1022,40.9,481.9,51.3,12.947,0.175,0,13581.0,0,9.51650066567374,0,Unknow,0,0,0,0,0,1
SOAD16005,Flumevale,Yes,Irrigation,Earth,13.554,0.232,88361.0,1936,,0.10638,7.98987,,14/09/2018,6,13.37,Low,Fair,2018-10-26,0.0761,41.5,242.4,31.1,13.554,0.232,0,88361.0,0,11.3891972919542,0,Unknow,0,0,0,0,0,0
SOAD11740,Flumevale,Yes,Water Supply,Earth,10.166,0.178,28000.0,1962,,0.16351,2.66329,,31/08/2021,0.5,51.205473483278375,Low,Satisfactory,2017-09-01,0.0706,34.4,16.6,60.9,10.166,0.178,0,28000.0,0,10.2399955028053,0,Unknow,0,0,0,0,0,1
SOAD08450,Flumevale,Yes,Irrigation,Earth,9.862,0.277,51001.0,1963,,0.1379,32.804809950496434,,03/06/2021,6,16.62,Low,Satisfactory,2019-08-08,0.0556,39.5,274.5,42.6,9.862,0.277,0,51001.0,0,10.8396201266238,0,Unknow,0,0,0,1,0,0
SOAD14660,Flumevale,Yes,Recreation,Earth,19.219,0.267,94475.70811484224,1986,,0.12017,37.198920098285456,Uncontrolled,03/05/2021,2,25.13,Significant,Satisfactory,2021-05-03,0.1137,45.7,277.7,9.5,19.219,0.267,0,,1,,0,Unknow,0,0,1,1,0,0
SOAD00416,Flumevale,Yes,Irrigation,Earth,3.524,0.183,8166.0,1900,,0.07683,29.29619,,23/09/2013,6,7.82,Low,Not Rated,,0.0588,41.7,382.0,28.4,3.524,0.183,0,8166.0,0,9.00785692335828,0,Unknow,0,0,0,0,0,0
SOAD01311,Flumevale,Yes,Other,Earth,15.08,0.4,64040.93068134012,1979,1996,0.07486,18.64303,Uncontrolled,20/10/2011,6,8.38,Low,Not Available,,0.0467,10.0,132.9,19.587180834118154,15.08,0.4,0,,1,,1,1996,0,0,1,0,0,0
SOAD07234,Flumevale,Yes,Recreation,Earth,5.096,0.167,5927.0,1892,,0.02364,10.65316,Uncontrolled,19/05/2021,4,47.9,Low,Fair,2016-08-04,0.0618,16.1,134.3,6.4,5.096,0.167,0,5927.0,0,8.68744216697592,0,Unknow,0,0,0,0,0,0
SOAD11186,Flumevale,Yes,Irrigation,Earth,6.816,0.767,22955.0,1967,,0.19306,21.30632,Uncontrolled,10/09/2015,6,9.36,Low,Not Rated,,0.0881,17.1,434.8,46.1,6.816,0.767,0,22955.0,0,10.0413346192283,0,Unknow,0,0,0,0,0,0
SOAD12794,Flumevale,Yes,"Fire Protection, Stock, Or Small Fish Pond",Earth,11.335,0.173,10440.0,1952,,0.08274,38.367238195867344,,05/07/2022,6,17.63,Low,Fair,2015-10-19,0.042,38.3,332.0,19.01873651560931,11.335,0.173,0,10440.0,0,9.25349564229011,0,Unknow,0,0,0,1,0,0
SOAD00592,Flumevale,Yes,Irrigation,Earth,7.223,0.4,21000.0,1910,1971S;1973H,0.21473,58.44191060664056,Uncontrolled,30/03/2022,1,0.0,High,Satisfactory,2022-03-30,0.1017,35.5,289.8,3.0,7.223,0.4,0,21000.0,0,9.95232533461943,2,1973,0,0,0,1,0,0
SOAD07605,Flumevale,Yes,Irrigation,Earth,16.806,0.28,132319.68602673194,1930,,0.11623,5.32658,,24/09/2021,1,0.6583258254803835,High,Satisfactory,2017-09-01,0.0957,25.1,943.2,11.5,16.806,0.28,0,,1,,0,Unknow,0,0,1,0,0,1
SOAD07902,Flumevale,Yes,Fish and Wildlife Pond,Earth,4.378,0.053,2171.0,1967,,0.09713413108083895,35.003784571701495,Uncontrolled,27/06/2017,10,28.33,Low,Not Rated,,0.0556,19.2,470.3,23.044199288613616,4.378,0.053,0,2171.0,0,7.68340368105383,0,Unknow,0,0,0,1,1,0
SOAD09474,Flumevale,Yes,Recreation,Earth,12.091,0.3,51000.0,1911,1973S;1987S;2004S,0.10047,7.98987,Uncontrolled,26/05/2022,1,8.29,High,Unsatisfactory,2022-05-26,0.1575,42.2,356.3,6.4,12.091,0.3,0,51000.0,0,10.8396005193574,3,2004,0,0,0,0,0,0
SOAD09787,Flumevale,Yes,Water Supply,Earth,26.376,0.14,4400.0,1980,,0.04137,47.93922,,26/07/2022,2,3.28,Significant,Fair,2022-07-26,0.1442,39.0,485.4,13.2,26.376,0.14,0,4400.0,0,8.38958706681109,0,Unknow,0,0,0,0,0,0
SOAD19726,Flumevale,Yes,Water Supply,Earth,8.027,0.35,20000.0,1952,,0.197,2.66329,,31/01/2022,1,1.0543769148719995,High,Satisfactory,2017-09-01,0.0892,19.9,581.3,10.5,8.027,0.35,0,20000.0,0,9.90353755128617,0,Unknow,0,0,0,0,0,1
SOAD01327,Flumevale,Yes,Water Supply,Earth,4.107,0.267,28000.0,1923,,0.32505,162.46069,,07/04/2022,1,0.0,High,Satisfactory,2017-09-01,0.1025,290.6,940.1,47.9,4.107,0.267,0,28000.0,0,10.2399955028053,0,Unknow,0,0,0,0,0,0
SOAD03510,Flumevale,Yes,Water Supply,Earth,6.825,0.433,50000.0,1980,,0.09653,35.00943881756824,,09/09/2021,1,0.16,High,Satisfactory,2017-09-01,0.1022,46.4,767.1,25.7,6.825,0.433,0,50000.0,0,10.8197982842103,0,Unknow,0,0,0,1,0,0
SOAD15664,Flumevale,Yes,Other,Earth,7.332,0.37,31663.33718621503,Unknow,,0.2758,5.32658,,24/05/2022,0.5,85.00454898634835,Low,Satisfactory,2017-09-01,0.0621,68.9,14.9,19.20445859971245,7.332,0.37,0,,1,,0,Unknow,0,0,1,0,0,1
SOAD11908,Flumevale,Yes,"Fire Protection, Stock, Or Small Fish Pond",Earth,3.219,0.61,20324.0,1908,,0.41173,111.37690649988879,,07/10/1985,6,18.97,Low,Not Rated,,0.0865,705.9,325.1,20.33570598832313,3.219,0.61,0,20324.0,0,9.91960693441601,0,Unknow,0,0,0,1,0,0
SOAD06974,Flumevale,Yes,Hydroelectric,Earth,5.713,0.02,300.0,1855,,0.46215686864099986,491.42486493300936,,12/08/2019,3,49.43140412714374,Low,Satisfactory,2023-09-29,0.0669,43.0,17.1,66.36683690476194,5.713,0.02,0,300.0,0,5.70711026474888,0,Unknow,0,0,0,1,1,1
SOAD11682,Flumevale,Yes,Water Supply,Earth,9.674,0.147,8200.0,1876,,0.17927,2.66329,,29/06/2022,1,1.56,Significant,Satisfactory,2017-09-01,0.1154,41.6,765.9,23.2,9.674,0.147,0,8200.0,0,9.01201137703641,0,Unknow,0,0,0,0,0,0
SOAD17810,Flumevale,Yes,Flood Risk Reduction,Earth,14.105,0.266,42385.0,1964,,0.13987,15.97974,,04/04/2019,3,4.92,Low,Satisfactory,2014-10-28,0.0631,38.3,749.8,18.830735314174568,14.105,0.266,0,42385.0,0,10.6545733980165,0,Unknow,0,0,0,0,0,0
SOAD18895,Flumevale,Yes,Water Supply,Earth,14.151,0.267,2000.0,1959,,0.13987,35.14661178062131,,27/01/2022,0.5,50.358967726665895,Low,Satisfactory,2017-09-01,0.0685,20.0,5.6,53.6,14.151,0.267,0,2000.0,0,7.60140233458373,0,Unknow,0,0,0,1,0,1
SOAD01653,Flumevale,Yes,Flood Risk Reduction,Earth,13.249,0.124,23830.0,1964,,0.12805,13.31645,,03/04/2019,3,21.83,Low,Satisfactory,2019-10-03,0.0676,11.0,153.9,17.177488213818577,13.249,0.124,0,23830.0,0,10.0787425331234,0,Unknow,0,0,0,0,0,0
SOAD07614,Flumevale,Yes,Recreation,Earth,6.716,0.083,4331.0,1944,,0.09178376356451126,21.30632,Uncontrolled,02/08/2017,Unknow,40.16,Significant,Not Rated,,0.1196,18.1,186.7,8.9,6.716,0.083,0,4331.0,0,8.37378460812088,0,Unknow,0,0,0,0,1,0
SOAD01739,Flumevale,Yes,Water Supply,Earth,4.305,0.029,9838.431859115075,1961,2002H,0.15366,7.98987,Uncontrolled,13/08/2008,6,4.73,Low,Fair,2022-09-29,0.0628,32.8,757.3,25.8,4.305,0.029,0,,1,,1,2002,0,0,1,0,0,0
SOAD07092,Flumevale,Yes,Irrigation,Earth,14.342,0.182,41509.5746071482,1911,1956,0.11032,7.98987,,18/02/2014,6,16.86,Low,Unsatisfactory,2010-08-06,0.0831,37.9,123.2,37.7,14.342,0.182,0,,1,,1,1956,0,0,1,0,0,0
SOAD16852,Flumevale,Yes,Water Supply,Earth,4.831,0.553,14400.0,1955,,0.32505,7.98987,,27/04/2022,0.5,51.56290445653562,Low,Satisfactory,2017-09-01,0.0781,126.5,5.0,62.3,4.831,0.553,0,14400.0,0,9.57505292759738,0,Unknow,0,0,0,0,0,1
SOAD20662,Flumevale,Yes,Irrigation,Earth,14.038,0.247,78385.0,1925,,0.11426,7.98987,,29/09/2020,6,36.54,Low,Satisfactory,2018-10-01,0.0432,45.5,181.1,3.4,14.038,0.247,0,78385.0,0,11.2694006189642,0,Unknow,0,0,0,0,0,0
SOAD01071,Flumevale,Yes,Water Supply,Earth,15.034,0.285,30000.0,1878,,0.10047,32.486844439582974,,24/05/2023,1,0.31,High,Fair,2017-09-01,0.1194,20.9,838.9,49.3,15.034,0.285,0,30000.0,0,10.3089859934221,0,Unknow,0,0,0,1,0,0
SOAD03291,Flumevale,Yes,Debris Control,Earth,16.678,0.218,131000.0,1960,,0.0886499999999999,39.94935,,01/12/2021,1,0.0,High,Satisfactory,2017-09-01,0.1009,41.5,171.5,18.794281445040543,16.678,0.218,0,131000.0,0,11.7829602357419,0,Unknow,0,0,0,0,0,0
SOAD05411,Flumevale,Yes,Flood Risk Reduction,Earth,14.975,0.231,34650.0,1957,,0.08471,37.28606,Uncontrolled,17/04/2014,3,10.01,Low,Not Rated,,0.1027,9.8,385.3,20.61819440086898,14.975,0.231,0,34650.0,0,10.4530818642305,0,Unknow,0,0,0,0,0,0
SOAD11714,Flumevale,Yes,Recreation,Earth,7.84,0.467,28324.0,1977,2009,0.15366,46.489420986935244,Uncontrolled,23/06/2022,1,0.0,High,Fair,2022-06-23,0.1182,34.6,409.4,9.0,7.84,0.467,0,28324.0,0,10.2515000858962,1,2009,0,0,0,1,0,0
SOAD06814,Flumevale,Yes,Irrigation,Earth,16.008,0.073,17926.0,1949,,0.07486,32.20260537805298,Uncontrolled,11/06/2019,6,43.93,Low,Not Rated,,0.0638,25.2,120.7,32.7,16.008,0.073,0,17926.0,0,9.79406323525484,0,Unknow,0,0,0,1,0,0
SOAD11075,Flumevale,Yes,Irrigation,Earth,2.87,0.546,42106.37561056418,1920,,0.32505,81.45711545602953,,29/08/1990,0,63.88,Low,Not Rated,,0.0847,455.0,135.4,23.3,2.87,0.546,0,,1,,0,Unknow,0,0,1,1,0,0
SOAD12308,Flumevale,Yes,Recreation,Earth,12.997,0.127,24600.0,1960,,0.13987,34.62277,Uncontrolled,20/10/2022,1,9.17,High,Satisfactory,2022-10-20,0.0984,35.4,368.8,4.7,12.997,0.127,0,24600.0,0,10.1105423715008,0,Unknow,0,0,0,0,0,0
SOAD20506,Flumevale,Yes,Recreation,Earth,10.419,0.162,34458.0,1965,,0.14184,7.98987,Uncontrolled,24/09/2019,6,28.75,Low,Not Rated,,0.0356,5.0,174.7,7.2,10.419,0.162,0,34458.0,0,10.4475254905082,0,Unknow,0,0,0,0,0,0
SOAD05597,Flumevale,Yes,Flood Risk Reduction,Earth,10.814,0.214,27430.0,1960,,0.13199,13.31645,Uncontrolled,01/11/2011,3,8.03,Low,Not Rated,,0.1081,27.7,360.9,19.117921067783975,10.814,0.214,0,27430.0,0,10.2194290397017,0,Unknow,0,0,0,0,0,0
SOAD09367,Flumevale,Yes,Water Supply,Earth,7.118,0.23,63618.0,1888,,0.08274,32.174845171337054,Uncontrolled,21/04/2009,0,0.0,Low,Fair,2016-08-09,0.0861,21.9,257.5,21.3,7.118,0.23,0,63618.0,0,11.060667446852,0,Unknow,0,0,0,1,0,0
SOAD14184,Flumevale,Yes,Irrigation,Earth,7.031,0.28,37611.0,1980,,0.14972,15.97974,,10/09/2021,6,45.29,Low,Satisfactory,2019-07-15,0.0533,9.6,128.4,42.7,7.031,0.28,0,37611.0,0,10.535078427397,0,Unknow,0,0,0,0,0,0
SOAD15713,Flumevale,Yes,Water Supply,Earth,17.479,0.137,600000.0,1982,,0.08471,7.98987,,04/10/2021,0.5,56.699548292944904,Low,Satisfactory,2017-09-01,0.0747,29.0,6.6,20.4,17.479,0.137,0,600000.0,0,13.3046866008636,0,Unknow,0,0,0,0,0,1
SOAD05109,Flumevale,Yes,Flood Risk Reduction,Earth,17.926,0.253,55000.0,1954,,0.12017,15.97974,,09/03/2022,1,3.02,High,Satisfactory,2017-09-01,0.0972,5.7,186.1,15.831443074811578,17.926,0.253,0,55000.0,0,10.9151066458675,0,Unknow,0,0,0,0,0,0
SOAD05778,Flumevale,Yes,Irrigation,Earth,9.137,0.133,16410.0,1950,,0.11032,47.70753158374158,,17/08/2016,6,24.38,Low,Satisfactory,2014-08-06,0.0475,5.1,202.2,17.6,9.137,0.133,0,16410.0,0,9.70570712067963,0,Unknow,0,0,0,1,0,0
SOAD14506,Flumevale,Yes,Flood Risk Reduction,Earth,18.803,0.389,175000.0,1990,,0.11229,15.97974,,23/02/2022,1,0.16,High,Satisfactory,2017-09-01,0.1034,28.2,418.1,17.626012478391686,18.803,0.389,0,175000.0,0,12.072546967175,0,Unknow,0,0,0,0,0,0
SOAD01248,Flumevale,Yes,Flood Risk Reduction,Earth,12.464,0.35,51434.0,1974,,0.13593,13.31645,Uncontrolled,21/02/2017,3,64.1,Low,Not Rated,,0.1069,42.1,78.3,19.188435476586836,12.464,0.35,0,51434.0,0,10.8480741535651,0,Unknow,0,0,0,0,0,0
SOAD01728,Flumevale,Yes,Fish and Wildlife Pond,Earth,8.65,0.032,12025.498912050412,1956,,0.13002,40.05378564207297,,19/09/2019,6,68.96,Low,Satisfactory,2021-10-05,0.0433,29.6,200.3,20.106607326826314,8.65,0.032,0,,1,,0,Unknow,0,0,1,1,0,0
SOAD06352,Flumevale,Yes,Water Supply,Earth,7.673,0.023,10685.623842541523,1904,,0.22655,2.66329,,31/05/2022,0.5,75.01850673618065,Low,Satisfactory,2017-09-01,0.0685,47.4,22.2,46.5,7.673,0.023,0,,1,,0,Unknow,0,0,1,0,0,1
SOAD16008,Flumevale,Yes,Other,Earth,14.104,0.723,98000.0,1990,,0.14578,33.917353783763375,,01/09/2021,0.5,68.16347643670406,Low,Satisfactory,2017-09-01,0.0786,9.7,15.7,22.757577095066818,14.104,0.723,0,98000.0,0,11.4927329616823,0,Unknow,0,0,0,1,0,1
SOAD18228,Flumevale,Yes,Water Supply,Earth,40.694,0.217,262292.0,1869,,0.12608,18.64303,,16/08/2022,1,1.64,High,Satisfactory,2017-09-01,0.1053,7.0,243.0,34.1,40.694,0.217,0,262292.0,0,12.4772174784992,0,Unknow,0,0,0,0,0,0
SOAD20120,Flumevale,Yes,Recreation,Earth,8.437,0.187,12326.0,1967,1968H;2008H;2008M,0.12214,189.09359,Uncontrolled,08/12/2015,6,40.02,Low,Satisfactory,2019-09-06,0.0482,46.2,182.4,4.8,8.437,0.187,0,12326.0,0,9.41954725755152,3,2008,0,0,0,0,0,0
SOAD20179,Flumevale,Yes,"Fire Protection, Stock, Or Small Fish Pond",Earth,10.988,0.175,34570.94955238321,1932,,0.13002,32.71663342179519,,11/10/2011,6,15.35,Low,Not Rated,,0.0526,45.2,237.8,21.86310226472081,10.988,0.175,0,,1,,0,Unknow,0,0,1,1,0,0
SOAD06086,Flumevale,Yes,Irrigation,Earth,2.554,0.248,4851.0,1902,,0.61267,329.2301575710038,,12/06/1991,0,20.66,Low,Not Rated,,0.0481,478.1,155.8,33.3,2.554,0.248,0,4851.0,0,8.48714627006394,0,Unknow,0,0,0,1,0,0
SOAD05346,Flumevale,No,Flood Risk Reduction,Earth,5.987,0.03,4000.0,Unknow,,0.12805,2.66329,Uncontrolled,07/11/2020,1,1.7091026143818346,High,Not Rated,,0.1149,46.6,805.8,18.482212551068987,5.987,0.03,0,4000.0,0,8.29429960885724,0,Unknow,0,0,0,0,0,1
SOAD07848,Flumevale,Yes,Water Supply,Earth,24.383,0.108,65000.0,1999,,0.08471,5.32658,,27/10/2021,1,3.96,High,Satisfactory,2017-09-01,0.0905,37.3,305.9,49.2,24.383,0.108,0,65000.0,0,11.0821579333748,0,Unknow,0,0,0,0,0,0
SOAD18770,Flumevale,Yes,Irrigation,Earth,12.155,0.072,24510.884804796282,Unknow,1959,0.05713,21.30632,,30/07/2012,6,17.88,Low,Unsatisfactory,2019-08-08,0.0823,5.4,257.7,1.7,12.155,0.072,0,,1,,1,1959,0,0,1,0,0,0
SOAD19205,Flumevale,Yes,Water Supply,Earth,8.678,0.06,12069.005940577441,Unknow,,0.13593,5.32658,,13/04/2022,0.5,73.99208701395843,Low,Satisfactory,2017-09-01,0.076,39.5,8.4,42.1,8.678,0.06,0,,1,,0,Unknow,0,0,1,0,0,1
SOAD05385,Flumevale,Yes,Water Supply,Earth,7.495,0.156,10670.0,1978,,0.21079,54.89353372365387,,26/04/2022,0.5,52.2213167978721,Low,Satisfactory,2017-09-01,0.0683,8.3,9.1,8.2,7.495,0.156,0,10670.0,0,9.27528506061656,0,Unknow,0,0,0,1,0,1
SOAD16804,Flumevale,Yes,Irrigation,Earth,11.6,0.092,8761.0,1948,,0.0906199999999999,34.10760496692666,Uncontrolled,15/07/2021,2,16.77,Significant,Satisfactory,2021-07-15,0.1423,39.2,318.2,41.0,11.6,0.092,0,8761.0,0,9.07817946837384,0,Unknow,0,0,0,1,0,0
SOAD08583,Flumevale,Yes,Irrigation,Earth,6.435,0.19,17443.42359191401,1949,,0.17139,7.98987,Uncontrolled,24/08/1987,6,96.41,Low,Satisfactory,2018-06-28,0.0411,15.2,86.6,42.4,6.435,0.19,0,,1,,0,Unknow,0,0,1,0,0,0
SOAD05695,Flumevale,Yes,Recreation,Earth,3.986,0.11,10273.00552122706,1892,,0.17139,46.72266574934432,Uncontrolled,23/03/2022,2,0.0,Significant,Satisfactory,2022-03-23,0.1415,22.7,396.7,5.0,3.986,0.11,0,,1,,0,Unknow,0,0,1,1,0,0
SOAD19963,Flumevale,Yes,Water Supply,Earth,13.806,0.833,96451.293063167,1901,2001,0.0925899999999999,31.658790569912743,Uncontrolled,29/03/2022,1,3.07,High,Fair,2022-03-29,0.1287,44.0,892.0,21.7,13.806,0.833,0,,1,,1,2001,0,0,1,1,0,0
SOAD19007,Flumevale,Yes,Irrigation,Earth,3.064,0.15,5571.0,1923,,0.31914,13.31645,Uncontrolled,21/06/2018,6,3.22,Low,Not Rated,,0.0279,501.0,448.4,24.7,3.064,0.15,0,5571.0,0,8.6255093348997,0,Unknow,0,0,0,0,0,0
SOAD20544,Flumevale,Yes,Water Supply,Earth,12.974,0.053,5000.0,1877,,0.14381,5.32658,,21/07/2021,1,3.99,High,Satisfactory,2021-08-23,0.1013,40.2,491.3,24.1,12.974,0.053,0,5000.0,0,8.5173931714189,0,Unknow,0,0,0,0,0,0
SOAD09764,Flumevale,Yes,Irrigation,Earth,5.516,0.567,33608.0,1896,,0.20882,36.12865881377232,Uncontrolled,25/08/2020,6,7.66,Low,Satisfactory,2016-08-17,0.0602,40.5,349.0,18.5,5.516,0.567,0,33608.0,0,10.4225491672268,0,Unknow,0,0,0,1,0,0
SOAD01273,Flumevale,Yes,Flood Risk Reduction,Earth,13.178,0.333,300000.0,2007,,0.0788,2.66329,,04/05/2022,1,0.64,High,Satisfactory,2017-09-01,0.0832,13.2,841.7,16.322876978018723,13.178,0.333,0,300000.0,0,12.6115410869661,0,Unknow,0,0,0,0,0,0
SOAD01958,Flumevale,Yes,Irrigation,Earth,10.501,0.117,34742.0,1908,,0.32111,13.31645,,16/05/2019,6,3.09,Low,Satisfactory,2019-06-07,0.0439,402.9,683.0,31.2,10.501,0.117,0,34742.0,0,10.4557333918525,0,Unknow,0,0,0,0,0,0
SOAD04999,Flumevale,Yes,Water Supply,Earth,14.775,0.436,48100.0,1993,,0.14578,34.33976846502952,,24/09/2021,0.5,59.17458602109632,Low,Satisfactory,2017-09-01,0.0729,9.1,6.5,13.8,14.775,0.436,0,48100.0,0,10.7810582458985,0,Unknow,0,0,0,1,0,1
SOAD07213,Flumevale,Yes,Other,Earth,13.323,0.2,43000.0,1967,,0.12411,7.98987,,08/06/2022,0.5,53.109874992278606,Low,Satisfactory,2017-09-01,0.0756,8.8,7.7,18.579642579675518,13.323,0.2,0,43000.0,0,10.6689786502192,0,Unknow,0,0,0,0,0,1
SOAD07724,Flumevale,Yes,Fish and Wildlife Pond,Earth,5.457,0.067,2861.0,1990,,0.20488,13.31645,Uncontrolled,24/05/2021,2,8.43,Significant,Fair,2021-05-24,0.1328,18.5,469.1,18.276111550082007,5.457,0.067,0,2861.0,0,7.9592759601164,0,Unknow,0,0,0,0,0,0
SOAD05151,Flumevale,Yes,Other,Earth,10.759,0.267,39327.57294492648,1925,,0.13002,2.66329,,31/08/2022,1,0.32,High,Satisfactory,2017-09-01,0.0997,21.6,926.5,16.88619935549883,10.759,0.267,0,,1,,0,Unknow,0,0,1,0,0,0
SOAD06738,Flumevale,Yes,Debris Control,Earth,19.987,0.28,557000.0,1960,,0.08668,53.2658,,18/11/2021,1,0.0,High,Satisfactory,2017-09-01,0.1015,30.1,493.9,12.163381851213483,19.987,0.28,0,557000.0,0,13.2303223142399,0,Unknow,0,0,0,0,0,0
SOAD13988,Flumevale,Yes,Flood Risk Reduction,Earth,10.604,0.327,22236.0,1977,,0.17927,21.30632,Uncontrolled,21/02/2017,3,45.2,Low,Satisfactory,2013-06-25,0.0742,46.7,221.0,20.811728276281315,10.604,0.327,0,22236.0,0,10.0095128471794,0,Unknow,0,0,0,0,0,0
SOAD17663,Flumevale,Yes,Flood Risk Reduction,Earth,7.922,0.308,19200.0,1971,,0.17336,42.61264,Uncontrolled,01/02/2012,6,46.21,Low,Not Rated,,0.0768,32.9,229.3,19.823448505315582,7.922,0.308,0,19200.0,0,9.86271763999292,0,Unknow,0,0,0,0,0,0
SOAD04867,Flumevale,Yes,Other,Earth,13.337,0.134,29718.0,1896,,0.15366,5.32658,,20/12/2021,1,0.0,High,Satisfactory,2017-09-01,0.0858,42.1,351.6,16.72337991703275,13.337,0.134,0,29718.0,0,10.2995418508901,0,Unknow,0,0,0,0,0,0
SOAD05379,Flumevale,Yes,Flood Risk Reduction,Earth,21.869,0.123,188000.0,2015,,0.06107,34.96743066067455,,20/04/2022,1,0.0,High,Satisfactory,2017-09-01,0.0893,46.8,162.5,21.094361326069993,21.869,0.123,0,188000.0,0,12.1442025609469,0,Unknow,0,0,0,1,0,0
SOAD09693,Flumevale,Yes,Irrigation,Earth,4.165,0.165,45603.0,1909,,0.1182,32.99178801722835,Controlled,17/08/1988,6,0.0,Low,Fair,2016-05-13,0.0697,46.0,265.4,25.7,4.165,0.165,0,45603.0,0,10.7277507109536,0,Unknow,0,0,0,1,0,0
SOAD10965,Flumevale,Yes,Water Supply,Earth,10.931,0.19,20000.0,1958,,0.197,7.98987,,23/02/2022,1,1.9936757160761056,High,Satisfactory,2017-09-01,0.0712,23.6,798.1,63.7,10.931,0.19,0,20000.0,0,9.90353755128617,0,Unknow,0,0,0,0,0,1
SOAD00025,Flumevale,Yes,Flood Risk Reduction,Earth,6.74,1.533,17250.0,2001,,0.12608,80.70716746788482,,16/02/2022,1,0.16,Significant,Satisfactory,2017-09-01,0.1363,18.0,785.4,15.947852666605883,6.74,1.533,0,17250.0,0,9.75562539179374,0,Unknow,0,0,0,1,0,0
SOAD10383,Flumevale,Yes,Irrigation,Earth,7.686,0.14,9853.0,1890,1959,0.12017,33.86777703380036,Uncontrolled,05/10/2021,6,33.58,Low,Unsatisfactory,2021-06-09,0.0844,20.1,114.2,40.2,7.686,0.14,0,9853.0,0,9.19563274310391,1,1959,0,0,0,1,0,0
SOAD14704,Flumevale,Yes,Irrigation,Earth,8.416,0.265,54638.0,1889,,0.11229,37.103603243955085,,30/08/2021,6,10.86,Low,Satisfactory,2021-06-09,0.0461,36.0,351.2,34.4,8.416,0.265,0,54638.0,0,10.9085031924667,0,Unknow,0,0,0,1,0,0
SOAD07490,Flumevale,Yes,Irrigation,Earth,8.974,0.473,51502.48922801069,1944,,0.20094,45.27593,Uncontrolled,02/01/2014,6,95.7,Low,Fair,2017-07-21,0.0551,37.3,109.4,39.7,8.974,0.473,0,,1,,0,Unknow,0,0,1,0,0,0
SOAD08213,Flumevale,Yes,Irrigation,Earth,4.095,0.083,10010.690517769921,1904,,0.10441,38.90665744650355,,16/09/1985,6,21.67,Low,Fair,2020-10-06,0.0402,26.7,183.2,31.2,4.095,0.083,0,,1,,0,Unknow,0,0,1,1,0,0
SOAD10950,Flumevale,Yes,Water Supply,Earth,11.517,0.2,2000.0,1905,,0.20488,10.65316,,24/05/2022,1,0.16,High,Satisfactory,2017-09-01,0.1124,23.5,383.6,23.8,11.517,0.2,0,2000.0,0,7.60140233458373,0,Unknow,0,0,0,0,0,0
SOAD11214,Flumevale,Yes,Irrigation,Earth,23.522,0.261,197100.0,1961,2008,0.06304,41.129053458270214,Uncontrolled,01/10/2018,1,13.52,High,Not Available,,0.1312,10.1,455.4,25.0,23.522,0.261,0,197100.0,0,12.1914715666947,1,2008,0,0,0,1,0,0
SOAD11560,Flumevale,Yes,Water Supply,Earth,11.306,0.78,119000.0,1980,,0.197,2.66329,,08/03/2022,1,0.0,High,Satisfactory,2017-09-01,0.0955,45.7,899.0,26.8,11.306,0.78,0,119000.0,0,11.6868871754197,0,Unknow,0,0,0,0,0,0
SOAD19369,Flumevale,Yes,Recreation,Earth,14.86,0.127,30826.0,1974,,0.0886499999999999,7.98987,Uncontrolled,29/09/2022,6,35.82,Low,Not Rated,,0.0766,46.7,144.1,5.8,14.86,0.127,0,30826.0,0,10.3361462083284,0,Unknow,0,0,0,0,0,0
SOAD20145,Flumevale,Yes,Water Supply,Earth,6.356,0.242,18000.0,1954,,0.31126,5.32658,,23/03/2022,0.5,43.94649188920777,Low,Satisfactory,2017-09-01,0.0559,247.3,12.8,55.4,6.356,0.242,0,18000.0,0,9.7981825908907,0,Unknow,0,0,0,0,0,1
SOAD06145,Flumevale,Yes,Water Supply,Earth,7.91,0.115,4727.0,1910,,0.16154,10.65316,,16/06/2022,1,1.9172918760761293,High,Satisfactory,2017-09-01,0.0816,45.9,505.3,7.0,7.91,0.115,0,4727.0,0,8.46125755908593,0,Unknow,0,0,0,0,0,1
SOAD06651,Flumevale,Yes,Water Supply,Earth,11.257,0.233,30000.0,1952,,0.10441,2.66329,,10/05/2022,1,0.0,High,Satisfactory,2017-09-01,0.1032,22.1,930.1,7.6,11.257,0.233,0,30000.0,0,10.3089859934221,0,Unknow,0,0,0,0,0,0
SOAD11760,Flumevale,No,Debris Control,Earth,17.084,0.433,138748.81145130855,1954,,0.00788,237.03281,Uncontrolled,27/02/2024,5,1.59,High,Not Available,,0.0959,37.6,256.1,15.28198052097194,17.084,0.433,0,,1,,0,Unknow,0,0,1,0,0,0
SOAD17356,Flumevale,Yes,"Fire Protection, Stock, Or Small Fish Pond",Earth,8.565,0.367,36676.2598200296,1901,,0.09653,21.30632,,13/04/1992,0,28.0,Low,Not Rated,,0.1148,31.0,177.0,19.81241112407626,8.565,0.367,0,,1,,0,Unknow,0,0,1,0,0,0
SOAD18046,Flumevale,Yes,Fish and Wildlife Pond,Earth,7.837,0.042,10754.70652829721,1882,,0.07289,34.97537532666865,Uncontrolled,03/05/1994,6,3.09,Low,Fair,2022-06-10,0.0759,28.3,668.1,20.507755253223728,7.837,0.042,0,,1,,0,Unknow,0,0,1,1,0,0
SOAD19627,Flumevale,Yes,Irrigation,Earth,7.524,0.19,31377.0,1895,,0.17336,13.31645,Uncontrolled,28/05/2021,6,11.34,Low,Not Rated,,0.0438,15.3,344.2,6.7,7.524,0.19,0,31377.0,0,10.3538622893929,0,Unknow,0,0,0,0,0,0
SOAD05813,Flumevale,Yes,Irrigation,Earth,15.807,0.23,37407.0,1906,,0.09653,7.98987,Uncontrolled,18/10/2022,6,34.88,Low,Unsatisfactory,2022-05-10,0.071,8.1,144.8,12.0,15.807,0.23,0,37407.0,0,10.5296398642718,0,Unknow,0,0,0,0,0,0
SOAD02615,Flumevale,No,Other,Earth,5.265,0.033,9885.09319153168,1952,,0.09808381022121107,40.37718008557234,Uncontrolled,05/08/2020,10,61.59267177854357,Low,Not Rated,,0.0199,10.0,21.7,19.523058874099828,5.265,0.033,0,,1,,0,Unknow,0,0,1,1,1,1
SOAD04381,Flumevale,Yes,Water Supply,Earth,23.85,0.239,111022.3329476195,1990,,0.07486,31.909179719931466,Uncontrolled,19/05/2022,2,12.57,Significant,Satisfactory,2022-05-19,0.1274,16.5,167.3,28.1,23.85,0.239,0,,1,,0,Unknow,0,0,1,1,0,0
SOAD06296,Flumevale,Yes,Irrigation,Earth,6.243,0.203,31400.0,Unknow,2022,0.14972,7.98987,Uncontrolled,12/10/2022,6,24.65,Low,Not Rated,,0.0602,9.6,312.4,17.1,6.243,0.203,0,31400.0,0,10.354595018523,1,2022,0,0,0,0,0,0
SOAD10146,Flumevale,Yes,Water Supply,Earth,8.348,1.233,87487.49613903608,1910,,0.24034,63.13477724365633,,08/06/2023,1,0.0,High,Poor,2018-04-06,0.124,30.9,710.5,35.5,8.348,1.233,0,,1,,0,Unknow,0,0,1,1,0,0
SOAD19457,Flumevale,Yes,Recreation,Earth,8.145,0.264,29532.0,1955,,0.22852,2761.83173,Uncontrolled,17/05/2011,6,5.04,Low,Fair,2016-10-26,0.0456,32.6,326.3,7.2,8.145,0.264,0,29532.0,0,10.2932635611797,0,Unknow,0,0,0,0,0,0
SOAD02167,Flumevale,Yes,Irrigation,Earth,6.0,0.15,3958.0,1967,,0.25019,66.58225,Uncontrolled,07/07/2017,6,31.39,Low,Fair,2004-08-02,0.0436,113.3,204.7,3.7,6.0,0.15,0,3958.0,0,8.28374674710613,0,Unknow,0,0,0,0,0,0
SOAD11887,Flumevale,Yes,Irrigation,Earth,11.146,0.091,44040.0,1957,,0.2167,33.455400943281745,Uncontrolled,11/07/2018,6,16.04,Low,Not Rated,,0.0775,10.7,362.7,31.9,11.146,0.091,0,44040.0,0,10.6928762972092,0,Unknow,0,0,0,1,0,0
SOAD12955,Flumevale,Yes,Water Supply,Earth,10.83,0.207,41000.0,1971,,0.14972,38.76770417138409,,09/02/2022,1,0.9980735460192905,High,Satisfactory,2017-09-01,0.0851,33.7,817.4,38.7,10.83,0.207,0,41000.0,0,10.6213517356329,0,Unknow,0,0,0,1,0,1
SOAD14568,Flumevale,Yes,Irrigation,Earth,3.256,0.102,10045.718748776535,1940,,0.09653,7.98987,Uncontrolled,22/07/1986,6,24.84,Low,Not Rated,,0.0962,30.4,111.2,6.9,3.256,0.102,0,,1,,0,Unknow,0,0,1,0,0,0
SOAD17025,Flumevale,Yes,Water Supply,Earth,21.253,0.106,47688.0,1967,,0.08077,5.32658,,26/04/2022,0.5,52.391650382429546,Low,Satisfactory,2017-09-01,0.0615,8.1,22.6,27.5,21.253,0.106,0,47688.0,0,10.7724560423159,0,Unknow,0,0,0,0,0,1
SOAD09799,Flumevale,Yes,Water Supply,Earth,20.054,0.313,64000.0,1951,,0.10441,7.98987,,02/08/2022,1,24.51,High,Satisfactory,2017-09-01,0.0872,41.7,371.2,32.2,20.054,0.313,0,64000.0,0,11.0666539872197,0,Unknow,0,0,0,0,0,0
SOAD17714,Flumevale,Yes,Water Supply,Earth,14.56,0.383,32530.0,1910,,0.08471,2.66329,,27/04/2022,0.5,57.263208622060134,Low,Satisfactory,2017-09-01,0.0762,33.3,20.3,11.2,14.56,0.383,0,32530.0,0,10.3899487598495,0,Unknow,0,0,0,0,0,1
SOAD18949,Flumevale,Yes,Water Supply,Earth,44.825,0.3,267000.0,1968,,0.0591,271.05767309043006,,01/09/2022,1,0.32,High,Satisfactory,2017-09-01,0.1064,6.4,548.0,52.2,44.825,0.3,0,267000.0,0,12.4950076826937,0,Unknow,0,0,0,1,0,0
SOAD07772,Flumevale,Yes,Water Supply,Earth,3.567,0.267,20923.33393377439,1901,,0.18715,35.95437960280864,Uncontrolled,25/04/2022,6,1.59,Low,Not Rated,,0.0568,28.4,887.5,42.7,3.567,0.267,0,,1,,0,Unknow,0,0,1,1,0,0
SOAD11789,Flumevale,Yes,Water Supply,Earth,26.253,0.128,54260.0,1978,,0.05516,32.92953712153335,,27/01/2022,0.5,51.65332499568664,Low,Satisfactory,2017-09-01,0.0662,35.4,13.1,13.2,26.253,0.128,0,54260.0,0,10.9015610158256,0,Unknow,0,0,0,1,0,1
SOAD14931,Flumevale,Yes,Water Supply,Earth,37.089,0.218,298200.0,1941,,0.0591,84.66180250262086,,17/08/2022,1,0.79,High,Satisfactory,2017-09-01,0.1082,14.8,597.2,61.6,37.089,0.218,0,298200.0,0,12.6055230347612,0,Unknow,0,0,0,1,0,0
SOAD17216,Flumevale,Yes,Other,Earth,18.135,0.153,42000.0,1955,,0.0906199999999999,18.64303,,26/10/2021,1,0.6672621328554484,High,Satisfactory,2017-09-01,0.0921,18.1,610.8,17.36721385745771,18.135,0.153,0,42000.0,0,10.6454487065059,0,Unknow,0,0,0,0,0,1
SOAD17458,Flumevale,Yes,Irrigation,Earth,12.548,0.167,29133.0,1915,1977M;1977S;1987H;1987S;2011M;2011S,0.11032,7.98987,Uncontrolled,13/07/2021,2,11.49,Significant,Satisfactory,2021-07-13,0.1381,7.7,174.6,5.3,12.548,0.167,0,29133.0,0,10.2796611560089,6,2011,0,0,0,0,0,0
SOAD08733,Flumevale,Yes,Flood Risk Reduction,Earth,9.105,0.305,38960.0,1959,,0.14578,13.31645,Uncontrolled,29/04/2014,3,24.59,Low,Not Rated,,0.0922,25.9,444.9,19.17089673819767,9.105,0.305,0,38960.0,0,10.5703164247782,0,Unknow,0,0,0,0,0,0
SOAD09885,Flumevale,Yes,Irrigation,Earth,5.808,0.181,20219.0,1906,,0.15169,34.52977929194102,Uncontrolled,29/08/2018,6,27.63,Low,Fair,2018-08-07,0.0637,34.1,268.1,14.7,5.808,0.181,0,20219.0,0,9.91442749257446,0,Unknow,0,0,0,1,0,0
SOAD12878,Flumevale,Yes,Water Supply,Earth,10.581,0.14,135000.0,1999,,0.0788,32.27178204745488,,11/05/2022,1,8.91,High,Satisfactory,2017-09-01,0.0879,18.9,327.7,51.7,10.581,0.14,0,135000.0,0,11.8130374648005,0,Unknow,0,0,0,1,0,0
SOAD13536,Flumevale,Yes,Water Supply,Earth,8.53,0.747,63000.0,1995,,0.16942,2.66329,,23/09/2021,1,0.0,High,Satisfactory,2017-09-01,0.0725,13.2,318.0,59.7,8.53,0.747,0,63000.0,0,11.0509058782636,0,Unknow,0,0,0,0,0,0
SOAD15805,Flumevale,Yes,Fish and Wildlife Pond,Earth,5.112,0.545,26400.0,1908,2002H;2002S,0.20094,2.66329,,12/09/2018,5,53.54558408733809,Low,Satisfactory,2018-09-12,0.0482,8.3,16.9,21.136489793397697,5.112,0.545,0,26400.0,0,10.1811571672049,2,2002,0,0,0,0,0,1
SOAD00954,Flumevale,Yes,Irrigation,Earth,6.125,0.25,22917.0,1893,,0.13396,37.204731058298734,,24/08/2016,6,34.75,Low,Satisfactory,2021-09-09,0.0443,31.2,171.4,41.2,6.125,0.25,0,22917.0,0,10.0396779069864,0,Unknow,0,0,0,1,0,0
SOAD05215,Flumevale,Yes,Irrigation,Earth,6.756,0.96,54663.2617774287,1935,,0.1576,120.73931842233705,,10/05/2022,6,1.59,Low,Fair,2009-07-16,0.0589,25.1,876.9,42.6,6.756,0.96,0,,1,,0,Unknow,0,0,1,1,0,0
SOAD17095,Flumevale,Yes,Flood Risk Reduction,Earth,10.589,0.299,47950.0,1958,,0.14578,21.30632,Uncontrolled,21/08/2014,3,0.0,Low,Satisfactory,2016-09-22,0.0668,20.7,558.2,18.309849016529153,10.589,0.299,0,47950.0,0,10.7779349351515,0,Unknow,0,0,0,0,0,0
SOAD20374,Flumevale,Yes,Flood Risk Reduction,Earth,11.926,0.182,13400.0,1971,,0.14775,29.29619,Uncontrolled,18/07/1991,3,28.56,Low,Not Rated,,0.1168,31.0,258.5,22.67808469136025,11.926,0.182,0,13400.0,0,9.50308461002023,0,Unknow,0,0,0,0,0,0
SOAD01536,Flumevale,Yes,Irrigation,Earth,10.37,0.248,64372.0,1908,,0.24822,15.97974,Uncontrolled,12/10/2021,6,14.11,Low,Satisfactory,2012-06-14,0.0253,77.6,334.8,9.3,10.37,0.248,0,64372.0,0,11.0724495695223,0,Unknow,0,0,0,0,0,0
SOAD12789,Flumevale,Yes,Flood Risk Reduction,Earth,16.575,0.165,36933.0,1973,,0.14184,21.30632,Uncontrolled,28/05/2008,3,58.44,Low,Not Rated,,0.075,36.6,80.6,19.764492699753216,16.575,0.165,0,36933.0,0,10.5168878150058,0,Unknow,0,0,0,0,0,0
SOAD08382,Flumevale,Yes,Fish and Wildlife Pond,Earth,3.597,0.143,7600.0,1970,2004H;2004S,0.18124,42.61264,,12/09/2018,5,47.95714203583547,Low,Unsatisfactory,2018-09-12,0.0931,26.5,10.9,19.56036881568679,3.597,0.143,0,7600.0,0,8.93603509656604,2,2004,0,0,0,0,0,1
SOAD19241,Flumevale,Yes,Hydroelectric,Earth,7.034,0.15,10700.0,1909,,0.10835,55.0155095030623,Uncontrolled,13/04/2022,1,9.59,High,Satisfactory,2022-04-13,0.0852,19.8,416.0,81.1,7.034,0.15,0,10700.0,0,9.278092474027,0,Unknow,0,0,0,1,0,0
SOAD10999,Flumevale,Yes,Water Supply,Earth,9.724,0.137,15928.591638415555,1866,,0.17533,2.66329,,13/06/2022,1,6.29,Significant,Satisfactory,2017-09-01,0.1139,10.8,323.3,33.1,9.724,0.137,0,,1,,0,Unknow,0,0,1,0,0,0
SOAD15985,Flumevale,Yes,Recreation,Earth,14.429,0.383,45765.0,1900,1901S;1975S;1997H,0.12411,44.72757230465717,Uncontrolled,18/11/2022,1,0.0,High,Unsatisfactory,2022-11-18,0.1339,38.4,895.5,7.8,14.429,0.383,0,45765.0,0,10.7312967363395,3,1997,0,0,0,1,0,0
SOAD20026,Flumevale,Yes,Irrigation,Earth,5.032,0.083,6668.0,1899,,0.51811,4467.392442762627,,19/04/2016,6,51.04,Low,Fair,2018-09-14,0.0457,158.5,66.2,35.0,5.032,0.083,0,6668.0,0,8.80522520263231,0,Unknow,0,0,0,1,0,0
SOAD17222,Flumevale,Yes,Irrigation,Earth,9.021,0.217,47847.0,1940,,0.10441,135.82779,,17/06/2020,6,1.53,Low,Fair,2013-09-05,0.0613,27.8,471.5,25.9,9.021,0.217,0,47847.0,0,10.7757845987244,0,Unknow,0,0,0,0,0,0
SOAD05269,Flumevale,Yes,Flood Risk Reduction,Earth,12.251,0.732,102763.59948066475,1970,,0.12017,29.18443788756772,,21/06/2022,3,0.0,High,Fair,2022-06-21,0.1013,24.7,884.5,19.68479649205922,12.251,0.732,0,,1,,0,Unknow,0,0,1,1,0,0
SOAD08683,Flumevale,Yes,Water Supply,Earth,4.668,1.717,95000.0,2003,,0.1773,80.17156714276638,,18/04/2022,0.5,57.122637062385294,Low,Satisfactory,2017-09-01,0.0673,19.3,10.9,40.0,4.668,1.717,0,95000.0,0,11.4616426968431,0,Unknow,0,0,0,1,0,1
SOAD11963,Flumevale,Yes,Water Supply,Earth,13.775,0.1,32368.227330125974,1921,,0.12017,2.66329,,09/09/2022,1,1.64,High,Satisfactory,2017-09-01,0.0767,20.0,553.4,47.6,13.775,0.1,0,,1,,0,Unknow,0,0,1,0,0,0
SOAD18918,Flumevale,Yes,Water Supply,Earth,26.623,0.083,138136.19154742538,1889,,0.09653,7.98987,,25/04/2023,1,0.0,High,Fair,2021-06-02,0.1212,7.5,602.5,65.6,26.623,0.083,0,,1,,0,Unknow,0,0,1,0,0,0
SOAD03446,Flumevale,Yes,Recreation,Earth,5.84,0.125,10577.599256483041,1922,,0.16154,85.22528,,10/08/2010,6,54.32,Low,Satisfactory,2018-05-08,0.0374,27.8,191.2,7.1,5.84,0.125,0,,1,,0,Unknow,0,0,1,0,0,0
SOAD11949,Flumevale,Yes,Flood Risk Reduction,Earth,29.36,0.107,119700.0,1956,,0.0886499999999999,31.95948,,09/03/2022,1,1.61,High,Satisfactory,2017-09-01,0.1017,22.4,96.7,21.28461965919559,29.36,0.107,0,119700.0,0,11.69275224573,0,Unknow,0,0,0,0,0,0
SOAD18372,Flumevale,Yes,Fish and Wildlife Pond,Earth,4.998,1.616,28495.0,1906,,0.28959,165.20343264799232,Uncontrolled,10/06/2016,6,9.43,Low,Satisfactory,2021-11-18,0.0413,476.8,159.1,19.4061101080442,4.998,1.616,0,28495.0,0,10.2575190055294,0,Unknow,0,0,0,1,0,0
SOAD05579,Flumevale,Yes,Other,Earth,18.983,0.142,57000.0,1952,,0.11229,2.66329,,09/03/2022,1,0.0,Significant,Satisfactory,2017-09-01,0.1259,9.1,172.9,17.159762021546044,18.983,0.142,0,57000.0,0,10.9508240905224,0,Unknow,0,0,0,0,0,0
SOAD03264,Flumevale,Yes,Fish and Wildlife Pond,Earth,3.404,0.2,5530.0,1913,,0.16351,42.08521892451533,Uncontrolled,11/07/2013,6,65.66,Low,Not Rated,,0.0373,6.9,114.4,20.69909553813194,3.404,0.2,0,5530.0,0,8.61812390999468,0,Unknow,0,0,0,1,0,0
SOAD11274,Flumevale,Yes,Other,Earth,9.824,0.253,45000.0,1957,,0.18715,2.66329,,10/02/2022,1,1.56,Significant,Satisfactory,2017-09-01,0.095,15.6,242.8,17.748367396864474,9.824,0.253,0,45000.0,0,10.7144399907278,0,Unknow,0,0,0,0,0,0
SOAD14420,Flumevale,Yes,Irrigation,Earth,12.663,0.093,16502.0,1904,,0.13002,29.29619,Uncontrolled,18/10/2018,6,9.65,Low,Fair,2014-08-14,0.0626,25.5,366.5,37.2,12.663,0.093,0,16502.0,0,9.71129746154357,0,Unknow,0,0,0,0,0,0
SOAD00436,Flumevale,Yes,"Fire Protection, Stock, Or Small Fish Pond",Earth,4.046,0.127,10585.351092116109,Unknow,,0.12805,34.76977383259601,,17/07/1978,0,25.08,Low,Fair,2013-07-25,0.0777,44.0,145.6,21.495502260565527,4.046,0.127,0,,1,,0,Unknow,0,0,1,1,0,0
SOAD02598,Flumevale,Yes,Recreation,Earth,12.95,0.087,25967.08338549255,1952,,0.1576,46.14805387969799,Uncontrolled,28/10/2019,0,6.44,Low,Fair,2010-06-04,0.0786,10.0,317.5,5.3,12.95,0.087,0,,1,,0,Unknow,0,0,1,1,0,0
SOAD19124,Flumevale,Yes,Irrigation,Earth,7.303,0.077,10769.434347933544,2012,,0.19306,58.59238,Uncontrolled,,6,53.17607728864809,Low,Fair,2021-08-30,0.0707,30.8,11.4,32.1,7.303,0.077,0,,1,,0,Unknow,0,0,1,0,0,1
SOAD03980,Flumevale,Yes,Hydroelectric,Earth,19.371,0.389,80000.0,1913,,0.1576,243.92819094380263,,07/08/2023,1,3.3,Significant,Satisfactory,2023-09-29,0.1223,17.3,837.6,84.7,19.371,0.389,0,80000.0,0,11.2897944135779,0,Unknow,0,0,0,1,0,0
SOAD13580,Flumevale,Yes,Irrigation,Earth,3.697,0.68,50753.08642154006,2013,,0.13002,49.5128837650053,Uncontrolled,,6,0.0,Low,Not Rated,,0.0658,20.8,685.8,6.4,3.697,0.68,0,,1,,0,Unknow,0,0,1,1,0,0
SOAD05775,Flumevale,Yes,Water Supply,Earth,5.142,0.08,2500.0,1925,,0.16351,36.179861410101594,,30/06/2022,0.5,48.868819861115774,Low,Satisfactory,2017-09-01,0.0766,36.5,8.5,10.3,5.142,0.08,0,2500.0,0,7.82444593087762,0,Unknow,0,0,0,1,0,1
SOAD09617,Flumevale,Yes,Flood Risk Reduction,Earth,10.17,0.3,51100.0,1963,,0.28171,34.62277,,09/03/2022,1,0.0,High,Satisfactory,2017-09-01,0.0833,68.2,680.6,19.628357374427228,10.17,0.3,0,51100.0,0,10.8415593454719,0,Unknow,0,0,0,0,0,0
SOAD12557,Flumevale,Yes,Water Supply,Earth,8.784,1.0,57929.01853152635,1984,,0.08471,43.23963137088787,,05/03/2020,6,19.52,Low,Not Rated,,0.0622,39.3,428.0,51.9,8.784,1.0,0,,1,,0,Unknow,0,0,1,1,0,0
SOAD19950,Flumevale,Yes,Irrigation,Earth,3.088,0.567,42363.953261775256,1911,1949,0.29747,68.55934626228661,Uncontrolled,28/10/2014,6,56.4,Low,Not Rated,,0.0541,710.1,222.4,32.3,3.088,0.567,0,,1,,1,1949,0,0,1,1,0,0
SOAD11541,Flumevale,Yes,Water Supply,Earth,21.329,0.317,16420.0,1959,,0.12017,34.51642836867087,,04/08/2022,2,42.9,Significant,Unsatisfactory,2022-08-04,0.1539,32.9,237.3,66.5,21.329,0.317,0,16420.0,0,9.70631628249184,0,Unknow,0,0,0,1,0,0
SOAD04019,Flumevale,Yes,Irrigation,Earth,9.758,0.085,18700.0,1959,,0.11426,32.41023059710591,,07/09/2021,6,13.89,Low,Not Rated,,0.1004,33.3,98.6,14.0,9.758,0.085,0,18700.0,0,9.83633227734872,0,Unknow,0,0,0,1,0,0
SOAD13218,Flumevale,Yes,Irrigation,Earth,4.345,0.263,14963.0,1875,,0.23246,54.72958043881659,Uncontrolled,01/06/2016,6,1.64,Low,Satisfactory,2015-06-04,0.0497,11.5,535.7,22.9,4.345,0.263,0,14963.0,0,9.61340259546804,0,Unknow,0,0,0,1,0,0
SOAD17888,Flumevale,Yes,Irrigation,Earth,6.438,0.4,30908.895494261767,1910,,0.22852,423.75382818455296,Uncontrolled,08/04/2016,0,3.25,Low,Fair,2015-09-10,0.0914,24.9,163.1,40.8,6.438,0.4,0,,1,,0,Unknow,0,0,1,1,0,0
SOAD02092,Flumevale,Yes,Water Supply,Earth,56.785,0.147,199000.0,2004,,0.0591,231.24314261213047,,25/01/2022,1,10.784517583357456,Significant,Satisfactory,2017-09-01,0.145,5.5,474.1,11.2,56.785,0.147,0,199000.0,0,12.2010651288196,0,Unknow,0,0,0,1,0,1
SOAD17265,Flumevale,Yes,Irrigation,Earth,10.02,0.108,8610.0,1955,,0.10441,44.81914561776845,,30/06/2021,6,18.52,Low,Not Rated,,0.0847,35.7,396.8,6.2,10.02,0.108,0,8610.0,0,9.06079573469617,0,Unknow,0,0,0,1,0,0
SOAD00186,Flumevale,Yes,Irrigation,Earth,5.075,0.176,19558.0,1950,,0.20291,87.88857,,,6,22.22,Low,Fair,2021-06-15,0.0603,8.1,122.1,23.2,5.075,0.176,0,19558.0,0,9.88119081753752,0,Unknow,0,0,0,0,0,0
SOAD04039,Flumevale,Yes,Recreation,Earth,5.44,0.11,9045.0,1904,,0.19306,69.79142785261865,Uncontrolled,25/09/2013,6,41.93,Low,Not Rated,,0.06,38.2,212.0,7.5,5.44,0.11,0,9045.0,0,9.11007795003779,0,Unknow,0,0,0,1,0,0
SOAD19587,Flumevale,Yes,Flood Risk Reduction,Earth,13.906,0.231,45681.07196320813,2020,2019,0.0906199999999999,63.91896,Uncontrolled,07/04/2022,3,0.0,High,Satisfactory,2022-04-07,0.103,46.3,119.8,11.454408939264587,13.906,0.231,0,,1,,1,2019,0,0,1,0,0,0
SOAD19655,Flumevale,Yes,Debris Control,Earth,25.154,0.181,691000.0,1960,,0.06698,23.96961,,18/11/2021,1,0.0,High,Satisfactory,2017-09-01,0.1057,39.6,162.1,19.713299672236953,25.154,0.181,0,691000.0,0,13.4458965499268,0,Unknow,0,0,0,0,0,0
SOAD02882,Flumevale,Yes,Irrigation,Earth,3.02,0.117,2742.0,1969,,0.38809,99.2368529242107,,23/07/2019,6,42.56,Low,Not Rated,,0.0291,519.6,158.1,44.5,3.02,0.117,0,2742.0,0,7.9168074909376,0,Unknow,0,0,0,1,0,0
SOAD11544,Flumevale,Yes,Recreation,Earth,8.386,0.097,10001.0,1953,2009S,0.08485742802954661,21.30632,Uncontrolled,08/06/2017,1,0.5,High,Not Rated,,0.1442,6.1,715.1,4.1,8.386,0.097,0,10001.0,0,9.21054035197885,1,2009,0,0,0,0,1,0
SOAD16084,Flumevale,Yes,Water Supply,Earth,13.788,0.108,20000.0,1991,,0.25216,7.98987,,11/08/2022,0.5,45.82320050669093,Low,Satisfactory,2017-09-01,0.056,215.7,20.9,50.6,13.788,0.108,0,20000.0,0,9.90353755128617,0,Unknow,0,0,0,0,0,1
SOAD04519,Flumevale,Yes,Irrigation,Earth,8.402,0.233,41482.0,1956,,0.14381,50.60251,,25/08/2014,6,99.02,Low,Not Rated,,0.0797,24.1,119.6,45.7,8.402,0.233,0,41482.0,0,10.6330389837398,0,Unknow,0,0,0,0,0,0
SOAD14243,Flumevale,Yes,Flood Risk Reduction,Earth,21.187,0.297,101336.82321782372,1968,,0.0985,7.98987,,19/09/2016,3,70.39,Low,Not Rated,,0.0942,43.8,226.0,18.57933841836981,21.187,0.297,0,,1,,0,Unknow,0,0,1,0,0,0
SOAD14259,Flumevale,Yes,Water Supply,Earth,12.652,1.012,150000.0,1999,,0.10441,545.6561678497769,,18/08/2022,1,0.0,High,Satisfactory,2017-09-01,0.0993,32.6,850.3,68.2,12.652,1.012,0,150000.0,0,11.9183972397228,0,Unknow,0,0,0,1,0,0
SOAD19834,Flumevale,Yes,Irrigation,Earth,8.25,0.126,20751.0,1957,,0.12805,33.65262969322364,,14/07/2021,6,13.79,Low,Not Rated,,0.073,11.5,114.3,33.5,8.25,0.126,0,20751.0,0,9.94039790655622,0,Unknow,0,0,0,1,0,0
SOAD09978,Flumevale,Yes,Other,Earth,5.852,0.5,42606.0576362416,Unknow,,0.18321,125.17463,Uncontrolled,03/09/2019,6,16.83,Low,Fair,2021-07-08,0.0674,13.4,261.6,16.495600583779275,5.852,0.5,0,,1,,0,Unknow,0,0,1,0,0,0
SOAD14909,Flumevale,Yes,Water Supply,Earth,11.856,0.347,90000.0,1957,,0.16745,5.32658,,28/06/2022,0.5,49.29262069259521,Low,Satisfactory,2017-09-01,0.0852,44.0,22.6,53.6,11.856,0.347,0,90000.0,0,11.4075760603618,0,Unknow,0,0,0,0,0,1
SOAD19535,Flumevale,Yes,Irrigation,Earth,4.2,0.223,19514.192579400504,1911,,0.29353,51.39693056481964,Uncontrolled,28/10/2014,6,56.35,Low,Not Rated,,0.0404,68.2,140.0,46.0,4.2,0.223,0,,1,,0,Unknow,0,0,1,1,0,0
SOAD07315,Flumevale,Yes,Water Supply,Earth,10.236,0.083,14000.0,1968,,0.25216,18.64303,,16/06/2022,0.5,47.53101690524365,Low,Satisfactory,2017-09-01,0.0793,493.0,11.9,18.7,10.236,0.083,0,14000.0,0,9.54688403461792,0,Unknow,0,0,0,0,0,1
SOAD11421,Flumevale,Yes,Water Supply,Earth,12.485,0.25,6700.0,1973,,0.08077,34.428128770178205,,12/04/2019,6,9.54,Low,Not Rated,,0.0759,47.4,355.1,19.7,12.485,0.25,0,6700.0,0,8.81001204797317,0,Unknow,0,0,0,1,0,0
SOAD12120,Flumevale,Yes,Water Supply,Earth,17.292,0.2,23019.0,1949,2009,0.09653,33.41174364157036,Uncontrolled,04/08/2022,2,53.89,Significant,Fair,2022-08-04,0.1531,19.6,128.6,48.0,17.292,0.2,0,23019.0,0,10.0441186822759,1,2009,0,0,0,1,0,0
SOAD05028,Flumevale,Yes,Recreation,Earth,16.771,0.117,49804.3897208019,1906,,0.07289,41.43036729698835,Uncontrolled,06/04/2022,1,0.0,High,Unsatisfactory,2022-04-06,0.1493,27.9,814.9,8.3,16.771,0.117,0,,1,,0,Unknow,0,0,1,1,0,0
SOAD10781,Flumevale,Yes,Water Supply,Earth,9.092,0.553,52000.0,1962,,0.20882,34.92043623047148,,26/04/2022,1,7.71,Significant,Satisfactory,2017-09-01,0.1266,30.7,137.4,54.2,9.092,0.553,0,52000.0,0,10.8590182281479,0,Unknow,0,0,0,1,0,0
SOAD13197,Flumevale,Yes,Other,Earth,28.191,0.2,500000.0,1970,,0.10244,83.48145037283712,,31/08/2022,0.5,49.69959246601836,Low,Satisfactory,2017-09-01,0.0664,23.9,7.4,12.24256915002243,28.191,0.2,0,500000.0,0,13.1223653774023,0,Unknow,0,0,0,1,0,1
SOAD14323,Flumevale,Yes,Irrigation,Earth,16.745,0.086,23344.0,1950,1947H;1947M;1947S;1998H;1998S,0.05713,71.90883,Uncontrolled,08/07/1997,0,23.68,Low,Not Rated,,0.1243,19.6,189.2,20.4,16.745,0.086,0,23344.0,0,10.058138107405,5,1998,0,0,0,0,0,0
SOAD00122,Flumevale,Yes,Irrigation,Earth,7.248,0.17,10320.0,1911,1986H;1986M;1986S,0.15366,53.063441868172795,Uncontrolled,20/10/2021,1,14.58,High,Fair,2021-10-20,0.0993,7.0,251.8,3.0,7.248,0.17,0,10320.0,0,9.24193593356593,3,1986,0,0,0,1,0,0
SOAD03223,Flumevale,Yes,Water Supply,Earth,6.005,1.347256160240275,1485300.0,1984,,0.17533,1459.4857768315755,,30/08/2022,0.5,57.54899141274083,Low,Satisfactory,2017-09-01,0.069,19.2,16.0,30.1,6.005,3.461,0,1485300.0,0,14.2111280032821,0,Unknow,0,1,0,1,0,1
SOAD03812,Flumevale,Yes,"Fire Protection, Stock, Or Small Fish Pond",Earth,8.691,0.1,12483.503174125519,1908,,0.2955,21.30632,,20/02/1992,0,20.02,Low,Not Rated,,0.1048,551.8,469.8,18.69507125817501,8.691,0.1,0,,1,,0,Unknow,0,0,1,0,0,0
SOAD04949,Flumevale,Yes,Irrigation,Earth,7.793,0.867,31823.0,1903,,0.16351,97.9718110140252,,27/08/2015,6,36.56,Low,Fair,2015-08-06,0.0497,36.8,70.6,6.3,7.793,0.867,0,31823.0,0,10.3679760010938,0,Unknow,0,0,0,1,0,0
SOAD01443,Flumevale,Yes,Water Supply,Earth,6.72,0.833,7557.0,1888,1989S;2001H;2001S,0.14578,56.02362978898921,Uncontrolled,11/10/2022,2,1.56,Significant,Satisfactory,2022-10-11,0.1134,26.9,365.7,6.1,6.72,0.833,0,7557.0,0,8.93036188390943,3,2001,0,0,0,1,0,0
SOAD01750,Flumevale,Yes,Fish and Wildlife Pond,Earth,13.196,0.123,30700.880241557814,1971,2000,0.03349,7.98987,,30/10/2017,6,23.81,Low,Not Rated,,0.0696,35.8,221.1,17.968708497447714,13.196,0.123,0,,1,,1,2000,0,0,1,0,0,0
SOAD09506,Flumevale,Yes,Recreation,Earth,8.495,0.145,25835.0,1967,,0.16351,46.351448445516894,Uncontrolled,24/09/2013,6,0.0,Low,Fair,2019-05-07,0.0555,10.8,114.6,5.0,8.495,0.145,0,25835.0,0,10.1595241471524,0,Unknow,0,0,0,1,0,0
SOAD13584,Flumevale,Yes,Unknow,Earth,5.827,1.353,112334.13840015841,Unknow,,1.76906,159.64859101469753,Uncontrolled,04/09/2020,6,73.60139650691868,Low,Fair,2016-07-18,0.0512,149.0,17.0,19.719048696038787,5.827,1.353,0,,1,,0,Unknow,0,0,1,1,0,1
SOAD18727,Flumevale,Yes,Irrigation,Earth,9.37,0.455,72174.0,1958,,0.13199,34.06581873523181,,19/10/2017,6,13.9,Low,Not Rated,,0.0611,11.6,251.7,32.0,9.37,0.455,0,72174.0,0,11.1868490045311,0,Unknow,0,0,0,1,0,0
SOAD10797,Flumevale,Yes,Irrigation,Earth,22.493,0.133,61322.8573832557,1991,,0.07289,7.98987,Uncontrolled,14/08/2014,6,8.09,Low,Not Rated,,0.0575,35.3,327.9,35.9,22.493,0.133,0,,1,,0,Unknow,0,0,1,0,0,0
SOAD12106,Flumevale,Yes,Recreation,Earth,14.987,0.177,31199.0,1964,,0.15366,396.83021,,07/05/2021,2,11.12,Significant,Satisfactory,2021-05-07,0.1129,28.8,336.0,3.7,14.987,0.177,0,31199.0,0,10.3481733737976,0,Unknow,0,0,0,0,0,0
SOAD01151,Flumevale,Yes,Flood Risk Reduction,Earth,10.629,0.412,45492.765123724974,1983,,0.14775,7.98987,Uncontrolled,09/06/2021,3,4.94,Low,Fair,2017-05-24,0.0958,39.6,185.9,18.710271354536548,10.629,0.412,0,,1,,0,Unknow,0,0,1,0,0,0
SOAD09364,Flumevale,Yes,Water Supply,Earth,9.687,0.453,29000.0,1954,,0.27186,93.21515,,28/03/2022,0.5,45.806561669905506,Low,Satisfactory,2017-09-01,0.0697,143.3,10.9,18.8,9.687,0.453,0,29000.0,0,10.2750855911327,0,Unknow,0,0,0,0,0,1
SOAD18558,Flumevale,Yes,Other,Earth,11.825,0.057,12700.0,1964,,0.17533,18.64303,,25/05/2022,1,1.1687289068835658,High,Satisfactory,2017-09-01,0.0884,44.4,594.4,16.765897223207308,11.825,0.057,0,12700.0,0,9.44943600950432,0,Unknow,0,0,0,0,0,1
SOAD09028,Flumevale,Yes,Debris Control,Earth,14.794,0.16,176000.0,1998,,0.12805,15.97974,,23/02/2022,1,1.08,High,Satisfactory,2017-09-01,0.0999,12.8,510.0,17.271622057557774,14.794,0.16,0,176000.0,0,12.0782449558223,0,Unknow,0,0,0,0,0,0
SOAD17699,Flumevale,Yes,Other,Earth,40.272,0.165,322000.0,1953,,0.0591,50.96453600537164,,02/11/2021,1,0.16,High,Satisfactory,2017-09-01,0.0843,10.7,611.8,14.493443833585264,40.272,0.165,0,322000.0,0,12.6823099301118,0,Unknow,0,0,0,1,0,0
SOAD06517,Flumevale,Yes,Irrigation,Earth,12.961,0.313,36414.0,1918,1964,0.14184,32.68662070737127,Uncontrolled,19/10/2021,2,14.83,Significant,Satisfactory,2021-10-19,0.123,42.3,377.5,23.5,12.961,0.313,0,36414.0,0,10.502736056652,1,1964,0,0,0,1,0,0
SOAD09958,Flumevale,Yes,Other,Earth,6.49,0.342,8647.0,1916,,0.28368,47.424491624096284,,02/11/2021,1,31.44,High,Satisfactory,2017-09-01,0.0961,248.9,141.9,17.49023831448201,6.49,0.342,0,8647.0,0,9.06508335931904,0,Unknow,0,0,0,1,0,0
SOAD10768,Flumevale,Yes,Irrigation,Earth,7.33,0.167,10193.0,1902,1946H;1946M;1946S,0.20882,7.98987,Uncontrolled,22/10/2018,6,14.37,Low,Not Rated,,0.0763,31.4,288.9,20.7,7.33,0.167,0,10193.0,0,9.22955459089999,3,1946,0,0,0,0,0,0
SOAD17481,Flumevale,Yes,Water Supply,Earth,36.141,0.224,160000.0,1976,,0.10835,36.192339438013725,,24/05/2022,0.5,0.0,Low,Satisfactory,2017-09-01,0.0555,31.7,858.1,64.6,36.141,0.224,0,160000.0,0,11.9829353441964,0,Unknow,0,0,0,1,0,0
SOAD18364,Flumevale,Yes,Irrigation,Earth,4.089,0.274,18668.0,1903,2007,0.25807,62.37962600815026,Uncontrolled,06/06/2019,6,3.35,Low,Satisfactory,2014-04-17,0.0413,670.7,643.1,20.4,4.089,0.274,0,18668.0,0,9.83461967323733,1,2007,0,0,0,1,0,0
SOAD00440,Flumevale,Yes,Irrigation,Earth,15.728,0.167,53778.0,1973,2007,0.11032,31.98102291848855,Uncontrolled,23/09/2022,2,45.23,Significant,Fair,2022-09-23,0.1359,31.0,201.8,23.9,15.728,0.167,0,53778.0,0,10.892638335377,1,2007,0,0,0,1,0,0
SOAD01015,Flumevale,Yes,Irrigation,Earth,3.348,0.113,10314.112064378067,2020,2020,0.13396,7.98987,Controlled,,6,3.22,Low,Not Rated,,0.0387,20.9,855.3,8.6,3.348,0.113,0,,1,,1,2020,0,0,1,0,0,0
SOAD12712,Flumevale,Yes,Water Supply,Earth,9.221,0.175,28821.0,1948,,0.13593,7.98987,,06/10/2022,6,12.55,Low,Satisfactory,2017-06-29,0.0373,43.3,355.3,6.3,9.221,0.175,0,28821.0,0,10.2688942633983,0,Unknow,0,0,0,0,0,0
SOAD12902,Flumevale,Yes,Other,Earth,10.924,0.5,28600.0,1940,,0.14775,10.65316,,18/08/2022,1,2.45,High,Satisfactory,2017-09-01,0.0953,10.6,634.7,18.172160166243756,10.924,0.5,0,28600.0,0,10.2611969612316,0,Unknow,0,0,0,0,0,0
SOAD16955,Flumevale,Yes,Recreation,Earth,8.583,0.415,14358.0,1907,,0.17927,50.71374960294236,Uncontrolled,23/08/2022,1,0.0,High,Fair,2022-08-23,0.1031,6.3,576.6,6.4,8.583,0.415,0,14358.0,0,9.57213220229438,0,Unknow,0,0,0,1,0,0
SOAD19326,Flumevale,Yes,Irrigation,Earth,11.113,0.111,13587.0,1938,2000S,0.12017,45.27593,Uncontrolled,31/08/2022,2,4.79,Significant,Satisfactory,2022-08-31,0.1178,24.3,165.2,15.7,11.113,0.111,0,13587.0,0,9.51694232928048,1,2000,0,0,0,0,0,0
SOAD00057,Flumevale,Yes,Irrigation,Earth,2.842,0.17,14840.202109334476,1878,,0.3349,7.98987,Uncontrolled,03/05/2011,6,7.93,Low,Not Rated,,0.0276,272.3,292.2,29.1,2.842,0.17,0,,1,,0,Unknow,0,0,1,0,0,0
SOAD04354,Flumevale,Yes,"Fire Protection, Stock, Or Small Fish Pond",Earth,8.043,0.212,22694.898151517486,1907,,0.28171,90.55186,Uncontrolled,01/12/2022,6,92.2,Low,Not Rated,,0.0501,247.7,201.7,17.05502209575396,8.043,0.212,0,,1,,0,Unknow,0,0,1,0,0,0
SOAD09130,Flumevale,Yes,Flood Risk Reduction,Earth,22.464,0.19,66000.0,1994,,0.1182,10.65316,,23/02/2022,0.5,53.38263272834859,Low,Satisfactory,2017-09-01,0.0745,30.4,7.8,18.956720986629534,22.464,0.19,0,66000.0,0,11.0974251724089,0,Unknow,0,0,0,0,0,1
SOAD11367,Flumevale,Yes,Water Supply,Earth,13.63,0.223,58000.0,1952,,0.13987,2.66329,,22/02/2022,0.5,0.0,Low,Satisfactory,2017-09-01,0.0629,30.2,627.4,48.0,13.63,0.223,0,58000.0,0,10.9682155307592,0,Unknow,0,0,0,0,0,0
SOAD03016,Flumevale,Yes,Water Supply,Earth,15.159,0.1,33662.98447200366,Unknow,1993;2015;2018,0.07683,42.341534241395415,Uncontrolled,17/05/2022,1,4.68,High,Satisfactory,2022-05-17,0.097,28.4,552.8,7.1,15.159,0.1,0,,1,,3,2018,0,0,1,1,0,0
SOAD10433,Flumevale,Yes,Water Supply,Earth,5.484,0.367,29604.256877910477,Unknow,,0.4334,37.28606,,22/06/2022,1,77.70178778509121,Low,Satisfactory,2017-09-01,0.0672,100.4,12.2,11.1,5.484,0.367,0,,1,,0,Unknow,0,0,1,0,0,1
SOAD16831,Flumevale,Yes,Hydroelectric,Earth,14.279,0.283,40000.0,1913,,0.14775,414.3677923116983,Uncontrolled,07/08/2023,1,3.14,High,Satisfactory,2023-09-29,0.1012,20.8,132.5,92.2,14.279,0.283,0,40000.0,0,10.5966597327836,0,Unknow,0,0,0,1,0,0
SOAD20061,Flumevale,Yes,Recreation,Earth,3.917,0.08,9936.772020405804,1933,,0.2758,42.61264,,30/07/2015,6,67.22,Low,Not Rated,,0.0874,231.7,71.9,3.3,3.917,0.08,0,,1,,0,Unknow,0,0,1,0,0,0
SOAD03610,Flumevale,Yes,Irrigation,Earth,4.133,0.347,18490.0,1902,,0.42158,141.15437,,10/06/1992,6,37.04,Low,Satisfactory,2012-02-01,0.0463,211.1,112.6,5.7,4.133,0.347,0,18490.0,0,9.82503940620699,0,Unknow,0,0,0,0,0,0
SOAD11362,Flumevale,Yes,Water Supply,Earth,27.381,0.36,167400.0,1961,,0.07092,35.22828569080548,,16/03/2022,1,0.5550873378960313,High,Satisfactory,2017-09-01,0.0834,42.7,568.5,40.9,27.381,0.36,0,167400.0,0,12.0281474107353,0,Unknow,0,0,0,1,0,1
SOAD19428,Flumevale,Yes,Flood Risk Reduction,Earth,9.101,0.489,38000.0,1959,,0.27777,7.98987,Uncontrolled,15/10/2020,3,3.36,Low,Unsatisfactory,2022-05-26,0.1115,308.0,694.8,19.327189701946956,9.101,0.489,0,38000.0,0,10.5453677541517,0,Unknow,0,0,0,0,0,0
SOAD19904,Flumevale,Yes,Irrigation,Earth,3.93,0.512,33275.0,1888,,0.14381,34.39323828870338,,20/07/1987,6,8.19,Low,Not Rated,,0.0719,42.4,339.4,40.3,3.93,0.512,0,33275.0,0,10.4125916954038,0,Unknow,0,0,0,1,0,0
SOAD20589,Flumevale,Yes,Water Supply,Earth,12.317,0.213,31460.0,1878,,0.11229,31.836548553486605,,21/07/2021,1,0.0,Significant,Satisfactory,2017-09-01,0.1177,27.4,762.0,26.6,12.317,0.213,0,31460.0,0,10.3565039625025,0,Unknow,0,0,0,1,0,0
SOAD00774,Flumevale,Yes,Recreation,Earth,7.055,0.083,8100.0,1939,,0.04334,167.78727,Uncontrolled,12/07/2022,6,101.03,Low,Fair,2018-07-24,0.036,13.7,129.5,5.4,7.055,0.083,0,8100.0,0,8.99974278983049,0,Unknow,0,0,0,0,0,0
SOAD02237,Flumevale,Yes,Irrigation,Earth,4.815,0.353,34261.0,1908,,0.29944,71.20014895526529,Uncontrolled,10/09/2015,6,4.96,Low,Satisfactory,2020-08-26,0.0297,147.4,739.5,21.4,4.815,0.353,0,34261.0,0,10.4417921472904,0,Unknow,0,0,0,1,0,0
SOAD05046,Flumevale,Yes,Water Supply,Earth,12.524,0.217,85000.0,1970,,0.20882,87.88857,,01/09/2021,0.5,47.395773352599356,Low,Satisfactory,2017-09-01,0.0634,35.4,11.6,48.0,12.524,0.217,0,85000.0,0,11.3504183001091,0,Unknow,0,0,0,0,0,1
SOAD09458,Flumevale,Yes,Irrigation,Earth,20.804,0.26,59469.0,1973,,0.12411,32.83872592323748,,23/09/2022,2,41.61,Significant,Fair,2022-09-23,0.1366,8.0,172.5,45.6,20.804,0.26,0,59469.0,0,10.9932272627006,0,Unknow,0,0,0,1,0,0
SOAD12571,Flumevale,Yes,Irrigation,Earth,12.486,0.092,36512.0,1905,,0.11623,32.38940422016032,,24/05/2007,6,10.76,Low,Satisfactory,2009-08-13,0.06,8.4,319.3,31.5,12.486,0.092,0,36512.0,0,10.5054236405427,0,Unknow,0,0,0,1,0,0
SOAD02512,Flumevale,Yes,Irrigation,Earth,2.748,0.372,4741.0,1894,,0.23246,59.06751642715198,,22/04/2021,6,7.66,Low,Not Rated,,0.0984,27.0,135.7,43.2,2.748,0.372,0,4741.0,0,8.46421426662535,0,Unknow,0,0,0,1,0,0
SOAD19772,Flumevale,Yes,Irrigation,Earth,15.264,0.167,48958.0,1945,,0.09653,29.29619,Uncontrolled,24/07/2018,6,26.4,Low,Not Rated,,0.0316,42.9,294.0,36.7,15.264,0.167,0,48958.0,0,10.798738492141,0,Unknow,0,0,0,0,0,0
SOAD17285,Flumevale,Yes,Water Supply,Earth,10.491,0.23,35578.27612921915,1889,1906,0.14578,13.31645,Uncontrolled,18/08/2021,2,7.98,Significant,Not Rated,,0.1607,26.2,429.3,65.1,10.491,0.23,0,,1,,1,1906,0,0,1,0,0,0
SOAD02881,Flumevale,Yes,Irrigation,Earth,8.626,0.087,10653.0,1951,,0.14775,34.24207982301539,,26/09/2022,6,19.89,Low,Fair,2009-09-03,0.0605,42.2,320.1,24.1,8.626,0.087,0,10653.0,0,9.27369068747694,0,Unknow,0,0,0,1,0,0
SOAD04134,Flumevale,Yes,Irrigation,Earth,6.595,0.213,28656.0,1931,,0.12411,133.1645,Uncontrolled,21/05/2015,6,4.62,Low,Fair,2021-10-05,0.05,13.9,767.0,16.1,6.595,0.213,0,28656.0,0,10.2631530203974,0,Unknow,0,0,0,0,0,0
SOAD07333,Flumevale,Yes,Recreation,Earth,4.466,0.047,9838.431859115075,1911,,0.18518,45.81433715786167,Uncontrolled,30/07/2019,6,24.49,Low,Not Rated,,0.0256,20.2,155.6,9.5,4.466,0.047,0,,1,,0,Unknow,0,0,1,1,0,0
SOAD17790,Flumevale,Yes,Water Supply,Earth,22.061,0.383,170000.0,1937,,0.0886499999999999,35.18068549493928,,24/02/2022,1,0.0,High,Satisfactory,2017-09-01,0.0806,24.2,923.7,64.2,22.061,0.383,0,170000.0,0,12.043559598368,0,Unknow,0,0,0,1,0,0
SOAD01128,Flumevale,Yes,Flood Risk Reduction,Earth,3.25,0.383,13107.0,1902,,0.30535,74.68141019044383,Uncontrolled,24/06/2009,6,0.0,Low,Not Rated,,0.0869,589.2,95.4,17.855337296719892,3.25,0.383,0,13107.0,0,9.4809780098187,0,Unknow,0,0,0,1,0,0
SOAD01597,Flumevale,Yes,Water Supply,Earth,11.728,0.193,65936.0,1957,,0.13199,7.98987,,30/06/2020,6,28.21,Low,Satisfactory,2021-06-09,0.0457,27.7,219.6,49.1,11.728,0.193,0,65936.0,0,11.0964550196854,0,Unknow,0,0,0,0,0,0
SOAD07097,Flumevale,Yes,Irrigation,Earth,9.766,0.108,24700.0,1894,,0.14381,32.51552922125523,,15/10/2015,6,20.87,Low,Satisfactory,2012-06-20,0.0519,7.2,317.3,30.9,9.766,0.108,0,24700.0,0,10.1145990076265,0,Unknow,0,0,0,1,0,0
SOAD11228,Flumevale,Yes,Recreation,Earth,5.679,0.31,24678.435271150527,1982,,0.12805,69.38594965648558,Uncontrolled,17/03/1994,6,0.0,Low,Fair,2018-09-06,0.0337,33.7,392.5,4.1,5.679,0.31,0,,1,,0,Unknow,0,0,1,1,0,0
SOAD19073,Flumevale,Yes,Flood Risk Reduction,Earth,5.963,0.177,8000.0,1953,,0.15366,282.30874,Uncontrolled,23/04/2011,3,26.58,Low,Fair,2017-07-21,0.0938,18.1,134.5,15.6328263503567,5.963,0.177,0,8000.0,0,8.98732181285012,0,Unknow,0,0,0,0,0,0
SOAD01503,Flumevale,Yes,Irrigation,Earth,4.187,0.9,52827.4729527857,1890,2010,0.1576,99.7307731167348,Uncontrolled,25/09/2013,6,11.25,Low,Satisfactory,2017-02-21,0.0461,42.7,352.8,12.4,4.187,0.9,0,,1,,1,2010,0,0,1,1,0,0
SOAD02161,Flumevale,Yes,Flood Risk Reduction,Earth,14.268,0.252,35165.0,1955,,0.14578,21.30632,Uncontrolled,06/10/2020,3,19.97,Low,Fair,2022-07-07,0.0763,23.8,233.6,18.220655300074945,14.268,0.252,0,35165.0,0,10.4678349857045,0,Unknow,0,0,0,0,0,0
SOAD08250,Flumevale,Yes,Water Supply,Earth,25.335,0.207,54000.0,1958,,0.08668,2.66329,,14/09/2022,1,2.4,High,Satisfactory,2017-09-01,0.09,22.8,268.7,15.3,25.335,0.207,0,54000.0,0,10.8967578438935,0,Unknow,0,0,0,0,0,0
SOAD00400,Flumevale,Yes,Water Supply,Earth,6.327,0.167,20000.0,1918,,0.23837,5.32658,,27/01/2022,1,0.0,High,Satisfactory,2017-09-01,0.1002,4.9,458.4,27.6,6.327,0.167,0,20000.0,0,9.90353755128617,0,Unknow,0,0,0,0,0,0
SOAD14959,Flumevale,Yes,Water Supply,Earth,8.381,0.3,44000.0,1955,,0.27974,7.98987,,26/05/2022,1,1.7291939474086546,High,Satisfactory,2017-09-01,0.0755,529.1,678.8,34.4,8.381,0.3,0,44000.0,0,10.6919676399149,0,Unknow,0,0,0,0,0,1
SOAD05878,Flumevale,Yes,Flood Risk Reduction,Earth,12.225,0.357,57573.30716582799,1970,,0.14184,32.64843556287764,Uncontrolled,14/04/2022,3,0.0,High,Satisfactory,2022-04-14,0.0719,6.3,281.9,19.777715577253783,12.225,0.357,0,,1,,0,Unknow,0,0,1,1,0,0
SOAD06549,Flumevale,Yes,Recreation,Earth,20.805,0.324,96000.0,1984,,0.11229,7.98987,,11/12/2018,0,4.71,Low,Not Rated,,0.097,12.0,324.3,7.7,20.805,0.324,0,96000.0,0,11.4721138870624,0,Unknow,0,0,0,0,0,0
SOAD06625,Flumevale,Yes,Irrigation,Earth,13.95,0.1,20414.0,1958,1970H;1970M;1970S,0.10835,31.899273852307427,Uncontrolled,11/10/2021,2,23.51,Significant,Satisfactory,2021-10-11,0.1023,36.0,160.5,39.0,13.95,0.1,0,20414.0,0,9.92402520375368,3,1970,0,0,0,1,0,0
SOAD00357,Flumevale,Yes,Water Supply,Earth,14.569,0.188,43635.19860348531,1897,,0.16548,37.28606,Uncontrolled,13/09/2022,2,64.6,Significant,Unsatisfactory,2022-09-13,0.1563,45.1,75.2,61.7,14.569,0.188,0,,1,,0,Unknow,0,0,1,0,0,0
SOAD05948,Flumevale,Yes,Irrigation,Earth,5.758,0.06,9885.09319153168,1895,,0.24231,59.10187753108132,Uncontrolled,26/07/2018,6,14.08,Low,Fair,2021-06-09,0.0461,5.2,233.3,35.3,5.758,0.06,0,,1,,0,Unknow,0,0,1,1,0,0
SOAD11928,Flumevale,Yes,Other,Earth,17.883,0.128,63000.0,1970,,0.15563,37.28606,,13/04/2022,1,0.8568248233278744,High,Satisfactory,2017-09-01,0.0986,46.9,827.8,18.864746425559204,17.883,0.128,0,63000.0,0,11.0509058782636,0,Unknow,0,0,0,0,0,1
SOAD11069,Flumevale,Yes,Water Supply,Earth,11.802,0.433,136500.0,1960,,0.2167,87.88857,,22/03/2022,1,0.16,High,Satisfactory,2017-09-01,0.0908,46.7,807.0,68.9,11.802,0.433,0,136500.0,0,11.8240872195876,0,Unknow,0,0,0,0,0,0
SOAD02470,Flumevale,Yes,Recreation,Earth,5.078,0.667,51440.42497856438,Unknow,2007,0.20094,37.28606,Uncontrolled,08/06/2016,6,0.0,Low,Fair,2020-07-27,0.0453,33.8,400.4,5.1,5.078,0.667,0,,1,,1,2007,0,0,1,0,0,0
SOAD06207,Flumevale,Yes,Irrigation,Earth,6.233,0.52,43746.286652631155,1901,,0.394,13.31645,Uncontrolled,11/12/2012,6,97.44,Low,Fair,2020-08-11,0.075,26.3,171.2,40.7,6.233,0.52,0,,1,,0,Unknow,0,0,1,0,0,0
SOAD08567,Flumevale,Yes,Irrigation,Earth,7.201,0.045,2400.0,1895,1966H;1966M;1966S,0.11426,35.38940859689304,Uncontrolled,29/07/2020,2,14.09,Significant,Fair,2020-07-29,0.1424,13.4,352.4,25.2,7.201,0.045,0,2400.0,0,7.78364059622125,3,1966,0,0,0,1,0,0
SOAD03441,Flumevale,Yes,Water Supply,Earth,16.953,0.203,160896.0,2003,,0.14775,23.96961,,26/10/2021,1,0.16,High,Satisfactory,2017-09-01,0.0856,23.8,525.3,15.9,16.953,0.203,0,160896.0,0,11.9885196876855,0,Unknow,0,0,0,0,0,0
SOAD08751,Flumevale,Yes,Water Supply,Earth,8.882,1.4,40000.0,1966,,0.29353,2.66329,,25/05/2022,0.5,50.359980456193895,Low,Satisfactory,2017-09-01,0.0735,319.7,5.4,45.7,8.882,1.4,0,40000.0,0,10.5966597327836,0,Unknow,0,0,0,0,0,1
SOAD06268,Flumevale,Yes,Irrigation,Earth,10.025,0.075,15706.614896127514,1965,,0.16745,37.49396080976765,Uncontrolled,20/10/2010,6,12.37,Low,Fair,2020-06-05,0.0444,28.8,365.8,20.4,10.025,0.075,0,,1,,0,Unknow,0,0,1,1,0,0
SOAD10985,Flumevale,Yes,Flood Risk Reduction,Earth,8.024,0.278,34212.0,1972,,0.22655,21.30632,Uncontrolled,21/02/2017,3,47.43,Low,Satisfactory,2021-05-20,0.0549,27.0,74.1,21.024050002584524,8.024,0.278,0,34212.0,0,10.4403609677836,0,Unknow,0,0,0,0,0,0
SOAD00929,Flumevale,Yes,Water Supply,Earth,16.3,0.32,58631.0,1951,,0.11032,46.44342536466971,Uncontrolled,21/07/2017,6,17.59,Low,Not Rated,,0.0859,33.7,214.6,9.0,16.3,0.32,0,58631.0,0,10.9790359016057,0,Unknow,0,0,0,1,0,0
SOAD09824,Flumevale,Yes,Irrigation,Earth,5.2,0.233,25000.0,Unknow,1986;2015,0.12805,33.22679388845512,Uncontrolled,02/11/2021,6,7.87,Low,Fair,2015-07-31,0.0586,41.8,104.2,30.6,5.2,0.233,0,25000.0,0,10.1266711030504,2,2015,0,0,0,1,0,0
SOAD11737,Flumevale,Yes,Water Supply,Earth,11.082,0.283,41431.0,1979,,0.21473,55.92909,Uncontrolled,29/09/2022,6,10.75,Low,Not Rated,,0.0723,12.5,397.5,46.9,11.082,0.283,0,41431.0,0,10.6318088081037,0,Unknow,0,0,0,0,0,0
SOAD06804,Flumevale,Yes,Hydroelectric,Earth,10.639,0.132,27337.21806039783,1922,,0.197,47.270234886427716,Uncontrolled,20/07/2017,6,29.22,Low,Not Rated,,0.0459,14.5,321.9,73.9,10.639,0.132,0,,1,,0,Unknow,0,0,1,1,0,0
SOAD09769,Flumevale,Yes,Irrigation,Earth,5.437,0.502,47202.0,1930,2018,0.22261,79.44445647063523,Uncontrolled,09/08/2018,6,10.09,Low,Satisfactory,2016-08-24,0.0314,46.4,175.7,11.1,5.437,0.502,0,47202.0,0,10.7622127288759,1,2018,0,0,0,1,0,0
SOAD15824,Flumevale,Yes,Water Supply,Earth,17.319,0.061,37065.47558671632,1971,,0.14972,7.98987,Uncontrolled,02/06/2021,2,44.79,Significant,Fair,2021-06-02,0.1455,24.6,174.9,4.8,17.319,0.061,0,,1,,0,Unknow,0,0,1,0,0,0
SOAD16020,Flumevale,Yes,Irrigation,Earth,12.094,0.146,51117.0,1972,,0.14381,58.59238,Uncontrolled,23/10/2018,6,10.02,Low,Satisfactory,2022-06-08,0.0415,13.6,209.7,3.7,12.094,0.146,0,51117.0,0,10.8418919646554,0,Unknow,0,0,0,0,0,0
SOAD18762,Flumevale,Yes,Recreation,Earth,3.556,0.66,46842.77978903145,1940,,0.2561,67.61731616844548,,15/09/1992,0,50.94,Low,Not Rated,,0.1064,516.7,60.5,4.2,3.556,0.66,0,,1,,0,Unknow,0,0,1,1,0,0
SOAD19259,Flumevale,Yes,Water Supply,Earth,6.209,0.054,6500.0,1965,,0.32505,13.31645,,01/11/2021,0.5,50.97147483678868,Low,Satisfactory,2017-09-01,0.0711,463.0,5.6,8.1,6.209,0.054,0,6500.0,0,8.77971129020447,0,Unknow,0,0,0,0,0,1
SOAD02988,Flumevale,Yes,Water Supply,Earth,12.344,0.327,5425.0,1960,,0.0985,102.62310454422513,,25/02/2022,1,0.0,High,Satisfactory,2017-09-01,0.0728,43.8,906.6,44.8,12.344,0.327,0,5425.0,0,8.59895749321888,0,Unknow,0,0,0,1,0,0
SOAD11464,Flumevale,Yes,Water Supply,Earth,26.428,0.767,320000.0,1938,,0.10047,43.576040182741615,,25/02/2022,1,0.0,High,Satisfactory,2017-09-01,0.0847,19.0,410.6,24.1,26.428,0.767,0,320000.0,0,12.676079399771,0,Unknow,0,0,0,1,0,0
SOAD12740,Flumevale,Yes,Irrigation,Earth,2.407,0.05,9838.431859115075,1905,,0.0591,21.30632,,15/10/1987,6,8.29,Low,Not Rated,,0.0371,13.6,156.6,39.0,2.407,0.05,0,,1,,0,Unknow,0,0,1,0,0,0
SOAD07101,Flumevale,Yes,Flood Risk Reduction,Earth,13.791,0.279,49700.0,1962,,0.18321,29.29619,,10/04/2018,3,14.22,Low,Satisfactory,2022-12-01,0.0652,31.1,375.4,22.73982161747761,13.791,0.279,0,49700.0,0,10.8137803326066,0,Unknow,0,0,0,0,0,0
SOAD12124,Flumevale,Yes,Water Supply,Earth,5.345,0.833,14000.0,1900,,0.29944,5.32658,,02/11/2021,1,2.0,High,Satisfactory,2017-09-01,0.0842,308.8,920.7,26.0,5.345,0.833,0,14000.0,0,9.54688403461792,0,Unknow,0,0,0,0,0,0
SOAD19628,Flumevale,Yes,Other,Earth,30.507,0.18,215000.0,1991,,0.08668,2.66329,,15/12/2021,1,0.0,High,Satisfactory,2017-09-01,0.1051,47.5,549.0,17.617269437552647,30.507,0.18,0,215000.0,0,12.2783979582618,0,Unknow,0,0,0,0,0,0
SOAD06552,Flumevale,Yes,Water Supply,Earth,13.475,0.16,88580.0,1956,,0.13987,33.30607624353262,Uncontrolled,01/07/2015,6,50.83,Low,Not Rated,,0.0673,45.7,104.5,68.4,13.475,0.16,0,88580.0,0,11.3916726666435,0,Unknow,0,0,0,1,0,0
SOAD07492,Flumevale,Yes,Other,Earth,30.632,0.118,114252.0,1938,,0.08668,10.65316,,18/08/2021,1,9.72,High,Satisfactory,2017-09-01,0.0907,16.9,242.9,17.902225679518704,30.632,0.118,0,114252.0,0,11.6461705666174,0,Unknow,0,0,0,0,0,0
SOAD11736,Flumevale,Yes,Irrigation,Earth,7.405,0.78,49550.79071580176,1904,,0.15563,42.70613254260714,,19/12/2000,0,59.68,Low,Fair,2018-07-24,0.0751,9.6,222.7,8.8,7.405,0.78,0,,1,,0,Unknow,0,0,1,1,0,0
SOAD20427,Flumevale,Yes,Flood Risk Reduction,Earth,23.586,0.115,55650.0,2004,,0.10441,32.208083369261,,10/08/2022,1,0.16,High,Satisfactory,2017-09-01,0.0949,45.3,829.3,20.640600435847105,23.586,0.115,0,55650.0,0,10.9268553259942,0,Unknow,0,0,0,1,0,0
SOAD20033,Flumevale,Yes,Water Supply,Earth,17.017,0.117,20000.0,1928,,0.2561,223.71636,,26/05/2022,0.5,47.72035617625614,Low,Satisfactory,2017-09-01,0.0709,110.0,18.4,41.4,17.017,0.117,0,20000.0,0,9.90353755128617,0,Unknow,0,0,0,0,0,1
SOAD10004,Flumevale,Yes,Water Supply,Earth,11.668,0.173,52275.0,1955,,0.12805,46.415011699579146,,10/06/2020,6,24.99,Low,Not Rated,,0.0459,9.0,372.7,59.3,11.668,0.173,0,52275.0,0,10.8642926537169,0,Unknow,0,0,0,1,0,0
SOAD12499,Flumevale,Yes,Recreation,Earth,16.307,0.111,35851.0,1965,,0.22655,85.22528,Uncontrolled,21/09/2021,2,28.85,Significant,Fair,2021-09-21,0.123,7.0,164.9,4.3,16.307,0.111,0,35851.0,0,10.4871546324773,0,Unknow,0,0,0,0,0,0
SOAD01779,Flumevale,Yes,Water Supply,Earth,14.531,0.216,86519.0,1949,,0.14381,32.67704436804619,,14/09/2021,1,0.79,High,Satisfactory,2017-09-01,0.1107,23.4,225.2,13.9,14.531,0.216,0,86519.0,0,11.368130880067,0,Unknow,0,0,0,1,0,0
SOAD15503,Flumevale,Yes,Irrigation,Earth,10.179,0.21,11555.0,1965,,0.04334,439.44285,Uncontrolled,07/05/2009,6,12.32,Low,Satisfactory,2021-08-18,0.0323,26.6,365.9,40.4,10.179,0.21,0,11555.0,0,9.35496006158613,0,Unknow,0,0,0,0,0,0
SOAD11495,Flumevale,Yes,Water Supply,Earth,9.519,0.58,34500.0,1957,,0.28368,10.65316,,27/04/2022,0.5,46.25685623356144,Low,Satisfactory,2017-09-01,0.0638,605.0,19.3,5.6,9.519,0.58,0,34500.0,0,10.4487435881066,0,Unknow,0,0,0,0,0,1
SOAD06213,Flumevale,Yes,Irrigation,Earth,7.953,0.37,57832.0,1979,2005,0.0788,15.97974,Uncontrolled,24/09/2021,2,0.0,Significant,Satisfactory,2021-09-24,0.135,18.2,588.7,29.0,7.953,0.37,0,57832.0,0,10.9653148259956,1,2005,0,0,0,0,0,0
SOAD13263,Flumevale,Yes,Irrigation,Earth,4.557,0.128,10585.351092116109,1934,,0.20882,37.19037780783636,Uncontrolled,17/08/2019,6,73.34,Low,Fair,2019-04-03,0.0678,23.1,144.3,17.7,4.557,0.128,0,,1,,0,Unknow,0,0,1,1,0,0
SOAD15102,Flumevale,Yes,Recreation,Earth,10.207,0.21,34628.02761928493,1948,,0.12214,48.23994210025279,Uncontrolled,20/07/2021,6,10.97,Low,Fair,2022-10-18,0.057,46.9,423.9,3.8,10.207,0.21,0,,1,,0,Unknow,0,0,1,1,0,0
SOAD15753,Flumevale,Yes,Other,Earth,16.685,0.262,42850.0,1963,,0.16351,39.90242367350483,,18/08/2022,1,0.0,High,Satisfactory,2017-09-01,0.0978,38.4,819.6,19.5412393347117,16.685,0.262,0,42850.0,0,10.6654842609765,0,Unknow,0,0,0,1,0,0
SOAD04515,Flumevale,Yes,Other,Earth,21.443,0.082,35820.0,1952,,0.10638,2.66329,,22/06/2022,1,1.2415191500254676,High,Satisfactory,2017-09-01,0.0847,34.5,612.0,16.491404952117872,21.443,0.082,0,35820.0,0,10.4862895925896,0,Unknow,0,0,0,0,0,1
SOAD20306,Flumevale,Yes,Irrigation,Earth,5.005,0.2,14667.0,1904,,0.19503,29.29619,,20/08/2019,6,38.34,Low,Fair,2021-06-03,0.0487,33.7,182.0,42.4,5.005,0.2,0,14667.0,0,9.59342352919122,0,Unknow,0,0,0,0,0,0
SOAD06134,Flumevale,No,Other,Earth,10.275,0.317,135326.44244120963,Unknow,,2.3708890615004616,2125.805597402323,,,Unknow,3.17,Significant,Not Available,,0.1828,354.1,880.2,18.799951342192557,10.275,0.317,0,,1,,0,Unknow,0,0,1,1,1,0
SOAD17455,Flumevale,Yes,Irrigation,Earth,3.231,0.767,40892.0,1974,,0.24428,75.60731042999417,Uncontrolled,18/05/2022,1,0.0,High,Satisfactory,2022-05-18,0.0711,263.7,605.6,27.9,3.231,0.767,0,40892.0,0,10.618714178239,0,Unknow,0,0,0,1,0,0
SOAD02844,Flumevale,Yes,Other,Earth,6.481,0.235,27524.0,1980,,0.07683,33.10655806770254,Uncontrolled,23/10/2018,6,10.14,Low,Not Rated,,0.0491,35.5,399.5,21.320843957389396,6.481,0.235,0,27524.0,0,10.2228499615909,0,Unknow,0,0,0,1,0,0
SOAD08216,Flumevale,Yes,Fish and Wildlife Pond,Earth,7.944,0.367,5705.0,1956,,0.17336,111.85818,Uncontrolled,01/11/2021,2,3.22,Significant,Satisfactory,2021-11-01,0.096,29.7,770.4,15.745698411826725,7.944,0.367,0,5705.0,0,8.64927353177345,0,Unknow,0,0,0,0,0,0
SOAD14663,Flumevale,Yes,"Fire Protection, Stock, Or Small Fish Pond",Earth,10.211,0.175,32559.589528279837,1915,,0.13002,36.90407235355489,,11/10/2011,6,18.44,Low,Satisfactory,2022-10-06,0.0375,41.8,286.9,19.189433641019203,10.211,0.175,0,,1,,0,Unknow,0,0,1,1,0,0
SOAD18686,Flumevale,Yes,Flood Risk Reduction,Earth,18.951,0.463,109460.60902132124,1993,,0.13199,13.31645,Uncontrolled,23/05/2022,3,41.56,High,Satisfactory,2022-05-23,0.1054,18.8,144.3,19.325901126897417,18.951,0.463,0,,1,,0,Unknow,0,0,1,0,0,0
SOAD04564,Flumevale,Yes,Irrigation,Earth,5.995,0.283,23633.48927889903,1952,,0.25807,7.98987,Uncontrolled,02/08/2018,6,23.04,Low,Not Rated,,0.0868,247.8,287.3,43.4,5.995,0.283,0,,1,,0,Unknow,0,0,1,0,0,0
SOAD16610,Flumevale,Yes,Hydroelectric,Earth,4.359,0.087,10045.718748776535,1922,,0.18321,41.92463065271083,Uncontrolled,20/07/2017,6,28.79,Low,Fair,2022-09-15,0.041,28.0,321.8,77.6,4.359,0.087,0,,1,,0,Unknow,0,0,1,1,0,0
SOAD18847,Flumevale,Yes,Other,Earth,7.823,0.318,20827.0,1862,,0.18715,33.94721076523395,,07/02/2023,1,0.0,High,Fair,2017-09-01,0.1085,44.8,824.4,20.050125367159982,7.823,0.318,0,20827.0,0,9.94405351428279,0,Unknow,0,0,0,1,0,0
SOAD01841,Flumevale,Yes,Irrigation,Earth,10.689,0.033,6933.0,1938,1999F;1999H;1999S,0.13002,54.74584413187598,Uncontrolled,09/09/2022,2,4.88,Significant,Fair,2022-09-09,0.1311,17.9,871.6,3.2,10.689,0.033,0,6933.0,0,8.84419212624497,3,1999,0,0,0,1,0,0
SOAD03603,Flumevale,Yes,Recreation,Earth,9.757,0.318,28861.0,1937,,0.178204254807973,460.74917,Uncontrolled,18/07/2014,Unknow,22.62,Significant,Not Rated,,0.1603,26.2,407.7,6.0,9.757,0.318,0,28861.0,0,10.270281129996,0,Unknow,0,0,0,0,1,0
SOAD09448,Flumevale,Yes,Water Supply,Earth,12.734,0.182,39379.517266620926,1952,,0.14184,32.30926743687959,Uncontrolled,29/09/2022,1,14.45,High,Fair,2022-09-29,0.1205,17.5,209.9,30.7,12.734,0.182,0,,1,,0,Unknow,0,0,1,1,0,0
SOAD13576,Flumevale,Yes,Irrigation,Earth,8.397,0.183,19444.292602238183,1913,,0.10047,7.98987,Uncontrolled,19/10/2016,6,37.41,Low,Satisfactory,2013-09-25,0.0512,12.6,127.3,47.0,8.397,0.183,0,,1,,0,Unknow,0,0,1,0,0,0
SOAD10705,Flumevale,Yes,Water Supply,Earth,19.027,0.133,39800.0,1956,,0.14578,2.66329,,16/06/2022,0.5,50.20291893207433,Low,Satisfactory,2017-09-01,0.0778,41.5,12.5,43.9,19.027,0.133,0,39800.0,0,10.591647316585,0,Unknow,0,0,0,0,0,1
SOAD18640,Flumevale,Yes,Water Supply,Earth,11.067,0.376,71888.0,1947,,0.14184,33.49833058858201,,10/06/2020,6,21.95,Low,Fair,2020-07-27,0.0625,6.7,265.9,14.4,11.067,0.376,0,71888.0,0,11.1828785417407,0,Unknow,0,0,0,1,0,0
SOAD05517,Flumevale,Yes,Flood Risk Reduction,Earth,17.796,1.392,423125.0,2008,,0.20291,37.28606,,17/02/2022,1,0.66,High,Satisfactory,2017-09-01,0.1051,5.6,404.5,20.298906120315632,17.796,1.392,0,423125.0,0,12.9554252860137,0,Unknow,0,0,0,0,0,0
SOAD12194,Flumevale,Yes,Irrigation,Earth,3.175,0.043,9838.431859115075,1920,,0.30732,78.26616210846187,,09/09/2021,6,8.43,Low,Not Rated,,0.038,48.4,159.5,7.1,3.175,0.043,0,,1,,0,Unknow,0,0,1,1,0,0
SOAD18037,Flumevale,Yes,Other,Earth,15.534,0.158,35000.0,1964,,0.1379,7.98987,,20/10/2021,1,1.66,High,Satisfactory,2017-09-01,0.1124,24.4,491.0,16.918459235045844,15.534,0.158,0,35000.0,0,10.463131911492,0,Unknow,0,0,0,0,0,0
SOAD00612,Flumevale,Yes,Water Supply,Earth,18.209,0.092,32000.0,1965,,0.25413,26.6329,,17/02/2022,1,11.81,Significant,Satisfactory,2017-09-01,0.1184,183.7,475.7,6.3,18.209,0.092,0,32000.0,0,10.3735224312936,0,Unknow,0,0,0,0,0,0
SOAD07052,Flumevale,Yes,Fish and Wildlife Pond,Earth,5.015,0.075,1661.0,1966,,0.10715488604062706,21.30632,Uncontrolled,02/08/2017,Unknow,37.23,Significant,Not Rated,,0.1419,28.3,214.1,20.873421374682422,5.015,0.075,0,1661.0,0,7.41577697541539,0,Unknow,0,0,0,0,1,0
SOAD20005,Flumevale,Yes,Irrigation,Earth,6.941,0.406,20200.0,1911,1968H;1968M;1968S;1998S;2002S,0.24428,49.696799117560424,Uncontrolled,07/08/2018,6,17.62,Low,Not Rated,,0.0802,707.2,451.5,44.6,6.941,0.406,0,20200.0,0,9.91348738711446,5,2002,0,0,0,1,0,0
SOAD02338,Flumevale,Yes,Irrigation,Earth,10.799,0.03,8266.0,1884,,0.20882,39.23846542256911,,24/06/2021,6,30.68,Low,Fair,2022-09-29,0.0592,25.0,103.9,41.1,10.799,0.03,0,8266.0,0,9.02002696525268,0,Unknow,0,0,0,1,0,0
SOAD08620,Flumevale,Yes,Unknow,Earth,10.588,0.85,58020.92632610721,Unknow,,0.35854,61.96619700473076,,14/06/2019,1,8.687225577911578,Significant,Poor,2017-09-01,0.1538,634.4,406.9,21.262575348251794,10.588,0.85,0,,1,,0,Unknow,0,0,1,1,0,1
SOAD09280,Flumevale,Yes,"Fire Protection, Stock, Or Small Fish Pond",Earth,3.632,0.32,23021.007351853823,1909,,0.18715,34.40412631212327,,16/09/1992,6,8.42,Low,Not Rated,,0.0571,12.7,242.5,23.09454241747402,3.632,0.32,0,,1,,0,Unknow,0,0,1,1,0,0
SOAD20314,Flumevale,No,Water Supply,Earth,20.679,0.4,195000.0,1947,,0.12214,122.09907047261687,Controlled,17/08/2020,1,0.0,High,Not Available,,0.0864,44.1,118.6,66.1,20.679,0.4,0,195000.0,0,12.1807599657379,0,Unknow,0,0,0,1,0,0
SOAD12285,Flumevale,Yes,Hydroelectric,Earth,5.371,0.162,2000.0,1870,,0.24428,5.32658,Uncontrolled,12/08/2019,3,48.49686223434924,Low,Satisfactory,2023-09-29,0.0736,501.1,20.1,62.70652348484859,5.371,0.162,0,2000.0,0,7.60140233458373,0,Unknow,0,0,0,0,0,1
SOAD16705,Flumevale,Yes,Flood Risk Reduction,Earth,34.723,0.25,149000.0,1994,,0.12805,13.31645,,23/02/2022,0.5,56.25825622159027,Low,Satisfactory,2017-09-01,0.0776,18.9,19.9,19.03529260619539,34.723,0.25,0,149000.0,0,11.9117082963145,0,Unknow,0,0,0,0,0,1
SOAD15798,Flumevale,No,Water Supply,Earth,5.159,0.053,9928.600220058708,1902,,0.2758,7.98987,Uncontrolled,22/09/2008,10,77.02461236291484,Low,Not Rated,,0.0206,285.4,9.3,30.8,5.159,0.053,0,,1,,0,Unknow,0,0,1,0,0,1
SOAD07233,Flumevale,Yes,Water Supply,Earth,3.602,0.583,42989.80667916862,1926,,0.86089,18.64303,,08/06/2022,0.5,89.14929292367174,Low,Satisfactory,2017-09-01,0.074,154.1,23.8,61.6,3.602,0.583,0,,1,,0,Unknow,0,0,1,0,0,1
SOAD15150,Flumevale,Yes,Water Supply,Earth,5.454,0.133,3000.0,1918,,0.45901,10.65316,,28/06/2023,0.5,48.69515522985803,Low,Poor,2022-01-12,0.0895,150.1,12.4,25.0,5.454,0.133,0,3000.0,0,8.00670084544037,0,Unknow,0,0,0,0,0,1
SOAD20207,Flumevale,Yes,Irrigation,Earth,3.508,0.273,21019.614623510224,Unknow,,0.36051,314.26822,,25/09/1991,0,6.69,Low,Not Rated,,0.0935,425.8,189.1,18.4,3.508,0.273,0,,1,,0,Unknow,0,0,1,0,0,0
SOAD00465,Flumevale,Yes,Irrigation,Earth,3.961,0.242,12460.0,1893,,0.15169,40.206804632214535,,15/10/1986,6,14.71,Low,Not Rated,,0.0373,41.0,282.3,11.5,3.961,0.242,0,12460.0,0,9.43035904594287,0,Unknow,0,0,0,1,0,0
SOAD02412,Flumevale,Yes,Irrigation,Earth,9.329,0.825,64053.0,1905,,0.41961,7.98987,Uncontrolled,08/06/2016,6,9.35,Low,Fair,2016-11-10,0.0644,329.9,118.3,39.1,9.329,0.825,0,64053.0,0,11.0674817565849,0,Unknow,0,0,0,0,0,0
SOAD03721,Flumevale,Yes,Recreation,Earth,7.773,0.73,11035.0,1966,,0.20291,61.668642208603025,,18/08/2008,6,139.71,Low,Not Rated,,0.0791,31.2,87.1,8.2,7.773,0.73,0,11035.0,0,9.30891793533718,0,Unknow,0,0,0,1,0,0
SOAD18416,Flumevale,Yes,Water Supply,Earth,20.488,0.833,198000.0,1996,,0.11229,68.22452032428258,,04/02/2022,0.5,55.98216010929205,Low,Satisfactory,2017-09-01,0.0608,23.9,10.3,64.5,20.488,0.833,0,198000.0,0,12.196027360169,0,Unknow,0,0,0,1,0,1
SOAD07630,Flumevale,Yes,Recreation,Earth,4.118,0.133,10692.097237514623,1930,2005H,0.32111,61.53219018963821,Controlled,22/04/2021,6,17.2,Low,Fair,2013-09-23,0.0488,180.1,429.8,5.2,4.118,0.133,0,,1,,1,2005,0,0,1,1,0,0
SOAD06049,Flumevale,Yes,Recreation,Earth,10.036,1.058,35130.0,1968,,0.2167,85.6910815115448,Uncontrolled,12/06/2018,6,32.08,Low,Not Rated,,0.0691,22.4,140.6,7.5,10.036,1.058,0,35130.0,0,10.4668392105536,0,Unknow,0,0,0,1,0,0
SOAD19048,Flumevale,No,Irrigation,Earth,2.469,0.465,44883.6838627578,1910,,0.3032751634906294,205.94009323211728,Controlled,31/08/2010,10,94.58213483177892,Low,Not Rated,,0.0679,15.2,18.4,15.6,2.469,0.465,0,,1,,0,Unknow,0,0,1,1,1,1
SOAD00026,Flumevale,Yes,Water Supply,Earth,9.485,0.113,59500.0,1879,1966S,0.15366,7.98987,Uncontrolled,04/08/2021,2,4.62,Significant,Satisfactory,2021-08-04,0.1333,44.1,390.2,64.6,9.485,0.113,0,59500.0,0,10.9937483981152,1,1966,0,0,0,0,0,0
SOAD08854,Flumevale,Yes,Water Supply,Earth,21.446,0.14,70000.0,Unknow,,0.06501,27.38294071489557,,11/05/2022,1,1.0820639856963115,High,Satisfactory,2017-09-01,0.0917,17.8,946.0,45.9,21.446,0.14,0,70000.0,0,11.1562648066437,0,Unknow,0,0,0,1,0,1
SOAD09395,Flumevale,Yes,Irrigation,Earth,3.885,0.046,2199.0,1886,,0.19897,52.41676095504304,,07/07/2017,0,11.13,Low,Not Rated,,0.0633,24.5,237.3,3.8,3.885,0.046,0,2199.0,0,7.69621263934641,0,Unknow,0,0,0,1,0,0
SOAD11296,Flumevale,Yes,Water Supply,Earth,26.998,0.149,120000.0,1946,,0.13199,5.32658,,19/05/2022,1,5.2,High,Satisfactory,2017-09-01,0.0975,29.8,335.8,12.3,26.998,0.149,0,120000.0,0,11.6952553550628,0,Unknow,0,0,0,0,0,0
SOAD05897,Flumevale,Yes,Water Supply,Earth,7.422,1.233,95000.0,1985,,0.14972,52.95804840698692,,10/08/2022,1,0.0,High,Satisfactory,2017-09-01,0.1035,37.4,689.1,21.4,7.422,1.233,0,95000.0,0,11.4616426968431,0,Unknow,0,0,0,1,0,0
SOAD09042,Flumevale,Yes,Irrigation,Earth,5.536,0.767,75727.0,1890,,0.30141,7.98987,Uncontrolled,14/07/2021,6,3.07,Low,Satisfactory,2020-07-20,0.0544,379.9,599.2,29.7,5.536,0.767,0,75727.0,0,11.234903252146,0,Unknow,0,0,0,0,0,0
SOAD03954,Flumevale,Yes,Water Supply,Earth,11.347,0.467,73088.92300701395,1907,,0.12214,33.734322253492145,Uncontrolled,14/04/2023,1,0.0,High,Unsatisfactory,2023-01-28,0.1296,14.6,332.6,22.5,11.347,0.467,0,,1,,0,Unknow,0,0,1,1,0,0
SOAD12128,Flumevale,Yes,Flood Risk Reduction,Earth,6.922,1.43,99566.64573540974,2002,,0.02364,37.28606,Uncontrolled,03/03/2022,3,0.0,High,Satisfactory,2022-03-03,0.0983,22.9,356.6,19.27755786077308,6.922,1.43,0,,1,,0,Unknow,0,0,1,0,0,0
SOAD02594,Flumevale,Yes,Recreation,Earth,4.003,0.38,20025.0,1881,1993,0.28368,71.91836071005928,Uncontrolled,22/06/2017,6,4.88,Low,Not Rated,,0.0845,249.4,757.7,9.3,4.003,0.38,0,20025.0,0,9.90478670826775,1,1993,0,0,0,1,0,0
SOAD03777,Flumevale,Yes,Water Supply,Earth,9.738,0.06,13843.040067692773,1914,,0.17336,13.31645,,29/06/2022,0.5,65.69644987354567,Low,Satisfactory,2017-09-01,0.0592,10.5,7.5,18.6,9.738,0.06,0,,1,,0,Unknow,0,0,1,0,0,1
SOAD10712,Flumevale,Yes,Water Supply,Earth,4.096,1.5367480931884447,982237.0468481177,1952,,0.47083,1220.201969845584,,17/08/2022,0.5,0.0,Low,Satisfactory,2017-09-01,0.0795,149.4,469.1,20.6,4.096,2.64,0,,1,,0,Unknow,0,1,1,1,0,0
SOAD13464,Flumevale,Yes,Irrigation,Earth,8.36,0.233,17630.0,1911,1949H;1949M;1949S,0.2167,49.56376640970713,Uncontrolled,19/06/2018,6,13.44,Low,Satisfactory,2019-07-15,0.042,33.2,103.9,14.4,8.36,0.233,0,17630.0,0,9.77741399528076,3,1949,0,0,0,1,0,0
SOAD20540,Flumevale,Yes,Water Supply,Earth,4.786,0.042,44437.0,1919,,0.31914,67.02479192881579,,27/05/2022,0.5,41.8461247684072,Low,Satisfactory,2017-09-01,0.0836,447.7,14.4,16.5,4.786,0.042,0,44437.0,0,10.7018502382404,0,Unknow,0,0,0,1,0,1
SOAD07760,Flumevale,Yes,Irrigation,Earth,5.422,0.292,18540.0,1959,,0.26398,48.92267843736462,,31/07/2015,6,36.69,Low,Not Rated,,0.0881,352.8,74.1,27.9,5.422,0.292,0,18540.0,0,9.82773977509785,0,Unknow,0,0,0,1,0,0
SOAD10863,Flumevale,Yes,Irrigation,Earth,4.171,0.799,46334.0,1904,,0.35854,90.198642077535,Uncontrolled,08/02/2016,6,15.83,Low,Fair,2008-04-29,0.0646,469.2,379.0,25.2,4.171,0.799,0,46334.0,0,10.7436528940208,0,Unknow,0,0,0,1,0,0
SOAD01785,Flumevale,Yes,"Fire Protection, Stock, Or Small Fish Pond",Earth,4.131,0.18,16134.150027083422,1915,,0.40385,76.72653646277695,,11/10/2011,6,14.75,Low,Fair,2013-07-25,0.0572,334.7,431.3,19.9547722781218,4.131,0.18,0,,1,,0,Unknow,0,0,1,1,0,0
SOAD10548,Flumevale,Yes,Irrigation,Earth,7.155,0.157,12779.21048865783,1948,,0.20094,34.84849214929362,,27/06/2019,6,0.0,Low,Satisfactory,2009-06-24,0.0497,43.2,329.8,22.5,7.155,0.157,0,,1,,0,Unknow,0,0,1,1,0,0
SOAD10582,Flumevale,Yes,Irrigation,Earth,21.235,0.063,47600.0,1951,,0.2167,7.98987,Uncontrolled,06/08/2015,6,17.62,Low,Not Rated,,0.076,41.8,377.1,15.8,21.235,0.063,0,47600.0,0,10.7706090484022,0,Unknow,0,0,0,0,0,0
SOAD04777,Flumevale,Yes,Flood Risk Reduction,Earth,11.342,0.275,33894.0,1969,,0.19503,21.30632,Uncontrolled,28/05/2008,3,50.68,Low,Not Rated,,0.0983,46.5,102.8,20.460279289573467,11.342,0.275,0,33894.0,0,10.4310227898651,0,Unknow,0,0,0,0,0,0
SOAD05327,Flumevale,Yes,Recreation,Earth,21.793,0.157,74950.81486829014,1885,,0.10047,50.61935438027484,Uncontrolled,19/05/2021,4,52.98,Low,Poor,2016-08-08,0.091,45.4,138.6,3.8,21.793,0.157,0,,1,,0,Unknow,0,0,1,1,0,0
SOAD07903,Flumevale,Yes,Irrigation,Earth,3.827,0.083,10000.0,1900,2005H;2005S,0.3152,62.75962137853866,Uncontrolled,13/08/2009,6,0.0,Low,Fair,2019-11-05,0.0753,180.5,186.8,8.9,3.827,0.083,0,10000.0,0,9.21044036697652,2,2005,0,0,0,1,0,0
SOAD19768,Flumevale,Yes,Flood Risk Reduction,Earth,15.452,0.127,26000.0,1970,,0.10047,39.94935,,30/11/2021,1,0.0,Significant,Satisfactory,2017-09-01,0.1385,9.5,350.1,18.25233037391438,15.452,0.127,0,26000.0,0,10.1658902778025,0,Unknow,0,0,0,0,0,0
SOAD01965,Flumevale,Yes,Flood Risk Reduction,Earth,10.871,0.167,25074.0,1956,,0.18124,21.30632,Uncontrolled,26/09/2013,3,8.24,Low,Not Rated,,0.0996,46.7,316.7,20.416108419385978,10.871,0.167,0,25074.0,0,10.1296266128301,0,Unknow,0,0,0,0,0,0
SOAD05875,Flumevale,Yes,Water Supply,Earth,15.844,0.708,287200.0,2002,,0.0985,52.49753157039084,,10/08/2022,1,0.0,Significant,Satisfactory,2017-09-01,0.1078,10.0,783.4,14.2,15.844,0.708,0,287200.0,0,12.5679375980443,0,Unknow,0,0,0,1,0,0
SOAD13796,Flumevale,Yes,Flood Risk Reduction,Earth,12.311,0.277,40600.0,1959,,0.19306,13.31645,Uncontrolled,15/10/2020,3,1.61,Low,Satisfactory,2021-09-08,0.0778,38.6,687.4,17.650855567462674,12.311,0.277,0,40600.0,0,10.6115479758284,0,Unknow,0,0,0,0,0,0
SOAD14966,Flumevale,Yes,Irrigation,Earth,18.569,0.151,45905.0,1955,,0.0985,21.30632,Uncontrolled,02/10/2020,6,35.61,Low,Satisfactory,2013-09-21,0.0486,8.4,209.6,8.3,18.569,0.151,0,45905.0,0,10.7343511064599,0,Unknow,0,0,0,0,0,0
SOAD11518,Flumevale,Yes,Irrigation,Earth,15.849,0.123,29900.0,1968,,0.15563,26.6329,Uncontrolled,06/05/2021,2,20.24,Significant,Fair,2021-05-06,0.1496,16.5,436.8,8.5,15.849,0.123,0,29900.0,0,10.3056472036356,0,Unknow,0,0,0,0,0,0
SOAD08614,Flumevale,Yes,Other,Earth,19.904,0.123,58000.0,1974,,0.16154,10.65316,,17/02/2022,1,0.0,High,Satisfactory,2017-09-01,0.0823,13.9,591.5,17.074414151254032,19.904,0.123,0,58000.0,0,10.9682155307592,0,Unknow,0,0,0,0,0,0
SOAD09856,Flumevale,Yes,Irrigation,Earth,6.01,0.65,28249.0,1938,,0.23837,13.31645,Uncontrolled,03/12/2021,6,6.32,Low,Fair,2019-09-14,0.0506,8.2,473.0,17.8,6.01,0.65,0,28249.0,0,10.2488487365746,0,Unknow,0,0,0,0,0,0
SOAD14230,Flumevale,Yes,Flood Risk Reduction,Earth,9.624,0.534,66830.0,1963,,0.11426,13.31645,Uncontrolled,15/09/2022,3,0.0,Low,Not Rated,,0.0871,5.4,220.7,19.155331773145168,9.624,0.534,0,66830.0,0,11.109922323733,0,Unknow,0,0,0,0,0,0
SOAD20785,Flumevale,Yes,Flood Risk Reduction,Earth,12.702,0.507,77988.0,1980,,0.20094,7.98987,Uncontrolled,09/06/2021,3,6.71,Low,Fair,2010-06-04,0.0941,46.7,380.9,18.94452819741199,12.702,0.507,0,77988.0,0,11.2643230700857,0,Unknow,0,0,0,0,0,0
SOAD00812,Flumevale,Yes,Flood Risk Reduction,Earth,11.506,0.186,73754.0,1958,,0.13199,7.98987,Uncontrolled,01/11/2021,3,1.64,Significant,Satisfactory,2021-11-01,0.1037,38.7,839.2,17.624673272171762,11.506,0.186,0,73754.0,0,11.2085040685141,0,Unknow,0,0,0,0,0,0
SOAD04943,Flumevale,Yes,Irrigation,Earth,6.585,0.085,6989.0,1952,,0.13199,7.98987,,08/06/2021,6,25.05,Low,Fair,2006-08-14,0.0549,39.2,461.5,4.9,6.585,0.085,0,6989.0,0,8.85223583522786,0,Unknow,0,0,0,0,0,0
SOAD07574,Flumevale,Yes,Water Supply,Earth,11.6,0.3,18000.0,1955,,0.11229,2.66329,,26/04/2022,0.5,56.20404276741285,Low,Satisfactory,2017-09-01,0.0738,22.2,5.0,15.4,11.6,0.3,0,18000.0,0,9.7981825908907,0,Unknow,0,0,0,0,0,1
SOAD08662,Flumevale,Yes,Irrigation,Earth,7.141,0.2,23457.0,1960,,0.21276,7.98987,,16/08/2022,6,11.55,Low,Fair,2021-05-19,0.0496,38.7,421.1,16.4,7.141,0.2,0,23457.0,0,10.0629668670814,0,Unknow,0,0,0,0,0,0
SOAD15946,Flumevale,Yes,Irrigation,Earth,10.992,0.25,58002.0,1962,,0.29747,62.512360367166195,,06/10/2022,6,12.36,Low,Not Rated,,0.0867,506.0,336.2,6.3,10.992,0.25,0,58002.0,0,10.9682500123288,0,Unknow,0,0,0,1,0,0
SOAD19685,Flumevale,Yes,Water Supply,Earth,18.714,0.602,192249.53826981605,1932,2001,0.10047,55.64489305163966,Uncontrolled,21/04/2022,1,0.0,High,Satisfactory,2022-04-21,0.0879,29.7,686.2,31.1,18.714,0.602,0,,1,,1,2001,0,0,1,1,0,0
SOAD19820,Flumevale,Yes,Irrigation,Earth,4.198,0.124,3233.0,1900,,0.30141,53.03825393685582,Uncontrolled,26/07/2018,6,14.58,Low,Not Rated,,0.07,652.3,363.6,17.7,4.198,0.124,0,3233.0,0,8.08147504013705,0,Unknow,0,0,0,1,0,0
SOAD03201,Flumevale,Yes,Irrigation,Earth,7.653,0.122,18505.0,1956,,0.18124,15.97974,,10/08/2021,2,19.5,Significant,Fair,2021-08-10,0.1313,43.2,459.0,8.5,7.653,0.122,0,18505.0,0,9.82585028280898,0,Unknow,0,0,0,0,0,0
SOAD01506,Flumevale,Yes,Recreation,Earth,17.488,0.167,50000.0,1962,2011F;2011H;2011M;2011S,0.13396,47.12726191980473,Controlled,23/09/2022,1,0.0,High,Fair,2022-09-23,0.1074,10.1,212.6,4.3,17.488,0.167,0,50000.0,0,10.8197982842103,4,2011,0,0,0,1,0,0
SOAD08695,Flumevale,Yes,Recreation,Earth,9.074,0.367,72000.0,1999,,0.19109,7.98987,Uncontrolled,08/10/2013,6,30.96,Low,Not Rated,,0.0867,5.2,143.2,9.0,9.074,0.367,0,72000.0,0,11.1844352867906,0,Unknow,0,0,0,0,0,0
SOAD09914,Flumevale,No,Recreation,Earth,9.22,0.071,12275.721601786034,1958,,0.9505932840695687,115.17145136476074,Uncontrolled,23/06/2014,1,30.28,High,Not Rated,,0.1137,626.0,177.4,6.4,9.22,0.071,0,,1,,0,Unknow,0,0,1,1,1,0
SOAD18425,Flumevale,Yes,Irrigation,Earth,5.409,0.307,19294.0,1930,,0.18715,7.98987,,07/09/2018,6,11.68,Low,Not Rated,,0.0533,32.8,262.5,38.5,5.409,0.307,0,19294.0,0,9.86760127397172,0,Unknow,0,0,0,0,0,0
SOAD03460,Flumevale,Yes,Recreation,Earth,6.106,0.233,21094.078652358967,1971,,0.29944,7.98987,Uncontrolled,10/10/2019,2,90.38,Significant,Satisfactory,2019-10-10,0.1262,298.5,202.5,3.2,6.106,0.233,0,,1,,0,Unknow,0,0,1,0,0,0
SOAD10134,Flumevale,Yes,Hydroelectric,Earth,19.948,0.133,99245.36358466935,1908,,0.1379,1472.0940543678366,Uncontrolled,13/08/2019,3,6.4,Low,Satisfactory,2023-09-29,0.0634,6.3,437.1,90.5,19.948,0.133,0,,1,,0,Unknow,0,0,1,1,0,0
SOAD17726,Flumevale,Yes,Irrigation,Earth,12.453,0.179,66654.0,1947,,0.15957,21.30632,Uncontrolled,26/06/2020,6,18.31,Low,Fair,2009-10-27,0.0447,10.6,236.1,17.5,12.453,0.179,0,66654.0,0,11.1072853415478,0,Unknow,0,0,0,0,0,0
SOAD08303,Flumevale,Yes,Water Supply,Earth,4.919,0.297,12000.0,1946,,0.32899,69.8102805376848,,22/03/2022,0.5,48.45962817500578,Low,Satisfactory,2017-09-01,0.0644,710.6,12.7,8.0,4.919,0.297,0,12000.0,0,9.39274525863144,0,Unknow,0,0,0,1,0,1
SOAD08640,Flumevale,Yes,Other,Earth,18.511,0.217,73500.0,1963,,0.16942,5.32658,,26/05/2022,1,4.68,Significant,Satisfactory,2017-09-01,0.1276,21.8,255.6,18.47293772107994,18.511,0.217,0,73500.0,0,11.2050542905506,0,Unknow,0,0,0,0,0,0
SOAD10350,Flumevale,Yes,Water Supply,Earth,7.078,1.209,120000.0,1989,,0.1182,43.343780082876926,,10/08/2022,1,0.0,High,Satisfactory,2017-09-01,0.0846,31.6,127.2,54.5,7.078,1.209,0,120000.0,0,11.6952553550628,0,Unknow,0,0,0,1,0,0
SOAD11758,Flumevale,Yes,Water Supply,Earth,11.746,0.234,81111.0,1906,1977S;2001S;2002S,0.15169,45.27593,Uncontrolled,13/07/2022,1,14.71,High,Satisfactory,2022-07-13,0.1004,46.1,357.7,9.7,11.746,0.234,0,81111.0,0,11.3035861946324,3,2002,0,0,0,0,0,0
SOAD16638,Flumevale,Yes,Irrigation,Earth,5.101,0.167,12215.0,1896,,0.12214,266.329,Uncontrolled,21/06/2022,6,9.46,Low,Fair,2022-10-20,0.0435,40.5,474.2,45.1,5.101,0.167,0,12215.0,0,9.41050184689847,0,Unknow,0,0,0,0,0,0
SOAD03853,Flumevale,Yes,Water Supply,Earth,12.623,0.1,45000.0,1968,,0.20094,133.1645,,28/01/2022,1,0.0,High,Satisfactory,2017-09-01,0.09,16.7,629.8,28.1,12.623,0.1,0,45000.0,0,10.7144399907278,0,Unknow,0,0,0,0,0,0
SOAD07019,Flumevale,Yes,Irrigation,Earth,7.108,0.2,29245.0,1951,,0.12805,62.03668518998483,,16/10/2020,6,33.55,Low,Not Rated,,0.0369,11.7,59.3,2.4,7.108,0.2,0,29245.0,0,10.2834980911718,0,Unknow,0,0,0,1,0,0
SOAD07271,Flumevale,Yes,Flood Risk Reduction,Earth,10.03,0.5,37000.0,1984,,0.16745,34.52121095539761,,05/01/2022,1,0.11,High,Satisfactory,2017-09-01,0.0953,23.1,702.6,20.243802178372757,10.03,0.5,0,37000.0,0,10.5187002182882,0,Unknow,0,0,0,1,0,0
SOAD17438,Flumevale,Yes,Irrigation,Earth,9.218,0.408,26183.0,1888,,0.18912,34.14452954431426,,29/09/2020,6,35.98,Low,Unsatisfactory,2010-03-17,0.0836,11.1,227.8,31.6,9.218,0.408,0,26183.0,0,10.172903816181,0,Unknow,0,0,0,1,0,0
SOAD20392,Flumevale,Yes,Irrigation,Earth,3.146,0.044,3063.0,1913,,0.12411,57.05173520100902,,10/07/1990,6,55.0,Low,Not Rated,,0.0602,29.8,199.0,1.5,3.146,0.044,0,3063.0,0,8.02747653086048,0,Unknow,0,0,0,1,0,0
SOAD00695,Flumevale,Yes,Irrigation,Earth,5.051,0.142,10088.0,1890,,0.2955,59.713578278294165,,16/08/2022,6,14.38,Low,Fair,2021-09-21,0.06,306.2,307.4,1.4,5.051,0.142,0,10088.0,0,9.21920100040838,0,Unknow,0,0,0,1,0,0
SOAD08330,Flumevale,Yes,Irrigation,Earth,7.09,0.19,25713.0,1894,,0.20882,50.11407919920711,Uncontrolled,08/07/2022,2,20.45,Significant,Fair,2022-07-08,0.144,17.9,416.4,4.3,7.09,0.19,0,25713.0,0,10.1547908696442,0,Unknow,0,0,0,1,0,0
SOAD08785,Flumevale,Yes,Flood Risk Reduction,Earth,30.379,0.18,196090.57804867328,1961,,0.09653,7.98987,Uncontrolled,24/10/2022,3,1.66,High,Fair,2022-10-24,0.0996,22.0,879.4,17.840451236842195,30.379,0.18,0,,1,,0,Unknow,0,0,1,0,0,0
SOAD16513,Flumevale,Yes,Water Supply,Earth,10.285,0.207,39200.0,1953,,0.26004,2.66329,,01/11/2021,1,1.69,High,Satisfactory,2017-09-01,0.076,380.8,146.7,20.8,10.285,0.207,0,39200.0,0,10.5764575356573,0,Unknow,0,0,0,0,0,0
SOAD12073,Flumevale,Yes,Flood Risk Reduction,Earth,14.081,0.345,110000.0,1981,,0.16154,47.93922,,09/03/2022,1,0.0,High,Satisfactory,2017-09-01,0.0908,9.2,417.3,15.864036704063674,14.081,0.345,0,110000.0,0,11.6082447356423,0,Unknow,0,0,0,0,0,0
SOAD16385,Flumevale,Yes,Water Supply,Earth,13.204,0.4,67500.0,1970,,0.19897,34.602325099096994,,28/04/2022,1,2.59,Significant,Satisfactory,2017-09-01,0.1055,44.2,109.2,36.4,13.204,0.4,0,67500.0,0,11.1198976915657,0,Unknow,0,0,0,1,0,0
SOAD17066,Flumevale,Yes,Water Supply,Earth,10.29,0.267,65184.0,1977,,0.18715,32.95816463268938,,10/04/1990,0,6.5,Low,Fair,2022-10-06,0.0852,33.5,127.3,36.8,10.29,0.267,0,65184.0,0,11.0849846600969,0,Unknow,0,0,0,1,0,0
SOAD05497,Flumevale,Yes,Water Supply,Earth,18.689,0.175,90000.0,1979,,0.11623,2.66329,,24/05/2022,0.5,48.58518531343653,Low,Satisfactory,2017-09-01,0.0585,40.8,6.6,10.0,18.689,0.175,0,90000.0,0,11.4075760603618,0,Unknow,0,0,0,0,0,1
SOAD05658,Flumevale,Yes,Water Supply,Earth,30.661,0.133,131780.0,1958,,0.12017,2.66329,,24/03/2022,1,0.31,High,Satisfactory,2017-09-01,0.1076,17.3,297.3,26.6,30.661,0.133,0,131780.0,0,11.7888967328439,0,Unknow,0,0,0,0,0,0
SOAD13661,Flumevale,Yes,Flood Risk Reduction,Earth,9.888,0.422,32700.0,1959,,0.26004,21.30632,,15/10/2020,3,1.64,Low,Fair,2011-08-01,0.0796,436.6,373.4,17.782033473716368,9.888,0.422,0,32700.0,0,10.3951609374575,0,Unknow,0,0,0,0,0,0
SOAD14167,Flumevale,Yes,Other,Earth,16.029,0.3,73000.0,1924,,0.15366,21.30632,,20/10/2021,1,0.34,High,Satisfactory,2017-09-01,0.0996,46.1,782.6,17.629191421494458,16.029,0.3,0,73000.0,0,11.1982284186668,0,Unknow,0,0,0,0,0,0
SOAD14195,Flumevale,Yes,Water Supply,Earth,7.723,0.7,85000.0,1986,,0.38021,31.95948,,15/02/2022,1,0.0,High,Satisfactory,2017-09-01,0.0864,108.8,819.4,50.0,7.723,0.7,0,85000.0,0,11.3504183001091,0,Unknow,0,0,0,0,0,0
SOAD11326,Flumevale,Yes,Other,Earth,13.242,0.293,42934.0,1936,,0.18321,7.98987,,06/04/2022,0.5,48.96839468378924,Low,Satisfactory,2017-09-01,0.0612,44.3,12.7,19.084055372517756,13.242,0.293,0,42934.0,0,10.6674426231066,0,Unknow,0,0,0,0,0,1
SOAD05763,Flumevale,Yes,Water Supply,Earth,13.819,1.492,152490.0282242668,2018,,0.11623,54.39016309440205,Uncontrolled,20/04/2022,1,1.54,High,Satisfactory,2022-04-20,0.0847,25.1,231.2,65.2,13.819,1.492,0,,1,,0,Unknow,0,0,1,1,0,0
SOAD18186,Flumevale,Yes,Water Supply,Earth,12.587,0.175,38994.27176017013,1904,1959;1991,0.12608,36.42237162939068,Uncontrolled,17/05/2022,1,4.65,High,Fair,2022-05-17,0.1051,44.5,419.6,71.0,12.587,0.175,0,,1,,2,1991,0,0,1,1,0,0
SOAD07548,Flumevale,Yes,Water Supply,Earth,9.374,0.048,12676.97137786757,Unknow,,0.18124,2.66329,,01/06/2022,0.5,67.75640935666006,Low,Satisfactory,2017-09-01,0.0637,12.7,14.8,20.8,9.374,0.048,0,,1,,0,Unknow,0,0,1,0,0,1
SOAD14716,Flumevale,Yes,Hydroelectric,Earth,20.978,0.333,106886.56540824247,1908,,0.14184,33.05675311983734,Uncontrolled,13/08/2019,3,6.61,Low,Satisfactory,2023-09-29,0.0772,7.8,281.9,74.0,20.978,0.333,0,,1,,0,Unknow,0,0,1,1,0,0
SOAD18597,Flumevale,Yes,Water Supply,Earth,9.475,0.133,15248.878515416374,1896,,0.19306,7.98987,Uncontrolled,19/07/2018,6,66.63,Low,Satisfactory,2014-04-17,0.0288,23.2,227.2,30.8,9.475,0.133,0,,1,,0,Unknow,0,0,1,0,0,0
SOAD18241,Flumevale,Yes,Flood Risk Reduction,Earth,12.793,0.369,54052.27785508106,1959,,0.21473,13.31645,Uncontrolled,15/10/2020,3,6.34,Low,Fair,2017-08-09,0.0975,44.2,234.2,18.52094016381049,12.793,0.369,0,,1,,0,Unknow,0,0,1,0,0,0
SOAD19530,Flumevale,Yes,Water Supply,Earth,16.172,0.323,144000.0,1990,,0.14775,5.32658,,01/09/2021,1,6.68,High,Satisfactory,2017-09-01,0.0908,23.1,222.3,41.2,16.172,0.323,0,144000.0,0,11.8775755229785,0,Unknow,0,0,0,0,0,0
SOAD13727,Flumevale,Yes,Water Supply,Earth,12.942,0.073,5000.0,1937,,0.16351,2.66329,,02/06/2022,0.5,47.90742208358903,Low,Satisfactory,2017-09-01,0.0617,19.8,14.5,42.6,12.942,0.073,0,5000.0,0,8.5173931714189,0,Unknow,0,0,0,0,0,1
SOAD13932,Flumevale,Yes,Flood Risk Reduction,Earth,10.06,0.3,35520.0,1963,,0.22458,42.61264,,03/04/2019,3,25.07,Low,Not Rated,,0.1037,13.2,112.9,20.11151733528007,10.06,0.3,0,35520.0,0,10.477879349863,0,Unknow,0,0,0,0,0,0
SOAD07580,Flumevale,Yes,Water Supply,Earth,15.979,0.218,127316.48744768868,1954,,0.16745,1197.1067433391866,Uncontrolled,07/04/2022,1,0.0,High,Satisfactory,2022-04-07,0.1183,46.0,849.1,65.1,15.979,0.218,0,,1,,0,Unknow,0,0,1,1,0,0
SOAD12112,Flumevale,Yes,Water Supply,Earth,8.792,0.24,27214.0,1959,,0.48462,5.32658,,23/03/2022,0.5,46.32705761324009,Low,Satisfactory,2017-09-01,0.0672,154.8,9.3,48.0,8.792,0.24,0,27214.0,0,10.2115235708683,0,Unknow,0,0,0,0,0,1
SOAD12396,Flumevale,Yes,Other,Earth,7.212,0.278,16100.0,1953,,0.50235,13.31645,,25/05/2022,0.5,49.36225593575091,Low,Satisfactory,2017-09-01,0.0687,74.5,4.8,20.92429080247945,7.212,0.278,0,16100.0,0,9.68663666084494,0,Unknow,0,0,0,0,0,1
SOAD02084,Flumevale,Yes,Other,Earth,9.46,0.133,14000.0,1957,,0.28959,5.32658,,20/10/2021,1,11.447611364228793,Significant,Satisfactory,2017-09-01,0.1245,360.6,436.8,18.1788437839264,9.46,0.133,0,14000.0,0,9.54688403461792,0,Unknow,0,0,0,0,0,1
SOAD08419,Flumevale,Yes,Water Supply,Earth,23.432,0.192,72200.0,1960,,0.13593,2.66329,,18/08/2022,1,0.9974238482151548,High,Satisfactory,2017-09-01,0.0897,30.4,655.8,59.1,23.432,0.192,0,72200.0,0,11.1872091752005,0,Unknow,0,0,0,0,0,1
SOAD13474,Flumevale,Yes,Irrigation,Earth,14.303,0.292,46120.6914531983,1910,,0.16154,15.97974,Uncontrolled,05/07/2019,6,9.88,Low,Fair,2017-12-20,0.0551,40.4,472.0,44.1,14.303,0.292,0,,1,,0,Unknow,0,0,1,0,0,0
SOAD05608,Flumevale,Yes,Other,Earth,15.166,0.167,40000.0,1964,,0.24034,58.59238,,27/01/2022,1,0.0,High,Satisfactory,2017-09-01,0.0959,45.3,419.6,15.420387272761792,15.166,0.167,0,40000.0,0,10.5966597327836,0,Unknow,0,0,0,0,0,0
SOAD05963,Flumevale,Yes,Irrigation,Earth,10.859,0.25,68890.0,1889,,0.0394,33.52818937318259,Uncontrolled,05/12/2005,6,18.09,Low,Not Rated,,0.0569,46.2,474.8,13.5,10.859,0.25,0,68890.0,0,11.1402808243768,0,Unknow,0,0,0,1,0,0
SOAD17793,Flumevale,Yes,Recreation,Earth,4.29,0.083,1300.0,2013,2013,0.25019,57.51199628184593,,17/05/2013,6,46.435329909686885,Low,Not Rated,,0.0629,214.7,20.6,4.9,4.29,0.083,0,1300.0,0,7.1708884785125,1,2013,0,0,0,1,0,1
SOAD04483,Flumevale,Yes,Irrigation,Earth,2.8,0.5,17779.0,1898,,0.60085,405.19382922396784,Controlled,26/06/2017,6,3.23,Low,Not Rated,,0.0612,173.8,844.8,33.5,2.8,0.5,0,17779.0,0,9.7858295090679,0,Unknow,0,0,0,1,0,0
SOAD16129,Flumevale,Yes,Other,Earth,15.175,0.173,83800.0,1975,,0.1379,100.43840074138429,,22/06/2022,1,0.84,Significant,Satisfactory,2017-09-01,0.1049,22.3,852.7,13.109682738904764,15.175,0.173,0,83800.0,0,11.3362002195732,0,Unknow,0,0,0,1,0,0
SOAD03563,Flumevale,Yes,Irrigation,Earth,14.076,0.933,82868.0,1963,1976H;2006H,0.14578,7.98987,Uncontrolled,23/06/2022,2,5.04,Significant,Satisfactory,2022-06-23,0.1217,5.9,235.4,40.7,14.076,0.933,0,82868.0,0,11.3250163266772,2,2006,0,0,0,0,0,0
SOAD08377,Flumevale,Yes,Flood Risk Reduction,Earth,10.997,0.157,60100.0,1963,,0.38809,21.30632,,09/03/2022,1,0.0,High,Satisfactory,2017-09-01,0.1015,457.4,898.5,18.08199157014144,10.997,0.157,0,60100.0,0,11.00378175932,0,Unknow,0,0,0,0,0,0
SOAD12493,Flumevale,Yes,Recreation,Earth,14.277,0.339,19976.0,1956,,0.17336,45.27593,Uncontrolled,12/09/2022,2,4.6,Significant,Satisfactory,2022-09-12,0.13,12.9,846.9,4.4,14.277,0.339,0,19976.0,0,9.90233689077873,0,Unknow,0,0,0,0,0,0
SOAD02517,Flumevale,Yes,Water Supply,Earth,5.469,0.067,3500.0,1919,,0.58706,18.64303,,02/06/2022,0.5,42.28101437059263,Low,Satisfactory,2017-09-01,0.0627,364.1,15.2,31.1,5.469,0.067,0,3500.0,0,8.16080392095467,0,Unknow,0,0,0,0,0,1
SOAD10384,Flumevale,Yes,Irrigation,Earth,8.952,0.134,26569.0,1905,,0.15957,32.98913564782335,Uncontrolled,26/07/2022,1,21.4,High,Fair,2022-07-26,0.1317,47.0,147.1,22.9,8.952,0.134,0,26569.0,0,10.1875380387539,0,Unknow,0,0,0,1,0,0
SOAD11314,Flumevale,Yes,Water Supply,Earth,16.266,0.144,85000.0,1872,,0.18321,13.31645,,15/09/2022,1,11.65,Significant,Satisfactory,2017-09-01,0.1424,46.2,349.9,66.3,16.266,0.144,0,85000.0,0,11.3504183001091,0,Unknow,0,0,0,0,0,0
SOAD01949,Flumevale,Yes,Water Supply,Earth,10.781,0.237,30000.0,1950,,0.27974,37.28606,,04/02/2022,0.5,44.83643993048597,Low,Satisfactory,2017-09-01,0.0664,632.7,22.8,49.4,10.781,0.237,0,30000.0,0,10.3089859934221,0,Unknow,0,0,0,0,0,1
SOAD00071,Flumevale,Yes,Debris Control,Earth,21.688,0.993,612100.0,1980,,0.19503,93.21515,,27/01/2022,1,1.56,High,Satisfactory,2017-09-01,0.0932,30.2,242.4,16.66942214191707,21.688,0.993,0,612100.0,0,13.3246525805578,0,Unknow,0,0,0,0,0,0
SOAD06809,Flumevale,Yes,Recreation,Earth,8.711,0.4,13746.0,1906,,0.33687,7.98987,,07/09/2022,2,26.42,Significant,Unsatisfactory,2022-09-07,0.1735,413.2,424.5,3.7,8.711,0.4,0,13746.0,0,9.52857589747142,0,Unknow,0,0,0,0,0,0
SOAD00803,Flumevale,Yes,Irrigation,Earth,17.707,0.05,39237.105635344844,1931,,0.0985,127.83792,Uncontrolled,15/05/2019,6,28.13,Low,Not Rated,,0.084,14.0,200.7,29.6,17.707,0.05,0,,1,,0,Unknow,0,0,1,0,0,0
SOAD10131,Flumevale,Yes,Water Supply,Earth,15.51,0.637,226000.0,1991,,0.1182,62.40228000929657,,21/10/2021,1,1.0,High,Satisfactory,2017-09-01,0.0831,45.8,756.4,61.6,15.51,0.637,0,226000.0,0,12.3282947030234,0,Unknow,0,0,0,1,0,0
SOAD18694,Flumevale,Yes,Irrigation,Earth,14.593,0.171,51471.0,1954,,0.13199,13.31645,,20/09/2021,6,20.48,Low,Not Rated,,0.0823,43.2,353.5,1.9,14.593,0.171,0,51471.0,0,10.8487932494788,0,Unknow,0,0,0,0,0,0
SOAD00694,Flumevale,Yes,Recreation,Earth,4.386,0.097,10045.718748776535,1947,,0.35657,29.29619,,02/07/2020,6,81.91,Low,Satisfactory,2016-05-13,0.0252,507.6,48.8,8.8,4.386,0.097,0,,1,,0,Unknow,0,0,1,0,0,0
SOAD01144,Flumevale,Yes,Irrigation,Earth,5.038,0.093,10082.497214526473,1931,,0.23049,202.10858802323418,,17/08/2019,6,46.24,Low,Not Rated,,0.026,17.5,234.0,33.6,5.038,0.093,0,,1,,0,Unknow,0,0,1,1,0,0
SOAD06318,Flumevale,Yes,Irrigation,Earth,5.022,0.32,15902.0,1883,,0.21473,35.46436253764257,Uncontrolled,15/06/2016,6,11.01,Low,Fair,2017-04-19,0.0523,9.5,475.2,17.6,5.022,0.32,0,15902.0,0,9.67426304965592,0,Unknow,0,0,0,1,0,0
SOAD08474,Flumevale,No,Water Supply,Earth,6.684,0.167,15098.186493488107,Unknow,,6.02136309631163,246.57791356081012,,,Unknow,0.0,High,Not Available,,0.1176,872.6,265.2,38.8,6.684,0.167,0,,1,,0,Unknow,0,0,1,1,1,0
SOAD15380,Flumevale,Yes,Irrigation,Earth,7.699,0.659,34672.0,1890,,0.19109,433.96644088532406,Uncontrolled,22/04/2020,2,11.55,Significant,Unsatisfactory,2020-04-22,0.19,16.9,133.6,47.3,7.699,0.659,0,34672.0,0,10.4537165650769,0,Unknow,0,0,0,1,0,0
SOAD01175,Flumevale,Yes,Flood Risk Reduction,Earth,16.243,0.2,80000.0,2019,,0.17927,35.687468014593655,,16/02/2022,1,1.3,High,Satisfactory,2021-02-05,0.1198,47.1,677.5,18.987728764135714,16.243,0.2,0,80000.0,0,11.2897944135779,0,Unknow,0,0,0,1,0,0
SOAD05204,Flumevale,Yes,Water Supply,Earth,6.755,0.022,10176.844506777556,1929,,0.28368,2.66329,,13/07/2022,0.5,15.62,Low,Fair,2020-08-13,0.0836,482.1,207.6,33.8,6.755,0.022,0,,1,,0,Unknow,0,0,1,0,0,0
SOAD08446,Flumevale,Yes,Irrigation,Earth,7.965,0.075,11100.0,1899,,0.26201,7.98987,,17/08/2022,6,35.19,Low,Satisfactory,2016-08-29,0.0558,280.6,207.4,41.2,7.965,0.075,0,11100.0,0,9.31479047333265,0,Unknow,0,0,0,0,0,0
SOAD02819,Flumevale,Yes,Flood Risk Reduction,Earth,15.004,0.257,40217.0,1965,,0.22655,21.30632,,11/04/2018,3,38.68,Low,Satisfactory,2021-08-04,0.0645,6.0,200.7,19.334231224165134,15.004,0.257,0,40217.0,0,10.602069935586,0,Unknow,0,0,0,0,0,0
SOAD06996,Flumevale,Yes,Irrigation,Earth,9.756,0.143,33692.0,1893,,0.24625,53.273011155904854,,30/06/2021,6,20.13,Low,Fair,2017-06-28,0.0418,480.3,260.0,15.9,9.756,0.143,0,33692.0,0,10.4250453796311,0,Unknow,0,0,0,1,0,0
SOAD17229,Flumevale,Yes,Recreation,Earth,14.531,0.247,111032.54803081733,1948,,17.021458293362674,698.9271863276874,,18/06/2012,5,62.24,High,Not Available,,0.1077,893.3,125.5,4.4,14.531,0.247,0,,1,,0,Unknow,0,0,1,1,1,0
SOAD09602,Flumevale,Yes,Other,Earth,55.378,0.152,623000.0,1968,,0.07486,2.66329,,03/11/2021,1,1.1184546099135664,High,Satisfactory,2017-09-01,0.0836,41.7,828.4,18.521766972909607,55.378,0.152,0,623000.0,0,13.3423034029047,0,Unknow,0,0,0,0,0,1
SOAD19465,Flumevale,Yes,Water Supply,Earth,9.232,0.567,79478.0,1952,,0.23443,31.95948,,22/03/2022,1,6.26,High,Satisfactory,2017-09-01,0.1184,15.8,347.2,13.1,9.232,0.567,0,79478.0,0,11.283248114805,0,Unknow,0,0,0,0,0,0
SOAD09529,Flumevale,Yes,Irrigation,Earth,14.282,0.217,31683.0,1977,,0.23443,42.426553541542205,Uncontrolled,17/11/2020,6,59.32,Low,Not Rated,,0.0857,23.4,91.9,15.6,14.282,0.217,0,31683.0,0,10.3635671005842,0,Unknow,0,0,0,1,0,0
SOAD13209,Flumevale,Yes,Irrigation,Earth,13.775,0.493,97358.0,1962,2004S,0.1773,37.28606,Uncontrolled,02/06/2015,6,4.62,Low,Not Rated,,0.0743,7.0,430.3,38.0,13.775,0.493,0,97358.0,0,11.4861604564501,1,2004,0,0,0,0,0,0
SOAD08306,Flumevale,Yes,Other,Earth,26.792,0.15,75000.0,1972,,0.14775,5.32658,,12/04/2022,1,3.22,High,Satisfactory,2017-09-01,0.0808,39.4,142.6,17.556810221351178,26.792,0.15,0,75000.0,0,11.2252567257629,0,Unknow,0,0,0,0,0,0
SOAD03142,Flumevale,Yes,Flood Risk Reduction,Earth,7.027,0.758,220000.0,2008,,0.24231,60.0385182549343,,12/05/2022,1,0.0,High,Satisfactory,2017-09-01,0.0799,47.5,213.6,17.373912619050152,7.027,0.758,0,220000.0,0,12.3013873707787,0,Unknow,0,0,0,1,0,0
SOAD17867,Flumevale,Yes,Water Supply,Earth,12.472,0.145,32000.0,1960,,0.2364,2.66329,,10/05/2022,1,0.0,High,Satisfactory,2017-09-01,0.0888,8.3,248.3,5.9,12.472,0.145,0,32000.0,0,10.3735224312936,0,Unknow,0,0,0,0,0,0
SOAD15679,Flumevale,Yes,Irrigation,Earth,5.848,0.075,5500.0,1892,1998,0.26201,47.34264228300471,,26/08/2022,6,17.49,Low,Fair,2018-10-22,0.0488,32.6,462.3,11.8,5.848,0.075,0,5500.0,0,8.61268517287546,1,1998,0,0,0,1,0,0
SOAD08063,Flumevale,Yes,Flood Risk Reduction,Earth,11.476,0.3,44450.0,1964,,0.22261,29.29619,,11/04/2018,3,34.63,Low,Not Rated,,0.0607,5.0,190.5,23.151966527365825,11.476,0.3,0,44450.0,0,10.7021427378768,0,Unknow,0,0,0,0,0,0
SOAD09798,Flumevale,Yes,Flood Risk Reduction,Earth,8.13,0.18,33279.0,1970,,0.22655,21.30632,Uncontrolled,01/02/2012,3,76.43,Low,Not Rated,,0.1132,26.3,139.0,21.308772018712347,8.13,0.18,0,33279.0,0,10.4127118949351,0,Unknow,0,0,0,0,0,0
SOAD19495,Flumevale,Yes,Water Supply,Earth,23.123,0.788,253308.04457375428,1892,,0.14381,125.59896833533695,,20/10/2021,1,1.7243423766709074,High,Satisfactory,2017-09-01,0.0694,32.8,890.5,63.3,23.123,0.788,0,,1,,0,Unknow,0,0,1,1,0,1
SOAD16047,Flumevale,Yes,Other,Earth,32.962,0.11,80000.0,1950,,0.12805,32.345073567651234,,21/04/2022,1,3.78,High,Satisfactory,2017-09-01,0.0736,13.5,382.4,20.777395050440568,32.962,0.11,0,80000.0,0,11.2897944135779,0,Unknow,0,0,0,1,0,0
SOAD16288,Flumevale,Yes,Water Supply,Earth,23.46,0.327,150000.0,2009,,0.13987,35.226565851959144,,19/10/2021,0.5,57.267188968380545,Low,Satisfactory,2017-09-01,0.0731,15.0,21.3,25.4,23.46,0.327,0,150000.0,0,11.9183972397228,0,Unknow,0,0,0,1,0,1
SOAD00001,Flumevale,Yes,Recreation,Earth,7.274,0.038,10574.751848822394,1939,,0.33687,63.643489059114835,Uncontrolled,19/10/2016,6,37.06,Low,Fair,2018-07-24,0.0596,180.5,138.8,6.5,7.274,0.038,0,,1,,0,Unknow,0,0,1,1,0,0
SOAD05479,Flumevale,Yes,Water Supply,Earth,24.986,0.185,118000.0,1965,,0.12805,5.32658,,22/06/2022,1,0.16,High,Satisfactory,2017-09-01,0.0857,29.8,506.9,66.6,24.986,0.185,0,118000.0,0,11.6784483779882,0,Unknow,0,0,0,0,0,0
SOAD07495,Flumevale,Yes,Irrigation,Earth,3.811,0.065,9838.431859115075,1933,,0.27186,7.98987,Uncontrolled,14/09/2019,6,50.49,Low,Not Rated,,0.0612,706.4,57.5,21.8,3.811,0.065,0,,1,,0,Unknow,0,0,1,0,0,0
SOAD01209,Flumevale,Yes,Hydroelectric,Earth,8.219,0.149,1400.0,1928,,0.2167,2.66329,Uncontrolled,06/06/2022,1,12.66,High,Satisfactory,2023-09-29,0.0878,22.4,302.0,86.5,8.219,0.149,0,1400.0,0,7.24494154633701,0,Unknow,0,0,0,0,0,0
SOAD09906,Flumevale,Yes,Irrigation,Earth,6.551,0.4,10000.0,1964,,0.42749,63.91896,Uncontrolled,17/06/2015,6,39.18,Low,Unsatisfactory,2016-10-28,0.1008,119.4,200.6,35.0,6.551,0.4,0,10000.0,0,9.21044036697652,0,Unknow,0,0,0,0,0,0
SOAD14174,Flumevale,Yes,Water Supply,Earth,18.125,0.175,73800.0,1962,,0.12411,38.4271300656425,,01/09/2022,1,1.169910877648613,High,Satisfactory,2017-09-01,0.0875,10.4,819.7,22.5,18.125,0.175,0,73800.0,0,11.2091275606323,0,Unknow,0,0,0,1,0,1
SOAD02119,Flumevale,Yes,Irrigation,Earth,12.768,0.15,23147.0,1911,1959S,0.16548,37.25970334966631,Uncontrolled,11/08/2020,6,18.25,Low,Not Rated,,0.0409,46.0,422.1,34.2,12.768,0.15,0,23147.0,0,10.0496636626937,1,1959,0,0,0,1,0,0
SOAD18704,Flumevale,Yes,Irrigation,Earth,9.489,0.519,51995.59645616539,1956,,0.3349,82.56199,,14/10/1998,0,130.8,Low,Satisfactory,2017-09-26,0.0543,340.4,79.9,14.3,9.489,0.519,0,,1,,0,Unknow,0,0,1,0,0,0
SOAD09263,Flumevale,Yes,Water Supply,Earth,8.189,0.267,2250.0,1889,,0.49644,15.97974,,30/06/2022,0.5,47.16870747160698,Low,Satisfactory,2017-09-01,0.0802,89.1,10.2,69.3,8.189,0.267,0,2250.0,0,7.71912984090673,0,Unknow,0,0,0,0,0,1
SOAD01153,Flumevale,Yes,Flood Risk Reduction,Earth,10.948,0.148,31557.635717245197,1957,,0.23049,21.30632,Uncontrolled,10/05/2000,3,9.9,Low,Unsatisfactory,2009-06-09,0.1242,18.9,368.6,19.700004319586334,10.948,0.148,0,,1,,0,Unknow,0,0,1,0,0,0
SOAD16432,Flumevale,Yes,Irrigation,Earth,3.872,0.135,4104.0,1912,1931S;2005H;2005S,0.36839,85.87505523563132,Uncontrolled,30/07/2019,6,40.21,Low,Not Rated,,0.071,682.3,210.4,5.8,3.872,0.135,0,4104.0,0,8.31996102188653,3,2005,0,0,0,1,0,0
SOAD02921,Flumevale,Yes,Flood Risk Reduction,Earth,11.326,0.608,60216.43481069992,1959,,0.26989,13.31645,Uncontrolled,15/10/2020,3,7.87,Low,Satisfactory,2018-10-18,0.0617,616.3,290.6,19.332016764671142,11.326,0.608,0,,1,,0,Unknow,0,0,1,0,0,0
SOAD10201,Flumevale,Yes,Irrigation,Earth,11.615,0.188,41360.0,1949,,0.22064,33.455400943281745,,31/08/2020,6,23.12,Low,Not Rated,,0.0778,5.1,315.4,43.4,11.615,0.188,0,41360.0,0,10.6300936868397,0,Unknow,0,0,0,1,0,0
SOAD10236,Flumevale,Yes,Irrigation,Earth,8.288,0.182,29919.0,1909,,0.16548,34.337655488003065,Uncontrolled,29/04/2021,6,38.73,Low,Fair,2011-10-11,0.0653,27.4,171.3,41.1,8.288,0.182,0,29919.0,0,10.3062824320884,0,Unknow,0,0,0,1,0,0
SOAD14150,Flumevale,Yes,Irrigation,Earth,9.706,0.258,13796.0,1940,1952H;1952M;1952S,0.26201,48.93799924965542,Uncontrolled,08/07/2021,6,36.06,Low,Unsatisfactory,2015-05-26,0.0975,453.3,63.5,21.8,9.706,0.258,0,13796.0,0,9.53220645620803,3,1952,0,0,0,1,0,0
SOAD03844,Flumevale,Yes,Hydroelectric,Earth,30.884,0.279,183626.76788744685,1923,,0.19897,2.66329,Uncontrolled,23/08/2023,1,23.31,High,Fair,2023-09-29,0.1215,13.2,201.1,59.5,30.884,0.279,0,,1,,0,Unknow,0,0,1,0,0,0
SOAD12970,Flumevale,Yes,Irrigation,Earth,5.491,0.252,7725.0,1911,1956H;1956M;1956S,0.32505,66.77535727061097,,08/07/2021,6,16.19,Low,Satisfactory,2017-07-19,0.0326,287.1,338.2,46.6,5.491,0.252,0,7725.0,0,8.95234654322623,3,1956,0,0,0,1,0,0
SOAD05842,Flumevale,Yes,Flood Risk Reduction,Earth,6.551,0.75,14160.0,1996,,0.18321,23.96961,,23/02/2022,1,0.16,High,Satisfactory,2017-09-01,0.0895,43.3,893.4,20.570096992406242,6.551,0.75,0,14160.0,0,9.55824698622306,0,Unknow,0,0,0,0,0,0
SOAD03736,Flumevale,Yes,Fish and Wildlife Pond,Earth,5.322,0.21,15400.0,1929,,0.19897,37.70439172562582,,14/08/2006,6,65.86,Low,Satisfactory,2020-10-15,0.0494,40.4,60.0,20.90712145308611,5.322,0.21,0,15400.0,0,9.64218772135847,0,Unknow,0,0,0,1,0,0
SOAD02225,Flumevale,Yes,Irrigation,Earth,12.184,0.407,31744.0,1953,,0.24231,117.18476,Uncontrolled,20/05/1994,0,57.23,Low,Fair,2019-07-10,0.076,45.8,111.4,13.2,12.184,0.407,0,31744.0,0,10.3654905116046,0,Unknow,0,0,0,0,0,0
SOAD09245,Flumevale,Yes,Other,Earth,22.575,0.144,35000.0,1935,,0.17336,37.28606,,21/06/2022,0.5,48.15650198112326,Low,Satisfactory,2017-09-01,0.0822,46.5,14.5,19.871020440001434,22.575,0.144,0,35000.0,0,10.463131911492,0,Unknow,0,0,0,0,0,1
SOAD00303,Flumevale,Yes,Water Supply,Earth,6.473,0.33,24500.0,1939,,0.41764,13.31645,,20/10/2021,1,9.69,Significant,Satisfactory,2023-04-12,0.1399,428.5,218.5,14.2,6.473,0.33,0,24500.0,0,10.1064692120264,0,Unknow,0,0,0,0,0,0
SOAD08151,Flumevale,Yes,Hydroelectric,Earth,21.728,0.265,173000.0,1956,,0.16745,36.03929340012663,Uncontrolled,29/08/2023,3,53.41822821294683,Low,Satisfactory,2023-09-29,0.0799,16.0,15.3,64.19097023809532,21.728,0.265,0,173000.0,0,12.06105265381,0,Unknow,0,0,0,1,0,1
SOAD03911,Flumevale,Yes,Fish and Wildlife Pond,Earth,11.168,0.217,38659.0,1998,,0.26201,38.225689052628574,Uncontrolled,13/09/2018,6,1.54,Low,Unsatisfactory,2010-07-12,0.0859,308.7,880.4,19.776874937083925,11.168,0.217,0,38659.0,0,10.5625607527623,0,Unknow,0,0,0,1,0,0
SOAD06341,Flumevale,Yes,Hydroelectric,Earth,6.293,0.117,10424.930338814924,1956,,0.15957,34.94443073923469,,29/08/2023,3,53.38977216815117,Low,Satisfactory,2023-09-29,0.0575,7.9,5.0,63.3767813492064,6.293,0.117,0,,1,,0,Unknow,0,0,1,1,0,1
SOAD20711,Flumevale,Yes,Tailings,Earth,16.214,0.333,107030.0686485252,1987,,0.20882,2.66329,,25/10/2021,1,4.197706318865792,Significant,Satisfactory,2017-09-01,0.1101,6.5,288.1,17.620995656295328,16.214,0.333,0,,1,,0,Unknow,0,0,1,0,0,1
SOAD07032,Flumevale,Yes,Irrigation,Earth,3.149,1.044,43158.0,1908,,0.49841,391.8215303812197,Uncontrolled,16/07/2009,6,0.0,Low,Not Rated,,0.022,601.5,823.9,25.0,3.149,1.044,0,43158.0,0,10.6726462495022,0,Unknow,0,0,0,1,0,0
SOAD12342,Flumevale,Yes,Irrigation,Earth,9.949,0.102,18532.78829107556,1953,,0.23837,7.98987,Uncontrolled,22/10/2018,6,14.37,Low,Fair,2007-03-21,0.059,18.9,423.8,16.8,9.949,0.102,0,,1,,0,Unknow,0,0,1,0,0,0
SOAD13033,Flumevale,Yes,Water Supply,Earth,13.067,0.333,157000.0,1995,,0.24822,131.8315445816411,,26/10/2021,0.5,47.11269560910299,Low,Satisfactory,2017-09-01,0.0792,540.0,8.6,60.1,13.067,0.333,0,157000.0,0,11.9640074537369,0,Unknow,0,0,0,1,0,1
SOAD18831,Flumevale,Yes,Water Supply,Earth,12.766,0.233,70000.0,1882,,0.15366,48.45842712054428,,01/12/2021,1,0.0,High,Satisfactory,2017-09-01,0.0988,14.2,157.7,9.3,12.766,0.233,0,70000.0,0,11.1562648066437,0,Unknow,0,0,0,1,0,0
SOAD02935,Flumevale,Yes,Water Supply,Earth,14.211,1.017,69300.0,1953,,0.10441,51.710829840550346,Uncontrolled,20/04/2022,2,0.0,Significant,Fair,2022-04-20,0.1327,19.6,163.7,40.2,14.211,1.017,0,69300.0,0,11.1462146150883,0,Unknow,0,0,0,1,0,0
SOAD02705,Flumevale,Yes,Water Supply,Earth,3.919,0.433,42723.18038709216,1912,,0.67768,45.27593,,16/06/2022,1,9.34839274493136,Significant,Satisfactory,2017-09-01,0.1258,647.9,433.7,34.9,3.919,0.433,0,,1,,0,Unknow,0,0,1,0,0,1
SOAD09249,Flumevale,Yes,Water Supply,Earth,7.386,0.145,12399.413338740753,1995,,0.1773,38.78598821458159,,09/09/2022,1,0.0,High,Satisfactory,2022-09-09,0.0766,6.2,422.2,18.8,7.386,0.145,0,,1,,0,Unknow,0,0,1,1,0,0
SOAD17036,Flumevale,Yes,Other,Earth,13.464,0.107,10655.0,1916,,0.35066,10.65316,,19/10/2021,0.5,44.21546881489829,Low,Satisfactory,2017-09-01,0.0612,273.9,14.4,18.665863326561443,13.464,0.107,0,10655.0,0,9.27387839278017,0,Unknow,0,0,0,0,0,1
SOAD19327,Flumevale,Yes,Flood Risk Reduction,Earth,23.739,0.157,80000.0,1956,,0.14578,31.95948,,09/03/2022,1,1.22,High,Satisfactory,2017-09-01,0.0895,44.8,892.8,21.082235351157966,23.739,0.157,0,80000.0,0,11.2897944135779,0,Unknow,0,0,0,0,0,0
SOAD17619,Flumevale,Yes,Irrigation,Earth,8.625,0.204,36267.0,1904,,0.24428,50.60251,Uncontrolled,25/06/2019,6,7.98,Low,Unsatisfactory,2003-10-02,0.1001,95.4,349.3,21.2,8.625,0.204,0,36267.0,0,10.4986910887659,0,Unknow,0,0,0,0,0,0
SOAD02842,Flumevale,Yes,Water Supply,Earth,22.793,0.133,35000.0,1956,,0.28959,13.31645,,19/07/2023,1,3.3,High,Fair,2022-03-23,0.1134,183.7,154.4,55.4,22.793,0.133,0,35000.0,0,10.463131911492,0,Unknow,0,0,0,0,0,0
SOAD10774,Flumevale,Yes,Recreation,Earth,12.812,0.161,39928.38608342256,1954,2012,0.28565,13.31645,Uncontrolled,19/10/2020,6,42.4,Low,Fair,2020-05-15,0.0591,349.9,111.6,7.3,12.812,0.161,0,,1,,1,2012,0,0,1,0,0,0
SOAD16436,Flumevale,Yes,Irrigation,Earth,8.244,0.293,22816.0,1965,,0.30338,7.98987,Uncontrolled,22/08/2019,6,4.86,Low,Not Rated,,0.0389,685.2,323.9,41.3,8.244,0.293,0,22816.0,0,10.0352611511456,0,Unknow,0,0,0,0,0,0
SOAD20247,Flumevale,Yes,Irrigation,Earth,6.713,0.717,52524.0,1881,1981,0.31126,56.001337229654744,Uncontrolled,21/04/2022,6,4.86,Low,Unsatisfactory,2022-10-18,0.0938,675.3,724.7,41.4,6.713,0.717,0,52524.0,0,10.8690445257132,1,1981,0,0,0,1,0,0
SOAD02973,Flumevale,Yes,Water Supply,Earth,16.043,0.277,104059.0,2012,,0.29156,2.66329,,06/04/2022,1,48.28748169448532,Significant,Satisfactory,2017-09-01,0.108,630.4,31.2,18.4,16.043,0.277,0,104059.0,0,11.5527229348443,0,Unknow,0,0,0,0,0,1
SOAD17133,Flumevale,Yes,Flood Risk Reduction,Earth,22.965,0.128,116000.0,1964,,0.20291,146.48095,,22/07/2022,1,0.0,High,Satisfactory,2017-09-01,0.0859,26.1,120.6,14.724526730576502,22.965,0.128,0,116000.0,0,11.661354090741,0,Unknow,0,0,0,0,0,0
SOAD08698,Flumevale,Yes,Water Supply,Earth,7.83,0.115,8000.0,1900,,0.6304,85.22528,,09/09/2021,0.5,45.85798108255601,Low,Satisfactory,2017-09-01,0.0749,559.2,19.8,58.1,7.83,0.115,0,8000.0,0,8.98732181285012,0,Unknow,0,0,0,0,0,1
SOAD04556,Flumevale,Yes,Recreation,Earth,5.801,0.073,2216.0,1906,,0.26989,50.60251,Uncontrolled,18/10/2022,6,33.45,Low,Satisfactory,2020-08-28,0.0307,438.6,52.8,9.4,5.801,0.073,0,2216.0,0,7.70391020961631,0,Unknow,0,0,0,0,0,0
SOAD06078,Flumevale,Yes,Flood Risk Reduction,Earth,8.986,0.357,42970.0,1963,,0.30929,50.60251,,03/04/2019,3,11.63,Low,Not Rated,,0.1108,415.8,114.5,18.946426191158984,8.986,0.357,0,42970.0,0,10.6682807485485,0,Unknow,0,0,0,0,0,0
SOAD20172,Flumevale,Yes,Water Supply,Earth,9.502,0.027,16050.0,1927,,0.31126,5.32658,,08/12/2021,1,1.741795197818698,High,Satisfactory,2017-09-01,0.087,550.0,702.1,31.9,9.502,0.027,0,16050.0,0,9.68352643191322,0,Unknow,0,0,0,0,0,1
SOAD06669,Flumevale,Yes,Fish and Wildlife Pond,Earth,18.125,0.743,20000.0,1968,,0.10441,30.206675138132614,Uncontrolled,11/06/2019,6,1.54,Low,Not Rated,,0.0987,47.1,887.3,21.17989801580922,18.125,0.743,0,20000.0,0,9.90353755128617,0,Unknow,0,0,0,1,0,0
SOAD09924,Flumevale,Yes,Hydroelectric,Earth,21.61,0.173,758066.8786046237,1907,,0.52599,2591.38117,Uncontrolled,28/06/2023,1,1.6010467970378557,High,Fair,2023-09-29,0.1091,675.0,547.5,83.7613975939867,21.61,0.173,0,,1,,0,Unknow,0,0,1,0,0,1
SOAD04560,Flumevale,Yes,Water Supply,Earth,14.036,0.341,11000.0,1972,,0.0985,54.46247107678356,Uncontrolled,30/09/2016,6,3.3,Low,Satisfactory,2018-12-11,0.0306,47.1,729.8,60.2,14.036,0.341,0,11000.0,0,9.30574145673943,0,Unknow,0,0,0,1,0,0
SOAD05588,Flumevale,Yes,Irrigation,Earth,4.709,0.213,19031.228984367874,1882,2009,0.44916,115.19183688992344,Uncontrolled,10/11/2022,2,0.0,Significant,Satisfactory,2022-11-10,0.1061,343.8,508.5,1.2,4.709,0.213,0,,1,,1,2009,0,0,1,1,0,0
SOAD18822,Flumevale,Yes,Water Supply,Earth,30.023,0.193,122000.0,1963,,0.11623,32.88702427076197,,08/06/2022,1,54.47879620132549,Significant,Satisfactory,2017-09-01,0.1369,30.1,66.8,69.2,30.023,0.193,0,122000.0,0,11.7117845204031,0,Unknow,0,0,0,1,0,1
SOAD12137,Flumevale,Yes,Unknow,Earth,11.994,0.02,30413.552289262767,Unknow,,0.1379,863.9654306323628,Uncontrolled,28/08/2020,6,15.01,Low,Not Rated,,0.0952,39.9,285.8,18.931339564492582,11.994,0.02,0,,1,,0,Unknow,0,0,1,1,0,0
SOAD04593,Flumevale,Yes,Irrigation,Earth,9.715,0.24,25903.642433845966,1930,,0.21473,13.31645,Uncontrolled,02/09/2022,1,25.16,High,Satisfactory,2022-09-02,0.0762,47.2,454.1,28.7,9.715,0.24,0,,1,,0,Unknow,0,0,1,0,0,0
SOAD09044,Flumevale,No,Other,Earth,22.698,0.367,817414.6627164829,Unknow,,34.86119404124592,2053.8300026674688,,,Unknow,3.3,High,Not Available,,0.1026,949.6,706.5,19.78696267591977,22.698,0.367,0,,1,,0,Unknow,0,0,1,1,1,0
SOAD03090,Flumevale,Yes,Water Supply,Earth,13.972,0.063,24590.861551539394,1891,,0.20685,29.29619,Uncontrolled,02/06/2021,2,67.58,Significant,Fair,2021-06-02,0.1482,8.6,200.4,29.2,13.972,0.063,0,,1,,0,Unknow,0,0,1,0,0,0
SOAD08417,Flumevale,No,Water Supply,Earth,13.453,0.267,48843.17740938338,Unknow,,0.991351625874663,216.67191523538193,,,Unknow,0.0,High,Not Available,,0.1309,658.8,483.2,15.6,13.453,0.267,0,,1,,0,Unknow,0,0,1,1,1,0
SOAD19087,Flumevale,Yes,Irrigation,Earth,5.407,0.533,65196.0,1882,2004,0.32111,7.98987,,06/11/2012,6,10.09,Low,Fair,2022-04-25,0.0417,279.3,309.3,17.7,5.407,0.533,0,65196.0,0,11.0851687345862,1,2004,0,0,0,0,0,0
SOAD00681,Flumevale,Yes,Irrigation,Earth,9.469,0.333,32066.0,1901,1947F;1947H;1947M;1947O;1947S,0.19897,42.61264,Uncontrolled,24/06/2021,2,10.86,Significant,Fair,2021-06-24,0.149,19.1,330.2,6.0,9.469,0.333,0,32066.0,0,10.3755827429421,5,1947,0,0,0,0,0,0
SOAD06837,Flumevale,Yes,Water Supply,Earth,7.78,0.133,11430.0,1953,,0.62252,47.93922,,25/05/2022,0.5,40.21134164354515,Low,Satisfactory,2017-09-01,0.0814,477.5,14.3,16.8,7.78,0.133,0,11430.0,0,9.34408424202578,0,Unknow,0,0,0,0,0,1
SOAD01169,Flumevale,Yes,Water Supply,Earth,28.126,0.108,91000.0,1939,,0.11229,26.6329,,07/12/2021,1,3.93,High,Satisfactory,2017-09-01,0.0901,13.0,300.3,37.8,28.126,0.108,0,91000.0,0,11.4186257744496,0,Unknow,0,0,0,0,0,0
SOAD05894,Flumevale,Yes,Irrigation,Earth,6.285,0.067,2861.0,1893,1970H;1970M;1970S,0.16154,34.96617326734216,Uncontrolled,08/08/2018,6,17.12,Low,Unsatisfactory,2018-09-19,0.0965,32.2,257.7,42.5,6.285,0.067,0,2861.0,0,7.9592759601164,3,1970,0,0,0,1,0,0
SOAD07439,Flumevale,Yes,Flood Risk Reduction,Earth,4.699,0.467,43169.64508984052,1975,2012,0.38612,29.29619,Uncontrolled,20/06/2012,3,6.48,Low,Fair,2018-09-19,0.0893,392.0,461.9,21.51703011531427,4.699,0.467,0,,1,,1,2012,0,0,1,0,0,0
SOAD18652,Flumevale,Yes,Water Supply,Earth,14.365,0.26,97000.0,1985,,0.28959,49.08806522775205,,25/01/2022,1,0.0,High,Satisfactory,2017-09-01,0.0927,255.0,821.8,15.6,14.365,0.26,0,97000.0,0,11.4824765667107,0,Unknow,0,0,0,1,0,0
SOAD02354,Flumevale,Yes,Recreation,Earth,13.981,0.142,17707.0,1964,,0.1379,13.31645,Uncontrolled,28/07/2021,6,4.81,Low,Satisfactory,2016-06-08,0.0593,28.2,722.7,3.9,13.981,0.142,0,17707.0,0,9.78177179385203,0,Unknow,0,0,0,0,0,0
SOAD07885,Flumevale,Yes,Flood Risk Reduction,Earth,16.931,0.183,85800.0,1960,,0.2364,29.29619,,21/04/2022,1,0.0,High,Satisfactory,2017-09-01,0.0871,21.5,826.7,20.434531712216916,16.931,0.183,0,85800.0,0,11.3597859404198,0,Unknow,0,0,0,0,0,0
SOAD18407,Flumevale,Yes,Other,Earth,16.844,0.24,79100.0,1976,,0.17139,26.6329,,12/11/2021,0.5,51.92516841566162,Low,Satisfactory,2017-09-01,0.0821,38.8,18.5,21.945238818388187,16.844,0.24,0,79100.0,0,11.2784807959009,0,Unknow,0,0,0,0,0,1
SOAD18248,Flumevale,Yes,Water Supply,Earth,8.541,0.948,65541.73462294572,1901,,0.2167,57.408313741675045,Uncontrolled,21/06/2022,1,0.0,High,Fair,2022-06-21,0.1266,9.5,660.0,41.8,8.541,0.948,0,,1,,0,Unknow,0,0,1,1,0,0
SOAD18875,Flumevale,Yes,Irrigation,Earth,8.05,0.047,3500.0,1890,1970S,0.25807,48.494678676862456,Uncontrolled,11/08/2022,2,14.13,Significant,Fair,2022-08-11,0.1302,569.8,139.0,29.5,8.05,0.047,0,3500.0,0,8.16080392095467,1,1970,0,0,0,1,0,0
SOAD20160,Flumevale,Yes,Flood Risk Reduction,Earth,23.354,0.165,96969.66521372582,1972,2006,0.16351,32.823837578055034,Uncontrolled,20/05/2021,3,3.07,High,Satisfactory,2021-05-20,0.114,12.0,218.7,21.225474257542903,23.354,0.165,0,,1,,1,2006,0,0,1,1,0,0
SOAD10025,Flumevale,Yes,Irrigation,Earth,6.11,0.075,10004.083266315634,1947,2000,0.31914,83.17135445190128,,20/10/2021,6,26.18,Low,Satisfactory,2021-05-25,0.0473,597.5,427.6,28.2,6.11,0.075,0,,1,,1,2000,0,0,1,1,0,0
SOAD14019,Flumevale,Yes,Water Supply,Earth,7.918,0.423,33000.0,2000,,0.11229,33.51012513218467,,24/03/2022,1,0.16,High,Satisfactory,2017-09-01,0.1069,13.0,189.1,58.0,7.918,0.423,0,33000.0,0,10.4042931430198,0,Unknow,0,0,0,1,0,0
SOAD11530,Flumevale,Yes,Irrigation,Earth,8.53,0.133,25145.0,1907,,0.49447,66.15696035159348,Uncontrolled,19/08/2020,6,9.2,Low,Fair,2018-10-18,0.0581,478.6,465.7,38.8,8.53,0.133,0,25145.0,0,10.1324541171531,0,Unknow,0,0,0,1,0,0
SOAD15358,Flumevale,No,"Fire Protection, Stock, Or Small Fish Pond",Earth,3.261,0.333,24482.577151926736,1975,,0.1312319090103158,29.29619,Uncontrolled,01/08/2011,10,93.94544490462279,Low,Not Rated,,0.055,7.3,18.2,23.925952171930643,3.261,0.333,0,,1,,0,Unknow,0,0,1,0,1,1
SOAD07855,Flumevale,Yes,Debris Control,Earth,9.663,0.819,204000.0,1998,,0.22655,39.94935,,23/02/2022,1,0.16,High,Satisfactory,2017-09-01,0.1017,32.4,541.0,19.65345121837303,9.663,0.819,0,204000.0,0,12.2258801747751,0,Unknow,0,0,0,0,0,0
SOAD11004,Flumevale,Yes,Flood Risk Reduction,Earth,17.412,0.555,114804.07730641279,1996,,0.17336,21.30632,,23/05/2022,3,9.51,High,Satisfactory,2022-05-23,0.0839,5.3,256.1,19.44035019728971,17.412,0.555,0,,1,,0,Unknow,0,0,1,0,0,0
SOAD03153,Flumevale,Yes,Other,Earth,10.901,0.567,45000.0,Unknow,,0.34475,2.66329,,24/05/2022,1,1.7728329086463972,High,Satisfactory,2017-09-01,0.0828,373.8,577.6,18.568267537552945,10.901,0.567,0,45000.0,0,10.7144399907278,0,Unknow,0,0,0,0,0,1
SOAD18144,Flumevale,Yes,Flood Risk Reduction,Earth,13.814,0.285,64800.0,1961,,0.18715,42.61264,,28/09/2020,3,24.65,Low,Not Rated,,0.0947,7.0,408.9,19.991956005094725,13.814,0.285,0,64800.0,0,11.0790763143201,0,Unknow,0,0,0,0,0,0
SOAD04838,Flumevale,Yes,Irrigation,Earth,13.625,0.267,44335.46347740306,1956,,0.27777,21.30632,Controlled,25/10/2021,6,117.86,Low,Not Rated,,0.0702,236.4,67.8,6.0,13.625,0.267,0,,1,,0,Unknow,0,0,1,0,0,0
SOAD05779,Flumevale,Yes,"Fire Protection, Stock, Or Small Fish Pond",Earth,21.655,0.13,54239.243079976215,1981,,0.17336,32.96831194305698,Uncontrolled,27/09/2022,2,28.93,Significant,Fair,2022-09-27,0.1395,27.7,129.8,22.020107526724274,21.655,0.13,0,,1,,0,Unknow,0,0,1,1,0,0
SOAD05844,Flumevale,Yes,Water Supply,Earth,13.28,0.107,20000.0,1950,,0.22852,23.96961,,22/02/2022,1,10.503437679281062,Significant,Satisfactory,2017-09-01,0.1261,44.8,279.8,28.4,13.28,0.107,0,20000.0,0,9.90353755128617,0,Unknow,0,0,0,0,0,1
SOAD02780,Flumevale,Yes,Hydroelectric,Earth,5.141,2.067,698244.361720699,1990,,0.24822,1735.4140918641765,Uncontrolled,19/05/2022,3,16.22,Low,Satisfactory,2023-09-29,0.0756,398.3,194.9,94.5,5.141,2.067,0,,1,,0,Unknow,0,0,1,1,0,0
SOAD02929,Flumevale,Yes,Water Supply,Earth,6.263,0.633,32545.0,1959,,0.5516,26.6329,,26/04/2022,0.5,50.77507522252889,Low,Satisfactory,2017-09-01,0.0757,36.6,22.1,57.6,6.263,0.633,0,32545.0,0,10.3904097522206,0,Unknow,0,0,0,0,0,1
SOAD07829,Flumevale,Yes,Water Supply,Earth,7.689,0.055,10729.130871068552,1905,,0.47477,2.66329,,31/05/2022,0.5,68.0761421559562,Low,Satisfactory,2017-09-01,0.058,66.7,11.8,26.2,7.689,0.055,0,,1,,0,Unknow,0,0,1,0,0,1
SOAD17496,Flumevale,Yes,Irrigation,Earth,6.594,0.057,3825.0,1935,1985S;1993H;1993S;2000M;2000S,0.20488,47.93922,Uncontrolled,24/05/2021,2,8.17,Significant,Fair,2021-05-24,0.1303,15.3,250.0,3.1,6.594,0.057,0,3825.0,0,8.2495751500002,5,2000,0,0,0,0,0,0
SOAD01018,Flumevale,Yes,Water Supply,Earth,6.462,0.45,6110.0,1939,,0.25019,51.55372959769142,Uncontrolled,08/06/2022,1,3.2,High,Unsatisfactory,2022-06-08,0.1258,445.5,564.2,40.0,6.462,0.45,0,6110.0,0,8.71784570489492,0,Unknow,0,0,0,1,0,0
SOAD13369,Flumevale,Yes,Flood Risk Reduction,Earth,11.801,0.262,52425.0,1958,,0.24428,29.29619,Uncontrolled,06/10/2020,3,25.82,Low,Fair,2018-10-25,0.0951,41.2,190.1,22.306704696140066,11.801,0.262,0,52425.0,0,10.8671579304571,0,Unknow,0,0,0,0,0,0
SOAD14763,Flumevale,Yes,Water Supply,Earth,12.732,0.167,59000.0,1953,,0.2758,2.66329,,01/12/2021,1,0.0,High,Satisfactory,2017-09-01,0.0924,635.4,521.7,33.9,12.732,0.167,0,59000.0,0,10.9853096718968,0,Unknow,0,0,0,0,0,0
SOAD02427,Flumevale,Yes,Irrigation,Earth,6.241,0.053,3500.0,1899,1970H;1970M;1970S,0.23837,44.284360391267015,Uncontrolled,09/08/2018,6,14.9,Low,Fair,2020-10-16,0.0751,46.9,403.4,42.1,6.241,0.053,0,3500.0,0,8.16080392095467,3,1970,0,0,0,1,0,0
SOAD11645,Flumevale,Yes,Irrigation,Earth,6.11,0.32,29282.0,1900,,0.38218,119.2578114295648,Uncontrolled,16/06/2022,6,1.58,Low,Unsatisfactory,2012-07-09,0.0887,617.9,206.7,24.6,6.11,0.32,0,29282.0,0,10.2847624218431,0,Unknow,0,0,0,1,0,0
SOAD13055,Flumevale,Yes,Water Supply,Earth,6.967,0.777,48331.0,1935,1956;1976;2004,0.24034,44.756829702068195,Uncontrolled,26/09/2022,1,3.22,High,Fair,2022-09-26,0.1194,13.8,427.8,45.9,6.967,0.777,0,48331.0,0,10.7858491461472,3,2004,0,0,0,1,0,0
SOAD16301,Flumevale,Yes,Irrigation,Earth,7.216,0.167,15330.454337892887,1954,,0.24231,7.98987,Uncontrolled,11/08/2020,6,21.11,Low,Fair,2019-07-30,0.0466,12.8,155.9,30.5,7.216,0.167,0,,1,,0,Unknow,0,0,1,0,0,0
SOAD00050,Flumevale,Yes,Fish and Wildlife Pond,Earth,11.541,0.167,11481.0,1912,,0.10905537188139905,7.98987,Uncontrolled,29/06/2017,10,17.46,Low,Not Rated,,0.0706,22.2,244.5,18.492434511646238,11.541,0.167,0,11481.0,0,9.34853587072758,0,Unknow,0,0,0,0,1,0
SOAD12201,Flumevale,Yes,Water Supply,Earth,13.818,0.16,58500.0,1960,,0.22064,2.66329,,10/02/2022,1,0.84,High,Satisfactory,2017-09-01,0.0882,45.1,701.2,28.3,13.818,0.16,0,58500.0,0,10.9767991270909,0,Unknow,0,0,0,0,0,0
SOAD11715,Flumevale,Yes,Water Supply,Earth,14.499,0.082,21600.0,1998,,0.2167,33.455400943281745,Uncontrolled,27/07/2021,2,38.83,Significant,Satisfactory,2021-07-27,0.1126,33.6,229.1,52.6,14.499,0.082,0,21600.0,0,9.98049488889691,0,Unknow,0,0,0,1,0,0
SOAD12458,Flumevale,No,"Fire Protection, Stock, Or Small Fish Pond",Earth,3.437,0.125,2467.0,1907,,0.7958652702920934,143.81766,Uncontrolled,29/09/2015,5,28.14415206547154,Significant,Not Rated,,0.0864,463.7,192.2,19.088517768322173,3.437,0.125,0,2467.0,0,7.81116338502528,0,Unknow,0,0,0,0,1,1
SOAD04460,Flumevale,Yes,Water Supply,Earth,6.461,1.912,16637.0,1925,2022,0.29156,149.65272816899719,Uncontrolled,19/05/2022,1,3.35,High,Satisfactory,2022-05-19,0.0947,370.5,323.2,54.2,6.461,1.912,0,16637.0,0,9.71944451484383,1,2022,0,0,0,1,0,0
SOAD14056,Flumevale,Yes,Water Supply,Earth,10.029,0.233,28355.6135708277,Unknow,,0.42749,7.98987,,09/12/2021,1,82.69595277889312,Significant,Satisfactory,2017-09-01,0.1333,35.6,69.6,30.7,10.029,0.233,0,,1,,0,Unknow,0,0,1,0,0,1
SOAD14509,Flumevale,Yes,Flood Risk Reduction,Earth,19.42,0.115,75065.0,1963,,0.14972,50.60251,Uncontrolled,15/09/2022,3,4.91,Low,Fair,2004-05-21,0.0851,21.7,96.9,14.288336543730171,19.42,0.115,0,75065.0,0,11.2261230055455,0,Unknow,0,0,0,0,0,0
SOAD18240,Flumevale,Yes,Recreation,Earth,14.572,0.293,64890.0,1938,2009,0.23246,173.11385,Uncontrolled,17/10/2022,2,37.43,Significant,Fair,2022-10-17,0.1369,26.6,222.5,6.3,14.572,0.293,0,64890.0,0,11.0804642181915,1,2009,0,0,0,0,0,0
SOAD18319,Flumevale,Yes,Irrigation,Earth,7.035,0.473,35764.0,1949,,0.20488,7.98987,,01/01/1998,0,25.23,Low,Fair,2019-07-30,0.0948,14.4,403.6,14.3,7.035,0.473,0,35764.0,0,10.4847250405425,0,Unknow,0,0,0,0,0,0
SOAD11165,Flumevale,Yes,Flood Risk Reduction,Earth,30.941,0.233,436000.0,1989,,0.13396,5.32658,,05/05/2022,1,0.0,High,Satisfactory,2017-09-01,0.0991,36.1,423.7,17.04500608701219,30.941,0.233,0,436000.0,0,12.9853998159065,0,Unknow,0,0,0,0,0,0
SOAD20139,Flumevale,Yes,Other,Earth,5.849,0.5027895189323229,36609.0,1981,1998,0.32308,393.293645387457,,23/10/2015,6,4.63,Low,Not Rated,,0.0459,159.5,151.7,19.147856012660565,5.849,3.175,0,36609.0,0,10.5080767061143,1,1998,0,1,0,1,0,0
SOAD05465,Flumevale,Yes,Flood Risk Reduction,Earth,14.805,0.3,85000.0,1954,,0.20488,37.28606,,09/03/2022,1,0.0,High,Satisfactory,2017-09-01,0.0949,34.1,513.1,18.619732754830746,14.805,0.3,0,85000.0,0,11.3504183001091,0,Unknow,0,0,0,0,0,0
SOAD14683,Flumevale,Yes,Water Supply,Earth,13.806,0.15,37429.56640418941,1915,,0.21079,21.30632,Uncontrolled,12/05/2021,6,14.63,Low,Satisfactory,2022-03-23,0.0489,40.9,276.1,41.7,13.806,0.15,0,,1,,0,Unknow,0,0,1,0,0,0
SOAD10639,Flumevale,Yes,Recreation,Earth,20.788,0.197,87059.12411241261,1959,,0.18124,45.27593,,14/12/2021,6,72.0,Low,Not Rated,,0.0763,17.0,220.2,5.6,20.788,0.197,0,,1,,0,Unknow,0,0,1,0,0,0
SOAD13278,Flumevale,Yes,Water Supply,Earth,12.096,0.092,21000.0,1956,,0.26398,44.49820752434869,,01/06/2022,1,1.16,High,Satisfactory,2017-09-01,0.0962,109.7,562.1,66.2,12.096,0.092,0,21000.0,0,9.95232533461943,0,Unknow,0,0,0,1,0,0
SOAD17658,Flumevale,Yes,Water Supply,Earth,21.022,0.212,51300.0,1991,,0.21473,33.71853114391901,,02/11/2021,1,3.33,High,Satisfactory,2017-09-01,0.0948,22.8,163.0,67.2,21.022,0.212,0,51300.0,0,10.8454655241463,0,Unknow,0,0,0,1,0,0
SOAD14712,Flumevale,Yes,Recreation,Earth,10.898,0.5,37781.0,1937,,0.22458,151.89459986460903,,17/05/2016,6,4.79,Low,Satisfactory,2022-10-06,0.0234,21.3,424.3,7.6,10.898,0.5,0,37781.0,0,10.5395880777168,0,Unknow,0,0,0,1,0,0
SOAD14250,Flumevale,Yes,Other,Earth,12.39,0.333,61000.0,1935,,0.50629,306.27835,,01/12/2021,1,0.0,High,Satisfactory,2017-09-01,0.0865,590.2,353.8,20.237584538519982,12.39,0.333,0,61000.0,0,11.0186455364637,0,Unknow,0,0,0,0,0,0
SOAD19510,Flumevale,Yes,Irrigation,Earth,9.069,0.47,74553.0,1900,2005,0.56342,7.98987,Uncontrolled,12/05/2022,1,1.63,High,Satisfactory,2022-05-12,0.1019,346.6,105.8,32.3,9.069,0.47,0,74553.0,0,11.2192789740184,1,2005,0,0,0,0,0,0
SOAD02726,Flumevale,Yes,Irrigation,Earth,7.063,0.15,13393.0,1966,,0.44128,62.402023029223514,,14/07/2020,6,38.5,Low,Not Rated,,0.0719,314.2,80.9,40.5,7.063,0.15,0,13393.0,0,9.50256212447,0,Unknow,0,0,0,1,0,0
SOAD19858,Flumevale,Yes,Irrigation,Earth,12.876,0.123,489.0,1996,2009,0.15366,7.98987,Uncontrolled,16/06/2020,2,30.8,Significant,Fair,2020-06-16,0.1678,45.4,163.8,39.2,12.876,0.123,0,489.0,0,6.19440539110467,1,2009,0,0,0,0,0,0
SOAD00841,Flumevale,Yes,Water Supply,Earth,42.238,0.157,279345.89297887497,1976,1997,0.0985,7.98987,Uncontrolled,29/06/2016,6,24.96,Low,Not Rated,,0.0379,44.3,377.7,61.7,42.238,0.157,0,,1,,1,1997,0,0,1,0,0,0
SOAD06031,Flumevale,Yes,Water Supply,Earth,4.393,1.667,75000.0,1951,,0.85695,7.98987,,15/06/2022,0.5,42.31099766111857,Low,Satisfactory,2017-09-01,0.063,347.5,13.7,36.8,4.393,1.667,0,75000.0,0,11.2252567257629,0,Unknow,0,0,0,0,0,1
SOAD12262,Flumevale,Yes,Irrigation,Earth,4.812,0.042,2642.0,1892,,0.34475,98.81444585917212,Uncontrolled,06/08/2015,6,17.94,Low,Fair,2021-05-14,0.0553,77.0,431.0,24.1,4.812,0.042,0,2642.0,0,7.87966991460429,0,Unknow,0,0,0,1,0,0
SOAD15916,Flumevale,Yes,Water Supply,Earth,24.088,0.388,96720.0,1970,,0.20685,7.98987,,11/05/2022,2,7.72,Significant,Satisfactory,2022-05-11,0.1031,39.5,148.5,55.9,24.088,0.388,0,96720.0,0,11.4795858243585,0,Unknow,0,0,0,0,0,0
SOAD00388,Flumevale,Yes,Fish and Wildlife Pond,Earth,13.984,0.24,43108.67438076616,1892,,0.14578,29.29619,Uncontrolled,12/05/2022,1,16.22,High,Unsatisfactory,2022-05-12,0.1442,24.2,180.3,22.669090543850558,13.984,0.24,0,,1,,0,Unknow,0,0,1,0,0,0
SOAD09753,Flumevale,Yes,Flood Risk Reduction,Earth,14.765,0.13,40000.0,1940,,0.24034,47.93922,,31/08/2022,0.5,51.32504462290693,Low,Satisfactory,2017-09-01,0.077,7.7,5.4,16.18553150118755,14.765,0.13,0,40000.0,0,10.5966597327836,0,Unknow,0,0,0,0,0,1
SOAD18754,Flumevale,Yes,Recreation,Earth,10.755,0.787,34463.0,1961,,0.16351,48.492694060603334,Uncontrolled,12/05/2022,1,0.0,High,Satisfactory,2022-05-12,0.0882,15.8,440.8,6.7,10.755,0.787,0,34463.0,0,10.4476705799561,0,Unknow,0,0,0,1,0,0
SOAD19086,Flumevale,Yes,Irrigation,Earth,7.391,0.388,49819.0,1961,,0.20488,52.94278249813595,,03/10/2022,6,26.95,Low,Satisfactory,2020-08-26,0.0284,28.1,205.2,11.3,7.391,0.388,0,49819.0,0,10.8161717888162,0,Unknow,0,0,0,1,0,0
SOAD04445,Flumevale,Yes,Water Supply,Earth,20.698,0.13,45000.0,1985,,0.18321,30.850386757563786,,12/04/2022,1,3.38,Significant,Satisfactory,2017-09-01,0.1219,30.7,913.8,28.0,20.698,0.13,0,45000.0,0,10.7144399907278,0,Unknow,0,0,0,1,0,0
SOAD00041,Flumevale,Yes,Water Supply,Earth,23.062,0.258,103377.90801930179,1937,,0.15169,42.61264,Uncontrolled,15/08/2016,6,57.12,Low,Fair,2022-09-15,0.0804,36.5,89.6,31.5,23.062,0.258,0,,1,,0,Unknow,0,0,1,0,0,0
SOAD05528,Flumevale,Yes,Irrigation,Earth,21.202,0.06,17314.0,1964,,0.15563,85.22528,Uncontrolled,11/10/2021,2,27.24,Significant,Unsatisfactory,2021-10-11,0.1765,38.4,286.9,20.3,21.202,0.06,0,17314.0,0,9.75932845683652,0,Unknow,0,0,0,0,0,0
SOAD14528,Flumevale,Yes,"Fire Protection, Stock, Or Small Fish Pond",Earth,10.12,0.167,81855.0,1904,,0.18321,32.725306148462565,Uncontrolled,01/08/2022,2,6.45,Significant,Fair,2022-08-01,0.1244,30.2,208.7,20.593980294581222,10.12,0.167,0,81855.0,0,11.3127168849385,0,Unknow,0,0,0,1,0,0
SOAD18415,Flumevale,Yes,Water Supply,Earth,38.481,0.247,331000.0,1954,,0.1182,5.32658,,01/09/2022,0.5,49.592960669854854,Low,Satisfactory,2017-09-01,0.0529,40.6,16.7,70.6,38.481,0.247,0,331000.0,0,12.7098766755027,0,Unknow,0,0,0,0,0,1
SOAD01116,Flumevale,Yes,Irrigation,Earth,7.919,0.358,112000.0,1908,1963S;2003H;2003S,0.27777,15.97974,Uncontrolled,20/04/2022,1,4.63,High,Satisfactory,2022-04-20,0.0942,444.6,802.5,9.1,7.919,0.358,0,112000.0,0,11.6262630788088,3,2003,0,0,0,0,0,0
SOAD17467,Flumevale,Yes,Water Supply,Earth,7.61,0.115,15343.0,1923,,0.394,34.62277,,22/06/2022,0.5,43.017211825062425,Low,Satisfactory,2017-09-01,0.0651,290.0,12.1,63.6,7.61,0.115,0,15343.0,0,9.63847979712322,0,Unknow,0,0,0,0,0,1
SOAD19645,Flumevale,Yes,Water Supply,Earth,21.785,0.158,62000.0,1957,,0.21079,2.66329,,15/02/2022,0.5,48.86568694254829,Low,Satisfactory,2017-09-01,0.0588,38.1,12.5,41.4,21.785,0.158,0,62000.0,0,11.0349057929294,0,Unknow,0,0,0,0,0,1
SOAD05847,Flumevale,Yes,Recreation,Earth,4.23,0.133,7243.0,1930,2005H,0.42749,91.22186111491186,Uncontrolled,28/06/2019,6,11.78,Low,Not Rated,,0.0408,308.3,362.2,6.5,4.23,0.133,0,7243.0,0,8.8879288190033,1,2005,0,0,0,1,0,0
SOAD05498,Flumevale,Yes,Water Supply,Earth,5.901,1.2,68131.69115377759,2012,,0.14775,48.20508249870671,Uncontrolled,14/07/2015,6,9.64,Low,Fair,2017-08-28,0.0637,33.4,109.5,45.8,5.901,1.2,0,,1,,0,Unknow,0,0,1,1,0,0
SOAD13290,Flumevale,No,Recreation,Earth,6.79,0.175,34136.99219060189,1928,,0.38218,1219.78682,Uncontrolled,31/05/2023,3,0.0,High,Fair,2023-05-31,0.0918,188.1,605.3,9.3,6.79,0.175,0,,1,,0,Unknow,0,0,1,0,0,0
SOAD11792,Flumevale,Yes,Irrigation,Earth,8.854,0.09,12089.0,1955,,0.2364,44.23063857300734,Uncontrolled,10/08/2021,2,19.18,Significant,Fair,2021-08-10,0.1513,32.7,282.0,38.0,8.854,0.09,0,12089.0,0,9.40013394360884,0,Unknow,0,0,0,1,0,0
SOAD20161,Flumevale,Yes,Fish and Wildlife Pond,Earth,7.554,0.433,43578.357656092645,1973,,0.38021,74.57212,,04/06/2010,6,11.1,Low,Not Rated,,0.0848,146.8,247.5,20.526443299020794,7.554,0.433,0,,1,,0,Unknow,0,0,1,0,0,0
SOAD01135,Flumevale,Yes,Water Supply,Earth,14.246,0.135,25900.0,1939,,0.29353,7.98987,,22/06/2022,0.5,51.540286934497985,Low,Satisfactory,2017-09-01,0.0792,59.3,10.8,29.1,14.246,0.135,0,25900.0,0,10.1620368569809,0,Unknow,0,0,0,0,0,1
SOAD20267,Flumevale,Yes,Irrigation,Earth,3.48,0.267,20882.867997876954,1907,,0.44128,21.30632,Uncontrolled,01/12/2022,6,18.39,Low,Not Rated,,0.0907,152.2,203.2,35.0,3.48,0.267,0,,1,,0,Unknow,0,0,1,0,0,0
SOAD03359,Flumevale,Yes,"Fire Protection, Stock, Or Small Fish Pond",Earth,11.701,0.052,10402.0,1968,,0.22852,350.23931445282017,Uncontrolled,10/06/2022,6,19.89,Low,Not Rated,,0.073,15.8,149.4,18.802177127957325,11.701,0.052,0,10402.0,0,9.24984950507089,0,Unknow,0,0,0,1,0,0
SOAD08742,Flumevale,Yes,Irrigation,Earth,12.047,0.103,400000.0,2008,,0.20094,109.19489,Uncontrolled,19/05/2021,6,35.48,Low,Fair,2021-02-02,0.048,29.0,70.0,14.8,12.047,0.103,0,400000.0,0,12.899222326087,0,Unknow,0,0,0,0,0,0
SOAD10169,Flumevale,Yes,Water Supply,Earth,6.66,0.283,23981.368141984694,1900,2005,0.55948,7.98987,Uncontrolled,12/05/2022,1,0.0,High,Satisfactory,2022-05-12,0.0893,164.4,826.1,30.2,6.66,0.283,0,,1,,1,2005,0,0,1,0,0,0
SOAD19227,Flumevale,Yes,Irrigation,Earth,7.582,0.6,46226.389951622456,1901,,0.51023,415.37003366189094,,16/05/2019,6,73.84,Low,Fair,2022-10-18,0.0561,70.6,60.5,18.1,7.582,0.6,0,,1,,0,Unknow,0,0,1,1,0,0
SOAD02035,Flumevale,Yes,Irrigation,Earth,5.428,0.367,35347.0,1885,,0.12805,50.60251,Uncontrolled,28/10/2016,6,7.95,Low,Fair,2017-10-19,0.0355,35.1,303.6,42.5,5.428,0.367,0,35347.0,0,10.4729970926379,0,Unknow,0,0,0,0,0,0
SOAD05006,Flumevale,Yes,Other,Earth,19.059,0.265,28836.0,1880,,0.66192,175.77714,,22/09/2021,1,4.76,High,Satisfactory,2017-09-01,0.0832,52.4,383.6,20.193724450957422,19.059,0.265,0,28836.0,0,10.2694145637968,0,Unknow,0,0,0,0,0,0
SOAD07460,Flumevale,Yes,Water Supply,Earth,30.673,0.233,24032.0,1965,,0.10244,74.57212,Uncontrolled,30/06/2022,1,10.73,High,Satisfactory,2022-06-30,0.0988,39.4,359.7,61.8,30.673,0.233,0,24032.0,0,10.0871831648832,0,Unknow,0,0,0,0,0,0
SOAD04167,Flumevale,Yes,Water Supply,Earth,8.39,0.33,29552.943132626147,1948,,0.40188,62.11508999776157,,10/09/2021,0.5,82.0627688832677,Low,Satisfactory,2017-09-01,0.0654,289.3,16.0,13.7,8.39,0.33,0,,1,,0,Unknow,0,0,1,1,0,1
SOAD01771,Flumevale,Yes,Water Supply,Earth,17.019,0.3,85700.0,1955,,0.23443,5.32658,,19/04/2022,0.5,53.74043695801809,Low,Satisfactory,2017-09-01,0.0697,27.7,11.1,21.9,17.019,0.3,0,85700.0,0,11.3586197731292,0,Unknow,0,0,0,0,0,1
SOAD05919,Flumevale,Yes,Flood Risk Reduction,Earth,12.577,0.718,99365.11172442803,1959,,0.2955,13.31645,Uncontrolled,20/07/2020,3,3.28,Low,Fair,2014-06-25,0.1001,133.5,187.4,18.397296718662055,12.577,0.718,0,,1,,0,Unknow,0,0,1,0,0,0
SOAD20282,Flumevale,Yes,Water Supply,Earth,30.056,0.225,201158.75138297369,1968,,0.13002,29.29619,Uncontrolled,09/08/2022,6,59.13,Low,Not Rated,,0.059,10.8,187.3,20.3,30.056,0.225,0,,1,,0,Unknow,0,0,1,0,0,0
SOAD16088,Flumevale,Yes,Irrigation,Earth,7.725,0.976,25318.0,1904,,0.32505,139.99627513715444,Uncontrolled,26/06/2017,6,7.8,Low,Not Rated,,0.0284,128.7,473.5,15.8,7.725,0.976,0,25318.0,0,10.1393103810074,0,Unknow,0,0,0,1,0,0
SOAD05374,Flumevale,Yes,Water Supply,Earth,5.534,2.0,90000.0,1975,,0.28565,78.63374642659275,,,1,1.3965181437700436,High,Not Rated,2022-03-18,0.1293,385.6,940.9,40.4,5.534,2.0,0,90000.0,0,11.4075760603618,0,Unknow,0,0,0,1,0,1
SOAD15959,Flumevale,Yes,Water Supply,Earth,5.634,0.083,130.0,1928,,0.56933,15.97974,,11/05/2021,1,24.787239181708816,Significant,Satisfactory,2017-09-01,0.1409,77.0,178.4,38.4,5.634,0.083,0,130.0,0,4.87519732320115,0,Unknow,0,0,0,0,0,1
SOAD05277,Flumevale,No,Recreation,Earth,5.067,0.167,14428.380174957247,1928,,0.38809,334.0764931035647,,31/05/2023,3,0.0,High,Fair,2023-05-31,0.1205,193.3,891.1,5.0,5.067,0.167,0,,1,,0,Unknow,0,0,1,1,0,0
SOAD08597,Flumevale,Yes,Flood Risk Reduction,Earth,17.476,0.21,81150.0,1964,,0.21079,58.59238,,05/04/2019,3,4.62,Low,Not Rated,,0.0983,9.1,314.4,13.524891846837757,17.476,0.21,0,81150.0,0,11.3040668957257,0,Unknow,0,0,0,0,0,0
SOAD13388,Flumevale,Yes,Irrigation,Earth,16.017,0.293,77958.0,1957,,0.20094,42.61264,Uncontrolled,14/06/2022,1,10.88,High,Fair,2022-06-14,0.1182,39.4,247.4,23.0,16.017,0.293,0,77958.0,0,11.2639383264484,0,Unknow,0,0,0,0,0,0
SOAD01468,Flumevale,Yes,Water Supply,Earth,36.684,0.29,331509.2696604025,1954,1984,0.10244,35.00132586313544,Uncontrolled,21/04/2022,1,0.0,High,Satisfactory,2022-04-21,0.1019,19.5,934.1,17.1,36.684,0.29,0,,1,,1,1984,0,0,1,1,0,0
SOAD04802,Flumevale,Yes,Irrigation,Earth,5.968,0.4,72525.0,1902,,0.38218,116.10034522317575,Uncontrolled,12/12/2008,6,17.55,Low,Satisfactory,2021-04-29,0.0452,538.6,98.1,15.8,5.968,0.4,0,72525.0,0,11.1917003972434,0,Unknow,0,0,0,1,0,0
SOAD01080,Flumevale,Yes,Water Supply,Earth,10.148,0.167,53000.0,Unknow,,0.27186,5.32658,,31/05/2022,0.5,47.22314122558946,Low,Satisfactory,2017-09-01,0.0708,642.4,16.7,38.2,10.148,0.167,0,53000.0,0,10.8780660602808,0,Unknow,0,0,0,0,0,1
SOAD08128,Flumevale,Yes,Water Supply,Earth,12.403,0.228,35142.0,1946,,0.31323,50.60251,,06/09/2022,1,0.79,High,Satisfactory,2017-09-01,0.1025,212.9,268.9,39.0,12.403,0.228,0,35142.0,0,10.4671807308916,0,Unknow,0,0,0,0,0,0
SOAD08562,Flumevale,Yes,Flood Risk Reduction,Earth,10.631,0.863,58396.889898832815,1963,,0.3349,37.28606,Uncontrolled,20/07/2020,3,20.11,Low,Fair,2016-06-24,0.0789,100.2,145.6,21.377059425743848,10.631,0.863,0,,1,,0,Unknow,0,0,1,0,0,0
SOAD03326,Flumevale,Yes,Irrigation,Earth,10.401,0.361,52821.0,1935,1955,0.41961,68.2154161031875,Uncontrolled,30/07/2015,6,38.97,Low,Satisfactory,2010-07-02,0.0323,202.0,196.2,36.7,10.401,0.361,0,52821.0,0,10.8746830495796,1,1955,0,0,0,1,0,0
SOAD01899,Flumevale,Yes,Irrigation,Earth,5.02,0.333,26669.0,1907,,0.43931,21.30632,Uncontrolled,01/12/2022,6,16.85,Low,Not Rated,,0.0622,334.6,308.7,32.2,5.02,0.333,0,26669.0,0,10.1912946171761,0,Unknow,0,0,0,0,0,0
SOAD01909,Flumevale,Yes,Flood Risk Reduction,Earth,15.1,0.39,88744.0,1979,,0.19306,13.31645,Uncontrolled,29/09/2021,3,0.0,High,Not Rated,,0.1439,13.2,226.6,17.98003978310315,15.1,0.39,0,88744.0,0,11.3935223677224,0,Unknow,0,0,0,0,0,0
SOAD15147,Flumevale,Yes,Irrigation,Earth,6.209,0.031,9915.625971691572,1891,2004,0.3349,7.98987,Uncontrolled,19/07/2022,6,18.12,Low,Fair,2019-09-13,0.0673,517.9,101.3,17.5,6.209,0.031,0,,1,,1,2004,0,0,1,0,0,0
SOAD20804,Flumevale,Yes,Fish and Wildlife Pond,Earth,8.153,0.467,48028.702586559724,1974,,0.36839,69.5439366729744,,31/08/2022,6,87.18,Low,Satisfactory,2022-11-21,0.0349,78.6,83.3,19.87243693234892,8.153,0.467,0,,1,,0,Unknow,0,0,1,1,0,0
SOAD02737,Flumevale,Yes,Water Supply,Earth,10.033,0.6,97800.0,1951,,0.38612,13.31645,,27/07/2022,1,0.16,High,Satisfactory,2017-09-01,0.1038,405.5,749.5,66.3,10.033,0.6,0,97800.0,0,11.4906900809195,0,Unknow,0,0,0,0,0,0
SOAD04717,Flumevale,Yes,Irrigation,Earth,5.354,0.087,10082.497214526473,1967,1989,0.24428,61.052609948061736,Uncontrolled,13/07/2015,6,8.25,Low,Not Rated,,0.0923,701.1,280.5,2.2,5.354,0.087,0,,1,,1,1989,0,0,1,1,0,0
SOAD14810,Flumevale,Yes,Irrigation,Earth,5.105,0.458,34378.0,1906,,0.33293,271.4779883848769,Uncontrolled,14/09/2022,2,0.0,Significant,Satisfactory,2022-09-14,0.1392,655.2,947.5,7.3,5.105,0.458,0,34378.0,0,10.4452011918355,0,Unknow,0,0,0,1,0,0
SOAD02498,Flumevale,Yes,Other,Earth,17.158,0.132,75000.0,1870,,0.50826,45.27593,,01/09/2022,1,0.0,High,Satisfactory,2017-09-01,0.0976,163.7,568.4,19.566326622885267,17.158,0.132,0,75000.0,0,11.2252567257629,0,Unknow,0,0,0,0,0,0
SOAD07912,Flumevale,Yes,Irrigation,Earth,12.282,0.083,27983.0,1940,,0.18518,32.78803144728339,Uncontrolled,22/09/2021,2,15.08,Significant,Satisfactory,2021-09-22,0.1238,27.2,108.4,47.1,12.282,0.083,0,27983.0,0,10.2393881972584,0,Unknow,0,0,0,1,0,0
SOAD12290,Flumevale,Yes,Water Supply,Earth,18.694,0.31,170000.0,1910,,0.15366,53.60501873346109,,17/03/2022,1,0.4837838827291197,High,Satisfactory,2017-09-01,0.1119,13.0,588.3,56.7,18.694,0.31,0,170000.0,0,12.043559598368,0,Unknow,0,0,0,1,0,1
SOAD05121,Flumevale,Yes,Irrigation,Earth,16.083,0.2,53215.0,1913,,0.30535,21.30632,Uncontrolled,26/05/2022,6,38.47,Low,Satisfactory,2021-06-08,0.0437,552.0,48.5,29.0,16.083,0.2,0,53215.0,0,10.8821143819927,0,Unknow,0,0,0,0,0,0
SOAD10608,Flumevale,Yes,Water Supply,Earth,20.193,0.077,63726.0,1936,,0.21079,18.64303,,31/08/2021,1,4.73,High,Satisfactory,2017-09-01,0.0886,43.8,556.0,31.1,20.193,0.077,0,63726.0,0,11.0623636136086,0,Unknow,0,0,0,0,0,0
SOAD01172,Flumevale,Yes,Irrigation,Earth,4.373,0.12,3674.0,1959,,0.45113,75.69378754930906,,23/07/2019,6,43.44,Low,Not Rated,,0.0813,394.2,201.8,19.1,4.373,0.12,0,3674.0,0,8.20930841164694,0,Unknow,0,0,0,1,0,0
SOAD13465,Flumevale,Yes,Irrigation,Earth,15.939,0.317,59393.0,1914,,0.0591,75.59830876658535,,22/03/2017,6,40.72,Low,Satisfactory,2021-09-09,0.0323,5.0,67.5,1.0,15.939,0.317,0,59393.0,0,10.9919484901479,0,Unknow,0,0,0,1,0,0
SOAD10287,Flumevale,Yes,"Fire Protection, Stock, Or Small Fish Pond",Earth,7.317,0.25,9771.0,1916,,0.13605914201659766,15.97974,Uncontrolled,05/09/2013,10,0.0,Low,Not Rated,,0.0681,24.4,948.4,17.447279432148754,7.317,0.25,0,9771.0,0,9.18727643237763,0,Unknow,0,0,0,0,1,0
SOAD05472,Flumevale,Yes,Water Supply,Earth,34.782,0.209,187000.0,1982,,0.13593,2.66329,,24/08/2022,0.5,52.223729889906224,Low,Satisfactory,2017-09-01,0.0699,28.1,14.6,32.0,34.782,0.209,0,187000.0,0,12.138869243416,0,Unknow,0,0,0,0,0,1
SOAD15277,Flumevale,Yes,Recreation,Earth,4.989,0.59,43534.25900225876,1896,,0.50629,496.1222576267551,,02/11/2015,6,15.62,Low,Satisfactory,2018-09-05,0.0403,467.3,380.1,7.8,4.989,0.59,0,,1,,0,Unknow,0,0,1,1,0,0
SOAD06173,Flumevale,Yes,Irrigation,Earth,10.989,0.619,63203.19464355976,1907,,0.26201,58.41317311852492,Uncontrolled,12/09/2022,2,8.0,Significant,Satisfactory,2022-09-12,0.1185,565.4,318.7,8.8,10.989,0.619,0,,1,,0,Unknow,0,0,1,1,0,0
SOAD11517,Flumevale,Yes,Irrigation,Earth,9.113,0.533,51347.197322072,1888,,0.2167,58.83941622163887,Uncontrolled,13/05/2020,6,6.21,Low,Not Rated,,0.0498,31.2,394.8,7.0,9.113,0.533,0,,1,,0,Unknow,0,0,1,1,0,0
SOAD01988,Flumevale,Yes,Hydroelectric,Earth,2.424,0.137,1800.0,1860,,0.28565,7.98987,Uncontrolled,28/06/2022,1,40.85,High,Satisfactory,2023-09-29,0.1148,690.4,127.5,47.7,2.424,0.137,0,1800.0,0,7.49609734517596,0,Unknow,0,0,0,0,0,0
SOAD05511,Flumevale,Yes,Water Supply,Earth,29.498,1.14,687722.3370405913,1994,,0.14184,81.88121719006193,Uncontrolled,18/05/2022,1,0.0,High,Satisfactory,2022-05-18,0.0996,40.5,276.9,38.8,29.498,1.14,0,,1,,0,Unknow,0,0,1,1,0,0
SOAD09640,Flumevale,Yes,Irrigation,Earth,8.868,0.167,30658.0,1888,2000S,0.29156,54.435183868457365,Uncontrolled,18/04/2022,2,6.5,Significant,Fair,2022-04-18,0.1456,506.4,100.2,6.7,8.868,0.167,0,30658.0,0,10.3306815361079,1,2000,0,0,0,1,0,0
SOAD10314,Flumevale,No,"Fire Protection, Stock, Or Small Fish Pond",Earth,2.832,0.237,19301.01397901375,1975,,0.12722439910233027,10.65316,Uncontrolled,31/08/2010,10,101.59320063340192,Low,Not Rated,,0.0618,21.9,21.1,20.523167222143385,2.832,0.237,0,,1,,0,Unknow,0,0,1,0,1,1
SOAD03709,Flumevale,Yes,Water Supply,Earth,9.505,0.35,75000.0,1940,,0.23837,44.86713049766566,,15/06/2022,0.5,49.46725138517322,Low,Satisfactory,2017-09-01,0.0636,21.6,5.0,64.0,9.505,0.35,0,75000.0,0,11.2252567257629,0,Unknow,0,0,0,1,0,1
SOAD03690,Flumevale,Yes,Other,Earth,24.003,0.528,105000.0,1996,,0.28565,52.29082229714501,Uncontrolled,24/05/1996,0,39.39,Low,Not Rated,,0.0759,710.9,143.6,18.565065210740826,24.003,0.528,0,105000.0,0,11.5617251529038,0,Unknow,0,0,0,1,0,0
SOAD12149,Flumevale,Yes,Water Supply,Earth,8.813,1.536,90894.69721776337,2009,,0.19897,39.71164984517474,Uncontrolled,14/07/2022,1,3.17,High,Satisfactory,2022-07-14,0.0878,34.8,785.0,28.6,8.813,1.536,0,,1,,0,Unknow,0,0,1,1,0,0
SOAD11324,Flumevale,Yes,Irrigation,Earth,2.835,0.617,32891.0,1879,,0.66783,98.84786449088485,Uncontrolled,21/04/2022,6,19.57,Low,Not Rated,,0.0652,406.6,218.1,20.1,2.835,0.617,0,32891.0,0,10.4009847460908,0,Unknow,0,0,0,1,0,0
SOAD08034,Flumevale,Yes,Irrigation,Earth,15.622,0.187,67.0,1957,,0.17336,21.30632,,01/07/2008,6,66.29,Low,Not Rated,,0.064,34.8,177.9,27.6,15.622,0.187,0,67.0,0,4.21950770517611,0,Unknow,0,0,0,0,0,0
SOAD15300,Flumevale,Yes,Irrigation,Earth,7.535,0.325,51552.0,1951,,0.12017,7.98987,,18/07/2013,6,15.93,Low,Not Rated,,0.0611,40.6,445.4,18.9,7.535,0.325,0,51552.0,0,10.8503656836781,0,Unknow,0,0,0,0,0,0
SOAD20539,Flumevale,Yes,Flood Risk Reduction,Earth,13.39,1.383,322000.0,2017,,0.20882,39.48786677502488,,17/02/2022,1,0.0,High,Satisfactory,2017-09-01,0.0853,24.9,858.5,20.008466918537128,13.39,1.383,0,322000.0,0,12.6823099301118,0,Unknow,0,0,0,1,0,0
SOAD00247,Flumevale,Yes,Hydroelectric,Earth,10.598,0.067,2000.0,1860,,0.26792,7.98987,,28/06/2022,1,38.89,High,Satisfactory,2023-09-29,0.0905,76.8,55.9,56.6,10.598,0.067,0,2000.0,0,7.60140233458373,0,Unknow,0,0,0,0,0,0
SOAD16647,Flumevale,Yes,Fish and Wildlife Pond,Earth,7.266,0.472,15133.0,1941,,0.36051,314.26822,Uncontrolled,01/01/2001,0,24.02,Low,Satisfactory,2020-10-13,0.0702,181.3,107.9,20.19399152625405,7.266,0.472,0,15133.0,0,9.62469914725447,0,Unknow,0,0,0,0,0,0
SOAD00134,Flumevale,Yes,Irrigation,Earth,14.346,0.297,28323.0,1957,,0.25807,44.34701513875792,,17/08/2016,6,27.85,Low,Not Rated,,0.0688,118.2,292.3,45.1,14.346,0.297,0,28323.0,0,10.2514647807717,0,Unknow,0,0,0,1,0,0
SOAD12737,Flumevale,Yes,Water Supply,Earth,23.749,0.163,85000.0,1940,,0.27974,26.6329,,07/01/2022,1,1.58,High,Satisfactory,2017-09-01,0.0916,31.2,943.8,35.8,23.749,0.163,0,85000.0,0,11.3504183001091,0,Unknow,0,0,0,0,0,0
SOAD04480,Flumevale,Yes,Irrigation,Earth,13.916,0.175,20118.0,1950,2001,0.17336,37.86451774595731,Uncontrolled,19/05/2021,6,33.97,Low,Not Rated,,0.0446,12.8,156.1,16.1,13.916,0.175,0,20118.0,0,9.90941992118924,1,2001,0,0,0,1,0,0
SOAD11855,Flumevale,Yes,Irrigation,Earth,5.701,0.527,40781.0,1906,,0.40188,956.12111,Uncontrolled,16/09/2016,6,26.1,Low,Fair,2022-10-06,0.0683,477.6,176.3,27.9,5.701,0.527,0,40781.0,0,10.6159960865747,0,Unknow,0,0,0,0,0,0
SOAD00599,Flumevale,Yes,Other,Earth,8.065,1.479,1765761.4822510788,1982,,0.23443,4745.3962348709765,,20/01/2022,0.5,81.670156176041,Low,Satisfactory,2017-09-01,0.06,35.7,23.5,18.326052955431674,8.065,1.479,0,,1,,0,Unknow,0,0,1,1,0,1
SOAD01171,Flumevale,Yes,Water Supply,Earth,17.027,0.15,74000.0,1992,,0.29747,5.32658,,31/08/2021,0.5,45.72669799089287,Low,Satisfactory,2017-09-01,0.064,597.9,18.6,12.1,17.027,0.15,0,74000.0,0,11.2118338856085,0,Unknow,0,0,0,0,0,1
SOAD14307,Flumevale,Yes,Water Supply,Earth,10.614,0.617,150000.0,2011,,0.21079,5.32658,,15/11/2022,1,5.84,High,Fair,2021-01-08,0.122,5.3,328.5,43.9,10.614,0.617,0,150000.0,0,11.9183972397228,0,Unknow,0,0,0,0,0,0
SOAD05281,Flumevale,Yes,Irrigation,Earth,8.096,0.123,10400.0,1909,1985H;1985M;1985S,0.31717,7.98987,Uncontrolled,20/10/2021,1,14.95,High,Fair,2021-10-20,0.0964,644.8,405.4,3.9,8.096,0.123,0,10400.0,0,9.24965723435313,3,1985,0,0,0,0,0,0
SOAD01414,Flumevale,Yes,Irrigation,Earth,7.597,0.16,9880.0,1894,1956,0.3349,57.94181773097375,Uncontrolled,08/07/2021,6,15.99,Low,Unsatisfactory,2004-05-21,0.0885,660.3,417.9,6.2,7.597,0.16,0,9880.0,0,9.19836900019496,1,1956,0,0,0,1,0,0
SOAD09758,Flumevale,Yes,Water Supply,Earth,15.109,0.162,150000.0,1966,,0.33687,51.82012113467787,,24/02/2022,1,0.66,High,Satisfactory,2017-09-01,0.0895,276.3,466.3,16.9,15.109,0.162,0,150000.0,0,11.9183972397228,0,Unknow,0,0,0,1,0,0
SOAD05370,Flumevale,Yes,Water Supply,Earth,12.166,0.178,40148.57803650974,1955,2014,0.23837,77.23541,Uncontrolled,23/08/2018,6,15.77,Low,Satisfactory,2019-10-10,0.036,11.3,175.2,50.6,12.166,0.178,0,,1,,1,2014,0,0,1,0,0,0
SOAD18528,Flumevale,Yes,Water Supply,Earth,22.513,0.088,40000.0,1954,,0.18518,2.66329,,03/05/2022,1,0.0,Significant,Satisfactory,2017-09-01,0.1056,36.3,740.0,62.7,22.513,0.088,0,40000.0,0,10.5966597327836,0,Unknow,0,0,0,0,0,0
SOAD04396,Flumevale,Yes,Irrigation,Earth,7.706,0.35,30864.66736134539,1922,,0.32308,58.5481990686635,Uncontrolled,22/06/2022,2,0.0,Significant,Satisfactory,2022-06-22,0.1212,238.3,291.0,18.0,7.706,0.35,0,,1,,0,Unknow,0,0,1,1,0,0
SOAD12987,Flumevale,Yes,Other,Earth,7.935,1.494,1713000.0,1999,,0.25019,1424.3658154869229,,24/02/2022,0.5,6.47,Low,Satisfactory,2017-09-01,0.0507,409.0,203.4,18.756012085012745,7.935,1.494,0,1713000.0,0,14.3537573610772,0,Unknow,0,0,0,1,0,0
SOAD01960,Flumevale,Yes,Irrigation,Earth,7.91,0.096,5550.0,1896,1985H;1985M;1985S,0.34475,7.98987,Uncontrolled,20/10/2021,1,15.66,High,Satisfactory,2021-10-20,0.0937,300.9,156.5,30.5,7.91,0.096,0,5550.0,0,8.62173337069016,3,1985,0,0,0,0,0,0
SOAD18408,Flumevale,Yes,Irrigation,Earth,37.687,0.6296496764130082,1545486.2616040166,1900,,0.17533,608.6514703058804,,09/09/1985,0,17.92,Low,Not Rated,,0.0981,34.2,438.7,21.8,37.687,,1,,1,,0,Unknow,0,1,1,1,0,0
SOAD20710,Flumevale,Yes,Water Supply,Earth,20.611,0.3,790.0,1968,,0.29156,46.81974590791076,Uncontrolled,20/10/2022,1,5.02,High,Fair,2022-10-20,0.098,71.5,333.5,58.8,20.611,0.3,0,790.0,0,6.67329796776765,0,Unknow,0,0,0,1,0,0
SOAD19250,Flumevale,Yes,Water Supply,Earth,11.602,0.153,28000.0,1959,,0.39597,53.2658,,13/04/2022,0.5,46.40897480817005,Low,Satisfactory,2017-09-01,0.0719,48.1,7.2,64.3,11.602,0.153,0,28000.0,0,10.2399955028053,0,Unknow,0,0,0,0,0,1
SOAD00682,Flumevale,Yes,Irrigation,Earth,6.059,0.263,11750.0,Unknow,,0.50038,945.46795,Uncontrolled,15/09/2016,6,28.03,Low,Fair,2018-09-21,0.0615,508.4,138.4,27.3,6.059,0.263,0,11750.0,0,9.37169362233394,0,Unknow,0,0,0,0,0,0
SOAD04997,Flumevale,Yes,Water Supply,Earth,19.898,0.21,70000.0,1923,,0.2561,7.98987,,15/09/2022,1,13.52,High,Fair,2012-05-10,0.1023,132.9,241.2,53.4,19.898,0.21,0,70000.0,0,11.1562648066437,0,Unknow,0,0,0,0,0,0
SOAD13368,Flumevale,Yes,Water Supply,Earth,15.571,0.322,83000.0,1962,,0.31914,5.32658,,31/08/2021,0.5,49.5727871312148,Low,Satisfactory,2017-09-01,0.0696,326.9,15.4,61.5,15.571,0.322,0,83000.0,0,11.3266079348989,0,Unknow,0,0,0,0,0,1
SOAD02511,Flumevale,Yes,Flood Risk Reduction,Earth,14.294,0.796,82630.01397153812,1959,,0.26398,29.29619,,15/10/2020,3,5.04,Low,Not Rated,,0.0868,707.6,214.0,22.321331479982664,14.294,0.796,0,,1,,0,Unknow,0,0,1,0,0,0
SOAD08876,Flumevale,Yes,Irrigation,Earth,6.431,0.6,1100.0,1920,,0.30535,120.50871537638098,,22/04/2021,6,4.81,Low,Fair,2020-06-30,0.0659,141.1,891.9,23.1,6.431,0.6,0,1100.0,0,7.00397413672268,0,Unknow,0,0,0,1,0,0
SOAD16257,Flumevale,Yes,Irrigation,Earth,12.227,0.085,12335.0,1952,,0.20488,7.98987,Uncontrolled,31/07/2017,6,31.04,Low,Satisfactory,2006-10-13,0.0476,20.6,184.6,26.5,12.227,0.085,0,12335.0,0,9.42027709580311,0,Unknow,0,0,0,0,0,0
SOAD05045,Flumevale,Yes,Water Supply,Earth,20.539,0.693,195000.0,1995,,0.197,127.5350022790044,Uncontrolled,03/05/2022,1,4.91,High,Satisfactory,2022-05-03,0.0708,43.3,691.9,5.8,20.539,0.693,0,195000.0,0,12.1807599657379,0,Unknow,0,0,0,1,0,0
SOAD04959,Flumevale,Yes,Irrigation,Earth,13.23,0.237,50431.0,1970,,0.16745,15.97974,Uncontrolled,24/03/2022,1,0.0,High,Satisfactory,2022-03-24,0.1075,7.1,276.9,4.4,13.23,0.237,0,50431.0,0,10.8283811732176,0,Unknow,0,0,0,0,0,0
SOAD16002,Flumevale,Yes,Flood Risk Reduction,Earth,23.985,0.5,196931.0,1928,,2.92939,23.96961,,16/11/2021,1,0.47,High,Satisfactory,2017-09-01,0.1077,828.0,829.5,18.68644226179864,23.985,0.5,0,196931.0,0,12.1906137704676,0,Unknow,0,0,0,0,0,0
SOAD03374,Flumevale,Yes,Water Supply,Earth,7.28,0.217,7167.0,1949,,0.46492,7.98987,,26/08/2020,6,24.3,Low,Fair,2018-08-23,0.0521,401.8,186.6,52.2,7.28,0.217,0,7167.0,0,8.87738195465477,0,Unknow,0,0,0,0,0,0
SOAD09631,Flumevale,Yes,Irrigation,Earth,6.457,1.652,109583.52467659922,2018,,0.33884,178.2398526510669,Uncontrolled,22/06/2022,1,1.612277431357755,High,Satisfactory,2022-06-22,0.0902,683.4,742.0,47.4,6.457,1.652,0,,1,,0,Unknow,0,0,1,1,0,1
SOAD07260,Flumevale,Yes,Recreation,Earth,15.311,0.284,79029.0,1979,,0.3743,86.47760382776899,,20/10/2022,2,103.96,Significant,Fair,2022-10-20,0.1368,523.4,228.1,8.5,15.311,0.284,0,79029.0,0,11.277582806199,0,Unknow,0,0,0,1,0,0
SOAD12573,Flumevale,Yes,Water Supply,Earth,7.26,0.15,7910.0,1923,,1.03622,101.20502,,25/05/2022,0.5,5.53,Low,Satisfactory,2017-09-01,0.0662,587.6,271.9,5.9,7.26,0.15,0,7910.0,0,8.9760094750214,0,Unknow,0,0,0,0,0,0
SOAD05947,Flumevale,Yes,Water Supply,Earth,18.659,0.767,300000.0,1988,,0.20882,45.67399032744718,,22/04/2022,1,1.69,High,Satisfactory,2017-09-01,0.0993,13.0,589.5,10.5,18.659,0.767,0,300000.0,0,12.6115410869661,0,Unknow,0,0,0,1,0,0
SOAD17469,Flumevale,Yes,Flood Risk Reduction,Earth,13.251,1.033,197000.0,1994,,0.31914,53.2658,,10/03/2022,1,0.0,High,Satisfactory,2017-09-01,0.0698,305.6,397.7,19.596850189126062,13.251,1.033,0,197000.0,0,12.1909640838494,0,Unknow,0,0,0,0,0,0
SOAD01970,Flumevale,Yes,Irrigation,Earth,10.412,0.09,23429.045831138188,1928,,0.27974,74.57212,Uncontrolled,21/09/2021,2,48.66,Significant,Fair,2021-09-21,0.1256,482.3,76.2,20.9,10.412,0.09,0,,1,,0,Unknow,0,0,1,0,0,0
SOAD07491,Flumevale,Yes,Irrigation,Earth,9.692,0.407,41383.9374069343,1942,1998;1998S,0.40188,114.52147,,01/07/2005,4,3.33,Significant,Not Available,,0.1555,152.6,923.7,41.6,9.692,0.407,0,,1,,2,1998,0,0,1,0,0,0
SOAD02171,Flumevale,Yes,Water Supply,Earth,10.103,0.36,40000.0,1918,,0.44128,37.28606,,22/06/2022,1,23.060968666963422,Significant,Satisfactory,2017-09-01,0.118,642.1,125.3,43.1,10.103,0.36,0,40000.0,0,10.5966597327836,0,Unknow,0,0,0,0,0,1
SOAD12216,Flumevale,No,Fish and Wildlife Pond,Earth,4.673,1.296983983797792,753600.284916979,1911,,1.1025267257655789,1204.8286064840604,,06/07/2023,Unknow,75.02910657188453,Significant,Not Available,,0.1511,299.9,89.9,19.318365617983968,4.673,,1,,1,,0,Unknow,0,1,1,1,1,1
SOAD14179,Flumevale,Yes,Irrigation,Earth,13.406,0.208,84126.0,1959,,0.1379,13.31645,,20/08/2021,6,22.35,Low,Satisfactory,2021-04-22,0.0433,5.0,217.4,40.0,13.406,0.208,0,84126.0,0,11.34008284081,0,Unknow,0,0,0,0,0,0
SOAD07737,Flumevale,Yes,Water Supply,Earth,34.222,0.317,450000.0,1996,,0.10835,55.84467871935101,Uncontrolled,19/05/2022,1,9.44,High,Satisfactory,2022-05-19,0.1033,10.4,413.8,31.5,34.222,0.317,0,450000.0,0,13.0170050839663,0,Unknow,0,0,0,1,0,0
SOAD12846,Flumevale,Yes,Irrigation,Earth,8.195,0.321,27996.415629175186,1947,,0.44325,114.52147,,15/10/2010,6,25.34,Low,Satisfactory,2021-05-25,0.0321,57.4,239.3,13.3,8.195,0.321,0,,1,,0,Unknow,0,0,1,0,0,0
SOAD12938,Flumevale,Yes,Irrigation,Earth,12.286,0.1,32091.897101589584,1894,,0.19109,7.98987,Uncontrolled,13/10/2022,1,3.11,High,Fair,2022-10-13,0.1251,15.2,115.2,22.6,12.286,0.1,0,,1,,0,Unknow,0,0,1,0,0,0
SOAD00639,Flumevale,Yes,Flood Risk Reduction,Earth,13.632,0.609,80239.5464705737,1973,,0.38415,21.30632,Uncontrolled,07/10/2021,3,4.7,Significant,Satisfactory,2021-10-07,0.1185,39.3,601.2,19.34482198052205,13.632,0.609,0,,1,,0,Unknow,0,0,1,0,0,0
SOAD15796,Flumevale,Yes,Water Supply,Earth,18.382,0.235,63900.0,1957,,0.2167,135.82779,,28/06/2022,0.5,48.05147703655428,Low,Satisfactory,2017-09-01,0.0802,44.2,9.9,60.4,18.382,0.235,0,63900.0,0,11.0650902896954,0,Unknow,0,0,0,0,0,1
SOAD15643,Flumevale,Yes,Recreation,Earth,13.962,0.145,33067.0,1969,,0.31126,21.30632,Uncontrolled,23/07/2019,6,61.61,Low,Not Rated,,0.0759,100.8,72.4,5.9,13.962,0.145,0,33067.0,0,10.4063213263726,0,Unknow,0,0,0,0,0,0
SOAD20183,Flumevale,Yes,Other,Earth,20.324,0.24,130000.0,1930,,0.2364,197.08346,,19/01/2023,1,0.0,High,Fair,2019-08-30,0.1011,33.0,288.1,17.57868517006369,20.324,0.24,0,130000.0,0,11.7752974217158,0,Unknow,0,0,0,0,0,0
SOAD04451,Flumevale,Yes,Irrigation,Earth,6.743,0.23,14930.0,1900,1990,0.51614,1018.8450226657326,Uncontrolled,29/07/2022,1,15.7,High,Fair,2022-07-29,0.1078,480.6,287.4,12.3,6.743,0.23,0,14930.0,0,9.61119486752666,1,1990,0,0,0,1,0,0
SOAD17796,Flumevale,Yes,Water Supply,Earth,20.645,0.172,49500.0,1967,,0.27777,34.62277,,05/04/2022,1,18.42,High,Satisfactory,2017-09-01,0.1077,169.1,270.9,39.3,20.645,0.172,0,49500.0,0,10.8097481503729,0,Unknow,0,0,0,0,0,0
SOAD11411,Flumevale,Yes,Water Supply,Earth,7.72,0.392,36700.0,1900,,0.67965,135.82779,,29/06/2022,0.5,41.92120698009484,Low,Satisfactory,2017-09-01,0.0754,498.2,5.1,32.5,7.72,0.392,0,36700.0,0,10.5105592816278,0,Unknow,0,0,0,0,0,1
SOAD16902,Flumevale,Yes,Irrigation,Earth,2.75,0.15,3437.0,1944,,0.3546,86.68185038061374,Uncontrolled,14/05/2021,6,20.13,Low,Not Rated,,0.1046,626.7,406.6,42.2,2.75,0.15,0,3437.0,0,8.1426451859428,0,Unknow,0,0,0,1,0,0
SOAD11798,Flumevale,Yes,Water Supply,Earth,14.172,0.513,43705.0,1972,,0.34081,2.66329,,28/01/2022,1,3.22,High,Satisfactory,2017-09-01,0.0759,237.5,505.5,10.7,14.172,0.513,0,43705.0,0,10.6852406714301,0,Unknow,0,0,0,0,0,0
SOAD11854,Flumevale,Yes,Flood Risk Reduction,Earth,12.803,0.357,53475.10489817817,1964,,0.39203,15.97974,Uncontrolled,10/05/2022,3,3.28,Significant,Satisfactory,2022-05-10,0.1326,401.7,250.9,17.95509730584551,12.803,0.357,0,,1,,0,Unknow,0,0,1,0,0,0
SOAD07269,Flumevale,Yes,Water Supply,Earth,4.047,0.103,10089.225777303564,Unknow,,0.73481,45.27593,,18/11/2021,0.5,57.81548804335637,Low,Satisfactory,2017-09-01,0.0635,344.2,13.2,44.8,4.047,0.103,0,,1,,0,Unknow,0,0,1,0,0,1
SOAD09588,Flumevale,No,"Fire Protection, Stock, Or Small Fish Pond",Earth,3.504,0.412,30014.487699559722,1980,,0.1306957859891493,34.62277,Controlled,31/08/2010,10,83.5319578858472,Low,Not Rated,,0.0461,11.0,23.5,22.30075474197045,3.504,0.412,0,,1,,0,Unknow,0,0,1,0,1,1
SOAD00714,Flumevale,Yes,Recreation,Earth,13.748,0.433,74387.42337867939,1952,,0.27974,47.93922,,11/10/2017,6,10.89,Low,Satisfactory,2022-07-11,0.0442,320.1,100.7,3.8,13.748,0.433,0,,1,,0,Unknow,0,0,1,0,0,0
SOAD06335,Flumevale,Yes,Irrigation,Earth,9.432,0.363,37826.72152633546,1903,,0.394,61.72065741477916,Controlled,20/04/2022,2,16.57,Significant,Not Rated,,0.1474,305.5,372.1,23.6,9.432,0.363,0,,1,,0,Unknow,0,0,1,1,0,0
SOAD19452,Flumevale,Yes,Fish and Wildlife Pond,Earth,10.355,1.333,785.0,1964,,0.38218,225.06931600646305,,05/11/2020,6,1.58,Low,Satisfactory,2018-10-05,0.0514,673.4,187.0,20.616675200856587,10.355,1.333,0,785.0,0,6.66695679242921,0,Unknow,0,0,0,1,0,0
SOAD02194,Flumevale,Yes,Water Supply,Earth,6.837,0.5,61460.0,1969,,0.4728,136.95253310504526,,19/07/2021,6,24.88,Low,Satisfactory,2017-06-26,0.0475,583.5,101.3,44.9,6.837,0.5,0,61460.0,0,11.0261581062973,0,Unknow,0,0,0,1,0,0
SOAD05739,Flumevale,Yes,Water Supply,Earth,25.849,0.117,57000.0,1928,,0.17927,29.29619,,16/06/2022,1,10.12,Significant,Satisfactory,2017-09-01,0.1247,13.1,163.6,12.8,25.849,0.117,0,57000.0,0,10.9508240905224,0,Unknow,0,0,0,0,0,0
SOAD16541,Flumevale,Yes,Flood Risk Reduction,Earth,11.729,0.333,60990.0,1965,,0.3152,74.57212,,11/04/2018,3,37.94,Low,Not Rated,,0.1068,187.8,157.1,17.942034081240628,11.729,0.333,0,60990.0,0,11.0184815912866,0,Unknow,0,0,0,0,0,0
SOAD16699,Flumevale,Yes,Irrigation,Earth,4.744,0.433,40750.0,1949,,0.3743,114.0319834392841,,23/07/1980,6,16.67,Low,Not Rated,,0.0473,362.7,301.1,30.1,4.744,0.433,0,40750.0,0,10.6152356582452,0,Unknow,0,0,0,1,0,0
SOAD17842,Flumevale,Yes,Irrigation,Earth,14.256,0.193,58000.0,1912,1953,0.16154,32.78803144728339,Uncontrolled,29/08/2022,1,12.28,High,Fair,2022-08-29,0.1264,6.2,165.2,35.5,14.256,0.193,0,58000.0,0,10.9682155307592,1,1953,0,0,0,1,0,0
SOAD19949,Flumevale,Yes,Other,Earth,20.537,0.281,145000.0,1949,,0.23837,81.71542564168305,,13/06/2022,1,0.7425954178313655,High,Satisfactory,2017-09-01,0.11,37.5,620.8,17.052007188227822,20.537,0.281,0,145000.0,0,11.8844959179307,0,Unknow,0,0,0,1,0,1
SOAD20059,Flumevale,Yes,Fish and Wildlife Pond,Earth,6.422,0.1,10132.820776630806,1879,,0.2955,50.39415767335895,Uncontrolled,08/10/2021,2,35.22,Significant,Satisfactory,2021-10-08,0.1259,667.1,108.9,17.41185617924411,6.422,0.1,0,,1,,0,Unknow,0,0,1,1,0,0
SOAD16103,Flumevale,Yes,Irrigation,Earth,3.19,1.417180736807853,1566226.7452083468,2016,,0.32899,1753.7665731770942,,,0,89.47832030949742,Low,Not Rated,,0.0646,495.7,16.7,18.9,3.19,,1,,1,,0,Unknow,0,1,1,1,0,1
SOAD13305,Flumevale,Yes,Irrigation,Earth,9.592,0.085,15603.0,1953,,0.29156,15.97974,Uncontrolled,24/06/2022,1,13.76,High,Fair,2022-06-24,0.1202,230.4,182.5,11.7,9.592,0.085,0,15603.0,0,9.65528257062655,0,Unknow,0,0,0,0,0,0
SOAD15925,Flumevale,Yes,Water Supply,Earth,18.098,0.4,206500.0,1980,,0.15957,53.53713165090252,,26/10/2021,1,0.16,High,Satisfactory,2017-09-01,0.0875,9.9,449.3,50.9,18.098,0.4,0,206500.0,0,12.2380605339865,0,Unknow,0,0,0,1,0,0
SOAD17166,Flumevale,Yes,Water Supply,Earth,35.464,0.173,8243.0,1924,,0.13199,42.61264,Uncontrolled,19/07/2022,1,23.38,High,Satisfactory,2022-07-19,0.0918,22.3,223.9,36.6,35.464,0.173,0,8243.0,0,9.01724094201035,0,Unknow,0,0,0,0,0,0
SOAD13186,Flumevale,Yes,Irrigation,Earth,20.238,0.083,33500.0,1956,,0.25413,175.77714,,02/08/2022,6,18.79,Low,Satisfactory,2021-11-12,0.0351,313.4,168.7,12.1,20.238,0.083,0,33500.0,0,10.4193305681139,0,Unknow,0,0,0,0,0,0
SOAD11660,Flumevale,Yes,Water Supply,Earth,4.515,0.347,10700.0,1941,,1.15048,7.98987,,16/06/2022,0.5,50.1080327193222,Low,Satisfactory,2017-09-01,0.0774,77.9,8.1,41.4,4.515,0.347,0,10700.0,0,9.278092474027,0,Unknow,0,0,0,0,0,1
SOAD05742,Flumevale,Yes,"Fire Protection, Stock, Or Small Fish Pond",Earth,7.672,0.22,30759.0,1914,,0.52205,793.66042,Uncontrolled,12/06/2023,1,6.26,High,Unsatisfactory,2023-07-07,0.1386,295.8,255.0,16.403634883825784,7.672,0.22,0,30759.0,0,10.3339704236196,0,Unknow,0,0,0,0,0,0
SOAD08175,Flumevale,Yes,Water Supply,Earth,23.234,1.275,508000.0,1959,,0.18124,69.88251546350116,,20/01/2022,1,0.8122284091715982,High,Satisfactory,2017-09-01,0.0782,38.4,540.4,21.9,23.234,1.275,0,508000.0,0,13.1382386950626,0,Unknow,0,0,0,1,0,1
SOAD11871,Flumevale,Yes,Recreation,Earth,22.233,0.25,195699.4796254067,1973,,0.28171,122.94026267123525,Uncontrolled,06/04/2022,1,0.0,High,Satisfactory,2022-04-06,0.0919,201.7,247.1,5.6,22.233,0.25,0,,1,,0,Unknow,0,0,1,1,0,0
SOAD18421,Flumevale,Yes,Irrigation,Earth,5.703,0.333,28733.0,1973,2001H;2001S,0.36642,85.38026748051672,Uncontrolled,02/09/2021,2,1.64,Significant,Satisfactory,2021-09-02,0.0999,50.1,122.0,29.1,5.703,0.333,0,28733.0,0,10.2658363695707,2,2001,0,0,0,1,0,0
SOAD18457,Flumevale,Yes,Recreation,Earth,6.938,0.467,35557.0,1909,,0.43537,90.07222293670486,Uncontrolled,22/06/2022,2,1.54,Significant,Satisfactory,2022-06-22,0.1334,658.0,314.2,5.8,6.938,0.467,0,35557.0,0,10.4789204450765,0,Unknow,0,0,0,1,0,0
SOAD09682,Flumevale,Yes,Irrigation,Earth,5.145,0.17,15161.188671617632,1923,,0.38809,84.41791020851319,Uncontrolled,18/08/2020,2,16.77,Significant,Fair,2020-08-18,0.1305,496.0,215.7,36.8,5.145,0.17,0,,1,,0,Unknow,0,0,1,1,0,0
SOAD01711,Flumevale,Yes,Irrigation,Earth,12.315,0.2,23360.0,1899,1960H;1960M;1960S;1975S;1989H;1989M;1989S,0.34672,73.7840963169376,Uncontrolled,21/10/2021,1,13.5,High,Fair,2021-10-21,0.0984,198.7,231.5,12.1,12.315,0.2,0,23360.0,0,10.0588232442451,7,1989,0,0,0,1,0,0
SOAD04217,Flumevale,Yes,Water Supply,Earth,4.387,0.033,2033.0,1903,,0.41764,73.4879452610634,,20/08/2015,6,4.99,Low,Not Rated,,0.1001,295.0,443.8,28.3,4.387,0.033,0,2033.0,0,7.61775957660851,0,Unknow,0,0,0,1,0,0
SOAD11851,Flumevale,Yes,"Fire Protection, Stock, Or Small Fish Pond",Earth,3.467,0.43,40392.67207119666,1904,,0.76239,95.98585835926136,,25/09/2017,6,33.13,Low,Not Rated,,0.073,260.1,138.5,21.81829095061145,3.467,0.43,0,,1,,0,Unknow,0,0,1,1,0,0
SOAD13273,Flumevale,Yes,Irrigation,Earth,8.961,0.457,49994.48176602119,1907,,0.30141,60.963814291025884,Uncontrolled,08/10/2021,2,18.73,Significant,Fair,2021-10-08,0.1403,687.3,424.9,1.1,8.961,0.457,0,,1,,0,Unknow,0,0,1,1,0,0
SOAD05868,Flumevale,Yes,Water Supply,Earth,7.058,0.16,17865.0,1942,1997H;2000S,0.45901,7.98987,Uncontrolled,04/08/2022,1,14.18,High,Satisfactory,2022-08-04,0.1021,636.6,227.4,55.2,7.058,0.16,0,17865.0,0,9.79065474426178,2,2000,0,0,0,0,0,0
SOAD04450,Flumevale,Yes,Fish and Wildlife Pond,Earth,4.943,0.13,3650.0,1888,,0.34869,63.76168174122316,Uncontrolled,10/09/2021,2,46.48,Significant,Satisfactory,2021-09-10,0.1415,60.8,196.2,19.803582070820067,4.943,0.13,0,3650.0,0,8.20275638165564,0,Unknow,0,0,0,1,0,0
SOAD14540,Flumevale,No,Irrigation,Earth,3.099,0.323,22604.843310746175,1980,,0.3728649488644441,66.58225,Controlled,31/08/2010,10,88.14601964366155,Low,Not Rated,,0.0582,16.4,6.2,44.5,3.099,0.323,0,,1,,0,Unknow,0,0,1,0,1,1
SOAD13783,Flumevale,Yes,Water Supply,Earth,59.24,0.267,479500.0,1963,,0.12017,114.74603241732864,,07/01/2022,1,2.41,High,Satisfactory,2017-09-01,0.1001,35.4,176.4,42.8,59.24,0.267,0,479500.0,0,13.0805012588092,0,Unknow,0,0,0,1,0,0
SOAD03730,Flumevale,Yes,Fish and Wildlife Pond,Earth,5.124,0.125,10577.599256483041,1940,,0.51811,151.80753,Uncontrolled,07/06/2022,2,61.88,Significant,Fair,2022-06-07,0.1586,81.7,97.6,19.05781515673805,5.124,0.125,0,,1,,0,Unknow,0,0,1,0,0,0
SOAD19194,Flumevale,Yes,Water Supply,Earth,13.219,0.12,21357.0,1955,,0.27186,7.98987,,24/07/2015,6,80.06,Low,Fair,2007-06-14,0.0401,212.9,97.7,59.5,13.219,0.12,0,21357.0,0,9.96918165573149,0,Unknow,0,0,0,0,0,0
SOAD05436,Flumevale,Yes,Flood Risk Reduction,Earth,5.056,0.467,43142.02785556341,1942,1973;1973S,0.73284,66.58225,,01/07/1983,4,5.23,Significant,Not Available,,0.1061,229.8,432.1,19.592850821143003,5.056,0.467,0,,1,,2,1973,0,0,1,0,0,0
SOAD12834,Flumevale,Yes,Fish and Wildlife Pond,Earth,12.073,0.083,24889.074525099208,1907,,0.33884,42.61264,Uncontrolled,01/09/2022,1,12.9,High,Satisfactory,2022-09-01,0.076,202.3,396.6,19.547796612577827,12.073,0.083,0,,1,,0,Unknow,0,0,1,0,0,0
SOAD06408,Flumevale,No,"Fire Protection, Stock, Or Small Fish Pond",Earth,2.831,0.023,400.0,1960,,0.13629622799059024,891.3653041701789,Controlled,01/08/2011,10,53.637052532125914,Low,Not Rated,,0.0287,22.6,21.7,16.30371833840461,2.831,0.023,0,400.0,0,5.99396142730657,0,Unknow,0,0,0,1,1,1
SOAD18231,Flumevale,Yes,Water Supply,Earth,32.302,1.167,496111.0,1983,,0.13987,63.77023738310517,,09/06/2022,1,0.0,High,Satisfactory,2017-09-01,0.0847,17.3,501.1,37.5,32.302,1.167,0,496111.0,0,13.1145569866682,0,Unknow,0,0,0,1,0,0
SOAD09371,Flumevale,Yes,Irrigation,Earth,16.884,0.257,90942.0,1950,2016,0.27186,45.73840851705364,,06/10/2022,1,13.4,High,Fair,2022-10-06,0.1137,201.3,308.0,33.1,16.884,0.257,0,90942.0,0,11.4179882156187,1,2016,0,0,0,1,0,0
SOAD17532,Flumevale,Yes,Water Supply,Earth,43.599,0.154,224887.0,1985,,0.14775,2.66329,,29/04/2022,1,0.0,High,Satisfactory,2017-09-01,0.0991,8.1,295.7,62.7,43.599,0.154,0,224887.0,0,12.3233577794763,0,Unknow,0,0,0,0,0,0
SOAD14460,Flumevale,Yes,Irrigation,Earth,11.929,0.333,49245.383015513355,1909,,0.33293,13.31645,,14/11/1991,0,115.61,Low,Satisfactory,2019-09-24,0.0723,341.5,60.2,15.0,11.929,0.333,0,,1,,0,Unknow,0,0,1,0,0,0
SOAD19683,Flumevale,Yes,Water Supply,Earth,25.497,0.322,239184.0,1938,,0.19503,48.371320658874616,,09/09/2022,1,0.16,High,Satisfactory,2017-09-01,0.0758,12.0,594.3,53.0,25.497,0.322,0,239184.0,0,12.3849925900622,0,Unknow,0,0,0,1,0,0
SOAD03213,Flumevale,Yes,Water Supply,Earth,12.769,0.13,12000.0,1926,,0.24034,7.98987,,02/06/2022,0.5,48.916862522659834,Low,Satisfactory,2017-09-01,0.0655,26.4,4.9,28.5,12.769,0.13,0,12000.0,0,9.39274525863144,0,Unknow,0,0,0,0,0,1
SOAD05491,Flumevale,Yes,Recreation,Earth,15.786,0.188,35949.0,1974,,0.2167,101.20502,Uncontrolled,29/04/2022,2,17.2,Significant,Fair,2022-04-29,0.1292,18.3,400.5,6.9,15.786,0.188,0,35949.0,0,10.4898843631492,0,Unknow,0,0,0,0,0,0
SOAD04105,Flumevale,Yes,Fish and Wildlife Pond,Earth,8.136,0.075,58388.0,1879,,0.27383,49.46198302717717,Uncontrolled,08/10/2021,2,33.58,Significant,Satisfactory,2021-10-08,0.1342,542.6,170.3,16.414014591068288,8.136,0.075,0,58388.0,0,10.9748827949107,0,Unknow,0,0,0,1,0,0
SOAD07436,Flumevale,Yes,Water Supply,Earth,18.356,0.117,39500.0,1948,,0.34672,2.66329,,05/01/2022,0.5,49.73751427477226,Low,Satisfactory,2017-09-01,0.0698,499.4,7.5,64.1,18.356,0.117,0,39500.0,0,10.5840812670245,0,Unknow,0,0,0,0,0,1
SOAD15812,Flumevale,Yes,Fish and Wildlife Pond,Earth,3.123,0.056,9838.431859115075,1879,,0.2955,63.982514691405314,Uncontrolled,24/09/2013,2,34.11,Significant,Satisfactory,2013-09-24,0.1341,265.4,176.5,15.977835377135728,3.123,0.056,0,,1,,0,Unknow,0,0,1,1,0,0
SOAD02496,Flumevale,Yes,Irrigation,Earth,11.276,0.21,52713.0,1911,,0.32308,7.98987,Uncontrolled,19/09/2018,6,6.42,Low,Fair,2021-06-03,0.0491,49.7,147.9,13.6,11.276,0.21,0,52713.0,0,10.8726363538985,0,Unknow,0,0,0,0,0,0
SOAD14341,Flumevale,Yes,Water Supply,Earth,14.057,0.417,100000.0,2004,,0.17533,34.14452954431426,Uncontrolled,03/05/2022,1,3.11,High,Satisfactory,2022-05-03,0.0988,10.4,299.5,47.1,14.057,0.417,0,100000.0,0,11.5129354649202,0,Unknow,0,0,0,1,0,0
SOAD12876,Flumevale,Yes,Flood Risk Reduction,Earth,10.542,0.611,56285.64017789906,1965,,0.41961,15.97974,Uncontrolled,10/05/2022,3,3.15,Significant,Satisfactory,2022-05-10,0.1441,165.2,307.9,18.71749893060713,10.542,0.611,0,,1,,0,Unknow,0,0,1,0,0,0
SOAD12227,Flumevale,No,Flood Risk Reduction,Earth,12.789,1.55,133334.60475396493,1968,,0.1417518166566203,41.73896688202007,Controlled,,6,0.0,Low,Not Available,,0.0518,22.3,749.1,19.734350346615575,12.789,1.55,0,,1,,0,Unknow,0,0,1,1,1,0
SOAD13540,Flumevale,Yes,Flood Risk Reduction,Earth,12.969,0.452,17830.0,1957,,0.33687,50.60251,Uncontrolled,05/09/2013,3,9.49,Low,Not Rated,,0.0966,205.6,379.3,20.878468803384656,12.969,0.452,0,17830.0,0,9.78869379453405,0,Unknow,0,0,0,0,0,0
SOAD05294,Flumevale,Yes,Recreation,Earth,10.801,0.23,37722.79116644725,1954,2005,0.42749,86.61293491200763,Uncontrolled,09/04/2021,2,0.0,Significant,Satisfactory,2021-04-09,0.1237,592.5,197.3,5.2,10.801,0.23,0,,1,,1,2005,0,0,1,1,0,0
SOAD17228,Flumevale,Yes,Recreation,Earth,3.418,0.483,42405.0564091037,1889,,0.58115,50.60251,,02/07/2020,6,76.94,Low,Not Rated,,0.0512,562.4,101.3,8.3,3.418,0.483,0,,1,,0,Unknow,0,0,1,0,0,0
SOAD02358,Flumevale,No,"Fire Protection, Stock, Or Small Fish Pond",Earth,2.532,0.183,15999.454483500072,1931,,0.3188716582539999,283.0226194453624,Uncontrolled,01/08/2011,10,79.55699608986535,Low,Not Rated,,0.0419,21.8,14.4,18.832842908896033,2.532,0.183,0,,1,,0,Unknow,0,0,1,1,1,1
SOAD10644,Flumevale,Yes,Water Supply,Earth,15.747,0.183,28500.0,1959,,0.51023,37.28606,,21/04/2022,0.5,16.07,Low,Satisfactory,2017-09-01,0.067,317.0,338.6,21.6,15.747,0.183,0,28500.0,0,10.2576944533605,0,Unknow,0,0,0,0,0,0
SOAD09017,Flumevale,Yes,Water Supply,Earth,24.598,0.133,17837.0,1939,1993F;1993H;1993M;1993O;1993S;2008,0.23837,7.98987,Uncontrolled,16/06/2022,1,11.78,High,Satisfactory,2022-06-16,0.1017,42.5,360.0,8.5,24.598,0.133,0,17837.0,0,9.78908629222615,6,2008,0,0,0,0,0,0
SOAD10657,Flumevale,Yes,Irrigation,Earth,26.883,0.141,96554.0,1889,,0.15957,37.28606,,25/05/2021,1,10.93,High,Fair,2021-05-25,0.1252,20.6,197.3,20.1,26.883,0.141,0,96554.0,0,11.4778680731548,0,Unknow,0,0,0,0,0,0
SOAD13913,Flumevale,Yes,Water Supply,Earth,30.347,0.107,83000.0,1907,,0.19897,15.97974,,15/09/2022,1,1.66,High,Satisfactory,2017-09-01,0.1029,6.4,160.0,19.4,30.347,0.107,0,83000.0,0,11.3266079348989,0,Unknow,0,0,0,0,0,0
SOAD05898,Flumevale,Yes,Water Supply,Earth,7.568,0.207,7136.0,1906,,1.00273,7.98987,,06/05/2022,1,6.23,High,Satisfactory,2017-09-01,0.093,41.5,396.4,12.6,7.568,0.207,0,7136.0,0,8.87304779897107,0,Unknow,0,0,0,0,0,0
SOAD15387,Flumevale,Yes,Irrigation,Earth,11.024,0.365,28302.0,1901,2010,0.28171,7.98987,Uncontrolled,26/07/2022,1,14.46,High,Fair,2022-07-26,0.1232,122.1,470.9,10.6,11.024,0.365,0,28302.0,0,10.2507230850801,1,2010,0,0,0,0,0,0
SOAD01577,Flumevale,Yes,Irrigation,Earth,7.081,0.332,34841.0,1920,,0.51811,21751.08943,Controlled,26/03/2018,5,0.0,High,Not Rated,,0.0748,188.1,847.7,16.7,7.081,0.332,0,34841.0,0,10.4585788346001,0,Unknow,0,0,0,0,0,0
SOAD04198,Flumevale,No,"Fire Protection, Stock, Or Small Fish Pond",Earth,3.119,0.763,53985.90390733306,1974,,0.28505979966736855,114.51358979082552,Uncontrolled,15/07/2010,10,94.33655568783075,Low,Not Rated,,0.0339,19.3,11.6,18.2918888298818,3.119,0.763,0,,1,,0,Unknow,0,0,1,1,1,1
SOAD13982,Flumevale,Yes,Recreation,Earth,4.704,0.067,6448.0,1958,,0.90029,7.98987,Uncontrolled,11/10/2018,6,1.67,Low,Fair,2015-08-27,0.051,65.0,314.6,3.6,4.704,0.067,0,6448.0,0,8.77168035901038,0,Unknow,0,0,0,0,0,0
SOAD17673,Flumevale,Yes,Irrigation,Earth,8.755,0.478,88768.0,1911,,0.28368,482.05549,Uncontrolled,14/04/2016,6,6.42,Low,Fair,2015-07-30,0.059,408.1,230.3,35.1,8.755,0.478,0,88768.0,0,11.3937927689319,0,Unknow,0,0,0,0,0,0
SOAD15192,Flumevale,Yes,Irrigation,Earth,21.213,0.338,49272.0,1950,,0.26792,46.81858042270334,Uncontrolled,07/10/2022,1,11.1,High,Fair,2022-10-07,0.1098,273.9,261.4,12.5,21.213,0.338,0,49272.0,0,10.8051315426634,0,Unknow,0,0,0,1,0,0
SOAD15350,Flumevale,No,Irrigation,Earth,46.426,0.08,328000.0,1952,,0.13987,7.98987,Uncontrolled,27/08/2020,1,3.17,High,Not Available,,0.1363,44.8,305.8,10.7,46.426,0.08,0,328000.0,0,12.7007719361421,0,Unknow,0,0,0,0,0,0
SOAD16374,Flumevale,Yes,Irrigation,Earth,9.032,0.165,17683.718782908527,1906,,0.24428,48.40927709679627,Uncontrolled,18/07/2017,6,24.94,Low,Not Rated,,0.0361,146.7,207.5,37.3,9.032,0.165,0,,1,,0,Unknow,0,0,1,1,0,0
SOAD04446,Flumevale,Yes,Water Supply,Earth,19.31,0.207,72551.0,1947,,0.3546,79.8987,Uncontrolled,11/08/2021,1,37.31,High,Fair,2021-08-11,0.1217,387.3,178.8,58.6,19.31,0.207,0,72551.0,0,11.1920588251274,0,Unknow,0,0,0,0,0,0
SOAD14944,Flumevale,Yes,Irrigation,Earth,16.533,0.438,95405.14665181944,1961,,0.26004,50.09086475649312,,11/10/2011,6,14.67,Low,Not Rated,,0.1006,701.6,290.3,11.2,16.533,0.438,0,,1,,0,Unknow,0,0,1,1,0,0
SOAD10938,Flumevale,Yes,Water Supply,Earth,17.051,0.297,110000.0,1980,,0.26201,2.66329,,17/02/2022,1,1.13,High,Satisfactory,2017-09-01,0.0965,391.8,161.1,45.8,17.051,0.297,0,110000.0,0,11.6082447356423,0,Unknow,0,0,0,0,0,0
SOAD16325,Flumevale,Yes,Irrigation,Earth,18.678,0.127,89448.0,1959,,0.2955,7.98987,,14/06/2022,6,20.5,Low,Satisfactory,2014-01-14,0.0443,29.1,161.8,4.2,18.678,0.127,0,89448.0,0,11.4014239094445,0,Unknow,0,0,0,0,0,0
SOAD14350,Flumevale,Yes,Irrigation,Earth,13.133,0.272,25600.0,1956,,0.35854,21.30632,,25/08/2022,1,17.07,High,Fair,2022-08-25,0.1075,44.1,97.2,31.0,13.133,0.272,0,25600.0,0,10.1503866922047,0,Unknow,0,0,0,0,0,0
SOAD02532,Flumevale,Yes,Irrigation,Earth,10.469,0.2,60000.0,1939,,0.46689,7.98987,Uncontrolled,04/11/2014,6,10.88,Low,Satisfactory,2022-10-06,0.0403,350.8,362.1,47.0,10.469,0.2,0,60000.0,0,11.002116507732,0,Unknow,0,0,0,0,0,0
SOAD08674,Flumevale,Yes,Irrigation,Earth,20.115,0.305,97968.3432180908,1965,2003H,0.26792,13.31645,Uncontrolled,27/09/2022,2,32.71,Significant,Fair,2022-09-27,0.1335,66.1,140.5,7.2,20.115,0.305,0,,1,,1,2003,0,0,1,0,0,0
SOAD17192,Flumevale,Yes,Flood Risk Reduction,Earth,13.927,0.479,78523.5344981412,2015,,0.27974,53.2658,Uncontrolled,20/04/2021,3,3.27,High,Fair,2021-04-20,0.0908,286.6,604.2,17.839426925661222,13.927,0.479,0,,1,,0,Unknow,0,0,1,0,0,0
SOAD18717,Flumevale,Yes,Water Supply,Earth,20.873,0.142,35.0,1929,,0.17139,85.22528,Uncontrolled,23/08/2018,6,13.85,Low,Not Rated,,0.0983,6.7,303.2,54.1,20.873,0.142,0,35.0,0,3.58351893845611,0,Unknow,0,0,0,0,0,0
SOAD20688,Flumevale,Yes,Hydroelectric,Earth,22.964,1.369,350000.0,1913,,0.19897,456.9497555800507,Uncontrolled,22/08/2023,1,4.71,High,Satisfactory,2023-09-29,0.0926,21.6,645.2,92.6,22.964,1.369,0,350000.0,0,12.7656912906044,0,Unknow,0,0,0,1,0,0
SOAD08490,Flumevale,No,Irrigation,Earth,2.458,0.508,42294.38303270081,1977,,0.17462659408538772,26.6329,Controlled,07/09/2010,10,99.7272933705519,Low,Not Rated,,0.0684,23.7,22.2,44.8,2.458,0.508,0,,1,,0,Unknow,0,0,1,0,1,1
SOAD20587,Flumevale,Yes,Recreation,Earth,4.509,0.107,3081.0,1906,1976F;1976H;1976O;1976S,0.51614,53.2658,Uncontrolled,18/10/2022,6,33.24,Low,Satisfactory,2013-09-23,0.0444,428.1,197.3,7.2,4.509,0.107,0,3081.0,0,8.03333401588006,4,1976,0,0,0,0,0,0
SOAD07042,Flumevale,Yes,Irrigation,Earth,12.018,0.267,43294.390044303145,1893,,0.33884,42.61264,Uncontrolled,28/10/2021,6,23.23,Low,Not Rated,,0.0831,99.7,388.3,10.1,12.018,0.267,0,,1,,0,Unknow,0,0,1,0,0,0
SOAD02074,Flumevale,Yes,Flood Risk Reduction,Earth,8.524,0.267,32002.0,1906,,0.39006,58.59238,Uncontrolled,05/10/2010,6,78.5,Low,Not Rated,,0.0497,620.9,225.0,20.896581052633465,8.524,0.267,0,32002.0,0,10.3735849273876,0,Unknow,0,0,0,0,0,0
SOAD05910,Flumevale,Yes,Fish and Wildlife Pond,Earth,4.301,0.445,43142.85513585701,1911,,1.00273,111.85818,Uncontrolled,07/06/2022,2,59.58,Significant,Fair,2022-06-07,0.1466,416.0,85.2,20.126698281365865,4.301,0.445,0,,1,,0,Unknow,0,0,1,0,0,0
SOAD05644,Flumevale,Yes,Irrigation,Earth,9.01,0.315,58121.0,1974,,0.40385,68.95675697669265,Uncontrolled,29/08/2019,6,8.06,Low,Not Rated,,0.04,268.7,476.6,23.7,9.01,0.315,0,58121.0,0,10.9702995286544,0,Unknow,0,0,0,1,0,0
SOAD19320,Flumevale,Yes,Water Supply,Earth,21.946,0.177,93433.0,1990,,0.27186,18.64303,,26/10/2021,1,0.8440247973587396,High,Satisfactory,2017-09-01,0.1049,218.6,661.7,56.7,21.946,0.177,0,93433.0,0,11.4450105836716,0,Unknow,0,0,0,0,0,1
SOAD09674,Flumevale,Yes,Hydroelectric,Earth,7.752,0.207,2500.0,1856,,0.55554,13.31645,Uncontrolled,07/09/2023,1,1.2716851244113703,High,Satisfactory,2023-09-29,0.0772,500.0,687.7,82.75175156421903,7.752,0.207,0,2500.0,0,7.82444593087762,0,Unknow,0,0,0,0,0,1
SOAD07933,Flumevale,Yes,Water Supply,Earth,19.026,0.168,25000.0,1850,,0.24231,5.32658,,13/04/2022,0.5,54.2877269226457,Low,Satisfactory,2017-09-01,0.0711,8.8,5.7,54.3,19.026,0.168,0,25000.0,0,10.1266711030504,0,Unknow,0,0,0,0,0,1
SOAD02097,Flumevale,Yes,Water Supply,Earth,9.566,1.153,121000.0,1948,,0.38809,107.90141573054912,,30/06/2022,0.5,48.714860286735274,Low,Satisfactory,2017-09-01,0.0636,67.5,12.0,65.5,9.566,1.153,0,121000.0,0,11.7035540890075,0,Unknow,0,0,0,1,0,1
SOAD01232,Flumevale,Yes,Irrigation,Earth,12.262,0.233,54660.0,1910,1986,0.0925899999999999,37.28606,Uncontrolled,02/08/2004,6,22.62,Low,Fair,2009-10-27,0.0489,42.4,138.6,17.9,12.262,0.233,0,54660.0,0,10.9089057542287,1,1986,0,0,0,0,0,0
SOAD13038,Flumevale,Yes,Flood Risk Reduction,Earth,16.662,1.333,410043.6211053493,1991,,0.22655,81.71780804470329,,24/05/2022,1,1.96,High,Satisfactory,2017-09-01,0.1053,8.0,309.7,18.341069155865185,16.662,1.333,0,,1,,0,Unknow,0,0,1,1,0,0
SOAD20689,Flumevale,Yes,Irrigation,Earth,3.03,0.117,5104.0,1908,,0.13002,47.80011588658742,Uncontrolled,24/09/1996,6,11.01,Low,Not Rated,,0.061,42.5,172.7,5.7,3.03,0.117,0,5104.0,0,8.53797573059877,0,Unknow,0,0,0,1,0,0
SOAD06704,Flumevale,Yes,Water Supply,Earth,6.393,0.075,10023.874048260077,Unknow,,0.40582,65.72450924517129,,04/05/2022,0.5,55.744536868697715,Low,Satisfactory,2022-08-05,0.0686,56.0,20.5,45.6,6.393,0.075,0,,1,,0,Unknow,0,0,1,1,0,1
SOAD06032,Flumevale,Yes,Irrigation,Earth,7.827,0.267,38822.0,1887,2009,0.41567,7.98987,Uncontrolled,13/10/2021,2,38.2,Significant,Unsatisfactory,2021-10-13,0.1727,257.6,163.4,33.4,7.827,0.267,0,38822.0,0,10.5667681334898,1,2009,0,0,0,0,0,0
SOAD05442,Flumevale,Yes,Irrigation,Earth,5.67,0.195,16457.0,Unknow,1966,0.24034,7.98987,Uncontrolled,19/07/2019,2,1.67,Significant,Fair,2019-07-19,0.1388,47.6,389.5,10.7,5.67,0.195,0,16457.0,0,9.70856696016566,1,1966,0,0,0,0,0,0
SOAD18646,Flumevale,Yes,Debris Control,Earth,14.19,1.2,207722.42418817536,1964,,0.52599,372.63460347960955,,20/04/2022,1,1.4778402252597447,High,Satisfactory,2017-09-01,0.0945,671.9,920.3,21.907381801686824,14.19,1.2,0,,1,,0,Unknow,0,0,1,1,0,1
SOAD03989,Flumevale,Yes,Fish and Wildlife Pond,Earth,8.963,0.08,12227.897271368764,1906,,0.00788,35.075575668914226,Uncontrolled,13/06/1989,6,3.35,Low,Satisfactory,2021-09-09,0.0378,19.4,625.9,20.947486088232594,8.963,0.08,0,,1,,0,Unknow,0,0,1,1,0,0
SOAD08141,Flumevale,Yes,Flood Risk Reduction,Earth,7.113,0.7,64031.93319282788,2006,,0.00788,415.47324,Uncontrolled,09/08/2022,3,1.67,High,Satisfactory,2022-08-09,0.0868,14.8,718.0,16.568446367135508,7.113,0.7,0,,1,,0,Unknow,0,0,1,0,0,0
SOAD18060,Flumevale,Yes,Irrigation,Earth,9.008,0.292,25902.0,1893,1952S,0.16942,7.98987,Uncontrolled,11/08/2022,2,13.97,Significant,Fair,2022-08-11,0.1324,21.0,100.0,19.3,9.008,0.292,0,25902.0,0,10.1621140710957,1,1952,0,0,0,0,0,0
SOAD18334,Flumevale,Yes,Irrigation,Earth,7.596,0.19,9400.0,1901,,0.32505,21.30632,Uncontrolled,21/07/2021,2,43.6,Significant,Fair,2021-07-21,0.1486,374.3,232.6,4.1,7.596,0.19,0,9400.0,0,9.14857134557855,0,Unknow,0,0,0,0,0,0
SOAD13425,Flumevale,Yes,Irrigation,Earth,13.89,0.337,1050.0,1952,,0.2758,47.00026029441829,Uncontrolled,12/07/2022,1,11.83,High,Fair,2022-07-12,0.1282,287.1,193.8,26.1,13.89,0.337,0,1050.0,0,6.95749737087695,0,Unknow,0,0,0,1,0,0
SOAD19343,Flumevale,Yes,Irrigation,Earth,10.446,0.443,52569.24258674213,1902,,0.34672,79.04586525362086,Uncontrolled,26/04/2019,6,13.39,Low,Not Rated,,0.0519,336.4,280.9,20.0,10.446,0.443,0,,1,,0,Unknow,0,0,1,1,0,0
SOAD00847,Flumevale,Yes,Irrigation,Earth,9.692,0.32,30433.146850672838,1902,,0.34869,70.00372525233792,Uncontrolled,26/04/2019,6,12.7,Low,Fair,2018-10-05,0.0458,698.8,217.5,44.8,9.692,0.32,0,,1,,0,Unknow,0,0,1,1,0,0
SOAD12387,Flumevale,Yes,Recreation,Earth,18.001,0.157,66524.07864982559,1945,,0.23246,98.54173,Uncontrolled,29/11/2021,2,24.42,Significant,Fair,2021-11-29,0.138,29.9,318.0,5.3,18.001,0.157,0,,1,,0,Unknow,0,0,1,0,0,0
SOAD06887,Flumevale,Yes,Water Supply,Earth,11.617,0.193,46500.0,1946,,0.43537,10.65316,,23/05/2022,0.5,43.63878386009667,Low,Satisfactory,2017-09-01,0.061,198.6,6.9,40.1,11.617,0.193,0,46500.0,0,10.7472290967206,0,Unknow,0,0,0,0,0,1
SOAD04165,Flumevale,Yes,Flood Risk Reduction,Earth,6.29,0.533,78360.0,1975,,1.60358,82.56199,,06/05/2022,1,2.33,Significant,Satisfactory,2017-09-01,0.1331,398.7,763.0,19.802999300065235,6.29,0.533,0,78360.0,0,11.2690816335901,0,Unknow,0,0,0,0,0,0
SOAD09632,Flumevale,Yes,Irrigation,Earth,10.06,0.2,26166.58969894116,1912,,0.25413,13.31645,Uncontrolled,13/09/2022,2,50.36,Significant,Satisfactory,2022-09-13,0.1179,292.3,96.0,33.7,10.06,0.2,0,,1,,0,Unknow,0,0,1,0,0,0
SOAD15542,Flumevale,Yes,Flood Risk Reduction,Earth,10.345,0.482,57838.79983550832,1959,,0.42552,37.28606,Uncontrolled,15/10/2020,3,3.09,Low,Fair,2016-09-22,0.0764,421.8,852.8,20.88065951087208,10.345,0.482,0,,1,,0,Unknow,0,0,1,0,0,0
SOAD19565,Flumevale,Yes,Recreation,Earth,17.057,0.09,21273.0,1957,,0.1773,103.86831,Uncontrolled,26/08/2022,2,27.71,Significant,Not Rated,,0.1426,10.8,453.1,4.0,17.057,0.09,0,21273.0,0,9.96524094881161,0,Unknow,0,0,0,0,0,0
SOAD13302,Flumevale,Yes,Irrigation,Earth,16.835,0.718,179442.97603211887,1971,1971,0.28762,21.30632,,24/03/2022,2,0.0,Significant,Satisfactory,2022-03-24,0.1091,239.8,953.3,12.7,16.835,0.718,0,,1,,1,1971,0,0,1,0,0,0
SOAD10421,Flumevale,Yes,Irrigation,Earth,9.051,0.627,53688.61323674298,1963,,0.50629,7.98987,Uncontrolled,19/09/2018,6,44.6,Low,Unsatisfactory,2016-02-19,0.0827,668.4,165.8,27.6,9.051,0.627,0,,1,,0,Unknow,0,0,1,0,0,0
SOAD06465,Flumevale,No,Other,Earth,6.681,1.4,98211.2475634297,Unknow,,0.11765901714765363,46.535392062114475,,,Unknow,6.32,Low,Not Available,,0.1215,19.5,135.2,17.970315287980725,6.681,1.4,0,,1,,0,Unknow,0,0,1,1,1,0
SOAD09459,Flumevale,Yes,Irrigation,Earth,10.679,0.2,27200.0,1906,,0.5319,168.0378281783478,,22/09/2021,2,26.71,Significant,Fair,2021-09-22,0.1425,671.5,199.0,29.6,10.679,0.2,0,27200.0,0,10.2110090163142,0,Unknow,0,0,0,1,0,0
SOAD19553,Flumevale,Yes,Water Supply,Earth,17.009,0.425,360445.0,Unknow,,0.27777,1070.2932316359877,,28/04/2022,1,0.0,High,Satisfactory,2020-12-01,0.075,500.6,735.3,7.5,17.009,0.425,0,360445.0,0,12.7950974325316,0,Unknow,0,0,0,1,0,0
SOAD05421,Flumevale,Yes,Irrigation,Earth,5.713,0.667,57945.0,1899,1989,0.43537,87.59686289510161,Uncontrolled,23/09/2021,2,15.14,Significant,Satisfactory,2021-09-23,0.1211,94.1,344.1,24.2,5.713,0.667,0,57945.0,0,10.967266821364,1,1989,0,0,0,1,0,0
SOAD00447,Flumevale,Yes,Recreation,Earth,12.201,0.142,20541.0,1947,2002H;2002S,0.3546,93.21515,Uncontrolled,11/08/2022,1,22.99,High,Satisfactory,2022-08-11,0.0889,249.3,240.1,4.1,12.201,0.142,0,20541.0,0,9.93022684972575,2,2002,0,0,0,0,0,0
SOAD19961,Flumevale,Yes,"Fire Protection, Stock, Or Small Fish Pond",Earth,8.121,0.467,48194.66838904752,1913,,0.97712,111.85818,,04/12/1992,0,128.0,Low,Not Rated,,0.0933,677.7,199.7,19.66146085363291,8.121,0.467,0,,1,,0,Unknow,0,0,1,0,0,0
SOAD06785,Flumevale,Yes,"Fire Protection, Stock, Or Small Fish Pond",Earth,6.58,0.327,24958.0,1971,,0.61858,998.73375,Uncontrolled,09/11/2012,6,41.42,Low,Not Rated,,0.0494,531.8,115.6,19.74803754517352,6.58,0.327,0,24958.0,0,10.1249897575782,0,Unknow,0,0,0,0,0,0
SOAD03931,Flumevale,Yes,Water Supply,Earth,13.526,0.108,36870.0,1887,1971,0.23443,47.93922,Uncontrolled,08/05/2017,6,3.23,Low,Not Rated,,0.0598,30.7,675.8,25.5,13.526,0.108,0,36870.0,0,10.5151806131821,1,1971,0,0,0,0,0,0
SOAD02917,Flumevale,Yes,Other,Earth,9.177,0.152,13300.0,1952,,1.02637,98.54173,,28/04/2022,0.5,46.03360626048233,Low,Satisfactory,2017-09-01,0.0792,162.4,20.9,19.870895149435444,9.177,0.152,0,13300.0,0,9.4955944993533,0,Unknow,0,0,0,0,0,1
SOAD02360,Flumevale,Yes,Recreation,Earth,13.642,0.089,39248.0,1978,,0.27383,42.61264,Uncontrolled,13/09/2019,6,39.28,Low,Satisfactory,2020-05-15,0.0489,489.0,226.6,8.4,13.642,0.089,0,39248.0,0,10.577681245179,0,Unknow,0,0,0,0,0,0
SOAD04204,Flumevale,Yes,Water Supply,Earth,18.594,0.263,116300.0,1973,,0.27974,2.66329,,09/02/2022,1,1.2056983849737326,High,Satisfactory,2017-09-01,0.0769,501.4,855.5,42.5,18.594,0.263,0,116300.0,0,11.6639369369221,0,Unknow,0,0,0,0,0,1
SOAD18433,Flumevale,Yes,Flood Risk Reduction,Earth,10.228,0.15,22810.0,1935,,0.5122,13.31645,,20/01/2022,1,1.2469148269103538,High,Satisfactory,2017-09-01,0.0993,153.3,948.4,18.849115531839153,10.228,0.15,0,22810.0,0,10.0349981547383,0,Unknow,0,0,0,0,0,1
SOAD04578,Flumevale,Yes,Irrigation,Earth,5.114,0.321,4504.0,1892,,0.26201,55.84656186980962,Uncontrolled,01/05/2009,6,26.42,Low,Fair,2018-09-05,0.0524,458.9,170.6,31.2,5.114,0.321,0,4504.0,0,8.41294317004244,0,Unknow,0,0,0,1,0,0
SOAD12662,Flumevale,Yes,Flood Risk Reduction,Earth,12.34,0.427,98000.0,1962,,0.52993,55.92909,,08/09/2021,1,0.9861925384320696,High,Satisfactory,2017-09-01,0.1006,570.1,484.7,21.304497990720776,12.34,0.427,0,98000.0,0,11.4927329616823,0,Unknow,0,0,0,0,0,1
SOAD19626,Flumevale,Yes,Irrigation,Earth,9.313,0.158,14060.0,1956,,0.39203,58.01225135591965,Uncontrolled,23/08/2021,2,21.53,Significant,Fair,2021-08-23,0.1324,148.9,384.7,47.6,9.313,0.158,0,14060.0,0,9.55116028659082,0,Unknow,0,0,0,1,0,0
SOAD18111,Flumevale,Yes,Irrigation,Earth,11.693,0.227,37280.0,1903,1952F;1952H;1952M;1952S;1995M,0.4137,7.98987,Uncontrolled,24/08/2022,1,16.8,High,Fair,2022-08-24,0.1127,159.3,186.5,15.8,11.693,0.227,0,37280.0,0,10.5262390924741,5,1995,0,0,0,0,0,0
SOAD17317,Flumevale,Yes,Irrigation,Earth,4.818,0.325,22470.0,1885,,0.55948,97.25394820356738,Uncontrolled,24/06/2022,2,3.38,Significant,Satisfactory,2022-06-24,0.1296,477.7,477.4,45.3,4.818,0.325,0,22470.0,0,10.0199808679719,0,Unknow,0,0,0,1,0,0
SOAD18189,Flumevale,Yes,Water Supply,Earth,21.955,0.243,156000.0,1896,,0.21473,36.84867664690391,,05/04/2023,1,0.0,High,Poor,2022-01-05,0.1247,22.6,605.4,11.8,21.955,0.243,0,156000.0,0,11.9576176964675,0,Unknow,0,0,0,1,0,0
SOAD12389,Flumevale,Yes,Water Supply,Earth,19.532,0.117,37300.0,1957,,0.2955,10.65316,,16/06/2022,0.5,49.814853772854555,Low,Satisfactory,2017-09-01,0.0662,192.4,10.5,6.1,19.532,0.117,0,37300.0,0,10.526775414924,0,Unknow,0,0,0,0,0,1
SOAD19869,Flumevale,Yes,Irrigation,Earth,9.075,0.143,7948.0,1951,1980,0.38021,59.919832183294254,Uncontrolled,05/10/2021,6,36.32,Low,Satisfactory,2013-09-05,0.0641,371.3,89.1,34.2,9.075,0.143,0,7948.0,0,8.98080141357311,1,1980,0,0,0,1,0,0
SOAD12989,Flumevale,Yes,Irrigation,Earth,8.012,0.6,19295.0,1912,,0.50629,58.59238,Uncontrolled,02/07/2008,6,8.43,Low,Not Rated,,0.0598,160.5,337.8,24.1,8.012,0.6,0,19295.0,0,9.86765309952691,0,Unknow,0,0,0,0,0,0
SOAD00765,Flumevale,Yes,Water Supply,Earth,10.411,0.247,50000.0,1957,,0.42749,5.32658,,10/02/2022,1,1.58,Significant,Satisfactory,2017-09-01,0.1065,687.1,925.5,68.1,10.411,0.247,0,50000.0,0,10.8197982842103,0,Unknow,0,0,0,0,0,0
SOAD00141,Flumevale,Yes,Irrigation,Earth,4.404,0.517,42484.0,1888,,0.42749,123.34776115489367,Uncontrolled,06/07/2005,0,0.0,Low,Not Rated,,0.0865,265.5,758.9,33.5,4.404,0.517,0,42484.0,0,10.6569063514376,0,Unknow,0,0,0,1,0,0
SOAD00229,Flumevale,Yes,Unknow,Earth,11.512,0.35,44975.14533998166,Unknow,,0.26792,47.93442901902337,,,6,4.88,Low,Not Rated,,0.0823,607.2,593.9,17.70190682627269,11.512,0.35,0,,1,,0,Unknow,0,0,1,1,0,0
SOAD17505,Flumevale,Yes,Recreation,Earth,4.535,0.323,23421.653311531565,1889,,0.78012,55.92909,,02/07/2020,6,76.19,Low,Satisfactory,2021-12-03,0.0387,546.9,139.9,5.2,4.535,0.323,0,,1,,0,Unknow,0,0,1,0,0,0
SOAD11106,Flumevale,Yes,Flood Risk Reduction,Earth,16.163,0.769,94620.0,1980,,0.75451,53.2658,Uncontrolled,09/06/2021,3,8.11,Low,Satisfactory,2018-07-13,0.0718,74.5,424.9,22.249666357536608,16.163,0.769,0,94620.0,0,11.4576347177194,0,Unknow,0,0,0,0,0,0
SOAD13205,Flumevale,Yes,Water Supply,Earth,14.273,0.237,30000.0,1957,,0.49447,98.54173,,18/04/2022,1,1.424658254376746,High,Satisfactory,2017-09-01,0.081,388.0,802.7,46.7,14.273,0.237,0,30000.0,0,10.3089859934221,0,Unknow,0,0,0,0,0,1
SOAD10444,Flumevale,Yes,Irrigation,Earth,9.361,0.41,81496.0,1908,1950;1987,0.3152,58.026036998919494,Uncontrolled,23/11/2021,1,0.0,High,Unsatisfactory,2021-11-23,0.1288,627.8,835.1,20.4,9.361,0.41,0,81496.0,0,11.3083214887355,2,1987,0,0,0,1,0,0
SOAD04272,Flumevale,Yes,Debris Control,Earth,21.374,0.515,470274.0,1936,,0.46689,71.90883,,03/11/2021,1,0.0,High,Satisfactory,2017-09-01,0.0788,143.2,373.0,21.292756603141978,21.374,0.515,0,470274.0,0,13.0610729089612,0,Unknow,0,0,0,0,0,0
SOAD16480,Flumevale,Yes,Irrigation,Earth,8.546,1.584,101989.54733851893,1892,1902M;1953M;1960S;1995S,0.45113,165.86538456918672,Uncontrolled,03/03/2022,1,0.0,High,Unsatisfactory,2022-03-03,0.1354,309.5,300.7,6.0,8.546,1.584,0,,1,,4,1995,0,0,1,1,0,0
SOAD06525,Flumevale,Yes,Irrigation,Earth,7.849,0.171,15094.0,1893,1993,0.54175,77.23541,Uncontrolled,19/10/2021,1,19.95,High,Satisfactory,2021-10-19,0.0884,341.5,113.1,23.2,7.849,0.171,0,15094.0,0,9.62211884214094,1,1993,0,0,0,0,0,0
SOAD06250,Flumevale,Yes,Flood Risk Reduction,Earth,15.081,0.467,74200.0,1962,,0.36642,82.56199,,10/04/2018,3,15.16,Low,Unsatisfactory,2018-04-23,0.1066,697.5,160.5,20.117748350582943,15.081,0.467,0,74200.0,0,11.2145329061536,0,Unknow,0,0,0,0,0,0
SOAD02725,Flumevale,Yes,Water Supply,Earth,12.407,0.333,27200.0,1943,,0.49447,7.98987,,10/06/2022,1,34.21,High,Fair,2022-06-10,0.1063,681.6,115.5,40.3,12.407,0.333,0,27200.0,0,10.2110090163142,0,Unknow,0,0,0,0,0,0
SOAD12905,Flumevale,Yes,Water Supply,Earth,5.47,1.233,48000.0,1947,,0.63631,10.65316,,07/06/2022,0.5,0.0,Low,Satisfactory,2017-09-01,0.0555,527.7,298.2,67.8,5.47,1.233,0,48000.0,0,10.7789771230064,0,Unknow,0,0,0,0,0,0
SOAD08713,Flumevale,Yes,Recreation,Earth,17.415,0.141,66554.34157370724,1974,,0.19503,197.08346,Uncontrolled,28/05/2021,2,56.96,Significant,Satisfactory,2021-05-28,0.1098,27.2,71.9,5.7,17.415,0.141,0,,1,,0,Unknow,0,0,1,0,0,0
SOAD17706,Flumevale,Yes,Irrigation,Earth,8.961,0.2,15724.0,1963,,0.40976,70.56817162389149,,14/05/2020,6,38.31,Low,Not Rated,,0.0778,518.7,218.1,5.5,8.961,0.2,0,15724.0,0,9.66300708156864,0,Unknow,0,0,0,1,0,0
SOAD16696,Flumevale,Yes,Water Supply,Earth,5.053,0.633,15729.0,1909,1990,0.4137,82.56916755831703,Uncontrolled,22/07/2022,1,8.24,High,Satisfactory,2022-07-22,0.0827,231.8,291.0,58.6,5.053,0.633,0,15729.0,0,9.66332499605232,1,1990,0,0,0,1,0,0
SOAD20141,Flumevale,Yes,Other,Earth,27.824,0.4,146700.0,1966,,0.24034,29.29619,,16/02/2022,1,0.5050607221986811,High,Satisfactory,2017-09-01,0.0878,21.7,859.0,19.297550826167768,27.824,0.4,0,146700.0,0,11.8961517807404,0,Unknow,0,0,0,0,0,1
SOAD05460,Flumevale,Yes,Hydroelectric,Earth,7.87,0.07,3000.0,1870,,0.46492,2.66329,Uncontrolled,12/08/2019,3,48.8483757435715,Low,Satisfactory,2023-09-29,0.0739,200.1,12.0,64.5016222222222,7.87,0.07,0,3000.0,0,8.00670084544037,0,Unknow,0,0,0,0,0,1
SOAD04124,Flumevale,Yes,Water Supply,Earth,8.29,1.567,144882.0,1959,,0.93772,5.32658,,18/05/2022,1,11.63,High,Satisfactory,2017-09-01,0.0987,566.7,321.9,66.3,8.29,1.567,0,144882.0,0,11.8836817991347,0,Unknow,0,0,0,0,0,0
SOAD05837,Flumevale,Yes,Recreation,Earth,17.093,0.083,36010.02374564219,1956,,0.3546,37.28606,Uncontrolled,07/06/2022,1,80.26,High,Unsatisfactory,2022-06-07,0.1351,489.9,209.8,7.1,17.093,0.083,0,,1,,0,Unknow,0,0,1,0,0,0
SOAD14547,Flumevale,Yes,Irrigation,Earth,7.094,0.343,44084.0,1890,,0.45507,103.08128834628427,,19/07/1990,0,3.27,Low,Unsatisfactory,2021-06-09,0.1073,179.1,497.5,8.0,7.094,0.343,0,44084.0,0,10.6938748675211,0,Unknow,0,0,0,1,0,0
SOAD02177,Flumevale,Yes,Flood Risk Reduction,Earth,10.76,1.1,1050.0,1954,,0.30535,63.91896,Uncontrolled,07/12/2021,3,0.0,High,Satisfactory,2021-12-07,0.1027,528.4,368.8,17.548821907458713,10.76,1.1,0,1050.0,0,6.95749737087695,0,Unknow,0,0,0,0,0,0
SOAD14397,Flumevale,Yes,Irrigation,Earth,3.555,0.354,19470.0,1903,,0.33687,7.98987,,04/09/2019,6,36.62,Low,Not Rated,,0.0635,285.3,70.0,8.2,3.555,0.354,0,19470.0,0,9.87668145811562,0,Unknow,0,0,0,0,0,0
SOAD17738,Flumevale,Yes,Water Supply,Earth,4.565,1.733,110000.0,1981,,0.87862,18.64303,,28/02/2022,0.5,1.54,Low,Satisfactory,2017-09-01,0.0588,281.4,394.0,18.6,4.565,1.733,0,110000.0,0,11.6082447356423,0,Unknow,0,0,0,0,0,0
SOAD11577,Flumevale,Yes,Water Supply,Earth,9.891,0.425,26145.0,1959,,0.79391,15.97974,,07/06/2022,0.5,49.937411629039055,Low,Satisfactory,2017-09-01,0.0678,51.0,22.6,24.7,9.891,0.425,0,26145.0,0,10.1714514941218,0,Unknow,0,0,0,0,0,1
SOAD11607,Flumevale,Yes,Irrigation,Earth,10.075,0.333,21565.0,1896,,0.24428,48.87860714362009,Uncontrolled,07/12/2020,2,3.23,Significant,Satisfactory,2020-12-07,0.1354,706.4,400.9,25.1,10.075,0.333,0,21565.0,0,9.97887327944202,0,Unknow,0,0,0,1,0,0
SOAD02591,Flumevale,Yes,Flood Risk Reduction,Earth,5.002,1.233,77721.97839381415,1989,,0.71905,21.30632,,11/02/2022,1,0.0,Significant,Satisfactory,2017-09-01,0.1264,242.6,668.1,19.661854998693148,5.002,1.233,0,,1,,0,Unknow,0,0,1,0,0,0
SOAD13511,Flumevale,Yes,Irrigation,Earth,3.202,0.267,21318.0,1892,,0.53584,1351.87988489529,Uncontrolled,22/06/2022,2,26.37,Significant,Unsatisfactory,2022-06-22,0.1773,228.7,163.1,4.2,3.202,0.267,0,21318.0,0,9.96735397286454,0,Unknow,0,0,0,1,0,0
SOAD08997,Flumevale,Yes,Water Supply,Earth,16.192,0.17,33242.0,1971,,0.47083,420.79982,,25/05/2022,1,24.87306073701869,Significant,Satisfactory,2017-09-01,0.1138,104.4,216.0,67.9,16.192,0.17,0,33242.0,0,10.4115994976044,0,Unknow,0,0,0,0,0,1
SOAD09672,Flumevale,Yes,Irrigation,Earth,12.314,0.167,27300.0,1960,,0.35066,37.28606,Uncontrolled,20/07/2022,2,19.92,Significant,Fair,2022-07-20,0.122,627.3,376.4,34.4,12.314,0.167,0,27300.0,0,10.2146786105388,0,Unknow,0,0,0,0,0,0
SOAD02492,Flumevale,Yes,Water Supply,Earth,8.768,0.467,105000.0,1978,,0.53781,2.66329,,16/11/2021,1,0.16,High,Satisfactory,2017-09-01,0.0909,356.4,875.7,26.6,8.768,0.467,0,105000.0,0,11.5617251529038,0,Unknow,0,0,0,0,0,0
SOAD13415,Flumevale,Yes,Water Supply,Earth,62.17,0.322,1377500.0,2012,,0.13396,345.68827147860276,,26/10/2021,1,0.8,High,Satisfactory,2017-09-01,0.071,35.7,365.5,23.5,62.17,0.322,0,1377500.0,0,14.1357815459618,0,Unknow,0,0,0,1,0,0
SOAD14718,Flumevale,Yes,Flood Risk Reduction,Earth,15.369,0.403,12196.0,1959,2022,0.03546,141.15437,Uncontrolled,28/09/2020,3,16.33,Low,Unsatisfactory,2021-07-28,0.1244,9.6,394.3,14.897611253067144,15.369,0.403,0,12196.0,0,9.40894529884324,1,2022,0,0,0,0,0,0
SOAD14026,Flumevale,Yes,Irrigation,Earth,6.729,0.036,3411.0,1944,,0.35854,13.31645,Uncontrolled,28/09/2016,6,27.77,Low,Unsatisfactory,2022-06-21,0.0806,462.1,358.9,26.3,6.729,0.036,0,3411.0,0,8.13505390861157,0,Unknow,0,0,0,0,0,0
SOAD17062,Flumevale,Yes,Flood Risk Reduction,Earth,20.43,1.167,685000.0,1987,,0.21867,31.95948,,24/05/2022,1,0.77,High,Satisfactory,2017-09-01,0.1036,21.2,363.7,20.345182924247908,20.43,1.167,0,685000.0,0,13.4371755770973,0,Unknow,0,0,0,0,0,0
SOAD19900,Flumevale,Yes,Irrigation,Earth,3.7,0.667,26171.0,1887,,0.30732,63.97297762296912,Uncontrolled,24/09/2013,6,1.69,Low,Not Rated,,0.0777,548.5,195.7,5.9,3.7,0.667,0,26171.0,0,10.1724454159896,0,Unknow,0,0,0,1,0,0
SOAD06751,Flumevale,Yes,Recreation,Earth,15.969,0.17,65117.182160037395,1969,,0.36051,45.27593,Uncontrolled,20/07/2022,1,9.48,High,Satisfactory,2022-07-20,0.1083,87.1,345.5,4.2,15.969,0.17,0,,1,,0,Unknow,0,0,1,0,0,0
SOAD17651,Flumevale,Yes,Flood Risk Reduction,Earth,13.856,0.501,76461.52384598815,1972,,0.41961,34.62277,Uncontrolled,07/10/2021,3,4.84,Significant,Satisfactory,2021-10-07,0.128,551.7,608.2,21.43669941131305,13.856,0.501,0,,1,,0,Unknow,0,0,1,0,0,0
SOAD10914,Flumevale,Yes,Water Supply,Earth,10.288,0.323,68916.0,1963,,0.50235,7.98987,,05/10/2021,2,26.31,Significant,Fair,2021-10-05,0.143,376.4,214.2,37.4,10.288,0.323,0,68916.0,0,11.1406581609655,0,Unknow,0,0,0,0,0,0
SOAD18872,Flumevale,Yes,Recreation,Earth,12.687,0.167,39150.19818858694,1953,,0.28565,21.30632,Uncontrolled,13/10/2022,1,25.66,High,Satisfactory,2022-10-13,0.0787,713.1,417.3,5.3,12.687,0.167,0,,1,,0,Unknow,0,0,1,0,0,0
SOAD13012,Flumevale,Yes,Irrigation,Earth,9.765,0.607,38200.0,1905,1931F;1931H;1931M;1931S;1974H;1974S,0.32899,55.212392739329275,Uncontrolled,20/12/2022,1,0.0,High,Fair,2022-12-20,0.099,538.8,485.8,45.2,9.765,0.607,0,38200.0,0,10.5506169722625,6,1974,0,0,0,1,0,0
SOAD17207,Flumevale,Yes,Flood Risk Reduction,Earth,10.432,0.448,55393.34638213968,1959,,0.48462,29.29619,Uncontrolled,15/10/2020,3,1.61,Low,Not Rated,,0.0701,211.2,355.9,21.16845590421675,10.432,0.448,0,,1,,0,Unknow,0,0,1,0,0,0
SOAD18281,Flumevale,Yes,Irrigation,Earth,14.936,0.197,93318.0,1907,1967S;2012H;2012S,0.20094,21.30632,Uncontrolled,23/06/2017,6,26.48,Low,Satisfactory,2013-04-25,0.0421,39.3,318.2,21.7,14.936,0.197,0,93318.0,0,11.4437790102614,3,2012,0,0,0,0,0,0
SOAD02669,Flumevale,Yes,Irrigation,Earth,5.954,0.4,30628.576394703065,1946,,0.73678,7.98987,Uncontrolled,25/06/2020,6,13.47,Low,Not Rated,,0.0835,475.6,207.2,36.3,5.954,0.4,0,,1,,0,Unknow,0,0,1,0,0,0
SOAD03294,Flumevale,Yes,Irrigation,Earth,20.594,0.168,525.0,1952,2016,0.43734,7.98987,Uncontrolled,08/07/2022,1,21.93,High,Fair,2022-07-08,0.0993,457.5,381.2,15.4,20.594,0.168,0,525.0,0,6.26530121273771,1,2016,0,0,0,0,0,0
SOAD12176,Flumevale,Yes,Flood Risk Reduction,Earth,23.968,0.143,73517.96188026092,1971,,0.25413,13.31645,Uncontrolled,20/05/2021,3,4.91,Significant,Satisfactory,2021-05-20,0.1167,256.1,214.1,18.809309361311882,23.968,0.143,0,,1,,0,Unknow,0,0,1,0,0,0
SOAD00363,Flumevale,Yes,Water Supply,Earth,5.869,0.633,464000.0,1989,,0.27777,138.92530429823518,,10/02/2022,1,7.96,Significant,Satisfactory,2017-09-01,0.1274,247.9,245.3,11.6,5.869,0.633,0,464000.0,0,13.0476419863785,0,Unknow,0,0,0,1,0,0
SOAD01174,Flumevale,Yes,Water Supply,Earth,17.146,0.127,12000.0,1927,1980S,0.31914,719.0883,Uncontrolled,16/11/2022,1,0.0,High,Fair,2022-11-16,0.105,425.8,447.9,55.5,17.146,0.127,0,12000.0,0,9.39274525863144,1,1980,0,0,0,0,0,0
SOAD09830,Flumevale,Yes,Fish and Wildlife Pond,Earth,10.926,0.07,20493.26925798213,1953,,0.31914,13.31645,Uncontrolled,08/06/2022,1,26.13,High,Fair,2022-06-08,0.1164,316.5,442.9,17.32672759632831,10.926,0.07,0,,1,,0,Unknow,0,0,1,0,0,0
SOAD12074,Flumevale,Yes,Irrigation,Earth,3.509,0.167,880.0,Unknow,1960,0.58115,21.30632,Uncontrolled,10/08/2022,2,1.59,Significant,Satisfactory,2022-08-10,0.1208,211.7,788.1,46.0,3.509,0.167,0,880.0,0,6.78105762593618,1,1960,0,0,0,0,0,0
SOAD15133,Flumevale,Yes,Flood Risk Reduction,Earth,4.119,0.045,9873.769521055581,1994,,0.58509,21.30632,,12/01/2022,1,0.16,High,Satisfactory,2017-09-01,0.1056,124.5,111.0,17.967357200580523,4.119,0.045,0,,1,,0,Unknow,0,0,1,0,0,0
SOAD03363,Flumevale,Yes,Water Supply,Earth,20.028,0.833,310000.0,1988,,0.25413,62.69393854757211,,16/03/2022,1,0.0,High,Satisfactory,2017-09-01,0.0978,595.8,305.3,11.8,20.028,0.833,0,310000.0,0,12.6443308022626,0,Unknow,0,0,0,1,0,0
SOAD16917,Flumevale,Yes,Water Supply,Earth,23.933,0.367,116600.0,1956,,0.34278,7.98987,,23/05/2022,0.5,46.33562124207958,Low,Satisfactory,2017-09-01,0.0539,520.7,21.3,45.8,23.933,0.367,0,116600.0,0,11.6665131291911,0,Unknow,0,0,0,0,0,1
SOAD10959,Flumevale,Yes,Hydroelectric,Earth,5.121,0.091,3000.0,1855,,0.77027,7.98987,Uncontrolled,12/08/2019,3,15.29,Low,Satisfactory,2023-09-29,0.0727,238.8,339.4,75.9,5.121,0.091,0,3000.0,0,8.00670084544037,0,Unknow,0,0,0,0,0,0
SOAD10743,Flumevale,Yes,Irrigation,Earth,18.359,0.351,68698.0,1969,,0.42355,66.58225,Uncontrolled,11/10/2013,6,18.41,Low,Not Rated,,0.1004,448.8,403.6,44.9,18.359,0.351,0,68698.0,0,11.1374899220637,0,Unknow,0,0,0,0,0,0
SOAD16252,Flumevale,Yes,Water Supply,Earth,4.372,0.4,78469.70031987372,1923,,1.80452,844.26293,,28/06/2022,0.5,68.41721427331409,Low,Satisfactory,2017-09-01,0.0797,451.4,22.5,31.9,4.372,0.4,0,,1,,0,Unknow,0,0,1,0,0,1
SOAD06759,Flumevale,Yes,Irrigation,Earth,8.407,0.22,34120.0,1965,,0.46492,13.31645,Uncontrolled,14/06/2022,1,14.82,High,Fair,2022-06-14,0.1089,457.0,312.6,34.8,8.407,0.22,0,34120.0,0,10.4376683094997,0,Unknow,0,0,0,0,0,0
SOAD11680,Flumevale,Yes,Water Supply,Earth,11.018,0.433,230000.0,1976,,0.57524,18.64303,,10/02/2022,1,0.0,Significant,Satisfactory,2017-09-01,0.0992,81.9,813.3,29.6,11.018,0.433,0,230000.0,0,12.345838935722,0,Unknow,0,0,0,0,0,0
SOAD16680,Flumevale,Yes,Irrigation,Earth,2.75,0.233,7006.0,1952,,1.85968,128.7571485355736,,01/01/1998,0,3.15,Low,Not Rated,,0.0871,635.9,518.5,5.9,2.75,0.233,0,7006.0,0,8.85466492837053,0,Unknow,0,0,0,1,0,0
SOAD10153,Flumevale,Yes,Irrigation,Earth,13.672,0.228,11253.0,1930,,0.30535,111.85818,Uncontrolled,29/08/2018,6,167.32,Low,Not Rated,,0.0625,363.7,190.0,32.1,13.672,0.228,0,11253.0,0,9.32847889999322,0,Unknow,0,0,0,0,0,0
SOAD13995,Flumevale,Yes,Water Supply,Earth,24.034,0.293,790.0,1966,,0.22852,411.96612814625195,,29/06/2022,1,24.7,High,Satisfactory,2022-06-29,0.0862,18.4,278.7,7.1,24.034,0.293,0,790.0,0,6.67329796776765,0,Unknow,0,0,0,1,0,0
SOAD10551,Flumevale,Yes,Irrigation,Earth,13.489,0.308,9523.0,1951,,0.7092,173.11385,Uncontrolled,02/06/2022,2,32.05,Significant,Fair,2022-06-02,0.1558,660.7,143.7,33.5,13.489,0.308,0,9523.0,0,9.16157020760675,0,Unknow,0,0,0,0,0,0
SOAD03874,Flumevale,Yes,Recreation,Earth,10.46,0.815,6465.0,1865,,0.46492,111.66153446040819,Uncontrolled,25/10/2022,1,0.0,High,Satisfactory,2022-10-25,0.0785,356.7,558.9,7.9,10.46,0.815,0,6465.0,0,8.77431295828538,0,Unknow,0,0,0,1,0,0
SOAD02651,Flumevale,Yes,Water Supply,Earth,17.78,0.183,220500.0,1969,,0.32308,5.32658,,26/01/2022,1,10.72,High,Satisfactory,2017-09-01,0.0835,329.1,380.1,22.6,17.78,0.183,0,220500.0,0,12.3036575090061,0,Unknow,0,0,0,0,0,0
SOAD06857,Flumevale,Yes,Unknow,Earth,2.529,0.005,111.0,Unknow,,1.92469,344.63044453396316,,,0,0.0,Low,Not Rated,,0.0797,532.6,533.2,18.51605253378497,2.529,0.005,0,111.0,0,4.71849887129509,0,Unknow,0,0,0,1,0,0
SOAD03663,Flumevale,Yes,Water Supply,Earth,13.148,0.14,37475.07709565735,Unknow,,0.35263,10.65316,,31/05/2022,0.5,74.83032683566461,Low,Satisfactory,2017-09-01,0.0832,587.1,17.7,33.3,13.148,0.14,0,,1,,0,Unknow,0,0,1,0,0,1
SOAD07268,Flumevale,Yes,Irrigation,Earth,6.457,0.498,55642.0,1903,2001,0.52402,403.9695205183279,Uncontrolled,29/07/2022,1,0.0,High,Not Rated,,0.1262,569.8,346.2,41.4,6.457,0.498,0,55642.0,0,10.9267115626284,1,2001,0,0,0,1,0,0
SOAD15307,Flumevale,Yes,Irrigation,Earth,13.598,0.833,94752.22633935919,1908,1940;1969,0.48659,68.68605693919778,Uncontrolled,30/03/2022,1,0.0,High,Unsatisfactory,2022-03-30,0.1299,465.4,567.2,36.8,13.598,0.833,0,,1,,2,1969,0,0,1,1,0,0
SOAD07887,Flumevale,Yes,Flood Risk Reduction,Earth,11.143,0.492,62971.2561001206,1960,,0.54372,34.62277,Uncontrolled,20/07/2020,3,11.46,Low,Not Rated,,0.1192,401.1,227.7,22.19881810679513,11.143,0.492,0,,1,,0,Unknow,0,0,1,0,0,0
SOAD00992,Flumevale,Yes,Irrigation,Earth,12.187,0.75,89083.0,1955,,0.33096,79.8987,,18/11/2021,6,37.41,Low,Not Rated,,0.0735,386.5,162.7,22.5,12.187,0.75,0,89083.0,0,11.3973350238207,0,Unknow,0,0,0,0,0,0
SOAD05749,Flumevale,Yes,Water Supply,Earth,6.4,0.873,51814.0,1962,,0.51417,296.68497336084334,Uncontrolled,16/11/2021,2,11.31,Significant,Satisfactory,2021-11-16,0.1213,495.5,466.8,46.8,6.4,0.873,0,51814.0,0,10.8554349616183,0,Unknow,0,0,0,1,0,0
SOAD08741,Flumevale,Yes,Flood Risk Reduction,Earth,12.014,0.667,2000.0,1985,,0.43734,21.30632,Uncontrolled,09/06/2021,3,8.16,Low,Not Rated,,0.0715,661.6,252.9,20.43052417892071,12.014,0.667,0,2000.0,0,7.60140233458373,0,Unknow,0,0,0,0,0,0
SOAD00956,Flumevale,Yes,Debris Control,Earth,15.353,0.762,1020741.0,2001,,0.64813,431.73180535637687,,15/12/2021,1,13.45,Significant,Satisfactory,2017-09-01,0.1053,389.3,122.3,22.221901669280935,15.353,0.762,0,1020741.0,0,13.8360403717766,0,Unknow,0,0,0,1,0,0
SOAD16413,Flumevale,Yes,Water Supply,Earth,22.777,0.183,654475.0,1972,,0.36248,5.32658,,06/06/2022,1,1.17,High,Satisfactory,2017-09-01,0.0876,525.6,608.1,37.3,22.777,0.183,0,654475.0,0,13.3915901944466,0,Unknow,0,0,0,0,0,0
SOAD02697,Flumevale,Yes,Water Supply,Earth,26.739,0.217,220000.0,1976,,0.27974,2.66329,,28/01/2022,1,2.12,High,Satisfactory,2017-09-01,0.0945,289.7,834.2,16.4,26.739,0.217,0,220000.0,0,12.3013873707787,0,Unknow,0,0,0,0,0,0
SOAD06929,Flumevale,Yes,Irrigation,Earth,8.213,0.508,23486.0,1928,,0.31323,52.4405521571164,Uncontrolled,23/06/2022,2,14.92,Significant,Satisfactory,2022-06-23,0.1018,472.1,415.9,37.8,8.213,0.508,0,23486.0,0,10.064202355576,0,Unknow,0,0,0,1,0,0
SOAD13869,Flumevale,Yes,Water Supply,Earth,12.18,0.253,43956.81995419674,1893,,0.43143,15.97974,,23/08/2017,6,67.71,Low,Not Rated,,0.0825,325.0,195.9,21.3,12.18,0.253,0,,1,,0,Unknow,0,0,1,0,0,0
SOAD11877,Flumevale,Yes,Irrigation,Earth,8.018,0.22,18015.0,1892,1973H;1973S,0.33293,62.63967633300174,Uncontrolled,11/08/2022,2,15.03,Significant,Fair,2022-08-11,0.1322,447.9,436.1,1.6,8.018,0.22,0,18015.0,0,9.79901553093942,2,1973,0,0,0,1,0,0
SOAD17097,Flumevale,Yes,Irrigation,Earth,14.418,0.265,8070.0,1935,,0.50038,7.98987,,25/07/2022,6,34.77,Low,Satisfactory,2015-07-14,0.0297,634.3,145.9,12.0,14.418,0.265,0,8070.0,0,8.99603266932437,0,Unknow,0,0,0,0,0,0
