"ID","Region","Regulated.Dam","Primary.Purpose","Primary.Type","Height..m.","Length..km.","Volume..m3.","Year.Completed","Years.Modified","Surface..km2.","Drainage..km2.","Spillway","Last.Inspection.Date","Inspection.Frequency","Distance.to.Nearest.City..km.","Hazard","Assessment","Assessment.Date","Probability.of.Failure","Loss.given.failure...prop..Qm.","Loss.given.failure...liab..Qm.","Loss.given.failure...BI..Qm.","Height_clean","Length_clean","Length_missing","Volume_clean","Volume_missing","Volume_log","n_modifications","last_modification_year"
"SOAD02906","Flumevale","Yes","Unknow","Earth",0,0.082,15650,"1947","",0.01773,NA,"","05/08/2020","1",0,"High","Not Available",NA,0.1355,30.6,651.4,NA,NA,0.082,0,15650,0,9.6582900916905,0,"Unknow"
"SOAD05705","Flumevale","No","Recreation","Earth",8.746,0.1,15000,"1950","",NA,NA,"Uncontrolled","22/10/2015","5",83.19,"Significant","Not Rated",NA,0.1355,107,74.2,6.1,8.746,0.1,0,15000,0,9.61587214452889,0,"Unknow"
"SOAD07112","Flumevale","No","Irrigation","Earth",7.961,0.262,9180,"1918","",NA,NA,"Controlled","28/09/2015","5",NA,"Significant","Not Rated",NA,0.1108,219.6,160.6,38.9,7.961,0.262,0,9180,0,9.1248914101437,0,"Unknow"
"SOAD10770","Flumevale","No","Fish and Wildlife Pond","Earth",10.525,0.05,NA,"1875","",NA,NA,"Uncontrolled","26/02/2020","1",NA,"High","Not Rated",NA,0.1203,851.5,772.2,NA,10.525,0.05,0,NA,1,NA,0,"Unknow"
"SOAD11108","Flumevale","No","Flood Risk Reduction","Earth",6.122,0.307,NA,"2005","",NA,NA,"","11/09/2018","5",NA,"Significant","Not Available",NA,0.1411,256.9,461.9,NA,6.122,0.307,0,NA,1,NA,0,"Unknow"
"SOAD18122","Flumevale","No","Other","Earth",13.878,0.073,NA,"1949","",NA,NA,"Uncontrolled","26/02/2020","1",0.16,"High","Not Rated",NA,0.102,925.1,619.9,NA,13.878,0.073,0,NA,1,NA,0,"Unknow"
"SOAD19425","Flumevale","No","Flood Risk Reduction","Earth",27.419,0.347,220000,"1971","",0.00788,NA,"","06/07/2023","1",6.32,"High","Satisfactory","2023-09-29",0.1104,16.4,201.5,NA,27.419,0.347,0,220000,0,12.3013873707787,0,"Unknow"
"SOAD03833","Flumevale","Yes","Fire Protection, Stock, Or Small Fish Pond","Earth",3.977,0.115,2773,"1983","1996",0.00788,0,"Uncontrolled","18/06/2020","2",11.26,"Significant","Satisfactory","2020-06-18",0.1354,39.8,121.9,NA,3.977,0.115,0,2773,0,7.92804560087478,1,"1996"
"SOAD14182","Flumevale","No","Tailings","Earth",8.658,0.267,NA,"Unknow","",NA,NA,"","","Unknow",4.75,"High","Not Available",NA,0.1235,844.9,374.4,NA,8.658,0.267,0,NA,1,NA,0,"Unknow"
"SOAD02312","Flumevale","No","Other","Earth",10.679,0.08,NA,"Unknow","",NA,NA,"","","Unknow",1.67,"Significant","Not Available",NA,0.1661,306.3,365.5,NA,10.679,0.08,0,NA,1,NA,0,"Unknow"
"SOAD01247","Flumevale","No","Water Supply","Earth",7.299,0.253,NA,"Unknow","",NA,NA,"","","Unknow",1.67,"Significant","Not Available",NA,0.1451,312.7,887.2,47.5,7.299,0.253,0,NA,1,NA,0,"Unknow"
"SOAD11867","Flumevale","Yes","Water Supply","Earth",4.43,0.083,NA,"1999","2000",0.00788,0,"Uncontrolled","24/05/2013","2",11.38,"Significant","Fair","2013-05-24",0.1314,18.3,151.7,15,4.43,0.083,0,NA,1,NA,1,"2000"
"SOAD15152","Flumevale","Yes","Flood Risk Reduction","Earth",11.071,0.095,21140,"2005","",0.00788,0,"Uncontrolled","17/09/2020","1",NA,"High","Fair","2020-09-17",0.1114,43.7,816.2,NA,11.071,0.095,0,21140,0,9.95896956199513,0,"Unknow"
"SOAD02714","Flumevale","No","Water Supply","Earth",13.753,0.033,NA,"Unknow","",NA,NA,"","","Unknow",7.67,"High","Not Available",NA,0.1083,672.7,452.4,51.7,13.753,0.033,0,NA,1,NA,0,"Unknow"
"SOAD05372","Flumevale","Yes","Irrigation","Earth",5.634,0.08,3550,"1960","",0.00788,7.98987,"Uncontrolled","21/06/2021","2",16.56,"Significant","Fair","2021-06-21",0.1503,8.1,260.9,24.6,5.634,0.08,0,3550,0,8.17498453294309,0,"Unknow"
"SOAD11286","Flumevale","Yes","Recreation","Earth",3.498,0.133,NA,"1966","",0.00788,7.98987,"Uncontrolled","29/08/2022","2",1.59,"Significant","Fair","2022-08-29",0.1333,11.7,704.8,4.9,3.498,0.133,0,NA,1,NA,0,"Unknow"
"SOAD03788","Flumevale","Yes","Recreation","Earth",2.778,0.1,698,"1933","",0.01773,7.98987,"Uncontrolled","24/08/2022","2",0,"Significant","Satisfactory","2022-08-24",0.1303,43.8,343.5,5.8,2.778,0.1,0,698,0,6.54965074223381,0,"Unknow"
"SOAD08746","Flumevale","Yes","Flood Risk Reduction","Earth",13.48,0.12,8900,"2005","",0.00788,0,"Uncontrolled","17/09/2020","1",0,"High","Fair","2020-09-17",0.0965,8.6,531.1,NA,13.48,0.12,0,8900,0,9.09391890895893,0,"Unknow"
"SOAD10234","Flumevale","Yes","Water Supply","Earth",7.349,0.06,NA,"2007","2016",0.00788,0,"Uncontrolled","28/09/2021","2",3.35,"Significant","Satisfactory","2021-09-28",0.1222,33.1,879.3,54.1,7.349,0.06,0,NA,1,NA,1,"2016"
"SOAD12835","Flumevale","Yes","Water Supply","Earth",7.45,0.093,7400,"1964","2011H",0.00788,0,"Uncontrolled","05/05/2021","2",4.63,"Significant","Satisfactory","2021-05-05",0.1031,39.9,162.8,46.6,7.45,0.093,0,7400,0,8.90937040519747,1,"2011"
"SOAD01805","Flumevale","No","Debris Control","Earth",24.241,0.167,0,"1938","",0.00788,13.31645,"Uncontrolled","18/05/2022","5",NA,"High","Not Available",NA,0.078,32.3,681.5,NA,24.241,0.167,0,NA,1,NA,0,"Unknow"
"SOAD13805","Flumevale","No","Fish and Wildlife Pond","Earth",4.377,0.058,2461,"1934","",0,0,"Uncontrolled","18/08/2010","Unknow",25.04,"Significant","Not Rated",NA,0.1194,5,123.9,NA,4.377,0.058,0,2461,0,7.8087293067444,0,"Unknow"
"SOAD03137","Flumevale","Yes","Hydroelectric","Earth",9.44,0.136,NA,"1983","",0.0197,NA,"","11/09/2019","2",NA,"Low","Satisfactory","2023-04-11",0.0644,15,8.5,NA,9.44,0.136,0,NA,1,NA,0,"Unknow"
"SOAD18509","Flumevale","Yes","Recreation","Earth",5.384,0.193,NA,"Unknow","",0.01576,0,"","16/11/2021","2",6.48,"Significant","Satisfactory","2021-11-16",0.1246,38.9,358.6,4.3,5.384,0.193,0,NA,1,NA,0,"Unknow"
"SOAD10593","Flumevale","Yes","Unknow","Earth",8.948,0.16,NA,"1953","",0.03349,45.27593,"Uncontrolled","13/07/2018","6",1.61,"Low","Unsatisfactory","2011-05-18",0.0936,5.4,953.9,NA,8.948,0.16,0,NA,1,NA,0,"Unknow"
"SOAD12130","Flumevale","Yes","Irrigation","Earth",13.105,0.1,0,"1990","",0.01576,NA,"","21/02/2023","1",NA,"Significant","Fair","2017-09-01",0.1522,46.3,199,9.4,13.105,0.1,0,NA,1,NA,0,"Unknow"
"SOAD20636","Flumevale","Yes","Water Supply","Earth",9.271,0.167,600,"1982","",0.01773,0,"","23/10/2018","6",1.61,"Low","Satisfactory","2016-07-22",0.0438,8.9,821.9,13.7,9.271,0.167,0,600,0,6.39859493453521,0,"Unknow"
"SOAD00507","Flumevale","Yes","Water Supply","Earth",16.582,0.087,16850,"1989","",0.00788,0,"Uncontrolled","25/03/2019","6",9.41,"Low","Not Rated",NA,0.0624,31.2,217.4,11,16.582,0.087,0,16850,0,9.73216528120054,0,"Unknow"
"SOAD14947","Flumevale","Yes","Irrigation","Earth",11.707,0.037,0,"1973","",0.00788,0,"Uncontrolled","21/04/2004","0",13.27,"Low","Not Rated",NA,0.0843,26.7,123.1,23.4,11.707,0.037,0,NA,1,NA,0,"Unknow"
"SOAD18593","Flumevale","Yes","Water Supply","Earth",14.382,0.209,42500,"1922","",0.00788,0,"","16/03/2022","1",NA,"Low","Satisfactory","2017-09-01",0.0786,34.9,17.3,67,14.382,0.209,0,42500,0,10.6572828840475,0,"Unknow"
"SOAD20352","Flumevale","Yes","Flood Risk Reduction","Earth",13.481,0.05,145,"1974","1977",0.00788,0,"","02/12/2016","3",1.69,"Low","Not Rated",NA,0.1019,8.8,357.6,NA,13.481,0.05,0,145,0,4.98360662170834,1,"1977"
"SOAD02117","Flumevale","Yes","Recreation","Earth",11.511,0.14,NA,"Unknow","",0.01576,0,"Uncontrolled","24/06/2021","6",NA,"Low","Fair","2018-09-25",0.0524,28.1,23.7,3.9,11.511,0.14,0,NA,1,NA,0,"Unknow"
"SOAD06483","Flumevale","No","Unknow","Earth",8.502,0,0,"1944","",0.0197,1078.63245,"","07/12/2022","Unknow",NA,"Significant","Not Available",NA,0.1584,30.1,235,NA,8.502,NA,1,NA,1,NA,0,"Unknow"
"SOAD09248","Flumevale","Yes","Other","Earth",15.568,0.133,42562,"1979","",0.00788,0,"","01/01/1991","6",24.89,"Low","Not Rated",NA,0.0225,20.2,171.7,NA,15.568,0.133,0,42562,0,10.6587406102531,0,"Unknow"
"SOAD12911","Flumevale","Yes","Water Supply","Earth",31.238,0.1,57000,"1940","",0.00788,0,"","24/08/2022","1",0.16,"High","Satisfactory","2017-09-01",0.069,31.5,144.8,32.6,31.238,0.1,0,57000,0,10.9508240905224,0,"Unknow"
"SOAD20752","Flumevale","Yes","Water Supply","Earth",12.74,0.111,17065,"1962","",0.01773,0,"","11/08/2022","1",0.47,"High","Satisfactory","2017-09-01",0.0782,18.6,665.2,62.6,12.74,0.111,0,17065,0,9.74484345909653,0,"Unknow"
"SOAD02445","Flumevale","Yes","Irrigation","Earth",9.043,0.243,8100,"2006","",0.02364,0,"Uncontrolled","01/10/2018","6",NA,"Low","Satisfactory","2015-10-23",0.0523,38.9,14.7,36.4,9.043,0.243,0,8100,0,8.99974278983049,0,"Unknow"
"SOAD02894","Flumevale","Yes","Debris Control","Earth",13.579,0.088,28000,"1962","",0.00788,2.66329,"","20/10/2021","1",0,"High","Satisfactory","2017-09-01",0.0753,16.4,234.3,NA,13.579,0.088,0,28000,0,10.2399955028053,0,"Unknow"
"SOAD19913","Flumevale","No","Other","Earth",5.106,0.033,NA,"Unknow","",NA,NA,"","","Unknow",1.01,"High","Not Available",NA,0.1051,885,246.6,NA,5.106,0.033,0,NA,1,NA,0,"Unknow"
"SOAD00632","Flumevale","Yes","Irrigation","Earth",8.833,0.067,NA,"1946","",0.01576,0,"Uncontrolled","06/06/2014","6",6.58,"Low","Not Rated",NA,0.0804,25.1,330.2,20.9,8.833,0.067,0,NA,1,NA,0,"Unknow"
"SOAD01721","Flumevale","Yes","Water Supply","Earth",10.502,0.347,11400,"1954","",0.01576,0,"","17/03/2022","1",NA,"High","Satisfactory","2017-09-01",0.0723,25.1,850.6,13.4,10.502,0.347,0,11400,0,9.34145634983372,0,"Unknow"
"SOAD08116","Flumevale","Yes","Hydroelectric","Earth",14.519,0.15,NA,"1906","",0.02364,NA,"Uncontrolled","08/09/2022","3",3.27,"Low","Fair","2023-09-29",0.081,26.4,328.2,79,14.519,0.15,0,NA,1,NA,0,"Unknow"
"SOAD08173","Flumevale","Yes","Debris Control","Earth",23.083,0.082,62000,"1957","",0.01773,NA,"","17/02/2022","1",0.16,"High","Satisfactory","2017-09-01",0.0867,41.5,699,NA,23.083,0.082,0,62000,0,11.0349057929294,0,"Unknow"
"SOAD11011","Flumevale","Yes","Recreation","Earth",7.912,0.07,3641,"1955","",0,15.97974,"Uncontrolled","14/09/2010","Unknow",0,"Significant","Not Rated",NA,0.1786,5.9,554.8,4.3,7.912,0.07,0,3641,0,8.20028826028755,0,"Unknow"
"SOAD19635","Flumevale","Yes","Flood Risk Reduction","Earth",13.349,0.07,10875,"1959","",0.01576,0,"Uncontrolled","05/11/2013","3",12.74,"Low","Satisfactory","2019-04-15",0.0613,7.7,425.9,NA,13.349,0.07,0,10875,0,9.29431380575236,0,"Unknow"
"SOAD06018","Flumevale","Yes","Recreation","Earth",6.087,0.083,NA,"Unknow","2016",0.01773,7.98987,"","31/10/2019","2",27.72,"Significant","Satisfactory","2019-10-31",0.1228,18.5,472.8,3.1,6.087,0.083,0,NA,1,NA,1,"2016"
"SOAD06333","Flumevale","Yes","Irrigation","Earth",14.307,0.07,0,"1973","",0.00788,0,"Uncontrolled","21/04/2004","0",12.97,"Low","Fair","2019-10-08",0.0768,41,372.3,42,14.307,0.07,0,NA,1,NA,0,"Unknow"
"SOAD07705","Flumevale","Yes","Unknow","Earth",11.951,0.077,0,"1950","",0.01379,NA,"","10/08/2022","1",2.3,"High","Fair","2017-09-01",0.1022,16.9,449.3,NA,11.951,0.077,0,NA,1,NA,0,"Unknow"
"SOAD12420","Flumevale","Yes","Water Supply","Earth",14.684,0.097,19400,"1969","",0.01576,0,"","06/04/2022","0.5",NA,"Low","Satisfactory","2017-09-01",0.0489,47.3,22.6,12.9,14.684,0.097,0,19400,0,9.8730798901147,0,"Unknow"
"SOAD02075","Flumevale","No","Other","Earth",26.928,0.133,NA,"Unknow","",NA,NA,"","","Unknow",6.39,"High","Not Available",NA,0.0841,520.5,161.2,NA,26.928,0.133,0,NA,1,NA,0,"Unknow"
"SOAD03528","Flumevale","Yes","Water Supply","Earth",14.85,0.117,9600,"1962","",0.00788,NA,"","27/05/2022","1",0,"High","Satisfactory","2017-09-01",0.1102,45.6,595.7,5.3,14.85,0.117,0,9600,0,9.16962253869762,0,"Unknow"
"SOAD04421","Flumevale","Yes","Recreation","Earth",8.878,0.043,5108,"1935","1975S;1984S;1995",0.01576,0,"Uncontrolled","14/05/2020","6",8.11,"Low","Satisfactory","2009-03-20",0.0345,29.4,364.8,5.4,8.878,0.043,0,5108,0,8.5387589693308,3,"1995"
"SOAD09829","Flumevale","No","Recreation","Earth",9.463,0.07,NA,"1955","",NA,0,"Uncontrolled","09/06/2014","10",28.59,"Low","Not Rated",NA,0.057,19.8,210.7,2.9,9.463,0.07,0,NA,1,NA,0,"Unknow"
"SOAD14395","Flumevale","Yes","Water Supply","Earth",24.015,0.08,75722,"1980","",0.00788,42.61264,"Uncontrolled","21/10/2003","0",3.2,"Low","Not Rated",NA,0.1188,23.7,914.3,20.7,24.015,0.08,0,75722,0,11.2348372241898,0,"Unknow"
"SOAD01676","Flumevale","Yes","Unknow","Earth",9.449,0.08,NA,"1982","",0.00788,0,"Uncontrolled","20/03/2019","6",0,"Low","Satisfactory","2020-07-28",0.0327,20.7,105.1,NA,9.449,0.08,0,NA,1,NA,0,"Unknow"
"SOAD03436","Flumevale","Yes","Other","Earth",10.554,0.063,NA,"1974","",0.01576,0,"Uncontrolled","30/04/1992","0",0,"Low","Not Rated",NA,0.0814,47.1,910.2,NA,10.554,0.063,0,NA,1,NA,0,"Unknow"
"SOAD05014","Flumevale","Yes","Debris Control","Earth",13.242,0.127,0,"1962","",0.01773,5.32658,"","04/11/2021","1",0,"High","Satisfactory","2017-09-01",0.0812,28.7,772.7,NA,13.242,0.127,0,NA,1,NA,0,"Unknow"
"SOAD11258","Flumevale","Yes","Other","Earth",13.153,0.117,22260,"1950","",0.0197,NA,"","10/08/2022","1",2.35,"High","Fair","2017-09-01",0.1139,46.1,848.3,NA,13.153,0.117,0,22260,0,10.0105915474503,0,"Unknow"
"SOAD14220","Flumevale","Yes","Water Supply","Earth",10.841,0.094,26000,"2006","",0.01576,0,"Uncontrolled","15/02/2019","6",1.63,"Low","Not Rated",NA,0.0568,46.1,930.7,15.7,10.841,0.094,0,26000,0,10.1658902778025,0,"Unknow"
"SOAD18608","Flumevale","Yes","Water Supply","Earth",52.641,0.339,0,"1958","",0.01773,NA,"","26/10/2021","1",0.14,"High","Satisfactory","2017-09-01",0.0899,27.4,602.3,12.9,52.641,0.339,0,NA,1,NA,0,"Unknow"
"SOAD06890","Flumevale","Yes","Irrigation","Earth",10.521,0.108,NA,"1960","",0.01773,0,"Uncontrolled","24/09/2009","6",31.99,"Low","Not Rated",NA,0.0862,31.4,230.2,16.8,10.521,0.108,0,NA,1,NA,0,"Unknow"
"SOAD07167","Flumevale","Yes","Fire Protection, Stock, Or Small Fish Pond","Earth",10.485,0.073,6700,"1992","",0.00788,0,"Uncontrolled","09/08/2017","6",17.91,"Low","Not Rated",NA,0.0478,16.7,213.8,NA,10.485,0.073,0,6700,0,8.81001204797317,0,"Unknow"
"SOAD11290","Flumevale","Yes","Irrigation","Earth",10.449,0.055,13605,"1953","",0.00788,7.98987,"","19/07/2007","6",9.78,"Low","Not Rated",NA,0.0363,46.6,253.5,21.2,10.449,0.055,0,13605,0,9.51826615090501,0,"Unknow"
"SOAD12393","Flumevale","Yes","Irrigation","Earth",11.377,0.091,NA,"1965","1973;1993",0.01773,0,"Uncontrolled","14/05/2019","6",3.22,"Low","Satisfactory","2020-05-20",0.0319,34.2,780.8,44.8,11.377,0.091,0,NA,1,NA,2,"1993"
"SOAD20735","Flumevale","Yes","Recreation","Earth",4.735,0.073,0,"1967","2016",0.01773,13.31645,"Uncontrolled","12/08/2022","2",1.54,"Significant","Satisfactory","2022-08-12",0.1176,22.7,569.7,6,4.735,0.073,0,NA,1,NA,1,"2016"
"SOAD01605","Flumevale","Yes","Water Supply","Earth",15.335,0.147,27333,"1948","",0.01576,0,"","11/07/2023","0.5",NA,"Low","Poor","2018-07-20",0.1049,6.7,16.4,41.3,15.335,0.147,0,27333,0,10.2158866275247,0,"Unknow"
"SOAD01826","Flumevale","Yes","Water Supply","Earth",11.195,0.072,0,"1969","",0.00788,7.98987,"Uncontrolled","27/09/2013","6",3.07,"Low","Fair","2019-08-22",0.0568,5.9,621.6,32,11.195,0.072,0,NA,1,NA,0,"Unknow"
"SOAD02825","Flumevale","Yes","Flood Risk Reduction","Earth",9.257,0.149,0,"1957","",0.01576,0,"Uncontrolled","05/10/2020","6",13.92,"Low","Satisfactory","2013-11-05",0.0506,20.9,383.3,NA,9.257,0.149,0,NA,1,NA,0,"Unknow"
"SOAD03914","Flumevale","Yes","Recreation","Earth",8.851,0.134,8000,"1984","",0.00788,7.98987,"Uncontrolled","11/12/2018","6",3.3,"Low","Not Rated",NA,0.058,30.3,391.5,9.1,8.851,0.134,0,8000,0,8.98732181285012,0,"Unknow"
"SOAD18320","Flumevale","Yes","Water Supply","Earth",15.01,0.067,11000,"1890","",0.01576,2.66329,"","23/06/2022","1",0.79,"High","Satisfactory","2017-09-01",0.0941,33.6,569.5,15,15.01,0.067,0,11000,0,9.30574145673943,0,"Unknow"
"SOAD02366","Flumevale","Yes","Debris Control","Earth",26.889,0.619,379000,"1980","",0.02364,26.6329,"","27/01/2022","1",0,"High","Satisfactory","2017-09-01",0.1031,27.1,952.3,NA,26.889,0.619,0,379000,0,12.8452941225835,0,"Unknow"
"SOAD04740","Flumevale","No","Fire Protection, Stock, Or Small Fish Pond","Earth",8.287,0,0,"1954","",0,0,"","06/12/2022","Unknow",NA,"Significant","Not Available",NA,0.1843,28.9,448.7,NA,8.287,NA,1,NA,1,NA,0,"Unknow"
"SOAD05331","Flumevale","Yes","Water Supply","Earth",7.127,0.56,11822,"1996","",0.01576,0,"","18/06/2020","2",11.47,"Significant","Fair","2020-06-18",0.142,42.4,176.2,22.3,7.127,0.56,0,11822,0,9.37780206586311,0,"Unknow"
"SOAD08968","Flumevale","Yes","Irrigation","Earth",18.088,0.117,32000,"Unknow","",0.01576,NA,"","09/03/2023","1",NA,"Significant","Fair","2017-09-01",0.1225,5.4,179.7,30.2,18.088,0.117,0,32000,0,10.3735224312936,0,"Unknow"
"SOAD09486","Flumevale","Yes","Water Supply","Earth",12.535,0.067,0,"Unknow","",0.01576,NA,"","14/03/2018","1",NA,"Significant","Not Rated","2022-02-15",0.1499,19.8,155.4,62.8,12.535,0.067,0,NA,1,NA,0,"Unknow"
"SOAD10560","Flumevale","Yes","Other","Earth",17.26,0.09,18300,"1962","",0.01773,0,"","03/05/2022","0.5",NA,"Low","Satisfactory","2017-09-01",0.0746,43.6,19.5,NA,17.26,0.09,0,18300,0,9.81471098214528,0,"Unknow"
"SOAD10701","Flumevale","Yes","Recreation","Earth",9.345,0.09,NA,"1955","",0.01773,47.93922,"","18/11/1992","0",144.73,"Low","Fair","2014-09-25",0.0886,19.7,176.4,2.9,9.345,0.09,0,NA,1,NA,0,"Unknow"
"SOAD14640","Flumevale","Yes","Irrigation","Earth",12.453,0.077,NA,"1958","",0.01576,13.31645,"","02/11/1988","0",22.22,"Low","Satisfactory","2016-09-19",0.0694,45.5,307.6,5.5,12.453,0.077,0,NA,1,NA,0,"Unknow"
"SOAD00298","Flumevale","Yes","Hydroelectric","Earth",11.238,0.073,NA,"1904","",0.01576,74.57212,"","13/09/2012","6",23.39,"Low","Satisfactory","2015-10-05",0.0429,18.9,127.3,74.5,11.238,0.073,0,NA,1,NA,0,"Unknow"
"SOAD04543","Flumevale","Yes","Flood Risk Reduction","Earth",7.983,0.082,0,"1958","",0.01773,0,"Uncontrolled","01/11/2021","3",0,"Significant","Satisfactory","2021-11-01",0.1271,19.6,809.3,NA,7.983,0.082,0,NA,1,NA,0,"Unknow"
"SOAD11269","Flumevale","Yes","Debris Control","Earth",15.13,0.088,33000,"1986","",0.01773,5.32658,"","09/08/2022","1",4.99,"Significant","Satisfactory","2017-09-01",0.0987,12.4,722.7,NA,15.13,0.088,0,33000,0,10.4042931430198,0,"Unknow"
"SOAD20505","Flumevale","Yes","Recreation","Earth",9.89,0.071,0,"1954","",0.01576,13.31645,"Uncontrolled","06/10/2022","6",8.37,"Low","Fair","2022-09-27",0.0356,7.4,233.2,8.4,9.89,0.071,0,NA,1,NA,0,"Unknow"
"SOAD03390","Flumevale","No","Recreation","Earth",8.866,0.072,2891,"1938","",NA,26.6329,"Controlled","07/08/2013","10",19.44,"Low","Not Rated",NA,0.0195,8.3,302.5,6.2,8.866,0.072,0,2891,0,7.96970358327866,0,"Unknow"
"SOAD04757","Flumevale","Yes","Irrigation","Earth",9.706,0.07,0,"1953","",0.01773,0,"Uncontrolled","29/09/2022","6",23.17,"Low","Not Rated",NA,0.0821,25.6,280.5,11.7,9.706,0.07,0,NA,1,NA,0,"Unknow"
"SOAD01286","Flumevale","Yes","Water Supply","Earth",10.164,0.344,2500,"1964","",0.01773,0,"","16/03/2022","1",NA,"High","Satisfactory","2017-09-01",0.0855,11.3,601.4,68.7,10.164,0.344,0,2500,0,7.82444593087762,0,"Unknow"
"SOAD06818","Flumevale","Yes","Irrigation","Earth",12.671,0.133,2015,"1936","2004H;2004S",0.01773,21.30632,"Uncontrolled","23/06/2022","2",3.31,"Significant","Fair","2022-06-23",0.1386,41.9,113.4,12.7,12.671,0.133,0,2015,0,7.60887062919126,2,"2004"
"SOAD09813","Flumevale","Yes","Flood Risk Reduction","Earth",12.88,0.179,17400,"1959","",0.02561,0,"Uncontrolled","15/04/2014","3",8.19,"Low","Satisfactory","2020-06-05",0.0821,28.7,436.8,NA,12.88,0.179,0,17400,0,9.76428295481558,0,"Unknow"
"SOAD12655","Flumevale","Yes","Debris Control","Earth",18.056,0.308,83000,"1966","",0.00788,2.66329,"","01/12/2021","1",0.16,"High","Satisfactory","2017-09-01",0.0912,26.6,764.5,NA,18.056,0.308,0,83000,0,11.3266079348989,0,"Unknow"
"SOAD16968","Flumevale","Yes","Irrigation","Earth",12.899,0.088,12587,"1955","",0.01576,0,"","30/08/2017","6",10.88,"Low","Not Rated",NA,0.0835,39.5,433,40.3,12.899,0.088,0,12587,0,9.4404992581843,0,"Unknow"
"SOAD05259","Flumevale","Yes","Fish and Wildlife Pond","Earth",9.762,0.227,NA,"1970","",0.03349,0,"","20/09/2001","0",16.59,"Low","Fair","2018-12-11",0.097,39.7,245.9,NA,9.762,0.227,0,NA,1,NA,0,"Unknow"
"SOAD10322","Flumevale","Yes","Water Supply","Earth",13.184,0.367,38500,"1965","",0.01576,NA,"","25/05/2022","1",0,"High","Satisfactory","2017-09-01",0.0951,39.8,562.7,48.2,13.184,0.367,0,38500,0,10.5584394939645,0,"Unknow"
"SOAD15752","Flumevale","Yes","Irrigation","Earth",9.213,0.267,0,"1979","",0.01576,0,"Uncontrolled","23/05/2022","2",0,"Significant","Satisfactory","2022-05-23",0.1212,26.4,833.8,24,9.213,0.267,0,NA,1,NA,0,"Unknow"
"SOAD19994","Flumevale","Yes","Irrigation","Earth",10.12,0.092,0,"1990","",0.01576,0,"Uncontrolled","06/10/2020","6",1.58,"Low","Satisfactory","2019-07-19",0.0406,45.1,576.7,16.9,10.12,0.092,0,NA,1,NA,0,"Unknow"
"SOAD04121","Flumevale","Yes","Irrigation","Earth",11.601,0.062,6800,"2015","",0.01773,37.28606,"Uncontrolled","31/12/2015","0",14.46,"Low","Not Rated",NA,0.0808,36.7,257.4,37.4,11.601,0.062,0,6800,0,8.82482493917564,0,"Unknow"
"SOAD16350","Flumevale","Yes","Flood Risk Reduction","Earth",22.189,0.11,63000,"1964","",0.02561,2.66329,"","24/02/2022","1",0.4,"High","Satisfactory","2017-09-01",0.0932,44.4,933.6,NA,22.189,0.11,0,63000,0,11.0509058782636,0,"Unknow"
"SOAD02195","Flumevale","Yes","Other","Earth",12.833,0.06,6726,"1909","",0.03349,7.98987,"","10/02/2022","0.5",NA,"Low","Satisfactory","2017-09-01",0.0764,10.1,22.2,NA,12.833,0.06,0,6726,0,8.81388455802561,0,"Unknow"
"SOAD10076","Flumevale","Yes","Other","Earth",12.06,0.223,29900,"1938","",0.04334,0,"","21/10/1992","6",0,"Low","Not Rated",NA,0.0668,24.2,544.7,NA,12.06,0.223,0,29900,0,10.3056472036356,0,"Unknow"
"SOAD10957","Flumevale","Yes","Other","Earth",14.258,0.059,22400,"1892","",0.01576,0,"","14/09/2021","0.5",NA,"Low","Satisfactory","2017-09-01",0.071,24.2,20.9,NA,14.258,0.059,0,22400,0,10.0168608797038,0,"Unknow"
"SOAD01737","Flumevale","Yes","Fire Protection, Stock, Or Small Fish Pond","Earth",11.262,0.3,32482,"1963","",0.01576,0,"Uncontrolled","23/09/2013","6",0,"Low","Fair","2016-05-24",0.0666,22.6,283.5,NA,11.262,0.3,0,32482,0,10.3884721545423,0,"Unknow"
"SOAD05134","Flumevale","Yes","Water Supply","Earth",21.131,0.073,70870,"1949","",0.00788,0,"","24/08/2022","1",0,"High","Satisfactory","2017-09-01",0.0912,37,166.1,49,21.131,0.073,0,70870,0,11.1686166020476,0,"Unknow"
"SOAD10224","Flumevale","Yes","Water Supply","Earth",6.177,0.32,NA,"Unknow","",0.01576,0,"Uncontrolled","14/04/2022","2",0,"Significant","Satisfactory","2022-04-14",0.1062,24.2,231.8,33.1,6.177,0.32,0,NA,1,NA,0,"Unknow"
"SOAD18724","Flumevale","Yes","Water Supply","Earth",11.673,0.079,9500,"1974","",0.01773,0,"","21/04/2022","0.5",NA,"Low","Satisfactory","2017-09-01",0.0751,35.5,21.8,7.8,11.673,0.079,0,9500,0,9.15915233520675,0,"Unknow"
"SOAD01677","Flumevale","Yes","Water Supply","Earth",13.931,0.377,0,"1958","",0.01773,NA,"","24/04/2023","1",0.48,"High","Fair","2017-09-01",0.1039,39.1,106.5,8.4,13.931,0.377,0,NA,1,NA,0,"Unknow"
"SOAD04534","Flumevale","Yes","Water Supply","Earth",10.394,0.07,210,"1982","",0.01773,7.98987,"","29/08/2016","6",6.65,"Low","Fair","2017-03-22",0.0387,32.8,225.9,67.2,10.394,0.07,0,210,0,5.35185813347607,0,"Unknow"
"SOAD06267","Flumevale","Yes","Water Supply","Earth",15.703,0.076,13900,"1989","",0.01576,2.66329,"","08/06/2022","0.5",NA,"Low","Satisfactory","2017-09-01",0.0774,35.8,10.4,18.9,15.703,0.076,0,13900,0,9.53971605897709,0,"Unknow"
"SOAD06282","Flumevale","Yes","Water Supply","Earth",18.628,0.277,81500,"1964","",0.01773,NA,"","17/11/2021","1",0,"High","Satisfactory","2017-09-01",0.0961,41.5,893.6,37.4,18.628,0.277,0,81500,0,11.3083705690923,0,"Unknow"
"SOAD11458","Flumevale","Yes","Water Supply","Earth",19.035,0.067,29000,"1967","",0.01576,0,"","12/05/2022","1",0.84,"High","Satisfactory","2017-09-01",0.076,13.7,834.5,38,19.035,0.067,0,29000,0,10.2750855911327,0,"Unknow"
"SOAD04159","Flumevale","Yes","Recreation","Earth",19.17,0.135,36606,"Unknow","",0.00788,0,"","25/04/1988","6",4.78,"Low","Fair","2015-07-14",0.0423,16.3,529.7,6.7,19.17,0.135,0,36606,0,10.5079947579328,0,"Unknow"
"SOAD04617","Flumevale","No","Hydroelectric","Earth",6.838,0.58,37000,"1913","",0.03546,NA,"Uncontrolled","08/08/2023","1",5.07,"High","Satisfactory","2023-09-29",0.0943,28,341.4,88.1,6.838,0.58,0,37000,0,10.5187002182882,0,"Unknow"
"SOAD05907","Flumevale","Yes","Water Supply","Earth",19.254,0.05,10000,"1925","",0.03349,23.96961,"","13/09/2023","0.5",NA,"Low","Fair","2023-06-12",0.0864,40.6,20.8,67,19.254,0.05,0,10000,0,9.21044036697652,0,"Unknow"
"SOAD19896","Flumevale","Yes","Recreation","Earth",11.004,0.083,NA,"1965","",0.01773,29.29619,"Uncontrolled","29/07/2011","6",65.73,"Low","Not Rated",NA,0.0612,30.5,97.4,6.9,11.004,0.083,0,NA,1,NA,0,"Unknow"
"SOAD00053","Flumevale","Yes","Water Supply","Earth",11.742,0.113,60000,"1978","",0.03546,0,"","11/05/2022","0.5",1.26,"Low","Satisfactory","2017-09-01",0.0719,22.7,263.4,32.4,11.742,0.113,0,60000,0,11.002116507732,0,"Unknow"
"SOAD03085","Flumevale","Yes","Irrigation","Earth",9.576,0.308,23483,"1911","",0.03349,42.61264,"Uncontrolled","04/10/2017","6",16.2,"Low","Fair","2014-02-12",0.06,30.7,459.9,23.8,9.576,0.308,0,23483,0,10.0640746171841,0,"Unknow"
"SOAD12442","Flumevale","Yes","Water Supply","Earth",18.78,0.101,48390,"1950","",0.01773,2.66329,"","25/05/2023","1",NA,"High","Fair","2017-09-01",0.1025,30.3,725.2,33.1,18.78,0.101,0,48390,0,10.7870691250006,0,"Unknow"
"SOAD17712","Flumevale","Yes","Flood Risk Reduction","Earth",14.355,0.184,37900,"2011","",0.02364,2.66329,"","08/02/2022","1",0.16,"High","Satisfactory","2017-09-01",0.0798,15.3,558.2,NA,14.355,0.184,0,37900,0,10.5427327759467,0,"Unknow"
"SOAD19568","Flumevale","Yes","Hydroelectric","Earth",15.643,0.113,NA,"1953","",0.02561,18.64303,"Controlled","31/05/2023","1",1.54,"High","Satisfactory","2023-09-29",0.115,39.1,455,77.8,15.643,0.113,0,NA,1,NA,0,"Unknow"
"SOAD00262","Flumevale","Yes","Water Supply","Earth",18.45,0.063,34500,"1931","",0.00788,0,"","16/02/2022","0.5",NA,"Low","Satisfactory","2017-09-01",0.0656,30.1,9.8,60.3,18.45,0.063,0,34500,0,10.4487435881066,0,"Unknow"
"SOAD07256","Flumevale","Yes","Water Supply","Earth",34.514,0.077,50000,"1930","",0.00788,0,"","24/08/2022","1",0,"High","Satisfactory","2017-09-01",0.084,28,609.1,22.6,34.514,0.077,0,50000,0,10.8197982842103,0,"Unknow"
"SOAD07664","Flumevale","Yes","Fish and Wildlife Pond","Earth",6.366,0.193,6549,"1990","2001H;2009H",0.02561,0,"Uncontrolled","28/09/2021","2",4.6,"Significant","Fair","2021-09-28",0.1182,42.2,464.4,NA,6.366,0.193,0,6549,0,8.7872203286293,2,"2009"
"SOAD13849","Flumevale","Yes","Other","Earth",5.778,0.033,1680,"1907","",0.03152,0,"Uncontrolled","02/09/2020","2",8.22,"Significant","Unsatisfactory","2020-09-02",0.1715,44.5,327.4,NA,5.778,0.033,0,1680,0,7.42714413340862,0,"Unknow"
"SOAD15126","Flumevale","Yes","Irrigation","Earth",8.951,0.095,9606,"1952","",0.01773,7.98987,"Uncontrolled","02/10/2003","6",9.54,"Low","Not Rated",NA,0.0509,34.7,455.8,1,8.951,0.095,0,9606,0,9.17024727840974,0,"Unknow"
"SOAD02369","Flumevale","Yes","Water Supply","Earth",10.67,0.175,525,"1982","",0.01773,0,"","08/09/2015","6",10.1,"Low","Fair","2012-07-19",0.0634,35.9,359.9,44.8,10.67,0.175,0,525,0,6.26530121273771,0,"Unknow"
"SOAD03084","Flumevale","Yes","Fish and Wildlife Pond","Earth",10.235,0.087,NA,"1959","",0.02561,42.61264,"Uncontrolled","28/09/2005","6",44.86,"Low","Not Rated",NA,0.049,18.3,122.1,NA,10.235,0.087,0,NA,1,NA,0,"Unknow"
"SOAD03938","Flumevale","Yes","Water Supply","Earth",12.983,0.11,18672,"1980","",0.01773,0,"","22/06/2022","0.5",NA,"Low","Satisfactory","2017-09-01",0.0796,27.9,14.1,9.3,12.983,0.11,0,18672,0,9.83483390921908,0,"Unknow"
"SOAD08269","Flumevale","Yes","Other","Earth",12.457,0.09,11674,"1932","",0.02561,2.66329,"","06/04/2022","0.5",NA,"Low","Satisfactory","2017-09-01",0.0702,5.8,12.8,NA,12.457,0.09,0,11674,0,9.3652050825371,0,"Unknow"
"SOAD17154","Flumevale","Yes","Water Supply","Earth",13.3,0.19,37000,"1912","",0.01576,0,"","01/09/2022","1",0,"High","Satisfactory","2017-09-01",0.1,14.8,608.1,30.9,13.3,0.19,0,37000,0,10.5187002182882,0,"Unknow"
"SOAD00750","Flumevale","Yes","Recreation","Earth",8.045,0.26,17967,"2005","",0.02561,0,"Uncontrolled","30/06/2021","2",13,"Significant","Satisfactory","2021-06-30",0.1037,14.1,397,5.4,8.045,0.26,0,17967,0,9.79634767697822,0,"Unknow"
"SOAD01479","Flumevale","Yes","Debris Control","Earth",11.962,1.412,277000,"1980","",0.03546,18.64303,"","27/01/2022","1",0.16,"High","Satisfactory","2017-09-01",0.0935,45.6,921.7,NA,11.962,1.412,0,277000,0,12.5317763952713,0,"Unknow"
"SOAD06428","Flumevale","Yes","Recreation","Earth",6.408,0.063,3384,"1972","2005H;2005S",0.01773,138.49108,"Uncontrolled","15/05/2017","2",4.68,"Significant","Unsatisfactory","2017-05-15",0.1786,31.1,470,7.2,6.408,0.063,0,3384,0,8.12710918534638,2,"2005"
"SOAD06719","Flumevale","Yes","Recreation","Earth",15.431,0.074,13620,"1964","",0.02561,13.31645,"Uncontrolled","20/06/2018","6",4.78,"Low","Fair","2017-05-17",0.0676,11.9,657.6,6.8,15.431,0.074,0,13620,0,9.51936799844734,0,"Unknow"
"SOAD06781","Flumevale","No","Water Supply","Earth",8.992,0.099,NA,"1961","",0.02167,NA,"Uncontrolled","09/05/2023","4",41.98,"Low","Poor","2023-05-09",0.0546,47.3,181.3,18.5,8.992,0.099,0,NA,1,NA,0,"Unknow"
"SOAD10792","Flumevale","Yes","Water Supply","Earth",8.369,0.376,NA,"1992","2013",0.02561,0,"Uncontrolled","14/04/2022","2",0,"Significant","Satisfactory","2022-04-14",0.1324,7.3,170.4,15,8.369,0.376,0,NA,1,NA,1,"2013"
"SOAD15281","Flumevale","No","Irrigation","Earth",4.363,0.17,0,"Unknow","",0.06895,NA,"","20/04/2022","1",NA,"Significant","Fair","2017-09-01",0.1311,34.6,134,14.6,4.363,0.17,0,NA,1,NA,0,"Unknow"
"SOAD08445","Flumevale","No","Recreation","Earth",3.717,0.073,1591,"1939","",0,7.98987,"Controlled","06/09/1964","Unknow",1.13,"Significant","Not Rated",NA,0.1283,32.9,160.1,5,3.717,0.073,0,1591,0,7.37274636640433,0,"Unknow"
"SOAD09286","Flumevale","Yes","Water Supply","Earth",12.729,0.467,184800,"1983","",0.0197,NA,"","10/02/2022","0.5",NA,"Low","Satisfactory","2017-09-01",0.0618,20.8,22,16.9,12.729,0.467,0,184800,0,12.1270348494305,0,"Unknow"
"SOAD12831","Flumevale","Yes","Irrigation","Earth",12.085,0.273,NA,"1895","",0.01576,0,"Uncontrolled","08/08/2019","6",10.93,"Low","Not Rated",NA,0.0515,14.2,95.5,34.8,12.085,0.273,0,NA,1,NA,0,"Unknow"
"SOAD17692","Flumevale","Yes","Flood Risk Reduction","Earth",9.012,0.12,7252,"1955","",0.02561,0,"Uncontrolled","06/10/2020","3",18.44,"Low","Fair","2020-05-14",0.0763,29.1,389.8,NA,9.012,0.12,0,7252,0,8.88917045536341,0,"Unknow"
"SOAD17849","Flumevale","Yes","Water Supply","Earth",14.9,0.14,24000,"1937","",0.01576,0,"","01/06/2022","0.5",NA,"Low","Satisfactory","2017-09-01",0.0686,16.2,11.4,31.8,14.9,0.14,0,24000,0,10.0858507751287,0,"Unknow"
"SOAD10163","Flumevale","Yes","Water Supply","Earth",19.695,0.077,22000,"1962","",0.01773,0,"","01/06/2022","1",4.05,"Significant","Satisfactory","2017-09-01",0.1294,39.9,788.1,13.4,19.695,0.077,0,22000,0,9.99884318585288,0,"Unknow"
"SOAD17871","Flumevale","Yes","Irrigation","Earth",13.436,0.25,69140,"1966","",0.01773,0,"Uncontrolled","30/09/2016","6",3.25,"Low","Fair","2020-05-13",0.0639,38.2,856.9,31.7,13.436,0.25,0,69140,0,11.1439031767786,0,"Unknow"
"SOAD19875","Flumevale","No","Fish and Wildlife Pond","Earth",8.062,0.09,0,"Unknow","1997",0.03349,0,"","09/05/2022","Unknow",NA,"High","Not Available",NA,0.1234,28,931.5,NA,8.062,0.09,0,NA,1,NA,1,"1997"
"SOAD20096","Flumevale","Yes","Water Supply","Earth",10.56,0.167,0,"1928","",0.02561,0,"Uncontrolled","06/08/2001","6",16.72,"Low","Not Rated",NA,0.0996,46.1,147,25.9,10.56,0.167,0,NA,1,NA,0,"Unknow"
"SOAD02051","Flumevale","Yes","Irrigation","Earth",10.661,0.094,NA,"1903","2007",0.02561,21.30632,"Uncontrolled","30/06/2021","6",31.87,"Low","Not Rated",NA,0.0657,9.2,162.9,41.9,10.661,0.094,0,NA,1,NA,1,"2007"
"SOAD04526","Flumevale","Yes","Flood Risk Reduction","Earth",19.351,0.075,0,"1982","",0.00788,45.27593,"Uncontrolled","04/10/1995","3",23.35,"Low","Not Rated",NA,0.0566,35.2,261.1,NA,19.351,0.075,0,NA,1,NA,0,"Unknow"
"SOAD16367","Flumevale","Yes","Flood Risk Reduction","Earth",8.804,0.14,8146,"1955","",0.02561,0,"Uncontrolled","05/10/2020","6",12.57,"Low","Not Rated",NA,0.0466,34.1,276.3,NA,8.804,0.14,0,8146,0,9.00540504031064,0,"Unknow"
"SOAD08774","Flumevale","Yes","Irrigation","Earth",11.547,0.11,27226,"1968","",0.02561,0,"","19/04/2017","6",18.57,"Low","Not Rated",NA,0.0567,32.2,208.4,45.5,11.547,0.11,0,27226,0,10.2119644069946,0,"Unknow"
"SOAD11724","Flumevale","Yes","Water Supply","Earth",12.88,0.07,1240,"1965","",0.01576,NA,"","08/09/2022","1",NA,"High","Satisfactory","2017-09-01",0.1121,43.2,938.9,48.2,12.88,0.07,0,1240,0,7.12367278520461,0,"Unknow"
"SOAD16333","Flumevale","Yes","Flood Risk Reduction","Earth",9.163,0.112,8266,"1956","",0.02561,0,"Uncontrolled","05/10/2020","3",16.4,"Low","Satisfactory","2015-04-13",0.0672,46.3,157,NA,9.163,0.112,0,8266,0,9.02002696525268,0,"Unknow"
"SOAD06223","Flumevale","Yes","Water Supply","Earth",10.68,0.493,0,"1928","",0.01773,0,"","24/02/2022","1",0,"High","Satisfactory","2017-09-01",0.1004,25.4,783.6,26.7,10.68,0.493,0,NA,1,NA,0,"Unknow"
"SOAD09159","Flumevale","Yes","Flood Risk Reduction","Earth",8.692,0.16,0,"1972","",0.03349,0,"Uncontrolled","21/02/2017","3",51.46,"Low","Satisfactory","2022-12-01",0.0708,23.2,159.5,NA,8.692,0.16,0,NA,1,NA,0,"Unknow"
"SOAD14757","Flumevale","Yes","Other","Earth",11.72,0.192,NA,"1975","",0.02364,0,"","24/08/2017","6",0,"Low","Satisfactory","2021-06-09",0.0292,16.3,599.4,NA,11.72,0.192,0,NA,1,NA,0,"Unknow"
"SOAD15025","Flumevale","Yes","Fish and Wildlife Pond","Earth",9.477,0.048,NA,"1970","",0.02561,42.61264,"Uncontrolled","11/10/2017","6",26.13,"Low","Satisfactory","2020-10-05",0.043,18.1,239.8,NA,9.477,0.048,0,NA,1,NA,0,"Unknow"
"SOAD19322","Flumevale","Yes","Flood Risk Reduction","Earth",10.397,0.123,0,"1957","",0.02561,0,"Uncontrolled","05/11/2013","3",1.56,"Low","Fair","2005-08-30",0.0811,34.6,233.8,NA,10.397,0.123,0,NA,1,NA,0,"Unknow"
"SOAD03031","Flumevale","Yes","Water Supply","Earth",15.857,0.107,0,"1908","",0.01773,2.66329,"","08/03/2023","1",0.48,"High","Fair","2017-09-01",0.1328,18.8,375,45.4,15.857,0.107,0,NA,1,NA,0,"Unknow"
"SOAD08339","Flumevale","Yes","Fish and Wildlife Pond","Earth",10.519,0.083,NA,"1958","",0.02561,0,"Uncontrolled","10/11/2022","2",1.59,"Significant","Not Rated",NA,0.1535,12,607.8,NA,10.519,0.083,0,NA,1,NA,0,"Unknow"
"SOAD08628","Flumevale","Yes","Hydroelectric","Earth",16.272,0.091,NA,"1980","",0.03546,181.10372,"","15/09/2022","1",21.83,"Low","Satisfactory","2023-04-11",0.0674,35.1,369.7,56.6,16.272,0.091,0,NA,1,NA,0,"Unknow"
"SOAD09233","Flumevale","Yes","Water Supply","Earth",8.958,0.817,0,"1980","",0.03349,0,"Uncontrolled","23/10/2015","6",5.04,"Low","Satisfactory","2018-09-14",0.0414,45,108.3,32.8,8.958,0.817,0,NA,1,NA,0,"Unknow"
"SOAD09849","Flumevale","Yes","Irrigation","Earth",8.817,0.111,5610,"1948","2009",0.04137,0,"Uncontrolled","17/09/2009","6",13.48,"Low","Satisfactory","2015-10-23",0.0511,35.2,370.8,10.4,8.817,0.111,0,5610,0,8.63248423575097,1,"2009"
"SOAD12193","Flumevale","Yes","Irrigation","Earth",8.867,0.08,NA,"1930","2008",0.03349,0,"Uncontrolled","09/09/2021","6",15.83,"Low","Not Rated",NA,0.0635,39.7,344.6,35.2,8.867,0.08,0,NA,1,NA,1,"2008"
"SOAD12677","Flumevale","Yes","Irrigation","Earth",10.352,0.11,20047,"1988","",0.02561,0,"Uncontrolled","23/09/2022","1",4.63,"High","Fair","2022-09-23",0.0997,8.2,242.6,33.9,10.352,0.11,0,20047,0,9.90588467713585,0,"Unknow"
"SOAD14449","Flumevale","Yes","Debris Control","Earth",29.717,0.126,117000,"1963","",0.01773,7.98987,"","01/12/2021","1",0,"High","Satisfactory","2017-09-01",0.1015,27.4,931.9,NA,29.717,0.126,0,117000,0,11.6699377607519,0,"Unknow"
"SOAD05026","Flumevale","Yes","Recreation","Earth",6.284,0.146,8461,"1954","",0,13.31645,"Uncontrolled","14/09/2010","Unknow",0,"Significant","Not Rated",NA,0.1268,6.5,761.1,9.5,6.284,0.146,0,8461,0,9.04334083128001,0,"Unknow"
"SOAD15351","Flumevale","Yes","Irrigation","Earth",12.665,0.126,NA,"1955","",0.02561,7.98987,"","15/07/1992","0",24.68,"Low","Fair","2019-08-08",0.0794,35.5,452.4,11.8,12.665,0.126,0,NA,1,NA,0,"Unknow"
"SOAD17910","Flumevale","Yes","Water Supply","Earth",19.859,0.04,0,"Unknow","",NA,NA,"","09/05/2023","0.5",NA,"Low","Fair","2017-09-01",0.074,8.2,10.6,12.2,19.859,0.04,0,NA,1,NA,0,"Unknow"
"SOAD13472","Flumevale","Yes","Fish and Wildlife Pond","Earth",9.248,0.129,NA,"1987","",0.03152,0,"Uncontrolled","10/06/2020","6",12.66,"Low","Satisfactory","2013-09-26",0.0467,27.6,378.7,NA,9.248,0.129,0,NA,1,NA,0,"Unknow"
"SOAD14419","Flumevale","Yes","Recreation","Earth",9.128,0.101,10000,"1964","",0.02364,29.29619,"Uncontrolled","20/05/2020","6",0,"Low","Satisfactory","2016-09-30",0.0415,6.5,906,4.7,9.128,0.101,0,10000,0,9.21044036697652,0,"Unknow"
"SOAD14737","Flumevale","Yes","Water Supply","Earth",14.168,0.052,5713,"1860","",0.04334,0,"","28/01/2022","1",1,"High","Satisfactory","2017-09-01",0.0779,24.2,730.7,59.2,14.168,0.052,0,5713,0,8.65067458279072,0,"Unknow"
"SOAD15998","Flumevale","Yes","Irrigation","Earth",11.149,0.248,28500,"1895","1994",0.03349,0,"Uncontrolled","08/08/2019","6",10.72,"Low","Unsatisfactory","2017-05-08",0.0839,11.1,116.2,2.3,11.149,0.248,0,28500,0,10.2576944533605,1,"1994"
"SOAD02339","Flumevale","Yes","Water Supply","Earth",13.988,0.218,713,"1982","",0.02561,0,"Uncontrolled","15/12/2022","1",1.66,"High","Satisfactory","2022-12-15",0.1075,33.6,332.8,61.8,13.988,0.218,0,713,0,6.57088296233958,0,"Unknow"
"SOAD03269","Flumevale","Yes","Irrigation","Earth",9.145,0.213,63279,"1912","1960",0.03546,0,"Uncontrolled","09/07/2012","6",29.98,"Low","Not Rated",NA,0.0269,34.5,127.8,19.6,9.145,0.213,0,63279,0,11.0553246024415,1,"1960"
"SOAD08642","Flumevale","Yes","Irrigation","Earth",11.582,0.099,28943,"Unknow","1973",0.02561,0,"Uncontrolled","19/10/2018","6",12.7,"Low","Unsatisfactory","2011-05-18",0.0971,21.7,386.4,37.2,11.582,0.099,0,28943,0,10.2731182076351,1,"1973"
"SOAD10875","Flumevale","Yes","Other","Earth",12.865,0.102,22000,"1964","",0.02561,2.66329,"","21/02/2022","1",0,"High","Satisfactory","2017-09-01",0.0917,42.2,793.6,NA,12.865,0.102,0,22000,0,9.99884318585288,0,"Unknow"
"SOAD17721","Flumevale","Yes","Flood Risk Reduction","Earth",11.845,0.144,14570,"1958","",0.03349,0,"Uncontrolled","04/06/2015","3",11.28,"Low","Not Rated",NA,0.1154,21.8,416,NA,11.845,0.144,0,14570,0,9.58678853101385,0,"Unknow"
"SOAD00406","Flumevale","Yes","Fire Protection, Stock, Or Small Fish Pond","Earth",11.784,0.105,44754,"1957","",0.02561,0,"Uncontrolled","15/09/2021","6",8.42,"Low","Satisfactory","2020-10-13",0.0526,27.1,418.6,NA,11.784,0.105,0,44754,0,10.708958449305,0,"Unknow"
"SOAD02064","Flumevale","Yes","Flood Risk Reduction","Earth",10.912,0.115,26144,"1958","",0.02561,0,"Uncontrolled","01/11/2021","3",1.54,"Significant","Satisfactory","2021-11-01",0.1182,29.7,393.4,NA,10.912,0.115,0,26144,0,10.1714132466222,0,"Unknow"
"SOAD02488","Flumevale","No","Irrigation","Earth",11.277,4.507,41000,"1953","2003",0.02561,7.98987,"Uncontrolled","26/08/2020","1",3.33,"High","Not Available",NA,0.1295,39.7,651.9,36.5,11.277,4.507,0,41000,0,10.6213517356329,1,"2003"
"SOAD06671","Flumevale","Yes","Recreation","Earth",5.899,0.06,5919,"1890","2006H;2006M;2006S",0.03152,0,"Uncontrolled","23/09/2021","2",1.69,"Significant","Satisfactory","2021-09-23",0.1239,19.9,936.9,3.4,5.899,0.06,0,5919,0,8.68609172787805,3,"2006"
"SOAD12481","Flumevale","Yes","Irrigation","Earth",8.354,0.083,7280,"1962","",0.03349,0,"Uncontrolled","11/11/1990","0",6.31,"Low","Not Rated",NA,0.0895,12.5,458.3,13.4,8.354,0.083,0,7280,0,8.89302349439471,0,"Unknow"
"SOAD13873","Flumevale","Yes","Debris Control","Earth",15.415,0.133,94000,"1965","",0.02561,7.98987,"","01/12/2021","1",0,"High","Satisfactory","2017-09-01",0.1193,35.2,849.6,NA,15.415,0.133,0,94000,0,11.4510606994934,0,"Unknow"
"SOAD14813","Flumevale","Yes","Water Supply","Earth",11.616,0.16,23000,"1965","",0.04334,0,"","14/03/2022","0.5",28.37,"Low","Satisfactory","2017-09-01",0.0809,29.1,245.9,24.8,11.616,0.16,0,23000,0,10.043292972227,0,"Unknow"
"SOAD19297","Flumevale","Yes","Hydroelectric","Earth",11.431,0.3,NA,"Unknow","",0.0197,NA,"Uncontrolled","07/07/2022","3",NA,"Low","Satisfactory","2023-09-29",0.0644,13.9,22.1,NA,11.431,0.3,0,NA,1,NA,0,"Unknow"
"SOAD20625","Flumevale","Yes","Irrigation","Earth",8.762,0.333,NA,"1967","",0.04137,0,"","17/10/2013","0",1.66,"Low","Not Rated",NA,0.1158,22.4,187.3,19,8.762,0.333,0,NA,1,NA,0,"Unknow"
"SOAD03573","Flumevale","Yes","Irrigation","Earth",9.202,0.423,NA,"2006","",0.02561,0,"Uncontrolled","05/04/2021","6",9.88,"Low","Fair","2009-08-12",0.0544,40.8,262.6,17.2,9.202,0.423,0,NA,1,NA,0,"Unknow"
"SOAD03857","Flumevale","Yes","Water Supply","Earth",25.949,0.255,74000,"1961","",0.02364,0,"","08/09/2022","1",NA,"High","Satisfactory","2017-09-01",0.081,23.2,792.1,8.9,25.949,0.255,0,74000,0,11.2118338856085,0,"Unknow"
"SOAD15427","Flumevale","Yes","Recreation","Earth",7.911,0.142,24908,"1974","",0.03546,0,"Uncontrolled","11/04/2022","2",0,"Significant","Satisfactory","2022-04-11",0.0992,13,933.6,7.4,7.911,0.142,0,24908,0,10.1229844629301,0,"Unknow"
"SOAD15727","Flumevale","Yes","Irrigation","Earth",9.84,0.087,NA,"1964","",0.03546,21.30632,"Uncontrolled","09/09/2013","6",17.81,"Low","Fair","2021-10-28",0.049,18.7,333.7,21.5,9.84,0.087,0,NA,1,NA,0,"Unknow"
"SOAD18973","Flumevale","Yes","Water Supply","Earth",20.635,0.093,19200,"1885","",0.03349,2.66329,"","23/06/2022","1",NA,"High","Satisfactory","2017-09-01",0.0807,7.7,620.6,50.2,20.635,0.093,0,19200,0,9.86271763999292,0,"Unknow"
"SOAD02418","Flumevale","Yes","Water Supply","Earth",33.52,0.435,0,"1962","",0.01576,NA,"","18/10/2022","1",0,"Significant","Fair","2017-09-01",0.125,42.6,162.3,45.4,33.52,0.435,0,NA,1,NA,0,"Unknow"
"SOAD10703","Flumevale","Yes","Water Supply","Earth",13.567,0.71,0,"Unknow","",NA,NA,"","06/03/2023","1",0,"High","Fair","2018-07-23",0.109,743,948.4,70.7,13.567,0.71,0,NA,1,NA,0,"Unknow"
"SOAD18939","Flumevale","Yes","Fish and Wildlife Pond","Earth",8.983,0.265,NA,"1970","",0.03349,0,"","20/09/2001","0",16.3,"Low","Satisfactory","2017-02-21",0.0754,38.9,292.4,NA,8.983,0.265,0,NA,1,NA,0,"Unknow"
"SOAD02700","Flumevale","No","Unknow","Earth",10.363,0,0,"Unknow","",NA,0,"","07/12/2022","Unknow",NA,"High","Not Available",NA,0.0996,878.6,896,NA,10.363,NA,1,NA,1,NA,0,"Unknow"
"SOAD04787","Flumevale","Yes","Water Supply","Earth",17.183,0.095,11430,"1971","",0.03546,2.66329,"","19/10/2021","1",8.27,"Significant","Satisfactory","2017-09-01",0.115,31.5,268.3,48,17.183,0.095,0,11430,0,9.34408424202578,0,"Unknow"
"SOAD11046","Flumevale","Yes","Recreation","Earth",17.895,0.117,20000,"1958","",0.03546,2.66329,"","15/09/2021","0.5",NA,"Low","Satisfactory","2017-09-01",0.0666,45,21,5.9,17.895,0.117,0,20000,0,9.90353755128617,0,"Unknow"
"SOAD15266","Flumevale","Yes","Flood Risk Reduction","Earth",11.354,0.158,18670,"1963","",0.04137,0,"","03/04/2019","3",13.9,"Low","Not Rated",NA,0.0696,26.9,465.7,NA,11.354,0.158,0,18670,0,9.83472679696534,0,"Unknow"
"SOAD15580","Flumevale","Yes","Flood Risk Reduction","Earth",8.618,0.309,0,"1961","",0.05319,0,"","13/07/2017","3",26.45,"Low","Fair","2020-06-17",0.0805,44.2,316.8,NA,8.618,0.309,0,NA,1,NA,0,"Unknow"
"SOAD16461","Flumevale","Yes","Debris Control","Earth",22.152,0.26,139950,"1944","",0.02561,13.31645,"","03/11/2021","1",0,"High","Satisfactory","2017-09-01",0.0892,47.4,793.5,NA,22.152,0.26,0,139950,0,11.8490476403271,0,"Unknow"
"SOAD19117","Flumevale","Yes","Irrigation","Earth",9.556,0.104,0,"1957","",0.04334,0,"Uncontrolled","13/01/2017","6",3.23,"Low","Unsatisfactory","2020-07-14",0.1094,44.7,114.2,11.5,9.556,0.104,0,NA,1,NA,0,"Unknow"
"SOAD00084","Flumevale","Yes","Water Supply","Earth",9.147,0.368,NA,"2009","",0.04137,NA,"","","0",NA,"Low","Not Rated",NA,0.0866,39.9,23.2,36.6,9.147,0.368,0,NA,1,NA,0,"Unknow"
"SOAD00963","Flumevale","Yes","Recreation","Earth",7.852,0.066,9600,"1966","2007",0.02561,29.29619,"Uncontrolled","13/07/2022","2",0,"Significant","Unsatisfactory","2022-07-13",0.1875,42,578.1,8.8,7.852,0.066,0,9600,0,9.16962253869762,1,"2007"
"SOAD05825","Flumevale","Yes","Other","Earth",17.514,0.433,99908,"1979","",0.02561,0,"","01/01/1991","6",24.84,"Low","Fair","2014-08-11",0.0769,12.2,182.6,NA,17.514,0.433,0,99908,0,11.5120150506689,0,"Unknow"
"SOAD07198","Flumevale","Yes","Other","Earth",19.098,0.177,65346,"1979","",0.03349,0,"","01/01/1991","6",24.05,"Low","Not Rated",NA,0.0606,32.3,355,NA,19.098,0.177,0,65346,0,11.0874668113422,0,"Unknow"
"SOAD00171","Flumevale","No","Water Supply","Earth",6.444,0.333,NA,"Unknow","",NA,NA,"","","Unknow",25.02,"High","Not Available",NA,0.1099,686.6,189.9,15,6.444,0.333,0,NA,1,NA,0,"Unknow"
"SOAD01058","Flumevale","Yes","Irrigation","Earth",9.711,0.16,280,"1980","",0.04334,0,"","10/07/2019","0",22.96,"Low","Fair","2021-05-12",0.0789,32.7,393.7,39.9,9.711,0.16,0,280,0,5.63835466933375,0,"Unknow"
"SOAD08932","Flumevale","Yes","Water Supply","Earth",12.059,0.453,0,"1966","",0.02561,0,"","26/10/2021","1",0.34,"High","Satisfactory","2017-09-01",0.0824,7.4,440.8,68.4,12.059,0.453,0,NA,1,NA,0,"Unknow"
"SOAD18527","Flumevale","Yes","Water Supply","Earth",23.339,0.067,16700,"1951","",0.03546,2.66329,"","21/06/2022","0.5",NA,"Low","Satisfactory","2017-09-01",0.0656,25.4,21,25.7,23.339,0.067,0,16700,0,9.72322387685162,0,"Unknow"
"SOAD20657","Flumevale","Yes","Water Supply","Earth",14.531,0.08,14500,"1969","",0.02561,0,"","01/12/2021","1",0,"High","Satisfactory","2017-09-01",0.0944,37.4,902.8,41.4,14.531,0.08,0,14500,0,9.5819728915479,0,"Unknow"
"SOAD11678","Flumevale","Yes","Water Supply","Earth",10.023,0.2,22000,"1880","",0.02561,0,"","05/08/2022","1",NA,"High","Satisfactory","2017-09-01",0.08,25.2,836.9,8.7,10.023,0.2,0,22000,0,9.99884318585288,0,"Unknow"
"SOAD15068","Flumevale","Yes","Flood Risk Reduction","Earth",10.173,0.133,80000,"1986","",0.02561,NA,"","25/03/2022","0.5",NA,"Low","Satisfactory","2017-09-01",0.0638,34.3,10.1,NA,10.173,0.133,0,80000,0,11.2897944135779,0,"Unknow"
"SOAD01162","Flumevale","Yes","Irrigation","Earth",10.955,0.08,12942,"1903","",0.02561,66.58225,"Uncontrolled","28/08/2017","6",20.19,"Low","Fair","2018-09-07",0.0532,36.4,469.1,36.8,10.955,0.08,0,12942,0,9.46831038044244,0,"Unknow"
"SOAD01341","Flumevale","Yes","Unknow","Earth",5.576,0.208,NA,"Unknow","",NA,NA,"","31/08/2020","6",NA,"Low","Fair","2018-10-03",0.049,14.5,14.3,NA,5.576,0.208,0,NA,1,NA,0,"Unknow"
"SOAD05723","Flumevale","Yes","Recreation","Earth",9.666,0.062,12257,"1955","",0.03546,0,"Uncontrolled","12/09/2008","0",6.73,"Low","Satisfactory","2020-08-26",0.0645,37.6,173.4,5.3,9.666,0.062,0,12257,0,9.41393406404568,0,"Unknow"
"SOAD07146","Flumevale","Yes","Fish and Wildlife Pond","Earth",3.507,0.142,2911,"1966","",NA,13.31645,"Uncontrolled","22/08/2019","10",4.65,"Low","Not Rated",NA,0.0404,10.4,529,NA,3.507,0.142,0,2911,0,7.97659540931658,0,"Unknow"
"SOAD12066","Flumevale","No","Fire Protection, Stock, Or Small Fish Pond","Earth",8.521,0.097,2602,"1961","",0.07486,NA,"Uncontrolled","09/05/2023","4",42.59,"Low","Poor","2023-05-09",0.081,29.8,211.3,NA,8.521,0.097,0,2602,0,7.86441990499457,0,"Unknow"
"SOAD13188","Flumevale","Yes","Irrigation","Earth",16.055,0.17,30895,"1963","",0.02364,0,"Uncontrolled","12/08/2016","6",6.39,"Low","Satisfactory","2017-10-11",0.0335,39.6,471.5,10.3,16.055,0.17,0,30895,0,10.3383820046683,0,"Unknow"
"SOAD16381","Flumevale","Yes","Irrigation","Earth",3.58,0.083,1580,"1898","",0.04137,63.91896,"Uncontrolled","29/03/2012","6",25.15,"Low","Not Rated",NA,0.0755,41.7,118.2,34.4,3.58,0.083,0,1580,0,7.36581283720947,0,"Unknow"
"SOAD18720","Flumevale","Yes","Flood Risk Reduction","Earth",8.668,0.153,6900,"1973","",0.03349,0,"Uncontrolled","17/11/2020","3",5.07,"Low","Not Rated",NA,0.1099,24.5,125.7,NA,8.668,0.153,0,6900,0,8.8394216076206,0,"Unknow"
"SOAD02308","Flumevale","Yes","Flood Risk Reduction","Earth",13.077,0.083,34564,"1958","",0.02561,0,"Uncontrolled","01/11/2021","3",1.63,"Significant","Satisfactory","2021-11-01",0.1108,26.5,928.3,NA,13.077,0.083,0,34564,0,10.4505968883794,0,"Unknow"
"SOAD03455","Flumevale","Yes","Fish and Wildlife Pond","Earth",4.038,0.067,NA,"1910","",0.0591,0,"","07/08/1990","0",48.61,"Low","Satisfactory","2020-10-05",0.067,17.5,115.5,NA,4.038,0.067,0,NA,1,NA,0,"Unknow"
"SOAD13864","Flumevale","Yes","Recreation","Earth",12.905,0.25,91174,"1963","",0.02561,0,"","12/08/2016","6",6.47,"Low","Fair","2019-05-13",0.0686,13.5,475.8,5.3,12.905,0.25,0,91174,0,11.4205360156769,0,"Unknow"
"SOAD15385","Flumevale","Yes","Recreation","Earth",6.781,0.035,1421,"1947","1968M",0.08274,7.98987,"Uncontrolled","24/08/2016","Unknow",7.19,"Low","Not Rated",NA,0.0704,42.4,190.2,8.8,6.781,0.035,0,1421,0,7.25981961036319,1,"1968"
"SOAD17825","Flumevale","Yes","Water Supply","Earth",9.375,0.128,14000,"1936","2007",0.02364,63.91896,"Uncontrolled","25/05/2021","2",55.54,"Significant","Satisfactory","2021-05-25",0.1068,22.5,96.4,57.3,9.375,0.128,0,14000,0,9.54688403461792,1,"2007"
"SOAD18330","Flumevale","Yes","Debris Control","Earth",15.748,0.195,37800,"1954","",0.02167,5.32658,"","30/11/2021","1",0,"High","Satisfactory","2017-09-01",0.1034,20,591.8,NA,15.748,0.195,0,37800,0,10.5400908362842,0,"Unknow"
"SOAD20147","Flumevale","Yes","Recreation","Earth",10.149,0.113,0,"1964","",0.02561,7.98987,"Uncontrolled","27/08/2021","2",17.15,"Significant","Satisfactory","2021-08-27",0.1244,28.9,147.8,3.8,10.149,0.113,0,NA,1,NA,0,"Unknow"
"SOAD00329","Flumevale","Yes","Irrigation","Earth",9.155,0.067,3901,"1912","",0,13.31645,"Uncontrolled","29/06/2017","10",16.85,"Low","Not Rated",NA,0.0466,39.3,179.7,30.7,9.155,0.067,0,3901,0,8.26924452118306,0,"Unknow"
"SOAD03814","Flumevale","Yes","Fish and Wildlife Pond","Earth",12.185,0.125,NA,"1973","",0.02561,7.98987,"","31/08/1989","0",22.96,"Low","Fair","2009-09-17",0.0727,38.6,348.8,NA,12.185,0.125,0,NA,1,NA,0,"Unknow"
"SOAD04504","Flumevale","Yes","Water Supply","Earth",25.154,0.11,NA,"2008","",0.03349,0,"Uncontrolled","12/08/2022","1",15.19,"High","Satisfactory","2022-08-12",0.0774,11.1,255.4,58.2,25.154,0.11,0,NA,1,NA,0,"Unknow"
"SOAD05966","Flumevale","Yes","Irrigation","Earth",8.318,0.225,NA,"1949","",0.05319,0,"Uncontrolled","22/09/2016","6",149.27,"Low","Fair","2015-07-30",0.0625,32.1,191,30,8.318,0.225,0,NA,1,NA,0,"Unknow"
"SOAD07666","Flumevale","Yes","Water Supply","Earth",11.536,0.24,NA,"1974","",0.02364,0,"Uncontrolled","12/07/2016","6",4.7,"Low","Not Rated",NA,0.0695,22.4,639.8,6.6,11.536,0.24,0,NA,1,NA,0,"Unknow"
"SOAD12897","Flumevale","Yes","Water Supply","Earth",16.528,0.233,26500,"1957","",0.36642,2.66329,"","04/03/2022","1",5.18,"High","Satisfactory","2017-09-01",0.0839,274.4,300.5,55.7,16.528,0.233,0,26500,0,10.1849377471114,0,"Unknow"
"SOAD13771","Flumevale","Yes","Irrigation","Earth",4.335,0.095,0,"1935","",0.0591,58.59238,"Uncontrolled","22/07/2016","6",0,"Low","Satisfactory","2016-06-01",0.0308,19.1,101.3,26.3,4.335,0.095,0,NA,1,NA,0,"Unknow"
"SOAD15115","Flumevale","Yes","Irrigation","Earth",2.888,0.667,54784,"1888","",0.24428,0,"","21/02/1979","6",7.92,"Low","Fair","2019-08-05",0.0529,203.2,422.1,5.9,2.888,0.667,0,54784,0,10.9111717128395,0,"Unknow"
"SOAD15406","Flumevale","Yes","Irrigation","Earth",7.247,0.3,0,"1887","",0.04334,0,"","","6",9.43,"Low","Fair","2018-09-25",0.06,42.2,286,32.2,7.247,0.3,0,NA,1,NA,0,"Unknow"
"SOAD18637","Flumevale","Yes","Other","Earth",12.998,0.183,19392,"1956","",0.03349,0,"","08/06/2022","1",6.44,"Significant","Satisfactory","2017-09-01",0.1382,31,394.6,NA,12.998,0.183,0,19392,0,9.87266745519624,0,"Unknow"
"SOAD01035","Flumevale","No","Fire Protection, Stock, Or Small Fish Pond","Earth",4.281,0.42,NA,"1934","",NA,79.8987,"Uncontrolled","31/08/2010","10",NA,"Low","Not Rated",NA,0.075,10,14.6,NA,4.281,0.42,0,NA,1,NA,0,"Unknow"
"SOAD04307","Flumevale","No","Irrigation","Earth",7.716,0.366,NA,"Unknow","",NA,NA,"","27/02/2020","1",0,"Significant","Not Rated",NA,0.127,431.6,656.4,31.2,7.716,0.366,0,NA,1,NA,0,"Unknow"
"SOAD06593","Flumevale","Yes","Unknow","Earth",13.295,0.104,NA,"Unknow","2018",0.02561,7.98987,"Uncontrolled","","6",12.9,"Low","Unsatisfactory","2009-09-24",0.0914,45,156.2,NA,13.295,0.104,0,NA,1,NA,1,"2018"
"SOAD06620","Flumevale","Yes","Irrigation","Earth",11.774,0.157,17735,"1958","",0.03349,7.98987,"","14/08/1991","0",0,"Low","Fair","2022-07-06",0.0857,22.7,605.3,18.2,11.774,0.157,0,17735,0,9.78335175129615,0,"Unknow"
"SOAD07600","Flumevale","Yes","Fish and Wildlife Pond","Earth",13.199,0.116,38867,"1969","",0.02364,15.97974,"Uncontrolled","18/10/2019","6",20.06,"Low","Satisfactory","2021-06-09",0.0349,32.9,418.6,NA,13.199,0.116,0,38867,0,10.5679265689593,0,"Unknow"
"SOAD07939","Flumevale","Yes","Recreation","Earth",8.628,0.36,195000,"1967","",0.01773,0,"Uncontrolled","01/05/2019","5",6.61,"Low","Not Available",NA,0.0828,29,377.5,6.6,8.628,0.36,0,195000,0,12.1807599657379,0,"Unknow"
"SOAD09150","Flumevale","Yes","Irrigation","Earth",3.463,0.317,NA,"1895","2011",0.03349,0,"Uncontrolled","08/08/2019","6",11.17,"Low","Not Rated",NA,0.0544,14.4,111.8,28.7,3.463,0.317,0,NA,1,NA,1,"2011"
"SOAD11344","Flumevale","Yes","Irrigation","Earth",2.716,0.067,1527,"1925","",0.11229,0,"","16/08/1979","0",87.19,"Low","Not Rated",NA,0.0657,7.7,217,15.8,2.716,0.067,0,1527,0,7.33171496972647,0,"Unknow"
"SOAD12151","Flumevale","Yes","Irrigation","Earth",10.147,0.049,NA,"1969","",0.03546,53.2658,"Uncontrolled","05/10/2017","6",1.54,"Low","Not Rated",NA,0.0476,8.3,262.6,12.8,10.147,0.049,0,NA,1,NA,0,"Unknow"
"SOAD12207","Flumevale","Yes","Irrigation","Earth",3.599,0.4,18768,"1882","",0.07289,0,"","11/03/1980","6",17.23,"Low","Not Rated",NA,0.0994,24.4,253.1,10.3,3.599,0.4,0,18768,0,9.83996185165625,0,"Unknow"
"SOAD13040","Flumevale","Yes","Flood Risk Reduction","Earth",20.434,0.233,330000,"1998","",0.04925,10.65316,"","25/03/2022","1",0,"High","Satisfactory","2017-09-01",0.1041,41.3,344.8,NA,20.434,0.233,0,330000,0,12.7068509637411,0,"Unknow"
"SOAD14767","Flumevale","Yes","Water Supply","Earth",18.045,0.188,263,"1932","",0.03349,0,"Uncontrolled","04/08/2022","6",42.54,"Low","Satisfactory","2019-09-17",0.0354,28.2,92.4,47.8,18.045,0.188,0,263,0,5.57594910314632,0,"Unknow"
"SOAD17817","Flumevale","No","Irrigation","Earth",4.658,0.23,NA,"Unknow","",NA,NA,"","15/01/2020","1",9.73,"Significant","Not Rated",NA,0.1149,116.7,261.6,4.7,4.658,0.23,0,NA,1,NA,0,"Unknow"
"SOAD18005","Flumevale","Yes","Irrigation","Earth",4.572,0.2,1350,"1935","",0.04334,0,"Uncontrolled","24/09/2013","6",12.49,"Low","Satisfactory","2019-04-03",0.0353,42.5,327.9,24.5,4.572,0.2,0,1350,0,7.2086003379602,0,"Unknow"
"SOAD18490","Flumevale","Yes","Irrigation","Earth",9.314,0.56,41078,"1962","",0.04334,0,"Uncontrolled","12/08/2021","6",8.21,"Low","Satisfactory","2017-02-21",0.0336,15,373.6,24.9,9.314,0.56,0,41078,0,10.6232523210003,0,"Unknow"
"SOAD04255","Flumevale","Yes","Water Supply","Earth",4.129,0.267,NA,"1969","",0.08077,0,"","02/07/2010","6",0,"Low","Not Rated",NA,0.0726,32,301.8,50.1,4.129,0.267,0,NA,1,NA,0,"Unknow"
"SOAD04329","Flumevale","No","Fire Protection, Stock, Or Small Fish Pond","Earth",7.529,0.093,2222,"1960","",0.02758,NA,"","09/05/2023","4",16.28,"Low","Poor","2023-05-09",0.0734,39,356.4,NA,7.529,0.093,0,2222,0,7.7066129139642,0,"Unknow"
"SOAD08332","Flumevale","Yes","Irrigation","Earth",3.597,0.182,5572,"1910","",0.02561,0,"","","6",13.47,"Low","Not Rated",NA,0.0705,23.7,356.6,10.3,3.597,0.182,0,5572,0,8.62568878756954,0,"Unknow"
"SOAD09560","Flumevale","Yes","Irrigation","Earth",8.707,0.067,NA,"Unknow","",NA,0,"Uncontrolled","","6",NA,"Low","Fair","2016-02-08",0.0635,20.1,12.9,19.3,8.707,0.067,0,NA,1,NA,0,"Unknow"
"SOAD10063","Flumevale","Yes","Irrigation","Earth",10.784,0.118,NA,"1954","",0.03349,0,"","29/06/1992","0",15.12,"Low","Not Rated",NA,0.125,22.7,438.4,5.2,10.784,0.118,0,NA,1,NA,0,"Unknow"
"SOAD10430","Flumevale","Yes","Water Supply","Earth",11.532,0.208,NA,"1968","",0.03546,0,"","18/07/1978","0",72.26,"Low","Fair","2009-10-27",0.0847,33.4,105.3,51,11.532,0.208,0,NA,1,NA,0,"Unknow"
"SOAD14189","Flumevale","Yes","Water Supply","Earth",17.561,0.303,50000,"1980","",0.02561,0,"","05/04/2022","0.5",NA,"Low","Satisfactory","2017-09-01",0.0765,40,16.9,32.5,17.561,0.303,0,50000,0,10.8197982842103,0,"Unknow"
"SOAD18784","Flumevale","Yes","Recreation","Earth",9.022,0.067,8955,"1967","",0.04137,15.97974,"Uncontrolled","21/09/2021","6",30.23,"Low","Satisfactory","2019-08-08",0.0582,19.9,108.9,2.9,9.022,0.067,0,8955,0,9.10007897771865,0,"Unknow"
"SOAD19207","Flumevale","Yes","Water Supply","Earth",14.054,0.18,35000,"1990","",0.03349,NA,"","05/04/2022","0.5",NA,"Low","Satisfactory","2017-09-01",0.0698,46.8,19.8,54.3,14.054,0.18,0,35000,0,10.463131911492,0,"Unknow"
"SOAD02055","Flumevale","No","Fire Protection, Stock, Or Small Fish Pond","Earth",6.946,0.2,1111,"1964","",0.0591,NA,"Uncontrolled","09/05/2023","4",8.21,"High","Poor","2023-05-09",0.0942,32.4,468.5,NA,6.946,0.2,0,1111,0,7.01391547481053,0,"Unknow"
"SOAD02401","Flumevale","Yes","Irrigation","Earth",4.606,0.163,10532,"1900","",0.03546,0,"Uncontrolled","15/10/2020","6",9.57,"Low","Not Rated",NA,0.055,26.8,200.8,4.2,4.606,0.163,0,10532,0,9.26226846483654,0,"Unknow"
"SOAD04180","Flumevale","Yes","Water Supply","Earth",17.902,0.163,36700,"1973","",0.02561,0,"","03/05/2022","0.5",NA,"Low","Satisfactory","2017-09-01",0.0761,45.1,6.6,38.5,17.902,0.163,0,36700,0,10.5105592816278,0,"Unknow"
"SOAD04681","Flumevale","Yes","Water Supply","Earth",6.386,0.04,50,"1981","",0.04137,0,"Uncontrolled","29/09/2022","6",1.58,"Low","Satisfactory","2013-09-26",0.0481,38.6,312.1,10.3,6.386,0.04,0,50,0,3.93182563272433,0,"Unknow"
"SOAD07940","Flumevale","Yes","Flood Risk Reduction","Earth",14.198,0.069,10320,"1956","",0.02561,0,"Uncontrolled","05/11/2013","3",6.26,"Low","Not Rated",NA,0.0878,36.5,202.7,NA,14.198,0.069,0,10320,0,9.24193593356593,0,"Unknow"
"SOAD08886","Flumevale","Yes","Fish and Wildlife Pond","Earth",26.571,0.083,NA,"Unknow","",0.08077,0,"","20/09/1989","0",66.47,"Low","Not Rated",NA,0.1071,37.1,129.6,NA,26.571,0.083,0,NA,1,NA,0,"Unknow"
"SOAD10327","Flumevale","No","Hydroelectric","Earth",3.72,0.037,100,"1855","",0.07486,2.66329,"Uncontrolled","12/08/2019","3",NA,"Low","Satisfactory","2023-09-29",0.0616,42.2,19.7,NA,3.72,0.037,0,100,0,4.61512051684126,0,"Unknow"
"SOAD13828","Flumevale","Yes","Flood Risk Reduction","Earth",8.834,0.194,12629,"1956","",0.03349,0,"Uncontrolled","10/11/2016","3",1.53,"Low","Satisfactory","2022-09-29",0.075,30.2,447.7,NA,8.834,0.194,0,12629,0,9.44383021534454,0,"Unknow"
"SOAD14400","Flumevale","Yes","Flood Risk Reduction","Earth",10.273,0.134,10219,"1956","",0.03349,0,"Uncontrolled","25/09/2014","3",5.05,"Low","Not Rated",NA,0.0876,38.9,129.6,NA,10.273,0.134,0,10219,0,9.23210186375769,0,"Unknow"
"SOAD15750","Flumevale","Yes","Flood Risk Reduction","Earth",7.122,0.127,13511,"1961","",0.04137,7.98987,"Uncontrolled","11/04/2018","3",30.54,"Low","Fair","2018-07-24",0.0691,9.7,145.4,NA,7.122,0.127,0,13511,0,9.51133345848764,0,"Unknow"
"SOAD16365","Flumevale","Yes","Fish and Wildlife Pond","Earth",3.556,0.249,9099,"1968","",0.06107,13.31645,"","","6",39.26,"Low","Not Rated",NA,0.0374,29.3,179.1,NA,3.556,0.249,0,9099,0,9.11602969250494,0,"Unknow"
"SOAD17708","Flumevale","Yes","Recreation","Earth",9.125,0.107,0,"1957","2017",0.0394,106.5316,"Uncontrolled","24/09/2019","6",9.88,"Low","Satisfactory","2010-06-04",0.0287,15,303.8,7.4,9.125,0.107,0,NA,1,NA,1,"2017"
"SOAD00202","Flumevale","Yes","Water Supply","Earth",8.289,0.137,12980,"1949","",0.0925899999999999,0,"","09/03/2022","0.5",NA,"Low","Satisfactory","2017-09-01",0.0733,32,14.4,64.7,8.289,0.137,0,12980,0,9.47124202889299,0,"Unknow"
"SOAD03423","Flumevale","Yes","Irrigation","Earth",3.598,0.05,2222,"1907","",0.06698,0,"","07/09/1990","6",4.73,"Low","Not Rated",NA,0.0426,31,812.5,23.5,3.598,0.05,0,2222,0,7.7066129139642,0,"Unknow"
"SOAD03726","Flumevale","No","Other","Earth",28.961,0.267,NA,"Unknow","",NA,NA,"","","Unknow",1.69,"High","Not Available",NA,0.1087,610.9,536.2,NA,28.961,0.267,0,NA,1,NA,0,"Unknow"
"SOAD05759","Flumevale","Yes","Water Supply","Earth",3.209,0.07,1604,"1889","2000",0.05713,0,"Uncontrolled","28/09/2022","2",14.67,"Significant","Not Rated",NA,0.1534,17.4,192.5,17.1,3.209,0.07,0,1604,0,7.38087903556412,1,"2000"
"SOAD08131","Flumevale","Yes","Irrigation","Earth",4.051,0.103,5860,"1927","",0.03152,0,"","24/09/2013","6",7.76,"Low","Fair","2020-10-05",0.0445,26,142.1,6.9,4.051,0.103,0,5860,0,8.67607551647643,0,"Unknow"
"SOAD10751","Flumevale","Yes","Fish and Wildlife Pond","Earth",3.635,0.175,NA,"1967","",0.04137,7.98987,"","18/09/1996","6",164.09,"Low","Not Rated",NA,0.0869,45.8,86.7,NA,3.635,0.175,0,NA,1,NA,0,"Unknow"
"SOAD11086","Flumevale","Yes","Water Supply","Earth",11.049,0.167,24855,"1959","",0.03546,5.32658,"","12/11/2021","0.5",NA,"Low","Satisfactory","2017-09-01",0.0692,32.1,6.5,67.2,11.049,0.167,0,24855,0,10.1208544510729,0,"Unknow"
"SOAD12566","Flumevale","Yes","Water Supply","Earth",17.062,0.099,29857,"1967","",0.02561,0,"","10/05/2022","0.5",NA,"Low","Satisfactory","2017-09-01",0.0831,10,8.3,66.6,17.062,0.099,0,29857,0,10.3042080896135,0,"Unknow"
"SOAD13408","Flumevale","Yes","Irrigation","Earth",5.357,0.119,9764,"1906","",0.0591,0,"","17/08/2022","6",36.62,"Low","Fair","2020-10-19",0.054,7.8,219.3,29.9,5.357,0.119,0,9764,0,9.18655984331078,0,"Unknow"
"SOAD17818","Flumevale","Yes","Unknow","Earth",5.695,0.067,NA,"Unknow","",0.04925,NA,"Uncontrolled","","6",NA,"Low","Fair","2018-07-19",0.0705,9.9,13,NA,5.695,0.067,0,NA,1,NA,0,"Unknow"
"SOAD18155","Flumevale","Yes","Water Supply","Earth",8.036,0.21,NA,"Unknow","",NA,NA,"","05/12/2022","1",2.28,"Significant","Fair","2017-09-01",0.1521,54,826.4,68.4,8.036,0.21,0,NA,1,NA,0,"Unknow"
"SOAD01361","Flumevale","Yes","Water Supply","Earth",13.064,0.072,14000,"1959","",0.03349,0,"","09/03/2022","1",0.16,"Significant","Satisfactory","2017-09-01",0.1353,38.6,364,55.3,13.064,0.072,0,14000,0,9.54688403461792,0,"Unknow"
"SOAD04228","Flumevale","Yes","Water Supply","Earth",7.63,0.242,12500,"1906","1994H;1996S",0.03349,NA,"Uncontrolled","07/06/2021","6",18.47,"Low","Not Rated",NA,0.0307,23.3,376.9,57.2,7.63,0.242,0,12500,0,9.43356392009056,2,"1996"
"SOAD06948","Flumevale","Yes","Recreation","Earth",12.78,0.112,62483,"1972","",0.03546,0,"","23/07/2019","6",37.22,"Low","Not Rated",NA,0.0998,20.4,186.2,4.5,12.78,0.112,0,62483,0,11.0426658029509,0,"Unknow"
"SOAD11993","Flumevale","Yes","Irrigation","Earth",5.389,0.267,60910,"1955","",0.0886499999999999,7.98987,"Uncontrolled","11/03/2020","6",16.85,"Low","Not Rated",NA,0.0537,19.4,217.7,13.2,5.389,0.267,0,60910,0,11.0171690613612,0,"Unknow"
"SOAD16500","Flumevale","Yes","Irrigation","Earth",8.995,0.213,700,"1929","",0.03349,90.55186,"","19/04/2017","6",14.46,"Low","Not Rated",NA,0.039,25.8,191.5,45.9,8.995,0.213,0,700,0,6.55250788703459,0,"Unknow"
"SOAD00445","Flumevale","Yes","Fish and Wildlife Pond","Earth",9.105,0.111,24086,"1940","",0.03349,13.31645,"","08/05/2018","0",28.01,"Low","Satisfactory","2014-09-25",0.0638,17,457.4,NA,9.105,0.111,0,24086,0,10.0894275548528,0,"Unknow"
"SOAD00587","Flumevale","Yes","Water Supply","Earth",10.012,0.2,NA,"1899","",0.03349,7.98987,"","16/11/1988","0",56.27,"Low","Not Rated",NA,0.0839,37.5,212.4,4.9,10.012,0.2,0,NA,1,NA,0,"Unknow"
"SOAD01446","Flumevale","Yes","Irrigation","Earth",6.4,0.15,14400,"1954","",0.04137,21.30632,"Uncontrolled","18/05/2011","6",73.64,"Low","Fair","2020-08-11",0.0589,25.9,208.7,4.2,6.4,0.15,0,14400,0,9.57505292759738,0,"Unknow"
"SOAD01465","Flumevale","Yes","Irrigation","Earth",5.849,0.372,NA,"1945","",0.04925,7.98987,"","26/10/1979","0",24.89,"Low","Not Rated",NA,0.08,29.6,446.7,8,5.849,0.372,0,NA,1,NA,0,"Unknow"
"SOAD07861","Flumevale","Yes","Water Supply","Earth",13.322,0.092,21157,"1945","",0.05122,5.32658,"","19/04/2022","1",13.31,"High","Satisfactory","2017-09-01",0.0793,5.2,407.4,70.6,13.322,0.092,0,21157,0,9.95977336354672,0,"Unknow"
"SOAD14047","Flumevale","Yes","Irrigation","Earth",17.689,0.153,NA,"1917","",0.02561,0,"Uncontrolled","12/04/2023","1",0,"High","Unsatisfactory","2023-04-12",0.1359,45.8,341.5,42.5,17.689,0.153,0,NA,1,NA,0,"Unknow"
"SOAD14520","Flumevale","Yes","Irrigation","Earth",8.166,0.173,NA,"1996","",0.03349,0,"Controlled","19/09/2019","6",32.52,"Low","Not Rated",NA,0.0854,26.3,48,9.9,8.166,0.173,0,NA,1,NA,0,"Unknow"
"SOAD14731","Flumevale","Yes","Fire Protection, Stock, Or Small Fish Pond","Earth",5.446,0.15,NA,"1939","",0.04925,0,"","21/11/1991","0",11.7,"Low","Fair","2017-10-11",0.0836,38.9,410.9,NA,5.446,0.15,0,NA,1,NA,0,"Unknow"
"SOAD16400","Flumevale","Yes","Flood Risk Reduction","Earth",7.123,0.152,0,"1957","",0.04137,0,"Uncontrolled","25/09/2014","3",6.26,"Low","Fair","2018-08-29",0.0806,44.7,100.9,NA,7.123,0.152,0,NA,1,NA,0,"Unknow"
"SOAD17882","Flumevale","Yes","Flood Risk Reduction","Earth",8.649,0.138,0,"1957","",0.04334,0,"Uncontrolled","10/11/2016","3",3.09,"Low","Fair","2018-06-20",0.0946,46.8,228.5,NA,8.649,0.138,0,NA,1,NA,0,"Unknow"
"SOAD00703","Flumevale","Yes","Flood Risk Reduction","Earth",8.683,0.185,14340,"1958","",0.04925,0,"Uncontrolled","25/07/2013","3",1.69,"Low","Not Rated",NA,0.1083,26.1,330.7,NA,8.683,0.185,0,14340,0,9.57087784672921,0,"Unknow"
"SOAD02561","Flumevale","Yes","Flood Risk Reduction","Earth",14.004,0.096,134000,"1969","",0.02561,5.32658,"","22/06/2022","1",0.77,"High","Satisfactory","2017-09-01",0.0768,6.8,539.6,NA,14.004,0.096,0,134000,0,11.8056025415918,0,"Unknow"
"SOAD03382","Flumevale","Yes","Irrigation","Earth",4.208,0.395,16853,"1904","",0.06107,0,"","24/09/2013","6",8.16,"Low","Fair","2011-11-01",0.0622,15.4,151.5,42.2,4.208,0.395,0,16853,0,9.7323432963323,0,"Unknow"
"SOAD04646","Flumevale","Yes","Tailings","Earth",7.079,0.617,1100,"1989","1999",0.0886499999999999,0,"Uncontrolled","30/11/1995","6",4.81,"Low","Satisfactory","2008-12-12",0.0498,38.6,516,NA,7.079,0.617,0,1100,0,7.00397413672268,1,"1999"
"SOAD06763","Flumevale","Yes","Irrigation","Earth",5.819,0.192,5700,"1961","",0.04925,0,"Uncontrolled","05/11/2019","6",0,"Low","Satisfactory","2017-06-22",0.0229,8.6,786.4,44.6,5.819,0.192,0,5700,0,8.64839687703158,0,"Unknow"
"SOAD10632","Flumevale","Yes","Flood Risk Reduction","Earth",7.125,0.56,NA,"2000","",0.15366,0,"Uncontrolled","04/01/2019","6",0,"Low","Not Rated",NA,0.0771,17.6,150.8,NA,7.125,0.56,0,NA,1,NA,0,"Unknow"
"SOAD19808","Flumevale","Yes","Water Supply","Earth",17.287,0.085,24800,"1956","",0.03349,0,"","19/04/2022","1",0.48,"Significant","Satisfactory","2017-09-01",0.1393,21,598.4,52.6,17.287,0.085,0,24800,0,10.1186392539208,0,"Unknow"
"SOAD01626","Flumevale","Yes","Irrigation","Earth",6.792,0.136,5200,"1952","2003H;2003M;2003S",0.04137,21.30632,"Uncontrolled","28/07/2021","6",31.25,"Low","Not Rated",NA,0.0619,33.9,235.6,24.1,6.792,0.136,0,5200,0,8.55660619377307,3,"2003"
"SOAD02937","Flumevale","Yes","Unknow","Earth",4.28,0.867,NA,"Unknow","",0.08077,0,"Uncontrolled","","6",NA,"Low","Fair","2020-10-07",0.0558,5.5,23.4,NA,4.28,0.867,0,NA,1,NA,0,"Unknow"
"SOAD03843","Flumevale","Yes","Recreation","Earth",6.465,0.098,0,"1958","",0.05122,0,"Uncontrolled","10/09/2019","6",23.46,"Low","Satisfactory","2021-10-20",0.039,38,309.6,7.7,6.465,0.098,0,NA,1,NA,0,"Unknow"
"SOAD18341","Flumevale","Yes","Flood Risk Reduction","Earth",10.345,0.211,19630,"1959","",0.04925,0,"Uncontrolled","04/06/2015","3",7.88,"Low","Not Rated",NA,0.1105,28.2,469.1,NA,10.345,0.211,0,19630,0,9.88486522840803,0,"Unknow"
"SOAD00814","Flumevale","Yes","Water Supply","Earth",14.145,0.133,48300,"1999","",0.04925,0,"","14/03/2022","1",NA,"Significant","Satisfactory","2017-09-01",0.1183,29.2,264.6,17.5,14.145,0.133,0,48300,0,10.7852075433601,0,"Unknow"
"SOAD03190","Flumevale","Yes","Flood Risk Reduction","Earth",8.305,0.083,5234,"1957","",0.0394,7.98987,"Uncontrolled","02/04/2002","3",5.04,"Low","Satisfactory","2017-10-30",0.0671,27.2,200.8,NA,8.305,0.083,0,5234,0,8.56312212330464,0,"Unknow"
"SOAD06303","Flumevale","Yes","Fire Protection, Stock, Or Small Fish Pond","Earth",10.119,0.01,NA,"1982","",0.0394,7.98987,"Uncontrolled","19/10/2018","6",24.91,"Low","Fair","2019-03-25",0.0557,44.5,271.3,NA,10.119,0.01,0,NA,1,NA,0,"Unknow"
"SOAD07281","Flumevale","Yes","Irrigation","Earth",13.006,0.108,NA,"1973","",0.03546,23.96961,"","27/09/2012","6",6.74,"Low","Satisfactory","2021-08-24",0.0424,18.6,234.8,43.3,13.006,0.108,0,NA,1,NA,0,"Unknow"
"SOAD07518","Flumevale","Yes","Water Supply","Earth",11.242,0.157,27938,"1961","",0.03349,0,"","25/04/2022","6",6.61,"Low","Not Rated",NA,0.0803,36.1,228.8,20.3,11.242,0.157,0,27938,0,10.2377788411898,0,"Unknow"
"SOAD07702","Flumevale","Yes","Water Supply","Earth",12.109,0.117,13000,"1980","",0.0591,5.32658,"","07/06/2022","1",NA,"Significant","Satisfactory","2017-09-01",0.1192,8.9,331.9,39.5,12.109,0.117,0,13000,0,9.47278155656217,0,"Unknow"
"SOAD16557","Flumevale","Yes","Flood Risk Reduction","Earth",7.762,0.134,0,"1964","",0.01773,0,"Uncontrolled","28/05/2021","6",9.35,"Low","Not Rated",NA,0.0828,27,332.1,NA,7.762,0.134,0,NA,1,NA,0,"Unknow"
"SOAD18263","Flumevale","Yes","Unknow","Earth",4.493,0.42,NA,"2018","",0.05122,0,"Uncontrolled","","6",NA,"Low","Satisfactory","2022-10-12",0.0417,43.1,14.2,NA,4.493,0.42,0,NA,1,NA,0,"Unknow"
"SOAD19463","Flumevale","Yes","Fire Protection, Stock, Or Small Fish Pond","Earth",4.703,0.243,NA,"1901","",0.10047,0,"","13/11/1991","0",26.21,"Low","Fair","2014-10-28",0.0812,19,428.5,NA,4.703,0.243,0,NA,1,NA,0,"Unknow"
"SOAD14008","Flumevale","Yes","Flood Risk Reduction","Earth",14.496,0.133,69100,"2005","",0.03546,7.98987,"Uncontrolled","21/07/2005","3",0,"Low","Not Rated",NA,0.1166,29.8,780.8,NA,14.496,0.133,0,69100,0,11.1433244814311,0,"Unknow"
"SOAD19271","Flumevale","Yes","Flood Risk Reduction","Earth",8.174,0.357,40810,"1984","",0.06698,21.30632,"Uncontrolled","01/05/2015","3",15.46,"Low","Satisfactory","2012-11-09",0.0618,24.6,165.4,NA,8.174,0.357,0,40810,0,10.6167069318977,0,"Unknow"
"SOAD19363","Flumevale","Yes","Irrigation","Earth",9.275,0.7,NA,"1904","",0.05122,0,"Uncontrolled","18/06/2019","6",1.54,"Low","Satisfactory","2020-10-05",0.0513,34.6,530.1,7.3,9.275,0.7,0,NA,1,NA,0,"Unknow"
"SOAD20596","Flumevale","Yes","Water Supply","Earth",14.053,0.087,24500,"1953","",0.05713,15.97974,"","01/09/2021","1",NA,"Significant","Satisfactory","2017-09-01",0.1379,41.5,474.4,27.3,14.053,0.087,0,24500,0,10.1064692120264,0,"Unknow"
"SOAD07997","Flumevale","Yes","Recreation","Earth",8.353,0.113,4291,"1964","2014S",0,53.2658,"Uncontrolled","10/06/2014","Unknow",4.09,"Significant","Not Rated",NA,0.1415,12.5,230.6,9.3,8.353,0.113,0,4291,0,8.36450810375059,1,"2014"
"SOAD10372","Flumevale","Yes","Other","Earth",14.511,0.107,26300,"1948","",0.02364,0,"","04/03/2022","1",NA,"Significant","Satisfactory","2017-09-01",0.1398,39,307.2,NA,14.511,0.107,0,26300,0,10.1773622402567,0,"Unknow"
"SOAD11027","Flumevale","Yes","Recreation","Earth",7.906,0.12,5867,"1964","",0.05122,50.60251,"","02/10/1979","6",24.34,"Low","Not Rated",NA,0.062,29.3,212.1,3.8,7.906,0.12,0,5867,0,8.67726913926287,0,"Unknow"
"SOAD12560","Flumevale","Yes","Irrigation","Earth",7.921,0.115,6628,"1926","1988H;1988M;1988S",0.05319,7.98987,"","08/07/2021","6",17.07,"Low","Fair","2012-03-29",0.0758,19.1,383.3,33.1,7.921,0.115,0,6628,0,8.79920924224139,3,"1988"
"SOAD03273","Flumevale","Yes","Fish and Wildlife Pond","Earth",7.158,0.042,6214,"1978","",0.05122,7.98987,"","03/08/2021","6",19.37,"Low","Not Rated",NA,0.0664,16.1,405,NA,7.158,0.042,0,6214,0,8.73472100394481,0,"Unknow"
"SOAD04186","Flumevale","Yes","Irrigation","Earth",3.412,0.15,NA,"1901","",0.05122,21.30632,"","15/11/1979","0",75.45,"Low","Not Rated",NA,0.0929,25.5,110.6,42,3.412,0.15,0,NA,1,NA,0,"Unknow"
"SOAD04245","Flumevale","Yes","Fish and Wildlife Pond","Earth",7.496,0.081,NA,"1946","",0.04137,114.52147,"","06/08/1991","0",4.79,"Low","Satisfactory","2016-12-12",0.0695,16.3,604.2,NA,7.496,0.081,0,NA,1,NA,0,"Unknow"
"SOAD05304","Flumevale","Yes","Irrigation","Earth",9.484,0.5,NA,"1952","",0.03349,0,"Uncontrolled","19/05/2022","6",0,"Low","Not Rated",NA,0.1017,45.6,930.1,17.8,9.484,0.5,0,NA,1,NA,0,"Unknow"
"SOAD05817","Flumevale","Yes","Flood Risk Reduction","Earth",11.517,0.453,85381,"1955","2005",0.02561,0,"Uncontrolled","09/02/2021","3",0,"High","Satisfactory","2021-02-09",0.1005,8.7,278.7,NA,11.517,0.453,0,85381,0,11.3548905847272,1,"2005"
"SOAD11529","Flumevale","Yes","Water Supply","Earth",12.719,0.183,36000,"1965","",0.05122,2.66329,"","10/02/2022","1",0.16,"High","Satisfactory","2017-09-01",0.0942,45.9,418.2,17.4,12.719,0.183,0,36000,0,10.4913019948302,0,"Unknow"
"SOAD11925","Flumevale","Yes","Water Supply","Earth",14.659,0.315,54200,"1955","",0.02561,0,"","08/09/2022","1",NA,"High","Satisfactory","2017-09-01",0.1033,40.8,682.5,6.2,14.659,0.315,0,54200,0,10.900454637442,0,"Unknow"
"SOAD12926","Flumevale","Yes","Recreation","Earth",6.053,NA,0,"1983","",0.06107,NA,"Uncontrolled","30/03/1999","0",1.61,"Low","Fair","2018-08-08",0.0744,5.1,616.4,5.2,6.053,NA,1,NA,1,NA,0,"Unknow"
"SOAD13339","Flumevale","Yes","Fire Protection, Stock, Or Small Fish Pond","Earth",8.156,0.267,NA,"1963","",0.05713,0,"","05/03/1987","0",122.2,"Low","Fair","2019-08-29",0.0785,36.9,236.2,NA,8.156,0.267,0,NA,1,NA,0,"Unknow"
"SOAD17012","Flumevale","Yes","Other","Earth",14.269,0.383,87000,"2006","",0.03546,0,"","12/05/2020","6",102.41,"Low","Not Rated",NA,0.0745,13.3,70.3,NA,14.269,0.383,0,87000,0,11.3736748918235,0,"Unknow"
"SOAD18025","Flumevale","Yes","Irrigation","Earth",4.658,0.083,6481,"1917","",0.08668,0,"","31/08/1989","0",55.35,"Low","Satisfactory","2013-09-25",0.061,5.4,81.4,24.7,4.658,0.083,0,6481,0,8.77678438370149,0,"Unknow"
"SOAD19276","Flumevale","Yes","Fish and Wildlife Pond","Earth",10.356,0.072,7505,"1965","",0.04137,23.96961,"Uncontrolled","18/10/2018","6",4.89,"Low","Fair","2017-04-19",0.0515,30.8,859.6,NA,10.356,0.072,0,7505,0,8.92345797969497,0,"Unknow"
"SOAD20385","Flumevale","Yes","Irrigation","Earth",11.629,0.143,42522,"1953","",0.04137,7.98987,"Uncontrolled","07/05/2019","6",23.73,"Low","Satisfactory","2021-06-09",0.0357,8.3,228,21.2,11.629,0.143,0,42522,0,10.6578003849999,0,"Unknow"
"SOAD05410","Flumevale","Yes","Other","Earth",14.291,0.117,25300,"1958","",0.05122,NA,"","08/06/2022","1",1.58,"High","Satisfactory","2017-09-01",0.0904,38.6,569.6,NA,14.291,0.117,0,25300,0,10.1385991996262,0,"Unknow"
"SOAD07609","Flumevale","Yes","Flood Risk Reduction","Earth",8.52,0.203,16020,"1957","",0.04137,0,"Uncontrolled","06/10/2020","3",25.04,"Low","Fair","2019-05-16",0.0863,45,288.9,NA,8.52,0.203,0,16020,0,9.68165564064671,0,"Unknow"
"SOAD08765","Flumevale","Yes","Flood Risk Reduction","Earth",8.185,0.18,13773,"1967","",0.04334,0,"Uncontrolled","18/07/1991","0",54.71,"Low","Not Rated",NA,0.0897,17.3,83.2,NA,8.185,0.18,0,13773,0,9.53053803610464,0,"Unknow"
"SOAD09488","Flumevale","Yes","Irrigation","Earth",3.364,0.35,11753,"1902","",0.16154,0,"","27/08/1984","6",4.96,"Low","Not Rated",NA,0.059,17.7,627.9,46.6,3.364,0.35,0,11753,0,9.3719488871726,0,"Unknow"
"SOAD10853","Flumevale","Yes","Fire Protection, Stock, Or Small Fish Pond","Earth",5.087,0.23,NA,"1924","",0.08471,53.2658,"","30/09/1988","0",5.02,"Low","Satisfactory","2019-06-28",0.0688,44.6,429.4,NA,5.087,0.23,0,NA,1,NA,0,"Unknow"
"SOAD13338","Flumevale","Yes","Fish and Wildlife Pond","Earth",11.362,0.262,NA,"1957","",0.0394,0,"","03/05/2013","6",19.05,"Low","Fair","2020-10-29",0.0463,7.8,205.7,NA,11.362,0.262,0,NA,1,NA,0,"Unknow"
"SOAD15188","Flumevale","Yes","Irrigation","Earth",4.957,0.083,5588,"1951","",0.05122,7.98987,"Uncontrolled","07/07/2017","6",46.98,"Low","Not Rated",NA,0.0787,34.2,236.3,27.6,4.957,0.083,0,5588,0,8.6285556592697,0,"Unknow"
"SOAD17045","Flumevale","Yes","Irrigation","Earth",5.113,0.28,10500,"1931","1962H;1962M;1962S",0.07486,0,"Uncontrolled","08/08/2018","6",13.1,"Low","Satisfactory","2020-07-20",0.0549,26.9,376.8,42.3,5.113,0.28,0,10500,0,9.25922576970599,3,"1962"
"SOAD01862","Flumevale","Yes","Irrigation","Earth",12.085,0.083,5560,"1970","",0.04334,29.29619,"Uncontrolled","01/11/2017","6",32.1,"Low","Satisfactory","2022-06-08",0.0388,28.5,91.8,33.9,12.085,0.083,0,5560,0,8.62353322718756,0,"Unknow"
"SOAD04495","Flumevale","Yes","Irrigation","Earth",4.224,0.033,0,"1904","",0.08077,0,"","23/08/1979","6",14.11,"Low","Satisfactory","2012-02-01",0.053,12.5,269.4,25.4,4.224,0.033,0,NA,1,NA,0,"Unknow"
"SOAD05002","Flumevale","Yes","Water Supply","Earth",15.013,0.335,NA,"1929","1929S;2001M;2004O",0.02561,0,"Uncontrolled","26/05/2022","1",3.11,"High","Fair","2022-05-26",0.1248,34.6,798,46,15.013,0.335,0,NA,1,NA,3,"2004"
"SOAD05298","Flumevale","Yes","Irrigation","Earth",3.028,0.31,8680,"1868","",0.05122,0,"Uncontrolled","11/01/1980","6",6.18,"Low","Not Rated",NA,0.0435,9.8,317.5,20.2,3.028,0.31,0,8680,0,9.06889200839181,0,"Unknow"
"SOAD12657","Flumevale","Yes","Water Supply","Earth",3.855,0.367,62578,"1888","",0.10441,0,"Uncontrolled","09/10/2012","2",0,"Significant","Fair","2012-10-09",0.1204,46,657.7,20.3,3.855,0.367,0,62578,0,11.044185037549,0,"Unknow"
"SOAD12760","Flumevale","Yes","Water Supply","Earth",16.813,0.09,15000,"1952","",0.03349,2.66329,"","26/04/2022","0.5",NA,"Low","Satisfactory","2017-09-01",0.0749,28.7,5.9,63.3,16.813,0.09,0,15000,0,9.61587214452889,0,"Unknow"
"SOAD16224","Flumevale","Yes","Irrigation","Earth",9.898,0.133,0,"1947","",0.04925,7.98987,"","24/06/2016","6",14.22,"Low","Fair","2022-09-27",0.052,26.2,238.6,4.3,9.898,0.133,0,NA,1,NA,0,"Unknow"
"SOAD19727","Flumevale","Yes","Water Supply","Earth",13.704,0.073,0,"1959","",0.03349,0,"","21/04/2022","0.5",NA,"Low","Satisfactory","2017-09-01",0.0644,19.2,14.5,48.6,13.704,0.073,0,NA,1,NA,0,"Unknow"
"SOAD01572","Flumevale","Yes","Water Supply","Earth",10.601,0.6,25932,"1982","",0.07683,0,"","26/08/2020","6",22.37,"Low","Satisfactory","2022-09-29",0.0269,34.3,224.9,10.3,10.601,0.6,0,25932,0,10.1632715679453,0,"Unknow"
"SOAD02230","Flumevale","Yes","Irrigation","Earth",5.174,0.153,5330,"1911","",0.07486,0,"","26/09/2022","6",11.75,"Low","Fair","2016-08-15",0.0447,40.7,277.6,46.4,5.174,0.153,0,5330,0,8.58129411682276,0,"Unknow"
"SOAD04017","Flumevale","Yes","Hydroelectric","Earth",23.742,0.105,NA,"1953","",0.02561,7.98987,"Uncontrolled","31/05/2023","1",1.61,"High","Satisfactory","2023-09-29",0.0909,24.1,738.2,81.9,23.742,0.105,0,NA,1,NA,0,"Unknow"
"SOAD11493","Flumevale","Yes","Irrigation","Earth",7.259,0.092,0,"1960","",0.04137,0,"Uncontrolled","25/08/2015","6",39.95,"Low","Not Rated",NA,0.0615,24.7,153,41.2,7.259,0.092,0,NA,1,NA,0,"Unknow"
"SOAD12118","Flumevale","No","Water Supply","Earth",10.562,0.1,NA,"Unknow","",NA,NA,"","","Unknow",NA,"High","Not Available",NA,0.1108,821.7,477.8,29.3,10.562,0.1,0,NA,1,NA,0,"Unknow"
"SOAD14584","Flumevale","Yes","Irrigation","Earth",4.439,0.24,0,"1916","",0.07486,0,"","","6",4.67,"Low","Satisfactory","2007-03-15",0.0426,28.3,910.9,20.2,4.439,0.24,0,NA,1,NA,0,"Unknow"
"SOAD15876","Flumevale","Yes","Irrigation","Earth",9.847,0.12,29060,"1905","1988S",0.03152,13.31645,"Uncontrolled","18/10/2018","6",3.19,"Low","Unsatisfactory","2013-09-21",0.0875,39.2,232.3,36.7,9.847,0.12,0,29060,0,10.2771523480945,1,"1988"
"SOAD18296","Flumevale","Yes","Water Supply","Earth",11.834,0.266,78195,"1977","",0.04137,34.62277,"","14/07/2020","6",14.08,"Low","Satisfactory","2021-11-18",0.0288,37,374.9,48.2,11.834,0.266,0,78195,0,11.26697377433,0,"Unknow"
"SOAD20570","Flumevale","Yes","Other","Earth",11.378,0.067,11434,"1975","",0.08471,0,"","25/06/2020","6",7.88,"Low","Not Rated",NA,0.0769,29.6,330.2,NA,11.378,0.067,0,11434,0,9.34443410645688,0,"Unknow"
"SOAD01188","Flumevale","Yes","Water Supply","Earth",14.635,0.063,22300,"1930","",0.01576,0,"","08/12/2021","1",3.36,"Significant","Satisfactory","2017-09-01",0.1306,15.1,131.9,32.5,14.635,0.063,0,22300,0,10.0123867994921,0,"Unknow"
"SOAD02487","Flumevale","Yes","Irrigation","Earth",4.24,0.267,650,"1882","",0.0925899999999999,37.28606,"Uncontrolled","11/10/2013","6",0,"Low","Not Rated",NA,0.0764,8.1,604.3,34.8,4.24,0.267,0,650,0,6.47850964220857,0,"Unknow"
"SOAD08596","Flumevale","No","Water Supply","Earth",44.519,0.143,146000,"1956","2007",0.02561,0,"Uncontrolled","22/08/2020","1",0,"High","Not Available",NA,0.0937,39.8,427.2,66.1,44.519,0.143,0,146000,0,11.8913687499821,1,"2007"
"SOAD09743","Flumevale","Yes","Irrigation","Earth",6.929,0.113,28000,"2006","",0.03349,0,"Uncontrolled","22/06/2022","2",0,"Significant","Satisfactory","2022-06-22",0.1317,34.8,831.3,36.8,6.929,0.113,0,28000,0,10.2399955028053,0,"Unknow"
"SOAD10447","Flumevale","Yes","Recreation","Earth",6.613,0.117,4261,"1963","",0,0,"Uncontrolled","15/09/2010","Unknow",25.28,"Significant","Not Rated",NA,0.1587,15.9,339.5,5.8,6.613,0.117,0,4261,0,8.35749381265856,0,"Unknow"
"SOAD12532","Flumevale","Yes","Water Supply","Earth",12.411,0.351,40000,"1947","",0.03349,NA,"","11/05/2022","0.5",NA,"Low","Satisfactory","2017-09-01",0.0739,15.2,12,40.5,12.411,0.351,0,40000,0,10.5966597327836,0,"Unknow"
"SOAD17484","Flumevale","Yes","Recreation","Earth",5.278,0.133,NA,"1957","",0.08471,0,"","07/10/2022","6",21.71,"Low","Fair","2017-10-19",0.0517,47.6,328.7,5.4,5.278,0.133,0,NA,1,NA,0,"Unknow"
"SOAD17774","Flumevale","Yes","Hydroelectric","Earth",9.236,0.138,NA,"1953","",0.02561,7.98987,"Uncontrolled","31/05/2023","1",1.66,"High","Satisfactory","2023-09-29",0.1079,22.4,158.6,83.8,9.236,0.138,0,NA,1,NA,0,"Unknow"
"SOAD19044","Flumevale","Yes","Irrigation","Earth",10.464,0.127,8738,"1963","2001H;2001S",0.02364,0,"Uncontrolled","25/07/2018","6",21.48,"Low","Not Rated",NA,0.049,38.4,372.1,21,10.464,0.127,0,8738,0,9.07555104562754,2,"2001"
"SOAD00168","Flumevale","Yes","Flood Risk Reduction","Earth",11.699,0.253,NA,"1984","",0.02561,0,"","06/07/1999","3",0,"Low","Not Rated",NA,0.095,41.9,669.6,NA,11.699,0.253,0,NA,1,NA,0,"Unknow"
"SOAD00925","Flumevale","Yes","Irrigation","Earth",6.465,0.25,32726,"1951","",0.06501,15.97974,"Uncontrolled","11/03/2020","6",15.58,"Low","Fair","2018-08-02",0.0474,23.8,247.9,47.5,6.465,0.25,0,32726,0,10.3959557042659,0,"Unknow"
"SOAD02613","Flumevale","Yes","Water Supply","Earth",21.448,0.083,32290,"1905","",0.02364,0,"","17/03/2022","0.5",NA,"Low","Satisfactory","2017-09-01",0.0704,27.4,17.1,42.6,21.448,0.083,0,32290,0,10.3825438326131,0,"Unknow"
"SOAD04044","Flumevale","Yes","Water Supply","Earth",16.884,0.137,21000,"1959","",0.03349,2.66329,"","03/11/2021","0.5",26.34,"Low","Satisfactory","2017-09-01",0.0704,32.7,184.3,32.9,16.884,0.137,0,21000,0,9.95232533461943,0,"Unknow"
"SOAD06033","Flumevale","Yes","Water Supply","Earth",8.489,0.08,7000,"1869","",0.0906199999999999,2.66329,"","25/04/2022","1",NA,"Significant","Satisfactory","2017-09-01",0.1261,12,432.2,64.2,8.489,0.08,0,7000,0,8.8538082749772,0,"Unknow"
"SOAD10801","Flumevale","Yes","Irrigation","Earth",4.205,0.267,15171,"1915","",0.0394,0,"","","6",11.6,"Low","Satisfactory","2015-06-04",0.0361,22,157.8,4.3,4.205,0.267,0,15171,0,9.62720690280879,0,"Unknow"
"SOAD14539","Flumevale","Yes","Irrigation","Earth",4.052,0.138,0,"Unknow","",0.06501,29.29619,"","28/10/1987","0",16.38,"Low","Satisfactory","2011-11-01",0.0695,42.8,373,24.2,4.052,0.138,0,NA,1,NA,0,"Unknow"
"SOAD14783","Flumevale","Yes","Flood Risk Reduction","Earth",10.09,0.162,15130,"1960","",0.06107,7.98987,"","11/04/2018","3",39.39,"Low","Satisfactory","2007-03-20",0.073,47.6,233.3,NA,10.09,0.162,0,15130,0,9.62450089845157,0,"Unknow"
"SOAD15246","Flumevale","Yes","Water Supply","Earth",7.172,0.143,0,"1984","",0.05319,7.98987,"Uncontrolled","16/11/2022","2",6.4,"Significant","Fair","2022-11-16",0.1434,43.3,429.1,16.8,7.172,0.143,0,NA,1,NA,0,"Unknow"
"SOAD16568","Flumevale","Yes","Irrigation","Earth",4.159,0.5,35981,"1906","",0.09456,0,"","25/09/2013","6",8,"Low","Satisfactory","2015-06-04",0.0345,7.4,298.4,34.2,4.159,0.5,0,35981,0,10.4907740923966,0,"Unknow"
"SOAD02111","Flumevale","Yes","Water Supply","Earth",7.925,0.243,29910,"1952","",0.04137,0,"","10/06/2020","6",23.11,"Low","Not Rated",NA,0.0989,18.8,215.7,11.8,7.925,0.243,0,29910,0,10.3059815846993,0,"Unknow"
"SOAD03029","Flumevale","Yes","Irrigation","Earth",5.892,0.673,26596,"1912","2001",0.04137,0,"Uncontrolled","23/09/2013","6",0,"Low","Not Rated",NA,0.0532,20,668.9,42.5,5.892,0.673,0,26596,0,10.1885537064545,1,"2001"
"SOAD03967","Flumevale","Yes","Water Supply","Earth",13.772,0.16,23500,"1956","",0.04334,0,"","11/08/2022","1",NA,"Significant","Satisfactory","2017-09-01",0.1364,11.1,382.7,60.3,13.772,0.16,0,23500,0,10.0647982524184,0,"Unknow"
"SOAD14025","Flumevale","Yes","Recreation","Earth",3.663,0.533,0,"1984","",0.05122,0,"Uncontrolled","08/09/2022","2",1.69,"Significant","Fair","2022-09-08",0.1233,25.8,711.1,7.1,3.663,0.533,0,NA,1,NA,0,"Unknow"
"SOAD16872","Flumevale","Yes","Other","Earth",8.745,0.06,16600,"1951","",0.07486,2.66329,"","14/03/2022","0.5",NA,"Low","Satisfactory","2017-09-01",0.0605,41.7,21.1,NA,8.745,0.06,0,16600,0,9.71721821349408,0,"Unknow"
"SOAD18136","Flumevale","Yes","Fish and Wildlife Pond","Earth",3.689,0.233,4194,"1885","",0.06501,0,"Uncontrolled","17/03/2010","6",1.66,"Low","Not Rated",NA,0.0599,10.2,647.2,NA,3.689,0.233,0,4194,0,8.34164861890131,0,"Unknow"
"SOAD20803","Flumevale","Yes","Irrigation","Earth",3.929,0.078,3634,"1911","",0,0,"","11/05/1992","6",30.36,"Low","Satisfactory","2022-09-12",0.0508,32.4,67.5,22.9,3.929,0.078,0,3634,0,8.19836438996762,0,"Unknow"
"SOAD03361","Flumevale","Yes","Irrigation","Earth",7.894,0.114,16596,"1946","",0.05713,63.91896,"Uncontrolled","13/05/2019","6",40.48,"Low","Fair","2020-05-12",0.047,41,100.3,2.4,7.894,0.114,0,16596,0,9.71697723512072,0,"Unknow"
"SOAD04079","Flumevale","Yes","Recreation","Earth",3.407,0.233,12657,"1968","2002",0.10638,0,"Uncontrolled","19/11/1997","6",38.68,"Low","Not Rated",NA,0.0388,14.1,226.4,4.8,3.407,0.233,0,12657,0,9.44604470533525,1,"2002"
"SOAD04616","Flumevale","Yes","Irrigation","Earth",6.055,0.042,4444,"1907","",0.04137,0,"","25/07/2018","6",21.79,"Low","Fair","2015-07-22",0.0474,38.8,167.7,17.5,6.055,0.042,0,4444,0,8.399535147948,0,"Unknow"
"SOAD06395","Flumevale","Yes","Irrigation","Earth",7.736,0.367,NA,"1989","1989",0.05713,NA,"Uncontrolled","24/08/2021","6",16.44,"Low","Not Rated",NA,0.0515,13.7,320.6,46.1,7.736,0.367,0,NA,1,NA,1,"1989"
"SOAD06844","Flumevale","Yes","Fire Protection, Stock, Or Small Fish Pond","Earth",8.742,0.15,NA,"1960","",0.0394,0,"Uncontrolled","25/11/2019","6",9.8,"Low","Satisfactory","2019-06-06",0.0373,24.8,107.1,NA,8.742,0.15,0,NA,1,NA,0,"Unknow"
"SOAD13640","Flumevale","Yes","Fish and Wildlife Pond","Earth",5.497,0.713,NA,"1928","",0.06895,0,"","10/08/1978","0",0,"Low","Fair","2019-06-11",0.0799,37,529.1,NA,5.497,0.713,0,NA,1,NA,0,"Unknow"
"SOAD18800","Flumevale","Yes","Irrigation","Earth",5.72,0.035,NA,"1950","",0.0591,0,"","21/05/2021","6",33.89,"Low","Fair","2012-10-30",0.0612,31,169.1,4.8,5.72,0.035,0,NA,1,NA,0,"Unknow"
"SOAD00861","Flumevale","Yes","Fire Protection, Stock, Or Small Fish Pond","Earth",4.661,0.133,7875,"1949","",0.04137,15.97974,"","16/08/1979","6",14.71,"Low","Fair","2020-08-31",0.0717,8.2,177.9,NA,4.661,0.133,0,7875,0,8.97157543975902,0,"Unknow"
"SOAD04967","Flumevale","Yes","Water Supply","Earth",6.722,0.117,14000,"1987","",0.05122,NA,"","10/10/2022","0.5",NA,"Low","Fair","2017-09-01",0.0733,43.6,8,54.5,6.722,0.117,0,14000,0,9.54688403461792,0,"Unknow"
"SOAD13497","Flumevale","Yes","Irrigation","Earth",3.902,0.067,0,"1909","",0.08274,0,"","26/08/1979","6",64.92,"Low","Not Rated",NA,0.0839,43.5,90.3,41.9,3.902,0.067,0,NA,1,NA,0,"Unknow"
"SOAD15930","Flumevale","Yes","Irrigation","Earth",7.809,0.1,NA,"1895","",0.05122,74.57212,"Uncontrolled","13/08/2020","6",48.85,"Low","Not Rated",NA,0.0552,5.2,143.9,22.7,7.809,0.1,0,NA,1,NA,0,"Unknow"
"SOAD17385","Flumevale","Yes","Irrigation","Earth",2.486,0.67,26471,"1886","",0.05713,0,"","30/09/2013","6",13.24,"Low","Not Rated",NA,0.0745,36.5,330.9,12.7,2.486,0.67,0,26471,0,10.1838428496014,0,"Unknow"
"SOAD01167","Flumevale","Yes","Irrigation","Earth",8.106,0.2,28848,"1913","",0.05122,0,"","27/07/2020","6",36.25,"Low","Not Rated",NA,0.0684,29.6,167.4,25.6,8.106,0.2,0,28848,0,10.2698306092904,0,"Unknow"
"SOAD02745","Flumevale","Yes","Irrigation","Earth",7.643,0.207,NA,"1978","",0.05713,0,"Uncontrolled","19/02/2016","6",26.26,"Low","Fair","2022-09-29",0.0585,39.4,119,28.3,7.643,0.207,0,NA,1,NA,0,"Unknow"
"SOAD03342","Flumevale","Yes","Water Supply","Earth",10.376,0.152,0,"1974","",0.05122,0,"","01/12/2021","1",0,"Significant","Satisfactory","2017-09-01",0.1213,18.9,795.1,55.9,10.376,0.152,0,NA,1,NA,0,"Unknow"
"SOAD04433","Flumevale","Yes","Water Supply","Earth",29.956,0.103,16000,"1963","",0.02561,0,"Uncontrolled","17/05/2022","1",3.27,"High","Fair","2022-05-17",0.1138,25.5,144.3,68.7,29.956,0.103,0,16000,0,9.68040649926887,0,"Unknow"
"SOAD04566","Flumevale","Yes","Irrigation","Earth",5.377,1.2,NA,"1951","",0.06304,0,"","04/10/1979","0",77.07,"Low","Fair","2020-08-31",0.0809,40.9,139.7,45.3,5.377,1.2,0,NA,1,NA,0,"Unknow"
"SOAD06235","Flumevale","Yes","Recreation","Earth",7.985,0.32,35842,"1912","",0.01576,0,"Uncontrolled","09/07/1992","6",0,"Low","Not Rated",NA,0.057,44.8,355.5,2.9,7.985,0.32,0,35842,0,10.4869035689429,0,"Unknow"
"SOAD08162","Flumevale","Yes","Irrigation","Earth",5.801,0.115,4898,"1934","",0.0394,0,"Uncontrolled","26/10/2016","6",64.87,"Low","Fair","2010-10-15",0.0554,27.6,207.3,4.5,5.801,0.115,0,4898,0,8.49678638163858,0,"Unknow"
"SOAD14034","Flumevale","Yes","Flood Risk Reduction","Earth",16.144,0.173,92000,"1974","",0.04334,10.65316,"","10/03/2022","1",0,"High","Satisfactory","2017-09-01",0.0818,33.8,469.6,NA,16.144,0.173,0,92000,0,11.4295547255373,0,"Unknow"
"SOAD00390","Flumevale","Yes","Flood Risk Reduction","Earth",9.74,0.097,5052,"1955","",0.02561,0,"Uncontrolled","16/10/2014","6",15.9,"Low","Not Rated",NA,0.0942,36.2,203.5,NA,9.74,0.097,0,5052,0,8.52773740529191,0,"Unknow"
"SOAD03934","Flumevale","Yes","Water Supply","Earth",15.559,0.175,45000,"1953","",0.03349,5.32658,"","08/12/2021","1",0.31,"High","Satisfactory","2017-09-01",0.0977,29.4,722.6,23,15.559,0.175,0,45000,0,10.7144399907278,0,"Unknow"
"SOAD11129","Flumevale","Yes","Flood Risk Reduction","Earth",13.266,0.226,21600,"1963","",0.00788,0,"Uncontrolled","28/09/2020","3",0,"Low","Fair","2016-07-26",0.0913,8.4,342.5,NA,13.266,0.226,0,21600,0,9.98049488889691,0,"Unknow"
"SOAD12395","Flumevale","Yes","Irrigation","Earth",12.393,0.22,27882,"1967","",0.0591,7.98987,"Uncontrolled","14/06/2019","6",33.16,"Low","Not Rated",NA,0.0658,11.8,55.5,9.9,12.393,0.22,0,27882,0,10.2357724631028,0,"Unknow"
"SOAD13583","Flumevale","Yes","Irrigation","Earth",2.56,0.048,NA,"1926","",0.12608,0,"","16/09/1985","6",25.99,"Low","Not Rated",NA,0.0886,14.7,241,5.2,2.56,0.048,0,NA,1,NA,0,"Unknow"
"SOAD18698","Flumevale","Yes","Water Supply","Earth",5.846,0.1,NA,"2016","",0.06107,0,"Uncontrolled","","6",7.87,"Low","Not Rated",NA,0.0848,43.6,152.9,39.7,5.846,0.1,0,NA,1,NA,0,"Unknow"
"SOAD20039","Flumevale","Yes","Irrigation","Earth",14.177,0.118,25900,"1951","",0.03546,7.98987,"Uncontrolled","06/10/2021","6",27.05,"Low","Fair","2007-03-27",0.0452,23.1,271.2,44.6,14.177,0.118,0,25900,0,10.1620368569809,0,"Unknow"
"SOAD11232","Flumevale","Yes","Irrigation","Earth",5.124,0.183,11154,"1964","",0.0591,221.05307,"","08/04/1993","6",17.02,"Low","Unsatisfactory","2011-12-14",0.0948,22.4,276.8,4.2,5.124,0.183,0,11154,0,9.31964310686663,0,"Unknow"
"SOAD11301","Flumevale","Yes","Debris Control","Earth",11.519,0.421,0,"1963","",0.10441,NA,"","09/08/2022","1",0,"High","Satisfactory","2017-09-01",0.0903,15.1,445.9,NA,11.519,0.421,0,NA,1,NA,0,"Unknow"
"SOAD17914","Flumevale","Yes","Irrigation","Earth",3.553,0.157,4564,"1910","",0.07486,0,"","","6",25.73,"Low","Not Rated",NA,0.0398,44.9,96.6,34.9,3.553,0.157,0,4564,0,8.42617379302907,0,"Unknow"
"SOAD00630","Flumevale","Yes","Flood Risk Reduction","Earth",9.682,0.2,66672,"1887","",0.02364,0,"Uncontrolled","09/10/2012","3",0,"Low","Not Rated",NA,0.0879,43,795.3,NA,9.682,0.2,0,66672,0,11.1075553523499,0,"Unknow"
"SOAD01724","Flumevale","Yes","Irrigation","Earth",4.739,0.083,0,"1890","",0.08668,0,"","13/08/1987","6",21.08,"Low","Not Rated",NA,0.0499,37.6,135,47.2,4.739,0.083,0,NA,1,NA,0,"Unknow"
"SOAD06608","Flumevale","Yes","Irrigation","Earth",10.583,0.133,7327,"1947","",0.04334,0,"","08/06/2022","6",27.67,"Low","Not Rated",NA,0.0774,14.2,144.8,25.8,10.583,0.133,0,7327,0,8.89945790635397,0,"Unknow"
"SOAD07257","Flumevale","Yes","Irrigation","Earth",3.432,0.525,42481,"1906","",0.08668,0,"","25/09/2013","6",8.42,"Low","Not Rated",NA,0.0583,10.4,389.6,36.7,3.432,0.525,0,42481,0,10.6568357357868,0,"Unknow"
"SOAD08758","Flumevale","Yes","Fish and Wildlife Pond","Earth",5.407,0.138,14921,"1912","2002S",0,7.98987,"Uncontrolled","29/06/2017","10",18.04,"Low","Not Rated",NA,0.0246,19,150.5,NA,5.407,0.138,0,14921,0,9.61059191303146,1,"2002"
"SOAD09490","Flumevale","Yes","Irrigation","Earth",8.589,0.143,29600,"1976","",0.04728,2.66329,"","28/09/2021","0.5",0,"Low","Satisfactory","2017-09-01",0.0631,31.9,197.6,29.2,8.589,0.143,0,29600,0,10.2955634235253,0,"Unknow"
"SOAD10127","Flumevale","Yes","Water Supply","Earth",13.952,0.158,17500,"1978","",0.05122,0,"","14/03/2022","1",NA,"Significant","Satisfactory","2017-09-01",0.1065,23.1,39.5,33.9,13.952,0.158,0,17500,0,9.77001330113616,0,"Unknow"
"SOAD12250","Flumevale","Yes","Water Supply","Earth",14.537,0.098,19700,"1953","",0.03349,0,"","02/11/2021","1",NA,"High","Satisfactory","2017-09-01",0.0805,29.5,598.1,9.7,14.537,0.098,0,19700,0,9.88842467485908,0,"Unknow"
"SOAD12595","Flumevale","Yes","Irrigation","Earth",7.749,0.15,12000,"1986","",0.03546,0,"","01/01/1997","0",31.46,"Low","Not Rated",NA,0.0572,29,140.8,38.8,7.749,0.15,0,12000,0,9.39274525863144,0,"Unknow"
"SOAD15349","Flumevale","Yes","Hydroelectric","Earth",5.196,0.524,NA,"1896","",0.0591,NA,"Uncontrolled","05/09/2023","3",28.45,"Low","Satisfactory","2023-09-29",0.0645,17.4,377.9,51.6,5.196,0.524,0,NA,1,NA,0,"Unknow"
"SOAD16688","Flumevale","Yes","Debris Control","Earth",16.117,0.189,158000,"1961","",0.02561,10.65316,"","01/12/2021","1",0,"High","Satisfactory","2017-09-01",0.0979,17.5,360.8,NA,16.117,0.189,0,158000,0,11.970356641103,0,"Unknow"
"SOAD19569","Flumevale","Yes","Fire Protection, Stock, Or Small Fish Pond","Earth",9.602,0.275,NA,"Unknow","",0.09653,0,"","15/11/1979","0",21.61,"Low","Fair","2021-05-28",0.0827,10.5,160.3,NA,9.602,0.275,0,NA,1,NA,0,"Unknow"
"SOAD02757","Flumevale","Yes","Irrigation","Earth",4.22,0.163,13367,"1936","1977;1993",0.06501,7.98987,"Uncontrolled","06/10/2016","6",1.61,"Low","Satisfactory","2017-02-16",0.039,4.8,250.9,13.9,4.22,0.163,0,13367,0,9.50061907027523,2,"1993"
"SOAD09642","Flumevale","Yes","Water Supply","Earth",38.852,0.207,93600,"1960","",0.02561,NA,"","16/03/2022","1",NA,"High","Satisfactory","2017-09-01",0.0987,29.8,507.7,27.1,38.852,0.207,0,93600,0,11.4467963461693,0,"Unknow"
"SOAD12162","Flumevale","Yes","Other","Earth",11.199,0.25,26600,"1951","",0.06501,10.65316,"","18/04/2022","0.5",NA,"Low","Satisfactory","2017-09-01",0.0631,31.9,17.4,NA,11.199,0.25,0,26600,0,10.1887040880481,0,"Unknow"
"SOAD15107","Flumevale","Yes","Irrigation","Earth",7.122,0.067,3333,"1904","1945",0.04334,0,"Uncontrolled","09/06/2021","6",16.81,"Low","Not Rated",NA,0.0468,17,113.9,34.3,7.122,0.067,0,3333,0,8.11192806331074,1,"1945"
"SOAD06515","Flumevale","Yes","Water Supply","Earth",11.314,0.1,31700,"1955","",0.05122,7.98987,"","16/06/2022","0.5",NA,"Low","Satisfactory","2017-09-01",0.0746,33.8,13.4,54.8,11.314,0.1,0,31700,0,10.3641035051091,0,"Unknow"
"SOAD07547","Flumevale","Yes","Irrigation","Earth",4.633,0.069,NA,"1930","",0.05319,0,"Uncontrolled","24/08/1987","6",112.68,"Low","Fair","2008-08-18",0.0678,44.9,148.2,40.1,4.633,0.069,0,NA,1,NA,0,"Unknow"
"SOAD08870","Flumevale","Yes","Irrigation","Earth",9.731,0.13,7389,"1914","",0.04334,34.62277,"Uncontrolled","30/07/1998","0",41.75,"Low","Fair","2018-09-05",0.0879,46.4,58.1,41.8,9.731,0.13,0,7389,0,8.90788301394225,0,"Unknow"
"SOAD09694","Flumevale","No","Fire Protection, Stock, Or Small Fish Pond","Earth",2.816,0.21,4107,"1955","",NA,NA,"Uncontrolled","14/08/2008","10",NA,"Low","Not Rated",NA,0.0323,7.9,16.1,NA,2.816,0.21,0,4107,0,8.32069157104845,0,"Unknow"
"SOAD11408","Flumevale","Yes","Water Supply","Earth",29.116,0.2,190000,"1988","",0.09456,0,"","21/06/2022","1",13.07,"High","Satisfactory","2017-09-01",0.1056,22.6,136.9,34.2,29.116,0.2,0,190000,0,12.1547846142867,0,"Unknow"
"SOAD12038","Flumevale","Yes","Water Supply","Earth",6.186,0.27,15095,"1939","",0.09653,0,"","08/06/2022","0.5",NA,"Low","Satisfactory","2017-09-01",0.0572,33.1,13,62.3,6.186,0.27,0,15095,0,9.62218508704839,0,"Unknow"
"SOAD12732","Flumevale","Yes","Irrigation","Earth",4.21,0.12,5973,"1964","",0.06698,226.37965,"","08/04/1993","6",17.84,"Low","Fair","2011-11-01",0.0656,45.1,243.7,20,4.21,0.12,0,5973,0,8.69517199877606,0,"Unknow"
"SOAD14050","Flumevale","Yes","Fire Protection, Stock, Or Small Fish Pond","Earth",4.674,0.374,NA,"1903","",0.05122,53.2658,"","15/11/1979","0",30.41,"Low","Fair","2021-09-21",0.083,32.6,220.6,NA,4.674,0.374,0,NA,1,NA,0,"Unknow"
"SOAD17380","Flumevale","Yes","Flood Risk Reduction","Earth",10.527,0.867,59500,"1964","",0.19306,13.31645,"","17/02/2022","1",0.16,"High","Satisfactory","2017-09-01",0.0976,19.6,744.3,NA,10.527,0.867,0,59500,0,10.9937483981152,0,"Unknow"
"SOAD18167","Flumevale","Yes","Irrigation","Earth",16.724,0.297,91000,"1961","2006",0.03349,0,"Uncontrolled","01/11/2020","1",15.04,"High","Not Available",NA,0.1111,29.1,300.4,20.1,16.724,0.297,0,91000,0,11.4186257744496,1,"2006"
"SOAD19075","Flumevale","Yes","Irrigation","Earth",4.124,0.367,0,"1915","",0.07683,0,"Uncontrolled","21/09/2013","6",1.58,"Low","Fair","2019-07-23",0.0704,17.5,400.7,32,4.124,0.367,0,NA,1,NA,0,"Unknow"
"SOAD20004","Flumevale","Yes","Water Supply","Earth",3.757,0.193,0,"1923","",0.28762,29.29619,"","15/06/2022","0.5",NA,"Low","Satisfactory","2017-09-01",0.0726,323.2,8.7,29.9,3.757,0.193,0,NA,1,NA,0,"Unknow"
"SOAD01199","Flumevale","Yes","Water Supply","Earth",10.594,0.167,0,"1980","",0.03349,0,"Uncontrolled","29/04/2021","2",0,"Significant","Fair","2021-04-29",0.1319,31.8,639,36.2,10.594,0.167,0,NA,1,NA,0,"Unknow"
"SOAD03321","Flumevale","Yes","Irrigation","Earth",2.789,0.2,6005,"1890","",0.12411,0,"","","6",14.63,"Low","Not Rated",NA,0.049,26.9,97.1,4,2.789,0.2,0,6005,0,8.70051424854327,0,"Unknow"
"SOAD09169","Flumevale","Yes","Irrigation","Earth",4.482,0.35,18649,"1908","",0.06698,0,"","20/05/1985","6",15.82,"Low","Not Rated",NA,0.0882,23.8,458.4,42.8,4.482,0.35,0,18649,0,9.83360142507196,0,"Unknow"
"SOAD11213","Flumevale","Yes","Irrigation","Earth",3.628,0.025,44725,"1894","",0.06501,0,"Uncontrolled","02/08/2022","2",8.21,"Significant","Satisfactory","2022-08-02",0.1109,39.1,423.5,31.4,3.628,0.025,0,44725,0,10.7083102669867,0,"Unknow"
"SOAD11619","Flumevale","Yes","Irrigation","Earth",4.095,0.14,7965,"1915","",0.03152,0,"","","6",11.76,"Low","Satisfactory","2014-04-15",0.0557,31.9,179.2,42.2,4.095,0.14,0,7965,0,8.98293776374159,0,"Unknow"
"SOAD16907","Flumevale","Yes","Fish and Wildlife Pond","Earth",10.969,0.067,25780,"1956","",0.05713,0,"Uncontrolled","01/07/2015","6",52.1,"Low","Fair","2021-06-18",0.0537,7,52.5,NA,10.969,0.067,0,25780,0,10.1573930655004,0,"Unknow"
"SOAD00237","Flumevale","Yes","Irrigation","Earth",7.602,0.147,22816,"1898","",0.0394,7.98987,"Uncontrolled","27/09/2005","6",8.03,"Low","Not Rated",NA,0.051,9,296.1,40.9,7.602,0.147,0,22816,0,10.0352611511456,0,"Unknow"
"SOAD02756","Flumevale","Yes","Irrigation","Earth",9.321,0.179,NA,"1959","",0.05713,21.30632,"","05/03/1987","0",231.6,"Low","Satisfactory","2016-04-19",0.0732,40.9,91.1,17.5,9.321,0.179,0,NA,1,NA,0,"Unknow"
"SOAD05230","Flumevale","Yes","Fish and Wildlife Pond","Earth",3.173,0.133,7111,"1904","",0.07486,0,"","25/09/2013","6",46.71,"Low","Not Rated",NA,0.0594,15.3,199.8,NA,3.173,0.133,0,7111,0,8.86953877719374,0,"Unknow"
"SOAD06780","Flumevale","Yes","Fire Protection, Stock, Or Small Fish Pond","Earth",6.952,0.1,NA,"1979","",0.07486,7.98987,"","16/09/1992","0",17.91,"Low","Fair","2017-06-23",0.0885,10.9,296.1,NA,6.952,0.1,0,NA,1,NA,0,"Unknow"
"SOAD10233","Flumevale","Yes","Fire Protection, Stock, Or Small Fish Pond","Earth",2.911,0.141,NA,"1901","",0.06107,0,"","17/07/1978","0",27.98,"Low","Satisfactory","2021-09-09",0.0811,36.1,456.3,NA,2.911,0.141,0,NA,1,NA,0,"Unknow"
"SOAD13423","Flumevale","Yes","Irrigation","Earth",2.84,0.71,17111,"1893","",0.08274,0,"","","6",3.22,"Low","Not Rated",NA,0.0321,19.8,460.4,27.8,2.84,0.71,0,17111,0,9.74753525076224,0,"Unknow"
"SOAD15912","Flumevale","Yes","Water Supply","Earth",9.311,0.123,0,"1953","",0.06501,5.32658,"","27/05/2022","0.5",NA,"Low","Satisfactory","2017-09-01",0.0598,19.1,9.4,47.5,9.311,0.123,0,NA,1,NA,0,"Unknow"
"SOAD19383","Flumevale","Yes","Irrigation","Earth",5.704,0.397,NA,"1895","",0.06698,0,"","08/08/2019","6",3.3,"Low","Not Rated",NA,0.0978,7.3,373.2,16.4,5.704,0.397,0,NA,1,NA,0,"Unknow"
"SOAD03570","Flumevale","Yes","Fire Protection, Stock, Or Small Fish Pond","Earth",11.539,0.272,NA,"1963","",0.0591,7.98987,"","05/03/1987","0",117.07,"Low","Fair","2016-10-19",0.0949,10.6,148.4,NA,11.539,0.272,0,NA,1,NA,0,"Unknow"
"SOAD04219","Flumevale","Yes","Other","Earth",12.592,0.083,0,"Unknow","",NA,NA,"","25/05/2023","0.5",10.89,"Low","Fair","2018-07-11",0.0831,12.3,195.5,NA,12.592,0.083,0,NA,1,NA,0,"Unknow"
"SOAD08825","Flumevale","Yes","Debris Control","Earth",16.8,0.389,339400,"1997","",0.05122,2.66329,"","23/02/2022","0.5",NA,"Low","Satisfactory","2017-09-01",0.0628,29,18.1,NA,16.8,0.389,0,339400,0,12.7349375781539,0,"Unknow"
"SOAD10164","Flumevale","Yes","Water Supply","Earth",11.693,0.067,0,"1885","",0.0788,2.66329,"","14/06/2023","0.5",NA,"Low","Fair","2017-09-01",0.0899,25.7,16.3,54,11.693,0.067,0,NA,1,NA,0,"Unknow"
"SOAD10317","Flumevale","Yes","Water Supply","Earth",8.351,0.646,78297,"2002","",0.04137,0,"","23/09/2021","1",1.08,"Significant","Satisfactory","2017-09-01",0.1099,10.5,272.1,7.1,8.351,0.646,0,78297,0,11.2682773388685,0,"Unknow"
"SOAD10623","Flumevale","Yes","Water Supply","Earth",4.161,0.4,4000,"1912","",0.28565,122.51134,"","09/09/2021","0.5",NA,"Low","Satisfactory","2017-09-01",0.0717,438.3,8.8,53.6,4.161,0.4,0,4000,0,8.29429960885724,0,"Unknow"
"SOAD11708","Flumevale","Yes","Flood Risk Reduction","Earth",9.946,0.142,9560,"1956","",0.04925,0,"Uncontrolled","01/11/2011","3",8.24,"Low","Fair","2017-07-13",0.0773,36.3,179.2,NA,9.946,0.142,0,9560,0,9.16544760308545,0,"Unknow"
"SOAD12803","Flumevale","Yes","Irrigation","Earth",6.006,0.128,NA,"1960","",0.04137,0,"Uncontrolled","16/05/2018","6",43.36,"Low","Satisfactory","2019-08-22",0.0495,5.8,189.2,8,6.006,0.128,0,NA,1,NA,0,"Unknow"
"SOAD13966","Flumevale","Yes","Irrigation","Earth",8.288,0.268,30055,"1956","",0.06501,0,"","06/10/2022","6",19.21,"Low","Not Rated",NA,0.0554,28.4,147.3,39.4,8.288,0.268,0,30055,0,10.3108175872538,0,"Unknow"
"SOAD17186","Flumevale","Yes","Water Supply","Earth",11.88,0.147,27961,"1949","",0.06501,2.66329,"","28/07/2022","0.5",NA,"Low","Satisfactory","2017-09-01",0.0616,15.4,12.8,10,11.88,0.147,0,27961,0,10.2386017245478,0,"Unknow"
"SOAD18288","Flumevale","Yes","Unknow","Earth",11.116,NA,NA,"1948","",0.06107,NA,"","","0",NA,"Low","Fair","2020-08-13",0.0914,28.6,19,NA,11.116,NA,1,NA,1,NA,0,"Unknow"
"SOAD18611","Flumevale","Yes","Water Supply","Earth",25.916,0.323,5600,"1964","",0.04137,0,"","26/07/2022","1",1.58,"High","Satisfactory","2017-09-01",0.0941,23.1,901.8,10.4,25.916,0.323,0,5600,0,8.63070043220983,0,"Unknow"
"SOAD20358","Flumevale","Yes","Irrigation","Earth",3.668,0.067,0,"1946","",0.10047,7.98987,"Uncontrolled","28/06/1990","6",45.95,"Low","Not Rated",NA,0.0789,14,226.1,13.4,3.668,0.067,0,NA,1,NA,0,"Unknow"
"SOAD05876","Flumevale","Yes","Irrigation","Earth",3.49,0.8,48672,"1892","",0.12017,0,"","09/03/1993","6",15.61,"Low","Not Rated",NA,0.1063,42.5,179.6,40.1,3.49,0.8,0,48672,0,10.7928797405416,0,"Unknow"
"SOAD07321","Flumevale","Yes","Irrigation","Earth",15.523,0.25,88989,"1983","2001",0.04137,0,"","23/07/2019","6",45.13,"Low","Not Rated",NA,0.0546,14.2,188.6,27.3,15.523,0.25,0,88989,0,11.3962792828509,1,"2001"
"SOAD11794","Flumevale","Yes","Water Supply","Earth",11.525,0.24,18000,"1969","",0.0591,13.31645,"","24/05/2022","0.5",NA,"Low","Satisfactory","2017-09-01",0.0849,17.8,18,23.3,11.525,0.24,0,18000,0,9.7981825908907,0,"Unknow"
"SOAD16819","Flumevale","No","Fish and Wildlife Pond","Earth",11.926,0.267,NA,"1972","",0.10047,NA,"Uncontrolled","09/05/2023","4",54.77,"Low","Poor","2023-05-09",0.0882,43.8,218.4,NA,11.926,0.267,0,NA,1,NA,0,"Unknow"
"SOAD18062","Flumevale","Yes","Irrigation","Earth",6.804,0.15,NA,"Unknow","",0.07092,15.97974,"Uncontrolled","28/10/2016","6",29.67,"Low","Not Rated",NA,0.0553,20.7,291.3,45.9,6.804,0.15,0,NA,1,NA,0,"Unknow"
"SOAD19956","Flumevale","Yes","Water Supply","Earth",12.262,0.134,24700,"1951","",0.07486,2.66329,"","28/07/2022","1",8.13,"High","Satisfactory","2017-09-01",0.0925,20.9,179.2,35.4,12.262,0.134,0,24700,0,10.1145990076265,0,"Unknow"
"SOAD01872","Flumevale","Yes","Fire Protection, Stock, Or Small Fish Pond","Earth",9.544,0.075,11163,"1974","",0.05122,21.30632,"Uncontrolled","04/06/2015","6",30.94,"Low","Unsatisfactory","2013-10-11",0.0968,11.1,219.8,NA,9.544,0.075,0,11163,0,9.32044959465621,0,"Unknow"
"SOAD03895","Flumevale","Yes","Water Supply","Earth",10.876,0.25,0,"1882","",0.03546,0,"","19/10/2021","0.5",NA,"Low","Satisfactory","2017-09-01",0.0707,9.9,5.8,39.2,10.876,0.25,0,NA,1,NA,0,"Unknow"
"SOAD05037","Flumevale","Yes","Recreation","Earth",13.392,0.118,16000,"2006","",0.04334,21.30632,"Uncontrolled","06/08/2010","0",64.38,"Low","Satisfactory","2021-06-07",0.0593,10.7,52.6,3.2,13.392,0.118,0,16000,0,9.68040649926887,0,"Unknow"
"SOAD06332","Flumevale","Yes","Irrigation","Earth",4.117,0.25,15088,"1918","",0.08668,0,"Uncontrolled","15/10/2020","6",9.36,"Low","Satisfactory","2013-09-26",0.0502,45.7,277.2,34.2,4.117,0.25,0,15088,0,9.62172128051365,0,"Unknow"
"SOAD07862","Flumevale","No","Unknow","Earth",7.176,0.093,0,"1956","",0.04728,0,"","06/12/2022","Unknow",NA,"Significant","Not Available",NA,0.1486,41.6,295.4,NA,7.176,0.093,0,NA,1,NA,0,"Unknow"
"SOAD09846","Flumevale","Yes","Water Supply","Earth",7.643,0.022,4867,"1888","",0.03152,0,"Uncontrolled","12/05/2020","6",1.69,"Low","Fair","2017-02-21",0.0614,36.6,416.8,25.5,7.643,0.022,0,4867,0,8.49043845410742,0,"Unknow"
"SOAD13567","Flumevale","Yes","Flood Risk Reduction","Earth",20.192,0.183,76000,"1979","1996",0.01773,5.32658,"Uncontrolled","20/10/2011","2",4.81,"Low","Not Available",NA,0.0989,41.2,744.9,NA,20.192,0.183,0,76000,0,11.2385017770766,1,"1996"
"SOAD18492","Flumevale","Yes","Water Supply","Earth",5.974,0.043,5211,"1940","",0.05319,0,"","29/09/2022","6",54.06,"Low","Satisfactory","2017-06-26",0.039,42.8,211.3,32.2,5.974,0.043,0,5211,0,8.55871893824474,0,"Unknow"
"SOAD07869","Flumevale","Yes","Irrigation","Earth",5.693,0.328,33320,"1946","",0.06895,0,"","01/10/1984","6",3.35,"Low","Not Rated",NA,0.0501,30.3,653.8,35.6,5.693,0.328,0,33320,0,10.4139431078352,0,"Unknow"
"SOAD11950","Flumevale","No","Hydroelectric","Earth",7.149,0.868,NA,"1911","",NA,NA,"Uncontrolled","07/09/2017","3",11.21,"Low","Poor","2023-09-29",0.0974,9.7,404.8,71.7,7.149,0.868,0,NA,1,NA,0,"Unknow"
"SOAD16179","Flumevale","Yes","Irrigation","Earth",4.282,0.025,NA,"1889","",0.08668,0,"","17/01/1974","0",0,"Low","Fair","2016-08-29",0.0791,19.7,595.5,24.1,4.282,0.025,0,NA,1,NA,0,"Unknow"
"SOAD16261","Flumevale","Yes","Irrigation","Earth",4.074,0.167,0,"1921","",0.12805,0,"Uncontrolled","13/08/1987","6",21.75,"Low","Unsatisfactory","2013-11-05",0.0901,31.4,355,39.4,4.074,0.167,0,NA,1,NA,0,"Unknow"
"SOAD17018","Flumevale","Yes","Other","Earth",17.678,0.433,155000,"1971","",0.05122,0,"","23/06/2022","0.5",NA,"Low","Satisfactory","2017-09-01",0.0692,6.3,14.7,NA,17.678,0.433,0,155000,0,11.9511868474935,0,"Unknow"
"SOAD18547","Flumevale","Yes","Water Supply","Earth",10.168,0.324,27200,"2004","",0.04334,0,"Uncontrolled","27/05/2021","2",NA,"Significant","Satisfactory","2021-05-27",0.1216,6.4,94.5,24.4,10.168,0.324,0,27200,0,10.2110090163142,0,"Unknow"
"SOAD18634","Flumevale","Yes","Flood Risk Reduction","Earth",9.027,0.167,NA,"1971","",0.06698,7.98987,"","15/12/1993","0",119.24,"Low","Satisfactory","2008-05-28",0.0695,21.6,87.9,NA,9.027,0.167,0,NA,1,NA,0,"Unknow"
"SOAD02907","Flumevale","Yes","Irrigation","Earth",4.902,0.533,80641,"1895","",0.06107,0,"Uncontrolled","29/04/2021","2",15.61,"Significant","Satisfactory","2021-04-29",0.1241,8.9,221.2,22.8,4.902,0.533,0,80641,0,11.2977748845849,0,"Unknow"
"SOAD08067","Flumevale","Yes","Recreation","Earth",3.664,0.083,0,"1966","",0.0394,0,"","27/08/1979","6",35.41,"Low","Not Rated",NA,0.0839,43.6,170.4,9.3,3.664,0.083,0,NA,1,NA,0,"Unknow"
"SOAD09907","Flumevale","Yes","Unknow","Earth",6.11,0.633,0,"1952","",0.10441,0,"Uncontrolled","19/07/1988","0",4.68,"Low","Fair","2017-09-25",0.0909,7.4,445.2,NA,6.11,0.633,0,NA,1,NA,0,"Unknow"
"SOAD15330","Flumevale","Yes","Debris Control","Earth",14.063,0.43,93000,"1963","",0.08077,13.31645,"","19/05/2022","0.5",NA,"Low","Satisfactory","2017-09-01",0.0657,43.8,5.8,NA,14.063,0.43,0,93000,0,11.4403655247658,0,"Unknow"
"SOAD04945","Flumevale","No","Fire Protection, Stock, Or Small Fish Pond","Earth",3.244,0.25,7626,"1954","",NA,NA,"Uncontrolled","14/08/2008","10",NA,"Low","Not Rated",NA,0.0539,7.7,8.5,NA,3.244,0.25,0,7626,0,8.93944986216424,0,"Unknow"
"SOAD17630","Flumevale","Yes","Flood Risk Reduction","Earth",10.449,0.208,20990,"1957","",0.04925,0,"Uncontrolled","10/04/2014","3",4.71,"Low","Fair","2020-09-15",0.0926,31.6,540.1,NA,10.449,0.208,0,20990,0,9.95184905341401,0,"Unknow"
"SOAD19828","Flumevale","Yes","Flood Risk Reduction","Earth",10.576,0.116,19010,"1957","",0.05122,0,"Uncontrolled","07/10/2020","6",18.33,"Low","Fair","2020-09-15",0.0516,21.2,277,NA,10.576,0.116,0,19010,0,9.85277303799163,0,"Unknow"
"SOAD20638","Flumevale","Yes","Debris Control","Earth",10.811,0.566,121700,"1991","",0.04137,NA,"","20/04/2022","1",0.16,"High","Satisfactory","2017-09-01",0.0999,13.2,518.3,NA,10.811,0.566,0,121700,0,11.7093224958687,0,"Unknow"
"SOAD00524","Flumevale","Yes","Flood Risk Reduction","Earth",10.964,0.153,21000,"1956","",0.06895,7.98987,"","28/06/2022","0.5",NA,"Low","Satisfactory","2017-09-01",0.0684,34.7,19.9,NA,10.964,0.153,0,21000,0,9.95232533461943,0,"Unknow"
"SOAD02248","Flumevale","Yes","Irrigation","Earth",5.4,0.217,22010,"Unknow","1976",0.03349,0,"Uncontrolled","28/08/2020","6",6.56,"Low","Satisfactory","2019-06-19",0.05,39.2,468.5,27.6,5.4,0.217,0,22010,0,9.9992976073821,1,"1976"
"SOAD03768","Flumevale","Yes","Recreation","Earth",5.222,0.117,5072,"1926","1952S;1968S;1999S",0.06107,7.98987,"Uncontrolled","19/06/2001","6",14.26,"Low","Satisfactory","2016-08-17",0.051,19.5,205.1,3.1,5.222,0.117,0,5072,0,8.53168763756669,3,"1999"
"SOAD06316","Flumevale","Yes","Water Supply","Earth",18.205,0.093,37600,"1964","",0.04925,7.98987,"","08/11/2021","1",NA,"Significant","Satisfactory","2021-11-12",0.1088,30.9,193,23.1,18.205,0.093,0,37600,0,10.534785924769,0,"Unknow"
"SOAD06843","Flumevale","Yes","Recreation","Earth",2.494,0.058,8762,"1906","",0.08077,0,"","25/09/2013","6",44.71,"Low","Not Rated",NA,0.0381,8.2,231.8,9.2,2.494,0.058,0,8762,0,9.07829359105585,0,"Unknow"
"SOAD07685","Flumevale","Yes","Fire Protection, Stock, Or Small Fish Pond","Earth",4.292,0.233,11200,"1950","",0.08077,7.98987,"","27/07/1979","6",28.91,"Low","Satisfactory","2013-07-25",0.0416,8.6,169.2,NA,4.292,0.233,0,11200,0,9.32375833901174,0,"Unknow"
"SOAD12185","Flumevale","Yes","Flood Risk Reduction","Earth",29.546,0.133,46960,"1876","",0.03152,2.66329,"","23/06/2022","1",0.8,"High","Satisfactory","2017-09-01",0.0864,13.2,396.2,NA,29.546,0.133,0,46960,0,10.7570727489942,0,"Unknow"
"SOAD13773","Flumevale","Yes","Flood Risk Reduction","Earth",6.392,0.417,NA,"1990","",0.08668,7.98987,"Uncontrolled","11/12/2018","3",1.69,"Low","Not Rated",NA,0.1204,18.8,234.3,NA,6.392,0.417,0,NA,1,NA,0,"Unknow"
"SOAD16462","Flumevale","Yes","Irrigation","Earth",4.736,0.21,400,"1931","",0.07683,0,"","15/10/1984","6",31.12,"Low","Satisfactory","2017-09-06",0.0441,30.4,197.9,13.6,4.736,0.21,0,400,0,5.99396142730657,0,"Unknow"
"SOAD20032","Flumevale","Yes","Water Supply","Earth",7.224,0.173,15665,"1966","",0.12805,7.98987,"","08/09/2021","0.5",NA,"Low","Satisfactory","2017-09-01",0.0755,43.8,15.3,15,7.224,0.173,0,15665,0,9.65924803792718,0,"Unknow"
"SOAD03048","Flumevale","Yes","Irrigation","Earth",8.063,0.05,6790,"1911","",0.12411,0,"Uncontrolled","06/08/2015","6",18.09,"Low","Fair","2017-05-25",0.0493,36.9,452.5,16.3,8.063,0.05,0,6790,0,8.82335348511379,0,"Unknow"
"SOAD05618","Flumevale","Yes","Debris Control","Earth",34.609,0.156,214800,"1978","",0.04334,26.6329,"","20/04/2022","1",1.56,"High","Satisfactory","2017-09-01",0.1041,25.5,613.3,NA,34.609,0.156,0,214800,0,12.2774672970995,0,"Unknow"
"SOAD06371","Flumevale","Yes","Irrigation","Earth",4.868,0.2,15902,"1961","",0.03152,0,"","27/07/1979","6",36.86,"Low","Fair","2020-10-29",0.0726,35.5,205.4,26.6,4.868,0.2,0,15902,0,9.67426304965592,0,"Unknow"
"SOAD06526","Flumevale","Yes","Irrigation","Earth",4.344,0.2,10657,"1900","",0.11032,13.31645,"","26/09/2013","6",6.18,"Low","Satisfactory","2019-04-03",0.0492,43.3,243.2,39.1,4.344,0.2,0,10657,0,9.27406606285673,0,"Unknow"
"SOAD08835","Flumevale","Yes","Water Supply","Earth",12.337,0.3,52000,"1986","",0.0925899999999999,NA,"","23/03/2022","1",0,"High","Satisfactory","2017-09-01",0.0852,15.2,660.3,57.2,12.337,0.3,0,52000,0,10.8590182281479,0,"Unknow"
"SOAD10963","Flumevale","Yes","Water Supply","Earth",8.898,0.133,0,"1983","",0.04925,NA,"","07/03/2023","1",NA,"Significant","Fair","2017-09-01",0.1353,46.6,201.6,69.9,8.898,0.133,0,NA,1,NA,0,"Unknow"
"SOAD12950","Flumevale","Yes","Other","Earth",5.263,1.097,33339,"1934","",0.10441,45.27593,"","05/01/2022","1",0.63,"High","Satisfactory","2017-09-01",0.0931,18.8,388.5,NA,5.263,1.097,0,33339,0,10.4145131563048,0,"Unknow"
"SOAD02295","Flumevale","Yes","Fish and Wildlife Pond","Earth",5.325,0.2,15557,"1948","",0.11032,13.31645,"","01/08/1988","0",35.06,"Low","Fair","2022-10-06",0.094,44.4,192.4,NA,5.325,0.2,0,15557,0,9.65233025476672,0,"Unknow"
"SOAD09223","Flumevale","Yes","Water Supply","Earth",14.584,0.125,36800,"Unknow","",0.05122,5.32658,"","01/03/2022","1",3.02,"Significant","Satisfactory","2017-09-01",0.1134,25.2,202.1,30.1,14.584,0.125,0,36800,0,10.5132802977009,0,"Unknow"
"SOAD09352","Flumevale","Yes","Water Supply","Earth",21.908,0.098,24000,"1950","",0.04334,5.32658,"","09/02/2023","1",NA,"Significant","Poor","2023-06-29",0.1569,19.2,134.6,6.7,21.908,0.098,0,24000,0,10.0858507751287,0,"Unknow"
"SOAD12682","Flumevale","Yes","Irrigation","Earth",4.28,0.173,0,"1951","",0.08077,0,"","29/08/1979","6",5.02,"Low","Fair","2019-06-14",0.0587,23.2,389,37.6,4.28,0.173,0,NA,1,NA,0,"Unknow"
"SOAD13074","Flumevale","Yes","Other","Earth",11.311,0.06,NA,"1978","2008",0.0591,13.31645,"Uncontrolled","18/08/2021","2",50.49,"Significant","Satisfactory","2021-08-18",0.1074,8,114,NA,11.311,0.06,0,NA,1,NA,1,"2008"
"SOAD14062","Flumevale","Yes","Irrigation","Earth",9.961,0.157,13362,"1926","2002",0.05122,7.98987,"Uncontrolled","27/08/2021","2",7.77,"Significant","Fair","2021-08-27",0.1243,15.1,327.9,26.8,9.961,0.157,0,13362,0,9.50024497278106,1,"2002"
"SOAD15565","Flumevale","Yes","Irrigation","Earth",6.745,0.149,22460,"1907","",0.04334,0,"","23/07/2015","6",20.13,"Low","Satisfactory","2013-09-25",0.0568,24,427,15,6.745,0.149,0,22460,0,10.0195357508988,0,"Unknow"
"SOAD18883","Flumevale","Yes","Recreation","Earth",8.674,0.028,1951,"1965","",0.0591,0,"Uncontrolled","27/09/2009","10",0,"Low","Not Rated",NA,0.056,31.8,258.5,3.1,8.674,0.028,0,1951,0,7.57660976697304,0,"Unknow"
"SOAD01611","Flumevale","Yes","Irrigation","Earth",2.721,0.45,NA,"1870","",0.04334,7.98987,"","08/03/1991","0",12.31,"Low","Not Rated",NA,0.1217,28.8,257,36.2,2.721,0.45,0,NA,1,NA,0,"Unknow"
"SOAD03830","Flumevale","Yes","Fish and Wildlife Pond","Earth",6.954,0.067,NA,"1910","",0.08471,0,"","26/09/2016","6",29.43,"Low","Not Rated",NA,0.0654,10.2,301.1,NA,6.954,0.067,0,NA,1,NA,0,"Unknow"
"SOAD05609","Flumevale","Yes","Water Supply","Earth",6.093,0.117,3400,"1978","",0.07683,2.66329,"","02/06/2022","0.5",NA,"Low","Satisfactory","2017-09-01",0.0739,43.4,18.8,32.6,6.093,0.117,0,3400,0,8.1318247850072,0,"Unknow"
"SOAD07474","Flumevale","Yes","Debris Control","Earth",16.367,0.388,55000,"1975","",0.12608,806.97687,"","28/03/2022","1",NA,"High","Satisfactory","2017-09-01",0.1086,43.8,694.5,NA,16.367,0.388,0,55000,0,10.9151066458675,0,"Unknow"
"SOAD09279","Flumevale","Yes","Water Supply","Earth",19.75,0.168,47000,"1964","",0.04925,2.66329,"","22/09/2021","1",2.46,"High","Satisfactory","2017-09-01",0.0847,31.2,537.4,13.9,19.75,0.168,0,47000,0,10.7579241570616,0,"Unknow"
"SOAD11372","Flumevale","Yes","Flood Risk Reduction","Earth",10.229,0.203,23170,"1958","",0.05713,0,"Uncontrolled","25/07/2013","3",4.76,"Low","Not Rated",NA,0.0847,37.8,151.9,NA,10.229,0.203,0,23170,0,10.0506567757527,0,"Unknow"
"SOAD11926","Flumevale","Yes","Recreation","Earth",5.889,0.053,NA,"1909","",0.06895,0,"","07/08/1990","0",48,"Low","Fair","2021-07-23",0.0865,29,119.8,8.4,5.889,0.053,0,NA,1,NA,0,"Unknow"
"SOAD00911","Flumevale","Yes","Recreation","Earth",11.292,0.18,NA,"1939","",0.0591,7.98987,"","14/10/2020","6",78.94,"Low","Fair","2015-05-26",0.0531,45.5,173.7,2.9,11.292,0.18,0,NA,1,NA,0,"Unknow"
"SOAD01005","Flumevale","Yes","Flood Risk Reduction","Earth",9.171,0.124,6916,"1971","",0.05713,7.98987,"Uncontrolled","17/11/2020","3",4.81,"Low","Unsatisfactory","2014-06-05",0.1186,14.2,95.5,NA,9.171,0.124,0,6916,0,8.84173742860058,0,"Unknow"
"SOAD06667","Flumevale","Yes","Water Supply","Earth",7.158,0.143,0,"Unknow","",0.16351,NA,"","16/02/2023","1",NA,"High","Fair","2017-09-01",0.1039,25.1,721.3,62.5,7.158,0.143,0,NA,1,NA,0,"Unknow"
"SOAD08964","Flumevale","Yes","Water Supply","Earth",8.246,0.679,53000,"1979","",0.05122,0,"","30/11/2021","1",0.16,"High","Satisfactory","2017-09-01",0.0939,22.8,414.5,16.8,8.246,0.679,0,53000,0,10.8780660602808,0,"Unknow"
"SOAD10286","Flumevale","Yes","Recreation","Earth",3.124,0.283,0,"1930","",0.06895,0,"","26/07/1979","6",5.05,"Low","Not Rated",NA,0.0916,34.5,129.7,8.2,3.124,0.283,0,NA,1,NA,0,"Unknow"
"SOAD13088","Flumevale","Yes","Irrigation","Earth",3.429,0.107,14982,"1888","",0.06107,0,"Uncontrolled","15/08/1991","6",8.38,"Low","Not Rated",NA,0.0626,35.6,147,15.4,3.429,0.107,0,14982,0,9.61467150404314,0,"Unknow"
"SOAD19208","Flumevale","Yes","Water Supply","Earth",10.147,0.2,40000,"1970","",0.04925,2.66329,"","02/08/2022","1",NA,"High","Satisfactory","2017-09-01",0.1044,13.5,642.9,31.8,10.147,0.2,0,40000,0,10.5966597327836,0,"Unknow"
"SOAD20007","Flumevale","Yes","Water Supply","Earth",6.513,0.07,2332,"1954","",0.13987,0,"","27/04/2022","1",5.84,"Significant","Satisfactory","2017-09-01",0.1309,46.5,344.6,41.9,6.513,0.07,0,2332,0,7.75491027202143,0,"Unknow"
"SOAD01936","Flumevale","Yes","Fish and Wildlife Pond","Earth",7.296,0.07,9402,"1889","",0.0591,0,"Uncontrolled","29/08/2019","6",61.95,"Low","Fair","2018-10-22",0.0593,25,234.2,NA,7.296,0.07,0,9402,0,9.14878406627708,0,"Unknow"
"SOAD08196","Flumevale","Yes","Irrigation","Earth",5.548,0.11,0,"1932","",0.04728,0,"Uncontrolled","14/06/1994","0",21.46,"Low","Fair","2014-10-09",0.0753,23.4,420.8,28,5.548,0.11,0,NA,1,NA,0,"Unknow"
"SOAD13292","Flumevale","Yes","Irrigation","Earth",6.442,0.109,12246,"1904","",0.02364,15.97974,"","01/01/1997","0",6.73,"Low","Fair","2022-07-12",0.072,26.7,185.5,28.6,6.442,0.109,0,12246,0,9.41303628802129,0,"Unknow"
"SOAD13649","Flumevale","Yes","Irrigation","Earth",3.281,0.1,NA,"1903","",0.08471,103.86831,"","26/10/1979","0",35.45,"Low","Not Rated",NA,0.0563,18.4,165.7,23.9,3.281,0.1,0,NA,1,NA,0,"Unknow"
"SOAD01221","Flumevale","Yes","Irrigation","Earth",5.863,0.067,4139,"1914","1966S",0.08274,34.62277,"Uncontrolled","08/05/2019","6",4.78,"Low","Satisfactory","2020-10-15",0.0392,30.7,147.8,36.7,5.863,0.067,0,4139,0,8.32845106681936,1,"1966"
"SOAD07644","Flumevale","Yes","Water Supply","Earth",17.754,0.2,0,"1961","",0.04925,2.66329,"","14/03/2022","0.5",NA,"Low","Satisfactory","2017-09-01",0.0692,29.8,17,61.1,17.754,0.2,0,NA,1,NA,0,"Unknow"
"SOAD11188","Flumevale","Yes","Irrigation","Earth",8.366,0.108,5777,"1950","",0.03546,0,"Uncontrolled","03/08/2017","6",10.78,"Low","Fair","2013-09-24",0.0499,46.3,266.1,14.8,8.366,0.108,0,5777,0,8.66181288102618,0,"Unknow"
"SOAD13983","Flumevale","Yes","Irrigation","Earth",4.116,0.5,NA,"1971","",0.12608,53.2658,"","09/11/1976","0",13.26,"Low","Satisfactory","2020-10-06",0.0656,25.8,220.5,39.1,4.116,0.5,0,NA,1,NA,0,"Unknow"
"SOAD16856","Flumevale","Yes","Water Supply","Earth",13.633,0.1,40000,"1971","",0.06698,0,"","11/01/2022","0.5",NA,"Low","Satisfactory","2017-09-01",0.0776,23.9,12.3,69.1,13.633,0.1,0,40000,0,10.5966597327836,0,"Unknow"
"SOAD19167","Flumevale","No","Fire Protection, Stock, Or Small Fish Pond","Earth",9.088,0.117,4167,"1965","",0.0906199999999999,NA,"Uncontrolled","09/05/2023","4",20.23,"Low","Poor","2023-05-09",0.0556,30.4,311.4,NA,9.088,0.117,0,4167,0,8.3351915834332,0,"Unknow"
"SOAD20414","Flumevale","Yes","Other","Earth",15.041,0.087,46572,"1951","",0.03349,2.66329,"","22/07/2021","1",0,"Significant","Satisfactory","2017-09-01",0.1194,41,104.8,NA,15.041,0.087,0,46572,0,10.7487762530556,0,"Unknow"
"SOAD01801","Flumevale","Yes","Flood Risk Reduction","Earth",7.163,0.367,14840,"1998","",0.08274,2.66329,"","20/04/2022","1",0.16,"High","Satisfactory","2017-09-01",0.0772,19.7,757.5,NA,7.163,0.367,0,14840,0,9.60514889989582,0,"Unknow"
"SOAD06345","Flumevale","Yes","Irrigation","Earth",3.298,0.733,0,"1910","",0.15957,0,"","23/10/1990","6",1.67,"Low","Not Rated",NA,0.0781,41.6,566.8,23.3,3.298,0.733,0,NA,1,NA,0,"Unknow"
"SOAD07529","Flumevale","Yes","Other","Earth",8.836,0.241,22250,"1967","",0.0886499999999999,NA,"","10/08/2022","1",NA,"Significant","Satisfactory","2017-09-01",0.1252,34.9,55.1,NA,8.836,0.241,0,22250,0,10.0101422304047,0,"Unknow"
"SOAD01566","Flumevale","Yes","Water Supply","Earth",13.165,0.117,23315,"1959","",0.07683,2.66329,"","12/11/2021","0.5",NA,"Low","Satisfactory","2017-09-01",0.0716,24.8,21,54.8,13.165,0.117,0,23315,0,10.0568950991654,0,"Unknow"
"SOAD02060","Flumevale","Yes","Irrigation","Earth",3.397,0.2,13830,"1902","",0.13987,0,"","31/07/1980","6",4.73,"Low","Fair","2003-05-15",0.0746,32.7,610.2,17.5,3.397,0.2,0,13830,0,9.53466772862471,0,"Unknow"
"SOAD03225","Flumevale","Yes","Other","Earth",8.222,0.533,NA,"2008","",0.04334,0,"Uncontrolled","17/05/2017","6",NA,"Low","Satisfactory","2019-08-17",0.0414,6.9,9.7,NA,8.222,0.533,0,NA,1,NA,0,"Unknow"
"SOAD04218","Flumevale","Yes","Irrigation","Earth",5.717,0.117,10676,"1964","",0.06501,13.31645,"","09/08/2017","6",19.79,"Low","Unsatisfactory","2016-06-14",0.0835,21.3,450.7,41.3,5.717,0.117,0,10676,0,9.2758471741783,0,"Unknow"
"SOAD05633","Flumevale","Yes","Flood Risk Reduction","Earth",9.983,0.147,18050,"1965","",0.06501,7.98987,"","11/04/2018","3",40.5,"Low","Unsatisfactory","2016-12-02",0.1271,36.4,228.5,NA,9.983,0.147,0,18050,0,9.80095636388846,0,"Unknow"
"SOAD07211","Flumevale","Yes","Water Supply","Earth",17.573,1.2,0,"1999","",0.0886499999999999,NA,"","16/09/2021","0.5",NA,"Low","Satisfactory","2017-09-01",0.075,16.8,13,26.6,17.573,1.2,0,NA,1,NA,0,"Unknow"
"SOAD13719","Flumevale","Yes","Unknow","Earth",6.634,0.533,18661,"Unknow","",0,NA,"Uncontrolled","21/08/2019","1",0,"High","Not Rated",NA,0.1118,24.9,271.9,NA,6.634,0.533,0,18661,0,9.83424464979397,0,"Unknow"
"SOAD20302","Flumevale","No","Fish and Wildlife Pond","Earth",3.053,0.413,NA,"1965","",NA,5.32658,"Controlled","07/09/2010","10",NA,"Low","Not Rated",NA,0.0027,20.4,17,NA,3.053,0.413,0,NA,1,NA,0,"Unknow"
"SOAD00908","Flumevale","Yes","Flood Risk Reduction","Earth",3.944,0.567,NA,"2006","",0.08471,21.30632,"Uncontrolled","","3",0,"Significant","Not Rated",NA,0.1384,28.4,185.6,NA,3.944,0.567,0,NA,1,NA,0,"Unknow"
"SOAD01929","Flumevale","No","Fire Protection, Stock, Or Small Fish Pond","Earth",18.651,0.197,NA,"1900","1978",0.03152,0,"Uncontrolled","23/06/2017","3",0,"Low","Fair","2017-06-23",0.0748,40,783.2,NA,18.651,0.197,0,NA,1,NA,1,"1978"
"SOAD06688","Flumevale","Yes","Fire Protection, Stock, Or Small Fish Pond","Earth",7.444,0.148,15427,"1896","",0.05713,0,"Uncontrolled","25/05/2017","6",4.73,"Low","Not Rated",NA,0.0427,30.4,875,NA,7.444,0.148,0,15427,0,9.64393931932812,0,"Unknow"
"SOAD07054","Flumevale","Yes","Irrigation","Earth",6.359,0.1,0,"1898","",0.00788,0,"Uncontrolled","","0",16.59,"Low","Fair","2018-07-11",0.0688,16.5,130.4,29.9,6.359,0.1,0,NA,1,NA,0,"Unknow"
"SOAD12258","Flumevale","Yes","Irrigation","Earth",6.389,0.267,NA,"1951","",0.07486,29.29619,"","","0",97.39,"Low","Fair","2016-09-30",0.0865,40.6,114.4,39.2,6.389,0.267,0,NA,1,NA,0,"Unknow"
"SOAD13446","Flumevale","Yes","Water Supply","Earth",24.145,0.104,34130,"1947","",0.04137,0,"","03/11/2021","1",1.08,"High","Satisfactory","2017-09-01",0.0909,45.9,843.5,28.4,24.145,0.104,0,34130,0,10.4379613412078,0,"Unknow"
"SOAD13710","Flumevale","Yes","Water Supply","Earth",12.566,0.17,24000,"1961","",0.04728,0,"","24/08/2022","1",4.75,"High","Satisfactory","2017-09-01",0.0903,11.9,866.7,14.5,12.566,0.17,0,24000,0,10.0858507751287,0,"Unknow"
"SOAD18990","Flumevale","Yes","Flood Risk Reduction","Earth",7.463,0.32,12813,"1998","",0.05122,7.98987,"Uncontrolled","14/12/2018","3",0,"Significant","Satisfactory","2018-12-14",0.1196,17.4,422.9,NA,7.463,0.32,0,12813,0,9.45829360219897,0,"Unknow"
"SOAD00315","Flumevale","Yes","Fire Protection, Stock, Or Small Fish Pond","Earth",8.807,0.25,NA,"1943","",0.04925,7.98987,"","11/05/1998","6",18.55,"Low","Not Rated",NA,0.0511,46.3,177.3,NA,8.807,0.25,0,NA,1,NA,0,"Unknow"
"SOAD00415","Flumevale","Yes","Recreation","Earth",9.721,0.227,18638,"1968","",0.07289,271.65558,"","","6",81.95,"Low","Fair","2013-09-24",0.0653,24.2,112.5,5.8,9.721,0.227,0,18638,0,9.8330114387318,0,"Unknow"
"SOAD08493","Flumevale","Yes","Irrigation","Earth",3.953,1.25,NA,"1972","",0.11623,0,"","27/08/1986","6",32.58,"Low","Not Rated",NA,0.0458,31.8,191.4,26.5,3.953,1.25,0,NA,1,NA,0,"Unknow"
"SOAD11538","Flumevale","Yes","Water Supply","Earth",14.719,0.047,7750,"1955","",0.06895,2.66329,"","19/08/2022","1",1.61,"High","Satisfactory","2017-09-01",0.0853,39.1,755.9,18,14.719,0.047,0,7750,0,8.95557714628151,0,"Unknow"
"SOAD12593","Flumevale","Yes","Tailings","Earth",3.527,0.6,39539,"1991","",0.07486,NA,"","15/07/2022","1",NA,"Significant","Fair","2017-09-01",0.1302,31.8,34.4,NA,3.527,0.6,0,39539,0,10.5850680967246,0,"Unknow"
"SOAD13525","Flumevale","Yes","Irrigation","Earth",13.2,0.139,NA,"1906","",0.05122,0,"Uncontrolled","29/09/2015","6",30.04,"Low","Not Rated",NA,0.0456,37.5,213.3,1,13.2,0.139,0,NA,1,NA,0,"Unknow"
"SOAD03379","Flumevale","Yes","Recreation","Earth",3.381,0.233,24535,"1878","",0.10638,0,"Uncontrolled","03/11/1999","6",12.66,"Low","Fair","2022-10-18",0.0525,16.3,198.2,5.5,3.381,0.233,0,24535,0,10.1078967057941,0,"Unknow"
"SOAD09129","Flumevale","Yes","Flood Risk Reduction","Earth",6.154,0.853,NA,"2005","",0.05713,0,"Uncontrolled","08/08/2019","3",0,"Significant","Satisfactory","2019-08-08",0.117,39.8,404.3,NA,6.154,0.853,0,NA,1,NA,0,"Unknow"
"SOAD09691","Flumevale","Yes","Water Supply","Earth",6.08,0.333,22270,"1990","",0.07683,2.66329,"","21/06/2022","0.5",NA,"Low","Satisfactory","2017-09-01",0.0805,46.9,18.8,20.8,6.08,0.333,0,22270,0,10.0110406627009,0,"Unknow"
"SOAD13514","Flumevale","Yes","Recreation","Earth",18.489,0.093,17585,"1974","",0.05122,37.28606,"Uncontrolled","22/10/2020","6",9.7,"Low","Fair","2019-09-03",0.0584,44.6,125.5,4.5,18.489,0.093,0,17585,0,9.77485840993895,0,"Unknow"
"SOAD19199","Flumevale","Yes","Water Supply","Earth",11.405,0.083,8000,"1955","",0.0906199999999999,5.32658,"","17/02/2022","1",NA,"High","Satisfactory","2017-09-01",0.077,42.8,777.6,45.4,11.405,0.083,0,8000,0,8.98732181285012,0,"Unknow"
"SOAD19878","Flumevale","Yes","Recreation","Earth",11.025,0.104,0,"1966","",0.06107,15.97974,"Uncontrolled","01/10/2019","6",24.36,"Low","Satisfactory","2016-03-30",0.0471,31.8,458.7,5,11.025,0.104,0,NA,1,NA,0,"Unknow"
"SOAD04862","Flumevale","Yes","Other","Earth",12.231,0.175,13000,"1951","",0.04925,0,"","09/03/2022","0.5",NA,"Low","Satisfactory","2017-09-01",0.0653,5.6,17.7,NA,12.231,0.175,0,13000,0,9.47278155656217,0,"Unknow"
"SOAD04887","Flumevale","Yes","Other","Earth",4.266,0.117,3350,"1872","",0.26989,NA,"","14/09/2021","0.5",NA,"Low","Satisfactory","2017-09-01",0.0602,429.6,8,NA,4.266,0.117,0,3350,0,8.11701408773731,0,"Unknow"
"SOAD05129","Flumevale","Yes","Irrigation","Earth",7.192,0.25,31608,"1951","",0.08077,170.45056,"Uncontrolled","21/11/2022","6",19.2,"Low","Not Rated",NA,0.0536,27,378.3,8.3,7.192,0.25,0,31608,0,10.3611971691509,0,"Unknow"
"SOAD05361","Flumevale","Yes","Irrigation","Earth",10.673,0.333,NA,"1980","",0.07486,13.31645,"","01/06/1989","0",42.14,"Low","Not Rated",NA,0.0853,22.9,90.2,19.8,10.673,0.333,0,NA,1,NA,0,"Unknow"
"SOAD05530","Flumevale","Yes","Water Supply","Earth",15.545,0.142,50000,"1987","",0.05713,2.66329,"","27/04/2022","1",NA,"High","Satisfactory","2017-09-01",0.1109,23.8,550.2,47.8,15.545,0.142,0,50000,0,10.8197982842103,0,"Unknow"
"SOAD11904","Flumevale","Yes","Recreation","Earth",2.769,0.256,24063,"1974","",0.08077,0,"Uncontrolled","22/06/2022","2",0,"Significant","Satisfactory","2022-06-22",0.1139,44.1,661.7,6.8,2.769,0.256,0,24063,0,10.0884722267496,0,"Unknow"
"SOAD12691","Flumevale","Yes","Irrigation","Earth",12.25,0.172,20800,"1971","",0.04334,0,"Uncontrolled","23/07/2019","6",45.02,"Low","Not Rated",NA,0.0792,29.9,121.5,34.2,12.25,0.172,0,20800,0,9.94275634145683,0,"Unknow"
"SOAD12953","Flumevale","Yes","Irrigation","Earth",5.762,0.333,25811,"1896","",0.06895,0,"","27/06/2018","6",26.9,"Low","Unsatisfactory","2019-07-05",0.1062,13,402.4,2,5.762,0.333,0,25811,0,10.1585947790557,0,"Unknow"
"SOAD14411","Flumevale","Yes","Water Supply","Earth",26.199,0.167,330000,"1941","",0.08077,23.96961,"","16/02/2022","1",1.56,"High","Satisfactory","2017-09-01",0.0839,31.9,162.3,63.5,26.199,0.167,0,330000,0,12.7068509637411,0,"Unknow"
"SOAD16152","Flumevale","Yes","Recreation","Earth",12.683,0.103,16374,"1964","",0.04728,114.52147,"Uncontrolled","15/06/2021","6",4.94,"Low","Not Rated",NA,0.0829,9,312.5,4.4,12.683,0.103,0,16374,0,9.70351106050345,0,"Unknow"
"SOAD16255","Flumevale","Yes","Other","Earth",11.323,0.733,NA,"1982","",0.03152,0,"","","0",15.49,"Low","Unsatisfactory","2012-10-11",0.108,31.5,143.7,NA,11.323,0.733,0,NA,1,NA,0,"Unknow"
"SOAD06752","Flumevale","Yes","Irrigation","Earth",4.089,0.1,5689,"1965","",0.14775,239.6961,"Uncontrolled","09/11/1999","6",14.22,"Low","Fair","2011-11-01",0.0682,14.8,331.4,4.3,4.089,0.1,0,5689,0,8.64646552712038,0,"Unknow"
"SOAD06819","Flumevale","Yes","Unknow","Earth",7.345,0,0,"Unknow","",NA,NA,"","12/05/2022","1",NA,"High","Unsatisfactory","2021-02-23",0.1301,486.4,658.4,NA,7.345,NA,1,NA,1,NA,0,"Unknow"
"SOAD11832","Flumevale","Yes","Recreation","Earth",9.714,0.154,NA,"1950","",0.05122,7.98987,"","15/04/2019","6",0,"Low","Fair","2007-06-22",0.0675,25.5,583,7.1,9.714,0.154,0,NA,1,NA,0,"Unknow"
"SOAD13216","Flumevale","Yes","Irrigation","Earth",10.17,0.118,30186,"1918","",0.04137,0,"Uncontrolled","16/07/2015","6",75.49,"Low","Not Rated",NA,0.0885,40.2,65.2,28.5,10.17,0.118,0,30186,0,10.3151666471108,0,"Unknow"
"SOAD16606","Flumevale","Yes","Irrigation","Earth",9.149,0.25,46286,"1966","2006",0.06698,0,"Uncontrolled","01/06/2022","2",0,"Significant","Satisfactory","2022-06-01",0.1237,45.6,668.5,3.7,9.149,0.25,0,46286,0,10.7426164231111,1,"2006"
"SOAD19953","Flumevale","Yes","Irrigation","Earth",9.81,0.313,NA,"1893","",0.06698,0,"","11/10/2011","6",16.85,"Low","Not Rated",NA,0.0457,46,229.1,39.3,9.81,0.313,0,NA,1,NA,0,"Unknow"
"SOAD00867","Flumevale","Yes","Fish and Wildlife Pond","Earth",4.006,0.207,NA,"1960","",0.07683,NA,"Controlled","","6",3.17,"Low","Not Rated",NA,0.1025,33.4,579.2,NA,4.006,0.207,0,NA,1,NA,0,"Unknow"
"SOAD02562","Flumevale","Yes","Irrigation","Earth",6.379,0.183,19067,"1908","",0.03349,0,"","18/07/2014","6",38.62,"Low","Not Rated",NA,0.0886,34.2,171.9,41.4,6.379,0.183,0,19067,0,9.85576681632472,0,"Unknow"
"SOAD03748","Flumevale","No","Fish and Wildlife Pond","Earth",4.644,0.063,721,"1904","",0.01773,21.30632,"Uncontrolled","20/07/2012","10",1.59,"Low","Not Rated",NA,0.0259,25.6,221.8,NA,4.644,0.063,0,721,0,6.58202513889283,0,"Unknow"
"SOAD03751","Flumevale","Yes","Water Supply","Earth",7.943,0.043,0,"1980","",0.03349,42.61264,"Uncontrolled","23/07/1996","0",42.24,"Low","Satisfactory","2017-06-26",0.0644,11.2,95.8,34.6,7.943,0.043,0,NA,1,NA,0,"Unknow"
"SOAD04940","Flumevale","Yes","Recreation","Earth",18.039,0.111,24382,"1969","",0.04728,0,"Uncontrolled","16/12/2020","6",8.24,"Low","Not Rated",NA,0.0546,7.9,259,6,18.039,0.111,0,24382,0,10.1016414471467,0,"Unknow"
"SOAD06802","Flumevale","Yes","Recreation","Earth",3.997,0.092,NA,"1933","",0.10047,37.28606,"","25/09/1986","6",70.15,"Low","Not Rated",NA,0.0417,39.9,139.2,3.3,3.997,0.092,0,NA,1,NA,0,"Unknow"
"SOAD16315","Flumevale","Yes","Flood Risk Reduction","Earth",7.512,1,90000,"1971","",0.22261,5.32658,"","17/02/2022","1",0.16,"High","Satisfactory","2017-09-01",0.0798,42.3,881.2,NA,7.512,1,0,90000,0,11.4075760603618,0,"Unknow"
"SOAD19281","Flumevale","Yes","Flood Risk Reduction","Earth",12.969,0.123,41258,"1957","",0.04137,0,"Uncontrolled","01/11/2021","3",0,"Significant","Satisfactory","2021-11-01",0.1224,42,432.5,NA,12.969,0.123,0,41258,0,10.6276245497828,0,"Unknow"
"SOAD19711","Flumevale","Yes","Irrigation","Earth",4.393,0.283,NA,"1956","",0.1182,42.61264,"","","0",57.65,"Low","Not Rated",NA,0.0906,30.3,78.6,40.7,4.393,0.283,0,NA,1,NA,0,"Unknow"
"SOAD20049","Flumevale","Yes","Flood Risk Reduction","Earth",10.524,0.167,0,"1972","",0.0591,13.31645,"Uncontrolled","01/06/2016","3",75.69,"Low","Not Rated",NA,0.1061,34.8,91.7,NA,10.524,0.167,0,NA,1,NA,0,"Unknow"
"SOAD00458","Flumevale","Yes","Flood Risk Reduction","Earth",9.37,0.214,15541,"1956","",0.05713,7.98987,"Uncontrolled","05/10/2020","6",14.43,"Low","Satisfactory","2018-10-25",0.0286,39.7,375.8,NA,9.37,0.214,0,15541,0,9.65130131576919,0,"Unknow"
"SOAD02534","Flumevale","Yes","Debris Control","Earth",16.972,0.222,155000,"1961","",0.04334,18.64303,"","20/10/2021","1",0,"High","Satisfactory","2017-09-01",0.089,41.2,508.1,NA,16.972,0.222,0,155000,0,11.9511868474935,0,"Unknow"
"SOAD05718","Flumevale","Yes","Fish and Wildlife Pond","Earth",6.729,0.107,NA,"1984","",0.06895,42.61264,"Uncontrolled","20/12/2017","6",31.21,"Low","Not Rated",NA,0.0713,25.7,93.4,NA,6.729,0.107,0,NA,1,NA,0,"Unknow"
"SOAD07209","Flumevale","Yes","Irrigation","Earth",5.995,0.345,NA,"1944","",0.0886499999999999,0,"","09/06/2021","6",159.68,"Low","Not Rated",NA,0.0748,17.9,62.3,2.7,5.995,0.345,0,NA,1,NA,0,"Unknow"
"SOAD07417","Flumevale","Yes","Other","Earth",14.924,0.097,21653,"1909","",0.06107,10.65316,"","20/12/2021","1",0,"High","Satisfactory","2017-09-01",0.0761,12,597.9,NA,14.924,0.097,0,21653,0,9.98294547387084,0,"Unknow"
"SOAD08747","Flumevale","Yes","Water Supply","Earth",5.03,0.5,0,"1987","",0.04925,0,"","09/09/1994","6",12.7,"Low","Satisfactory","2018-09-05",0.0561,18,244.1,39.3,5.03,0.5,0,NA,1,NA,0,"Unknow"
"SOAD17582","Flumevale","Yes","Flood Risk Reduction","Earth",8.103,0.235,NA,"1971","",0.07486,0,"","15/12/1993","0",148.2,"Low","Not Rated",NA,0.0746,13.3,54.4,NA,8.103,0.235,0,NA,1,NA,0,"Unknow"
"SOAD17833","Flumevale","No","Recreation","Earth",9.757,0.057,4431,"1911","",0,7.98987,"Uncontrolled","","Unknow",0,"Significant","Not Rated",NA,0.1487,19.9,165.2,6.8,9.757,0.057,0,4431,0,8.39660622842712,0,"Unknow"
"SOAD18681","Flumevale","Yes","Water Supply","Earth",18.795,0.163,150000,"1975","",0.05713,2.66329,"","11/02/2022","0.5",NA,"Low","Satisfactory","2017-09-01",0.0742,10.2,19,66.2,18.795,0.163,0,150000,0,11.9183972397228,0,"Unknow"
"SOAD19851","Flumevale","Yes","Water Supply","Earth",5.437,0.289,12400,"1983","",0.12805,2.66329,"","20/10/2021","0.5",NA,"Low","Satisfactory","2017-09-01",0.069,45.3,15.9,8,5.437,0.289,0,12400,0,9.42553239350277,0,"Unknow"
"SOAD05659","Flumevale","Yes","Flood Risk Reduction","Earth",9.139,0.273,21700,"1956","",0.06698,7.98987,"Uncontrolled","01/11/2011","6",4.94,"Low","Satisfactory","2003-10-10",0.0438,17.7,349.3,NA,9.139,0.273,0,21700,0,9.98511362141607,0,"Unknow"
"SOAD13232","Flumevale","Yes","Water Supply","Earth",15.403,0.163,80000,"2002","",0.0591,2.66329,"","28/09/2021","1",6.19,"High","Satisfactory","2017-09-01",0.0988,12,190.7,34.7,15.403,0.163,0,80000,0,11.2897944135779,0,"Unknow"
"SOAD13457","Flumevale","Yes","Irrigation","Earth",5.753,0.133,10324,"1916","",0.0985,0,"","29/09/2020","6",26.66,"Low","Fair","2019-10-01",0.0428,31.6,182.7,37.3,5.753,0.133,0,10324,0,9.24232341782923,0,"Unknow"
"SOAD16273","Flumevale","Yes","Irrigation","Earth",6.163,0.107,6933,"1947","",0.09456,101.20502,"","","6",20.6,"Low","Unsatisfactory","2017-11-01",0.0851,11.4,286.9,11.1,6.163,0.107,0,6933,0,8.84419212624497,0,"Unknow"
"SOAD16642","Flumevale","Yes","Flood Risk Reduction","Earth",8.783,0.201,19326,"1959","",0.06698,0,"Uncontrolled","01/02/2012","3",4.88,"Low","Fair","2018-10-18",0.0815,15.5,484.1,NA,8.783,0.201,0,19326,0,9.86925836098547,0,"Unknow"
"SOAD18765","Flumevale","Yes","Recreation","Earth",3.536,0.062,2253,"1919","",0.0906199999999999,0,"","25/09/2013","6",42.77,"Low","Not Rated",NA,0.0868,7.2,110.5,3,3.536,0.062,0,2253,0,7.72046169459972,0,"Unknow"
"SOAD01260","Flumevale","Yes","Other","Earth",17.269,0.733,NA,"1982","",0.03546,0,"","25/06/2002","6",15.98,"Low","Not Rated",NA,0.0495,26.7,386.3,NA,17.269,0.733,0,NA,1,NA,0,"Unknow"
"SOAD05685","Flumevale","Yes","Recreation","Earth",10.728,0.148,40691,"1940","",0.04728,0,"","29/09/2022","6",49.73,"Low","Not Rated",NA,0.0549,38.4,184.1,4.8,10.728,0.148,0,40691,0,10.6137867919136,0,"Unknow"
"SOAD11282","Flumevale","Yes","Irrigation","Earth",8.051,0.143,0,"1913","",0.06895,0,"Uncontrolled","29/07/1991","0",38.54,"Low","Not Rated",NA,0.0878,26.1,219.8,5,8.051,0.143,0,NA,1,NA,0,"Unknow"
"SOAD15677","Flumevale","Yes","Water Supply","Earth",13.114,0.25,10250,"1938","",0.03546,0,"Uncontrolled","19/05/2022","1",3.28,"High","Satisfactory","2022-05-19",0.0741,35.1,920.5,14.8,13.114,0.25,0,10250,0,9.2351305407834,0,"Unknow"
"SOAD16366","Flumevale","Yes","Unknow","Earth",9.525,0.4,NA,"1986","2009",0.0394,0,"Uncontrolled","31/03/2022","2",1.66,"Significant","Satisfactory","2022-03-31",0.1161,9.3,456.6,NA,9.525,0.4,0,NA,1,NA,1,"2009"
"SOAD16797","Flumevale","Yes","Water Supply","Earth",6.791,0.25,14800,"1955","",0.0985,5.32658,"","22/07/2022","1",5.62,"High","Satisfactory","2017-09-01",0.0971,10,207.4,22.2,6.791,0.25,0,14800,0,9.60245002503719,0,"Unknow"
"SOAD19201","Flumevale","Yes","Flood Risk Reduction","Earth",4.301,1.502,81700,"1981","",0.16942,7.98987,"","10/03/2022","1",0.16,"High","Satisfactory","2017-09-01",0.0851,42,186.8,NA,4.301,1.502,0,81700,0,11.3108215206753,0,"Unknow"
"SOAD00338","Flumevale","Yes","Recreation","Earth",5.034,0.158,15800,"1967","",0.02955,0,"Uncontrolled","01/05/2019","5",6.34,"Low","Not Available",NA,0.0766,36.6,464.4,4.8,5.034,0.158,0,15800,0,9.6678285081515,0,"Unknow"
"SOAD04062","Flumevale","Yes","Irrigation","Earth",8.821,0.06,2738,"1895","",0.04925,7.98987,"Uncontrolled","26/07/2022","6",12.34,"Low","Satisfactory","2019-08-08",0.0436,40.7,381,33.2,8.821,0.06,0,2738,0,7.91534816926308,0,"Unknow"
"SOAD08113","Flumevale","Yes","Water Supply","Earth",12.387,0.681,246200,"1996","",0.04137,0,"","30/11/2021","1",0.16,"High","Satisfactory","2017-09-01",0.0963,32.2,399,48.5,12.387,0.681,0,246200,0,12.4139035544627,0,"Unknow"
"SOAD10429","Flumevale","Yes","Irrigation","Earth",6.545,0.267,0,"1919","",0.06501,0,"","28/10/1987","0",16.7,"Low","Not Rated",NA,0.097,40.3,333.8,4.4,6.545,0.267,0,NA,1,NA,0,"Unknow"
"SOAD11811","Flumevale","Yes","Water Supply","Earth",10.307,0.203,21000,"1925","",0.11229,7.98987,"","11/01/2022","0.5",NA,"Significant","Satisfactory","2017-09-01",0.1333,23.3,253.7,66.5,10.307,0.203,0,21000,0,9.95232533461943,0,"Unknow"
"SOAD14294","Flumevale","Yes","Irrigation","Earth",6.229,0.62,66136,"1907","",0.12017,0,"","24/09/2013","6",3.09,"Low","Fair","2015-08-06",0.0669,21.5,201.3,40,6.229,0.62,0,66136,0,11.0994836271762,0,"Unknow"
"SOAD14525","Flumevale","Yes","Irrigation","Earth",7.734,0.217,NA,"2002","2007",0.03546,13.31645,"","","0",1.61,"Low","Not Rated",NA,0.1085,45.6,316.6,25.1,7.734,0.217,0,NA,1,NA,1,"2007"
"SOAD20421","Flumevale","Yes","Flood Risk Reduction","Earth",7.892,0.391,5755,"1966","",0.16154,7.98987,"Uncontrolled","23/10/2001","3",0,"Low","Fair","2021-10-25",0.0846,16.3,571.4,NA,7.892,0.391,0,5755,0,8.65799806800726,0,"Unknow"
"SOAD02963","Flumevale","Yes","Irrigation","Earth",2.69,0.86,23785,"1907","",0.14775,0,"","","6",3.06,"Low","Not Rated",NA,0.0423,26.6,876,47.1,2.69,0.86,0,23785,0,10.0768524512872,0,"Unknow"
"SOAD04610","Flumevale","Yes","Recreation","Earth",5.991,NA,0,"1983","",0.06895,NA,"Uncontrolled","","0",1.63,"Low","Fair","2018-08-08",0.0691,20.2,808.7,6.6,5.991,NA,1,NA,1,NA,0,"Unknow"
"SOAD05192","Flumevale","Yes","Irrigation","Earth",5.468,0.193,NA,"1940","",0.08668,0,"","19/08/1991","6",8.11,"Low","Not Rated",NA,0.1037,13.1,156,23.7,5.468,0.193,0,NA,1,NA,0,"Unknow"
"SOAD05899","Flumevale","Yes","Water Supply","Earth",8.408,0.183,17280,"1947","",0.14381,NA,"","25/08/2022","0.5",NA,"Low","Satisfactory","2017-09-01",0.0803,6.4,15.6,12,8.408,0.183,0,17280,0,9.75736291105399,0,"Unknow"
"SOAD06440","Flumevale","Yes","Fish and Wildlife Pond","Earth",5.344,0.08,8534,"1913","",NA,NA,"Uncontrolled","01/09/2015","0",10.75,"High","Not Available",NA,0.101,593,395.4,NA,5.344,0.08,0,8534,0,9.05193063522854,0,"Unknow"
"SOAD07723","Flumevale","Yes","Recreation","Earth",12.045,0.667,NA,"1980","2007",0.05713,0,"Uncontrolled","10/06/2020","6",15.69,"Low","Satisfactory","2018-11-06",0.0531,17.1,448.9,4.2,12.045,0.667,0,NA,1,NA,1,"2007"
"SOAD08648","Flumevale","No","Fire Protection, Stock, Or Small Fish Pond","Earth",2.383,0.16,NA,"1890","",NA,NA,"Uncontrolled","31/08/2010","10",NA,"Low","Not Rated",NA,0.0554,12.7,15.4,NA,2.383,0.16,0,NA,1,NA,0,"Unknow"
"SOAD14912","Flumevale","Yes","Other","Earth",13.859,0.25,52600,"2004","",0.04728,0,"","01/11/2021","1",1.22,"High","Satisfactory","2017-09-01",0.1066,24.8,852.9,NA,13.859,0.25,0,52600,0,10.8704904099519,0,"Unknow"
"SOAD00102","Flumevale","Yes","Irrigation","Earth",5.504,0.233,0,"1984","",0.06895,0,"","22/03/2017","6",32.02,"Low","Not Rated",NA,0.045,6,63.2,25,5.504,0.233,0,NA,1,NA,0,"Unknow"
"SOAD03231","Flumevale","Yes","Irrigation","Earth",5.434,0.683,NA,"1896","",0.0906199999999999,0,"Uncontrolled","11/12/2012","6",70.97,"Low","Not Rated",NA,0.0597,8.6,100.7,20.9,5.434,0.683,0,NA,1,NA,0,"Unknow"
"SOAD04143","Flumevale","Yes","Irrigation","Earth",6.371,0.347,NA,"1909","",0.07092,0,"","16/09/1992","0",7.74,"Low","Unsatisfactory","2016-09-16",0.1119,47.3,209.5,17.4,6.371,0.347,0,NA,1,NA,0,"Unknow"
"SOAD04715","Flumevale","Yes","Water Supply","Earth",12.63,0.302,34200,"1951","",0.04925,2.66329,"","08/04/2022","1",0,"Significant","Satisfactory","2017-09-01",0.1094,18.9,268.2,65.3,12.63,0.302,0,34200,0,10.4400101623893,0,"Unknow"
"SOAD04990","Flumevale","Yes","Fish and Wildlife Pond","Earth",5.448,0.136,24237,"1908","2002",0.10835,7.98987,"Uncontrolled","04/11/2015","6",10.96,"Low","Satisfactory","2020-10-15",0.0288,23.7,316.1,NA,5.448,0.136,0,24237,0,10.0956769285284,1,"2002"
"SOAD08697","Flumevale","Yes","Irrigation","Earth",8.484,0.287,40134,"1950","",0.06501,0,"Uncontrolled","12/07/2022","6",101.5,"Low","Not Rated",NA,0.0886,18.3,143.7,38.9,8.484,0.287,0,40134,0,10.6000040505657,0,"Unknow"
"SOAD11138","Flumevale","Yes","Recreation","Earth",12.69,0.186,72218,"1962","",0.06698,0,"Uncontrolled","24/05/2017","6",30.41,"Low","Satisfactory","2019-02-14",0.029,21.3,136.3,8.4,12.69,0.186,0,72218,0,11.1874584481557,0,"Unknow"
"SOAD03397","Flumevale","Yes","Water Supply","Earth",10.048,0.242,15000,"1959","",0.08471,5.32658,"","14/09/2022","1",1.53,"High","Satisfactory","2017-09-01",0.0885,13,687.6,54,10.048,0.242,0,15000,0,9.61587214452889,0,"Unknow"
"SOAD04142","Flumevale","Yes","Recreation","Earth",9.07,0.1,NA,"1956","",0.04925,29.29619,"Uncontrolled","05/09/2018","6",36.73,"Low","Satisfactory","2016-09-30",0.0569,6.5,78.2,5.8,9.07,0.1,0,NA,1,NA,0,"Unknow"
"SOAD06706","Flumevale","Yes","Irrigation","Earth",3.149,0.15,9001,"1886","",0.12214,0,"","","6",13.9,"Low","Not Rated",NA,0.0755,39.6,250.2,13.6,3.149,0.15,0,9001,0,9.10520205385288,0,"Unknow"
"SOAD12739","Flumevale","Yes","Water Supply","Earth",14.976,0.14,150000,"1978","",0.06501,2.66329,"","11/05/2022","1",1.09,"High","Satisfactory","2017-09-01",0.0722,27,944.6,20.1,14.976,0.14,0,150000,0,11.9183972397228,0,"Unknow"
"SOAD13695","Flumevale","Yes","Water Supply","Earth",6.795,0.057,1550,"1966","",0.10244,34.62277,"","15/04/2022","0.5",NA,"Low","Satisfactory","2018-07-20",0.0695,5.2,6.3,14.8,6.795,0.057,0,1550,0,7.34665516317654,0,"Unknow"
"SOAD15255","Flumevale","Yes","Other","Earth",19.286,0.104,23000,"1950","",0.04334,7.98987,"","12/11/2021","0.5",NA,"Low","Satisfactory","2017-09-01",0.0739,21.2,14.6,NA,19.286,0.104,0,23000,0,10.043292972227,0,"Unknow"
"SOAD02947","Flumevale","Yes","Water Supply","Earth",10.817,0.13,20600,"1954","",0.0985,13.31645,"","19/04/2022","1",0,"High","Satisfactory","2017-09-01",0.0816,41.1,866.7,13.9,10.817,0.13,0,20600,0,9.93309489728879,0,"Unknow"
"SOAD14963","Flumevale","Yes","Irrigation","Earth",7.548,0.217,34368,"1964","",0.10441,114.52147,"Uncontrolled","08/09/2016","6",53.42,"Low","Fair","2018-07-05",0.0695,19.1,111.9,9.3,7.548,0.217,0,34368,0,10.4449102742795,0,"Unknow"
"SOAD15740","Flumevale","Yes","Flood Risk Reduction","Earth",7.703,0.283,NA,"1973","",0.07092,0,"","09/10/2014","3",26.53,"Low","Fair","2015-09-29",0.0777,29.9,192.9,NA,7.703,0.283,0,NA,1,NA,0,"Unknow"
"SOAD20612","Flumevale","Yes","Flood Risk Reduction","Earth",5.751,0.206,7351,"1955","",0.09653,61.25567,"","","3",25.1,"Low","Satisfactory","2013-09-25",0.0532,20.1,151.1,NA,5.751,0.206,0,7351,0,8.90272766403552,0,"Unknow"
"SOAD06209","Flumevale","Yes","Other","Earth",7.21,0.328,30000,"1948","",0.1379,21.30632,"","14/06/2022","0.5",NA,"Low","Satisfactory","2017-09-01",0.0622,25,14.5,NA,7.21,0.328,0,30000,0,10.3089859934221,0,"Unknow"
"SOAD09718","Flumevale","Yes","Other","Earth",36.359,0.149,107000,"1923","",0.03349,0,"","19/05/2022","1",5.82,"Significant","Satisfactory","2017-09-01",0.1305,15.6,454.6,NA,36.359,0.149,0,107000,0,11.5805934591948,0,"Unknow"
"SOAD13885","Flumevale","Yes","Water Supply","Earth",5.766,0.303,13600,"1955","",0.24428,10.65316,"","27/04/2022","0.5",NA,"Low","Satisfactory","2017-09-01",0.0705,195.2,5.4,47.9,5.766,0.303,0,13600,0,9.51789859843275,0,"Unknow"
"SOAD15784","Flumevale","Yes","Recreation","Earth",5.381,0.133,9778,"1877","",0.03546,7.98987,"","15/06/2007","6",12.71,"Low","Satisfactory","2020-10-15",0.0408,35.9,106.4,3.8,5.381,0.133,0,9778,0,9.18799250831228,0,"Unknow"
"SOAD18809","Flumevale","No","Fire Protection, Stock, Or Small Fish Pond","Earth",3.411,0.177,NA,"1970","",NA,NA,"Uncontrolled","07/09/2010","10",NA,"Low","Not Rated",NA,0.0291,8,15.1,NA,3.411,0.177,0,NA,1,NA,0,"Unknow"
"SOAD19629","Flumevale","Yes","Irrigation","Earth",6.79,0.283,34700,"1939","",0.06895,7.98987,"","21/11/2014","6",79.87,"Low","Satisfactory","2012-11-06",0.0571,34.5,148.3,45.4,6.79,0.283,0,34700,0,10.4545237839635,0,"Unknow"
"SOAD03360","Flumevale","Yes","Water Supply","Earth",6.718,0.223,10000,"1938","",0.13987,5.32658,"","13/05/2022","0.5",NA,"Low","Satisfactory","2017-09-01",0.0579,43.2,21.4,10.8,6.718,0.223,0,10000,0,9.21044036697652,0,"Unknow"
"SOAD14069","Flumevale","Yes","Water Supply","Earth",17.047,0.103,30000,"1954","",0.0591,2.66329,"","02/11/2021","1",0.61,"High","Satisfactory","2017-09-01",0.0757,39.4,662.8,34,17.047,0.103,0,30000,0,10.3089859934221,0,"Unknow"
"SOAD16905","Flumevale","Yes","Water Supply","Earth",6.08,0.103,3700,"1870","",0.19306,2.66329,"","05/05/2022","1",NA,"Significant","Satisfactory","2017-09-01",0.1363,32.9,211.6,7.8,6.08,0.103,0,3700,0,8.21635833238616,0,"Unknow"
"SOAD17249","Flumevale","Yes","Flood Risk Reduction","Earth",10.844,0.19,NA,"1974","",0.09456,37.28606,"","05/03/1992","0",161.22,"Low","Not Rated",NA,0.0876,5.5,55.5,NA,10.844,0.19,0,NA,1,NA,0,"Unknow"
"SOAD19740","Flumevale","Yes","Water Supply","Earth",14.931,0.3,51000,"1965","",0.07486,2.66329,"","29/09/2021","1",1,"High","Satisfactory","2017-09-01",0.0884,14.1,782.1,14.1,14.931,0.3,0,51000,0,10.8396005193574,0,"Unknow"
"SOAD02836","Flumevale","Yes","Recreation","Earth",11.823,0.042,14232,"1939","",0.06304,135.82779,"","15/10/2019","6",37.88,"Low","Not Rated",NA,0.0804,24.5,233.1,7.9,11.823,0.042,0,14232,0,9.56331849107062,0,"Unknow"
"SOAD02886","Flumevale","Yes","Fish and Wildlife Pond","Earth",8.788,0.026,10400,"1981","",NA,NA,"Uncontrolled","16/09/2008","10",26.47,"Low","Not Rated",NA,0.0303,20.4,149.7,NA,8.788,0.026,0,10400,0,9.24965723435313,0,"Unknow"
"SOAD05507","Flumevale","Yes","Water Supply","Earth",10.007,0.532,0,"1924","",0.04137,0,"","17/02/2022","1",0.16,"High","Satisfactory","2017-09-01",0.0847,14.7,137.3,37,10.007,0.532,0,NA,1,NA,0,"Unknow"
"SOAD10493","Flumevale","Yes","Flood Risk Reduction","Earth",8.986,0.182,34421,"1904","2005H;2005S",0.05122,0,"Uncontrolled","15/04/2019","6",7.8,"Low","Satisfactory","2020-10-05",0.0453,24.5,321.7,NA,8.986,0.182,0,34421,0,10.4464511738299,2,"2005"
"SOAD00401","Flumevale","Yes","Water Supply","Earth",39.86,0.151,97000,"1953","",0.02561,0,"","13/09/2022","1",0.48,"High","Satisfactory","2017-09-01",0.0922,42.6,422.6,37.7,39.86,0.151,0,97000,0,11.4824765667107,0,"Unknow"
"SOAD03744","Flumevale","Yes","Debris Control","Earth",4.827,NA,NA,"Unknow","",NA,NA,"","27/01/2023","1",NA,"High","Not Rated",NA,0.1318,948.9,809.8,NA,4.827,NA,1,NA,1,NA,0,"Unknow"
"SOAD07129","Flumevale","Yes","Water Supply","Earth",10.2,0.697,109000,"1977","",0.04925,NA,"","08/02/2022","0.5",0,"Low","Satisfactory","2017-09-01",0.0729,28.4,689.7,52.3,10.2,0.697,0,109000,0,11.5991123354811,0,"Unknow"
"SOAD17525","Flumevale","Yes","Water Supply","Earth",8.016,0.161,0,"1962","",0.11229,2.66329,"","16/06/2022","0.5",NA,"Low","Satisfactory","2017-09-01",0.0654,5.3,10,57.7,8.016,0.161,0,NA,1,NA,0,"Unknow"
"SOAD01490","Flumevale","Yes","Recreation","Earth",13.739,0.047,11130,"1968","",0.05516,106.5316,"","01/01/1994","0",65.2,"Low","Not Rated",NA,0.1111,14,172.1,7.7,13.739,0.047,0,11130,0,9.31748928749323,0,"Unknow"
"SOAD04023","Flumevale","Yes","Water Supply","Earth",6.587,0.107,0,"Unknow","",0.09653,NA,"","10/09/2021","0.5",NA,"Low","Satisfactory","2017-09-01",0.0719,31.3,12,42.8,6.587,0.107,0,NA,1,NA,0,"Unknow"
"SOAD05643","Flumevale","Yes","Other","Earth",7.488,0.567,NA,"2008","",0.07486,0,"Uncontrolled","17/05/2017","6",NA,"Low","Fair","2019-06-18",0.05,46.3,18.8,NA,7.488,0.567,0,NA,1,NA,0,"Unknow"
"SOAD12681","Flumevale","Yes","Fish and Wildlife Pond","Earth",4.033,0.1,1621,"1967","",NA,0,"Uncontrolled","02/08/2017","10",38.34,"Low","Not Rated",NA,0.0474,5.1,145.7,NA,4.033,0.1,0,1621,0,7.39141523467536,0,"Unknow"
"SOAD13172","Flumevale","Yes","Water Supply","Earth",9.337,0.143,18800,"1956","",0.09653,2.66329,"","04/10/2021","1",1.58,"High","Satisfactory","2017-09-01",0.0897,16.6,704,23.5,9.337,0.143,0,18800,0,9.84166533889278,0,"Unknow"
"SOAD15475","Flumevale","Yes","Fish and Wildlife Pond","Earth",3.633,0.05,1605,"1900","",0.11229,0,"","","6",51.41,"Low","Not Rated",NA,0.0896,43.8,84.9,NA,3.633,0.05,0,1605,0,7.38150189450671,0,"Unknow"
"SOAD16218","Flumevale","Yes","Irrigation","Earth",7.221,0.175,NA,"1945","",0.0886499999999999,0,"Uncontrolled","30/10/2012","6",10.1,"Low","Fair","2003-10-21",0.0606,17.8,364.3,11.3,7.221,0.175,0,NA,1,NA,0,"Unknow"
"SOAD20163","Flumevale","Yes","Water Supply","Earth",19.485,0.283,196500,"1952","",0.05122,NA,"","24/02/2022","1",0,"High","Satisfactory","2017-09-01",0.0882,13,649.8,9.4,19.485,0.283,0,196500,0,12.188422799337,0,"Unknow"
"SOAD01415","Flumevale","Yes","Irrigation","Earth",2.891,0.4,10588,"1910","",0.12805,0,"","01/10/2013","6",17.3,"Low","Not Rated",NA,0.0561,18.6,237.5,9.3,2.891,0.4,0,10588,0,9.26757100543045,0,"Unknow"
"SOAD07567","Flumevale","Yes","Other","Earth",11.529,0.207,68575,"Unknow","",0.05122,0,"","13/10/2021","0.5",NA,"Low","Satisfactory","2017-09-01",0.0702,25.9,18.6,NA,11.529,0.207,0,68575,0,11.1356978982733,0,"Unknow"
"SOAD07731","Flumevale","Yes","Irrigation","Earth",12.332,0.087,NA,"1947","",0.06895,21.30632,"","23/09/2019","6",16.22,"Low","Not Rated",NA,0.0478,39.4,319.8,47.5,12.332,0.087,0,NA,1,NA,0,"Unknow"
"SOAD09580","Flumevale","Yes","Irrigation","Earth",5.088,0.207,19040,"1949","",0.0925899999999999,15.97974,"Uncontrolled","26/08/2016","6",52.73,"Low","Satisfactory","2020-07-20",0.0349,16,133,5.4,5.088,0.207,0,19040,0,9.85434982797458,0,"Unknow"
"SOAD12904","Flumevale","Yes","Water Supply","Earth",6.947,0.3,26000,"1964","",0.13593,0,"","15/02/2022","0.5",NA,"Low","Satisfactory","2017-09-01",0.0818,12.2,16.9,45.7,6.947,0.3,0,26000,0,10.1658902778025,0,"Unknow"
"SOAD14037","Flumevale","Yes","Irrigation","Earth",5.631,0.133,10957,"1920","",0.08077,0,"Uncontrolled","26/09/2017","6",44.97,"Low","Not Rated",NA,0.0799,6.9,52.9,37.9,5.631,0.133,0,10957,0,9.30182506209836,0,"Unknow"
"SOAD14669","Flumevale","Yes","Water Supply","Earth",4.755,0.117,0,"1980","",0.1182,NA,"","08/02/2023","0.5",NA,"Low","Fair","2017-09-01",0.0872,32.6,10.3,7.2,4.755,0.117,0,NA,1,NA,0,"Unknow"
"SOAD15910","Flumevale","Yes","Flood Risk Reduction","Earth",9.343,0.3,17336,"1956","",0.06501,0,"Uncontrolled","05/10/2020","6",12.32,"Low","Not Rated",NA,0.09,18.5,202.4,NA,9.343,0.3,0,17336,0,9.76059822498589,0,"Unknow"
"SOAD19498","Flumevale","Yes","Irrigation","Earth",3.257,0.3,730,"1965","",0.12608,0,"","","6",12.97,"Low","Not Rated",NA,0.0746,6.8,144.4,33.3,3.257,0.3,0,730,0,6.59441345974978,0,"Unknow"
"SOAD20128","Flumevale","Yes","Irrigation","Earth",18.361,0.297,82000,"1983","",0.04925,0,"","06/12/2022","2",1.54,"Significant","Fair","2022-12-06",0.1418,10.6,851.1,7.8,18.361,0.297,0,82000,0,11.314486721294,0,"Unknow"
"SOAD02616","Flumevale","Yes","Water Supply","Earth",11.548,0.533,0,"Unknow","",0.04728,NA,"","11/08/2022","1",0,"High","Fair","2017-09-01",0.0891,20.2,211.8,49.1,11.548,0.533,0,NA,1,NA,0,"Unknow"
"SOAD02824","Flumevale","Yes","Irrigation","Earth",4.157,0.781,79305,"1966","",0.09653,0,"Uncontrolled","11/05/1995","6",0,"Low","Not Rated",NA,0.0441,33.8,893.2,9.3,4.157,0.781,0,79305,0,11.2810690668036,0,"Unknow"
"SOAD09912","Flumevale","Yes","Flood Risk Reduction","Earth",29.891,0.387,NA,"2014","2014",0.08668,7.98987,"Uncontrolled","07/04/2022","3",1.64,"Significant","Satisfactory","2022-04-07",0.1162,22.5,150,NA,29.891,0.387,0,NA,1,NA,1,"2014"
"SOAD14163","Flumevale","Yes","Flood Risk Reduction","Earth",9.07,0.14,14630,"1957","",0.06895,0,"Uncontrolled","07/10/2020","3",19.24,"Low","Satisfactory","2017-01-13",0.0785,25,446,NA,9.07,0.14,0,14630,0,9.59089784437816,0,"Unknow"
"SOAD03451","Flumevale","Yes","Other","Earth",1.735,0.12,NA,"Unknow","",NA,NA,"","","Unknow",18.62,"Significant","Not Available",NA,0.1225,24,185.7,NA,1.735,0.12,0,NA,1,NA,0,"Unknow"
"SOAD09180","Flumevale","Yes","Unknow","Earth",3.808,0.065,2590,"1904","",0.0788,0,"","28/08/2020","6",14.11,"Low","Satisfactory","2018-06-27",0.038,28.4,205.3,NA,3.808,0.065,0,2590,0,7.85979918056211,0,"Unknow"
"SOAD12155","Flumevale","Yes","Water Supply","Earth",13.096,0.092,25400,"1959","",0.08077,10.65316,"","25/01/2022","1",0.5,"High","Satisfactory","2017-09-01",0.116,47,827.9,38.5,13.096,0.092,0,25400,0,10.1425438223104,0,"Unknow"
"SOAD12724","Flumevale","Yes","Flood Risk Reduction","Earth",16.856,0.367,100400,"1961","",0.05122,34.62277,"Uncontrolled","01/10/2018","2",10.97,"Significant","Not Available",NA,0.1583,21.2,334.7,NA,16.856,0.367,0,100400,0,11.5169274463495,0,"Unknow"
"SOAD18660","Flumevale","Yes","Fish and Wildlife Pond","Earth",6.814,0.225,8711,"1971","",0,0,"Uncontrolled","07/09/2008","10",12.87,"Low","Not Rated",NA,0.0453,44.8,401.1,NA,6.814,0.225,0,8711,0,9.0724566646128,0,"Unknow"
"SOAD20290","Flumevale","Yes","Water Supply","Earth",13.707,0.046,7000,"1974","",0.0591,0,"","04/02/2022","0.5",1.59,"Low","Satisfactory","2017-09-01",0.0847,13.6,222.6,27.5,13.707,0.046,0,7000,0,8.8538082749772,0,"Unknow"
"SOAD03024","Flumevale","Yes","Irrigation","Earth",7.385,0.232,13357,"1959","",0.07092,15.97974,"Uncontrolled","12/08/2021","6",0,"Low","Not Rated",NA,0.0414,9.9,505.2,2.1,7.385,0.232,0,13357,0,9.49987073528558,0,"Unknow"
"SOAD04642","Flumevale","Yes","Other","Earth",13.828,0.277,46500,"1947","",0.06107,21.30632,"","03/02/2022","1",6.65,"Significant","Satisfactory","2017-09-01",0.1234,43.4,464.2,NA,13.828,0.277,0,46500,0,10.7472290967206,0,"Unknow"
"SOAD06590","Flumevale","Yes","Flood Risk Reduction","Earth",12.751,0.274,32200,"1963","",0.05713,0,"Uncontrolled","15/09/2022","3",0,"High","Satisfactory","2022-09-15",0.0906,38.2,198.9,NA,12.751,0.274,0,32200,0,10.3797527869509,0,"Unknow"
"SOAD07005","Flumevale","Yes","Water Supply","Earth",7.774,0.322,43000,"1982","",0.2561,NA,"","02/08/2022","1",0,"Significant","Satisfactory","2017-09-01",0.1263,439.5,799.7,5.6,7.774,0.322,0,43000,0,10.6689786502192,0,"Unknow"
"SOAD07659","Flumevale","Yes","Other","Earth",13.911,0.168,41800,"2003","",0.04137,0,"","10/08/2022","0.5",NA,"Low","Satisfactory","2017-09-01",0.0659,11.4,13.1,NA,13.911,0.168,0,41800,0,10.6406755416717,0,"Unknow"
"SOAD08358","Flumevale","Yes","Irrigation","Earth",19.367,0.083,22361,"1947","",0.04137,29.29619,"Uncontrolled","26/08/1999","0",7.79,"Low","Not Rated",NA,0.0763,23.3,255.9,27.3,19.367,0.083,0,22361,0,10.0151183687073,0,"Unknow"
"SOAD09358","Flumevale","Yes","Irrigation","Earth",4.461,0.133,8132,"1892","",0.06698,0,"","12/07/2017","6",15.03,"Low","Not Rated",NA,0.0479,12.6,293.4,23.2,4.461,0.133,0,8132,0,9.00368513816677,0,"Unknow"
"SOAD09524","Flumevale","Yes","Irrigation","Earth",6.251,0.167,NA,"2006","",0.07289,0,"Uncontrolled","08/10/2019","6",30.72,"Low","Fair","2012-09-14",0.0428,29.4,117.9,9.1,6.251,0.167,0,NA,1,NA,0,"Unknow"
"SOAD14752","Flumevale","Yes","Irrigation","Earth",3.038,0.3,12001,"1882","",0.22852,0,"","22/07/2010","6",18.55,"Low","Not Rated",NA,0.0905,31.3,395.4,24.2,3.038,0.3,0,12001,0,9.39282858154946,0,"Unknow"
"SOAD16782","Flumevale","Yes","Water Supply","Earth",16.232,0.52,182300,"1996","",0.13002,0,"","30/11/2021","1",0,"Significant","Satisfactory","2017-09-01",0.1155,44.4,340.8,48.6,16.232,0.52,0,182300,0,12.1134144461152,0,"Unknow"
"SOAD20294","Flumevale","Yes","Irrigation","Earth",6.81,0.179,24610,"1905","",0.0591,0,"","29/09/2020","6",34.37,"Low","Satisfactory","2020-07-20",0.026,13.4,104.8,21,6.81,0.179,0,24610,0,10.1109487764482,0,"Unknow"
"SOAD01145","Flumevale","Yes","Water Supply","Earth",5.461,0.127,5972,"1952","",0.18321,7.98987,"","11/01/2022","0.5",NA,"Low","Satisfactory","2017-09-01",0.0688,31.1,21.6,64.3,5.461,0.127,0,5972,0,8.69500459273231,0,"Unknow"
"SOAD04299","Flumevale","Yes","Irrigation","Earth",8.604,0.087,5993,"1950","",0.09456,149.14424,"","19/09/1979","6",16.09,"Low","Satisfactory","2016-08-12",0.0413,44.2,213.6,21.2,8.604,0.087,0,5993,0,8.69851424787661,0,"Unknow"
"SOAD07376","Flumevale","Yes","Flood Risk Reduction","Earth",9.4,0.208,18230,"1960","",0.08077,13.31645,"Uncontrolled","11/04/2018","3",36.3,"Low","Satisfactory","2016-08-11",0.071,29.3,188.2,NA,9.4,0.208,0,18230,0,9.81087872080347,0,"Unknow"
"SOAD09866","Flumevale","Yes","Irrigation","Earth",7.01,0.373,NA,"2008","",0.08274,7.98987,"Uncontrolled","15/04/2019","6",NA,"Low","Not Rated",NA,0.0243,25.5,17.9,19.7,7.01,0.373,0,NA,1,NA,0,"Unknow"
"SOAD11491","Flumevale","Yes","Irrigation","Earth",5.602,0.133,9692,"1952","",0.03349,0,"","26/09/2013","6",11.81,"Low","Not Rated",NA,0.0494,45.3,177.8,29.4,5.602,0.133,0,9692,0,9.17915925449261,0,"Unknow"
"SOAD14046","Flumevale","No","Irrigation","Earth",21.647,0.667,20000,"1966","",0.00788,NA,"Uncontrolled","22/08/2022","3",7.92,"Low","Satisfactory","2023-09-29",0.0644,25.7,275,5,21.647,0.667,0,20000,0,9.90353755128617,0,"Unknow"
"SOAD00665","Flumevale","Yes","Irrigation","Earth",2.38,0.317,7116,"1908","",0.2167,0,"","17/06/1992","6",20.05,"Low","Not Rated",NA,0.0668,46.1,285,41.8,2.38,0.317,0,7116,0,8.87024156729927,0,"Unknow"
"SOAD05070","Flumevale","Yes","Water Supply","Earth",15.545,0.333,20000,"1951","",0.07289,0,"","06/04/2022","1",NA,"High","Satisfactory","2017-09-01",0.0796,18.3,847.5,62,15.545,0.333,0,20000,0,9.90353755128617,0,"Unknow"
"SOAD09357","Flumevale","Yes","Irrigation","Earth",3.49,0.033,0,"1924","",0.08274,0,"Uncontrolled","17/08/1986","6",31.62,"Low","Not Rated",NA,0.0958,42.8,125.6,25.6,3.49,0.033,0,NA,1,NA,0,"Unknow"
"SOAD10730","Flumevale","Yes","Irrigation","Earth",11.483,0.111,30587,"1946","",0.05122,37.28606,"","16/11/2020","6",31.97,"Low","Satisfactory","2021-06-09",0.0346,37.8,223.6,3.9,11.483,0.111,0,30587,0,10.3283630541641,0,"Unknow"
"SOAD11767","Flumevale","Yes","Water Supply","Earth",22.82,0.14,51000,"1951","",0.06107,2.66329,"","14/04/2022","1",16.83,"Significant","Satisfactory","2017-09-01",0.1253,26.3,411.1,13.2,22.82,0.14,0,51000,0,10.8396005193574,0,"Unknow"
"SOAD11909","Flumevale","Yes","Irrigation","Earth",6.861,0.233,NA,"2020","",0.06895,0,"Uncontrolled","11/08/2022","1",NA,"High","Satisfactory","2022-08-11",0.0972,14.8,908.9,30.4,6.861,0.233,0,NA,1,NA,0,"Unknow"
"SOAD12457","Flumevale","Yes","Flood Risk Reduction","Earth",14.308,0.275,37847,"1958","",0.06698,0,"Uncontrolled","05/10/2020","3",9.88,"Low","Not Rated",NA,0.0684,37.9,458.7,NA,14.308,0.275,0,37847,0,10.541333417311,0,"Unknow"
"SOAD17202","Flumevale","Yes","Water Supply","Earth",16.693,0.16,2e+05,"1978","",0.08077,5.32658,"","11/05/2022","1",1.32,"High","Satisfactory","2017-09-01",0.0838,10.6,338.3,21.7,16.693,0.16,0,2e+05,0,12.2060776455177,0,"Unknow"
"SOAD17555","Flumevale","Yes","Flood Risk Reduction","Earth",13.837,0.083,33500,"1949","",0.06107,13.31645,"","10/08/2022","1",0,"High","Satisfactory","2017-09-01",0.0906,27,125,NA,13.837,0.083,0,33500,0,10.4193305681139,0,"Unknow"
"SOAD04889","Flumevale","Yes","Irrigation","Earth",7.426,0.305,79323,"1906","",0.17336,7.98987,"","21/04/2022","6",17.91,"Low","Fair","2015-08-06",0.0437,17.7,224.1,4.6,7.426,0.305,0,79323,0,11.2812960100057,0,"Unknow"
"SOAD05764","Flumevale","Yes","Irrigation","Earth",4.763,0.533,0,"1914","",0.04925,0,"Uncontrolled","22/03/2017","6",17.6,"Low","Satisfactory","2018-08-23",0.0544,41.7,232.2,31.7,4.763,0.533,0,NA,1,NA,0,"Unknow"
"SOAD08154","Flumevale","No","Fish and Wildlife Pond","Earth",6.092,0.05,1671,"1929","",0,7.98987,"Uncontrolled","17/07/2017","10",6.13,"Low","Not Rated",NA,0.0654,25.1,390.7,NA,6.092,0.05,0,1671,0,7.42177579364465,0,"Unknow"
"SOAD10215","Flumevale","Yes","Water Supply","Earth",11.309,0.225,29225,"1953","",0.18715,5.32658,"","25/08/2022","0.5",NA,"Low","Satisfactory","2017-09-01",0.0734,17,5.2,36.7,11.309,0.225,0,29225,0,10.2828140030346,0,"Unknow"
"SOAD14557","Flumevale","Yes","Flood Risk Reduction","Earth",7.446,0.333,0,"1990","",0.09653,0,"Uncontrolled","09/06/2021","6",7.93,"Low","Not Rated",NA,0.0435,35.7,370.4,NA,7.446,0.333,0,NA,1,NA,0,"Unknow"
"SOAD17477","Flumevale","Yes","Irrigation","Earth",5.808,0.275,28601,"1904","",0.04137,0,"","27/07/2020","6",36.52,"Low","Fair","2021-09-13",0.0489,4.8,183.3,32.2,5.808,0.275,0,28601,0,10.2612319244329,0,"Unknow"
"SOAD19545","Flumevale","Yes","Flood Risk Reduction","Earth",8.597,0.197,NA,"1964","",0.06895,7.98987,"","13/05/1998","6",0,"Low","Satisfactory","2019-07-23",0.0531,32.3,601,NA,8.597,0.197,0,NA,1,NA,0,"Unknow"
"SOAD20251","Flumevale","Yes","Irrigation","Earth",5.711,0.22,20165,"1956","",0.06501,0,"","19/10/2017","6",13.39,"Low","Fair","2020-05-04",0.0599,23.2,194.3,31.5,5.711,0.22,0,20165,0,9.91175329695316,0,"Unknow"
"SOAD04655","Flumevale","Yes","Water Supply","Earth",13.178,0.2,56154,"1949","",0.04334,5.32658,"","10/08/2022","1",NA,"High","Satisfactory","2017-09-01",0.1001,16.9,788.6,63.8,13.178,0.2,0,56154,0,10.9358710033971,0,"Unknow"
"SOAD06838","Flumevale","Yes","Fire Protection, Stock, Or Small Fish Pond","Earth",6.406,0.292,0,"1950","",0.08077,7.98987,"Uncontrolled","18/10/2022","6",6.56,"Low","Unsatisfactory","2018-05-25",0.0706,46.8,175,NA,6.406,0.292,0,NA,1,NA,0,"Unknow"
"SOAD12276","Flumevale","Yes","Unknow","Earth",3.435,0.15,NA,"Unknow","",NA,NA,"Uncontrolled","21/10/2017","6",NA,"Low","Not Rated",NA,0.0785,5.4,16.6,NA,3.435,0.15,0,NA,1,NA,0,"Unknow"
"SOAD18864","Flumevale","Yes","Water Supply","Earth",3.907,0.067,NA,"1920","",0.11229,0,"","19/09/1986","6",43.96,"Low","Not Rated",NA,0.084,13.1,208.9,49.6,3.907,0.067,0,NA,1,NA,0,"Unknow"
"SOAD00919","Flumevale","Yes","Water Supply","Earth",21.151,0.152,61000,"1975","",0.05713,2.66329,"","24/05/2023","0.5",NA,"Low","Fair","2017-09-01",0.0853,14.8,11.3,25.9,21.151,0.152,0,61000,0,11.0186455364637,0,"Unknow"
"SOAD04049","Flumevale","Yes","Water Supply","Earth",13.813,0.057,8770,"1951","",0.0906199999999999,0,"","02/11/2021","1",NA,"Significant","Satisfactory","2017-09-01",0.1355,16.3,219.2,58.8,13.813,0.057,0,8770,0,9.07920610395138,0,"Unknow"
"SOAD06220","Flumevale","Yes","Irrigation","Earth",7.009,0.093,10946,"1946","",0.07683,0,"","15/05/2020","6",36.46,"Low","Fair","2016-03-30",0.0499,18.9,222.3,8.1,7.009,0.093,0,10946,0,9.30082072510456,0,"Unknow"
"SOAD08243","Flumevale","Yes","Fish and Wildlife Pond","Earth",7.114,0.133,1600,"1889","",0.05713,0,"Uncontrolled","29/08/2019","6",60.03,"Low","Not Rated",NA,0.063,47.1,101.9,NA,7.114,0.133,0,1600,0,7.37838371299671,0,"Unknow"
"SOAD10270","Flumevale","No","Flood Risk Reduction","Earth",7.054,0.178,25600,"1961","",0.09653,13.31645,"Uncontrolled","15/09/2022","5",0,"Significant","Not Available",NA,0.1138,25.9,334.8,NA,7.054,0.178,0,25600,0,10.1503866922047,0,"Unknow"
"SOAD11187","Flumevale","Yes","Water Supply","Earth",18.244,0.158,49600,"1952","",0.06895,0,"","03/05/2022","1",0,"High","Satisfactory","2017-09-01",0.0807,33.7,624.9,64.1,18.244,0.158,0,49600,0,10.8117662738001,0,"Unknow"
"SOAD11221","Flumevale","Yes","Irrigation","Earth",12.631,0.04,13595,"1904","",0.05122,114.52147,"Uncontrolled","10/06/2022","6",14.13,"Low","Fair","2004-04-21",0.0666,32,459.8,8.3,12.631,0.04,0,13595,0,9.51753091081601,0,"Unknow"
"SOAD19602","Flumevale","Yes","Flood Risk Reduction","Earth",10.494,0.301,18876,"1955","",0.0788,7.98987,"Uncontrolled","04/06/2015","3",6.24,"Low","Satisfactory","2011-08-09",0.0697,5.8,328.9,NA,10.494,0.301,0,18876,0,9.84569952876873,0,"Unknow"
"SOAD20068","Flumevale","Yes","Fire Protection, Stock, Or Small Fish Pond","Earth",5.042,0.37,55160,"1925","",0.11032,15.97974,"Uncontrolled","12/11/2008","6",48.99,"Low","Fair","2022-10-03",0.0484,16.7,66.1,NA,5.042,0.37,0,55160,0,10.918011460822,0,"Unknow"
"SOAD01865","Flumevale","Yes","Water Supply","Earth",10.575,0.263,26700,"1955","",0.08274,10.65316,"","21/06/2022","1",0.5,"High","Satisfactory","2017-09-01",0.0841,7.6,559,16.7,10.575,0.263,0,26700,0,10.1924562968705,0,"Unknow"
"SOAD02298","Flumevale","Yes","Debris Control","Earth",19.28,0.093,23000,"2004","",0.04137,37.28606,"","20/10/2021","1",0,"High","Satisfactory","2017-09-01",0.1107,34.4,588.1,NA,19.28,0.093,0,23000,0,10.043292972227,0,"Unknow"
"SOAD03708","Flumevale","Yes","Irrigation","Earth",6.718,0.477,55591,"1927","",0.08471,0,"","25/09/2013","6",12.95,"Low","Fair","2015-07-16",0.0432,20.4,244.1,28.6,6.718,0.477,0,55591,0,10.9257945849942,0,"Unknow"
"SOAD05384","Flumevale","Yes","Flood Risk Reduction","Earth",9.477,0.212,22611,"1955","",0.07092,7.98987,"Uncontrolled","24/10/2013","3",7.74,"Low","Not Rated",NA,0.0798,12.3,194.4,NA,9.477,0.212,0,22611,0,10.0262360177952,0,"Unknow"
"SOAD09032","Flumevale","Yes","Irrigation","Earth",4.523,0.167,0,"1951","",0.12608,0,"","29/08/1979","6",3.28,"Low","Satisfactory","2016-10-06",0.034,8.5,127.7,25.3,4.523,0.167,0,NA,1,NA,0,"Unknow"
"SOAD09048","Flumevale","Yes","Flood Risk Reduction","Earth",13.93,0.093,NA,"1964","",0.1182,13.31645,"Uncontrolled","28/08/1998","3",55.83,"Low","Satisfactory","2008-08-13",0.0773,35.4,145.3,NA,13.93,0.093,0,NA,1,NA,0,"Unknow"
"SOAD12179","Flumevale","Yes","Water Supply","Earth",14.561,0.362,93000,"1980","",0.04728,2.66329,"","28/01/2022","0.5",NA,"Low","Satisfactory","2017-09-01",0.0777,33.4,16.3,49.1,14.561,0.362,0,93000,0,11.4403655247658,0,"Unknow"
"SOAD20411","Flumevale","Yes","Irrigation","Earth",9.082,0.2,33319,"Unknow","1979",0.0591,0,"Uncontrolled","19/04/2019","6",13.02,"Low","Satisfactory","2021-09-10",0.0556,47.7,472.9,23.7,9.082,0.2,0,33319,0,10.4139130962808,1,"1979"
"SOAD03678","Flumevale","Yes","Fish and Wildlife Pond","Earth",3.723,0.55,NA,"Unknow","2002",0.14578,NA,"Uncontrolled","","6",39.5,"Low","Not Rated",NA,0.0534,20.8,110,NA,3.723,0.55,0,NA,1,NA,1,"2002"
"SOAD14622","Flumevale","No","Recreation","Earth",4.582,0.1,100,"1938","",NA,7.98987,"Uncontrolled","01/08/2011","Unknow",0.8,"Significant","Not Rated",NA,0.1363,414.1,607.8,9.3,4.582,0.1,0,100,0,4.61512051684126,0,"Unknow"
"SOAD15591","Flumevale","Yes","Irrigation","Earth",7.279,0.08,12196,"1889","",0.11426,0,"","03/10/2022","6",37.15,"Low","Satisfactory","2020-02-25",0.0419,7.9,187.6,23,7.279,0.08,0,12196,0,9.40894529884324,0,"Unknow"
"SOAD17702","Flumevale","Yes","Flood Risk Reduction","Earth",12.613,0.242,16000,"1970","",0.06304,0,"Uncontrolled","21/02/2017","6",54.74,"Low","Not Rated",NA,0.0362,40.5,120.7,NA,12.613,0.242,0,16000,0,9.68040649926887,0,"Unknow"
"SOAD18805","Flumevale","Yes","Water Supply","Earth",10.022,0.12,17000,"1964","",0.11426,2.66329,"","04/10/2021","1",18.54,"Significant","Satisfactory","2017-09-01",0.1453,10.3,224.2,39.3,10.022,0.12,0,17000,0,9.74102744483773,0,"Unknow"
"SOAD04549","Flumevale","Yes","Water Supply","Earth",16.681,0.157,65000,"1959","",0.07486,5.32658,"","14/09/2022","1",1.69,"High","Satisfactory","2017-09-01",0.1002,38.6,739.1,52.5,16.681,0.157,0,65000,0,11.0821579333748,0,"Unknow"
"SOAD07550","Flumevale","Yes","Other","Earth",21.885,0.717,138000,"2005","",0.0591,0,"","25/05/2022","0.5",NA,"Low","Satisfactory","2017-09-01",0.0734,28.3,6,NA,21.885,0.717,0,138000,0,11.8350162104899,0,"Unknow"
"SOAD13817","Flumevale","Yes","Fire Protection, Stock, Or Small Fish Pond","Earth",5.363,0.167,15276,"1941","",0.1379,0,"","13/10/2020","6",3.25,"Low","Satisfactory","2020-10-15",0.0394,21.7,600.4,NA,5.363,0.167,0,15276,0,9.63410370836572,0,"Unknow"
"SOAD13886","Flumevale","Yes","Flood Risk Reduction","Earth",8.836,0.185,18618,"1958","",0.07486,7.98987,"Uncontrolled","04/06/2015","3",4.86,"Low","Satisfactory","2009-12-16",0.0729,13,530.2,NA,8.836,0.185,0,18618,0,9.83193784369605,0,"Unknow"
"SOAD16923","Flumevale","Yes","Irrigation","Earth",12.717,0.11,0,"1961","",0.06107,15.97974,"Uncontrolled","19/06/2019","6",4.75,"Low","Satisfactory","2016-09-26",0.0425,6.8,619.2,35,12.717,0.11,0,NA,1,NA,0,"Unknow"
"SOAD17909","Flumevale","Yes","Other","Earth",25.591,0.095,38000,"1948","",0.04334,2.66329,"","09/03/2022","0.5",NA,"Low","Satisfactory","2017-09-01",0.0768,38.2,12.8,NA,25.591,0.095,0,38000,0,10.5453677541517,0,"Unknow"
"SOAD01324","Flumevale","Yes","Other","Earth",7.677,0.787,43036,"1851","",0.09653,0,"","20/12/2021","1",4.63,"High","Satisfactory","2017-09-01",0.0976,26.6,270.1,NA,7.677,0.787,0,43036,0,10.6698154898041,0,"Unknow"
"SOAD03584","Flumevale","Yes","Unknow","Earth",3.583,0.108,NA,"Unknow","",0.13002,0,"Uncontrolled","17/07/1997","6",24.12,"Low","Not Rated",NA,0.0833,44.3,459.6,NA,3.583,0.108,0,NA,1,NA,0,"Unknow"
"SOAD03960","Flumevale","Yes","Water Supply","Earth",30.47,0.125,84400,"1931","",0.03152,0,"","01/09/2022","1",0.19,"High","Poor","2023-06-22",0.1162,40,100.5,23.4,30.47,0.125,0,84400,0,11.3433345288551,0,"Unknow"
"SOAD04220","Flumevale","No","Recreation","Earth",5.087,0.2,NA,"1973","",0.07289,87.88857,"Uncontrolled","07/09/2021","3",0,"Low","Poor","2021-09-07",0.0984,6.4,609.6,8.6,5.087,0.2,0,NA,1,NA,0,"Unknow"
"SOAD11009","Flumevale","Yes","Fish and Wildlife Pond","Earth",4.468,0.253,18027,"1960","2002",0.13199,0,"Uncontrolled","21/11/2017","6",40.29,"Low","Not Rated",NA,0.0403,4.8,157.3,NA,4.468,0.253,0,18027,0,9.79968138381054,1,"2002"
"SOAD11726","Flumevale","Yes","Irrigation","Earth",7.323,0.715,8810,"1905","",0.0985,0,"Uncontrolled","23/09/2013","6",24.67,"Low","Not Rated",NA,0.0872,27.7,473.6,42.9,7.323,0.715,0,8810,0,9.08375621986673,0,"Unknow"
"SOAD14456","Flumevale","Yes","Water Supply","Earth",13.189,0.425,97450,"1962","",0.03349,0,"","17/11/2022","1",0.39,"High","Fair","2021-01-08",0.1104,13,687.3,25.7,13.189,0.425,0,97450,0,11.4871049665557,0,"Unknow"
"SOAD19840","Flumevale","Yes","Water Supply","Earth",15.186,0.12,40000,"1935","",0.08077,2.66329,"","28/01/2022","1",0,"High","Satisfactory","2019-08-20",0.1057,12.8,348.1,25.4,15.186,0.12,0,40000,0,10.5966597327836,0,"Unknow"
"SOAD00131","Flumevale","Yes","Irrigation","Earth",4.061,0.273,13606,"1890","",0.1576,0,"","27/01/1989","6",10.81,"Low","Satisfactory","2013-10-24",0.0332,13.8,215.3,47.2,4.061,0.273,0,13606,0,9.51833964519086,0,"Unknow"
"SOAD01931","Flumevale","Yes","Recreation","Earth",3.076,0.075,NA,"Unknow","",0.1576,111.85818,"Uncontrolled","30/07/2014","0",46.81,"Low","Not Rated",NA,0.0934,36.7,180,8.2,3.076,0.075,0,NA,1,NA,0,"Unknow"
"SOAD15512","Flumevale","Yes","Fire Protection, Stock, Or Small Fish Pond","Earth",4.916,0.067,NA,"1976","",0.13002,21.30632,"Uncontrolled","04/06/2010","6",25.78,"Low","Not Rated",NA,0.0641,34.4,416.5,NA,4.916,0.067,0,NA,1,NA,0,"Unknow"
"SOAD02053","Flumevale","Yes","Debris Control","Earth",18.106,0.302,488000,"1958","",0.06501,10.65316,"","03/11/2021","1",0.84,"High","Satisfactory","2017-09-01",0.1002,20.1,454.2,NA,18.106,0.302,0,488000,0,13.0980727340135,0,"Unknow"
"SOAD02640","Flumevale","Yes","Water Supply","Earth",8.159,0.657,NA,"1975","",0.04925,0,"","17/10/2022","2",4.79,"Significant","Fair","2022-10-17",0.1174,34.5,98.5,10.8,8.159,0.657,0,NA,1,NA,0,"Unknow"
"SOAD04836","Flumevale","Yes","Water Supply","Earth",7.471,0.413,20000,"1928","",0.16548,0,"","30/06/2022","1",12.6,"High","Satisfactory","2021-08-26",0.1048,27,289.4,34.7,7.471,0.413,0,20000,0,9.90353755128617,0,"Unknow"
"SOAD07610","Flumevale","Yes","Irrigation","Earth",3.789,0.118,0,"1895","",0.08668,0,"","24/09/1984","6",43.88,"Low","Not Rated",NA,0.032,31.2,163.8,17.6,3.789,0.118,0,NA,1,NA,0,"Unknow"
"SOAD08076","Flumevale","Yes","Irrigation","Earth",2.704,0.108,0,"1895","",0.17533,0,"Uncontrolled","22/05/2018","6",17.7,"Low","Not Rated",NA,0.1014,8.8,120.2,17.3,2.704,0.108,0,NA,1,NA,0,"Unknow"
"SOAD10564","Flumevale","Yes","Water Supply","Earth",11.111,0.123,28000,"1968","",0.09456,13.31645,"","10/05/2022","1",0,"Significant","Satisfactory","2017-09-01",0.1199,22.6,663.2,44.9,11.111,0.123,0,28000,0,10.2399955028053,0,"Unknow"
"SOAD00698","Flumevale","Yes","Water Supply","Earth",11.215,0.117,22000,"1952","",0.08274,10.65316,"","06/04/2022","1",1.08,"High","Satisfactory","2017-09-01",0.0928,14.4,911.6,9.6,11.215,0.117,0,22000,0,9.99884318585288,0,"Unknow"
"SOAD06889","Flumevale","Yes","Water Supply","Earth",10.112,0.183,31754,"1959","",0.08668,2.66329,"","21/04/2022","1",19.07,"High","Satisfactory","2017-09-01",0.09,27.4,171.3,26.9,10.112,0.183,0,31754,0,10.3658054722371,0,"Unknow"
"SOAD06984","Flumevale","Yes","Flood Risk Reduction","Earth",11.291,0.34,400,"1956","",0.0591,61.25567,"","25/09/1998","6",0,"Low","Satisfactory","2016-10-31",0.0601,10.8,168.3,NA,11.291,0.34,0,400,0,5.99396142730657,0,"Unknow"
"SOAD07590","Flumevale","Yes","Water Supply","Earth",10.933,0.098,14455,"1955","",0.06501,0,"","03/10/2014","6",10.09,"Low","Not Rated",NA,0.0607,8.5,383.9,24.4,10.933,0.098,0,14455,0,9.57886483227206,0,"Unknow"
"SOAD02803","Flumevale","Yes","Other","Earth",11.605,0.155,35000,"1940","",0.09456,2.66329,"","12/04/2022","0.5",NA,"Low","Satisfactory","2017-09-01",0.0674,5.9,18.8,NA,11.605,0.155,0,35000,0,10.463131911492,0,"Unknow"
"SOAD09719","Flumevale","Yes","Debris Control","Earth",20.406,0.269,367800,"1997","",0.06698,5.32658,"","23/02/2022","0.5",NA,"Low","Satisfactory","2017-09-01",0.0686,14.2,13.7,NA,20.406,0.269,0,367800,0,12.8152973100176,0,"Unknow"
"SOAD11161","Flumevale","Yes","Fire Protection, Stock, Or Small Fish Pond","Earth",10.803,0.2,NA,"1966","",0.06698,0,"Uncontrolled","05/10/2015","6",101.5,"Low","Fair","2009-10-15",0.0562,4.8,181.6,NA,10.803,0.2,0,NA,1,NA,0,"Unknow"
"SOAD11573","Flumevale","Yes","Irrigation","Earth",2.498,0.183,NA,"1915","",0.13593,0,"","17/07/1978","0",18.17,"Low","Not Rated",NA,0.0818,11.8,412.4,16.7,2.498,0.183,0,NA,1,NA,0,"Unknow"
"SOAD12562","Flumevale","Yes","Recreation","Earth",13.418,0.123,19425,"1937","1965H;1965M;1965S",0.05122,0,"Uncontrolled","03/08/2021","2",33.76,"Significant","Fair","2021-08-03",0.1197,47.1,212.8,5.3,13.418,0.123,0,19425,0,9.87436765396228,3,"1965"
"SOAD12616","Flumevale","Yes","Flood Risk Reduction","Earth",8.851,0.102,11449,"1959","",0.03349,15.97974,"","10/05/1988","3",1.67,"Low","Fair","2016-05-17",0.0926,7.1,284,NA,8.851,0.102,0,11449,0,9.34574500898239,0,"Unknow"
"SOAD15582","Flumevale","Yes","Irrigation","Earth",5.006,0.167,NA,"1910","",0.01773,0,"","25/08/1989","0",1.59,"Low","Not Rated",NA,0.0624,20.1,527.9,11,5.006,0.167,0,NA,1,NA,0,"Unknow"
"SOAD16389","Flumevale","Yes","Flood Risk Reduction","Earth",13.438,0.233,31343,"1979","",0.08274,7.98987,"Uncontrolled","19/08/2009","3",9.53,"Low","Unsatisfactory","2008-07-01",0.0977,5.1,213.3,NA,13.438,0.233,0,31343,0,10.3527781401843,0,"Unknow"
"SOAD01142","Flumevale","Yes","Recreation","Earth",9.434,0.187,17330,"1955","1993S",0.0591,0,"Uncontrolled","13/12/2022","6",3.07,"Low","Not Rated",NA,0.0916,28.4,916.6,6.1,9.434,0.187,0,17330,0,9.76025208444937,1,"1993"
"SOAD08663","Flumevale","Yes","Irrigation","Earth",5.722,0.192,17861,"1948","",0.06501,415.47324,"Uncontrolled","14/04/2016","6",13.24,"Low","Fair","2017-08-03",0.0475,15.8,301.8,17.9,5.722,0.192,0,17861,0,9.79043083024383,0,"Unknow"
"SOAD09020","Flumevale","Yes","Fish and Wildlife Pond","Earth",2.897,0.633,0,"1962","1986",0.23443,0,"Uncontrolled","28/08/2019","6",0,"Low","Not Rated",NA,0.0839,42.8,157.9,NA,2.897,0.633,0,NA,1,NA,1,"1986"
"SOAD10497","Flumevale","Yes","Irrigation","Earth",3.276,0.4,18489,"1886","1988",0.11229,0,"Uncontrolled","25/09/2013","6",3.09,"Low","Not Rated",NA,0.051,39.2,807.3,13,3.276,0.4,0,18489,0,9.82498532438117,1,"1988"
"SOAD11428","Flumevale","Yes","Fish and Wildlife Pond","Earth",6.713,0.107,8581,"1912","2003S",0,7.98987,"Controlled","29/06/2017","10",17.47,"Low","Not Rated",NA,0.0293,10.4,413.5,NA,6.713,0.107,0,8581,0,9.05742226555147,1,"2003"
"SOAD14414","Flumevale","Yes","Irrigation","Earth",3.346,0.36,11062,"1882","",0.0925899999999999,0,"","","6",11.63,"Low","Not Rated",NA,0.0338,27.8,392,9.7,3.346,0.36,0,11062,0,9.31136148603491,0,"Unknow"
"SOAD01955","Flumevale","Yes","Irrigation","Earth",8.381,0.139,NA,"1947","",0.08668,7.98987,"","20/10/2021","6",28.3,"Low","Unsatisfactory","2009-08-20",0.0854,30.4,230.2,29.8,8.381,0.139,0,NA,1,NA,0,"Unknow"
"SOAD04235","Flumevale","Yes","Water Supply","Earth",10.482,0.172,20000,"1957","",0.11623,2.66329,"","10/02/2022","0.5",0.66,"Low","Satisfactory","2017-09-01",0.066,25.2,345.6,32.8,10.482,0.172,0,20000,0,9.90353755128617,0,"Unknow"
"SOAD08383","Flumevale","Yes","Water Supply","Earth",19.929,0.1,40000,"1970","",0.05122,0,"","01/09/2022","1",6.21,"High","Satisfactory","2017-09-01",0.0835,10.8,288.4,55.4,19.929,0.1,0,40000,0,10.5966597327836,0,"Unknow"
"SOAD14096","Flumevale","Yes","Irrigation","Earth",5.043,0.11,9019,"1888","",0.10244,0,"","16/07/2020","6",12.68,"Low","Not Rated",NA,0.0467,40.5,250.3,3.1,5.043,0.11,0,9019,0,9.10719961305667,0,"Unknow"
"SOAD14536","Flumevale","Yes","Water Supply","Earth",13.052,0.095,22000,"1950","",0.0788,45.27593,"","05/01/2022","0.5",NA,"Low","Satisfactory","2017-09-01",0.0701,42.5,9.4,51,13.052,0.095,0,22000,0,9.99884318585288,0,"Unknow"
"SOAD17901","Flumevale","Yes","Water Supply","Earth",3.171,0.333,6000,"1912","",0.20685,5.32658,"","12/05/2022","1",0,"High","Satisfactory","2017-09-01",0.0866,24.9,484.8,26.6,3.171,0.333,0,6000,0,8.69968140098951,0,"Unknow"
"SOAD04231","Flumevale","Yes","Flood Risk Reduction","Earth",12.098,0.252,32140,"1961","",0.09456,13.31645,"","11/04/2018","3",37.6,"Low","Fair","2020-05-14",0.0677,26.9,222.2,NA,12.098,0.252,0,32140,0,10.3778877526843,0,"Unknow"
"SOAD08047","Flumevale","Yes","Fire Protection, Stock, Or Small Fish Pond","Earth",2.519,0.2,2834,"1895","",0.12214,0,"","24/09/2013","6",14.88,"Low","Not Rated",NA,0.0511,35.2,415,NA,2.519,0.2,0,2834,0,7.94979721616185,0,"Unknow"
"SOAD11130","Flumevale","Yes","Irrigation","Earth",4.095,0.5,37339,"1898","",0.10835,0,"Uncontrolled","05/04/1995","6",0,"Low","Fair","2020-10-07",0.0677,38.4,627.4,42.2,4.095,0.5,0,37339,0,10.5278204170957,0,"Unknow"
"SOAD17828","Flumevale","Yes","Fire Protection, Stock, Or Small Fish Pond","Earth",7.239,0.133,15679,"1987","",0.08471,26.6329,"Uncontrolled","05/02/2013","6",72.05,"Low","Fair","2019-05-13",0.0451,34.3,234.4,NA,7.239,0.133,0,15679,0,9.6601412939044,0,"Unknow"
"SOAD00628","Flumevale","Yes","Irrigation","Earth",4.01,0.25,17580,"1887","",0.07683,0,"","","6",7.74,"Low","Not Rated",NA,0.072,34.5,440.8,20.1,4.01,0.25,0,17580,0,9.77457405244279,0,"Unknow"
"SOAD02291","Flumevale","Yes","Irrigation","Earth",3.034,0.383,1300,"1890","",0.10441,0,"","22/10/1984","6",13.19,"Low","Not Rated",NA,0.0861,40.8,310.7,30.9,3.034,0.383,0,1300,0,7.1708884785125,0,"Unknow"
"SOAD07071","Flumevale","Yes","Water Supply","Earth",4.846,0.2,6300,"1941","",0.2364,21.30632,"","04/11/2021","1",NA,"Significant","Satisfactory","2017-09-01",0.1198,14.6,197.1,21.6,4.846,0.2,0,6300,0,8.74846362994206,0,"Unknow"
"SOAD09016","Flumevale","Yes","Flood Risk Reduction","Earth",8.992,0.202,22270,"1958","",0.07486,7.98987,"Uncontrolled","25/07/2013","3",1.61,"Low","Fair","2012-02-01",0.0883,40.2,296.4,NA,8.992,0.202,0,22270,0,10.0110406627009,0,"Unknow"
"SOAD09973","Flumevale","No","Fire Protection, Stock, Or Small Fish Pond","Earth",7.388,0.233,10371,"1948","",0,29.29619,"Uncontrolled","05/09/2013","10",0,"Low","Not Rated",NA,0.0419,32.3,888.7,NA,7.388,0.233,0,10371,0,9.24686514665856,0,"Unknow"
"SOAD14885","Flumevale","Yes","Water Supply","Earth",17.362,0.091,33500,"1963","",0.04137,0,"","11/08/2022","1",0.32,"High","Satisfactory","2017-09-01",0.093,46.5,133.9,34.5,17.362,0.091,0,33500,0,10.4193305681139,0,"Unknow"
"SOAD15977","Flumevale","Yes","Irrigation","Earth",4.384,0.65,NA,"1898","",0.14775,85.22528,"Uncontrolled","01/01/1997","0",67.82,"Low","Fair","2013-09-05",0.0891,24.1,101.5,2.9,4.384,0.65,0,NA,1,NA,0,"Unknow"
"SOAD17352","Flumevale","Yes","Fire Protection, Stock, Or Small Fish Pond","Earth",5.438,0.13,NA,"1901","",0.03349,0,"","18/11/1993","0",26.26,"Low","Satisfactory","2019-07-23",0.0588,6.1,411.1,NA,5.438,0.13,0,NA,1,NA,0,"Unknow"
"SOAD20030","Flumevale","Yes","Water Supply","Earth",6.955,0.331,NA,"1882","2013",0.06895,0,"Uncontrolled","25/04/2022","2",0,"Significant","Fair","2022-04-25",0.1389,46,297.2,26.8,6.955,0.331,0,NA,1,NA,1,"2013"
"SOAD20095","Flumevale","Yes","Fish and Wildlife Pond","Earth",2.821,0.1,3700,"1912","",0.20094,0,"Uncontrolled","12/09/2018","5",NA,"Low","Unsatisfactory","2018-09-12",0.0792,34.5,17.4,NA,2.821,0.1,0,3700,0,8.21635833238616,0,"Unknow"
"SOAD05506","Flumevale","Yes","Water Supply","Earth",17.382,0.13,30000,"1960","",0.12017,0,"","18/08/2022","1",NA,"High","Satisfactory","2017-09-01",0.0872,22.6,927.6,11.7,17.382,0.13,0,30000,0,10.3089859934221,0,"Unknow"
"SOAD06906","Flumevale","Yes","Fire Protection, Stock, Or Small Fish Pond","Earth",8.02,0.11,20676,"1974","",0.07683,0,"Uncontrolled","01/08/2017","6",42.93,"Low","Satisfactory","2013-09-29",0.0398,34.2,235.6,NA,8.02,0.11,0,20676,0,9.93677725040077,0,"Unknow"
"SOAD16308","Flumevale","Yes","Irrigation","Earth",2.551,0.042,0,"1913","",0.16745,0,"Uncontrolled","04/08/1993","0",16.81,"Low","Not Rated",NA,0.0884,13,254.1,46.4,2.551,0.042,0,NA,1,NA,0,"Unknow"
"SOAD19646","Flumevale","Yes","Water Supply","Earth",6.258,0.232,18660,"1965","",0.1379,2.66329,"","19/01/2023","1",0,"High","Poor","2023-03-09",0.1127,26,355.6,6.9,6.258,0.232,0,18660,0,9.83419106353347,0,"Unknow"
"SOAD20479","Flumevale","Yes","Water Supply","Earth",10.175,0.247,13700,"1967","",0.11426,5.32658,"","24/01/2022","0.5",NA,"Low","Satisfactory","2022-03-01",0.0726,36.6,14.6,15.5,10.175,0.247,0,13700,0,9.52522410185311,0,"Unknow"
"SOAD02187","Flumevale","Yes","Irrigation","Earth",7.515,0.265,14187,"1968","",0.10047,34.62277,"Uncontrolled","14/06/2016","6",21.53,"Low","Unsatisfactory","2021-10-25",0.1008,36.2,232.4,14.7,7.515,0.265,0,14187,0,9.56015181589351,0,"Unknow"
"SOAD04100","Flumevale","Yes","Water Supply","Earth",16.749,0.106,34500,"1976","",0.0591,2.66329,"","02/08/2022","1",NA,"High","Satisfactory","2017-09-01",0.0845,44.8,858,50.2,16.749,0.106,0,34500,0,10.4487435881066,0,"Unknow"
"SOAD19231","Flumevale","Yes","Water Supply","Earth",8.576,0.075,12570,"1934","",0.05713,0,"Uncontrolled","16/09/2021","6",26.4,"Low","Fair","2021-05-12",0.0465,40.1,212.6,43,8.576,0.075,0,12570,0,9.43914785291483,0,"Unknow"
"SOAD04372","Flumevale","Yes","Water Supply","Earth",13.762,0.185,39000,"1971","",0.08668,2.66329,"","16/02/2022","1",0,"Significant","Satisfactory","2017-09-01",0.1368,22.8,213.8,49.4,13.762,0.185,0,39000,0,10.5713425658087,0,"Unknow"
"SOAD07018","Flumevale","Yes","Irrigation","Earth",12.414,0.265,NA,"1950","1961",0.06501,0,"","09/09/2013","6",23.15,"Low","Fair","2009-10-27",0.0599,23.5,228.5,16.2,12.414,0.265,0,NA,1,NA,1,"1961"
"SOAD07242","Flumevale","Yes","Fish and Wildlife Pond","Earth",3.738,0.047,1622,"1890","",0.10441,0,"","24/09/2013","6",44.1,"Low","Not Rated",NA,0.0581,39.8,165.9,NA,3.738,0.047,0,1622,0,7.39203156751459,0,"Unknow"
"SOAD08139","Flumevale","Yes","Other","Earth",10.627,0.133,9756,"1937","",0.16942,207.73662,"","27/04/2022","0.5",NA,"Low","Satisfactory","2017-09-01",0.0642,25.6,10.7,NA,10.627,0.133,0,9756,0,9.18574025510795,0,"Unknow"
"SOAD10443","Flumevale","Yes","Irrigation","Earth",3.455,0.087,0,"1885","",0.13987,0,"","30/05/1984","6",8.4,"Low","Not Rated",NA,0.0764,5.1,122,26.7,3.455,0.087,0,NA,1,NA,0,"Unknow"
"SOAD11684","Flumevale","Yes","Flood Risk Reduction","Earth",9.711,0.189,19854,"1958","",0.08471,7.98987,"Uncontrolled","04/06/2015","3",6.29,"Low","Fair","2020-09-15",0.0944,45,98.5,NA,9.711,0.189,0,19854,0,9.89621114356535,0,"Unknow"
"SOAD16824","Flumevale","Yes","Water Supply","Earth",13.498,0.132,24000,"1961","",0.08471,5.32658,"","10/05/2022","1",0,"High","Satisfactory","2017-09-01",0.1017,17.2,199.8,4.9,13.498,0.132,0,24000,0,10.0858507751287,0,"Unknow"
"SOAD19219","Flumevale","Yes","Water Supply","Earth",7.739,0.13,13867,"1929","",0.11229,0,"","17/08/2017","6",27.02,"Low","Not Rated",NA,0.0316,15.7,126.4,60.9,7.739,0.13,0,13867,0,9.53733930680491,0,"Unknow"
"SOAD19755","Flumevale","Yes","Hydroelectric","Earth",10.853,0.148,9630,"1908","",0.09653,237.03281,"Uncontrolled","20/07/2023","1",23.35,"Significant","Fair","2023-09-29",0.1471,7.3,167.1,78.7,10.853,0.148,0,9630,0,9.17274234156086,0,"Unknow"
"SOAD00148","Flumevale","Yes","Irrigation","Earth",4.071,0.165,6464,"1925","2001",0.20094,0,"Uncontrolled","06/06/2019","6",14.55,"Low","Satisfactory","2020-03-05",0.04,12.2,282.7,5.7,4.071,0.165,0,6464,0,8.77415829120596,1,"2001"
"SOAD01445","Flumevale","Yes","Flood Risk Reduction","Earth",8.349,0.667,85000,"2007","",0.09653,95.87844,"","01/06/2022","0.5",NA,"Low","Satisfactory","2017-09-01",0.0609,28.7,5.3,NA,8.349,0.667,0,85000,0,11.3504183001091,0,"Unknow"
"SOAD09522","Flumevale","Yes","Flood Risk Reduction","Earth",10.539,0.247,19815,"1964","",0.0788,21.30632,"","15/03/2007","3",9.17,"Low","Fair","2016-09-01",0.0865,10.2,377,NA,10.539,0.247,0,19815,0,9.8942449711692,0,"Unknow"
"SOAD10775","Flumevale","Yes","Fire Protection, Stock, Or Small Fish Pond","Earth",7.922,0.23,NA,"1949","",0.17139,7.98987,"","08/03/1991","0",28.61,"Low","Not Rated",NA,0.0859,24.2,358,NA,7.922,0.23,0,NA,1,NA,0,"Unknow"
"SOAD11145","Flumevale","No","Irrigation","Earth",10.128,0.167,58000,"1958","",0,0,"","17/09/2020","6",0,"Low","Not Available",NA,0.027,30.1,462.4,45.4,10.128,0.167,0,58000,0,10.9682155307592,0,"Unknow"
"SOAD11648","Flumevale","Yes","Water Supply","Earth",17.408,0.07,50000,"Unknow","",0.06501,2.66329,"","23/06/2022","1",0,"High","Satisfactory","2017-09-01",0.1077,28.3,277.1,31.7,17.408,0.07,0,50000,0,10.8197982842103,0,"Unknow"
"SOAD08342","Flumevale","Yes","Fire Protection, Stock, Or Small Fish Pond","Earth",6.345,0.16,NA,"1909","",0.09653,7.98987,"","13/04/1992","0",98.26,"Low","Fair","2010-07-22",0.0767,34.6,140.8,NA,6.345,0.16,0,NA,1,NA,0,"Unknow"
"SOAD10556","Flumevale","Yes","Other","Earth",6.254,0.229,20244,"1948","",0.14184,5.32658,"","04/02/2022","1",NA,"Significant","Satisfactory","2017-09-01",0.1282,9.4,448.4,NA,6.254,0.229,0,20244,0,9.91566312846626,0,"Unknow"
"SOAD11276","Flumevale","Yes","Fire Protection, Stock, Or Small Fish Pond","Earth",7.02,0.17,NA,"1907","",0.07486,0,"","25/04/1991","0",9.64,"Low","Not Rated",NA,0.1158,27.1,385.7,NA,7.02,0.17,0,NA,1,NA,0,"Unknow"
"SOAD17660","Flumevale","Yes","Fire Protection, Stock, Or Small Fish Pond","Earth",7.174,0.26,36401,"1908","",0.17336,0,"","06/04/1988","6",8.13,"Low","Fair","2015-07-01",0.057,46.4,438.5,NA,7.174,0.26,0,36401,0,10.5023789971704,0,"Unknow"
"SOAD19408","Flumevale","Yes","Recreation","Earth",13.532,0.207,55111,"1940","",0.06698,7.98987,"","23/09/2022","6",35.56,"Low","Not Rated",NA,0.0542,32.4,225.5,8.6,13.532,0.207,0,55111,0,10.917122757273,0,"Unknow"
"SOAD20675","Flumevale","Yes","Debris Control","Earth",18.749,0.318,454000,"1960","",0.07289,90.55186,"","12/10/2022","0.5",NA,"Low","Fair","2017-09-01",0.0871,38.6,22.9,NA,18.749,0.318,0,454000,0,13.0258546796642,0,"Unknow"
"SOAD02135","Flumevale","No","Other","Earth",5.405,0.4,NA,"Unknow","",NA,NA,"","","Unknow",6.37,"Low","Not Available",NA,0.1266,8.2,425.1,NA,5.405,0.4,0,NA,1,NA,0,"Unknow"
"SOAD08590","Flumevale","No","Irrigation","Earth",10.008,0.29,58000,"1959","",0.0906199999999999,7.98987,"","23/10/2014","6",0,"Low","Not Available",NA,0.0742,26,123,30.8,10.008,0.29,0,58000,0,10.9682155307592,0,"Unknow"
"SOAD11068","Flumevale","Yes","Recreation","Earth",3.424,0.45,34452,"1889","",0.13002,0,"Uncontrolled","16/02/2021","2",0,"Significant","Satisfactory","2021-02-16",0.1063,10.2,296,3.3,3.424,0.45,0,34452,0,10.4473513553789,0,"Unknow"
"SOAD14567","Flumevale","Yes","Water Supply","Earth",28.082,0.168,38577,"1980","",0.04137,7.98987,"","06/08/2014","6",13.9,"Low","Satisfactory","2019-06-05",0.0365,36.7,200,36.6,28.082,0.168,0,38577,0,10.5604374447842,0,"Unknow"
"SOAD20277","Flumevale","Yes","Flood Risk Reduction","Earth",8.518,0.256,NA,"1970","",0.06895,0,"","20/10/1992","3",134.88,"Low","Fair","2018-10-26",0.0854,38.5,173.8,NA,8.518,0.256,0,NA,1,NA,0,"Unknow"
"SOAD02808","Flumevale","Yes","Other","Earth",9.867,0.17,40000,"1967","",0.13002,2.66329,"","22/02/2022","0.5",NA,"Low","Satisfactory","2017-09-01",0.0761,24.9,18.5,NA,9.867,0.17,0,40000,0,10.5966597327836,0,"Unknow"
"SOAD14728","Flumevale","Yes","Hydroelectric","Earth",3.059,0.112,300,"1870","",0.20685,2.66329,"Uncontrolled","18/08/2016","3",NA,"Low","Satisfactory","2023-09-29",0.0618,25.9,21.9,NA,3.059,0.112,0,300,0,5.70711026474888,0,"Unknow"
"SOAD15797","Flumevale","Yes","Irrigation","Earth",7.513,0.037,17889,"1960","",0.06895,0,"Uncontrolled","26/10/2018","6",4.62,"Low","Not Rated",NA,0.0791,30.8,500.1,29.1,7.513,0.037,0,17889,0,9.79199717650276,0,"Unknow"
"SOAD01849","Flumevale","Yes","Irrigation","Earth",9.662,0.253,29555,"1901","1972H;1972M;1972S",0.06698,0,"Uncontrolled","03/08/2021","2",16.4,"Significant","Satisfactory","2021-08-03",0.1248,4.9,165.6,26.1,9.662,0.253,0,29555,0,10.2940420479085,3,"1972"
"SOAD04727","Flumevale","Yes","Flood Risk Reduction","Earth",9.319,0.22,27325,"1957","",0.07486,7.98987,"Uncontrolled","06/10/2020","3",24.42,"Low","Not Rated",NA,0.0712,46.9,358.3,NA,9.319,0.22,0,27325,0,10.2155939088984,0,"Unknow"
"SOAD04764","Flumevale","Yes","Water Supply","Earth",9.074,0.933,NA,"1978","",0.04925,0,"Uncontrolled","15/09/2022","2",1.61,"Significant","Fair","2022-09-15",0.1301,19.8,95.7,35,9.074,0.933,0,NA,1,NA,0,"Unknow"
"SOAD05032","Flumevale","Yes","Fish and Wildlife Pond","Earth",3.117,0.053,NA,"1935","",0.12214,0,"","22/10/1984","0",8.14,"Low","Satisfactory","2018-12-11",0.0702,24.2,118.2,NA,3.117,0.053,0,NA,1,NA,0,"Unknow"
"SOAD06803","Flumevale","Yes","Fire Protection, Stock, Or Small Fish Pond","Earth",6.584,0.308,NA,"1973","",0.16745,0,"","13/11/1991","0",28.51,"Low","Not Rated",NA,0.1087,37.4,254.5,NA,6.584,0.308,0,NA,1,NA,0,"Unknow"
"SOAD07688","Flumevale","Yes","Irrigation","Earth",3.79,0.567,61002,"1902","",0.13396,0,"","13/06/1986","6",4.91,"Low","Not Rated",NA,0.0427,29.3,358.1,15.9,3.79,0.567,0,61002,0,11.018678322274,0,"Unknow"
"SOAD12697","Flumevale","Yes","Flood Risk Reduction","Earth",11.433,0.38,36120,"1961","",0.08668,7.98987,"Uncontrolled","11/04/2018","3",36.11,"Low","Fair","2019-08-08",0.0829,24.1,159.8,NA,11.433,0.38,0,36120,0,10.4946296926405,0,"Unknow"
"SOAD13357","Flumevale","Yes","Flood Risk Reduction","Earth",11.653,0.312,35400,"1955","",0.09456,7.98987,"Uncontrolled","22/04/2014","3",8.22,"Low","Fair","2015-08-25",0.0901,32.3,314.4,NA,11.653,0.312,0,35400,0,10.4744953473105,0,"Unknow"
"SOAD15302","Flumevale","Yes","Fire Protection, Stock, Or Small Fish Pond","Earth",9.822,0.328,NA,"1963","",0.10441,13.31645,"","05/03/1987","0",118.36,"Low","Unsatisfactory","2013-09-27",0.1247,22.6,85.3,NA,9.822,0.328,0,NA,1,NA,0,"Unknow"
"SOAD10142","Flumevale","Yes","Recreation","Earth",7.546,0.073,3681,"1969","",0.09456,7.98987,"Uncontrolled","01/09/2010","10",195.49,"Low","Not Rated","2020-08-25",0.0704,16.9,104.6,6.1,7.546,0.073,0,3681,0,8.21121136179302,0,"Unknow"
"SOAD10670","Flumevale","Yes","Flood Risk Reduction","Earth",12.807,0.233,27127,"1956","",0.08077,7.98987,"Uncontrolled","01/11/2011","6",6.23,"Low","Satisfactory","2021-07-22",0.0285,23.8,283.6,NA,12.807,0.233,0,27127,0,10.2083216838055,0,"Unknow"
"SOAD11734","Flumevale","Yes","Water Supply","Earth",14.897,0.08,25000,"1926","",0.0906199999999999,7.98987,"","12/04/2023","1",NA,"Significant","Poor","2017-09-01",0.1489,42.3,248.1,55,14.897,0.08,0,25000,0,10.1266711030504,0,"Unknow"
"SOAD12965","Flumevale","Yes","Fire Protection, Stock, Or Small Fish Pond","Earth",10.411,0.117,NA,"1905","",0.15957,37.28606,"Uncontrolled","16/08/2018","6",19.98,"Low","Satisfactory","2018-10-23",0.0559,32.8,143,NA,10.411,0.117,0,NA,1,NA,0,"Unknow"
"SOAD13044","Flumevale","Yes","Water Supply","Earth",8.558,0.08,4452,"Unknow","",0.10638,0,"","18/07/2023","1",0.16,"High","Fair","2017-09-01",0.1153,45.8,751.9,5.3,8.558,0.08,0,4452,0,8.4013333053217,0,"Unknow"
"SOAD17134","Flumevale","Yes","Irrigation","Earth",6.292,0.212,NA,"Unknow","",0.08668,7.98987,"Uncontrolled","24/08/2021","6",16.81,"Low","Not Rated",NA,0.0935,35.7,197.3,34.6,6.292,0.212,0,NA,1,NA,0,"Unknow"
"SOAD18649","Flumevale","Yes","Irrigation","Earth",8.495,0.057,2450,"1959","",0.04925,0,"Uncontrolled","30/09/2016","6",40,"Low","Satisfactory","2019-07-16",0.0361,12.5,164.1,41.7,8.495,0.057,0,2450,0,7.80425138352811,0,"Unknow"
"SOAD18900","Flumevale","Yes","Irrigation","Earth",3.429,0.757,39774,"1887","",0.12608,0,"","01/07/1987","6",11.04,"Low","Not Rated",NA,0.0435,10.6,232.1,37.1,3.429,0.757,0,39774,0,10.590993853206,0,"Unknow"
"SOAD00478","Flumevale","Yes","Water Supply","Earth",4.373,0.144,11580,"1955","",0.21473,0,"","11/05/2022","0.5",NA,"Low","Satisfactory","2017-09-01",0.0652,28.6,23.7,14.9,4.373,0.144,0,11580,0,9.35712110318438,0,"Unknow"
"SOAD09072","Flumevale","Yes","Recreation","Earth",3.498,0.21,NA,"1965","",0.10441,50.60251,"","11/06/2008","6",76.8,"Low","Not Rated",NA,0.042,15.6,171.5,9.5,3.498,0.21,0,NA,1,NA,0,"Unknow"
"SOAD13589","Flumevale","Yes","Irrigation","Earth",17.186,0.145,0,"1922","",0.30141,0,"Uncontrolled","23/04/1992","0",21.64,"Low","Not Rated",NA,0.11,318.8,289.1,20.9,17.186,0.145,0,NA,1,NA,0,"Unknow"
"SOAD14204","Flumevale","Yes","Irrigation","Earth",5.822,1.167,54675,"1902","",0.10244,0,"Uncontrolled","24/09/2013","6",11.25,"Low","Not Rated",NA,0.0918,27.8,345.1,22.2,5.822,1.167,0,54675,0,10.9091801352725,0,"Unknow"
"SOAD16001","Flumevale","Yes","Irrigation","Earth",8.018,0.275,16089,"1963","",0.0985,0,"","21/04/2022","6",27.51,"Low","Fair","2022-10-18",0.0448,18.7,231.9,7.8,8.018,0.275,0,16089,0,9.68595323998643,0,"Unknow"
"SOAD01621","Flumevale","Yes","Irrigation","Earth",4.71,0.31,21433,"1893","",0.197,0,"Uncontrolled","04/02/2021","2",3.19,"Significant","Satisfactory","2021-02-04",0.1187,44,170.8,31.8,4.71,0.31,0,21433,0,9.97273372527294,0,"Unknow"
"SOAD02733","Flumevale","No","Fish and Wildlife Pond","Earth",4.787,0.15,NA,"1907","",NA,NA,"Uncontrolled","08/08/2008","10",NA,"Low","Not Rated",NA,0.0143,17.1,16.2,NA,4.787,0.15,0,NA,1,NA,0,"Unknow"
"SOAD07628","Flumevale","Yes","Water Supply","Earth",5.851,1.2,47000,"1954","",0.20291,18.64303,"","26/04/2022","0.5",1.66,"Low","Satisfactory","2017-09-01",0.0672,25.6,338.5,6.7,5.851,1.2,0,47000,0,10.7579241570616,0,"Unknow"
"SOAD15279","Flumevale","No","Other","Earth",10.616,0.267,NA,"Unknow","",NA,NA,"","","Unknow",3.22,"Significant","Not Available",NA,0.152,233.9,666.2,NA,10.616,0.267,0,NA,1,NA,0,"Unknow"
"SOAD01579","Flumevale","Yes","Fish and Wildlife Pond","Earth",11.591,0.067,10501,"1967","",0.0886499999999999,13.31645,"Controlled","09/07/2013","Unknow",17.84,"Significant","Not Rated",NA,0.1435,41.7,252.2,NA,11.591,0.067,0,10501,0,9.2593209941978,0,"Unknow"
"SOAD04189","Flumevale","Yes","Irrigation","Earth",8.731,0.1,11736,"1903","",0.11229,0,"Uncontrolled","25/09/2018","6",13.87,"Low","Satisfactory","2015-10-23",0.0367,34.3,461.4,33.4,8.731,0.1,0,11736,0,9.37050152410012,0,"Unknow"
"SOAD13787","Flumevale","Yes","Water Supply","Earth",19.014,0.193,58835,"1952","",0.06895,5.32658,"","07/04/2022","1",0,"High","Satisfactory","2017-09-01",0.0765,6.3,252.1,9.6,19.014,0.193,0,58835,0,10.9825091914392,0,"Unknow"
"SOAD02019","Flumevale","Yes","Irrigation","Earth",6.514,0.173,6334,"1896","",0.13002,13.31645,"","29/10/1984","6",8.3,"Low","Fair","2014-11-06",0.052,13.2,448.1,18.5,6.514,0.173,0,6334,0,8.75384509275524,0,"Unknow"
"SOAD09312","Flumevale","Yes","Water Supply","Earth",6.33,0.24,9400,"1948","",9.65891,34.62277,"","16/06/2022","0.5",NA,"Low","Satisfactory","2017-09-01",0.0586,741.3,17.8,64.9,6.33,0.24,0,9400,0,9.14857134557855,0,"Unknow"
"SOAD02372","Flumevale","Yes","Irrigation","Earth",4.188,0.093,1699,"1922","",0.21473,0,"Uncontrolled","23/07/2021","6",16.89,"Low","Fair","2021-08-12",0.0607,18.3,304.2,14.3,4.188,0.093,0,1699,0,7.43838353004431,0,"Unknow"
"SOAD04419","Flumevale","Yes","Unknow","Earth",5.435,1.093,NA,"Unknow","",0.09653,0,"Uncontrolled","04/09/2020","6",NA,"Low","Fair","2021-06-30",0.0512,27,20.9,NA,5.435,1.093,0,NA,1,NA,0,"Unknow"
"SOAD06063","Flumevale","Yes","Fish and Wildlife Pond","Earth",6.528,0.091,10193,"1920","",0.12411,13.31645,"Uncontrolled","29/06/2017","6",46.82,"Low","Satisfactory","2020-07-14",0.0502,29.4,127.6,NA,6.528,0.091,0,10193,0,9.22955459089999,0,"Unknow"
"SOAD08026","Flumevale","Yes","Flood Risk Reduction","Earth",10.518,0.235,31800,"1957","",0.08077,7.98987,"Uncontrolled","15/04/2014","3",8.14,"Low","Fair","2018-10-31",0.0948,15,159.9,NA,10.518,0.235,0,31800,0,10.3672530148147,0,"Unknow"
"SOAD16090","Flumevale","Yes","Water Supply","Earth",7.198,0.952,72000,"2005","",0.08668,0,"Uncontrolled","22/07/2022","1",6.56,"High","Satisfactory","2022-07-22",0.0868,26.1,383,8.7,7.198,0.952,0,72000,0,11.1844352867906,0,"Unknow"
"SOAD01767","Flumevale","No","Fire Protection, Stock, Or Small Fish Pond","Earth",16.067,0.13,NA,"1953","1980",0.05319,23.96961,"Uncontrolled","23/06/2017","3",0,"Low","Fair","2017-06-23",0.0941,30.1,781.2,NA,16.067,0.13,0,NA,1,NA,1,"1980"
"SOAD09843","Flumevale","Yes","Water Supply","Earth",12.036,0.113,16400,"1958","",0.10441,7.98987,"","29/06/2022","0.5",NA,"Low","Satisfactory","2017-09-01",0.0672,5.6,19.4,52.4,12.036,0.113,0,16400,0,9.70509758756311,0,"Unknow"
"SOAD18139","Flumevale","Yes","Flood Risk Reduction","Earth",16.465,0.192,27170,"1976","",0.08471,7.98987,"Uncontrolled","01/06/2016","3",39.71,"Low","Not Rated",NA,0.0801,37.9,137.6,NA,16.465,0.192,0,27170,0,10.2099055070431,0,"Unknow"
"SOAD03262","Flumevale","Yes","Water Supply","Earth",5.412,0.613,19000,"1960","",0.32899,127.83792,"","27/04/2022","1",3.23,"High","Satisfactory","2017-09-01",0.1047,486,846.4,71.3,5.412,0.613,0,19000,0,9.85224688834253,0,"Unknow"
"SOAD06516","Flumevale","Yes","Water Supply","Earth",6.187,0.36,31500,"1985","",0.10244,NA,"","10/10/2022","0.5",NA,"Low","Fair","2017-09-01",0.0832,26.5,21,71,6.187,0.36,0,31500,0,10.3577745703416,0,"Unknow"
"SOAD09527","Flumevale","Yes","Water Supply","Earth",7.441,0.1,10000,"2013","",0.12608,NA,"","08/02/2023","0.5",NA,"Low","Fair","2017-09-01",0.0785,34.2,9.7,20,7.441,0.1,0,10000,0,9.21044036697652,0,"Unknow"
"SOAD14241","Flumevale","Yes","Irrigation","Earth",11.266,0.108,14733,"1946","",0.08077,7.98987,"Uncontrolled","24/07/2018","6",26.87,"Low","Not Rated",NA,0.0913,41.1,340.4,6.8,11.266,0.108,0,14733,0,9.59791302724276,0,"Unknow"
"SOAD09119","Flumevale","Yes","Irrigation","Earth",10.627,0.089,NA,"1966","",0.0906199999999999,15.97974,"Uncontrolled","16/05/2018","6",47.79,"Low","Not Rated",NA,0.0658,5.6,83,45.9,10.627,0.089,0,NA,1,NA,0,"Unknow"
"SOAD13835","Flumevale","Yes","Fire Protection, Stock, Or Small Fish Pond","Earth",11.567,0.184,NA,"Unknow","1975;1985",0.07486,0,"Uncontrolled","09/09/2013","0",27.69,"Low","Satisfactory","2021-06-09",0.0636,6,282.5,NA,11.567,0.184,0,NA,1,NA,2,"1985"
"SOAD17802","Flumevale","Yes","Water Supply","Earth",7.986,0.167,12100,"2004","",0.0591,0,"","15/12/2021","1",NA,"High","Satisfactory","2017-09-01",0.1093,26.5,898.5,56.2,7.986,0.167,0,12100,0,9.40104337279805,0,"Unknow"
"SOAD07149","Flumevale","Yes","Water Supply","Earth",9.765,0.367,49000,"1953","",0.10835,NA,"","22/03/2022","1",0.8,"Significant","Satisfactory","2017-09-01",0.1173,39.6,201.4,64.8,9.765,0.367,0,49000,0,10.7995959850478,0,"Unknow"
"SOAD12331","Flumevale","Yes","Irrigation","Earth",8.719,0.15,25369,"1902","",0.07683,0,"","29/10/2018","6",15.74,"Low","Satisfactory","2018-04-11",0.044,16.5,383,15.1,8.719,0.15,0,25369,0,10.1413226525933,0,"Unknow"
"SOAD15418","Flumevale","Yes","Recreation","Earth",4.324,0.283,NA,"1970","2015",0.11229,0,"Controlled","","6",1.67,"Low","Fair","2020-10-06",0.0647,29.6,714.8,6.3,4.324,0.283,0,NA,1,NA,1,"2015"
"SOAD16131","Flumevale","Yes","Irrigation","Earth",8.703,0.232,31119,"1950","1951",0.10244,0,"Uncontrolled","24/09/2013","6",11.6,"Low","Not Rated",NA,0.1014,45.3,317.7,10.7,8.703,0.232,0,31119,0,10.3456059782923,1,"1951"
"SOAD16539","Flumevale","Yes","Water Supply","Earth",21.461,0.153,81777,"1903","",0.04728,0,"","19/07/2022","1",3.35,"High","Satisfactory","2022-07-19",0.1071,20.4,818.5,21.7,21.461,0.153,0,81777,0,11.3117635377624,0,"Unknow"
"SOAD19774","Flumevale","Yes","Flood Risk Reduction","Earth",5.868,0.564,21215,"1957","",0.1379,7.98987,"","23/07/1980","6",20,"Low","Satisfactory","2022-04-21",0.0341,31.7,333.2,NA,5.868,0.564,0,21215,0,9.96251089298559,0,"Unknow"
"SOAD03373","Flumevale","Yes","Flood Risk Reduction","Earth",24.042,0.063,50610,"1963","",0.0591,13.31645,"","22/07/2022","1",0,"High","Satisfactory","2017-09-01",0.092,25.5,214.6,NA,24.042,0.063,0,50610,0,10.8319242229538,0,"Unknow"
"SOAD03636","Flumevale","Yes","Irrigation","Earth",3.835,0.448,22164,"1948","",0.10244,0,"","05/04/1978","6",3.07,"Low","Fair","2019-04-01",0.0509,26.8,815.6,6.9,3.835,0.448,0,22164,0,10.0062697471792,0,"Unknow"
"SOAD06297","Flumevale","Yes","Water Supply","Earth",4.49,1.143,109000,"1956","",0.02758,NA,"","29/03/2022","1",NA,"High","Fair","2017-09-01",0.1055,27.4,512.7,44.1,4.49,1.143,0,109000,0,11.5991123354811,0,"Unknow"
"SOAD20733","Flumevale","Yes","Water Supply","Earth",7.794,0.152,10200,"1941","",0.16942,2.66329,"","28/06/2023","0.5",NA,"Low","Fair","2021-11-08",0.0807,29,8.8,50.3,7.794,0.152,0,10200,0,9.23024103368252,0,"Unknow"
"SOAD00575","Flumevale","Yes","Water Supply","Earth",12.076,0.112,12160,"1959","",0.10441,18.64303,"","09/02/2022","1",NA,"High","Satisfactory","2017-09-01",0.1001,18.6,487.9,42.5,12.076,0.112,0,12160,0,9.405989388981,0,"Unknow"
"SOAD05240","Flumevale","Yes","Recreation","Earth",9.881,0.16,NA,"1956","",0.08668,79.8987,"Uncontrolled","20/09/2021","2",32.15,"Significant","Fair","2021-09-20",0.1453,24.1,98.1,3.7,9.881,0.16,0,NA,1,NA,0,"Unknow"
"SOAD08739","Flumevale","Yes","Flood Risk Reduction","Earth",8.453,0.271,24480,"1963","",0.11229,13.31645,"","03/04/2019","3",16.75,"Low","Fair","2018-09-20",0.0754,29.3,429.1,NA,8.453,0.271,0,24480,0,10.1056525854651,0,"Unknow"
"SOAD13020","Flumevale","Yes","Irrigation","Earth",6.846,0.08,0,"1948","",0.03349,69.24554,"Uncontrolled","14/08/2006","0",4.91,"Low","Satisfactory","2017-10-11",0.0683,32.1,551.6,44.3,6.846,0.08,0,NA,1,NA,0,"Unknow"
"SOAD02675","Flumevale","Yes","Recreation","Earth",14.725,0.108,32609,"1971","",0.06895,21.30632,"Uncontrolled","21/09/2021","6",4.92,"Low","Fair","2022-10-25",0.066,23.5,729.4,4,14.725,0.108,0,32609,0,10.3923742687834,0,"Unknow"
"SOAD20022","Flumevale","Yes","Fish and Wildlife Pond","Earth",4.838,0.1,NA,"1973","",0.0925899999999999,13.31645,"Uncontrolled","04/09/1991","6",21.51,"Low","Satisfactory","2020-07-20",0.0264,24.4,355.3,NA,4.838,0.1,0,NA,1,NA,0,"Unknow"
"SOAD01097","Flumevale","Yes","Unknow","Earth",3.714,0.767,NA,"Unknow","",0.18715,0,"Uncontrolled","","0",53.29,"Low","Not Rated",NA,0.0866,21.8,144.6,NA,3.714,0.767,0,NA,1,NA,0,"Unknow"
"SOAD03522","Flumevale","Yes","Irrigation","Earth",5.349,0.433,88271,"1902","",0.14184,0,"Uncontrolled","29/04/2021","6",0,"Low","Not Rated",NA,0.0577,39.9,520.9,38.1,5.349,0.433,0,88271,0,11.3881782355122,0,"Unknow"
"SOAD12225","Flumevale","Yes","Fire Protection, Stock, Or Small Fish Pond","Earth",10.83,0.25,0,"1915","",0.10835,NA,"","24/05/2023","1",NA,"Significant","Fair","2017-09-01",0.1465,22.9,139.8,NA,10.83,0.25,0,NA,1,NA,0,"Unknow"
"SOAD07006","Flumevale","Yes","Fish and Wildlife Pond","Earth",14.281,0.292,25200,"1978","2004H",0.13396,151.80753,"","22/08/2018","5",NA,"Low","Poor","2018-08-22",0.0707,8.5,19.8,NA,14.281,0.292,0,25200,0,10.1346389552519,1,"2004"
"SOAD11475","Flumevale","Yes","Irrigation","Earth",4.67,0.433,59925,"1888","2001",0.0925899999999999,0,"Controlled","16/05/2018","2",0,"Significant","Satisfactory","2018-05-16",0.1158,27.4,396,4.1,4.67,0.433,0,59925,0,11.0008657466894,1,"2001"
"SOAD13091","Flumevale","Yes","Irrigation","Earth",7.033,0.25,NA,"1920","",0.08077,13.31645,"","13/04/1992","6",18.39,"Low","Not Rated",NA,0.0816,28,189.3,5.5,7.033,0.25,0,NA,1,NA,0,"Unknow"
"SOAD04656","Flumevale","Yes","Fire Protection, Stock, Or Small Fish Pond","Earth",7.588,0.15,NA,"1939","",0.12017,15.97974,"","27/02/1986","0",24.81,"Low","Satisfactory","2016-09-08",0.0615,38.1,245.2,NA,7.588,0.15,0,NA,1,NA,0,"Unknow"
"SOAD02216","Flumevale","Yes","Irrigation","Earth",6.48,0.293,0,"1981","",0.10047,0,"","30/04/2020","6",9.46,"Low","Satisfactory","2019-06-06",0.0423,41.5,420.3,13.6,6.48,0.293,0,NA,1,NA,0,"Unknow"
"SOAD06627","Flumevale","Yes","Irrigation","Earth",9.009,0.117,0,"1903","",0.08077,0,"Uncontrolled","24/07/2018","6",32.1,"Low","Unsatisfactory","2015-06-02",0.0837,5,121.4,11.8,9.009,0.117,0,NA,1,NA,0,"Unknow"
"SOAD09062","Flumevale","Yes","Irrigation","Earth",4.94,0.645,47272,"1910","",0.16745,7.98987,"","22/10/1984","6",15.48,"Low","Satisfactory","2020-12-16",0.0371,34.9,180.6,42,4.94,0.645,0,47272,0,10.7636945869734,0,"Unknow"
"SOAD10037","Flumevale","Yes","Recreation","Earth",10,0.154,36463,"1964","",0.08274,0,"","01/01/1994","0",23.81,"Low","Satisfactory","2018-10-05",0.0727,39.7,327.3,3.3,10,0.154,0,36463,0,10.5040807514855,0,"Unknow"
"SOAD15734","Flumevale","No","Fire Protection, Stock, Or Small Fish Pond","Earth",4.199,0.15,NA,"1970","",NA,23.96961,"Uncontrolled","31/08/2010","10",NA,"Low","Not Rated",NA,0.0563,22.8,19,NA,4.199,0.15,0,NA,1,NA,0,"Unknow"
"SOAD02319","Flumevale","Yes","Flood Risk Reduction","Earth",7.088,0.27,63500,"1999","",0.09456,5.32658,"","23/02/2022","1",0.16,"High","Satisfactory","2017-09-01",0.0873,7.5,685.2,NA,7.088,0.27,0,63500,0,11.0588109327883,0,"Unknow"
"SOAD03482","Flumevale","Yes","Fire Protection, Stock, Or Small Fish Pond","Earth",6.179,0.167,NA,"1939","",0.12411,53.2658,"","01/10/1987","0",67.26,"Low","Unsatisfactory","2013-09-04",0.1178,5.8,130.8,NA,6.179,0.167,0,NA,1,NA,0,"Unknow"
"SOAD03953","Flumevale","Yes","Irrigation","Earth",10.275,0.14,35693,"1937","1956",0.05713,7.98987,"Uncontrolled","11/07/2017","6",14.09,"Low","Satisfactory","2012-09-13",0.0438,18.9,437.2,38,10.275,0.14,0,35693,0,10.482737886416,1,"1956"
"SOAD04674","Flumevale","Yes","Flood Risk Reduction","Earth",8.337,0.5,46000,"1959","2020",0.02561,21.30632,"","25/10/2022","3",25.52,"Low","Satisfactory","2019-08-08",0.0674,43.9,369.7,NA,8.337,0.5,0,46000,0,10.7364184143654,1,"2020"
"SOAD14003","Flumevale","Yes","Debris Control","Earth",32.833,0.325,6e+05,"1988","",0.11032,37.28606,"","17/02/2022","1",0,"High","Satisfactory","2017-09-01",0.0712,24.3,245.7,NA,32.833,0.325,0,6e+05,0,13.3046866008636,0,"Unknow"
"SOAD15779","Flumevale","Yes","Water Supply","Earth",37.781,0.207,166000,"1984","",0.04137,NA,"","05/05/2022","1",0,"High","Satisfactory","2017-09-01",0.091,34.8,130.3,65.2,37.781,0.207,0,166000,0,12.0197490914169,0,"Unknow"
"SOAD17765","Flumevale","Yes","Irrigation","Earth",18.587,0.145,35681,"1959","",0.06107,0,"","08/06/2022","6",25.65,"Low","Not Rated",NA,0.0241,44,127.1,43.9,18.587,0.145,0,35681,0,10.4824016389346,0,"Unknow"
"SOAD03955","Flumevale","Yes","Irrigation","Earth",7.245,0.25,20557,"1976","",0.24231,0,"Uncontrolled","28/09/2016","6",29.48,"Low","Satisfactory","2019-05-08",0.0542,38,105.7,42.1,7.245,0.25,0,20557,0,9.93100543857287,0,"Unknow"
"SOAD10651","Flumevale","Yes","Flood Risk Reduction","Earth",19.221,0.177,NA,"1967","",0.06895,0,"","19/09/2016","3",66.1,"Low","Not Rated",NA,0.0848,19.2,74.9,NA,19.221,0.177,0,NA,1,NA,0,"Unknow"
"SOAD14637","Flumevale","Yes","Water Supply","Earth",11.29,0.212,28000,"1955","",0.11623,2.66329,"","02/08/2022","1",NA,"Significant","Satisfactory","2017-09-01",0.118,8.6,174.6,22.4,11.29,0.212,0,28000,0,10.2399955028053,0,"Unknow"
"SOAD18140","Flumevale","Yes","Irrigation","Earth",8.323,0.082,12412,"1930","",0.11032,362.20744,"Uncontrolled","17/05/2011","6",9.56,"Low","Not Rated",NA,0.0671,26.8,380.4,33.3,8.323,0.082,0,12412,0,9.42649958951595,0,"Unknow"
"SOAD18991","Flumevale","Yes","Flood Risk Reduction","Earth",10.93,0.208,30174,"1970","",0.09456,7.98987,"Uncontrolled","01/06/2016","3",40.29,"Low","Fair","2020-05-12",0.0958,27.9,219.9,NA,10.93,0.208,0,30174,0,10.3147690459657,0,"Unknow"
"SOAD19571","Flumevale","Yes","Irrigation","Earth",4.388,0.12,0,"1895","",0.08471,0,"","24/09/1984","6",39.18,"Low","Not Rated",NA,0.0953,45.5,192.6,35.9,4.388,0.12,0,NA,1,NA,0,"Unknow"
"SOAD04496","Flumevale","Yes","Water Supply","Earth",9.421,0.137,20300,"1979","",0.07683,5.32658,"","16/03/2022","1",0.8,"High","Satisfactory","2017-09-01",0.0932,26.5,660.1,15.1,9.421,0.137,0,20300,0,9.91842542490033,0,"Unknow"
"SOAD08438","Flumevale","Yes","Irrigation","Earth",6.805,0.133,NA,"1952","",0.06501,42.61264,"Uncontrolled","22/08/2019","6",11.41,"Low","Not Rated",NA,0.0437,11.8,383.2,31.1,6.805,0.133,0,NA,1,NA,0,"Unknow"
"SOAD13217","Flumevale","Yes","Water Supply","Earth",34.196,0.165,125000,"2001","",0.05319,0,"","06/01/2022","1",1.59,"High","Satisfactory","2017-09-01",0.1144,20.6,166,18.9,34.196,0.165,0,125000,0,11.7360770162524,0,"Unknow"
"SOAD16056","Flumevale","Yes","Fire Protection, Stock, Or Small Fish Pond","Earth",6.895,0.215,NA,"1944","",0.12214,0,"Uncontrolled","06/11/2018","6",43.19,"Low","Unsatisfactory","2021-06-24",0.096,31.2,66.9,NA,6.895,0.215,0,NA,1,NA,0,"Unknow"
"SOAD07212","Flumevale","Yes","Recreation","Earth",7.221,0.07,200,"1957","",0.06895,801.65029,"Uncontrolled","27/09/2013","6",14.95,"Low","Not Rated",NA,0.0672,28,440.3,3.1,7.221,0.07,0,200,0,5.30330490805908,0,"Unknow"
"SOAD08359","Flumevale","Yes","Other","Earth",12.629,0.167,30700,"1951","",0.0788,90.55186,"","18/08/2023","0.5",NA,"Low","Fair","2017-09-01",0.0863,41,22.4,NA,12.629,0.167,0,30700,0,10.3320505063347,0,"Unknow"
"SOAD14149","Flumevale","Yes","Irrigation","Earth",15.999,0.367,74570,"1962","",0.0591,0,"Uncontrolled","07/10/2020","6",6.65,"Low","Satisfactory","2016-06-03",0.0304,38.6,194.1,33.2,15.999,0.367,0,74570,0,11.2195069706665,0,"Unknow"
"SOAD01252","Flumevale","Yes","Flood Risk Reduction","Earth",24.858,0.148,NA,"1961","",0.06698,0,"Uncontrolled","24/10/2022","3",0,"High","Fair","2022-10-24",0.1053,26.5,551.6,NA,24.858,0.148,0,NA,1,NA,0,"Unknow"
"SOAD04297","Flumevale","Yes","Water Supply","Earth",10.993,0.783,80000,"1991","",0.06698,0,"","23/09/2021","1",1.13,"High","Satisfactory","2017-09-01",0.1081,13,825.5,14,10.993,0.783,0,80000,0,11.2897944135779,0,"Unknow"
"SOAD08924","Flumevale","Yes","Fish and Wildlife Pond","Earth",6.162,1.092,68240,"Unknow","1977",0.11426,0,"","15/10/2019","6",1.56,"Low","Fair","2019-07-23",0.0579,34.6,521.1,NA,6.162,1.092,0,68240,0,11.13080083622,1,"1977"
"SOAD19337","Flumevale","Yes","Irrigation","Earth",2.435,0.446,8171,"1889","",0.15366,0,"","26/09/2013","6",14.05,"Low","Not Rated",NA,0.076,24.6,333.2,45.8,2.435,0.446,0,8171,0,9.00846895593751,0,"Unknow"
"SOAD03494","Flumevale","Yes","Irrigation","Earth",3.845,0.4,NA,"1917","",0.16942,0,"Uncontrolled","16/05/2006","6",69.27,"Low","Not Rated",NA,0.0827,34.3,147.2,26.9,3.845,0.4,0,NA,1,NA,0,"Unknow"
"SOAD11534","Flumevale","Yes","Fish and Wildlife Pond","Earth",2.769,0.69,NA,"1932","",0.26989,218.38978,"Uncontrolled","02/08/2006","0",64.04,"Low","Not Rated",NA,0.0803,437.6,125,NA,2.769,0.69,0,NA,1,NA,0,"Unknow"
"SOAD18217","Flumevale","Yes","Flood Risk Reduction","Earth",12.787,0.367,55525,"1961","",0.16942,15.97974,"","23/09/2021","1",0.16,"High","Satisfactory","2017-09-01",0.087,23.3,512,NA,12.787,0.367,0,55525,0,10.9246066585059,0,"Unknow"
"SOAD09517","Flumevale","Yes","Water Supply","Earth",11.372,0.202,35787,"1962","",0.12214,2.66329,"","04/02/2022","0.5",3.88,"Low","Satisfactory","2017-09-01",0.0753,41.7,514.5,65.7,11.372,0.202,0,35787,0,10.4853679206675,0,"Unknow"
"SOAD12480","Flumevale","Yes","Irrigation","Earth",12.677,0.095,29956,"1960","",0.09456,7.98987,"Uncontrolled","21/09/2018","6",4.6,"Low","Satisfactory","2017-07-20",0.0407,34.1,588.2,5.3,12.677,0.095,0,29956,0,10.3075182991061,0,"Unknow"
"SOAD12993","Flumevale","Yes","Water Supply","Earth",5.14,0.953,0,"Unknow","",0.10244,NA,"","19/10/2022","1",0.16,"High","Fair","2017-09-01",0.1053,36.3,492.7,67.4,5.14,0.953,0,NA,1,NA,0,"Unknow"
"SOAD14271","Flumevale","Yes","Unknow","Earth",8.01,0.102,0,"1910","",0.08077,29.29619,"Uncontrolled","07/04/1995","0",41.96,"Low","Not Rated",NA,0.127,44.5,172.8,NA,8.01,0.102,0,NA,1,NA,0,"Unknow"
"SOAD16416","Flumevale","Yes","Irrigation","Earth",14.179,0.092,0,"1952","",0.06698,29.29619,"Uncontrolled","13/09/2021","6",29.44,"Low","Satisfactory","2020-05-12",0.0427,42.7,428,46.3,14.179,0.092,0,NA,1,NA,0,"Unknow"
"SOAD17891","Flumevale","Yes","Water Supply","Earth",7.733,0.153,15000,"1918","",0.17533,NA,"","09/06/2022","1",15.82,"Significant","Satisfactory","2017-09-01",0.1149,39.8,242.1,63.4,7.733,0.153,0,15000,0,9.61587214452889,0,"Unknow"
"SOAD11236","Flumevale","Yes","Flood Risk Reduction","Earth",7.656,0.583,33964,"2009","",0.12411,21.30632,"","28/02/2022","1",0,"High","Satisfactory","2017-09-01",0.1023,23.1,882.1,NA,7.656,0.583,0,33964,0,10.4330858616254,0,"Unknow"
"SOAD17682","Flumevale","Yes","Irrigation","Earth",7.55,0.007,675,"1913","",0.08274,0,"","30/07/2015","6",46.73,"Low","Not Rated",NA,0.091,27.6,238.3,13.3,7.55,0.007,0,675,0,6.51619307604296,0,"Unknow"
"SOAD02779","Flumevale","Yes","Flood Risk Reduction","Earth",8.816,0.16,38012,"1958","",0.0886499999999999,7.98987,"Uncontrolled","01/11/2021","3",1.59,"Significant","Satisfactory","2021-11-01",0.1219,35.7,626.8,NA,8.816,0.16,0,38012,0,10.545683485467,0,"Unknow"
"SOAD04259","Flumevale","Yes","Flood Risk Reduction","Earth",12.122,0.667,2e+05,"1979","",0.29156,45.27593,"","10/03/2022","1",0,"High","Satisfactory","2017-09-01",0.0924,446,358.7,NA,12.122,0.667,0,2e+05,0,12.2060776455177,0,"Unknow"
"SOAD02172","Flumevale","Yes","Irrigation","Earth",7.417,0.183,3043,"1949","",0.20882,0,"","08/06/2021","6",14.67,"Low","Satisfactory","2016-04-08",0.062,30,473.8,21,7.417,0.183,0,3043,0,8.02092771898158,0,"Unknow"
"SOAD11780","Flumevale","Yes","Irrigation","Earth",4.351,0.9,30003,"1880","",0.16548,0,"Uncontrolled","24/02/1995","6",3.14,"Low","Not Rated",NA,0.0474,7.4,756.4,25.9,4.351,0.9,0,30003,0,10.3090859850895,0,"Unknow"
"SOAD19040","Flumevale","Yes","Water Supply","Earth",10.442,0.533,62200,"1963","1963;1963;1963;1984;2010",0.06501,0,"Uncontrolled","09/11/2022","1",8.37,"High","Fair","2022-11-09",0.0913,10.3,409.8,69.5,10.442,0.533,0,62200,0,11.0381263557685,5,"2010"
"SOAD03276","Flumevale","Yes","Water Supply","Earth",17.117,0.197,69400,"1964","",0.05713,5.32658,"","13/04/2022","1",NA,"High","Satisfactory","2017-09-01",0.0884,21.9,873.5,42.4,17.117,0.197,0,69400,0,11.147656555613,0,"Unknow"
"SOAD03598","Flumevale","Yes","Irrigation","Earth",9.669,0.165,28518,"1903","",0.08274,7.98987,"Uncontrolled","21/07/2017","6",32.73,"Low","Satisfactory","2020-06-16",0.0532,5.6,207.2,2,9.669,0.165,0,28518,0,10.2583258107999,0,"Unknow"
"SOAD06336","Flumevale","Yes","Irrigation","Earth",4.314,0.417,66093,"1871","",0.13002,0,"Uncontrolled","14/06/1991","6",8.14,"Low","Satisfactory","2014-04-10",0.0425,12.1,336.8,37.5,4.314,0.417,0,66093,0,11.0988332501615,0,"Unknow"
"SOAD08451","Flumevale","Yes","Recreation","Earth",8.793,0.125,9000,"1955","1962F;1962H;1962S;1986H;1986S",0.08077,95.87844,"Uncontrolled","07/07/2022","2",13.42,"Significant","Satisfactory","2022-07-07",0.1035,39.7,98.4,8.7,8.793,0.125,0,9000,0,9.10509096125709,5,"1986"
"SOAD11016","Flumevale","Yes","Water Supply","Earth",9.513,0.31,18300,"1954","",0.18124,55.92909,"","14/06/2022","0.5",NA,"Low","Satisfactory","2017-09-01",0.0694,34.8,8.8,55.9,9.513,0.31,0,18300,0,9.81471098214528,0,"Unknow"
"SOAD00683","Flumevale","Yes","Irrigation","Earth",12.065,0.32,70401,"1950","",0.13002,0,"","14/10/2011","6",19.37,"Low","Not Rated",NA,0.0964,7.8,402.4,26.7,12.065,0.32,0,70401,0,11.1619769508335,0,"Unknow"
"SOAD04798","Flumevale","Yes","Water Supply","Earth",22.999,0.117,30000,"1966","",0.10638,2.66329,"","09/02/2022","0.5",14.11,"Low","Satisfactory","2017-09-01",0.0566,21.4,434,42.6,22.999,0.117,0,30000,0,10.3089859934221,0,"Unknow"
"SOAD14675","Flumevale","Yes","Water Supply","Earth",6.58,0.4,11500,"1879","",0.12411,NA,"","06/04/2022","0.5",NA,"Low","Satisfactory","2017-09-01",0.0671,18.6,5.7,69.9,6.58,0.4,0,11500,0,9.35018926709258,0,"Unknow"
"SOAD14725","Flumevale","Yes","Water Supply","Earth",13.8,0.157,80445,"1968","",0.10835,0,"","03/11/2021","1",4.18,"High","Satisfactory","2017-09-01",0.0925,10.4,340.1,58.3,13.8,0.157,0,80445,0,11.2953414308613,0,"Unknow"
"SOAD17151","Flumevale","Yes","Irrigation","Earth",4.753,0.667,58538,"1879","1991",0.14381,0,"Uncontrolled","28/05/2021","2",8.21,"Significant","Satisfactory","2021-05-28",0.1365,27.6,219.9,27.5,4.753,0.667,0,58538,0,10.9774484777631,1,"1991"
"SOAD17422","Flumevale","Yes","Irrigation","Earth",3.65,0.081,1548,"1912","1996H;1996M;1996S",0.15563,7.98987,"Uncontrolled","21/05/2004","6",29.07,"Low","Not Rated",NA,0.0948,30.1,177.2,23.8,3.65,0.081,0,1548,0,7.34536484041687,3,"1996"
"SOAD18324","Flumevale","Yes","Other","Earth",10.497,0.128,22500,"2003","",0.12017,2.66329,"","15/03/2022","1",7.27,"High","Satisfactory","2017-09-01",0.1036,17.1,351.4,NA,10.497,0.128,0,22500,0,10.0213150316493,0,"Unknow"
"SOAD19442","Flumevale","Yes","Irrigation","Earth",16.252,0.087,NA,"1953","",0.01773,0,"","29/06/1992","0",3.07,"Low","Satisfactory","2019-08-16",0.063,14.4,609.4,20,16.252,0.087,0,NA,1,NA,0,"Unknow"
"SOAD02762","Flumevale","Yes","Irrigation","Earth",4.833,0.27,0,"1892","",0.15169,0,"Uncontrolled","17/01/1986","6",6.66,"Low","Fair","2017-02-21",0.0572,6.5,375.9,18.8,4.833,0.27,0,NA,1,NA,0,"Unknow"
"SOAD04631","Flumevale","Yes","Flood Risk Reduction","Earth",8.039,0.1,0,"1962","",0.15957,7.98987,"","18/11/2021","6",29.51,"Low","Satisfactory","2013-09-26",0.0463,6.8,152.4,NA,8.039,0.1,0,NA,1,NA,0,"Unknow"
"SOAD08222","Flumevale","Yes","Water Supply","Earth",13.232,0.195,39000,"1951","",0.10441,5.32658,"","21/09/2021","1",0.16,"Significant","Satisfactory","2017-09-01",0.1092,11.6,883.7,47.4,13.232,0.195,0,39000,0,10.5713425658087,0,"Unknow"
"SOAD13948","Flumevale","Yes","Water Supply","Earth",6.88,0.517,32300,"1980","",0.197,2.66329,"","03/05/2022","0.5",NA,"Low","Satisfactory","2017-09-01",0.0631,40.6,15.5,63.9,6.88,0.517,0,32300,0,10.3828534684838,0,"Unknow"
"SOAD16943","Flumevale","Yes","Fire Protection, Stock, Or Small Fish Pond","Earth",2.517,0.267,4886,"1936","",0.1182,0,"","29/06/1988","0",72.55,"Low","Not Rated",NA,0.1162,41.1,71.1,NA,2.517,0.267,0,4886,0,8.49433389727015,0,"Unknow"
"SOAD17417","Flumevale","Yes","Flood Risk Reduction","Earth",10.722,0.197,25640,"1960","",0.11426,15.97974,"","04/04/2019","3",32.78,"Low","Not Rated",NA,0.0998,36.7,151.8,NA,10.722,0.197,0,25640,0,10.1519479118341,0,"Unknow"
"SOAD20538","Flumevale","Yes","Recreation","Earth",9.416,0.05,NA,"1964","2004",0.10441,159.7974,"Uncontrolled","11/05/2009","6",3.14,"Low","Satisfactory","2009-05-01",0.0528,38.3,738.4,6.4,9.416,0.05,0,NA,1,NA,1,"2004"
"SOAD00546","Flumevale","Yes","Water Supply","Earth",7.29,0.067,4000,"1925","",0.10441,0,"","30/06/2022","0.5",NA,"Low","Satisfactory","2017-09-01",0.0686,19.6,23.2,35,7.29,0.067,0,4000,0,8.29429960885724,0,"Unknow"
"SOAD02264","Flumevale","Yes","Other","Earth",27.187,0.173,76000,"1983","",0.05122,0,"","13/04/2022","1",1.59,"High","Satisfactory","2017-09-01",0.0778,19.9,761.2,NA,27.187,0.173,0,76000,0,11.2385017770766,0,"Unknow"
"SOAD06281","Flumevale","Yes","Flood Risk Reduction","Earth",4.753,1.033,35000,"1958","",0.29944,13.31645,"","28/02/2022","1",NA,"High","Satisfactory","2017-09-01",0.0974,368.9,689.6,NA,4.753,1.033,0,35000,0,10.463131911492,0,"Unknow"
"SOAD07448","Flumevale","Yes","Water Supply","Earth",8.094,0.197,34600,"1980","",0.08274,0,"","09/02/2022","1",0,"High","Satisfactory","2017-09-01",0.0948,14,277.3,67.9,8.094,0.197,0,34600,0,10.4516378623623,0,"Unknow"
"SOAD13604","Flumevale","Yes","Irrigation","Earth",3.631,0.05,2123,"1902","",0.17336,0,"","22/09/2017","6",17.96,"Low","Not Rated",NA,0.0871,35.4,150.1,46,3.631,0.05,0,2123,0,7.66105638236183,0,"Unknow"
"SOAD07330","Flumevale","Yes","Water Supply","Earth",7.602,0.272,NA,"1889","1906",0.0906199999999999,0,"Uncontrolled","18/08/2021","2",7.9,"Significant","Satisfactory","2021-08-18",0.1393,5.2,171.5,27.6,7.602,0.272,0,NA,1,NA,1,"1906"
"SOAD07607","Flumevale","Yes","Irrigation","Earth",2.536,0.43,6799,"1900","1993",0.19109,0,"Uncontrolled","11/02/2021","6",0,"Low","Fair","2015-05-22",0.0471,6.2,480.4,6.7,2.536,0.43,0,6799,0,8.8246778911642,1,"1993"
"SOAD12528","Flumevale","Yes","Irrigation","Earth",12.139,0.155,26643,"1913","1989S",0.06895,21.30632,"Uncontrolled","26/05/2022","6",41.22,"Low","Not Rated",NA,0.0875,34.1,88.2,23.8,12.139,0.155,0,26643,0,10.1903192635331,1,"1989"
"SOAD19451","Flumevale","Yes","Water Supply","Earth",5.617,0.417,14500,"1962","",0.22261,5.32658,"","18/04/2022","0.5",NA,"Low","Satisfactory","2017-09-01",0.0778,37.8,22.8,13.8,5.617,0.417,0,14500,0,9.5819728915479,0,"Unknow"
"SOAD00282","Flumevale","Yes","Irrigation","Earth",6.217,0.13,11896,"1964","",0.12214,13.31645,"","19/07/2017","6",18.65,"Low","Not Rated",NA,0.0703,13.2,98.1,9.7,6.217,0.13,0,11896,0,9.38404154647653,0,"Unknow"
"SOAD04858","Flumevale","Yes","Flood Risk Reduction","Earth",20.063,0.147,71000,"1963","",0.14381,45.27593,"","22/07/2022","1",0,"High","Satisfactory","2017-09-01",0.0897,37.4,788.3,NA,20.063,0.147,0,71000,0,11.1704492404313,0,"Unknow"
"SOAD07693","Flumevale","Yes","Flood Risk Reduction","Earth",10.119,0.25,NA,"1888","",0.08274,21.30632,"","11/05/1998","6",20.08,"Low","Not Rated",NA,0.0748,12.3,321.1,NA,10.119,0.25,0,NA,1,NA,0,"Unknow"
"SOAD08291","Flumevale","Yes","Irrigation","Earth",5.712,0.342,32937,"1908","",0.0591,0,"","27/06/2018","6",22.78,"Low","Satisfactory","2019-05-15",0.0399,24.7,368.6,9.8,5.712,0.342,0,32937,0,10.4023822854342,0,"Unknow"
"SOAD09342","Flumevale","Yes","Recreation","Earth",12.877,0.09,0,"1957","2019",0.06107,133.1645,"Uncontrolled","26/07/2021","6",8.21,"Low","Fair","2013-10-08",0.0385,31.2,394.2,6.1,12.877,0.09,0,NA,1,NA,1,"2019"
"SOAD11919","Flumevale","Yes","Water Supply","Earth",7.177,0.233,0,"Unknow","",0.09653,NA,"","18/04/2023","1",3.81,"High","Fair","2017-09-01",0.1046,34.6,794.8,54.2,7.177,0.233,0,NA,1,NA,0,"Unknow"
"SOAD14054","Flumevale","Yes","Water Supply","Earth",15.772,0.11,12000,"1961","",0.08668,10.65316,"","07/04/2022","0.5",NA,"Low","Satisfactory","2017-09-01",0.0678,28.1,12.6,32.9,15.772,0.11,0,12000,0,9.39274525863144,0,"Unknow"
"SOAD15641","Flumevale","Yes","Water Supply","Earth",8.717,0.78,NA,"1973","",0.07486,0,"Uncontrolled","14/06/2012","6",1.56,"Low","Satisfactory","2011-06-22",0.0484,8.6,753.6,5.5,8.717,0.78,0,NA,1,NA,0,"Unknow"
"SOAD18792","Flumevale","Yes","Water Supply","Earth",15.109,0.299,42000,"1955","",0.07486,0,"","11/08/2022","1",NA,"Significant","Satisfactory","2017-09-01",0.1152,16.1,380.8,49.3,15.109,0.299,0,42000,0,10.6454487065059,0,"Unknow"
"SOAD04469","Flumevale","Yes","Irrigation","Earth",6.573,2.107,27000,"1974","",0.14184,15.97974,"","","6",42.83,"Low","Satisfactory","2016-06-15",0.0373,27.7,169.2,37.5,6.573,2.107,0,27000,0,10.2036291813376,0,"Unknow"
"SOAD10310","Flumevale","Yes","Recreation","Earth",6.627,0.06,NA,"Unknow","",0.0394,66.58225,"Uncontrolled","31/12/2019","6",67.27,"Low","Not Rated",NA,0.1001,37,108.6,8.5,6.627,0.06,0,NA,1,NA,0,"Unknow"
"SOAD11890","Flumevale","Yes","Other","Earth",12.515,0.112,16237,"1958","",0.12214,13.31645,"","16/11/2021","1",0,"High","Satisfactory","2017-09-01",0.1035,13.3,260.1,NA,12.515,0.112,0,16237,0,9.69510945342239,0,"Unknow"
"SOAD08518","Flumevale","Yes","Recreation","Earth",5.824,0.025,NA,"1965","",0.14184,4157.39569,"","","6",9.99,"Low","Unsatisfactory","2015-08-20",0.0935,22.2,103.6,5.9,5.824,0.025,0,NA,1,NA,0,"Unknow"
"SOAD14477","Flumevale","Yes","Irrigation","Earth",4.734,0.25,17275,"1870","",0.15169,0,"Uncontrolled","31/05/1991","6",3.33,"Low","Satisfactory","2013-09-25",0.0294,41.2,448.7,29.3,4.734,0.25,0,17275,0,9.75707353408059,0,"Unknow"
"SOAD18289","Flumevale","Yes","Recreation","Earth",2.798,0.125,15280,"1889","",0.10441,0,"Uncontrolled","29/09/2013","6",46.31,"Low","Not Rated",NA,0.0644,39.4,71.3,8.4,2.798,0.125,0,15280,0,9.63436550560526,0,"Unknow"
"SOAD03944","Flumevale","Yes","Recreation","Earth",13.491,0.167,NA,"1901","",0.10835,0,"","06/04/2022","1",0,"High","Unsatisfactory","2022-04-06",0.1545,13.8,305.6,3.5,13.491,0.167,0,NA,1,NA,0,"Unknow"
"SOAD06928","Flumevale","Yes","Water Supply","Earth",9.856,0.553,94592,"1981","",0.07683,0,"Uncontrolled","20/04/2022","2",0,"Significant","Satisfactory","2022-04-20",0.131,45,411.6,31.5,9.856,0.553,0,94592,0,11.4573387565305,0,"Unknow"
"SOAD07348","Flumevale","Yes","Irrigation","Earth",2.878,0.25,2176,"1892","",0.22655,0,"Uncontrolled","22/10/1991","6",3.2,"Low","Satisfactory","2006-09-20",0.0399,7.1,769.3,37.6,2.878,0.25,0,2176,0,7.68570306123455,0,"Unknow"
"SOAD14113","Flumevale","Yes","Water Supply","Earth",11.985,0.153,26600,"1959","",0.13199,47.93922,"","24/05/2023","1",NA,"High","Poor","2019-09-04",0.096,9.1,662.2,61.7,11.985,0.153,0,26600,0,10.1887040880481,0,"Unknow"
"SOAD01861","Flumevale","Yes","Irrigation","Earth",7.166,0.187,12444,"1941","",0.10638,7.98987,"Uncontrolled","03/08/2017","6",9.4,"Low","Satisfactory","2009-08-19",0.0605,12,468.5,12.2,7.166,0.187,0,12444,0,9.42907421480169,0,"Unknow"
"SOAD05429","Flumevale","Yes","Irrigation","Earth",4.244,0.492,NA,"2018","2019",0.0985,7.98987,"Uncontrolled","","6",NA,"Low","Fair","2020-11-17",0.0518,30.8,13.2,27.3,4.244,0.492,0,NA,1,NA,1,"2019"
"SOAD10294","Flumevale","Yes","Irrigation","Earth",7.241,0.188,35104,"1952","",0.12805,396.83021,"Uncontrolled","14/04/2016","6",12.92,"Low","Satisfactory","2008-07-02",0.0426,16.7,189.5,10,7.241,0.188,0,35104,0,10.4660988494513,0,"Unknow"
"SOAD13599","Flumevale","Yes","Flood Risk Reduction","Earth",9.574,0.162,17920,"1957","",0.10441,7.98987,"Uncontrolled","07/10/2020","6",18.04,"Low","Fair","2020-10-16",0.0717,8.7,180.1,NA,9.574,0.162,0,17920,0,9.79372848854339,0,"Unknow"
"SOAD16569","Flumevale","Yes","Water Supply","Earth",24.726,0.14,81000,"1987","",0.06501,0,"","26/01/2022","1",5.04,"High","Satisfactory","2017-09-01",0.0948,40.1,348,49,24.726,0.14,0,81000,0,11.3022167792574,0,"Unknow"
"SOAD07232","Flumevale","Yes","Irrigation","Earth",4.354,0.147,4404,"1919","",0.12017,69.24554,"Uncontrolled","","6",40.82,"Low","Not Rated",NA,0.0552,21.4,208.7,11.6,4.354,0.147,0,4404,0,8.39049553837028,0,"Unknow"
"SOAD07323","Flumevale","Yes","Flood Risk Reduction","Earth",9.696,0.7,59000,"1958","",0.18518,37.28606,"","16/02/2022","1",0.16,"High","Satisfactory","2017-09-01",0.1044,15.6,189.5,NA,9.696,0.7,0,59000,0,10.9853096718968,0,"Unknow"
"SOAD09629","Flumevale","Yes","Flood Risk Reduction","Earth",8.705,0.256,23766,"1955","1984S",0.05713,7.98987,"Uncontrolled","13/12/2022","6",4.84,"Low","Unsatisfactory","2006-08-02",0.0993,33.4,531,NA,8.705,0.256,0,23766,0,10.0760533428814,1,"1984"
"SOAD14417","Flumevale","Yes","Water Supply","Earth",12.01,0.207,80000,"1967","",0.12017,0,"","09/03/2022","1",1.5,"High","Satisfactory","2017-09-01",0.0752,10.6,900.7,9,12.01,0.207,0,80000,0,11.2897944135779,0,"Unknow"
"SOAD15074","Flumevale","Yes","Recreation","Earth",16.468,0.13,0,"1963","",0.07289,0,"Uncontrolled","20/10/2022","6",24.65,"Low","Not Rated",NA,0.0435,46.7,187.3,9.1,16.468,0.13,0,NA,1,NA,0,"Unknow"
"SOAD16089","Flumevale","Yes","Flood Risk Reduction","Earth",8.597,0.222,0,"1962","",0.09456,7.98987,"Uncontrolled","10/05/2000","3",9.48,"Low","Satisfactory","2009-08-19",0.0589,7.4,283,NA,8.597,0.222,0,NA,1,NA,0,"Unknow"
"SOAD19107","Flumevale","Yes","Water Supply","Earth",15.892,0.292,NA,"1938","",0.07486,0,"Uncontrolled","05/10/2022","2",4.89,"Significant","Fair","2022-10-05",0.1458,20,217.3,30,15.892,0.292,0,NA,1,NA,0,"Unknow"
"SOAD11198","Flumevale","Yes","Hydroelectric","Earth",6.495,0.062,2000,"1870","",0.14184,2.66329,"Uncontrolled","12/08/2019","3",NA,"Low","Satisfactory","2023-09-29",0.053,12.3,13.3,NA,6.495,0.062,0,2000,0,7.60140233458373,0,"Unknow"
"SOAD12383","Flumevale","Yes","Flood Risk Reduction","Earth",7.55,0.307,NA,"2009","",0.14775,87.88857,"Uncontrolled","08/06/2021","3",0,"Low","Unsatisfactory","2014-11-21",0.1116,25.2,708.4,NA,7.55,0.307,0,NA,1,NA,0,"Unknow"
"SOAD17504","Flumevale","Yes","Irrigation","Earth",7.315,0.303,NA,"1915","",0.14775,0,"","25/10/1979","0",4.7,"Low","Not Rated",NA,0.1021,44.6,706,12.9,7.315,0.303,0,NA,1,NA,0,"Unknow"
"SOAD18034","Flumevale","Yes","Debris Control","Earth",29.92,0.173,2e+05,"1955","",0.05319,21.30632,"","21/09/2023","1",0,"High","Fair","2017-09-01",0.0925,26.4,709.6,NA,29.92,0.173,0,2e+05,0,12.2060776455177,0,"Unknow"
"SOAD18574","Flumevale","Yes","Water Supply","Earth",12.349,0.45,140000,"2003","",0.06107,0,"","28/01/2022","1",0.16,"Significant","Satisfactory","2017-09-01",0.1189,5.4,872.1,12.3,12.349,0.45,0,140000,0,11.8494048444231,0,"Unknow"
"SOAD20017","Flumevale","Yes","Irrigation","Earth",11.194,0.129,18828,"1957","",0.0886499999999999,0,"","13/09/2021","2",24.88,"Significant","Fair","2021-09-13",0.121,9.1,475.4,8.6,11.194,0.129,0,18828,0,9.84315351349643,0,"Unknow"
"SOAD07082","Flumevale","Yes","Recreation","Earth",10.459,0.082,11118,"1957","",0.07486,7.98987,"Uncontrolled","07/07/2021","2",11.17,"Significant","Satisfactory","2021-07-07",0.1204,11.3,349.7,5.9,10.459,0.082,0,11118,0,9.31641063570325,0,"Unknow"
"SOAD07103","Flumevale","Yes","Other","Earth",6.957,0.455,23000,"2003","",0.07092,0,"","","0",1.66,"Low","Satisfactory","2009-04-21",0.0637,43.9,255.3,NA,6.957,0.455,0,23000,0,10.043292972227,0,"Unknow"
"SOAD08988","Flumevale","Yes","Recreation","Earth",16.853,0.083,44800,"1979","2015",0.07289,431.45298,"Uncontrolled","26/08/2021","6",52.12,"Low","Not Rated",NA,0.0702,33.6,121.5,3.7,16.853,0.083,0,44800,0,10.7099857395825,1,"2015"
"SOAD16216","Flumevale","Yes","Other","Earth",16.441,0.433,145500,"1997","",0.04137,0,"Uncontrolled","09/08/2022","1",3.17,"High","Satisfactory","2022-08-09",0.1,43.1,917.8,NA,16.441,0.433,0,145500,0,11.8879382384223,0,"Unknow"
"SOAD01368","Flumevale","Yes","Flood Risk Reduction","Earth",20.012,0.196,44920,"1959","",0.07486,7.98987,"Uncontrolled","13/05/2016","3",1.54,"Low","Satisfactory","2021-08-18",0.0695,37.3,880.5,NA,20.012,0.196,0,44920,0,10.7126606704033,0,"Unknow"
"SOAD07703","Flumevale","Yes","Flood Risk Reduction","Earth",10.332,0.167,17324,"1969","",0.0886499999999999,7.98987,"","18/07/1991","0",51.49,"Low","Not Rated",NA,0.0871,15.9,147.7,NA,10.332,0.167,0,17324,0,9.7599058240581,0,"Unknow"
"SOAD08729","Flumevale","Yes","Water Supply","Earth",8.644,0.087,38000,"1951","",0.10244,74.57212,"","01/11/2021","0.5",NA,"Low","Satisfactory","2017-09-01",0.0655,6.4,8.7,15.2,8.644,0.087,0,38000,0,10.5453677541517,0,"Unknow"
"SOAD13169","Flumevale","Yes","Flood Risk Reduction","Earth",8.589,0.188,19381,"1967","",0.11032,13.31645,"Uncontrolled","18/07/1991","3",27.93,"Low","Satisfactory","2003-10-10",0.0602,34,120.9,NA,8.589,0.188,0,19381,0,9.8721000792945,0,"Unknow"
"SOAD17402","Flumevale","Yes","Water Supply","Earth",49.492,0.207,3e+05,"1963","",0.05122,0,"","15/06/2022","1",0,"High","Satisfactory","2017-09-01",0.0903,26.1,753.4,51,49.492,0.207,0,3e+05,0,12.6115410869661,0,"Unknow"
"SOAD20376","Flumevale","Yes","Flood Risk Reduction","Earth",27.741,0.15,177500,"1958","",0.05516,7.98987,"Uncontrolled","01/11/2020","2",16.94,"Low","Not Available",NA,0.1191,37.3,131.8,NA,27.741,0.15,0,177500,0,12.0867315216846,0,"Unknow"
"SOAD00308","Flumevale","Yes","Irrigation","Earth",8.676,0.179,25684,"1910","",0.12214,0,"","17/09/2018","6",35.14,"Low","Fair","2018-10-19",0.0569,41.1,122.8,42.1,8.676,0.179,0,25684,0,10.1536624429014,0,"Unknow"
"SOAD06003","Flumevale","Yes","Water Supply","Earth",8.214,0.167,16000,"1958","",0.12411,2.66329,"","12/01/2022","1",1.64,"High","Satisfactory","2017-09-01",0.0883,35,811.3,47.2,8.214,0.167,0,16000,0,9.68040649926887,0,"Unknow"
"SOAD06405","Flumevale","No","Recreation","Earth",7.495,0.5,NA,"1887","",0.02561,NA,"Uncontrolled","19/05/2021","4",53.24,"Low","Unsatisfactory","2016-08-04",0.1035,14.3,121.9,7.3,7.495,0.5,0,NA,1,NA,0,"Unknow"
"SOAD10333","Flumevale","Yes","Irrigation","Earth",4.346,0.17,NA,"2007","",0.20291,34.62277,"Uncontrolled","23/04/2018","6",36.46,"Low","Fair","2018-04-10",0.0738,8.8,76.2,5,4.346,0.17,0,NA,1,NA,0,"Unknow"
"SOAD13466","Flumevale","Yes","Water Supply","Earth",13.494,0.158,29600,"1877","",0.06895,0,"","21/07/2021","1",0,"Significant","Satisfactory","2017-09-01",0.1048,43,370.4,31.7,13.494,0.158,0,29600,0,10.2955634235253,0,"Unknow"
"SOAD14130","Flumevale","Yes","Other","Earth",18.314,0.347,80960,"1907","",0.14775,7.98987,"","17/05/2022","1",6.34,"Significant","Satisfactory","2017-09-01",0.1077,35.6,473.8,NA,18.314,0.347,0,80960,0,11.3017228362237,0,"Unknow"
"SOAD14299","Flumevale","Yes","Irrigation","Earth",6.244,0.048,2852,"1889","1968H;1968M;1968S",0.16942,0,"Uncontrolled","09/08/2018","6",12.73,"Low","Not Rated",NA,0.0934,7.9,320.7,25.5,6.244,0.048,0,2852,0,7.9561263512135,3,"1968"
"SOAD16175","Flumevale","Yes","Irrigation","Earth",7.837,0.233,NA,"1940","",0.14184,7.98987,"","01/10/1987","0",45.02,"Low","Not Rated",NA,0.066,41.1,194.6,31.9,7.837,0.233,0,NA,1,NA,0,"Unknow"
"SOAD18588","Flumevale","Yes","Other","Earth",14.146,0.306,55500,"2009","",0.08077,7.98987,"","16/03/2022","0.5",NA,"Low","Satisfactory","2017-09-01",0.0582,30.6,19.1,NA,14.146,0.306,0,55500,0,10.9241563175902,0,"Unknow"
"SOAD07241","Flumevale","Yes","Water Supply","Earth",5.072,0.667,29730,"1879","",0.13002,0,"Uncontrolled","25/09/2013","6",3.12,"Low","Satisfactory","2018-06-12",0.0418,21.6,766.8,65.6,5.072,0.667,0,29730,0,10.2999455514843,0,"Unknow"
"SOAD08395","Flumevale","Yes","Irrigation","Earth",12.573,0.1,NA,"1969","",0.02561,55.92909,"","17/07/1987","6",39.79,"Low","Satisfactory","2015-09-08",0.0498,7.1,54.6,18.7,12.573,0.1,0,NA,1,NA,0,"Unknow"
"SOAD09205","Flumevale","Yes","Water Supply","Earth",9.868,0.265,19125,"1955","",0.16154,0,"","22/07/2022","1",NA,"Significant","Satisfactory","2017-09-01",0.1252,14.6,276.3,19,9.868,0.265,0,19125,0,9.85880394490949,0,"Unknow"
"SOAD13848","Flumevale","No","Other","Earth",28.539,0.1,NA,"Unknow","",NA,NA,"","","Unknow",11.02,"High","Not Available",NA,0.0994,703.2,352.4,NA,28.539,0.1,0,NA,1,NA,0,"Unknow"
"SOAD13897","Flumevale","Yes","Water Supply","Earth",6.853,0.233,20000,"1875","",0.12411,0,"","24/05/2023","0.5",NA,"Low","Poor","2021-11-10",0.0983,21.6,20.6,60.4,6.853,0.233,0,20000,0,9.90353755128617,0,"Unknow"
"SOAD00230","Flumevale","Yes","Water Supply","Earth",13.235,0.39,44450,"1957","",0.0925899999999999,0,"","04/05/2020","6",3.23,"Low","Satisfactory","2019-02-15",0.0411,37.5,480.9,58.8,13.235,0.39,0,44450,0,10.7021427378768,0,"Unknow"
"SOAD06356","Flumevale","Yes","Water Supply","Earth",7.067,0.2,6500,"1949","",0.06698,7.98987,"","26/08/2020","6",23.31,"Low","Satisfactory","2017-08-24",0.0365,21.4,186.9,30.5,7.067,0.2,0,6500,0,8.77971129020447,0,"Unknow"
"SOAD16118","Flumevale","Yes","Water Supply","Earth",16.946,0.067,21000,"1955","",0.0925899999999999,0,"","21/04/2022","1",0.93,"High","Satisfactory","2017-09-01",0.0863,35.6,791,48.4,16.946,0.067,0,21000,0,9.95232533461943,0,"Unknow"
"SOAD17059","Flumevale","Yes","Water Supply","Earth",15.535,0.118,29500,"1952","",0.10441,2.66329,"","01/09/2022","1",6.5,"High","Satisfactory","2017-09-01",0.1185,14.8,382.8,29.2,15.535,0.118,0,29500,0,10.2921794400585,0,"Unknow"
"SOAD18127","Flumevale","Yes","Recreation","Earth",6.043,0.667,NA,"Unknow","1995",0.10047,0,"Uncontrolled","13/04/2022","2",0,"Significant","Unsatisfactory","2022-04-13",0.1532,18.6,896,7.7,6.043,0.667,0,NA,1,NA,1,"1995"
"SOAD19001","Flumevale","Yes","Debris Control","Earth",19.728,0.123,140000,"1996","",0.04925,18.64303,"","09/08/2022","1",0.34,"High","Satisfactory","2017-09-01",0.0899,11.6,420.2,NA,19.728,0.123,0,140000,0,11.8494048444231,0,"Unknow"
"SOAD02309","Flumevale","Yes","Water Supply","Earth",7.192,0.433,0,"1918","",0.12805,0,"Uncontrolled","09/08/1989","0",24.04,"Low","Satisfactory","2017-08-09",0.0775,18.3,185.1,24.4,7.192,0.433,0,NA,1,NA,0,"Unknow"
"SOAD06459","Flumevale","Yes","Fire Protection, Stock, Or Small Fish Pond","Earth",11.032,0.15,45037,"1970","",0.04137,7.98987,"Uncontrolled","05/07/2018","6",42.54,"Low","Not Rated",NA,0.0545,15.9,210.9,NA,11.032,0.15,0,45037,0,10.7152618568543,0,"Unknow"
"SOAD08458","Flumevale","No","Flood Risk Reduction","Earth",13.493,0.087,0,"1915","1983",NA,0,"Controlled","01/06/2022","Unknow",NA,"Significant","Not Available",NA,0.1317,344.1,309.9,NA,13.493,0.087,0,NA,1,NA,1,"1983"
"SOAD11471","Flumevale","Yes","Flood Risk Reduction","Earth",4.343,0.356,23084,"1951","",0.07486,0,"Uncontrolled","19/11/1998","6",0,"Low","Fair","2020-10-06",0.0529,39.1,362.9,NA,4.343,0.356,0,23084,0,10.0469383349411,0,"Unknow"
"SOAD11924","Flumevale","Yes","Water Supply","Earth",14.203,0.11,30500,"1956","",0.09456,5.32658,"","18/04/2022","1",3.25,"High","Satisfactory","2017-09-01",0.0732,29.7,878.2,52.4,14.203,0.11,0,30500,0,10.3255147489433,0,"Unknow"
"SOAD16278","Flumevale","Yes","Water Supply","Earth",15.221,0.203,130000,"1911","",0.08471,2.66329,"","08/06/2022","0.5",NA,"Low","Satisfactory","2017-09-01",0.0704,18.4,16.9,22.4,15.221,0.203,0,130000,0,11.7752974217158,0,"Unknow"
"SOAD17715","Flumevale","Yes","Water Supply","Earth",21.433,0.183,125000,"1997","",0.07289,2.66329,"","24/08/2022","0.5",NA,"Low","Satisfactory","2017-09-01",0.0617,11.6,23.3,12.5,21.433,0.183,0,125000,0,11.7360770162524,0,"Unknow"
"SOAD19860","Flumevale","Yes","Irrigation","Earth",11.349,0.127,9395,"1957","",0.12608,29.29619,"Uncontrolled","11/03/2020","6",4.67,"Low","Fair","2020-06-10",0.0578,34.8,244.5,33.3,11.349,0.127,0,9395,0,9.1480393457788,0,"Unknow"
"SOAD00454","Flumevale","Yes","Irrigation","Earth",5.724,0.14,5227,"1926","1985",0.11229,15.97974,"Uncontrolled","14/06/2016","6",20.23,"Low","Not Rated",NA,0.096,6.5,296.7,20,5.724,0.14,0,5227,0,8.56178407474411,1,"1985"
"SOAD06444","Flumevale","Yes","Irrigation","Earth",6.339,0.45,NA,"1919","",0.16351,0,"","14/11/1991","0",111.09,"Low","Not Rated",NA,0.0968,21.9,159.2,20.7,6.339,0.45,0,NA,1,NA,0,"Unknow"
"SOAD14458","Flumevale","Yes","Flood Risk Reduction","Earth",18.735,0.128,0,"Unknow","",NA,NA,"","15/02/2023","1",0.77,"High","Fair","2022-05-06",0.104,648.9,564.8,NA,18.735,0.128,0,NA,1,NA,0,"Unknow"
"SOAD00093","Flumevale","Yes","Water Supply","Earth",14.67,0.112,22196,"1971","",0.18715,21.30632,"","24/09/2021","1",NA,"Significant","Satisfactory","2017-09-01",0.1262,10.9,371.6,53.1,14.67,0.112,0,22196,0,10.0077124235937,0,"Unknow"
"SOAD05738","Flumevale","Yes","Irrigation","Earth",3.421,NA,25000,"2016","",0.08668,0,"","","0",NA,"Low","Not Rated",NA,0.0959,47.6,6.3,7.6,3.421,NA,1,25000,0,10.1266711030504,0,"Unknow"
"SOAD06512","Flumevale","Yes","Irrigation","Earth",8.899,0.207,43125,"1915","1991S",0.08668,98.54173,"Uncontrolled","26/05/2015","6",12.97,"Low","Fair","2021-08-03",0.0457,43.8,277.5,4.7,8.899,0.207,0,43125,0,10.6718813424706,1,"1991"
"SOAD10171","Flumevale","No","Recreation","Earth",5.348,0.05,971,"Unknow","",0,7.98987,"Uncontrolled","02/08/2017","10",35.2,"Low","Not Rated",NA,0.0365,14.4,186.1,9.3,5.348,0.05,0,971,0,6.87935580446044,0,"Unknow"
"SOAD18938","Flumevale","Yes","Other","Earth",12.05,0.275,89611,"1928","",0.12805,138.49108,"","26/10/2021","1",0,"High","Satisfactory","2017-09-01",0.095,25.9,652.8,NA,12.05,0.275,0,89611,0,11.4032445185668,0,"Unknow"
"SOAD19692","Flumevale","Yes","Irrigation","Earth",7.998,0.084,17115,"1906","",0.12805,0,"Uncontrolled","24/07/2018","6",38.44,"Low","Satisfactory","2015-06-17",0.0523,35.3,178.9,32.3,7.998,0.084,0,17115,0,9.74776897753671,0,"Unknow"
"SOAD09734","Flumevale","Yes","Water Supply","Earth",7.079,0.197,8600,"1959","",0.30535,5.32658,"","09/12/2021","0.5",NA,"Low","Satisfactory","2017-09-01",0.0731,284.6,10,18.3,7.079,0.197,0,8600,0,9.05963375455148,0,"Unknow"
"SOAD17275","Flumevale","Yes","Water Supply","Earth",16.621,0.49,68000,"1952","",0.05319,NA,"","19/01/2022","1",0,"High","Satisfactory","2017-09-01",0.0988,43.6,417.5,32.1,16.621,0.49,0,68000,0,11.1272776899325,0,"Unknow"
"SOAD03358","Flumevale","Yes","Water Supply","Earth",13.943,0.417,70000,"1978","",0.1182,0,"","22/03/2022","0.5",NA,"Low","Satisfactory","2017-09-01",0.0731,26,23.5,44.5,13.943,0.417,0,70000,0,11.1562648066437,0,"Unknow"
"SOAD05249","Flumevale","Yes","Water Supply","Earth",22.931,0.253,86700,"1938","",0.06895,5.32658,"","18/05/2022","1",1.71,"High","Satisfactory","2017-09-01",0.0953,38.6,514,18.4,22.931,0.253,0,86700,0,11.3702206967275,0,"Unknow"
"SOAD06812","Flumevale","Yes","Flood Risk Reduction","Earth",19.065,0.35,0,"1979","1996",0.07683,10.65316,"Uncontrolled","20/10/2011","6",4.65,"Low","Not Available",NA,0.0774,35.2,520.1,NA,19.065,0.35,0,NA,1,NA,1,"1996"
"SOAD18317","Flumevale","Yes","Irrigation","Earth",8.027,0.042,3160,"1964","",0.08077,0,"","06/09/2018","6",23.38,"Low","Not Rated",NA,0.0654,16.7,420.1,8.8,8.027,0.042,0,3160,0,8.05864371221562,0,"Unknow"
"SOAD18970","Flumevale","Yes","Irrigation","Earth",5.006,0.261,24942,"1954","",0.09653,0,"Uncontrolled","01/01/2010","0",3.23,"Low","Fair","2021-09-20",0.0862,13.2,843.4,10.2,5.006,0.261,0,24942,0,10.1243485006928,0,"Unknow"
"SOAD19836","Flumevale","Yes","Recreation","Earth",7.791,0.283,42891,"1907","",0.14578,0,"Uncontrolled","25/09/2013","6",6.69,"Low","Fair","2015-05-28",0.0385,11.3,206,8,7.791,0.283,0,42891,0,10.66644060734,0,"Unknow"
"SOAD03985","Flumevale","Yes","Recreation","Earth",5.102,0.177,1681,"1939","",0.16351,7.98987,"Uncontrolled","09/07/2014","10",9.36,"Low","Not Rated",NA,0.0258,38.8,195.2,6,5.102,0.177,0,1681,0,7.42773884053289,0,"Unknow"
"SOAD13880","Flumevale","Yes","Water Supply","Earth",28.349,0.317,160000,"1981","",0.06501,0,"","24/03/2022","1",0.5,"High","Satisfactory","2017-09-01",0.0811,30.6,316.9,8,28.349,0.317,0,160000,0,11.9829353441964,0,"Unknow"
"SOAD17709","Flumevale","Yes","Irrigation","Earth",6.345,0.083,NA,"1926","",0.0985,13.31645,"","07/09/2018","6",30.06,"Low","Fair","2007-06-15",0.0574,11.3,115.2,21.8,6.345,0.083,0,NA,1,NA,0,"Unknow"
"SOAD08150","Flumevale","Yes","Flood Risk Reduction","Earth",9.537,0.183,20804,"1957","",0.09653,15.97974,"Uncontrolled","01/11/2011","3",7.76,"Low","Not Rated",NA,0.1227,35.5,335.5,NA,9.537,0.183,0,20804,0,9.94294862141704,0,"Unknow"
"SOAD01146","Flumevale","Yes","Recreation","Earth",8.754,0.029,NA,"1930","",0.08077,37.28606,"Uncontrolled","05/09/2018","6",34.83,"Low","Fair","2013-09-25",0.0684,27.3,56.7,9.5,8.754,0.029,0,NA,1,NA,0,"Unknow"
"SOAD01301","Flumevale","Yes","Irrigation","Earth",4.125,0.3,NA,"1991","2012",0.17336,0,"Uncontrolled","14/07/2015","6",11.39,"Low","Fair","2020-11-17",0.0664,27.3,160.5,20.4,4.125,0.3,0,NA,1,NA,1,"2012"
"SOAD10366","Flumevale","Yes","Water Supply","Earth",10.213,0.135,16400,"1964","",0.18715,7.98987,"","02/11/2021","0.5",NA,"Low","Satisfactory","2017-09-01",0.0756,23.5,10.8,11.2,10.213,0.135,0,16400,0,9.70509758756311,0,"Unknow"
"SOAD12574","Flumevale","Yes","Irrigation","Earth",4.369,0.367,18220,"1885","",0.16548,0,"Uncontrolled","01/10/2013","6",7.71,"Low","Satisfactory","2013-09-24",0.0433,20,476.9,40,4.369,0.367,0,18220,0,9.81033005404988,0,"Unknow"
"SOAD12867","Flumevale","Yes","Water Supply","Earth",7.77,0.533,62156,"1964","",0.07289,7.98987,"","10/06/2020","6",17.89,"Low","Fair","2011-10-11",0.0715,15.6,218.4,22.8,7.77,0.533,0,62156,0,11.0374187213286,0,"Unknow"
"SOAD14264","Flumevale","Yes","Fire Protection, Stock, Or Small Fish Pond","Earth",5.412,0.353,18285,"1954","",0.10244,50.60251,"Uncontrolled","29/09/1994","6",61,"Low","Satisfactory","2020-09-29",0.0408,15.3,237.7,NA,5.412,0.353,0,18285,0,9.81389101872437,0,"Unknow"
"SOAD15760","Flumevale","Yes","Recreation","Earth",11.416,0.22,0,"1960","",0.0886499999999999,0,"Uncontrolled","22/10/2021","6",1.61,"Low","Satisfactory","2021-06-09",0.0344,41.2,744.5,3.1,11.416,0.22,0,NA,1,NA,0,"Unknow"
"SOAD09341","Flumevale","Yes","Water Supply","Earth",16.983,0.183,28000,"1968","",0.1182,2.66329,"","08/06/2022","0.5",NA,"Low","Satisfactory","2017-09-01",0.0802,5.9,6.7,41.2,16.983,0.183,0,28000,0,10.2399955028053,0,"Unknow"
"SOAD03987","Flumevale","Yes","Other","Earth",4.696,0.19,5807,"1964","",0.42946,23.96961,"","11/05/2022","0.5",NA,"Low","Satisfactory","2017-09-01",0.0644,393.3,17,NA,4.696,0.19,0,5807,0,8.66699155650463,0,"Unknow"
"SOAD10961","Flumevale","Yes","Water Supply","Earth",2.707,0.225,NA,"1909","2000",0.14972,0,"","27/06/1979","6",1.56,"Low","Not Rated",NA,0.0691,6.1,591.7,52,2.707,0.225,0,NA,1,NA,1,"2000"
"SOAD13165","Flumevale","Yes","Other","Earth",11.792,0.17,14500,"1962","",0.14184,23.96961,"","21/06/2022","0.5",NA,"Low","Satisfactory","2017-09-01",0.0546,30.4,19,NA,11.792,0.17,0,14500,0,9.5819728915479,0,"Unknow"
"SOAD04082","Flumevale","Yes","Water Supply","Earth",24.697,0.16,93700,"1943","",0.05122,0,"","02/11/2021","1",0.82,"High","Satisfactory","2017-09-01",0.0889,45.7,167.1,32.7,24.697,0.16,0,93700,0,11.4478641405282,0,"Unknow"
"SOAD08680","Flumevale","Yes","Irrigation","Earth",6.59,0.098,NA,"1926","",0.08274,0,"","07/09/2018","6",28.13,"Low","Satisfactory","2018-08-29",0.0324,22,222.2,30.3,6.59,0.098,0,NA,1,NA,0,"Unknow"
"SOAD15699","Flumevale","Yes","Irrigation","Earth",10.899,0.19,26840,"1906","1962",0.11229,21.30632,"Uncontrolled","14/12/2011","6",17.47,"Low","Not Rated",NA,0.0394,8.7,378.2,23.3,10.899,0.19,0,26840,0,10.1976858482157,1,"1962"
"SOAD19975","Flumevale","Yes","Fish and Wildlife Pond","Earth",6.184,0.343,NA,"1928","",0.25019,170.45056,"","27/06/1989","0",88.3,"Low","Not Rated",NA,0.0677,432.1,231.5,NA,6.184,0.343,0,NA,1,NA,0,"Unknow"
"SOAD06259","Flumevale","Yes","Fish and Wildlife Pond","Earth",15.797,0.103,NA,"1988","",0.06698,7.98987,"Uncontrolled","08/09/2021","6",26.19,"Low","Not Rated",NA,0.0437,25,176.4,NA,15.797,0.103,0,NA,1,NA,0,"Unknow"
"SOAD20679","Flumevale","Yes","Irrigation","Earth",6.89,0.364,NA,"1989","",0.06107,50.60251,"Uncontrolled","03/06/2016","6",1.54,"Low","Not Rated",NA,0.0804,41.7,481.7,15.3,6.89,0.364,0,NA,1,NA,0,"Unknow"
"SOAD04723","Flumevale","Yes","Irrigation","Earth",10.138,0.163,47187,"1918","",0.08274,0,"Uncontrolled","16/07/2015","6",71.57,"Low","Not Rated",NA,0.0877,13.7,66.1,23.2,10.138,0.163,0,47187,0,10.7618949019617,0,"Unknow"
"SOAD12744","Flumevale","Yes","Fire Protection, Stock, Or Small Fish Pond","Earth",3.46,1.167,10693,"1909","",0.34475,1326.31842,"","23/04/2009","6",36.22,"Low","Not Rated",NA,0.0924,264.7,54.3,NA,3.46,1.167,0,10693,0,9.27743811550868,0,"Unknow"
"SOAD13896","Flumevale","Yes","Irrigation","Earth",5.83,0.233,7800,"1912","2011",0.15366,0,"Uncontrolled","09/07/2020","6",12.78,"Low","Fair","2019-10-28",0.0756,26.7,185.3,17.3,5.83,0.233,0,7800,0,8.96200720958831,1,"2011"
"SOAD15918","Flumevale","Yes","Flood Risk Reduction","Earth",11.402,0.188,22314,"1971","",0.10835,21.30632,"Uncontrolled","07/10/1998","0",8.29,"Low","Fair","2019-06-05",0.0884,20.1,266,NA,11.402,0.188,0,22314,0,10.0130143770634,0,"Unknow"
"SOAD18797","Flumevale","Yes","Recreation","Earth",6.692,0.055,1683,"1975","",0.14578,0,"","03/10/2022","6",21.69,"Low","Not Rated",NA,0.0498,43.5,128.4,7.1,6.692,0.055,0,1683,0,7.42892719480227,0,"Unknow"
"SOAD05055","Flumevale","Yes","Fish and Wildlife Pond","Earth",8.356,0.2,0,"1906","2014",0.1182,0,"Uncontrolled","14/02/2019","6",0,"Low","Satisfactory","2014-10-17",0.0455,20.4,239.4,NA,8.356,0.2,0,NA,1,NA,1,"2014"
"SOAD06852","Flumevale","Yes","Irrigation","Earth",4.936,0.279,7400,"1973","",0.1379,37.28606,"","09/05/1991","6",26.77,"Low","Satisfactory","2020-08-26",0.04,37,284.7,21.6,4.936,0.279,0,7400,0,8.90937040519747,0,"Unknow"
"SOAD07113","Flumevale","Yes","Water Supply","Earth",20.242,0.143,0,"1939","",0.08668,2.66329,"","28/02/2022","1",3.35,"High","Satisfactory","2017-09-01",0.0959,16.2,280.1,19.3,20.242,0.143,0,NA,1,NA,0,"Unknow"
"SOAD09581","Flumevale","Yes","Flood Risk Reduction","Earth",11.874,0.225,28000,"1971","",0.11032,15.97974,"Uncontrolled","29/04/2008","3",4.6,"Low","Not Rated",NA,0.0653,8,593.1,NA,11.874,0.225,0,28000,0,10.2399955028053,0,"Unknow"
"SOAD12674","Flumevale","Yes","Flood Risk Reduction","Earth",10.098,0.068,18970,"1962","",0.15366,15.97974,"","23/09/2021","1",0.79,"High","Satisfactory","2017-09-01",0.0858,45,524.2,NA,10.098,0.068,0,18970,0,9.85066677635255,0,"Unknow"
"SOAD19398","Flumevale","Yes","Irrigation","Earth",18.328,0.173,45000,"2007","",0.06698,0,"Uncontrolled","03/06/2022","2",36.14,"Significant","Satisfactory","2022-06-03",0.1089,42.6,183.8,9.6,18.328,0.173,0,45000,0,10.7144399907278,0,"Unknow"
"SOAD00504","Flumevale","No","Other","Earth",6.934,0.2,NA,"Unknow","",NA,NA,"","","Unknow",6.13,"Low","Not Available",NA,0.1065,7.4,182.3,NA,6.934,0.2,0,NA,1,NA,0,"Unknow"
"SOAD04570","Flumevale","Yes","Flood Risk Reduction","Earth",7.741,0.45,35000,"1983","",0.14381,NA,"","21/04/2022","1",0,"High","Satisfactory","2017-09-01",0.0719,14,876,NA,7.741,0.45,0,35000,0,10.463131911492,0,"Unknow"
"SOAD07266","Flumevale","Yes","Flood Risk Reduction","Earth",14.08,0.32,NA,"1984","",0.04925,7.98987,"Uncontrolled","07/04/2022","3",0,"High","Satisfactory","2022-04-07",0.1093,12.6,368.7,NA,14.08,0.32,0,NA,1,NA,0,"Unknow"
"SOAD14853","Flumevale","Yes","Irrigation","Earth",9.998,0.14,25885,"1961","",0.05122,7.98987,"","15/06/2021","6",17.76,"Low","Satisfactory","2016-09-22",0.0471,36.2,463.1,6.2,9.998,0.14,0,25885,0,10.1614575610024,0,"Unknow"
"SOAD15934","Flumevale","Yes","Fish and Wildlife Pond","Earth",14.572,0.433,59441,"1960","",0.05713,0,"Uncontrolled","11/06/2019","6",1.64,"Low","Satisfactory","2019-04-15",0.0285,39.1,603.5,NA,14.572,0.433,0,59441,0,10.9927563262011,0,"Unknow"
"SOAD16940","Flumevale","Yes","Flood Risk Reduction","Earth",10.109,0.253,28310,"1958","",0.12411,15.97974,"Uncontrolled","13/05/2016","3",5.02,"Low","Not Rated",NA,0.1058,35.9,293.7,NA,10.109,0.253,0,28310,0,10.2510057006894,0,"Unknow"
"SOAD18464","Flumevale","Yes","Recreation","Earth",15.513,0.111,13158,"1998","2018",0.0985,7.98987,"Uncontrolled","19/07/2018","6",6.52,"Low","Not Rated",NA,0.1054,45.8,476.5,5.3,15.513,0.111,0,13158,0,9.48486121415014,1,"2018"
"SOAD01898","Flumevale","Yes","Recreation","Earth",6.567,1.267,120000,"1991","",0.18321,42.61264,"Uncontrolled","15/05/2019","6",38.5,"Low","Satisfactory","2021-10-20",0.0602,46.3,145.2,5.2,6.567,1.267,0,120000,0,11.6952553550628,0,"Unknow"
"SOAD14818","Flumevale","Yes","Irrigation","Earth",9.611,0.14,9507,"1949","",0.0985,0,"","13/09/2021","6",17.22,"Low","Satisfactory","2013-09-24",0.0431,28.6,192.5,30.4,9.611,0.14,0,9507,0,9.15988882848009,0,"Unknow"
"SOAD17527","Flumevale","Yes","Irrigation","Earth",9.909,0.158,10934,"1962","",0.08077,0,"","21/09/2011","6",83.41,"Low","Not Rated",NA,0.0476,13.2,169.7,17.7,9.909,0.158,0,10934,0,9.29972393311087,0,"Unknow"
"SOAD04005","Flumevale","Yes","Irrigation","Earth",4.352,0.167,7714,"1890","",0.18124,0,"","16/08/2022","6",15.03,"Low","Satisfactory","2020-03-11",0.0483,12.4,344.7,39,4.352,0.167,0,7714,0,8.95092176479726,0,"Unknow"
"SOAD10475","Flumevale","Yes","Fish and Wildlife Pond","Earth",3.74,0.35,32372,"1930","2002",0.17533,45.27593,"Uncontrolled","16/12/2009","6",39.73,"Low","Not Rated",NA,0.0677,20.4,113.6,NA,3.74,0.35,0,32372,0,10.3850800210318,1,"2002"
"SOAD11365","Flumevale","Yes","Irrigation","Earth",18.195,0.167,0,"Unknow","",0.11229,NA,"","09/05/2023","0.5",NA,"Low","Fair","2017-09-01",0.0859,25.7,22.9,19.4,18.195,0.167,0,NA,1,NA,0,"Unknow"
"SOAD12268","Flumevale","Yes","Irrigation","Earth",13.607,0.079,31439,"1948","",0.0788,0,"","19/05/2022","6",14.19,"Low","Fair","2022-08-26",0.0405,14.4,437.7,42.8,13.607,0.079,0,31439,0,10.3558362465431,0,"Unknow"
"SOAD12913","Flumevale","Yes","Irrigation","Earth",8.841,0.1,NA,"1952","",0.0985,21.30632,"","18/11/1993","0",95.78,"Low","Fair","2020-10-05",0.1048,11.9,154.9,27,8.841,0.1,0,NA,1,NA,0,"Unknow"
"SOAD05490","Flumevale","Yes","Irrigation","Earth",5.712,0.145,12603,"1908","",0.13593,7.98987,"Uncontrolled","21/07/2017","6",7.96,"Low","Satisfactory","2020-09-29",0.0614,30.8,430,29,5.712,0.145,0,12603,0,9.44176950287716,0,"Unknow"
"SOAD13623","Flumevale","Yes","Water Supply","Earth",4.809,0.2,6000,"2000","",0.14184,93.21515,"","24/02/2022","0.5",NA,"Low","Satisfactory","2017-09-01",0.0592,35,10.4,67,4.809,0.2,0,6000,0,8.69968140098951,0,"Unknow"
"SOAD20134","Flumevale","Yes","Water Supply","Earth",5.841,1.146,0,"1990","",0.09456,NA,"","30/11/2021","1",NA,"Significant","Satisfactory","2017-09-01",0.1341,35.8,351.3,46.8,5.841,1.146,0,NA,1,NA,0,"Unknow"
"SOAD00561","Flumevale","Yes","Recreation","Earth",4.065,0.46,40896,"1972","",0.21473,0,"Uncontrolled","28/05/2015","6",3.3,"Low","Satisfactory","2014-04-22",0.0461,14.2,453.4,3.1,4.065,0.46,0,40896,0,10.6188119897074,0,"Unknow"
"SOAD04415","Flumevale","Yes","Flood Risk Reduction","Earth",11.194,0.197,37761,"1976","",0.11623,13.31645,"Uncontrolled","19/08/2009","6",49.17,"Low","Unsatisfactory","2017-06-08",0.0775,35.5,228.6,NA,11.194,0.197,0,37761,0,10.5390585849585,0,"Unknow"
"SOAD04573","Flumevale","Yes","Hydroelectric","Earth",9.178,0.04,3150,"1910","",0.09456,NA,"Uncontrolled","22/08/2018","3",26.85,"Low","Satisfactory","2023-09-29",0.069,19.6,99.1,82.7,9.178,0.04,0,3150,0,8.05547514175727,0,"Unknow"
"SOAD10268","Flumevale","Yes","Irrigation","Earth",12.967,0.119,18385,"1948","",0.09653,0,"","16/07/2015","6",40,"Low","Satisfactory","2019-01-04",0.0444,12.2,218.5,14.5,12.967,0.119,0,18385,0,9.8193447844237,0,"Unknow"
"SOAD12055","Flumevale","Yes","Irrigation","Earth",7.332,0.12,0,"1920","",0.10835,7.98987,"Uncontrolled","09/07/2020","6",14.83,"Low","Not Rated",NA,0.042,22.3,369,20.1,7.332,0.12,0,NA,1,NA,0,"Unknow"
"SOAD14422","Flumevale","Yes","Irrigation","Earth",3.348,0.123,4477,"1923","",0.32111,0,"","05/04/1991","6",19.23,"Low","Not Rated",NA,0.0779,265,463.5,4.6,3.348,0.123,0,4477,0,8.4069317971587,0,"Unknow"
"SOAD20286","Flumevale","Yes","Irrigation","Earth",12.476,0.287,18700,"1948","",0.07486,7.98987,"","27/07/2020","6",36.22,"Low","Fair","2020-10-06",0.0472,47.1,105.6,27,12.476,0.287,0,18700,0,9.83633227734872,0,"Unknow"
"SOAD12971","Flumevale","Yes","Irrigation","Earth",8.334,0.189,NA,"1961","",0.0925899999999999,0,"Uncontrolled","16/05/2018","6",48.93,"Low","Unsatisfactory","2012-12-11",0.095,10.3,100.7,2.2,8.334,0.189,0,NA,1,NA,0,"Unknow"
"SOAD01496","Flumevale","Yes","Irrigation","Earth",10.682,0.45,63051,"1902","2019",0.0985,0,"Uncontrolled","28/05/2021","6",11.58,"Low","Satisfactory","2015-09-22",0.0582,29.5,124.4,15.3,10.682,0.45,0,63051,0,11.0517150617464,1,"2019"
"SOAD12218","Flumevale","Yes","Irrigation","Earth",13.281,0.06,10110,"1947","",0.0925899999999999,7.98987,"Uncontrolled","26/07/2022","2",11.31,"Significant","Fair","2022-07-26",0.1436,25,149.5,21.9,13.281,0.06,0,10110,0,9.2213792190914,0,"Unknow"
"SOAD12332","Flumevale","Yes","Flood Risk Reduction","Earth",8.355,0.15,NA,"2019","",0.06895,0,"Uncontrolled","17/09/2019","6",NA,"Low","Fair","2018-05-16",0.0529,42.1,18.2,NA,8.355,0.15,0,NA,1,NA,0,"Unknow"
"SOAD16125","Flumevale","Yes","Fire Protection, Stock, Or Small Fish Pond","Earth",4.731,0.29,NA,"1950","",0.17139,0,"","21/11/1991","0",9.27,"Low","Fair","2011-05-17",0.0835,45,100.4,NA,4.731,0.29,0,NA,1,NA,0,"Unknow"
"SOAD08178","Flumevale","Yes","Irrigation","Earth",5.681,0.448,27102,"1946","",0.15957,0,"Uncontrolled","","6",18.97,"Low","Not Rated",NA,0.039,30.8,266.5,8.8,5.681,0.448,0,27102,0,10.2073997018479,0,"Unknow"
"SOAD00100","Flumevale","Yes","Other","Earth",7.7,0.2,11590,"1926","",0.15563,2.66329,"","06/10/2021","0.5",NA,"Low","Satisfactory","2017-09-01",0.0715,31.5,23,NA,7.7,0.2,0,11590,0,9.35798421388875,0,"Unknow"
"SOAD03122","Flumevale","Yes","Irrigation","Earth",9.685,0.383,NA,"1939","",0.34475,362.20744,"Uncontrolled","15/09/2022","6",92.49,"Low","Satisfactory","2019-08-08",0.04,218.1,237.6,7.8,9.685,0.383,0,NA,1,NA,0,"Unknow"
"SOAD04685","Flumevale","Yes","Water Supply","Earth",21.178,0.033,250840,"1950","",0.05516,NA,"","24/08/2022","1",0,"High","Satisfactory","2017-09-01",0.0973,24.1,522.3,21.8,21.178,0.033,0,250840,0,12.432574551254,0,"Unknow"
"SOAD07130","Flumevale","Yes","Irrigation","Earth",11.128,0.366,78086,"1973","",0.12214,29.29619,"Uncontrolled","21/11/2022","6",4.62,"Low","Fair","2017-10-05",0.0714,44.8,924,23.4,11.128,0.366,0,78086,0,11.2655788687079,0,"Unknow"
"SOAD18730","Flumevale","Yes","Water Supply","Earth",12.746,0.313,54200,"1982","",0.08077,NA,"","28/01/2022","0.5",NA,"Low","Satisfactory","2017-09-01",0.0605,8.2,12.7,16.3,12.746,0.313,0,54200,0,10.900454637442,0,"Unknow"
"SOAD10080","Flumevale","Yes","Irrigation","Earth",10.287,0.317,8550,"1947","",0.12017,0,"","21/04/2021","6",45.47,"Low","Fair","2018-10-05",0.0726,30,216.4,36.6,10.287,0.317,0,8550,0,9.05380351415596,0,"Unknow"
"SOAD17266","Flumevale","Yes","Water Supply","Earth",10.459,0.64,36700,"1932","",0.17139,2.66329,"","19/05/2022","1",0.34,"High","Satisfactory","2017-09-01",0.0869,13.5,426.9,42.3,10.459,0.64,0,36700,0,10.5105592816278,0,"Unknow"
"SOAD00294","Flumevale","Yes","Irrigation","Earth",6.112,0.147,10667,"1934","",0.09653,7.98987,"Uncontrolled","12/08/2022","1",16.17,"High","Not Rated",NA,0.1334,26,391.1,44.7,6.112,0.147,0,10667,0,9.2750038853019,0,"Unknow"
"SOAD00768","Flumevale","Yes","Flood Risk Reduction","Earth",4.634,1.367,NA,"2012","",0.13987,0,"Uncontrolled","","6",9.77,"Low","Fair","2019-04-05",0.0582,16.6,241.7,NA,4.634,1.367,0,NA,1,NA,0,"Unknow"
"SOAD19703","Flumevale","Yes","Other","Earth",17.778,0.188,63426,"1901","",0.15169,0,"","13/10/2021","1",0.84,"High","Satisfactory","2017-09-01",0.0941,13.3,912.3,NA,17.778,0.188,0,63426,0,11.0576449172774,0,"Unknow"
"SOAD02183","Flumevale","Yes","Irrigation","Earth",13.904,0.115,55415,"1949","",0.0925899999999999,50.60251,"Uncontrolled","26/08/2016","6",165.57,"Low","Fair","2022-10-07",0.059,33.2,134.9,20,13.904,0.115,0,55415,0,10.9226236397024,0,"Unknow"
"SOAD03298","Flumevale","Yes","Irrigation","Earth",15.978,0.15,0,"1951","",0.06698,13.31645,"Uncontrolled","20/07/2021","6",26.05,"Low","Fair","2019-03-20",0.0466,18.5,387.5,44.9,15.978,0.15,0,NA,1,NA,0,"Unknow"
"SOAD09614","Flumevale","Yes","Water Supply","Earth",15.382,0.3,82000,"1981","",0.08274,0,"","09/11/2021","1",0.84,"High","Satisfactory","2017-09-01",0.0768,37.9,212.9,25.5,15.382,0.3,0,82000,0,11.314486721294,0,"Unknow"
"SOAD16260","Flumevale","Yes","Flood Risk Reduction","Earth",4.081,0.467,45231,"1889","2003",0.19503,0,"","02/11/2022","3",0,"Significant","Satisfactory","2022-11-02",0.1417,34.9,794.4,NA,4.081,0.467,0,45231,0,10.7195600799334,1,"2003"
"SOAD16398","Flumevale","Yes","Irrigation","Earth",10.037,0.085,NA,"1972","",0.11032,103.86831,"","18/07/2016","6",23.36,"Low","Not Rated",NA,0.0792,28.7,99.4,42.7,10.037,0.085,0,NA,1,NA,0,"Unknow"
"SOAD06953","Flumevale","Yes","Fish and Wildlife Pond","Earth",6.479,0.108,0,"1895","",0.15169,0,"Uncontrolled","20/06/2018","6",6.13,"Low","Satisfactory","2022-04-21",0.052,33,376.6,NA,6.479,0.108,0,NA,1,NA,0,"Unknow"
"SOAD09363","Flumevale","Yes","Irrigation","Earth",10.536,0.39,39500,"1951","",0.11426,0,"","31/07/2015","6",38.66,"Low","Not Rated",NA,0.0631,36.5,198.3,31.1,10.536,0.39,0,39500,0,10.5840812670245,0,"Unknow"
"SOAD10129","Flumevale","Yes","Fish and Wildlife Pond","Earth",11.35,0.204,9200,"2000","",0.12411,29.29619,"Uncontrolled","20/07/2021","2",9.72,"Significant","Satisfactory","2021-07-20",0.1227,45,335.1,NA,11.35,0.204,0,9200,0,9.12706745278236,0,"Unknow"
"SOAD10726","Flumevale","Yes","Flood Risk Reduction","Earth",9.926,0.23,16079,"1974","",0.1576,7.98987,"Uncontrolled","02/07/2008","3",63.56,"Low","Fair","2020-03-05",0.0899,36.4,81.8,NA,9.926,0.23,0,16079,0,9.68533154273296,0,"Unknow"
"SOAD14599","Flumevale","Yes","Irrigation","Earth",14.096,0.173,29457,"1906","",0.07486,21.30632,"Uncontrolled","05/05/2021","2",14.32,"Significant","Fair","2021-05-05",0.1383,34.5,131.8,36.3,14.096,0.173,0,29457,0,10.2907207990495,0,"Unknow"
"SOAD18669","Flumevale","Yes","Irrigation","Earth",4.556,0.687,NA,"2007","",0.0906199999999999,0,"Uncontrolled","14/01/2014","6",1.61,"Low","Fair","2020-09-28",0.0482,42.5,665,7.6,4.556,0.687,0,NA,1,NA,0,"Unknow"
"SOAD00519","Flumevale","No","Fire Protection, Stock, Or Small Fish Pond","Earth",2.669,0.495,NA,"1951","",NA,NA,"Uncontrolled","01/08/2011","10",NA,"Low","Not Rated",NA,0.0471,5.6,8.1,NA,2.669,0.495,0,NA,1,NA,0,"Unknow"
"SOAD03950","Flumevale","Yes","Flood Risk Reduction","Earth",4.85,0.032,12000,"2002","",0.20685,18.64303,"","24/02/2022","0.5",0.4,"Low","Satisfactory","2017-09-01",0.0729,31.2,138.3,NA,4.85,0.032,0,12000,0,9.39274525863144,0,"Unknow"
"SOAD06025","Flumevale","Yes","Water Supply","Earth",15.189,0.188,44300,"2002","",0.12411,2.66329,"","24/09/2021","1",0,"High","Satisfactory","2017-09-01",0.0761,25.4,230.1,12.8,15.189,0.188,0,44300,0,10.6987625291419,0,"Unknow"
"SOAD07064","Flumevale","Yes","Fire Protection, Stock, Or Small Fish Pond","Earth",5.321,0.133,10371,"1897","",0.03349,0,"","24/08/1994","6",4.83,"Low","Fair","2014-10-03",0.0592,44.6,348.1,NA,5.321,0.133,0,10371,0,9.24686514665856,0,"Unknow"
"SOAD09623","Flumevale","Yes","Water Supply","Earth",8.058,0.85,83000,"1967","",0.33884,2.66329,"","10/06/2022","1",NA,"Significant","Satisfactory","2017-09-01",0.122,414,412.8,38.5,8.058,0.85,0,83000,0,11.3266079348989,0,"Unknow"
"SOAD10303","Flumevale","Yes","Water Supply","Earth",21.273,0.151,75000,"1908","",0.06895,7.98987,"","05/08/2022","1",3.3,"High","Satisfactory","2017-09-01",0.0793,27.7,844.9,14.2,21.273,0.151,0,75000,0,11.2252567257629,0,"Unknow"
"SOAD13046","Flumevale","Yes","Water Supply","Earth",8.826,0.09,3000,"1913","",0.24231,2.66329,"","14/06/2022","0.5",NA,"Low","Satisfactory","2017-09-01",0.0669,18.3,21.6,23.1,8.826,0.09,0,3000,0,8.00670084544037,0,"Unknow"
"SOAD02590","Flumevale","Yes","Irrigation","Earth",6.966,0.139,13711,"1908","",0.12017,7.98987,"Uncontrolled","15/07/2019","6",35.56,"Low","Satisfactory","2011-05-03",0.0329,15.7,158,9.3,6.966,0.139,0,13711,0,9.52602664083756,0,"Unknow"
"SOAD05606","Flumevale","Yes","Irrigation","Earth",9.445,0.1,0,"1968","",0.09456,29.29619,"Uncontrolled","26/05/2015","6",25.33,"Low","Fair","2013-09-22",0.0732,36,357.4,35.7,9.445,0.1,0,NA,1,NA,0,"Unknow"
"SOAD05793","Flumevale","Yes","Fire Protection, Stock, Or Small Fish Pond","Earth",6.908,0.117,9074,"1947","",0.08471,58.59238,"Uncontrolled","13/04/1995","6",23.31,"Low","Not Rated",NA,0.0636,39.1,159.5,NA,6.908,0.117,0,9074,0,9.11327865913305,0,"Unknow"
"SOAD07190","Flumevale","Yes","Flood Risk Reduction","Earth",13.488,0.182,27950,"1977","",0.0985,15.97974,"Uncontrolled","05/03/2020","6",30.68,"Low","Unsatisfactory","2013-11-18",0.0934,44.4,141.8,NA,13.488,0.182,0,27950,0,10.2382082561185,0,"Unknow"
"SOAD18993","Flumevale","Yes","Fire Protection, Stock, Or Small Fish Pond","Earth",11.203,0.193,NA,"1965","",0.14184,42.61264,"","13/02/1992","0",48.98,"Low","Not Rated",NA,0.0745,32.9,62.5,NA,11.203,0.193,0,NA,1,NA,0,"Unknow"
"SOAD04367","Flumevale","Yes","Irrigation","Earth",12.373,0.233,10889,"2020","2020",0.10047,0,"Uncontrolled","21/06/2021","2",14.08,"Significant","Satisfactory","2021-06-21",0.1248,30.5,178.1,40.4,12.373,0.233,0,10889,0,9.29560021592701,1,"2020"
"SOAD05671","Flumevale","Yes","Irrigation","Earth",6.459,0.138,0,"1906","",0.12805,15.97974,"Uncontrolled","01/12/2022","6",17.04,"Low","Satisfactory","2021-09-16",0.0361,11.9,448.9,30.2,6.459,0.138,0,NA,1,NA,0,"Unknow"
"SOAD05794","Flumevale","Yes","Irrigation","Earth",8.91,0.227,0,"Unknow","",0.11229,NA,"","05/12/2022","1",0.82,"High","Fair","2017-09-01",0.1153,35.6,173.8,13.7,8.91,0.227,0,NA,1,NA,0,"Unknow"
"SOAD12482","Flumevale","Yes","Irrigation","Earth",7.175,0.092,17282,"1915","",0.12214,0,"Uncontrolled","15/07/2019","6",27.55,"Low","Not Rated",NA,0.085,39.7,451.7,3,7.175,0.092,0,17282,0,9.75747863840049,0,"Unknow"
"SOAD14632","Flumevale","Yes","Other","Earth",21.606,0.122,42000,"1971","",0.11229,53.2658,"","05/01/2022","0.5",NA,"Low","Satisfactory","2017-09-01",0.0568,19.1,11,NA,21.606,0.122,0,42000,0,10.6454487065059,0,"Unknow"
"SOAD02627","Flumevale","Yes","Irrigation","Earth",4.209,0.353,0,"1904","",0.18321,0,"Uncontrolled","25/06/2014","6",63.67,"Low","Fair","2022-09-29",0.0497,47.5,192.8,41,4.209,0.353,0,NA,1,NA,0,"Unknow"
"SOAD04993","Flumevale","Yes","Water Supply","Earth",12.681,0.15,NA,"1906","",0.06501,7.98987,"Uncontrolled","23/08/2022","2",11.28,"Significant","Satisfactory","2022-08-23",0.1159,31.3,103,18.6,12.681,0.15,0,NA,1,NA,0,"Unknow"
"SOAD07126","Flumevale","Yes","Irrigation","Earth",11.617,0.064,8281,"1903","",0.10638,0,"Uncontrolled","18/05/2022","1",4.7,"High","Fair","2022-05-18",0.0964,43.6,177.9,1.6,11.617,0.064,0,8281,0,9.02183976410551,0,"Unknow"
"SOAD01187","Flumevale","Yes","Irrigation","Earth",7.543,0.084,8450,"1942","",0.11426,13.31645,"Uncontrolled","04/09/2013","6",16.35,"Low","Fair","2010-10-05",0.0489,20.3,439.1,31.7,7.543,0.084,0,8450,0,9.04204005654448,0,"Unknow"
"SOAD01478","Flumevale","Yes","Water Supply","Earth",5.283,0.157,0,"1920","",0.34081,66.58225,"","04/11/2021","0.5",NA,"Low","Satisfactory","2017-09-01",0.0833,531.6,18.1,50.6,5.283,0.157,0,NA,1,NA,0,"Unknow"
"SOAD10101","Flumevale","Yes","Irrigation","Earth",7.552,0.25,14722,"1953","1996H;1996S",0.12214,0,"Uncontrolled","17/06/2021","2",12.41,"Significant","Fair","2021-06-17",0.1301,32.3,454.9,13.6,7.552,0.25,0,14722,0,9.59716617586541,2,"1996"
"SOAD12775","Flumevale","Yes","Flood Risk Reduction","Earth",14.967,0.218,54930,"1962","",0.0906199999999999,15.97974,"","04/04/2019","3",3.31,"Low","Fair","2013-05-17",0.0991,42.4,821.4,NA,14.967,0.218,0,54930,0,10.9138331311591,0,"Unknow"
"SOAD20564","Flumevale","Yes","Irrigation","Earth",6.056,0.6,56417,"1925","",0.18124,7.98987,"","17/09/1991","0",48.64,"Low","Fair","2015-09-23",0.0909,36.8,74.9,43,6.056,0.6,0,56417,0,10.9405435355051,0,"Unknow"
"SOAD04316","Flumevale","Yes","Water Supply","Earth",12.612,0.11,29000,"1953","",0.12608,5.32658,"","15/12/2021","1",NA,"Significant","Satisfactory","2017-09-01",0.1351,21.9,336,65.5,12.612,0.11,0,29000,0,10.2750855911327,0,"Unknow"
"SOAD10408","Flumevale","Yes","Other","Earth",13.375,0.047,8000,"1961","",0.0925899999999999,237.03281,"","20/06/2023","0.5",NA,"Low","Poor","2021-08-18",0.1058,38.1,19.5,NA,13.375,0.047,0,8000,0,8.98732181285012,0,"Unknow"
"SOAD18118","Flumevale","Yes","Flood Risk Reduction","Earth",10.596,0.302,30600,"1965","",0.13002,13.31645,"","11/04/2018","3",40.37,"Low","Satisfactory","2020-07-07",0.0641,11.7,187.3,NA,10.596,0.302,0,30600,0,10.3287879671451,0,"Unknow"
"SOAD04873","Flumevale","Yes","Recreation","Earth",11.725,0.6,86424,"1972","",0.10441,0,"Uncontrolled","15/06/2022","2",0,"Significant","Satisfactory","2022-06-15",0.1209,33.6,952.6,4,11.725,0.6,0,86424,0,11.3670322647898,0,"Unknow"
"SOAD05067","Flumevale","Yes","Water Supply","Earth",14.345,0.263,150000,"1992","",0.07289,2.66329,"","26/04/2022","1",1.01,"High","Satisfactory","2017-09-01",0.1077,19.7,602,25.3,14.345,0.263,0,150000,0,11.9183972397228,0,"Unknow"
"SOAD06358","Flumevale","Yes","Water Supply","Earth",33.915,0.172,158100,"1973","",0.07486,7.98987,"","11/08/2021","1",2.01,"High","Satisfactory","2017-09-01",0.1083,5.7,582.7,55.9,33.915,0.172,0,158100,0,11.9709893482882,0,"Unknow"
"SOAD14376","Flumevale","Yes","Water Supply","Earth",14.395,0.287,47000,"1966","",0.10441,2.66329,"","14/03/2022","0.5",23.81,"Low","Satisfactory","2017-09-01",0.0702,33.2,215.7,26.8,14.395,0.287,0,47000,0,10.7579241570616,0,"Unknow"
"SOAD00224","Flumevale","Yes","Irrigation","Earth",7.598,0.525,NA,"1906","2003",0.12411,7.98987,"Uncontrolled","17/12/2021","1",5.05,"High","Fair","2021-12-17",0.1051,37.5,133.6,13.5,7.598,0.525,0,NA,1,NA,1,"2003"
"SOAD01287","Flumevale","Yes","Irrigation","Earth",5.673,0.013,2107,"1962","2005",0.24034,0,"Uncontrolled","19/10/2021","6",5.02,"Low","Satisfactory","2020-10-15",0.0287,18.9,425.5,38,5.673,0.013,0,2107,0,7.65349490966125,1,"2005"
"SOAD04905","Flumevale","Yes","Water Supply","Earth",6.484,0.443,0,"1905","",0.18124,2.66329,"","23/06/2022","0.5",NA,"Low","Satisfactory","2017-09-01",0.0762,8.5,13.9,12.9,6.484,0.443,0,NA,1,NA,0,"Unknow"
"SOAD13630","Flumevale","Yes","Irrigation","Earth",3.811,0.2,10865,"1948","",0.13987,0,"Uncontrolled","26/09/2013","6",0,"Low","Satisfactory","2016-06-09",0.0355,33.6,728.7,24.1,3.811,0.2,0,10865,0,9.29339392711147,0,"Unknow"
"SOAD17507","Flumevale","Yes","Recreation","Earth",12.514,0.313,98536,"1955","",0.08077,0,"Uncontrolled","09/11/2022","2",7.88,"Significant","Satisfactory","2022-11-09",0.1271,13.6,293.6,4.3,12.514,0.313,0,98536,0,11.498187391145,0,"Unknow"
"SOAD18229","Flumevale","Yes","Irrigation","Earth",2.803,0.235,6560,"1879","",0.13593,0,"","09/09/1985","6",17.92,"Low","Not Rated",NA,0.0641,38.1,181,33.8,2.803,0.235,0,6560,0,8.78889830934488,0,"Unknow"
"SOAD19136","Flumevale","Yes","Water Supply","Earth",19.993,0.182,72000,"1989","",0.0925899999999999,2.66329,"","01/09/2021","1",NA,"Significant","Satisfactory","2017-09-01",0.1336,5.8,433.8,5.6,19.993,0.182,0,72000,0,11.1844352867906,0,"Unknow"
"SOAD01237","Flumevale","Yes","Water Supply","Earth",12.371,0.139,22060,"1936","",0.13199,13.31645,"","04/05/2022","1",0.16,"High","Satisfactory","2017-09-01",0.0956,33.2,913.6,62.5,12.371,0.139,0,22060,0,10.0015666226958,0,"Unknow"
"SOAD01973","Flumevale","Yes","Irrigation","Earth",5.095,0.055,4522,"1886","",0.1182,0,"","26/08/2022","6",14.26,"Low","Not Rated",NA,0.0585,40.7,117.2,14.9,5.095,0.055,0,4522,0,8.41693076947784,0,"Unknow"
"SOAD06850","Flumevale","Yes","Irrigation","Earth",38.113,0.147,124000,"1966","",0.06501,0,"Uncontrolled","02/08/2021","3",0,"Low","Satisfactory","2023-09-29",0.067,23.3,137.6,3.5,38.113,0.147,0,124000,0,11.7280449090708,0,"Unknow"
"SOAD16975","Flumevale","Yes","Hydroelectric","Earth",18.468,0.36,NA,"1962","",0.12411,2.66329,"Uncontrolled","11/07/2023","3",1.66,"Low","Satisfactory","2023-09-29",0.0619,34.9,117.3,93.6,18.468,0.36,0,NA,1,NA,0,"Unknow"
"SOAD18462","Flumevale","Yes","Hydroelectric","Earth",3.256,0.03,200,"1855","",0,0,"Uncontrolled","10/08/2016","3",NA,"Low","Satisfactory","2023-09-29",0.0712,16.2,5.8,NA,3.256,0.03,0,200,0,5.30330490805908,0,"Unknow"
"SOAD03141","Flumevale","Yes","Other","Earth",9.266,0.373,38000,"1968","",0.20094,21.30632,"","27/04/2022","0.5",NA,"Low","Satisfactory","2017-09-01",0.0579,12.8,12.7,NA,9.266,0.373,0,38000,0,10.5453677541517,0,"Unknow"
"SOAD03661","Flumevale","Yes","Irrigation","Earth",7.138,0.163,NA,"1946","1999H",0.0886499999999999,0,"","15/05/2020","6",38.46,"Low","Fair","2016-09-16",0.0524,26.7,232.8,16.3,7.138,0.163,0,NA,1,NA,1,"1999"
"SOAD05140","Flumevale","Yes","Fire Protection, Stock, Or Small Fish Pond","Earth",8.144,0.16,NA,"1971","2000",0.13002,0,"Uncontrolled","10/10/2019","6",18.41,"Low","Fair","2017-08-23",0.0662,42.4,254.1,NA,8.144,0.16,0,NA,1,NA,1,"2000"
"SOAD05272","Flumevale","Yes","Unknow","Earth",4.424,0.167,NA,"Unknow","2018",0.12214,NA,"Uncontrolled","","0",NA,"Low","Satisfactory","2019-04-04",0.0628,24.6,20.1,NA,4.424,0.167,0,NA,1,NA,1,"2018"
"SOAD06954","Flumevale","Yes","Water Supply","Earth",18.218,0.133,36000,"1954","",0.07683,111.85818,"","23/02/2022","1",9.48,"Significant","Satisfactory","2017-09-01",0.1372,14.7,196.8,10.9,18.218,0.133,0,36000,0,10.4913019948302,0,"Unknow"
"SOAD09879","Flumevale","Yes","Water Supply","Earth",12.443,0.12,23000,"1961","",0.18321,23.96961,"","10/06/2022","0.5",NA,"Low","Satisfactory","2017-09-01",0.0754,38,19.8,67.7,12.443,0.12,0,23000,0,10.043292972227,0,"Unknow"
"SOAD13943","Flumevale","Yes","Flood Risk Reduction","Earth",11.444,0.195,26980,"1964","",0.21276,7.98987,"","04/04/2019","3",32.71,"Low","Fair","2004-10-08",0.0836,41.4,126.1,NA,11.444,0.195,0,26980,0,10.2028881935671,0,"Unknow"
"SOAD15660","Flumevale","Yes","Flood Risk Reduction","Earth",16.044,0.438,85340,"1954","",0.13199,13.31645,"","09/03/2022","1",0.5,"High","Satisfactory","2017-09-01",0.0866,28.5,705.2,NA,16.044,0.438,0,85340,0,11.3544102745079,0,"Unknow"
"SOAD01139","Flumevale","Yes","Irrigation","Earth",15.907,0.202,47729,"1961","",0.0886499999999999,13.31645,"Uncontrolled","19/05/2018","6",4.68,"Low","Not Rated",NA,0.0472,18.9,679.8,25,15.907,0.202,0,47729,0,10.7733154099999,0,"Unknow"
"SOAD04006","Flumevale","Yes","Water Supply","Earth",9.672,1.083,69000,"1961","",0.14775,0,"","30/06/2022","1",2.22,"High","Satisfactory","2017-09-01",0.0819,20.9,316.5,50.5,9.672,1.083,0,69000,0,11.141876276228,0,"Unknow"
"SOAD15972","Flumevale","Yes","Flood Risk Reduction","Earth",10.097,0.3,28401,"1969","",0.13199,13.31645,"Uncontrolled","18/07/1991","0",48.72,"Low","Satisfactory","2019-03-21",0.0757,43.2,135.5,NA,10.097,0.3,0,28401,0,10.254214844205,0,"Unknow"
"SOAD16686","Flumevale","Yes","Flood Risk Reduction","Earth",12.026,0.21,17248,"1975","",0.13987,21.30632,"Uncontrolled","05/10/2010","3",8.43,"Low","Not Rated",NA,0.0939,13.5,160.7,NA,12.026,0.21,0,17248,0,9.75550944976463,0,"Unknow"
"SOAD03697","Flumevale","Yes","Irrigation","Earth",6.387,0.077,4857,"1894","1966H;1966M;1966S",0.0886499999999999,79.8987,"Uncontrolled","08/08/2018","6",18.47,"Low","Satisfactory","2020-08-20",0.0335,17.6,185.4,44.9,6.387,0.077,0,4857,0,8.48838210956212,3,"1966"
"SOAD04991","Flumevale","Yes","Irrigation","Earth",7.414,0.133,21959,"1904","1990",0.13002,0,"Uncontrolled","05/10/2021","6",40.31,"Low","Satisfactory","2020-10-22",0.0336,39.8,102.5,6.6,7.414,0.133,0,21959,0,9.99697789562347,1,"1990"
"SOAD11425","Flumevale","Yes","Water Supply","Earth",6.117,0.807,0,"1885","",0.08668,NA,"","24/02/2022","1",0,"High","Satisfactory","2017-09-01",0.0928,42.5,821.9,15.3,6.117,0.807,0,NA,1,NA,0,"Unknow"
"SOAD01055","Flumevale","No","Fish and Wildlife Pond","Earth",3.639,0.073,NA,"1893","",NA,NA,"Uncontrolled","22/09/2008","10",NA,"Low","Not Rated",NA,0.0784,7.3,18.2,NA,3.639,0.073,0,NA,1,NA,0,"Unknow"
"SOAD09055","Flumevale","Yes","Irrigation","Earth",9.03,0.13,0,"1913","",0.12017,0,"Uncontrolled","05/06/2014","6",40.71,"Low","Fair","2013-11-05",0.0697,45.7,148,45.1,9.03,0.13,0,NA,1,NA,0,"Unknow"
"SOAD17176","Flumevale","Yes","Irrigation","Earth",7.295,0.133,19096,"1911","",0.13002,0,"","29/09/2020","6",25.99,"Low","Fair","2016-06-29",0.0733,45.4,400.9,22,7.295,0.133,0,19096,0,9.85728653363541,0,"Unknow"
"SOAD17713","Flumevale","Yes","Irrigation","Earth",9.668,0.1,12755,"1951","",0.12411,7.98987,"Uncontrolled","20/09/2018","6",NA,"Low","Fair","2020-07-14",0.0523,30.7,9.2,37.7,9.668,0.1,0,12755,0,9.45375702812995,0,"Unknow"
"SOAD07626","Flumevale","Yes","Irrigation","Earth",6.143,0.121,13377,"1914","",0.12214,7.98987,"Uncontrolled","16/07/2019","6",39.11,"Low","Fair","2017-07-31",0.0587,40.6,89.3,43.7,6.143,0.121,0,13377,0,9.50136684567835,0,"Unknow"
"SOAD09079","Flumevale","Yes","Water Supply","Earth",13.725,0.118,41000,"1966","",0.12214,2.66329,"","19/08/2022","1",0,"High","Satisfactory","2017-09-01",0.0779,36.1,244.6,56.2,13.725,0.118,0,41000,0,10.6213517356329,0,"Unknow"
"SOAD13284","Flumevale","Yes","Irrigation","Earth",4.458,1.088,51085,"1910","2001H;2001S",0.14381,0,"Uncontrolled","22/11/2022","1",0,"High","Satisfactory","2022-11-22",0.0725,12.4,405.5,27.9,4.458,1.088,0,51085,0,10.8412657660517,2,"2001"
"SOAD04022","Flumevale","Yes","Tailings","Earth",23.274,0.3,90005,"1977","",0.0886499999999999,7.98987,"","01/01/1999","6",23.86,"Low","Not Rated",NA,0.0673,30.4,393,NA,23.274,0.3,0,90005,0,11.4076316137569,0,"Unknow"
"SOAD03311","Flumevale","Yes","Water Supply","Earth",9.268,0.067,9000,"1967","",0.18124,13.31645,"","21/06/2022","1",0,"High","Satisfactory","2017-09-01",0.1123,19.8,913.3,56.2,9.268,0.067,0,9000,0,9.10509096125709,0,"Unknow"
"SOAD06309","Flumevale","Yes","Fish and Wildlife Pond","Earth",3.886,0.039,450,"1951","",0.19503,71.90883,"","12/10/2010","6",15.64,"Low","Not Rated",NA,0.0409,44.8,192,NA,3.886,0.039,0,450,0,6.11146733950268,0,"Unknow"
"SOAD06445","Flumevale","Yes","Irrigation","Earth",3.941,0.55,16024,"1905","",0.1576,0,"Uncontrolled","23/05/2022","6",5,"Low","Unsatisfactory","2006-09-29",0.0922,15.2,746.8,33.9,3.941,0.55,0,16024,0,9.68190528178887,0,"Unknow"
"SOAD07875","Flumevale","Yes","Irrigation","Earth",4.724,0.17,38941,"1892","",0.03546,0,"Uncontrolled","02/07/1999","6",7.95,"Low","Satisfactory","2013-09-25",0.0496,22.2,244.8,40.5,4.724,0.17,0,38941,0,10.5698286386756,0,"Unknow"
"SOAD11576","Flumevale","Yes","Flood Risk Reduction","Earth",10.301,0.21,27960,"1963","",0.14578,13.31645,"","03/04/2019","3",27.92,"Low","Not Rated",NA,0.1103,32.8,232.8,NA,10.301,0.21,0,27960,0,10.2385659610873,0,"Unknow"
"SOAD18460","Flumevale","Yes","Water Supply","Earth",15.923,0.077,18500,"1929","",0.27777,39.94935,"","26/10/2021","0.5",NA,"Low","Satisfactory","2017-09-01",0.0781,125.7,20.4,55.5,15.923,0.077,0,18500,0,9.8255800636596,0,"Unknow"
"SOAD20060","Flumevale","Yes","Flood Risk Reduction","Earth",11.968,0.144,23730,"1960","",0.11426,29.29619,"","10/04/2018","3",33.58,"Low","Fair","2012-05-03",0.0706,42.6,104.1,NA,11.968,0.144,0,23730,0,10.074537489292,0,"Unknow"
"SOAD02928","Flumevale","Yes","Water Supply","Earth",6.508,1.05,0,"1990","",0.0906199999999999,0,"","30/11/2021","1",0,"Significant","Satisfactory","2017-09-01",0.1159,30.1,449.4,5.5,6.508,1.05,0,NA,1,NA,0,"Unknow"
"SOAD06222","Flumevale","Yes","Water Supply","Earth",8.335,0.05,NA,"1927","",0.07289,0,"","22/06/2011","6",15.37,"Low","Not Rated",NA,0.0448,9,129.9,37.5,8.335,0.05,0,NA,1,NA,0,"Unknow"
"SOAD10513","Flumevale","Yes","Water Supply","Earth",4.24,0.158,2150,"1919","",0.35657,13.31645,"","07/06/2022","0.5",NA,"Low","Satisfactory","2017-09-01",0.0727,283.7,13.5,24.8,4.24,0.158,0,2150,0,7.67368812926773,0,"Unknow"
"SOAD14546","Flumevale","Yes","Water Supply","Earth",15.75,0.215,88000,"1955","",0.11229,2.66329,"","13/10/2021","1",7.71,"High","Satisfactory","2017-09-01",0.0936,15.9,360.5,36.8,15.75,0.215,0,88000,0,11.3851034570321,0,"Unknow"
"SOAD14095","Flumevale","Yes","Irrigation","Earth",17.669,0.2,52742,"1955","",0.0985,0,"","30/08/2017","6",11.6,"Low","Not Rated",NA,0.0734,14.4,327,36.1,17.669,0.2,0,52742,0,10.8731863411109,0,"Unknow"
"SOAD06085","Flumevale","Yes","Water Supply","Earth",16.206,0.081,17650,"1965","",0.12805,10.65316,"","28/03/2022","0.5",NA,"Low","Satisfactory","2017-09-01",0.0594,43.6,5,6.9,16.206,0.081,0,17650,0,9.77854771798028,0,"Unknow"
"SOAD06143","Flumevale","Yes","Flood Risk Reduction","Earth",9.075,0.792,35750,"2019","",0.16942,7.98987,"Uncontrolled","28/03/2022","3",1.64,"High","Satisfactory","2022-03-28",0.1062,42.1,797.6,NA,9.075,0.792,0,35750,0,10.4843335197589,0,"Unknow"
"SOAD16073","Flumevale","Yes","Fire Protection, Stock, Or Small Fish Pond","Earth",19.546,0.267,140500,"1958","2003H;2003S",0.05713,0,"Uncontrolled","21/12/2022","1",1.58,"High","Not Rated",NA,0.1273,31,926.3,NA,19.546,0.267,0,140500,0,11.8529698851683,2,"2003"
"SOAD19791","Flumevale","Yes","Other","Earth",13.003,0.195,41700,"1954","",0.14775,10.65316,"","11/01/2022","1",9.4,"High","Satisfactory","2017-09-01",0.0903,28.7,137.8,NA,13.003,0.195,0,41700,0,10.6382803883147,0,"Unknow"
"SOAD01884","Flumevale","No","Fire Protection, Stock, Or Small Fish Pond","Earth",2.761,0.44,NA,"1974","",NA,55.92909,"Uncontrolled","07/09/2010","10",NA,"Low","Not Rated",NA,0.0403,12.5,11.1,NA,2.761,0.44,0,NA,1,NA,0,"Unknow"
"SOAD05185","Flumevale","Yes","Other","Earth",31.131,0.123,155400,"1933","",0.06501,2.66329,"","14/09/2022","0.5",NA,"Low","Satisfactory","2017-09-01",0.0579,45.1,5,NA,31.131,0.123,0,155400,0,11.9537641519014,0,"Unknow"
"SOAD11759","Flumevale","Yes","Water Supply","Earth",12.947,0.175,13581,"1931","",0.20685,103.86831,"","27/01/2022","1",NA,"High","Satisfactory","2017-09-01",0.1022,40.9,481.9,51.3,12.947,0.175,0,13581,0,9.51650066567374,0,"Unknow"
"SOAD16005","Flumevale","Yes","Irrigation","Earth",13.554,0.232,88361,"1936","",0.10638,7.98987,"","14/09/2018","6",13.37,"Low","Fair","2018-10-26",0.0761,41.5,242.4,31.1,13.554,0.232,0,88361,0,11.3891972919542,0,"Unknow"
"SOAD11740","Flumevale","Yes","Water Supply","Earth",10.166,0.178,28000,"1962","",0.16351,2.66329,"","31/08/2021","0.5",NA,"Low","Satisfactory","2017-09-01",0.0706,34.4,16.6,60.9,10.166,0.178,0,28000,0,10.2399955028053,0,"Unknow"
"SOAD08450","Flumevale","Yes","Irrigation","Earth",9.862,0.277,51001,"1963","",0.1379,0,"","03/06/2021","6",16.62,"Low","Satisfactory","2019-08-08",0.0556,39.5,274.5,42.6,9.862,0.277,0,51001,0,10.8396201266238,0,"Unknow"
"SOAD14660","Flumevale","Yes","Recreation","Earth",19.219,0.267,NA,"1986","",0.12017,0,"Uncontrolled","03/05/2021","2",25.13,"Significant","Satisfactory","2021-05-03",0.1137,45.7,277.7,9.5,19.219,0.267,0,NA,1,NA,0,"Unknow"
"SOAD00416","Flumevale","Yes","Irrigation","Earth",3.524,0.183,8166,"1900","",0.07683,29.29619,"","23/09/2013","6",7.82,"Low","Not Rated",NA,0.0588,41.7,382,28.4,3.524,0.183,0,8166,0,9.00785692335828,0,"Unknow"
"SOAD01311","Flumevale","Yes","Other","Earth",15.08,0.4,0,"1979","1996",0.07486,18.64303,"Uncontrolled","20/10/2011","6",8.38,"Low","Not Available",NA,0.0467,10,132.9,NA,15.08,0.4,0,NA,1,NA,1,"1996"
"SOAD07234","Flumevale","Yes","Recreation","Earth",5.096,0.167,5927,"1892","",0.02364,10.65316,"Uncontrolled","19/05/2021","4",47.9,"Low","Fair","2016-08-04",0.0618,16.1,134.3,6.4,5.096,0.167,0,5927,0,8.68744216697592,0,"Unknow"
"SOAD11186","Flumevale","Yes","Irrigation","Earth",6.816,0.767,22955,"1967","",0.19306,21.30632,"Uncontrolled","10/09/2015","6",9.36,"Low","Not Rated",NA,0.0881,17.1,434.8,46.1,6.816,0.767,0,22955,0,10.0413346192283,0,"Unknow"
"SOAD12794","Flumevale","Yes","Fire Protection, Stock, Or Small Fish Pond","Earth",11.335,0.173,10440,"1952","",0.08274,0,"","05/07/2022","6",17.63,"Low","Fair","2015-10-19",0.042,38.3,332,NA,11.335,0.173,0,10440,0,9.25349564229011,0,"Unknow"
"SOAD00592","Flumevale","Yes","Irrigation","Earth",7.223,0.4,21000,"1910","1971S;1973H",0.21473,0,"Uncontrolled","30/03/2022","1",0,"High","Satisfactory","2022-03-30",0.1017,35.5,289.8,3,7.223,0.4,0,21000,0,9.95232533461943,2,"1973"
"SOAD07605","Flumevale","Yes","Irrigation","Earth",16.806,0.28,0,"1930","",0.11623,5.32658,"","24/09/2021","1",NA,"High","Satisfactory","2017-09-01",0.0957,25.1,943.2,11.5,16.806,0.28,0,NA,1,NA,0,"Unknow"
"SOAD07902","Flumevale","Yes","Fish and Wildlife Pond","Earth",4.378,0.053,2171,"1967","",0,0,"Uncontrolled","27/06/2017","10",28.33,"Low","Not Rated",NA,0.0556,19.2,470.3,NA,4.378,0.053,0,2171,0,7.68340368105383,0,"Unknow"
"SOAD09474","Flumevale","Yes","Recreation","Earth",12.091,0.3,51000,"1911","1973S;1987S;2004S",0.10047,7.98987,"Uncontrolled","26/05/2022","1",8.29,"High","Unsatisfactory","2022-05-26",0.1575,42.2,356.3,6.4,12.091,0.3,0,51000,0,10.8396005193574,3,"2004"
"SOAD09787","Flumevale","Yes","Water Supply","Earth",26.376,0.14,4400,"1980","",0.04137,47.93922,"","26/07/2022","2",3.28,"Significant","Fair","2022-07-26",0.1442,39,485.4,13.2,26.376,0.14,0,4400,0,8.38958706681109,0,"Unknow"
"SOAD19726","Flumevale","Yes","Water Supply","Earth",8.027,0.35,20000,"1952","",0.197,2.66329,"","31/01/2022","1",NA,"High","Satisfactory","2017-09-01",0.0892,19.9,581.3,10.5,8.027,0.35,0,20000,0,9.90353755128617,0,"Unknow"
"SOAD01327","Flumevale","Yes","Water Supply","Earth",4.107,0.267,28000,"1923","",0.32505,162.46069,"","07/04/2022","1",0,"High","Satisfactory","2017-09-01",0.1025,290.6,940.1,47.9,4.107,0.267,0,28000,0,10.2399955028053,0,"Unknow"
"SOAD03510","Flumevale","Yes","Water Supply","Earth",6.825,0.433,50000,"1980","",0.09653,NA,"","09/09/2021","1",0.16,"High","Satisfactory","2017-09-01",0.1022,46.4,767.1,25.7,6.825,0.433,0,50000,0,10.8197982842103,0,"Unknow"
"SOAD15664","Flumevale","Yes","Other","Earth",7.332,0.37,0,"Unknow","",0.2758,5.32658,"","24/05/2022","0.5",NA,"Low","Satisfactory","2017-09-01",0.0621,68.9,14.9,NA,7.332,0.37,0,NA,1,NA,0,"Unknow"
"SOAD11908","Flumevale","Yes","Fire Protection, Stock, Or Small Fish Pond","Earth",3.219,0.61,20324,"1908","",0.41173,0,"","07/10/1985","6",18.97,"Low","Not Rated",NA,0.0865,705.9,325.1,NA,3.219,0.61,0,20324,0,9.91960693441601,0,"Unknow"
"SOAD06974","Flumevale","Yes","Hydroelectric","Earth",5.713,0.02,300,"1855","",0,0,"","12/08/2019","3",NA,"Low","Satisfactory","2023-09-29",0.0669,43,17.1,NA,5.713,0.02,0,300,0,5.70711026474888,0,"Unknow"
"SOAD11682","Flumevale","Yes","Water Supply","Earth",9.674,0.147,8200,"1876","",0.17927,2.66329,"","29/06/2022","1",1.56,"Significant","Satisfactory","2017-09-01",0.1154,41.6,765.9,23.2,9.674,0.147,0,8200,0,9.01201137703641,0,"Unknow"
"SOAD17810","Flumevale","Yes","Flood Risk Reduction","Earth",14.105,0.266,42385,"1964","",0.13987,15.97974,"","04/04/2019","3",4.92,"Low","Satisfactory","2014-10-28",0.0631,38.3,749.8,NA,14.105,0.266,0,42385,0,10.6545733980165,0,"Unknow"
"SOAD18895","Flumevale","Yes","Water Supply","Earth",14.151,0.267,2000,"1959","",0.13987,NA,"","27/01/2022","0.5",NA,"Low","Satisfactory","2017-09-01",0.0685,20,5.6,53.6,14.151,0.267,0,2000,0,7.60140233458373,0,"Unknow"
"SOAD01653","Flumevale","Yes","Flood Risk Reduction","Earth",13.249,0.124,23830,"1964","",0.12805,13.31645,"","03/04/2019","3",21.83,"Low","Satisfactory","2019-10-03",0.0676,11,153.9,NA,13.249,0.124,0,23830,0,10.0787425331234,0,"Unknow"
"SOAD07614","Flumevale","Yes","Recreation","Earth",6.716,0.083,4331,"1944","",0,21.30632,"Uncontrolled","02/08/2017","Unknow",40.16,"Significant","Not Rated",NA,0.1196,18.1,186.7,8.9,6.716,0.083,0,4331,0,8.37378460812088,0,"Unknow"
"SOAD01739","Flumevale","Yes","Water Supply","Earth",4.305,0.029,NA,"1961","2002H",0.15366,7.98987,"Uncontrolled","13/08/2008","6",4.73,"Low","Fair","2022-09-29",0.0628,32.8,757.3,25.8,4.305,0.029,0,NA,1,NA,1,"2002"
"SOAD07092","Flumevale","Yes","Irrigation","Earth",14.342,0.182,NA,"1911","1956",0.11032,7.98987,"","18/02/2014","6",16.86,"Low","Unsatisfactory","2010-08-06",0.0831,37.9,123.2,37.7,14.342,0.182,0,NA,1,NA,1,"1956"
"SOAD16852","Flumevale","Yes","Water Supply","Earth",4.831,0.553,14400,"1955","",0.32505,7.98987,"","27/04/2022","0.5",NA,"Low","Satisfactory","2017-09-01",0.0781,126.5,5,62.3,4.831,0.553,0,14400,0,9.57505292759738,0,"Unknow"
"SOAD20662","Flumevale","Yes","Irrigation","Earth",14.038,0.247,78385,"1925","",0.11426,7.98987,"","29/09/2020","6",36.54,"Low","Satisfactory","2018-10-01",0.0432,45.5,181.1,3.4,14.038,0.247,0,78385,0,11.2694006189642,0,"Unknow"
"SOAD01071","Flumevale","Yes","Water Supply","Earth",15.034,0.285,30000,"1878","",0.10047,0,"","24/05/2023","1",0.31,"High","Fair","2017-09-01",0.1194,20.9,838.9,49.3,15.034,0.285,0,30000,0,10.3089859934221,0,"Unknow"
"SOAD03291","Flumevale","Yes","Debris Control","Earth",16.678,0.218,131000,"1960","",0.0886499999999999,39.94935,"","01/12/2021","1",0,"High","Satisfactory","2017-09-01",0.1009,41.5,171.5,NA,16.678,0.218,0,131000,0,11.7829602357419,0,"Unknow"
"SOAD05411","Flumevale","Yes","Flood Risk Reduction","Earth",14.975,0.231,34650,"1957","",0.08471,37.28606,"Uncontrolled","17/04/2014","3",10.01,"Low","Not Rated",NA,0.1027,9.8,385.3,NA,14.975,0.231,0,34650,0,10.4530818642305,0,"Unknow"
"SOAD11714","Flumevale","Yes","Recreation","Earth",7.84,0.467,28324,"1977","2009",0.15366,0,"Uncontrolled","23/06/2022","1",0,"High","Fair","2022-06-23",0.1182,34.6,409.4,9,7.84,0.467,0,28324,0,10.2515000858962,1,"2009"
"SOAD06814","Flumevale","Yes","Irrigation","Earth",16.008,0.073,17926,"1949","",0.07486,0,"Uncontrolled","11/06/2019","6",43.93,"Low","Not Rated",NA,0.0638,25.2,120.7,32.7,16.008,0.073,0,17926,0,9.79406323525484,0,"Unknow"
"SOAD11075","Flumevale","Yes","Irrigation","Earth",2.87,0.546,NA,"1920","",0.32505,0,"","29/08/1990","0",63.88,"Low","Not Rated",NA,0.0847,455,135.4,23.3,2.87,0.546,0,NA,1,NA,0,"Unknow"
"SOAD12308","Flumevale","Yes","Recreation","Earth",12.997,0.127,24600,"1960","",0.13987,34.62277,"Uncontrolled","20/10/2022","1",9.17,"High","Satisfactory","2022-10-20",0.0984,35.4,368.8,4.7,12.997,0.127,0,24600,0,10.1105423715008,0,"Unknow"
"SOAD20506","Flumevale","Yes","Recreation","Earth",10.419,0.162,34458,"1965","",0.14184,7.98987,"Uncontrolled","24/09/2019","6",28.75,"Low","Not Rated",NA,0.0356,5,174.7,7.2,10.419,0.162,0,34458,0,10.4475254905082,0,"Unknow"
"SOAD05597","Flumevale","Yes","Flood Risk Reduction","Earth",10.814,0.214,27430,"1960","",0.13199,13.31645,"Uncontrolled","01/11/2011","3",8.03,"Low","Not Rated",NA,0.1081,27.7,360.9,NA,10.814,0.214,0,27430,0,10.2194290397017,0,"Unknow"
"SOAD09367","Flumevale","Yes","Water Supply","Earth",7.118,0.23,63618,"1888","",0.08274,0,"Uncontrolled","21/04/2009","0",0,"Low","Fair","2016-08-09",0.0861,21.9,257.5,21.3,7.118,0.23,0,63618,0,11.060667446852,0,"Unknow"
"SOAD14184","Flumevale","Yes","Irrigation","Earth",7.031,0.28,37611,"1980","",0.14972,15.97974,"","10/09/2021","6",45.29,"Low","Satisfactory","2019-07-15",0.0533,9.6,128.4,42.7,7.031,0.28,0,37611,0,10.535078427397,0,"Unknow"
"SOAD15713","Flumevale","Yes","Water Supply","Earth",17.479,0.137,6e+05,"1982","",0.08471,7.98987,"","04/10/2021","0.5",NA,"Low","Satisfactory","2017-09-01",0.0747,29,6.6,20.4,17.479,0.137,0,6e+05,0,13.3046866008636,0,"Unknow"
"SOAD05109","Flumevale","Yes","Flood Risk Reduction","Earth",17.926,0.253,55000,"1954","",0.12017,15.97974,"","09/03/2022","1",3.02,"High","Satisfactory","2017-09-01",0.0972,5.7,186.1,NA,17.926,0.253,0,55000,0,10.9151066458675,0,"Unknow"
"SOAD05778","Flumevale","Yes","Irrigation","Earth",9.137,0.133,16410,"1950","",0.11032,0,"","17/08/2016","6",24.38,"Low","Satisfactory","2014-08-06",0.0475,5.1,202.2,17.6,9.137,0.133,0,16410,0,9.70570712067963,0,"Unknow"
"SOAD14506","Flumevale","Yes","Flood Risk Reduction","Earth",18.803,0.389,175000,"1990","",0.11229,15.97974,"","23/02/2022","1",0.16,"High","Satisfactory","2017-09-01",0.1034,28.2,418.1,NA,18.803,0.389,0,175000,0,12.072546967175,0,"Unknow"
"SOAD01248","Flumevale","Yes","Flood Risk Reduction","Earth",12.464,0.35,51434,"1974","",0.13593,13.31645,"Uncontrolled","21/02/2017","3",64.1,"Low","Not Rated",NA,0.1069,42.1,78.3,NA,12.464,0.35,0,51434,0,10.8480741535651,0,"Unknow"
"SOAD01728","Flumevale","Yes","Fish and Wildlife Pond","Earth",8.65,0.032,NA,"1956","",0.13002,0,"","19/09/2019","6",68.96,"Low","Satisfactory","2021-10-05",0.0433,29.6,200.3,NA,8.65,0.032,0,NA,1,NA,0,"Unknow"
"SOAD06352","Flumevale","Yes","Water Supply","Earth",7.673,0.023,0,"1904","",0.22655,2.66329,"","31/05/2022","0.5",NA,"Low","Satisfactory","2017-09-01",0.0685,47.4,22.2,46.5,7.673,0.023,0,NA,1,NA,0,"Unknow"
"SOAD16008","Flumevale","Yes","Other","Earth",14.104,0.723,98000,"1990","",0.14578,0,"","01/09/2021","0.5",NA,"Low","Satisfactory","2017-09-01",0.0786,9.7,15.7,NA,14.104,0.723,0,98000,0,11.4927329616823,0,"Unknow"
"SOAD18228","Flumevale","Yes","Water Supply","Earth",40.694,0.217,262292,"1869","",0.12608,18.64303,"","16/08/2022","1",1.64,"High","Satisfactory","2017-09-01",0.1053,7,243,34.1,40.694,0.217,0,262292,0,12.4772174784992,0,"Unknow"
"SOAD20120","Flumevale","Yes","Recreation","Earth",8.437,0.187,12326,"1967","1968H;2008H;2008M",0.12214,189.09359,"Uncontrolled","08/12/2015","6",40.02,"Low","Satisfactory","2019-09-06",0.0482,46.2,182.4,4.8,8.437,0.187,0,12326,0,9.41954725755152,3,"2008"
"SOAD20179","Flumevale","Yes","Fire Protection, Stock, Or Small Fish Pond","Earth",10.988,0.175,NA,"1932","",0.13002,0,"","11/10/2011","6",15.35,"Low","Not Rated",NA,0.0526,45.2,237.8,NA,10.988,0.175,0,NA,1,NA,0,"Unknow"
"SOAD06086","Flumevale","Yes","Irrigation","Earth",2.554,0.248,4851,"1902","",0.61267,0,"","12/06/1991","0",20.66,"Low","Not Rated",NA,0.0481,478.1,155.8,33.3,2.554,0.248,0,4851,0,8.48714627006394,0,"Unknow"
"SOAD05346","Flumevale","No","Flood Risk Reduction","Earth",5.987,0.03,4000,"Unknow","",0.12805,2.66329,"Uncontrolled","07/11/2020","1",NA,"High","Not Rated",NA,0.1149,46.6,805.8,NA,5.987,0.03,0,4000,0,8.29429960885724,0,"Unknow"
"SOAD07848","Flumevale","Yes","Water Supply","Earth",24.383,0.108,65000,"1999","",0.08471,5.32658,"","27/10/2021","1",3.96,"High","Satisfactory","2017-09-01",0.0905,37.3,305.9,49.2,24.383,0.108,0,65000,0,11.0821579333748,0,"Unknow"
"SOAD18770","Flumevale","Yes","Irrigation","Earth",12.155,0.072,NA,"Unknow","1959",0.05713,21.30632,"","30/07/2012","6",17.88,"Low","Unsatisfactory","2019-08-08",0.0823,5.4,257.7,1.7,12.155,0.072,0,NA,1,NA,1,"1959"
"SOAD19205","Flumevale","Yes","Water Supply","Earth",8.678,0.06,0,"Unknow","",0.13593,5.32658,"","13/04/2022","0.5",NA,"Low","Satisfactory","2017-09-01",0.076,39.5,8.4,42.1,8.678,0.06,0,NA,1,NA,0,"Unknow"
"SOAD05385","Flumevale","Yes","Water Supply","Earth",7.495,0.156,10670,"1978","",0.21079,NA,"","26/04/2022","0.5",NA,"Low","Satisfactory","2017-09-01",0.0683,8.3,9.1,8.2,7.495,0.156,0,10670,0,9.27528506061656,0,"Unknow"
"SOAD16804","Flumevale","Yes","Irrigation","Earth",11.6,0.092,8761,"1948","",0.0906199999999999,0,"Uncontrolled","15/07/2021","2",16.77,"Significant","Satisfactory","2021-07-15",0.1423,39.2,318.2,41,11.6,0.092,0,8761,0,9.07817946837384,0,"Unknow"
"SOAD08583","Flumevale","Yes","Irrigation","Earth",6.435,0.19,NA,"1949","",0.17139,7.98987,"Uncontrolled","24/08/1987","6",96.41,"Low","Satisfactory","2018-06-28",0.0411,15.2,86.6,42.4,6.435,0.19,0,NA,1,NA,0,"Unknow"
"SOAD05695","Flumevale","Yes","Recreation","Earth",3.986,0.11,0,"1892","",0.17139,0,"Uncontrolled","23/03/2022","2",0,"Significant","Satisfactory","2022-03-23",0.1415,22.7,396.7,5,3.986,0.11,0,NA,1,NA,0,"Unknow"
"SOAD19963","Flumevale","Yes","Water Supply","Earth",13.806,0.833,NA,"1901","2001",0.0925899999999999,0,"Uncontrolled","29/03/2022","1",3.07,"High","Fair","2022-03-29",0.1287,44,892,21.7,13.806,0.833,0,NA,1,NA,1,"2001"
"SOAD19007","Flumevale","Yes","Irrigation","Earth",3.064,0.15,5571,"1923","",0.31914,13.31645,"Uncontrolled","21/06/2018","6",3.22,"Low","Not Rated",NA,0.0279,501,448.4,24.7,3.064,0.15,0,5571,0,8.6255093348997,0,"Unknow"
"SOAD20544","Flumevale","Yes","Water Supply","Earth",12.974,0.053,5000,"1877","",0.14381,5.32658,"","21/07/2021","1",3.99,"High","Satisfactory","2021-08-23",0.1013,40.2,491.3,24.1,12.974,0.053,0,5000,0,8.5173931714189,0,"Unknow"
"SOAD09764","Flumevale","Yes","Irrigation","Earth",5.516,0.567,33608,"1896","",0.20882,0,"Uncontrolled","25/08/2020","6",7.66,"Low","Satisfactory","2016-08-17",0.0602,40.5,349,18.5,5.516,0.567,0,33608,0,10.4225491672268,0,"Unknow"
"SOAD01273","Flumevale","Yes","Flood Risk Reduction","Earth",13.178,0.333,3e+05,"2007","",0.0788,2.66329,"","04/05/2022","1",0.64,"High","Satisfactory","2017-09-01",0.0832,13.2,841.7,NA,13.178,0.333,0,3e+05,0,12.6115410869661,0,"Unknow"
"SOAD01958","Flumevale","Yes","Irrigation","Earth",10.501,0.117,34742,"1908","",0.32111,13.31645,"","16/05/2019","6",3.09,"Low","Satisfactory","2019-06-07",0.0439,402.9,683,31.2,10.501,0.117,0,34742,0,10.4557333918525,0,"Unknow"
"SOAD04999","Flumevale","Yes","Water Supply","Earth",14.775,0.436,48100,"1993","",0.14578,0,"","24/09/2021","0.5",NA,"Low","Satisfactory","2017-09-01",0.0729,9.1,6.5,13.8,14.775,0.436,0,48100,0,10.7810582458985,0,"Unknow"
"SOAD07213","Flumevale","Yes","Other","Earth",13.323,0.2,43000,"1967","",0.12411,7.98987,"","08/06/2022","0.5",NA,"Low","Satisfactory","2017-09-01",0.0756,8.8,7.7,NA,13.323,0.2,0,43000,0,10.6689786502192,0,"Unknow"
"SOAD07724","Flumevale","Yes","Fish and Wildlife Pond","Earth",5.457,0.067,2861,"1990","",0.20488,13.31645,"Uncontrolled","24/05/2021","2",8.43,"Significant","Fair","2021-05-24",0.1328,18.5,469.1,NA,5.457,0.067,0,2861,0,7.9592759601164,0,"Unknow"
"SOAD05151","Flumevale","Yes","Other","Earth",10.759,0.267,0,"1925","",0.13002,2.66329,"","31/08/2022","1",0.32,"High","Satisfactory","2017-09-01",0.0997,21.6,926.5,NA,10.759,0.267,0,NA,1,NA,0,"Unknow"
"SOAD06738","Flumevale","Yes","Debris Control","Earth",19.987,0.28,557000,"1960","",0.08668,53.2658,"","18/11/2021","1",0,"High","Satisfactory","2017-09-01",0.1015,30.1,493.9,NA,19.987,0.28,0,557000,0,13.2303223142399,0,"Unknow"
"SOAD13988","Flumevale","Yes","Flood Risk Reduction","Earth",10.604,0.327,22236,"1977","",0.17927,21.30632,"Uncontrolled","21/02/2017","3",45.2,"Low","Satisfactory","2013-06-25",0.0742,46.7,221,NA,10.604,0.327,0,22236,0,10.0095128471794,0,"Unknow"
"SOAD17663","Flumevale","Yes","Flood Risk Reduction","Earth",7.922,0.308,19200,"1971","",0.17336,42.61264,"Uncontrolled","01/02/2012","6",46.21,"Low","Not Rated",NA,0.0768,32.9,229.3,NA,7.922,0.308,0,19200,0,9.86271763999292,0,"Unknow"
"SOAD04867","Flumevale","Yes","Other","Earth",13.337,0.134,29718,"1896","",0.15366,5.32658,"","20/12/2021","1",0,"High","Satisfactory","2017-09-01",0.0858,42.1,351.6,NA,13.337,0.134,0,29718,0,10.2995418508901,0,"Unknow"
"SOAD05379","Flumevale","Yes","Flood Risk Reduction","Earth",21.869,0.123,188000,"2015","",0.06107,NA,"","20/04/2022","1",0,"High","Satisfactory","2017-09-01",0.0893,46.8,162.5,NA,21.869,0.123,0,188000,0,12.1442025609469,0,"Unknow"
"SOAD09693","Flumevale","Yes","Irrigation","Earth",4.165,0.165,45603,"1909","",0.1182,0,"Controlled","17/08/1988","6",0,"Low","Fair","2016-05-13",0.0697,46,265.4,25.7,4.165,0.165,0,45603,0,10.7277507109536,0,"Unknow"
"SOAD10965","Flumevale","Yes","Water Supply","Earth",10.931,0.19,20000,"1958","",0.197,7.98987,"","23/02/2022","1",NA,"High","Satisfactory","2017-09-01",0.0712,23.6,798.1,63.7,10.931,0.19,0,20000,0,9.90353755128617,0,"Unknow"
"SOAD00025","Flumevale","Yes","Flood Risk Reduction","Earth",6.74,1.533,17250,"2001","",0.12608,NA,"","16/02/2022","1",0.16,"Significant","Satisfactory","2017-09-01",0.1363,18,785.4,NA,6.74,1.533,0,17250,0,9.75562539179374,0,"Unknow"
"SOAD10383","Flumevale","Yes","Irrigation","Earth",7.686,0.14,9853,"1890","1959",0.12017,0,"Uncontrolled","05/10/2021","6",33.58,"Low","Unsatisfactory","2021-06-09",0.0844,20.1,114.2,40.2,7.686,0.14,0,9853,0,9.19563274310391,1,"1959"
"SOAD14704","Flumevale","Yes","Irrigation","Earth",8.416,0.265,54638,"1889","",0.11229,0,"","30/08/2021","6",10.86,"Low","Satisfactory","2021-06-09",0.0461,36,351.2,34.4,8.416,0.265,0,54638,0,10.9085031924667,0,"Unknow"
"SOAD07490","Flumevale","Yes","Irrigation","Earth",8.974,0.473,NA,"1944","",0.20094,45.27593,"Uncontrolled","02/01/2014","6",95.7,"Low","Fair","2017-07-21",0.0551,37.3,109.4,39.7,8.974,0.473,0,NA,1,NA,0,"Unknow"
"SOAD08213","Flumevale","Yes","Irrigation","Earth",4.095,0.083,0,"1904","",0.10441,0,"","16/09/1985","6",21.67,"Low","Fair","2020-10-06",0.0402,26.7,183.2,31.2,4.095,0.083,0,NA,1,NA,0,"Unknow"
"SOAD10950","Flumevale","Yes","Water Supply","Earth",11.517,0.2,2000,"1905","",0.20488,10.65316,"","24/05/2022","1",0.16,"High","Satisfactory","2017-09-01",0.1124,23.5,383.6,23.8,11.517,0.2,0,2000,0,7.60140233458373,0,"Unknow"
"SOAD11214","Flumevale","Yes","Irrigation","Earth",23.522,0.261,197100,"1961","2008",0.06304,0,"Uncontrolled","01/10/2018","1",13.52,"High","Not Available",NA,0.1312,10.1,455.4,25,23.522,0.261,0,197100,0,12.1914715666947,1,"2008"
"SOAD11560","Flumevale","Yes","Water Supply","Earth",11.306,0.78,119000,"1980","",0.197,2.66329,"","08/03/2022","1",0,"High","Satisfactory","2017-09-01",0.0955,45.7,899,26.8,11.306,0.78,0,119000,0,11.6868871754197,0,"Unknow"
"SOAD19369","Flumevale","Yes","Recreation","Earth",14.86,0.127,30826,"1974","",0.0886499999999999,7.98987,"Uncontrolled","29/09/2022","6",35.82,"Low","Not Rated",NA,0.0766,46.7,144.1,5.8,14.86,0.127,0,30826,0,10.3361462083284,0,"Unknow"
"SOAD20145","Flumevale","Yes","Water Supply","Earth",6.356,0.242,18000,"1954","",0.31126,5.32658,"","23/03/2022","0.5",NA,"Low","Satisfactory","2017-09-01",0.0559,247.3,12.8,55.4,6.356,0.242,0,18000,0,9.7981825908907,0,"Unknow"
"SOAD06145","Flumevale","Yes","Water Supply","Earth",7.91,0.115,4727,"1910","",0.16154,10.65316,"","16/06/2022","1",NA,"High","Satisfactory","2017-09-01",0.0816,45.9,505.3,7,7.91,0.115,0,4727,0,8.46125755908593,0,"Unknow"
"SOAD06651","Flumevale","Yes","Water Supply","Earth",11.257,0.233,30000,"1952","",0.10441,2.66329,"","10/05/2022","1",0,"High","Satisfactory","2017-09-01",0.1032,22.1,930.1,7.6,11.257,0.233,0,30000,0,10.3089859934221,0,"Unknow"
"SOAD11760","Flumevale","No","Debris Control","Earth",17.084,0.433,0,"1954","",0.00788,237.03281,"Uncontrolled","27/02/2024","5",1.59,"High","Not Available",NA,0.0959,37.6,256.1,NA,17.084,0.433,0,NA,1,NA,0,"Unknow"
"SOAD17356","Flumevale","Yes","Fire Protection, Stock, Or Small Fish Pond","Earth",8.565,0.367,NA,"1901","",0.09653,21.30632,"","13/04/1992","0",28,"Low","Not Rated",NA,0.1148,31,177,NA,8.565,0.367,0,NA,1,NA,0,"Unknow"
"SOAD18046","Flumevale","Yes","Fish and Wildlife Pond","Earth",7.837,0.042,0,"1882","",0.07289,0,"Uncontrolled","03/05/1994","6",3.09,"Low","Fair","2022-06-10",0.0759,28.3,668.1,NA,7.837,0.042,0,NA,1,NA,0,"Unknow"
"SOAD19627","Flumevale","Yes","Irrigation","Earth",7.524,0.19,31377,"1895","",0.17336,13.31645,"Uncontrolled","28/05/2021","6",11.34,"Low","Not Rated",NA,0.0438,15.3,344.2,6.7,7.524,0.19,0,31377,0,10.3538622893929,0,"Unknow"
"SOAD05813","Flumevale","Yes","Irrigation","Earth",15.807,0.23,37407,"1906","",0.09653,7.98987,"Uncontrolled","18/10/2022","6",34.88,"Low","Unsatisfactory","2022-05-10",0.071,8.1,144.8,12,15.807,0.23,0,37407,0,10.5296398642718,0,"Unknow"
"SOAD02615","Flumevale","No","Other","Earth",5.265,0.033,NA,"1952","",NA,NA,"Uncontrolled","05/08/2020","10",NA,"Low","Not Rated",NA,0.0199,10,21.7,NA,5.265,0.033,0,NA,1,NA,0,"Unknow"
"SOAD04381","Flumevale","Yes","Water Supply","Earth",23.85,0.239,NA,"1990","",0.07486,0,"Uncontrolled","19/05/2022","2",12.57,"Significant","Satisfactory","2022-05-19",0.1274,16.5,167.3,28.1,23.85,0.239,0,NA,1,NA,0,"Unknow"
"SOAD06296","Flumevale","Yes","Irrigation","Earth",6.243,0.203,31400,"Unknow","2022",0.14972,7.98987,"Uncontrolled","12/10/2022","6",24.65,"Low","Not Rated",NA,0.0602,9.6,312.4,17.1,6.243,0.203,0,31400,0,10.354595018523,1,"2022"
"SOAD10146","Flumevale","Yes","Water Supply","Earth",8.348,1.233,0,"1910","",0.24034,NA,"","08/06/2023","1",0,"High","Poor","2018-04-06",0.124,30.9,710.5,35.5,8.348,1.233,0,NA,1,NA,0,"Unknow"
"SOAD19457","Flumevale","Yes","Recreation","Earth",8.145,0.264,29532,"1955","",0.22852,2761.83173,"Uncontrolled","17/05/2011","6",5.04,"Low","Fair","2016-10-26",0.0456,32.6,326.3,7.2,8.145,0.264,0,29532,0,10.2932635611797,0,"Unknow"
"SOAD02167","Flumevale","Yes","Irrigation","Earth",6,0.15,3958,"1967","",0.25019,66.58225,"Uncontrolled","07/07/2017","6",31.39,"Low","Fair","2004-08-02",0.0436,113.3,204.7,3.7,6,0.15,0,3958,0,8.28374674710613,0,"Unknow"
"SOAD11887","Flumevale","Yes","Irrigation","Earth",11.146,0.091,44040,"1957","",0.2167,0,"Uncontrolled","11/07/2018","6",16.04,"Low","Not Rated",NA,0.0775,10.7,362.7,31.9,11.146,0.091,0,44040,0,10.6928762972092,0,"Unknow"
"SOAD12955","Flumevale","Yes","Water Supply","Earth",10.83,0.207,41000,"1971","",0.14972,0,"","09/02/2022","1",NA,"High","Satisfactory","2017-09-01",0.0851,33.7,817.4,38.7,10.83,0.207,0,41000,0,10.6213517356329,0,"Unknow"
"SOAD14568","Flumevale","Yes","Irrigation","Earth",3.256,0.102,0,"1940","",0.09653,7.98987,"Uncontrolled","22/07/1986","6",24.84,"Low","Not Rated",NA,0.0962,30.4,111.2,6.9,3.256,0.102,0,NA,1,NA,0,"Unknow"
"SOAD17025","Flumevale","Yes","Water Supply","Earth",21.253,0.106,47688,"1967","",0.08077,5.32658,"","26/04/2022","0.5",NA,"Low","Satisfactory","2017-09-01",0.0615,8.1,22.6,27.5,21.253,0.106,0,47688,0,10.7724560423159,0,"Unknow"
"SOAD09799","Flumevale","Yes","Water Supply","Earth",20.054,0.313,64000,"1951","",0.10441,7.98987,"","02/08/2022","1",24.51,"High","Satisfactory","2017-09-01",0.0872,41.7,371.2,32.2,20.054,0.313,0,64000,0,11.0666539872197,0,"Unknow"
"SOAD17714","Flumevale","Yes","Water Supply","Earth",14.56,0.383,32530,"1910","",0.08471,2.66329,"","27/04/2022","0.5",NA,"Low","Satisfactory","2017-09-01",0.0762,33.3,20.3,11.2,14.56,0.383,0,32530,0,10.3899487598495,0,"Unknow"
"SOAD18949","Flumevale","Yes","Water Supply","Earth",44.825,0.3,267000,"1968","",0.0591,0,"","01/09/2022","1",0.32,"High","Satisfactory","2017-09-01",0.1064,6.4,548,52.2,44.825,0.3,0,267000,0,12.4950076826937,0,"Unknow"
"SOAD07772","Flumevale","Yes","Water Supply","Earth",3.567,0.267,NA,"1901","",0.18715,0,"Uncontrolled","25/04/2022","6",1.59,"Low","Not Rated",NA,0.0568,28.4,887.5,42.7,3.567,0.267,0,NA,1,NA,0,"Unknow"
"SOAD11789","Flumevale","Yes","Water Supply","Earth",26.253,0.128,54260,"1978","",0.05516,0,"","27/01/2022","0.5",NA,"Low","Satisfactory","2017-09-01",0.0662,35.4,13.1,13.2,26.253,0.128,0,54260,0,10.9015610158256,0,"Unknow"
"SOAD14931","Flumevale","Yes","Water Supply","Earth",37.089,0.218,298200,"1941","",0.0591,0,"","17/08/2022","1",0.79,"High","Satisfactory","2017-09-01",0.1082,14.8,597.2,61.6,37.089,0.218,0,298200,0,12.6055230347612,0,"Unknow"
"SOAD17216","Flumevale","Yes","Other","Earth",18.135,0.153,42000,"1955","",0.0906199999999999,18.64303,"","26/10/2021","1",NA,"High","Satisfactory","2017-09-01",0.0921,18.1,610.8,NA,18.135,0.153,0,42000,0,10.6454487065059,0,"Unknow"
"SOAD17458","Flumevale","Yes","Irrigation","Earth",12.548,0.167,29133,"1915","1977M;1977S;1987H;1987S;2011M;2011S",0.11032,7.98987,"Uncontrolled","13/07/2021","2",11.49,"Significant","Satisfactory","2021-07-13",0.1381,7.7,174.6,5.3,12.548,0.167,0,29133,0,10.2796611560089,6,"2011"
"SOAD08733","Flumevale","Yes","Flood Risk Reduction","Earth",9.105,0.305,38960,"1959","",0.14578,13.31645,"Uncontrolled","29/04/2014","3",24.59,"Low","Not Rated",NA,0.0922,25.9,444.9,NA,9.105,0.305,0,38960,0,10.5703164247782,0,"Unknow"
"SOAD09885","Flumevale","Yes","Irrigation","Earth",5.808,0.181,20219,"1906","",0.15169,0,"Uncontrolled","29/08/2018","6",27.63,"Low","Fair","2018-08-07",0.0637,34.1,268.1,14.7,5.808,0.181,0,20219,0,9.91442749257446,0,"Unknow"
"SOAD12878","Flumevale","Yes","Water Supply","Earth",10.581,0.14,135000,"1999","",0.0788,0,"","11/05/2022","1",8.91,"High","Satisfactory","2017-09-01",0.0879,18.9,327.7,51.7,10.581,0.14,0,135000,0,11.8130374648005,0,"Unknow"
"SOAD13536","Flumevale","Yes","Water Supply","Earth",8.53,0.747,63000,"1995","",0.16942,2.66329,"","23/09/2021","1",0,"High","Satisfactory","2017-09-01",0.0725,13.2,318,59.7,8.53,0.747,0,63000,0,11.0509058782636,0,"Unknow"
"SOAD15805","Flumevale","Yes","Fish and Wildlife Pond","Earth",5.112,0.545,26400,"1908","2002H;2002S",0.20094,2.66329,"","12/09/2018","5",NA,"Low","Satisfactory","2018-09-12",0.0482,8.3,16.9,NA,5.112,0.545,0,26400,0,10.1811571672049,2,"2002"
"SOAD00954","Flumevale","Yes","Irrigation","Earth",6.125,0.25,22917,"1893","",0.13396,0,"","24/08/2016","6",34.75,"Low","Satisfactory","2021-09-09",0.0443,31.2,171.4,41.2,6.125,0.25,0,22917,0,10.0396779069864,0,"Unknow"
"SOAD05215","Flumevale","Yes","Irrigation","Earth",6.756,0.96,NA,"1935","",0.1576,0,"","10/05/2022","6",1.59,"Low","Fair","2009-07-16",0.0589,25.1,876.9,42.6,6.756,0.96,0,NA,1,NA,0,"Unknow"
"SOAD17095","Flumevale","Yes","Flood Risk Reduction","Earth",10.589,0.299,47950,"1958","",0.14578,21.30632,"Uncontrolled","21/08/2014","3",0,"Low","Satisfactory","2016-09-22",0.0668,20.7,558.2,NA,10.589,0.299,0,47950,0,10.7779349351515,0,"Unknow"
"SOAD20374","Flumevale","Yes","Flood Risk Reduction","Earth",11.926,0.182,13400,"1971","",0.14775,29.29619,"Uncontrolled","18/07/1991","3",28.56,"Low","Not Rated",NA,0.1168,31,258.5,NA,11.926,0.182,0,13400,0,9.50308461002023,0,"Unknow"
"SOAD01536","Flumevale","Yes","Irrigation","Earth",10.37,0.248,64372,"1908","",0.24822,15.97974,"Uncontrolled","12/10/2021","6",14.11,"Low","Satisfactory","2012-06-14",0.0253,77.6,334.8,9.3,10.37,0.248,0,64372,0,11.0724495695223,0,"Unknow"
"SOAD12789","Flumevale","Yes","Flood Risk Reduction","Earth",16.575,0.165,36933,"1973","",0.14184,21.30632,"Uncontrolled","28/05/2008","3",58.44,"Low","Not Rated",NA,0.075,36.6,80.6,NA,16.575,0.165,0,36933,0,10.5168878150058,0,"Unknow"
"SOAD08382","Flumevale","Yes","Fish and Wildlife Pond","Earth",3.597,0.143,7600,"1970","2004H;2004S",0.18124,42.61264,"","12/09/2018","5",NA,"Low","Unsatisfactory","2018-09-12",0.0931,26.5,10.9,NA,3.597,0.143,0,7600,0,8.93603509656604,2,"2004"
"SOAD19241","Flumevale","Yes","Hydroelectric","Earth",7.034,0.15,10700,"1909","",0.10835,0,"Uncontrolled","13/04/2022","1",9.59,"High","Satisfactory","2022-04-13",0.0852,19.8,416,81.1,7.034,0.15,0,10700,0,9.278092474027,0,"Unknow"
"SOAD10999","Flumevale","Yes","Water Supply","Earth",9.724,0.137,0,"1866","",0.17533,2.66329,"","13/06/2022","1",6.29,"Significant","Satisfactory","2017-09-01",0.1139,10.8,323.3,33.1,9.724,0.137,0,NA,1,NA,0,"Unknow"
"SOAD15985","Flumevale","Yes","Recreation","Earth",14.429,0.383,45765,"1900","1901S;1975S;1997H",0.12411,0,"Uncontrolled","18/11/2022","1",0,"High","Unsatisfactory","2022-11-18",0.1339,38.4,895.5,7.8,14.429,0.383,0,45765,0,10.7312967363395,3,"1997"
"SOAD20026","Flumevale","Yes","Irrigation","Earth",5.032,0.083,6668,"1899","",0.51811,0,"","19/04/2016","6",51.04,"Low","Fair","2018-09-14",0.0457,158.5,66.2,35,5.032,0.083,0,6668,0,8.80522520263231,0,"Unknow"
"SOAD17222","Flumevale","Yes","Irrigation","Earth",9.021,0.217,47847,"1940","",0.10441,135.82779,"","17/06/2020","6",1.53,"Low","Fair","2013-09-05",0.0613,27.8,471.5,25.9,9.021,0.217,0,47847,0,10.7757845987244,0,"Unknow"
"SOAD05269","Flumevale","Yes","Flood Risk Reduction","Earth",12.251,0.732,NA,"1970","",0.12017,0,"","21/06/2022","3",0,"High","Fair","2022-06-21",0.1013,24.7,884.5,NA,12.251,0.732,0,NA,1,NA,0,"Unknow"
"SOAD08683","Flumevale","Yes","Water Supply","Earth",4.668,1.717,95000,"2003","",0.1773,NA,"","18/04/2022","0.5",NA,"Low","Satisfactory","2017-09-01",0.0673,19.3,10.9,40,4.668,1.717,0,95000,0,11.4616426968431,0,"Unknow"
"SOAD11963","Flumevale","Yes","Water Supply","Earth",13.775,0.1,0,"1921","",0.12017,2.66329,"","09/09/2022","1",1.64,"High","Satisfactory","2017-09-01",0.0767,20,553.4,47.6,13.775,0.1,0,NA,1,NA,0,"Unknow"
"SOAD18918","Flumevale","Yes","Water Supply","Earth",26.623,0.083,0,"1889","",0.09653,7.98987,"","25/04/2023","1",0,"High","Fair","2021-06-02",0.1212,7.5,602.5,65.6,26.623,0.083,0,NA,1,NA,0,"Unknow"
"SOAD03446","Flumevale","Yes","Recreation","Earth",5.84,0.125,NA,"1922","",0.16154,85.22528,"","10/08/2010","6",54.32,"Low","Satisfactory","2018-05-08",0.0374,27.8,191.2,7.1,5.84,0.125,0,NA,1,NA,0,"Unknow"
"SOAD11949","Flumevale","Yes","Flood Risk Reduction","Earth",29.36,0.107,119700,"1956","",0.0886499999999999,31.95948,"","09/03/2022","1",1.61,"High","Satisfactory","2017-09-01",0.1017,22.4,96.7,NA,29.36,0.107,0,119700,0,11.69275224573,0,"Unknow"
"SOAD18372","Flumevale","Yes","Fish and Wildlife Pond","Earth",4.998,1.616,28495,"1906","",0.28959,0,"Uncontrolled","10/06/2016","6",9.43,"Low","Satisfactory","2021-11-18",0.0413,476.8,159.1,NA,4.998,1.616,0,28495,0,10.2575190055294,0,"Unknow"
"SOAD05579","Flumevale","Yes","Other","Earth",18.983,0.142,57000,"1952","",0.11229,2.66329,"","09/03/2022","1",0,"Significant","Satisfactory","2017-09-01",0.1259,9.1,172.9,NA,18.983,0.142,0,57000,0,10.9508240905224,0,"Unknow"
"SOAD03264","Flumevale","Yes","Fish and Wildlife Pond","Earth",3.404,0.2,5530,"1913","",0.16351,0,"Uncontrolled","11/07/2013","6",65.66,"Low","Not Rated",NA,0.0373,6.9,114.4,NA,3.404,0.2,0,5530,0,8.61812390999468,0,"Unknow"
"SOAD11274","Flumevale","Yes","Other","Earth",9.824,0.253,45000,"1957","",0.18715,2.66329,"","10/02/2022","1",1.56,"Significant","Satisfactory","2017-09-01",0.095,15.6,242.8,NA,9.824,0.253,0,45000,0,10.7144399907278,0,"Unknow"
"SOAD14420","Flumevale","Yes","Irrigation","Earth",12.663,0.093,16502,"1904","",0.13002,29.29619,"Uncontrolled","18/10/2018","6",9.65,"Low","Fair","2014-08-14",0.0626,25.5,366.5,37.2,12.663,0.093,0,16502,0,9.71129746154357,0,"Unknow"
"SOAD00436","Flumevale","Yes","Fire Protection, Stock, Or Small Fish Pond","Earth",4.046,0.127,NA,"Unknow","",0.12805,0,"","17/07/1978","0",25.08,"Low","Fair","2013-07-25",0.0777,44,145.6,NA,4.046,0.127,0,NA,1,NA,0,"Unknow"
"SOAD02598","Flumevale","Yes","Recreation","Earth",12.95,0.087,0,"1952","",0.1576,0,"Uncontrolled","28/10/2019","0",6.44,"Low","Fair","2010-06-04",0.0786,10,317.5,5.3,12.95,0.087,0,NA,1,NA,0,"Unknow"
"SOAD19124","Flumevale","Yes","Irrigation","Earth",7.303,0.077,NA,"2012","",0.19306,58.59238,"Uncontrolled","","6",NA,"Low","Fair","2021-08-30",0.0707,30.8,11.4,32.1,7.303,0.077,0,NA,1,NA,0,"Unknow"
"SOAD03980","Flumevale","Yes","Hydroelectric","Earth",19.371,0.389,80000,"1913","",0.1576,NA,"","07/08/2023","1",3.3,"Significant","Satisfactory","2023-09-29",0.1223,17.3,837.6,84.7,19.371,0.389,0,80000,0,11.2897944135779,0,"Unknow"
"SOAD13580","Flumevale","Yes","Irrigation","Earth",3.697,0.68,NA,"2013","",0.13002,0,"Uncontrolled","","6",0,"Low","Not Rated",NA,0.0658,20.8,685.8,6.4,3.697,0.68,0,NA,1,NA,0,"Unknow"
"SOAD05775","Flumevale","Yes","Water Supply","Earth",5.142,0.08,2500,"1925","",0.16351,0,"","30/06/2022","0.5",NA,"Low","Satisfactory","2017-09-01",0.0766,36.5,8.5,10.3,5.142,0.08,0,2500,0,7.82444593087762,0,"Unknow"
"SOAD09617","Flumevale","Yes","Flood Risk Reduction","Earth",10.17,0.3,51100,"1963","",0.28171,34.62277,"","09/03/2022","1",0,"High","Satisfactory","2017-09-01",0.0833,68.2,680.6,NA,10.17,0.3,0,51100,0,10.8415593454719,0,"Unknow"
"SOAD12557","Flumevale","Yes","Water Supply","Earth",8.784,1,0,"1984","",0.08471,0,"","05/03/2020","6",19.52,"Low","Not Rated",NA,0.0622,39.3,428,51.9,8.784,1,0,NA,1,NA,0,"Unknow"
"SOAD19950","Flumevale","Yes","Irrigation","Earth",3.088,0.567,NA,"1911","1949",0.29747,0,"Uncontrolled","28/10/2014","6",56.4,"Low","Not Rated",NA,0.0541,710.1,222.4,32.3,3.088,0.567,0,NA,1,NA,1,"1949"
"SOAD11541","Flumevale","Yes","Water Supply","Earth",21.329,0.317,16420,"1959","",0.12017,0,"","04/08/2022","2",42.9,"Significant","Unsatisfactory","2022-08-04",0.1539,32.9,237.3,66.5,21.329,0.317,0,16420,0,9.70631628249184,0,"Unknow"
"SOAD04019","Flumevale","Yes","Irrigation","Earth",9.758,0.085,18700,"1959","",0.11426,0,"","07/09/2021","6",13.89,"Low","Not Rated",NA,0.1004,33.3,98.6,14,9.758,0.085,0,18700,0,9.83633227734872,0,"Unknow"
"SOAD13218","Flumevale","Yes","Irrigation","Earth",4.345,0.263,14963,"1875","",0.23246,0,"Uncontrolled","01/06/2016","6",1.64,"Low","Satisfactory","2015-06-04",0.0497,11.5,535.7,22.9,4.345,0.263,0,14963,0,9.61340259546804,0,"Unknow"
"SOAD17888","Flumevale","Yes","Irrigation","Earth",6.438,0.4,0,"1910","",0.22852,0,"Uncontrolled","08/04/2016","0",3.25,"Low","Fair","2015-09-10",0.0914,24.9,163.1,40.8,6.438,0.4,0,NA,1,NA,0,"Unknow"
"SOAD02092","Flumevale","Yes","Water Supply","Earth",56.785,0.147,199000,"2004","",0.0591,NA,"","25/01/2022","1",NA,"Significant","Satisfactory","2017-09-01",0.145,5.5,474.1,11.2,56.785,0.147,0,199000,0,12.2010651288196,0,"Unknow"
"SOAD17265","Flumevale","Yes","Irrigation","Earth",10.02,0.108,8610,"1955","",0.10441,0,"","30/06/2021","6",18.52,"Low","Not Rated",NA,0.0847,35.7,396.8,6.2,10.02,0.108,0,8610,0,9.06079573469617,0,"Unknow"
"SOAD00186","Flumevale","Yes","Irrigation","Earth",5.075,0.176,19558,"1950","",0.20291,87.88857,"","","6",22.22,"Low","Fair","2021-06-15",0.0603,8.1,122.1,23.2,5.075,0.176,0,19558,0,9.88119081753752,0,"Unknow"
"SOAD04039","Flumevale","Yes","Recreation","Earth",5.44,0.11,9045,"1904","",0.19306,0,"Uncontrolled","25/09/2013","6",41.93,"Low","Not Rated",NA,0.06,38.2,212,7.5,5.44,0.11,0,9045,0,9.11007795003779,0,"Unknow"
"SOAD19587","Flumevale","Yes","Flood Risk Reduction","Earth",13.906,0.231,NA,"2020","2019",0.0906199999999999,63.91896,"Uncontrolled","07/04/2022","3",0,"High","Satisfactory","2022-04-07",0.103,46.3,119.8,NA,13.906,0.231,0,NA,1,NA,1,"2019"
"SOAD19655","Flumevale","Yes","Debris Control","Earth",25.154,0.181,691000,"1960","",0.06698,23.96961,"","18/11/2021","1",0,"High","Satisfactory","2017-09-01",0.1057,39.6,162.1,NA,25.154,0.181,0,691000,0,13.4458965499268,0,"Unknow"
"SOAD02882","Flumevale","Yes","Irrigation","Earth",3.02,0.117,2742,"1969","",0.38809,0,"","23/07/2019","6",42.56,"Low","Not Rated",NA,0.0291,519.6,158.1,44.5,3.02,0.117,0,2742,0,7.9168074909376,0,"Unknow"
"SOAD11544","Flumevale","Yes","Recreation","Earth",8.386,0.097,10001,"1953","2009S",0,21.30632,"Uncontrolled","08/06/2017","1",0.5,"High","Not Rated",NA,0.1442,6.1,715.1,4.1,8.386,0.097,0,10001,0,9.21054035197885,1,"2009"
"SOAD16084","Flumevale","Yes","Water Supply","Earth",13.788,0.108,20000,"1991","",0.25216,7.98987,"","11/08/2022","0.5",NA,"Low","Satisfactory","2017-09-01",0.056,215.7,20.9,50.6,13.788,0.108,0,20000,0,9.90353755128617,0,"Unknow"
"SOAD04519","Flumevale","Yes","Irrigation","Earth",8.402,0.233,41482,"1956","",0.14381,50.60251,"","25/08/2014","6",99.02,"Low","Not Rated",NA,0.0797,24.1,119.6,45.7,8.402,0.233,0,41482,0,10.6330389837398,0,"Unknow"
"SOAD14243","Flumevale","Yes","Flood Risk Reduction","Earth",21.187,0.297,NA,"1968","",0.0985,7.98987,"","19/09/2016","3",70.39,"Low","Not Rated",NA,0.0942,43.8,226,NA,21.187,0.297,0,NA,1,NA,0,"Unknow"
"SOAD14259","Flumevale","Yes","Water Supply","Earth",12.652,1.012,150000,"1999","",0.10441,0,"","18/08/2022","1",0,"High","Satisfactory","2017-09-01",0.0993,32.6,850.3,68.2,12.652,1.012,0,150000,0,11.9183972397228,0,"Unknow"
"SOAD19834","Flumevale","Yes","Irrigation","Earth",8.25,0.126,20751,"1957","",0.12805,0,"","14/07/2021","6",13.79,"Low","Not Rated",NA,0.073,11.5,114.3,33.5,8.25,0.126,0,20751,0,9.94039790655622,0,"Unknow"
"SOAD09978","Flumevale","Yes","Other","Earth",5.852,0.5,NA,"Unknow","",0.18321,125.17463,"Uncontrolled","03/09/2019","6",16.83,"Low","Fair","2021-07-08",0.0674,13.4,261.6,NA,5.852,0.5,0,NA,1,NA,0,"Unknow"
"SOAD14909","Flumevale","Yes","Water Supply","Earth",11.856,0.347,90000,"1957","",0.16745,5.32658,"","28/06/2022","0.5",NA,"Low","Satisfactory","2017-09-01",0.0852,44,22.6,53.6,11.856,0.347,0,90000,0,11.4075760603618,0,"Unknow"
"SOAD19535","Flumevale","Yes","Irrigation","Earth",4.2,0.223,NA,"1911","",0.29353,0,"Uncontrolled","28/10/2014","6",56.35,"Low","Not Rated",NA,0.0404,68.2,140,46,4.2,0.223,0,NA,1,NA,0,"Unknow"
"SOAD07315","Flumevale","Yes","Water Supply","Earth",10.236,0.083,14000,"1968","",0.25216,18.64303,"","16/06/2022","0.5",NA,"Low","Satisfactory","2017-09-01",0.0793,493,11.9,18.7,10.236,0.083,0,14000,0,9.54688403461792,0,"Unknow"
"SOAD11421","Flumevale","Yes","Water Supply","Earth",12.485,0.25,6700,"1973","",0.08077,0,"","12/04/2019","6",9.54,"Low","Not Rated",NA,0.0759,47.4,355.1,19.7,12.485,0.25,0,6700,0,8.81001204797317,0,"Unknow"
"SOAD12120","Flumevale","Yes","Water Supply","Earth",17.292,0.2,23019,"1949","2009",0.09653,0,"Uncontrolled","04/08/2022","2",53.89,"Significant","Fair","2022-08-04",0.1531,19.6,128.6,48,17.292,0.2,0,23019,0,10.0441186822759,1,"2009"
"SOAD05028","Flumevale","Yes","Recreation","Earth",16.771,0.117,NA,"1906","",0.07289,0,"Uncontrolled","06/04/2022","1",0,"High","Unsatisfactory","2022-04-06",0.1493,27.9,814.9,8.3,16.771,0.117,0,NA,1,NA,0,"Unknow"
"SOAD10781","Flumevale","Yes","Water Supply","Earth",9.092,0.553,52000,"1962","",0.20882,0,"","26/04/2022","1",7.71,"Significant","Satisfactory","2017-09-01",0.1266,30.7,137.4,54.2,9.092,0.553,0,52000,0,10.8590182281479,0,"Unknow"
"SOAD13197","Flumevale","Yes","Other","Earth",28.191,0.2,5e+05,"1970","",0.10244,0,"","31/08/2022","0.5",NA,"Low","Satisfactory","2017-09-01",0.0664,23.9,7.4,NA,28.191,0.2,0,5e+05,0,13.1223653774023,0,"Unknow"
"SOAD14323","Flumevale","Yes","Irrigation","Earth",16.745,0.086,23344,"1950","1947H;1947M;1947S;1998H;1998S",0.05713,71.90883,"Uncontrolled","08/07/1997","0",23.68,"Low","Not Rated",NA,0.1243,19.6,189.2,20.4,16.745,0.086,0,23344,0,10.058138107405,5,"1998"
"SOAD00122","Flumevale","Yes","Irrigation","Earth",7.248,0.17,10320,"1911","1986H;1986M;1986S",0.15366,0,"Uncontrolled","20/10/2021","1",14.58,"High","Fair","2021-10-20",0.0993,7,251.8,3,7.248,0.17,0,10320,0,9.24193593356593,3,"1986"
"SOAD03223","Flumevale","Yes","Water Supply","Earth",6.005,3.461,1485300,"1984","",0.17533,NA,"","30/08/2022","0.5",NA,"Low","Satisfactory","2017-09-01",0.069,19.2,16,30.1,6.005,3.461,0,1485300,0,14.2111280032821,0,"Unknow"
"SOAD03812","Flumevale","Yes","Fire Protection, Stock, Or Small Fish Pond","Earth",8.691,0.1,NA,"1908","",0.2955,21.30632,"","20/02/1992","0",20.02,"Low","Not Rated",NA,0.1048,551.8,469.8,NA,8.691,0.1,0,NA,1,NA,0,"Unknow"
"SOAD04949","Flumevale","Yes","Irrigation","Earth",7.793,0.867,31823,"1903","",0.16351,0,"","27/08/2015","6",36.56,"Low","Fair","2015-08-06",0.0497,36.8,70.6,6.3,7.793,0.867,0,31823,0,10.3679760010938,0,"Unknow"
"SOAD01443","Flumevale","Yes","Water Supply","Earth",6.72,0.833,7557,"1888","1989S;2001H;2001S",0.14578,0,"Uncontrolled","11/10/2022","2",1.56,"Significant","Satisfactory","2022-10-11",0.1134,26.9,365.7,6.1,6.72,0.833,0,7557,0,8.93036188390943,3,"2001"
"SOAD01750","Flumevale","Yes","Fish and Wildlife Pond","Earth",13.196,0.123,NA,"1971","2000",0.03349,7.98987,"","30/10/2017","6",23.81,"Low","Not Rated",NA,0.0696,35.8,221.1,NA,13.196,0.123,0,NA,1,NA,1,"2000"
"SOAD09506","Flumevale","Yes","Recreation","Earth",8.495,0.145,25835,"1967","",0.16351,0,"Uncontrolled","24/09/2013","6",0,"Low","Fair","2019-05-07",0.0555,10.8,114.6,5,8.495,0.145,0,25835,0,10.1595241471524,0,"Unknow"
"SOAD13584","Flumevale","Yes","Unknow","Earth",5.827,1.353,NA,"Unknow","",1.76906,0,"Uncontrolled","04/09/2020","6",NA,"Low","Fair","2016-07-18",0.0512,149,17,NA,5.827,1.353,0,NA,1,NA,0,"Unknow"
"SOAD18727","Flumevale","Yes","Irrigation","Earth",9.37,0.455,72174,"1958","",0.13199,0,"","19/10/2017","6",13.9,"Low","Not Rated",NA,0.0611,11.6,251.7,32,9.37,0.455,0,72174,0,11.1868490045311,0,"Unknow"
"SOAD10797","Flumevale","Yes","Irrigation","Earth",22.493,0.133,0,"1991","",0.07289,7.98987,"Uncontrolled","14/08/2014","6",8.09,"Low","Not Rated",NA,0.0575,35.3,327.9,35.9,22.493,0.133,0,NA,1,NA,0,"Unknow"
"SOAD12106","Flumevale","Yes","Recreation","Earth",14.987,0.177,31199,"1964","",0.15366,396.83021,"","07/05/2021","2",11.12,"Significant","Satisfactory","2021-05-07",0.1129,28.8,336,3.7,14.987,0.177,0,31199,0,10.3481733737976,0,"Unknow"
"SOAD01151","Flumevale","Yes","Flood Risk Reduction","Earth",10.629,0.412,0,"1983","",0.14775,7.98987,"Uncontrolled","09/06/2021","3",4.94,"Low","Fair","2017-05-24",0.0958,39.6,185.9,NA,10.629,0.412,0,NA,1,NA,0,"Unknow"
"SOAD09364","Flumevale","Yes","Water Supply","Earth",9.687,0.453,29000,"1954","",0.27186,93.21515,"","28/03/2022","0.5",NA,"Low","Satisfactory","2017-09-01",0.0697,143.3,10.9,18.8,9.687,0.453,0,29000,0,10.2750855911327,0,"Unknow"
"SOAD18558","Flumevale","Yes","Other","Earth",11.825,0.057,12700,"1964","",0.17533,18.64303,"","25/05/2022","1",NA,"High","Satisfactory","2017-09-01",0.0884,44.4,594.4,NA,11.825,0.057,0,12700,0,9.44943600950432,0,"Unknow"
"SOAD09028","Flumevale","Yes","Debris Control","Earth",14.794,0.16,176000,"1998","",0.12805,15.97974,"","23/02/2022","1",1.08,"High","Satisfactory","2017-09-01",0.0999,12.8,510,NA,14.794,0.16,0,176000,0,12.0782449558223,0,"Unknow"
"SOAD17699","Flumevale","Yes","Other","Earth",40.272,0.165,322000,"1953","",0.0591,0,"","02/11/2021","1",0.16,"High","Satisfactory","2017-09-01",0.0843,10.7,611.8,NA,40.272,0.165,0,322000,0,12.6823099301118,0,"Unknow"
"SOAD06517","Flumevale","Yes","Irrigation","Earth",12.961,0.313,36414,"1918","1964",0.14184,0,"Uncontrolled","19/10/2021","2",14.83,"Significant","Satisfactory","2021-10-19",0.123,42.3,377.5,23.5,12.961,0.313,0,36414,0,10.502736056652,1,"1964"
"SOAD09958","Flumevale","Yes","Other","Earth",6.49,0.342,8647,"1916","",0.28368,0,"","02/11/2021","1",31.44,"High","Satisfactory","2017-09-01",0.0961,248.9,141.9,NA,6.49,0.342,0,8647,0,9.06508335931904,0,"Unknow"
"SOAD10768","Flumevale","Yes","Irrigation","Earth",7.33,0.167,10193,"1902","1946H;1946M;1946S",0.20882,7.98987,"Uncontrolled","22/10/2018","6",14.37,"Low","Not Rated",NA,0.0763,31.4,288.9,20.7,7.33,0.167,0,10193,0,9.22955459089999,3,"1946"
"SOAD17481","Flumevale","Yes","Water Supply","Earth",36.141,0.224,160000,"1976","",0.10835,0,"","24/05/2022","0.5",0,"Low","Satisfactory","2017-09-01",0.0555,31.7,858.1,64.6,36.141,0.224,0,160000,0,11.9829353441964,0,"Unknow"
"SOAD18364","Flumevale","Yes","Irrigation","Earth",4.089,0.274,18668,"1903","2007",0.25807,0,"Uncontrolled","06/06/2019","6",3.35,"Low","Satisfactory","2014-04-17",0.0413,670.7,643.1,20.4,4.089,0.274,0,18668,0,9.83461967323733,1,"2007"
"SOAD00440","Flumevale","Yes","Irrigation","Earth",15.728,0.167,53778,"1973","2007",0.11032,0,"Uncontrolled","23/09/2022","2",45.23,"Significant","Fair","2022-09-23",0.1359,31,201.8,23.9,15.728,0.167,0,53778,0,10.892638335377,1,"2007"
"SOAD01015","Flumevale","Yes","Irrigation","Earth",3.348,0.113,NA,"2020","2020",0.13396,7.98987,"Controlled","","6",3.22,"Low","Not Rated",NA,0.0387,20.9,855.3,8.6,3.348,0.113,0,NA,1,NA,1,"2020"
"SOAD12712","Flumevale","Yes","Water Supply","Earth",9.221,0.175,28821,"1948","",0.13593,7.98987,"","06/10/2022","6",12.55,"Low","Satisfactory","2017-06-29",0.0373,43.3,355.3,6.3,9.221,0.175,0,28821,0,10.2688942633983,0,"Unknow"
"SOAD12902","Flumevale","Yes","Other","Earth",10.924,0.5,28600,"1940","",0.14775,10.65316,"","18/08/2022","1",2.45,"High","Satisfactory","2017-09-01",0.0953,10.6,634.7,NA,10.924,0.5,0,28600,0,10.2611969612316,0,"Unknow"
"SOAD16955","Flumevale","Yes","Recreation","Earth",8.583,0.415,14358,"1907","",0.17927,0,"Uncontrolled","23/08/2022","1",0,"High","Fair","2022-08-23",0.1031,6.3,576.6,6.4,8.583,0.415,0,14358,0,9.57213220229438,0,"Unknow"
"SOAD19326","Flumevale","Yes","Irrigation","Earth",11.113,0.111,13587,"1938","2000S",0.12017,45.27593,"Uncontrolled","31/08/2022","2",4.79,"Significant","Satisfactory","2022-08-31",0.1178,24.3,165.2,15.7,11.113,0.111,0,13587,0,9.51694232928048,1,"2000"
"SOAD00057","Flumevale","Yes","Irrigation","Earth",2.842,0.17,0,"1878","",0.3349,7.98987,"Uncontrolled","03/05/2011","6",7.93,"Low","Not Rated",NA,0.0276,272.3,292.2,29.1,2.842,0.17,0,NA,1,NA,0,"Unknow"
"SOAD04354","Flumevale","Yes","Fire Protection, Stock, Or Small Fish Pond","Earth",8.043,0.212,0,"1907","",0.28171,90.55186,"Uncontrolled","01/12/2022","6",92.2,"Low","Not Rated",NA,0.0501,247.7,201.7,NA,8.043,0.212,0,NA,1,NA,0,"Unknow"
"SOAD09130","Flumevale","Yes","Flood Risk Reduction","Earth",22.464,0.19,66000,"1994","",0.1182,10.65316,"","23/02/2022","0.5",NA,"Low","Satisfactory","2017-09-01",0.0745,30.4,7.8,NA,22.464,0.19,0,66000,0,11.0974251724089,0,"Unknow"
"SOAD11367","Flumevale","Yes","Water Supply","Earth",13.63,0.223,58000,"1952","",0.13987,2.66329,"","22/02/2022","0.5",0,"Low","Satisfactory","2017-09-01",0.0629,30.2,627.4,48,13.63,0.223,0,58000,0,10.9682155307592,0,"Unknow"
"SOAD03016","Flumevale","Yes","Water Supply","Earth",15.159,0.1,NA,"Unknow","1993;2015;2018",0.07683,0,"Uncontrolled","17/05/2022","1",4.68,"High","Satisfactory","2022-05-17",0.097,28.4,552.8,7.1,15.159,0.1,0,NA,1,NA,3,"2018"
"SOAD10433","Flumevale","Yes","Water Supply","Earth",5.484,0.367,0,"Unknow","",0.4334,37.28606,"","22/06/2022","1",NA,"Low","Satisfactory","2017-09-01",0.0672,100.4,12.2,11.1,5.484,0.367,0,NA,1,NA,0,"Unknow"
"SOAD16831","Flumevale","Yes","Hydroelectric","Earth",14.279,0.283,40000,"1913","",0.14775,NA,"Uncontrolled","07/08/2023","1",3.14,"High","Satisfactory","2023-09-29",0.1012,20.8,132.5,92.2,14.279,0.283,0,40000,0,10.5966597327836,0,"Unknow"
"SOAD20061","Flumevale","Yes","Recreation","Earth",3.917,0.08,NA,"1933","",0.2758,42.61264,"","30/07/2015","6",67.22,"Low","Not Rated",NA,0.0874,231.7,71.9,3.3,3.917,0.08,0,NA,1,NA,0,"Unknow"
"SOAD03610","Flumevale","Yes","Irrigation","Earth",4.133,0.347,18490,"1902","",0.42158,141.15437,"","10/06/1992","6",37.04,"Low","Satisfactory","2012-02-01",0.0463,211.1,112.6,5.7,4.133,0.347,0,18490,0,9.82503940620699,0,"Unknow"
"SOAD11362","Flumevale","Yes","Water Supply","Earth",27.381,0.36,167400,"1961","",0.07092,0,"","16/03/2022","1",NA,"High","Satisfactory","2017-09-01",0.0834,42.7,568.5,40.9,27.381,0.36,0,167400,0,12.0281474107353,0,"Unknow"
"SOAD19428","Flumevale","Yes","Flood Risk Reduction","Earth",9.101,0.489,38000,"1959","",0.27777,7.98987,"Uncontrolled","15/10/2020","3",3.36,"Low","Unsatisfactory","2022-05-26",0.1115,308,694.8,NA,9.101,0.489,0,38000,0,10.5453677541517,0,"Unknow"
"SOAD19904","Flumevale","Yes","Irrigation","Earth",3.93,0.512,33275,"1888","",0.14381,0,"","20/07/1987","6",8.19,"Low","Not Rated",NA,0.0719,42.4,339.4,40.3,3.93,0.512,0,33275,0,10.4125916954038,0,"Unknow"
"SOAD20589","Flumevale","Yes","Water Supply","Earth",12.317,0.213,31460,"1878","",0.11229,0,"","21/07/2021","1",0,"Significant","Satisfactory","2017-09-01",0.1177,27.4,762,26.6,12.317,0.213,0,31460,0,10.3565039625025,0,"Unknow"
"SOAD00774","Flumevale","Yes","Recreation","Earth",7.055,0.083,8100,"1939","",0.04334,167.78727,"Uncontrolled","12/07/2022","6",101.03,"Low","Fair","2018-07-24",0.036,13.7,129.5,5.4,7.055,0.083,0,8100,0,8.99974278983049,0,"Unknow"
"SOAD02237","Flumevale","Yes","Irrigation","Earth",4.815,0.353,34261,"1908","",0.29944,0,"Uncontrolled","10/09/2015","6",4.96,"Low","Satisfactory","2020-08-26",0.0297,147.4,739.5,21.4,4.815,0.353,0,34261,0,10.4417921472904,0,"Unknow"
"SOAD05046","Flumevale","Yes","Water Supply","Earth",12.524,0.217,85000,"1970","",0.20882,87.88857,"","01/09/2021","0.5",NA,"Low","Satisfactory","2017-09-01",0.0634,35.4,11.6,48,12.524,0.217,0,85000,0,11.3504183001091,0,"Unknow"
"SOAD09458","Flumevale","Yes","Irrigation","Earth",20.804,0.26,59469,"1973","",0.12411,0,"","23/09/2022","2",41.61,"Significant","Fair","2022-09-23",0.1366,8,172.5,45.6,20.804,0.26,0,59469,0,10.9932272627006,0,"Unknow"
"SOAD12571","Flumevale","Yes","Irrigation","Earth",12.486,0.092,36512,"1905","",0.11623,0,"","24/05/2007","6",10.76,"Low","Satisfactory","2009-08-13",0.06,8.4,319.3,31.5,12.486,0.092,0,36512,0,10.5054236405427,0,"Unknow"
"SOAD02512","Flumevale","Yes","Irrigation","Earth",2.748,0.372,4741,"1894","",0.23246,0,"","22/04/2021","6",7.66,"Low","Not Rated",NA,0.0984,27,135.7,43.2,2.748,0.372,0,4741,0,8.46421426662535,0,"Unknow"
"SOAD19772","Flumevale","Yes","Irrigation","Earth",15.264,0.167,48958,"1945","",0.09653,29.29619,"Uncontrolled","24/07/2018","6",26.4,"Low","Not Rated",NA,0.0316,42.9,294,36.7,15.264,0.167,0,48958,0,10.798738492141,0,"Unknow"
"SOAD17285","Flumevale","Yes","Water Supply","Earth",10.491,0.23,NA,"1889","1906",0.14578,13.31645,"Uncontrolled","18/08/2021","2",7.98,"Significant","Not Rated",NA,0.1607,26.2,429.3,65.1,10.491,0.23,0,NA,1,NA,1,"1906"
"SOAD02881","Flumevale","Yes","Irrigation","Earth",8.626,0.087,10653,"1951","",0.14775,0,"","26/09/2022","6",19.89,"Low","Fair","2009-09-03",0.0605,42.2,320.1,24.1,8.626,0.087,0,10653,0,9.27369068747694,0,"Unknow"
"SOAD04134","Flumevale","Yes","Irrigation","Earth",6.595,0.213,28656,"1931","",0.12411,133.1645,"Uncontrolled","21/05/2015","6",4.62,"Low","Fair","2021-10-05",0.05,13.9,767,16.1,6.595,0.213,0,28656,0,10.2631530203974,0,"Unknow"
"SOAD07333","Flumevale","Yes","Recreation","Earth",4.466,0.047,0,"1911","",0.18518,0,"Uncontrolled","30/07/2019","6",24.49,"Low","Not Rated",NA,0.0256,20.2,155.6,9.5,4.466,0.047,0,NA,1,NA,0,"Unknow"
"SOAD17790","Flumevale","Yes","Water Supply","Earth",22.061,0.383,170000,"1937","",0.0886499999999999,NA,"","24/02/2022","1",0,"High","Satisfactory","2017-09-01",0.0806,24.2,923.7,64.2,22.061,0.383,0,170000,0,12.043559598368,0,"Unknow"
"SOAD01128","Flumevale","Yes","Flood Risk Reduction","Earth",3.25,0.383,13107,"1902","",0.30535,0,"Uncontrolled","24/06/2009","6",0,"Low","Not Rated",NA,0.0869,589.2,95.4,NA,3.25,0.383,0,13107,0,9.4809780098187,0,"Unknow"
"SOAD01597","Flumevale","Yes","Water Supply","Earth",11.728,0.193,65936,"1957","",0.13199,7.98987,"","30/06/2020","6",28.21,"Low","Satisfactory","2021-06-09",0.0457,27.7,219.6,49.1,11.728,0.193,0,65936,0,11.0964550196854,0,"Unknow"
"SOAD07097","Flumevale","Yes","Irrigation","Earth",9.766,0.108,24700,"1894","",0.14381,0,"","15/10/2015","6",20.87,"Low","Satisfactory","2012-06-20",0.0519,7.2,317.3,30.9,9.766,0.108,0,24700,0,10.1145990076265,0,"Unknow"
"SOAD11228","Flumevale","Yes","Recreation","Earth",5.679,0.31,0,"1982","",0.12805,0,"Uncontrolled","17/03/1994","6",0,"Low","Fair","2018-09-06",0.0337,33.7,392.5,4.1,5.679,0.31,0,NA,1,NA,0,"Unknow"
"SOAD19073","Flumevale","Yes","Flood Risk Reduction","Earth",5.963,0.177,8000,"1953","",0.15366,282.30874,"Uncontrolled","23/04/2011","3",26.58,"Low","Fair","2017-07-21",0.0938,18.1,134.5,NA,5.963,0.177,0,8000,0,8.98732181285012,0,"Unknow"
"SOAD01503","Flumevale","Yes","Irrigation","Earth",4.187,0.9,NA,"1890","2010",0.1576,0,"Uncontrolled","25/09/2013","6",11.25,"Low","Satisfactory","2017-02-21",0.0461,42.7,352.8,12.4,4.187,0.9,0,NA,1,NA,1,"2010"
"SOAD02161","Flumevale","Yes","Flood Risk Reduction","Earth",14.268,0.252,35165,"1955","",0.14578,21.30632,"Uncontrolled","06/10/2020","3",19.97,"Low","Fair","2022-07-07",0.0763,23.8,233.6,NA,14.268,0.252,0,35165,0,10.4678349857045,0,"Unknow"
"SOAD08250","Flumevale","Yes","Water Supply","Earth",25.335,0.207,54000,"1958","",0.08668,2.66329,"","14/09/2022","1",2.4,"High","Satisfactory","2017-09-01",0.09,22.8,268.7,15.3,25.335,0.207,0,54000,0,10.8967578438935,0,"Unknow"
"SOAD00400","Flumevale","Yes","Water Supply","Earth",6.327,0.167,20000,"1918","",0.23837,5.32658,"","27/01/2022","1",0,"High","Satisfactory","2017-09-01",0.1002,4.9,458.4,27.6,6.327,0.167,0,20000,0,9.90353755128617,0,"Unknow"
"SOAD14959","Flumevale","Yes","Water Supply","Earth",8.381,0.3,44000,"1955","",0.27974,7.98987,"","26/05/2022","1",NA,"High","Satisfactory","2017-09-01",0.0755,529.1,678.8,34.4,8.381,0.3,0,44000,0,10.6919676399149,0,"Unknow"
"SOAD05878","Flumevale","Yes","Flood Risk Reduction","Earth",12.225,0.357,NA,"1970","",0.14184,0,"Uncontrolled","14/04/2022","3",0,"High","Satisfactory","2022-04-14",0.0719,6.3,281.9,NA,12.225,0.357,0,NA,1,NA,0,"Unknow"
"SOAD06549","Flumevale","Yes","Recreation","Earth",20.805,0.324,96000,"1984","",0.11229,7.98987,"","11/12/2018","0",4.71,"Low","Not Rated",NA,0.097,12,324.3,7.7,20.805,0.324,0,96000,0,11.4721138870624,0,"Unknow"
"SOAD06625","Flumevale","Yes","Irrigation","Earth",13.95,0.1,20414,"1958","1970H;1970M;1970S",0.10835,0,"Uncontrolled","11/10/2021","2",23.51,"Significant","Satisfactory","2021-10-11",0.1023,36,160.5,39,13.95,0.1,0,20414,0,9.92402520375368,3,"1970"
"SOAD00357","Flumevale","Yes","Water Supply","Earth",14.569,0.188,NA,"1897","",0.16548,37.28606,"Uncontrolled","13/09/2022","2",64.6,"Significant","Unsatisfactory","2022-09-13",0.1563,45.1,75.2,61.7,14.569,0.188,0,NA,1,NA,0,"Unknow"
"SOAD05948","Flumevale","Yes","Irrigation","Earth",5.758,0.06,0,"1895","",0.24231,0,"Uncontrolled","26/07/2018","6",14.08,"Low","Fair","2021-06-09",0.0461,5.2,233.3,35.3,5.758,0.06,0,NA,1,NA,0,"Unknow"
"SOAD11928","Flumevale","Yes","Other","Earth",17.883,0.128,63000,"1970","",0.15563,37.28606,"","13/04/2022","1",NA,"High","Satisfactory","2017-09-01",0.0986,46.9,827.8,NA,17.883,0.128,0,63000,0,11.0509058782636,0,"Unknow"
"SOAD11069","Flumevale","Yes","Water Supply","Earth",11.802,0.433,136500,"1960","",0.2167,87.88857,"","22/03/2022","1",0.16,"High","Satisfactory","2017-09-01",0.0908,46.7,807,68.9,11.802,0.433,0,136500,0,11.8240872195876,0,"Unknow"
"SOAD02470","Flumevale","Yes","Recreation","Earth",5.078,0.667,NA,"Unknow","2007",0.20094,37.28606,"Uncontrolled","08/06/2016","6",0,"Low","Fair","2020-07-27",0.0453,33.8,400.4,5.1,5.078,0.667,0,NA,1,NA,1,"2007"
"SOAD06207","Flumevale","Yes","Irrigation","Earth",6.233,0.52,NA,"1901","",0.394,13.31645,"Uncontrolled","11/12/2012","6",97.44,"Low","Fair","2020-08-11",0.075,26.3,171.2,40.7,6.233,0.52,0,NA,1,NA,0,"Unknow"
"SOAD08567","Flumevale","Yes","Irrigation","Earth",7.201,0.045,2400,"1895","1966H;1966M;1966S",0.11426,0,"Uncontrolled","29/07/2020","2",14.09,"Significant","Fair","2020-07-29",0.1424,13.4,352.4,25.2,7.201,0.045,0,2400,0,7.78364059622125,3,"1966"
"SOAD03441","Flumevale","Yes","Water Supply","Earth",16.953,0.203,160896,"2003","",0.14775,23.96961,"","26/10/2021","1",0.16,"High","Satisfactory","2017-09-01",0.0856,23.8,525.3,15.9,16.953,0.203,0,160896,0,11.9885196876855,0,"Unknow"
"SOAD08751","Flumevale","Yes","Water Supply","Earth",8.882,1.4,40000,"1966","",0.29353,2.66329,"","25/05/2022","0.5",NA,"Low","Satisfactory","2017-09-01",0.0735,319.7,5.4,45.7,8.882,1.4,0,40000,0,10.5966597327836,0,"Unknow"
"SOAD06268","Flumevale","Yes","Irrigation","Earth",10.025,0.075,NA,"1965","",0.16745,0,"Uncontrolled","20/10/2010","6",12.37,"Low","Fair","2020-06-05",0.0444,28.8,365.8,20.4,10.025,0.075,0,NA,1,NA,0,"Unknow"
"SOAD10985","Flumevale","Yes","Flood Risk Reduction","Earth",8.024,0.278,34212,"1972","",0.22655,21.30632,"Uncontrolled","21/02/2017","3",47.43,"Low","Satisfactory","2021-05-20",0.0549,27,74.1,NA,8.024,0.278,0,34212,0,10.4403609677836,0,"Unknow"
"SOAD00929","Flumevale","Yes","Water Supply","Earth",16.3,0.32,58631,"1951","",0.11032,0,"Uncontrolled","21/07/2017","6",17.59,"Low","Not Rated",NA,0.0859,33.7,214.6,9,16.3,0.32,0,58631,0,10.9790359016057,0,"Unknow"
"SOAD09824","Flumevale","Yes","Irrigation","Earth",5.2,0.233,25000,"Unknow","1986;2015",0.12805,0,"Uncontrolled","02/11/2021","6",7.87,"Low","Fair","2015-07-31",0.0586,41.8,104.2,30.6,5.2,0.233,0,25000,0,10.1266711030504,2,"2015"
"SOAD11737","Flumevale","Yes","Water Supply","Earth",11.082,0.283,41431,"1979","",0.21473,55.92909,"Uncontrolled","29/09/2022","6",10.75,"Low","Not Rated",NA,0.0723,12.5,397.5,46.9,11.082,0.283,0,41431,0,10.6318088081037,0,"Unknow"
"SOAD06804","Flumevale","Yes","Hydroelectric","Earth",10.639,0.132,NA,"1922","",0.197,0,"Uncontrolled","20/07/2017","6",29.22,"Low","Not Rated",NA,0.0459,14.5,321.9,73.9,10.639,0.132,0,NA,1,NA,0,"Unknow"
"SOAD09769","Flumevale","Yes","Irrigation","Earth",5.437,0.502,47202,"1930","2018",0.22261,0,"Uncontrolled","09/08/2018","6",10.09,"Low","Satisfactory","2016-08-24",0.0314,46.4,175.7,11.1,5.437,0.502,0,47202,0,10.7622127288759,1,"2018"
"SOAD15824","Flumevale","Yes","Water Supply","Earth",17.319,0.061,NA,"1971","",0.14972,7.98987,"Uncontrolled","02/06/2021","2",44.79,"Significant","Fair","2021-06-02",0.1455,24.6,174.9,4.8,17.319,0.061,0,NA,1,NA,0,"Unknow"
"SOAD16020","Flumevale","Yes","Irrigation","Earth",12.094,0.146,51117,"1972","",0.14381,58.59238,"Uncontrolled","23/10/2018","6",10.02,"Low","Satisfactory","2022-06-08",0.0415,13.6,209.7,3.7,12.094,0.146,0,51117,0,10.8418919646554,0,"Unknow"
"SOAD18762","Flumevale","Yes","Recreation","Earth",3.556,0.66,NA,"1940","",0.2561,0,"","15/09/1992","0",50.94,"Low","Not Rated",NA,0.1064,516.7,60.5,4.2,3.556,0.66,0,NA,1,NA,0,"Unknow"
"SOAD19259","Flumevale","Yes","Water Supply","Earth",6.209,0.054,6500,"1965","",0.32505,13.31645,"","01/11/2021","0.5",NA,"Low","Satisfactory","2017-09-01",0.0711,463,5.6,8.1,6.209,0.054,0,6500,0,8.77971129020447,0,"Unknow"
"SOAD02988","Flumevale","Yes","Water Supply","Earth",12.344,0.327,5425,"1960","",0.0985,NA,"","25/02/2022","1",0,"High","Satisfactory","2017-09-01",0.0728,43.8,906.6,44.8,12.344,0.327,0,5425,0,8.59895749321888,0,"Unknow"
"SOAD11464","Flumevale","Yes","Water Supply","Earth",26.428,0.767,320000,"1938","",0.10047,NA,"","25/02/2022","1",0,"High","Satisfactory","2017-09-01",0.0847,19,410.6,24.1,26.428,0.767,0,320000,0,12.676079399771,0,"Unknow"
"SOAD12740","Flumevale","Yes","Irrigation","Earth",2.407,0.05,0,"1905","",0.0591,21.30632,"","15/10/1987","6",8.29,"Low","Not Rated",NA,0.0371,13.6,156.6,39,2.407,0.05,0,NA,1,NA,0,"Unknow"
"SOAD07101","Flumevale","Yes","Flood Risk Reduction","Earth",13.791,0.279,49700,"1962","",0.18321,29.29619,"","10/04/2018","3",14.22,"Low","Satisfactory","2022-12-01",0.0652,31.1,375.4,NA,13.791,0.279,0,49700,0,10.8137803326066,0,"Unknow"
"SOAD12124","Flumevale","Yes","Water Supply","Earth",5.345,0.833,14000,"1900","",0.29944,5.32658,"","02/11/2021","1",2,"High","Satisfactory","2017-09-01",0.0842,308.8,920.7,26,5.345,0.833,0,14000,0,9.54688403461792,0,"Unknow"
"SOAD19628","Flumevale","Yes","Other","Earth",30.507,0.18,215000,"1991","",0.08668,2.66329,"","15/12/2021","1",0,"High","Satisfactory","2017-09-01",0.1051,47.5,549,NA,30.507,0.18,0,215000,0,12.2783979582618,0,"Unknow"
"SOAD06552","Flumevale","Yes","Water Supply","Earth",13.475,0.16,88580,"1956","",0.13987,0,"Uncontrolled","01/07/2015","6",50.83,"Low","Not Rated",NA,0.0673,45.7,104.5,68.4,13.475,0.16,0,88580,0,11.3916726666435,0,"Unknow"
"SOAD07492","Flumevale","Yes","Other","Earth",30.632,0.118,114252,"1938","",0.08668,10.65316,"","18/08/2021","1",9.72,"High","Satisfactory","2017-09-01",0.0907,16.9,242.9,NA,30.632,0.118,0,114252,0,11.6461705666174,0,"Unknow"
"SOAD11736","Flumevale","Yes","Irrigation","Earth",7.405,0.78,NA,"1904","",0.15563,0,"","19/12/2000","0",59.68,"Low","Fair","2018-07-24",0.0751,9.6,222.7,8.8,7.405,0.78,0,NA,1,NA,0,"Unknow"
"SOAD20427","Flumevale","Yes","Flood Risk Reduction","Earth",23.586,0.115,55650,"2004","",0.10441,NA,"","10/08/2022","1",0.16,"High","Satisfactory","2017-09-01",0.0949,45.3,829.3,NA,23.586,0.115,0,55650,0,10.9268553259942,0,"Unknow"
"SOAD20033","Flumevale","Yes","Water Supply","Earth",17.017,0.117,20000,"1928","",0.2561,223.71636,"","26/05/2022","0.5",NA,"Low","Satisfactory","2017-09-01",0.0709,110,18.4,41.4,17.017,0.117,0,20000,0,9.90353755128617,0,"Unknow"
"SOAD10004","Flumevale","Yes","Water Supply","Earth",11.668,0.173,52275,"1955","",0.12805,0,"","10/06/2020","6",24.99,"Low","Not Rated",NA,0.0459,9,372.7,59.3,11.668,0.173,0,52275,0,10.8642926537169,0,"Unknow"
"SOAD12499","Flumevale","Yes","Recreation","Earth",16.307,0.111,35851,"1965","",0.22655,85.22528,"Uncontrolled","21/09/2021","2",28.85,"Significant","Fair","2021-09-21",0.123,7,164.9,4.3,16.307,0.111,0,35851,0,10.4871546324773,0,"Unknow"
"SOAD01779","Flumevale","Yes","Water Supply","Earth",14.531,0.216,86519,"1949","",0.14381,0,"","14/09/2021","1",0.79,"High","Satisfactory","2017-09-01",0.1107,23.4,225.2,13.9,14.531,0.216,0,86519,0,11.368130880067,0,"Unknow"
"SOAD15503","Flumevale","Yes","Irrigation","Earth",10.179,0.21,11555,"1965","",0.04334,439.44285,"Uncontrolled","07/05/2009","6",12.32,"Low","Satisfactory","2021-08-18",0.0323,26.6,365.9,40.4,10.179,0.21,0,11555,0,9.35496006158613,0,"Unknow"
"SOAD11495","Flumevale","Yes","Water Supply","Earth",9.519,0.58,34500,"1957","",0.28368,10.65316,"","27/04/2022","0.5",NA,"Low","Satisfactory","2017-09-01",0.0638,605,19.3,5.6,9.519,0.58,0,34500,0,10.4487435881066,0,"Unknow"
"SOAD06213","Flumevale","Yes","Irrigation","Earth",7.953,0.37,57832,"1979","2005",0.0788,15.97974,"Uncontrolled","24/09/2021","2",0,"Significant","Satisfactory","2021-09-24",0.135,18.2,588.7,29,7.953,0.37,0,57832,0,10.9653148259956,1,"2005"
"SOAD13263","Flumevale","Yes","Irrigation","Earth",4.557,0.128,NA,"1934","",0.20882,0,"Uncontrolled","17/08/2019","6",73.34,"Low","Fair","2019-04-03",0.0678,23.1,144.3,17.7,4.557,0.128,0,NA,1,NA,0,"Unknow"
"SOAD15102","Flumevale","Yes","Recreation","Earth",10.207,0.21,NA,"1948","",0.12214,0,"Uncontrolled","20/07/2021","6",10.97,"Low","Fair","2022-10-18",0.057,46.9,423.9,3.8,10.207,0.21,0,NA,1,NA,0,"Unknow"
"SOAD15753","Flumevale","Yes","Other","Earth",16.685,0.262,42850,"1963","",0.16351,NA,"","18/08/2022","1",0,"High","Satisfactory","2017-09-01",0.0978,38.4,819.6,NA,16.685,0.262,0,42850,0,10.6654842609765,0,"Unknow"
"SOAD04515","Flumevale","Yes","Other","Earth",21.443,0.082,35820,"1952","",0.10638,2.66329,"","22/06/2022","1",NA,"High","Satisfactory","2017-09-01",0.0847,34.5,612,NA,21.443,0.082,0,35820,0,10.4862895925896,0,"Unknow"
"SOAD20306","Flumevale","Yes","Irrigation","Earth",5.005,0.2,14667,"1904","",0.19503,29.29619,"","20/08/2019","6",38.34,"Low","Fair","2021-06-03",0.0487,33.7,182,42.4,5.005,0.2,0,14667,0,9.59342352919122,0,"Unknow"
"SOAD06134","Flumevale","No","Other","Earth",10.275,0.317,NA,"Unknow","",NA,NA,"","","Unknow",3.17,"Significant","Not Available",NA,0.1828,354.1,880.2,NA,10.275,0.317,0,NA,1,NA,0,"Unknow"
"SOAD17455","Flumevale","Yes","Irrigation","Earth",3.231,0.767,40892,"1974","",0.24428,0,"Uncontrolled","18/05/2022","1",0,"High","Satisfactory","2022-05-18",0.0711,263.7,605.6,27.9,3.231,0.767,0,40892,0,10.618714178239,0,"Unknow"
"SOAD02844","Flumevale","Yes","Other","Earth",6.481,0.235,27524,"1980","",0.07683,0,"Uncontrolled","23/10/2018","6",10.14,"Low","Not Rated",NA,0.0491,35.5,399.5,NA,6.481,0.235,0,27524,0,10.2228499615909,0,"Unknow"
"SOAD08216","Flumevale","Yes","Fish and Wildlife Pond","Earth",7.944,0.367,5705,"1956","",0.17336,111.85818,"Uncontrolled","01/11/2021","2",3.22,"Significant","Satisfactory","2021-11-01",0.096,29.7,770.4,NA,7.944,0.367,0,5705,0,8.64927353177345,0,"Unknow"
"SOAD14663","Flumevale","Yes","Fire Protection, Stock, Or Small Fish Pond","Earth",10.211,0.175,NA,"1915","",0.13002,0,"","11/10/2011","6",18.44,"Low","Satisfactory","2022-10-06",0.0375,41.8,286.9,NA,10.211,0.175,0,NA,1,NA,0,"Unknow"
"SOAD18686","Flumevale","Yes","Flood Risk Reduction","Earth",18.951,0.463,0,"1993","",0.13199,13.31645,"Uncontrolled","23/05/2022","3",41.56,"High","Satisfactory","2022-05-23",0.1054,18.8,144.3,NA,18.951,0.463,0,NA,1,NA,0,"Unknow"
"SOAD04564","Flumevale","Yes","Irrigation","Earth",5.995,0.283,0,"1952","",0.25807,7.98987,"Uncontrolled","02/08/2018","6",23.04,"Low","Not Rated",NA,0.0868,247.8,287.3,43.4,5.995,0.283,0,NA,1,NA,0,"Unknow"
"SOAD16610","Flumevale","Yes","Hydroelectric","Earth",4.359,0.087,NA,"1922","",0.18321,0,"Uncontrolled","20/07/2017","6",28.79,"Low","Fair","2022-09-15",0.041,28,321.8,77.6,4.359,0.087,0,NA,1,NA,0,"Unknow"
"SOAD18847","Flumevale","Yes","Other","Earth",7.823,0.318,20827,"1862","",0.18715,0,"","07/02/2023","1",0,"High","Fair","2017-09-01",0.1085,44.8,824.4,NA,7.823,0.318,0,20827,0,9.94405351428279,0,"Unknow"
"SOAD01841","Flumevale","Yes","Irrigation","Earth",10.689,0.033,6933,"1938","1999F;1999H;1999S",0.13002,0,"Uncontrolled","09/09/2022","2",4.88,"Significant","Fair","2022-09-09",0.1311,17.9,871.6,3.2,10.689,0.033,0,6933,0,8.84419212624497,3,"1999"
"SOAD03603","Flumevale","Yes","Recreation","Earth",9.757,0.318,28861,"1937","",0,460.74917,"Uncontrolled","18/07/2014","Unknow",22.62,"Significant","Not Rated",NA,0.1603,26.2,407.7,6,9.757,0.318,0,28861,0,10.270281129996,0,"Unknow"
"SOAD09448","Flumevale","Yes","Water Supply","Earth",12.734,0.182,NA,"1952","",0.14184,0,"Uncontrolled","29/09/2022","1",14.45,"High","Fair","2022-09-29",0.1205,17.5,209.9,30.7,12.734,0.182,0,NA,1,NA,0,"Unknow"
"SOAD13576","Flumevale","Yes","Irrigation","Earth",8.397,0.183,0,"1913","",0.10047,7.98987,"Uncontrolled","19/10/2016","6",37.41,"Low","Satisfactory","2013-09-25",0.0512,12.6,127.3,47,8.397,0.183,0,NA,1,NA,0,"Unknow"
"SOAD10705","Flumevale","Yes","Water Supply","Earth",19.027,0.133,39800,"1956","",0.14578,2.66329,"","16/06/2022","0.5",NA,"Low","Satisfactory","2017-09-01",0.0778,41.5,12.5,43.9,19.027,0.133,0,39800,0,10.591647316585,0,"Unknow"
"SOAD18640","Flumevale","Yes","Water Supply","Earth",11.067,0.376,71888,"1947","",0.14184,0,"","10/06/2020","6",21.95,"Low","Fair","2020-07-27",0.0625,6.7,265.9,14.4,11.067,0.376,0,71888,0,11.1828785417407,0,"Unknow"
"SOAD05517","Flumevale","Yes","Flood Risk Reduction","Earth",17.796,1.392,423125,"2008","",0.20291,37.28606,"","17/02/2022","1",0.66,"High","Satisfactory","2017-09-01",0.1051,5.6,404.5,NA,17.796,1.392,0,423125,0,12.9554252860137,0,"Unknow"
"SOAD12194","Flumevale","Yes","Irrigation","Earth",3.175,0.043,0,"1920","",0.30732,0,"","09/09/2021","6",8.43,"Low","Not Rated",NA,0.038,48.4,159.5,7.1,3.175,0.043,0,NA,1,NA,0,"Unknow"
"SOAD18037","Flumevale","Yes","Other","Earth",15.534,0.158,35000,"1964","",0.1379,7.98987,"","20/10/2021","1",1.66,"High","Satisfactory","2017-09-01",0.1124,24.4,491,NA,15.534,0.158,0,35000,0,10.463131911492,0,"Unknow"
"SOAD00612","Flumevale","Yes","Water Supply","Earth",18.209,0.092,32000,"1965","",0.25413,26.6329,"","17/02/2022","1",11.81,"Significant","Satisfactory","2017-09-01",0.1184,183.7,475.7,6.3,18.209,0.092,0,32000,0,10.3735224312936,0,"Unknow"
"SOAD07052","Flumevale","Yes","Fish and Wildlife Pond","Earth",5.015,0.075,1661,"1966","",0,21.30632,"Uncontrolled","02/08/2017","Unknow",37.23,"Significant","Not Rated",NA,0.1419,28.3,214.1,NA,5.015,0.075,0,1661,0,7.41577697541539,0,"Unknow"
"SOAD20005","Flumevale","Yes","Irrigation","Earth",6.941,0.406,20200,"1911","1968H;1968M;1968S;1998S;2002S",0.24428,0,"Uncontrolled","07/08/2018","6",17.62,"Low","Not Rated",NA,0.0802,707.2,451.5,44.6,6.941,0.406,0,20200,0,9.91348738711446,5,"2002"
"SOAD02338","Flumevale","Yes","Irrigation","Earth",10.799,0.03,8266,"1884","",0.20882,0,"","24/06/2021","6",30.68,"Low","Fair","2022-09-29",0.0592,25,103.9,41.1,10.799,0.03,0,8266,0,9.02002696525268,0,"Unknow"
"SOAD08620","Flumevale","Yes","Unknow","Earth",10.588,0.85,0,"Unknow","",0.35854,NA,"","14/06/2019","1",NA,"Significant","Poor","2017-09-01",0.1538,634.4,406.9,NA,10.588,0.85,0,NA,1,NA,0,"Unknow"
"SOAD09280","Flumevale","Yes","Fire Protection, Stock, Or Small Fish Pond","Earth",3.632,0.32,NA,"1909","",0.18715,0,"","16/09/1992","6",8.42,"Low","Not Rated",NA,0.0571,12.7,242.5,NA,3.632,0.32,0,NA,1,NA,0,"Unknow"
"SOAD20314","Flumevale","No","Water Supply","Earth",20.679,0.4,195000,"1947","",0.12214,0,"Controlled","17/08/2020","1",0,"High","Not Available",NA,0.0864,44.1,118.6,66.1,20.679,0.4,0,195000,0,12.1807599657379,0,"Unknow"
"SOAD12285","Flumevale","Yes","Hydroelectric","Earth",5.371,0.162,2000,"1870","",0.24428,5.32658,"Uncontrolled","12/08/2019","3",NA,"Low","Satisfactory","2023-09-29",0.0736,501.1,20.1,NA,5.371,0.162,0,2000,0,7.60140233458373,0,"Unknow"
"SOAD16705","Flumevale","Yes","Flood Risk Reduction","Earth",34.723,0.25,149000,"1994","",0.12805,13.31645,"","23/02/2022","0.5",NA,"Low","Satisfactory","2017-09-01",0.0776,18.9,19.9,NA,34.723,0.25,0,149000,0,11.9117082963145,0,"Unknow"
"SOAD15798","Flumevale","No","Water Supply","Earth",5.159,0.053,NA,"1902","",0.2758,7.98987,"Uncontrolled","22/09/2008","10",NA,"Low","Not Rated",NA,0.0206,285.4,9.3,30.8,5.159,0.053,0,NA,1,NA,0,"Unknow"
"SOAD07233","Flumevale","Yes","Water Supply","Earth",3.602,0.583,0,"1926","",0.86089,18.64303,"","08/06/2022","0.5",NA,"Low","Satisfactory","2017-09-01",0.074,154.1,23.8,61.6,3.602,0.583,0,NA,1,NA,0,"Unknow"
"SOAD15150","Flumevale","Yes","Water Supply","Earth",5.454,0.133,3000,"1918","",0.45901,10.65316,"","28/06/2023","0.5",NA,"Low","Poor","2022-01-12",0.0895,150.1,12.4,25,5.454,0.133,0,3000,0,8.00670084544037,0,"Unknow"
"SOAD20207","Flumevale","Yes","Irrigation","Earth",3.508,0.273,0,"Unknow","",0.36051,314.26822,"","25/09/1991","0",6.69,"Low","Not Rated",NA,0.0935,425.8,189.1,18.4,3.508,0.273,0,NA,1,NA,0,"Unknow"
"SOAD00465","Flumevale","Yes","Irrigation","Earth",3.961,0.242,12460,"1893","",0.15169,0,"","15/10/1986","6",14.71,"Low","Not Rated",NA,0.0373,41,282.3,11.5,3.961,0.242,0,12460,0,9.43035904594287,0,"Unknow"
"SOAD02412","Flumevale","Yes","Irrigation","Earth",9.329,0.825,64053,"1905","",0.41961,7.98987,"Uncontrolled","08/06/2016","6",9.35,"Low","Fair","2016-11-10",0.0644,329.9,118.3,39.1,9.329,0.825,0,64053,0,11.0674817565849,0,"Unknow"
"SOAD03721","Flumevale","Yes","Recreation","Earth",7.773,0.73,11035,"1966","",0.20291,0,"","18/08/2008","6",139.71,"Low","Not Rated",NA,0.0791,31.2,87.1,8.2,7.773,0.73,0,11035,0,9.30891793533718,0,"Unknow"
"SOAD18416","Flumevale","Yes","Water Supply","Earth",20.488,0.833,198000,"1996","",0.11229,0,"","04/02/2022","0.5",NA,"Low","Satisfactory","2017-09-01",0.0608,23.9,10.3,64.5,20.488,0.833,0,198000,0,12.196027360169,0,"Unknow"
"SOAD07630","Flumevale","Yes","Recreation","Earth",4.118,0.133,NA,"1930","2005H",0.32111,NA,"Controlled","22/04/2021","6",17.2,"Low","Fair","2013-09-23",0.0488,180.1,429.8,5.2,4.118,0.133,0,NA,1,NA,1,"2005"
"SOAD06049","Flumevale","Yes","Recreation","Earth",10.036,1.058,35130,"1968","",0.2167,0,"Uncontrolled","12/06/2018","6",32.08,"Low","Not Rated",NA,0.0691,22.4,140.6,7.5,10.036,1.058,0,35130,0,10.4668392105536,0,"Unknow"
"SOAD19048","Flumevale","No","Irrigation","Earth",2.469,0.465,NA,"1910","",NA,NA,"Controlled","31/08/2010","10",NA,"Low","Not Rated",NA,0.0679,15.2,18.4,15.6,2.469,0.465,0,NA,1,NA,0,"Unknow"
"SOAD00026","Flumevale","Yes","Water Supply","Earth",9.485,0.113,59500,"1879","1966S",0.15366,7.98987,"Uncontrolled","04/08/2021","2",4.62,"Significant","Satisfactory","2021-08-04",0.1333,44.1,390.2,64.6,9.485,0.113,0,59500,0,10.9937483981152,1,"1966"
"SOAD08854","Flumevale","Yes","Water Supply","Earth",21.446,0.14,70000,"Unknow","",0.06501,NA,"","11/05/2022","1",NA,"High","Satisfactory","2017-09-01",0.0917,17.8,946,45.9,21.446,0.14,0,70000,0,11.1562648066437,0,"Unknow"
"SOAD09395","Flumevale","Yes","Irrigation","Earth",3.885,0.046,2199,"1886","",0.19897,0,"","07/07/2017","0",11.13,"Low","Not Rated",NA,0.0633,24.5,237.3,3.8,3.885,0.046,0,2199,0,7.69621263934641,0,"Unknow"
"SOAD11296","Flumevale","Yes","Water Supply","Earth",26.998,0.149,120000,"1946","",0.13199,5.32658,"","19/05/2022","1",5.2,"High","Satisfactory","2017-09-01",0.0975,29.8,335.8,12.3,26.998,0.149,0,120000,0,11.6952553550628,0,"Unknow"
"SOAD05897","Flumevale","Yes","Water Supply","Earth",7.422,1.233,95000,"1985","",0.14972,0,"","10/08/2022","1",0,"High","Satisfactory","2017-09-01",0.1035,37.4,689.1,21.4,7.422,1.233,0,95000,0,11.4616426968431,0,"Unknow"
"SOAD09042","Flumevale","Yes","Irrigation","Earth",5.536,0.767,75727,"1890","",0.30141,7.98987,"Uncontrolled","14/07/2021","6",3.07,"Low","Satisfactory","2020-07-20",0.0544,379.9,599.2,29.7,5.536,0.767,0,75727,0,11.234903252146,0,"Unknow"
"SOAD03954","Flumevale","Yes","Water Supply","Earth",11.347,0.467,NA,"1907","",0.12214,0,"Uncontrolled","14/04/2023","1",0,"High","Unsatisfactory","2023-01-28",0.1296,14.6,332.6,22.5,11.347,0.467,0,NA,1,NA,0,"Unknow"
"SOAD12128","Flumevale","Yes","Flood Risk Reduction","Earth",6.922,1.43,NA,"2002","",0.02364,37.28606,"Uncontrolled","03/03/2022","3",0,"High","Satisfactory","2022-03-03",0.0983,22.9,356.6,NA,6.922,1.43,0,NA,1,NA,0,"Unknow"
"SOAD02594","Flumevale","Yes","Recreation","Earth",4.003,0.38,20025,"1881","1993",0.28368,0,"Uncontrolled","22/06/2017","6",4.88,"Low","Not Rated",NA,0.0845,249.4,757.7,9.3,4.003,0.38,0,20025,0,9.90478670826775,1,"1993"
"SOAD03777","Flumevale","Yes","Water Supply","Earth",9.738,0.06,0,"1914","",0.17336,13.31645,"","29/06/2022","0.5",NA,"Low","Satisfactory","2017-09-01",0.0592,10.5,7.5,18.6,9.738,0.06,0,NA,1,NA,0,"Unknow"
"SOAD10712","Flumevale","Yes","Water Supply","Earth",4.096,2.64,0,"1952","",0.47083,0,"","17/08/2022","0.5",0,"Low","Satisfactory","2017-09-01",0.0795,149.4,469.1,20.6,4.096,2.64,0,NA,1,NA,0,"Unknow"
"SOAD13464","Flumevale","Yes","Irrigation","Earth",8.36,0.233,17630,"1911","1949H;1949M;1949S",0.2167,0,"Uncontrolled","19/06/2018","6",13.44,"Low","Satisfactory","2019-07-15",0.042,33.2,103.9,14.4,8.36,0.233,0,17630,0,9.77741399528076,3,"1949"
"SOAD20540","Flumevale","Yes","Water Supply","Earth",4.786,0.042,44437,"1919","",0.31914,NA,"","27/05/2022","0.5",NA,"Low","Satisfactory","2017-09-01",0.0836,447.7,14.4,16.5,4.786,0.042,0,44437,0,10.7018502382404,0,"Unknow"
"SOAD07760","Flumevale","Yes","Irrigation","Earth",5.422,0.292,18540,"1959","",0.26398,0,"","31/07/2015","6",36.69,"Low","Not Rated",NA,0.0881,352.8,74.1,27.9,5.422,0.292,0,18540,0,9.82773977509785,0,"Unknow"
"SOAD10863","Flumevale","Yes","Irrigation","Earth",4.171,0.799,46334,"1904","",0.35854,0,"Uncontrolled","08/02/2016","6",15.83,"Low","Fair","2008-04-29",0.0646,469.2,379,25.2,4.171,0.799,0,46334,0,10.7436528940208,0,"Unknow"
"SOAD01785","Flumevale","Yes","Fire Protection, Stock, Or Small Fish Pond","Earth",4.131,0.18,NA,"1915","",0.40385,0,"","11/10/2011","6",14.75,"Low","Fair","2013-07-25",0.0572,334.7,431.3,NA,4.131,0.18,0,NA,1,NA,0,"Unknow"
"SOAD10548","Flumevale","Yes","Irrigation","Earth",7.155,0.157,NA,"1948","",0.20094,0,"","27/06/2019","6",0,"Low","Satisfactory","2009-06-24",0.0497,43.2,329.8,22.5,7.155,0.157,0,NA,1,NA,0,"Unknow"
"SOAD10582","Flumevale","Yes","Irrigation","Earth",21.235,0.063,47600,"1951","",0.2167,7.98987,"Uncontrolled","06/08/2015","6",17.62,"Low","Not Rated",NA,0.076,41.8,377.1,15.8,21.235,0.063,0,47600,0,10.7706090484022,0,"Unknow"
"SOAD04777","Flumevale","Yes","Flood Risk Reduction","Earth",11.342,0.275,33894,"1969","",0.19503,21.30632,"Uncontrolled","28/05/2008","3",50.68,"Low","Not Rated",NA,0.0983,46.5,102.8,NA,11.342,0.275,0,33894,0,10.4310227898651,0,"Unknow"
"SOAD05327","Flumevale","Yes","Recreation","Earth",21.793,0.157,NA,"1885","",0.10047,NA,"Uncontrolled","19/05/2021","4",52.98,"Low","Poor","2016-08-08",0.091,45.4,138.6,3.8,21.793,0.157,0,NA,1,NA,0,"Unknow"
"SOAD07903","Flumevale","Yes","Irrigation","Earth",3.827,0.083,10000,"1900","2005H;2005S",0.3152,0,"Uncontrolled","13/08/2009","6",0,"Low","Fair","2019-11-05",0.0753,180.5,186.8,8.9,3.827,0.083,0,10000,0,9.21044036697652,2,"2005"
"SOAD19768","Flumevale","Yes","Flood Risk Reduction","Earth",15.452,0.127,26000,"1970","",0.10047,39.94935,"","30/11/2021","1",0,"Significant","Satisfactory","2017-09-01",0.1385,9.5,350.1,NA,15.452,0.127,0,26000,0,10.1658902778025,0,"Unknow"
"SOAD01965","Flumevale","Yes","Flood Risk Reduction","Earth",10.871,0.167,25074,"1956","",0.18124,21.30632,"Uncontrolled","26/09/2013","3",8.24,"Low","Not Rated",NA,0.0996,46.7,316.7,NA,10.871,0.167,0,25074,0,10.1296266128301,0,"Unknow"
"SOAD05875","Flumevale","Yes","Water Supply","Earth",15.844,0.708,287200,"2002","",0.0985,0,"","10/08/2022","1",0,"Significant","Satisfactory","2017-09-01",0.1078,10,783.4,14.2,15.844,0.708,0,287200,0,12.5679375980443,0,"Unknow"
"SOAD13796","Flumevale","Yes","Flood Risk Reduction","Earth",12.311,0.277,40600,"1959","",0.19306,13.31645,"Uncontrolled","15/10/2020","3",1.61,"Low","Satisfactory","2021-09-08",0.0778,38.6,687.4,NA,12.311,0.277,0,40600,0,10.6115479758284,0,"Unknow"
"SOAD14966","Flumevale","Yes","Irrigation","Earth",18.569,0.151,45905,"1955","",0.0985,21.30632,"Uncontrolled","02/10/2020","6",35.61,"Low","Satisfactory","2013-09-21",0.0486,8.4,209.6,8.3,18.569,0.151,0,45905,0,10.7343511064599,0,"Unknow"
"SOAD11518","Flumevale","Yes","Irrigation","Earth",15.849,0.123,29900,"1968","",0.15563,26.6329,"Uncontrolled","06/05/2021","2",20.24,"Significant","Fair","2021-05-06",0.1496,16.5,436.8,8.5,15.849,0.123,0,29900,0,10.3056472036356,0,"Unknow"
"SOAD08614","Flumevale","Yes","Other","Earth",19.904,0.123,58000,"1974","",0.16154,10.65316,"","17/02/2022","1",0,"High","Satisfactory","2017-09-01",0.0823,13.9,591.5,NA,19.904,0.123,0,58000,0,10.9682155307592,0,"Unknow"
"SOAD09856","Flumevale","Yes","Irrigation","Earth",6.01,0.65,28249,"1938","",0.23837,13.31645,"Uncontrolled","03/12/2021","6",6.32,"Low","Fair","2019-09-14",0.0506,8.2,473,17.8,6.01,0.65,0,28249,0,10.2488487365746,0,"Unknow"
"SOAD14230","Flumevale","Yes","Flood Risk Reduction","Earth",9.624,0.534,66830,"1963","",0.11426,13.31645,"Uncontrolled","15/09/2022","3",0,"Low","Not Rated",NA,0.0871,5.4,220.7,NA,9.624,0.534,0,66830,0,11.109922323733,0,"Unknow"
"SOAD20785","Flumevale","Yes","Flood Risk Reduction","Earth",12.702,0.507,77988,"1980","",0.20094,7.98987,"Uncontrolled","09/06/2021","3",6.71,"Low","Fair","2010-06-04",0.0941,46.7,380.9,NA,12.702,0.507,0,77988,0,11.2643230700857,0,"Unknow"
"SOAD00812","Flumevale","Yes","Flood Risk Reduction","Earth",11.506,0.186,73754,"1958","",0.13199,7.98987,"Uncontrolled","01/11/2021","3",1.64,"Significant","Satisfactory","2021-11-01",0.1037,38.7,839.2,NA,11.506,0.186,0,73754,0,11.2085040685141,0,"Unknow"
"SOAD04943","Flumevale","Yes","Irrigation","Earth",6.585,0.085,6989,"1952","",0.13199,7.98987,"","08/06/2021","6",25.05,"Low","Fair","2006-08-14",0.0549,39.2,461.5,4.9,6.585,0.085,0,6989,0,8.85223583522786,0,"Unknow"
"SOAD07574","Flumevale","Yes","Water Supply","Earth",11.6,0.3,18000,"1955","",0.11229,2.66329,"","26/04/2022","0.5",NA,"Low","Satisfactory","2017-09-01",0.0738,22.2,5,15.4,11.6,0.3,0,18000,0,9.7981825908907,0,"Unknow"
"SOAD08662","Flumevale","Yes","Irrigation","Earth",7.141,0.2,23457,"1960","",0.21276,7.98987,"","16/08/2022","6",11.55,"Low","Fair","2021-05-19",0.0496,38.7,421.1,16.4,7.141,0.2,0,23457,0,10.0629668670814,0,"Unknow"
"SOAD15946","Flumevale","Yes","Irrigation","Earth",10.992,0.25,58002,"1962","",0.29747,0,"","06/10/2022","6",12.36,"Low","Not Rated",NA,0.0867,506,336.2,6.3,10.992,0.25,0,58002,0,10.9682500123288,0,"Unknow"
"SOAD19685","Flumevale","Yes","Water Supply","Earth",18.714,0.602,NA,"1932","2001",0.10047,0,"Uncontrolled","21/04/2022","1",0,"High","Satisfactory","2022-04-21",0.0879,29.7,686.2,31.1,18.714,0.602,0,NA,1,NA,1,"2001"
"SOAD19820","Flumevale","Yes","Irrigation","Earth",4.198,0.124,3233,"1900","",0.30141,0,"Uncontrolled","26/07/2018","6",14.58,"Low","Not Rated",NA,0.07,652.3,363.6,17.7,4.198,0.124,0,3233,0,8.08147504013705,0,"Unknow"
"SOAD03201","Flumevale","Yes","Irrigation","Earth",7.653,0.122,18505,"1956","",0.18124,15.97974,"","10/08/2021","2",19.5,"Significant","Fair","2021-08-10",0.1313,43.2,459,8.5,7.653,0.122,0,18505,0,9.82585028280898,0,"Unknow"
"SOAD01506","Flumevale","Yes","Recreation","Earth",17.488,0.167,50000,"1962","2011F;2011H;2011M;2011S",0.13396,0,"Controlled","23/09/2022","1",0,"High","Fair","2022-09-23",0.1074,10.1,212.6,4.3,17.488,0.167,0,50000,0,10.8197982842103,4,"2011"
"SOAD08695","Flumevale","Yes","Recreation","Earth",9.074,0.367,72000,"1999","",0.19109,7.98987,"Uncontrolled","08/10/2013","6",30.96,"Low","Not Rated",NA,0.0867,5.2,143.2,9,9.074,0.367,0,72000,0,11.1844352867906,0,"Unknow"
"SOAD09914","Flumevale","No","Recreation","Earth",9.22,0.071,NA,"1958","",NA,0,"Uncontrolled","23/06/2014","1",30.28,"High","Not Rated",NA,0.1137,626,177.4,6.4,9.22,0.071,0,NA,1,NA,0,"Unknow"
"SOAD18425","Flumevale","Yes","Irrigation","Earth",5.409,0.307,19294,"1930","",0.18715,7.98987,"","07/09/2018","6",11.68,"Low","Not Rated",NA,0.0533,32.8,262.5,38.5,5.409,0.307,0,19294,0,9.86760127397172,0,"Unknow"
"SOAD03460","Flumevale","Yes","Recreation","Earth",6.106,0.233,NA,"1971","",0.29944,7.98987,"Uncontrolled","10/10/2019","2",90.38,"Significant","Satisfactory","2019-10-10",0.1262,298.5,202.5,3.2,6.106,0.233,0,NA,1,NA,0,"Unknow"
"SOAD10134","Flumevale","Yes","Hydroelectric","Earth",19.948,0.133,NA,"1908","",0.1379,NA,"Uncontrolled","13/08/2019","3",6.4,"Low","Satisfactory","2023-09-29",0.0634,6.3,437.1,90.5,19.948,0.133,0,NA,1,NA,0,"Unknow"
"SOAD17726","Flumevale","Yes","Irrigation","Earth",12.453,0.179,66654,"1947","",0.15957,21.30632,"Uncontrolled","26/06/2020","6",18.31,"Low","Fair","2009-10-27",0.0447,10.6,236.1,17.5,12.453,0.179,0,66654,0,11.1072853415478,0,"Unknow"
"SOAD08303","Flumevale","Yes","Water Supply","Earth",4.919,0.297,12000,"1946","",0.32899,0,"","22/03/2022","0.5",NA,"Low","Satisfactory","2017-09-01",0.0644,710.6,12.7,8,4.919,0.297,0,12000,0,9.39274525863144,0,"Unknow"
"SOAD08640","Flumevale","Yes","Other","Earth",18.511,0.217,73500,"1963","",0.16942,5.32658,"","26/05/2022","1",4.68,"Significant","Satisfactory","2017-09-01",0.1276,21.8,255.6,NA,18.511,0.217,0,73500,0,11.2050542905506,0,"Unknow"
"SOAD10350","Flumevale","Yes","Water Supply","Earth",7.078,1.209,120000,"1989","",0.1182,0,"","10/08/2022","1",0,"High","Satisfactory","2017-09-01",0.0846,31.6,127.2,54.5,7.078,1.209,0,120000,0,11.6952553550628,0,"Unknow"
"SOAD11758","Flumevale","Yes","Water Supply","Earth",11.746,0.234,81111,"1906","1977S;2001S;2002S",0.15169,45.27593,"Uncontrolled","13/07/2022","1",14.71,"High","Satisfactory","2022-07-13",0.1004,46.1,357.7,9.7,11.746,0.234,0,81111,0,11.3035861946324,3,"2002"
"SOAD16638","Flumevale","Yes","Irrigation","Earth",5.101,0.167,12215,"1896","",0.12214,266.329,"Uncontrolled","21/06/2022","6",9.46,"Low","Fair","2022-10-20",0.0435,40.5,474.2,45.1,5.101,0.167,0,12215,0,9.41050184689847,0,"Unknow"
"SOAD03853","Flumevale","Yes","Water Supply","Earth",12.623,0.1,45000,"1968","",0.20094,133.1645,"","28/01/2022","1",0,"High","Satisfactory","2017-09-01",0.09,16.7,629.8,28.1,12.623,0.1,0,45000,0,10.7144399907278,0,"Unknow"
"SOAD07019","Flumevale","Yes","Irrigation","Earth",7.108,0.2,29245,"1951","",0.12805,0,"","16/10/2020","6",33.55,"Low","Not Rated",NA,0.0369,11.7,59.3,2.4,7.108,0.2,0,29245,0,10.2834980911718,0,"Unknow"
"SOAD07271","Flumevale","Yes","Flood Risk Reduction","Earth",10.03,0.5,37000,"1984","",0.16745,NA,"","05/01/2022","1",0.11,"High","Satisfactory","2017-09-01",0.0953,23.1,702.6,NA,10.03,0.5,0,37000,0,10.5187002182882,0,"Unknow"
"SOAD17438","Flumevale","Yes","Irrigation","Earth",9.218,0.408,26183,"1888","",0.18912,0,"","29/09/2020","6",35.98,"Low","Unsatisfactory","2010-03-17",0.0836,11.1,227.8,31.6,9.218,0.408,0,26183,0,10.172903816181,0,"Unknow"
"SOAD20392","Flumevale","Yes","Irrigation","Earth",3.146,0.044,3063,"1913","",0.12411,0,"","10/07/1990","6",55,"Low","Not Rated",NA,0.0602,29.8,199,1.5,3.146,0.044,0,3063,0,8.02747653086048,0,"Unknow"
"SOAD00695","Flumevale","Yes","Irrigation","Earth",5.051,0.142,10088,"1890","",0.2955,0,"","16/08/2022","6",14.38,"Low","Fair","2021-09-21",0.06,306.2,307.4,1.4,5.051,0.142,0,10088,0,9.21920100040838,0,"Unknow"
"SOAD08330","Flumevale","Yes","Irrigation","Earth",7.09,0.19,25713,"1894","",0.20882,0,"Uncontrolled","08/07/2022","2",20.45,"Significant","Fair","2022-07-08",0.144,17.9,416.4,4.3,7.09,0.19,0,25713,0,10.1547908696442,0,"Unknow"
"SOAD08785","Flumevale","Yes","Flood Risk Reduction","Earth",30.379,0.18,NA,"1961","",0.09653,7.98987,"Uncontrolled","24/10/2022","3",1.66,"High","Fair","2022-10-24",0.0996,22,879.4,NA,30.379,0.18,0,NA,1,NA,0,"Unknow"
"SOAD16513","Flumevale","Yes","Water Supply","Earth",10.285,0.207,39200,"1953","",0.26004,2.66329,"","01/11/2021","1",1.69,"High","Satisfactory","2017-09-01",0.076,380.8,146.7,20.8,10.285,0.207,0,39200,0,10.5764575356573,0,"Unknow"
"SOAD12073","Flumevale","Yes","Flood Risk Reduction","Earth",14.081,0.345,110000,"1981","",0.16154,47.93922,"","09/03/2022","1",0,"High","Satisfactory","2017-09-01",0.0908,9.2,417.3,NA,14.081,0.345,0,110000,0,11.6082447356423,0,"Unknow"
"SOAD16385","Flumevale","Yes","Water Supply","Earth",13.204,0.4,67500,"1970","",0.19897,0,"","28/04/2022","1",2.59,"Significant","Satisfactory","2017-09-01",0.1055,44.2,109.2,36.4,13.204,0.4,0,67500,0,11.1198976915657,0,"Unknow"
"SOAD17066","Flumevale","Yes","Water Supply","Earth",10.29,0.267,65184,"1977","",0.18715,0,"","10/04/1990","0",6.5,"Low","Fair","2022-10-06",0.0852,33.5,127.3,36.8,10.29,0.267,0,65184,0,11.0849846600969,0,"Unknow"
"SOAD05497","Flumevale","Yes","Water Supply","Earth",18.689,0.175,90000,"1979","",0.11623,2.66329,"","24/05/2022","0.5",NA,"Low","Satisfactory","2017-09-01",0.0585,40.8,6.6,10,18.689,0.175,0,90000,0,11.4075760603618,0,"Unknow"
"SOAD05658","Flumevale","Yes","Water Supply","Earth",30.661,0.133,131780,"1958","",0.12017,2.66329,"","24/03/2022","1",0.31,"High","Satisfactory","2017-09-01",0.1076,17.3,297.3,26.6,30.661,0.133,0,131780,0,11.7888967328439,0,"Unknow"
"SOAD13661","Flumevale","Yes","Flood Risk Reduction","Earth",9.888,0.422,32700,"1959","",0.26004,21.30632,"","15/10/2020","3",1.64,"Low","Fair","2011-08-01",0.0796,436.6,373.4,NA,9.888,0.422,0,32700,0,10.3951609374575,0,"Unknow"
"SOAD14167","Flumevale","Yes","Other","Earth",16.029,0.3,73000,"1924","",0.15366,21.30632,"","20/10/2021","1",0.34,"High","Satisfactory","2017-09-01",0.0996,46.1,782.6,NA,16.029,0.3,0,73000,0,11.1982284186668,0,"Unknow"
"SOAD14195","Flumevale","Yes","Water Supply","Earth",7.723,0.7,85000,"1986","",0.38021,31.95948,"","15/02/2022","1",0,"High","Satisfactory","2017-09-01",0.0864,108.8,819.4,50,7.723,0.7,0,85000,0,11.3504183001091,0,"Unknow"
"SOAD11326","Flumevale","Yes","Other","Earth",13.242,0.293,42934,"1936","",0.18321,7.98987,"","06/04/2022","0.5",NA,"Low","Satisfactory","2017-09-01",0.0612,44.3,12.7,NA,13.242,0.293,0,42934,0,10.6674426231066,0,"Unknow"
"SOAD05763","Flumevale","Yes","Water Supply","Earth",13.819,1.492,NA,"2018","",0.11623,0,"Uncontrolled","20/04/2022","1",1.54,"High","Satisfactory","2022-04-20",0.0847,25.1,231.2,65.2,13.819,1.492,0,NA,1,NA,0,"Unknow"
"SOAD18186","Flumevale","Yes","Water Supply","Earth",12.587,0.175,NA,"1904","1959;1991",0.12608,0,"Uncontrolled","17/05/2022","1",4.65,"High","Fair","2022-05-17",0.1051,44.5,419.6,71,12.587,0.175,0,NA,1,NA,2,"1991"
"SOAD07548","Flumevale","Yes","Water Supply","Earth",9.374,0.048,0,"Unknow","",0.18124,2.66329,"","01/06/2022","0.5",NA,"Low","Satisfactory","2017-09-01",0.0637,12.7,14.8,20.8,9.374,0.048,0,NA,1,NA,0,"Unknow"
"SOAD14716","Flumevale","Yes","Hydroelectric","Earth",20.978,0.333,NA,"1908","",0.14184,NA,"Uncontrolled","13/08/2019","3",6.61,"Low","Satisfactory","2023-09-29",0.0772,7.8,281.9,74,20.978,0.333,0,NA,1,NA,0,"Unknow"
"SOAD18597","Flumevale","Yes","Water Supply","Earth",9.475,0.133,NA,"1896","",0.19306,7.98987,"Uncontrolled","19/07/2018","6",66.63,"Low","Satisfactory","2014-04-17",0.0288,23.2,227.2,30.8,9.475,0.133,0,NA,1,NA,0,"Unknow"
"SOAD18241","Flumevale","Yes","Flood Risk Reduction","Earth",12.793,0.369,NA,"1959","",0.21473,13.31645,"Uncontrolled","15/10/2020","3",6.34,"Low","Fair","2017-08-09",0.0975,44.2,234.2,NA,12.793,0.369,0,NA,1,NA,0,"Unknow"
"SOAD19530","Flumevale","Yes","Water Supply","Earth",16.172,0.323,144000,"1990","",0.14775,5.32658,"","01/09/2021","1",6.68,"High","Satisfactory","2017-09-01",0.0908,23.1,222.3,41.2,16.172,0.323,0,144000,0,11.8775755229785,0,"Unknow"
"SOAD13727","Flumevale","Yes","Water Supply","Earth",12.942,0.073,5000,"1937","",0.16351,2.66329,"","02/06/2022","0.5",NA,"Low","Satisfactory","2017-09-01",0.0617,19.8,14.5,42.6,12.942,0.073,0,5000,0,8.5173931714189,0,"Unknow"
"SOAD13932","Flumevale","Yes","Flood Risk Reduction","Earth",10.06,0.3,35520,"1963","",0.22458,42.61264,"","03/04/2019","3",25.07,"Low","Not Rated",NA,0.1037,13.2,112.9,NA,10.06,0.3,0,35520,0,10.477879349863,0,"Unknow"
"SOAD07580","Flumevale","Yes","Water Supply","Earth",15.979,0.218,NA,"1954","",0.16745,0,"Uncontrolled","07/04/2022","1",0,"High","Satisfactory","2022-04-07",0.1183,46,849.1,65.1,15.979,0.218,0,NA,1,NA,0,"Unknow"
"SOAD12112","Flumevale","Yes","Water Supply","Earth",8.792,0.24,27214,"1959","",0.48462,5.32658,"","23/03/2022","0.5",NA,"Low","Satisfactory","2017-09-01",0.0672,154.8,9.3,48,8.792,0.24,0,27214,0,10.2115235708683,0,"Unknow"
"SOAD12396","Flumevale","Yes","Other","Earth",7.212,0.278,16100,"1953","",0.50235,13.31645,"","25/05/2022","0.5",NA,"Low","Satisfactory","2017-09-01",0.0687,74.5,4.8,NA,7.212,0.278,0,16100,0,9.68663666084494,0,"Unknow"
"SOAD02084","Flumevale","Yes","Other","Earth",9.46,0.133,14000,"1957","",0.28959,5.32658,"","20/10/2021","1",NA,"Significant","Satisfactory","2017-09-01",0.1245,360.6,436.8,NA,9.46,0.133,0,14000,0,9.54688403461792,0,"Unknow"
"SOAD08419","Flumevale","Yes","Water Supply","Earth",23.432,0.192,72200,"1960","",0.13593,2.66329,"","18/08/2022","1",NA,"High","Satisfactory","2017-09-01",0.0897,30.4,655.8,59.1,23.432,0.192,0,72200,0,11.1872091752005,0,"Unknow"
"SOAD13474","Flumevale","Yes","Irrigation","Earth",14.303,0.292,0,"1910","",0.16154,15.97974,"Uncontrolled","05/07/2019","6",9.88,"Low","Fair","2017-12-20",0.0551,40.4,472,44.1,14.303,0.292,0,NA,1,NA,0,"Unknow"
"SOAD05608","Flumevale","Yes","Other","Earth",15.166,0.167,40000,"1964","",0.24034,58.59238,"","27/01/2022","1",0,"High","Satisfactory","2017-09-01",0.0959,45.3,419.6,NA,15.166,0.167,0,40000,0,10.5966597327836,0,"Unknow"
"SOAD05963","Flumevale","Yes","Irrigation","Earth",10.859,0.25,68890,"1889","",0.0394,0,"Uncontrolled","05/12/2005","6",18.09,"Low","Not Rated",NA,0.0569,46.2,474.8,13.5,10.859,0.25,0,68890,0,11.1402808243768,0,"Unknow"
"SOAD17793","Flumevale","Yes","Recreation","Earth",4.29,0.083,1300,"2013","2013",0.25019,0,"","17/05/2013","6",NA,"Low","Not Rated",NA,0.0629,214.7,20.6,4.9,4.29,0.083,0,1300,0,7.1708884785125,1,"2013"
"SOAD04483","Flumevale","Yes","Irrigation","Earth",2.8,0.5,17779,"1898","",0.60085,0,"Controlled","26/06/2017","6",3.23,"Low","Not Rated",NA,0.0612,173.8,844.8,33.5,2.8,0.5,0,17779,0,9.7858295090679,0,"Unknow"
"SOAD16129","Flumevale","Yes","Other","Earth",15.175,0.173,83800,"1975","",0.1379,0,"","22/06/2022","1",0.84,"Significant","Satisfactory","2017-09-01",0.1049,22.3,852.7,NA,15.175,0.173,0,83800,0,11.3362002195732,0,"Unknow"
"SOAD03563","Flumevale","Yes","Irrigation","Earth",14.076,0.933,82868,"1963","1976H;2006H",0.14578,7.98987,"Uncontrolled","23/06/2022","2",5.04,"Significant","Satisfactory","2022-06-23",0.1217,5.9,235.4,40.7,14.076,0.933,0,82868,0,11.3250163266772,2,"2006"
"SOAD08377","Flumevale","Yes","Flood Risk Reduction","Earth",10.997,0.157,60100,"1963","",0.38809,21.30632,"","09/03/2022","1",0,"High","Satisfactory","2017-09-01",0.1015,457.4,898.5,NA,10.997,0.157,0,60100,0,11.00378175932,0,"Unknow"
"SOAD12493","Flumevale","Yes","Recreation","Earth",14.277,0.339,19976,"1956","",0.17336,45.27593,"Uncontrolled","12/09/2022","2",4.6,"Significant","Satisfactory","2022-09-12",0.13,12.9,846.9,4.4,14.277,0.339,0,19976,0,9.90233689077873,0,"Unknow"
"SOAD02517","Flumevale","Yes","Water Supply","Earth",5.469,0.067,3500,"1919","",0.58706,18.64303,"","02/06/2022","0.5",NA,"Low","Satisfactory","2017-09-01",0.0627,364.1,15.2,31.1,5.469,0.067,0,3500,0,8.16080392095467,0,"Unknow"
"SOAD10384","Flumevale","Yes","Irrigation","Earth",8.952,0.134,26569,"1905","",0.15957,0,"Uncontrolled","26/07/2022","1",21.4,"High","Fair","2022-07-26",0.1317,47,147.1,22.9,8.952,0.134,0,26569,0,10.1875380387539,0,"Unknow"
"SOAD11314","Flumevale","Yes","Water Supply","Earth",16.266,0.144,85000,"1872","",0.18321,13.31645,"","15/09/2022","1",11.65,"Significant","Satisfactory","2017-09-01",0.1424,46.2,349.9,66.3,16.266,0.144,0,85000,0,11.3504183001091,0,"Unknow"
"SOAD01949","Flumevale","Yes","Water Supply","Earth",10.781,0.237,30000,"1950","",0.27974,37.28606,"","04/02/2022","0.5",NA,"Low","Satisfactory","2017-09-01",0.0664,632.7,22.8,49.4,10.781,0.237,0,30000,0,10.3089859934221,0,"Unknow"
"SOAD00071","Flumevale","Yes","Debris Control","Earth",21.688,0.993,612100,"1980","",0.19503,93.21515,"","27/01/2022","1",1.56,"High","Satisfactory","2017-09-01",0.0932,30.2,242.4,NA,21.688,0.993,0,612100,0,13.3246525805578,0,"Unknow"
"SOAD06809","Flumevale","Yes","Recreation","Earth",8.711,0.4,13746,"1906","",0.33687,7.98987,"","07/09/2022","2",26.42,"Significant","Unsatisfactory","2022-09-07",0.1735,413.2,424.5,3.7,8.711,0.4,0,13746,0,9.52857589747142,0,"Unknow"
"SOAD00803","Flumevale","Yes","Irrigation","Earth",17.707,0.05,0,"1931","",0.0985,127.83792,"Uncontrolled","15/05/2019","6",28.13,"Low","Not Rated",NA,0.084,14,200.7,29.6,17.707,0.05,0,NA,1,NA,0,"Unknow"
"SOAD10131","Flumevale","Yes","Water Supply","Earth",15.51,0.637,226000,"1991","",0.1182,0,"","21/10/2021","1",1,"High","Satisfactory","2017-09-01",0.0831,45.8,756.4,61.6,15.51,0.637,0,226000,0,12.3282947030234,0,"Unknow"
"SOAD18694","Flumevale","Yes","Irrigation","Earth",14.593,0.171,51471,"1954","",0.13199,13.31645,"","20/09/2021","6",20.48,"Low","Not Rated",NA,0.0823,43.2,353.5,1.9,14.593,0.171,0,51471,0,10.8487932494788,0,"Unknow"
"SOAD00694","Flumevale","Yes","Recreation","Earth",4.386,0.097,NA,"1947","",0.35657,29.29619,"","02/07/2020","6",81.91,"Low","Satisfactory","2016-05-13",0.0252,507.6,48.8,8.8,4.386,0.097,0,NA,1,NA,0,"Unknow"
"SOAD01144","Flumevale","Yes","Irrigation","Earth",5.038,0.093,NA,"1931","",0.23049,0,"","17/08/2019","6",46.24,"Low","Not Rated",NA,0.026,17.5,234,33.6,5.038,0.093,0,NA,1,NA,0,"Unknow"
"SOAD06318","Flumevale","Yes","Irrigation","Earth",5.022,0.32,15902,"1883","",0.21473,0,"Uncontrolled","15/06/2016","6",11.01,"Low","Fair","2017-04-19",0.0523,9.5,475.2,17.6,5.022,0.32,0,15902,0,9.67426304965592,0,"Unknow"
"SOAD08474","Flumevale","No","Water Supply","Earth",6.684,0.167,NA,"Unknow","",NA,NA,"","","Unknow",0,"High","Not Available",NA,0.1176,872.6,265.2,38.8,6.684,0.167,0,NA,1,NA,0,"Unknow"
"SOAD15380","Flumevale","Yes","Irrigation","Earth",7.699,0.659,34672,"1890","",0.19109,0,"Uncontrolled","22/04/2020","2",11.55,"Significant","Unsatisfactory","2020-04-22",0.19,16.9,133.6,47.3,7.699,0.659,0,34672,0,10.4537165650769,0,"Unknow"
"SOAD01175","Flumevale","Yes","Flood Risk Reduction","Earth",16.243,0.2,80000,"2019","",0.17927,NA,"","16/02/2022","1",1.3,"High","Satisfactory","2021-02-05",0.1198,47.1,677.5,NA,16.243,0.2,0,80000,0,11.2897944135779,0,"Unknow"
"SOAD05204","Flumevale","Yes","Water Supply","Earth",6.755,0.022,0,"1929","",0.28368,2.66329,"","13/07/2022","0.5",15.62,"Low","Fair","2020-08-13",0.0836,482.1,207.6,33.8,6.755,0.022,0,NA,1,NA,0,"Unknow"
"SOAD08446","Flumevale","Yes","Irrigation","Earth",7.965,0.075,11100,"1899","",0.26201,7.98987,"","17/08/2022","6",35.19,"Low","Satisfactory","2016-08-29",0.0558,280.6,207.4,41.2,7.965,0.075,0,11100,0,9.31479047333265,0,"Unknow"
"SOAD02819","Flumevale","Yes","Flood Risk Reduction","Earth",15.004,0.257,40217,"1965","",0.22655,21.30632,"","11/04/2018","3",38.68,"Low","Satisfactory","2021-08-04",0.0645,6,200.7,NA,15.004,0.257,0,40217,0,10.602069935586,0,"Unknow"
"SOAD06996","Flumevale","Yes","Irrigation","Earth",9.756,0.143,33692,"1893","",0.24625,0,"","30/06/2021","6",20.13,"Low","Fair","2017-06-28",0.0418,480.3,260,15.9,9.756,0.143,0,33692,0,10.4250453796311,0,"Unknow"
"SOAD17229","Flumevale","Yes","Recreation","Earth",14.531,0.247,0,"1948","",NA,NA,"","18/06/2012","5",62.24,"High","Not Available",NA,0.1077,893.3,125.5,4.4,14.531,0.247,0,NA,1,NA,0,"Unknow"
"SOAD09602","Flumevale","Yes","Other","Earth",55.378,0.152,623000,"1968","",0.07486,2.66329,"","03/11/2021","1",NA,"High","Satisfactory","2017-09-01",0.0836,41.7,828.4,NA,55.378,0.152,0,623000,0,13.3423034029047,0,"Unknow"
"SOAD19465","Flumevale","Yes","Water Supply","Earth",9.232,0.567,79478,"1952","",0.23443,31.95948,"","22/03/2022","1",6.26,"High","Satisfactory","2017-09-01",0.1184,15.8,347.2,13.1,9.232,0.567,0,79478,0,11.283248114805,0,"Unknow"
"SOAD09529","Flumevale","Yes","Irrigation","Earth",14.282,0.217,31683,"1977","",0.23443,0,"Uncontrolled","17/11/2020","6",59.32,"Low","Not Rated",NA,0.0857,23.4,91.9,15.6,14.282,0.217,0,31683,0,10.3635671005842,0,"Unknow"
"SOAD13209","Flumevale","Yes","Irrigation","Earth",13.775,0.493,97358,"1962","2004S",0.1773,37.28606,"Uncontrolled","02/06/2015","6",4.62,"Low","Not Rated",NA,0.0743,7,430.3,38,13.775,0.493,0,97358,0,11.4861604564501,1,"2004"
"SOAD08306","Flumevale","Yes","Other","Earth",26.792,0.15,75000,"1972","",0.14775,5.32658,"","12/04/2022","1",3.22,"High","Satisfactory","2017-09-01",0.0808,39.4,142.6,NA,26.792,0.15,0,75000,0,11.2252567257629,0,"Unknow"
"SOAD03142","Flumevale","Yes","Flood Risk Reduction","Earth",7.027,0.758,220000,"2008","",0.24231,0,"","12/05/2022","1",0,"High","Satisfactory","2017-09-01",0.0799,47.5,213.6,NA,7.027,0.758,0,220000,0,12.3013873707787,0,"Unknow"
"SOAD17867","Flumevale","Yes","Water Supply","Earth",12.472,0.145,32000,"1960","",0.2364,2.66329,"","10/05/2022","1",0,"High","Satisfactory","2017-09-01",0.0888,8.3,248.3,5.9,12.472,0.145,0,32000,0,10.3735224312936,0,"Unknow"
"SOAD15679","Flumevale","Yes","Irrigation","Earth",5.848,0.075,5500,"1892","1998",0.26201,0,"","26/08/2022","6",17.49,"Low","Fair","2018-10-22",0.0488,32.6,462.3,11.8,5.848,0.075,0,5500,0,8.61268517287546,1,"1998"
"SOAD08063","Flumevale","Yes","Flood Risk Reduction","Earth",11.476,0.3,44450,"1964","",0.22261,29.29619,"","11/04/2018","3",34.63,"Low","Not Rated",NA,0.0607,5,190.5,NA,11.476,0.3,0,44450,0,10.7021427378768,0,"Unknow"
"SOAD09798","Flumevale","Yes","Flood Risk Reduction","Earth",8.13,0.18,33279,"1970","",0.22655,21.30632,"Uncontrolled","01/02/2012","3",76.43,"Low","Not Rated",NA,0.1132,26.3,139,NA,8.13,0.18,0,33279,0,10.4127118949351,0,"Unknow"
"SOAD19495","Flumevale","Yes","Water Supply","Earth",23.123,0.788,0,"1892","",0.14381,0,"","20/10/2021","1",NA,"High","Satisfactory","2017-09-01",0.0694,32.8,890.5,63.3,23.123,0.788,0,NA,1,NA,0,"Unknow"
"SOAD16047","Flumevale","Yes","Other","Earth",32.962,0.11,80000,"1950","",0.12805,NA,"","21/04/2022","1",3.78,"High","Satisfactory","2017-09-01",0.0736,13.5,382.4,NA,32.962,0.11,0,80000,0,11.2897944135779,0,"Unknow"
"SOAD16288","Flumevale","Yes","Water Supply","Earth",23.46,0.327,150000,"2009","",0.13987,0,"","19/10/2021","0.5",NA,"Low","Satisfactory","2017-09-01",0.0731,15,21.3,25.4,23.46,0.327,0,150000,0,11.9183972397228,0,"Unknow"
"SOAD00001","Flumevale","Yes","Recreation","Earth",7.274,0.038,0,"1939","",0.33687,0,"Uncontrolled","19/10/2016","6",37.06,"Low","Fair","2018-07-24",0.0596,180.5,138.8,6.5,7.274,0.038,0,NA,1,NA,0,"Unknow"
"SOAD05479","Flumevale","Yes","Water Supply","Earth",24.986,0.185,118000,"1965","",0.12805,5.32658,"","22/06/2022","1",0.16,"High","Satisfactory","2017-09-01",0.0857,29.8,506.9,66.6,24.986,0.185,0,118000,0,11.6784483779882,0,"Unknow"
"SOAD07495","Flumevale","Yes","Irrigation","Earth",3.811,0.065,NA,"1933","",0.27186,7.98987,"Uncontrolled","14/09/2019","6",50.49,"Low","Not Rated",NA,0.0612,706.4,57.5,21.8,3.811,0.065,0,NA,1,NA,0,"Unknow"
"SOAD01209","Flumevale","Yes","Hydroelectric","Earth",8.219,0.149,1400,"1928","",0.2167,2.66329,"Uncontrolled","06/06/2022","1",12.66,"High","Satisfactory","2023-09-29",0.0878,22.4,302,86.5,8.219,0.149,0,1400,0,7.24494154633701,0,"Unknow"
"SOAD09906","Flumevale","Yes","Irrigation","Earth",6.551,0.4,10000,"1964","",0.42749,63.91896,"Uncontrolled","17/06/2015","6",39.18,"Low","Unsatisfactory","2016-10-28",0.1008,119.4,200.6,35,6.551,0.4,0,10000,0,9.21044036697652,0,"Unknow"
"SOAD14174","Flumevale","Yes","Water Supply","Earth",18.125,0.175,73800,"1962","",0.12411,0,"","01/09/2022","1",NA,"High","Satisfactory","2017-09-01",0.0875,10.4,819.7,22.5,18.125,0.175,0,73800,0,11.2091275606323,0,"Unknow"
"SOAD02119","Flumevale","Yes","Irrigation","Earth",12.768,0.15,23147,"1911","1959S",0.16548,0,"Uncontrolled","11/08/2020","6",18.25,"Low","Not Rated",NA,0.0409,46,422.1,34.2,12.768,0.15,0,23147,0,10.0496636626937,1,"1959"
"SOAD18704","Flumevale","Yes","Irrigation","Earth",9.489,0.519,NA,"1956","",0.3349,82.56199,"","14/10/1998","0",130.8,"Low","Satisfactory","2017-09-26",0.0543,340.4,79.9,14.3,9.489,0.519,0,NA,1,NA,0,"Unknow"
"SOAD09263","Flumevale","Yes","Water Supply","Earth",8.189,0.267,2250,"1889","",0.49644,15.97974,"","30/06/2022","0.5",NA,"Low","Satisfactory","2017-09-01",0.0802,89.1,10.2,69.3,8.189,0.267,0,2250,0,7.71912984090673,0,"Unknow"
"SOAD01153","Flumevale","Yes","Flood Risk Reduction","Earth",10.948,0.148,0,"1957","",0.23049,21.30632,"Uncontrolled","10/05/2000","3",9.9,"Low","Unsatisfactory","2009-06-09",0.1242,18.9,368.6,NA,10.948,0.148,0,NA,1,NA,0,"Unknow"
"SOAD16432","Flumevale","Yes","Irrigation","Earth",3.872,0.135,4104,"1912","1931S;2005H;2005S",0.36839,0,"Uncontrolled","30/07/2019","6",40.21,"Low","Not Rated",NA,0.071,682.3,210.4,5.8,3.872,0.135,0,4104,0,8.31996102188653,3,"2005"
"SOAD02921","Flumevale","Yes","Flood Risk Reduction","Earth",11.326,0.608,NA,"1959","",0.26989,13.31645,"Uncontrolled","15/10/2020","3",7.87,"Low","Satisfactory","2018-10-18",0.0617,616.3,290.6,NA,11.326,0.608,0,NA,1,NA,0,"Unknow"
"SOAD10201","Flumevale","Yes","Irrigation","Earth",11.615,0.188,41360,"1949","",0.22064,0,"","31/08/2020","6",23.12,"Low","Not Rated",NA,0.0778,5.1,315.4,43.4,11.615,0.188,0,41360,0,10.6300936868397,0,"Unknow"
"SOAD10236","Flumevale","Yes","Irrigation","Earth",8.288,0.182,29919,"1909","",0.16548,0,"Uncontrolled","29/04/2021","6",38.73,"Low","Fair","2011-10-11",0.0653,27.4,171.3,41.1,8.288,0.182,0,29919,0,10.3062824320884,0,"Unknow"
"SOAD14150","Flumevale","Yes","Irrigation","Earth",9.706,0.258,13796,"1940","1952H;1952M;1952S",0.26201,0,"Uncontrolled","08/07/2021","6",36.06,"Low","Unsatisfactory","2015-05-26",0.0975,453.3,63.5,21.8,9.706,0.258,0,13796,0,9.53220645620803,3,"1952"
"SOAD03844","Flumevale","Yes","Hydroelectric","Earth",30.884,0.279,NA,"1923","",0.19897,2.66329,"Uncontrolled","23/08/2023","1",23.31,"High","Fair","2023-09-29",0.1215,13.2,201.1,59.5,30.884,0.279,0,NA,1,NA,0,"Unknow"
"SOAD12970","Flumevale","Yes","Irrigation","Earth",5.491,0.252,7725,"1911","1956H;1956M;1956S",0.32505,0,"","08/07/2021","6",16.19,"Low","Satisfactory","2017-07-19",0.0326,287.1,338.2,46.6,5.491,0.252,0,7725,0,8.95234654322623,3,"1956"
"SOAD05842","Flumevale","Yes","Flood Risk Reduction","Earth",6.551,0.75,14160,"1996","",0.18321,23.96961,"","23/02/2022","1",0.16,"High","Satisfactory","2017-09-01",0.0895,43.3,893.4,NA,6.551,0.75,0,14160,0,9.55824698622306,0,"Unknow"
"SOAD03736","Flumevale","Yes","Fish and Wildlife Pond","Earth",5.322,0.21,15400,"1929","",0.19897,0,"","14/08/2006","6",65.86,"Low","Satisfactory","2020-10-15",0.0494,40.4,60,NA,5.322,0.21,0,15400,0,9.64218772135847,0,"Unknow"
"SOAD02225","Flumevale","Yes","Irrigation","Earth",12.184,0.407,31744,"1953","",0.24231,117.18476,"Uncontrolled","20/05/1994","0",57.23,"Low","Fair","2019-07-10",0.076,45.8,111.4,13.2,12.184,0.407,0,31744,0,10.3654905116046,0,"Unknow"
"SOAD09245","Flumevale","Yes","Other","Earth",22.575,0.144,35000,"1935","",0.17336,37.28606,"","21/06/2022","0.5",NA,"Low","Satisfactory","2017-09-01",0.0822,46.5,14.5,NA,22.575,0.144,0,35000,0,10.463131911492,0,"Unknow"
"SOAD00303","Flumevale","Yes","Water Supply","Earth",6.473,0.33,24500,"1939","",0.41764,13.31645,"","20/10/2021","1",9.69,"Significant","Satisfactory","2023-04-12",0.1399,428.5,218.5,14.2,6.473,0.33,0,24500,0,10.1064692120264,0,"Unknow"
"SOAD08151","Flumevale","Yes","Hydroelectric","Earth",21.728,0.265,173000,"1956","",0.16745,NA,"Uncontrolled","29/08/2023","3",NA,"Low","Satisfactory","2023-09-29",0.0799,16,15.3,NA,21.728,0.265,0,173000,0,12.06105265381,0,"Unknow"
"SOAD03911","Flumevale","Yes","Fish and Wildlife Pond","Earth",11.168,0.217,38659,"1998","",0.26201,0,"Uncontrolled","13/09/2018","6",1.54,"Low","Unsatisfactory","2010-07-12",0.0859,308.7,880.4,NA,11.168,0.217,0,38659,0,10.5625607527623,0,"Unknow"
"SOAD06341","Flumevale","Yes","Hydroelectric","Earth",6.293,0.117,NA,"1956","",0.15957,NA,"","29/08/2023","3",NA,"Low","Satisfactory","2023-09-29",0.0575,7.9,5,NA,6.293,0.117,0,NA,1,NA,0,"Unknow"
"SOAD20711","Flumevale","Yes","Tailings","Earth",16.214,0.333,0,"1987","",0.20882,2.66329,"","25/10/2021","1",NA,"Significant","Satisfactory","2017-09-01",0.1101,6.5,288.1,NA,16.214,0.333,0,NA,1,NA,0,"Unknow"
"SOAD07032","Flumevale","Yes","Irrigation","Earth",3.149,1.044,43158,"1908","",0.49841,0,"Uncontrolled","16/07/2009","6",0,"Low","Not Rated",NA,0.022,601.5,823.9,25,3.149,1.044,0,43158,0,10.6726462495022,0,"Unknow"
"SOAD12342","Flumevale","Yes","Irrigation","Earth",9.949,0.102,0,"1953","",0.23837,7.98987,"Uncontrolled","22/10/2018","6",14.37,"Low","Fair","2007-03-21",0.059,18.9,423.8,16.8,9.949,0.102,0,NA,1,NA,0,"Unknow"
"SOAD13033","Flumevale","Yes","Water Supply","Earth",13.067,0.333,157000,"1995","",0.24822,0,"","26/10/2021","0.5",NA,"Low","Satisfactory","2017-09-01",0.0792,540,8.6,60.1,13.067,0.333,0,157000,0,11.9640074537369,0,"Unknow"
"SOAD18831","Flumevale","Yes","Water Supply","Earth",12.766,0.233,70000,"1882","",0.15366,0,"","01/12/2021","1",0,"High","Satisfactory","2017-09-01",0.0988,14.2,157.7,9.3,12.766,0.233,0,70000,0,11.1562648066437,0,"Unknow"
"SOAD02935","Flumevale","Yes","Water Supply","Earth",14.211,1.017,69300,"1953","",0.10441,0,"Uncontrolled","20/04/2022","2",0,"Significant","Fair","2022-04-20",0.1327,19.6,163.7,40.2,14.211,1.017,0,69300,0,11.1462146150883,0,"Unknow"
"SOAD02705","Flumevale","Yes","Water Supply","Earth",3.919,0.433,0,"1912","",0.67768,45.27593,"","16/06/2022","1",NA,"Significant","Satisfactory","2017-09-01",0.1258,647.9,433.7,34.9,3.919,0.433,0,NA,1,NA,0,"Unknow"
"SOAD09249","Flumevale","Yes","Water Supply","Earth",7.386,0.145,0,"1995","",0.1773,0,"","09/09/2022","1",0,"High","Satisfactory","2022-09-09",0.0766,6.2,422.2,18.8,7.386,0.145,0,NA,1,NA,0,"Unknow"
"SOAD17036","Flumevale","Yes","Other","Earth",13.464,0.107,10655,"1916","",0.35066,10.65316,"","19/10/2021","0.5",NA,"Low","Satisfactory","2017-09-01",0.0612,273.9,14.4,NA,13.464,0.107,0,10655,0,9.27387839278017,0,"Unknow"
"SOAD19327","Flumevale","Yes","Flood Risk Reduction","Earth",23.739,0.157,80000,"1956","",0.14578,31.95948,"","09/03/2022","1",1.22,"High","Satisfactory","2017-09-01",0.0895,44.8,892.8,NA,23.739,0.157,0,80000,0,11.2897944135779,0,"Unknow"
"SOAD17619","Flumevale","Yes","Irrigation","Earth",8.625,0.204,36267,"1904","",0.24428,50.60251,"Uncontrolled","25/06/2019","6",7.98,"Low","Unsatisfactory","2003-10-02",0.1001,95.4,349.3,21.2,8.625,0.204,0,36267,0,10.4986910887659,0,"Unknow"
"SOAD02842","Flumevale","Yes","Water Supply","Earth",22.793,0.133,35000,"1956","",0.28959,13.31645,"","19/07/2023","1",3.3,"High","Fair","2022-03-23",0.1134,183.7,154.4,55.4,22.793,0.133,0,35000,0,10.463131911492,0,"Unknow"
"SOAD10774","Flumevale","Yes","Recreation","Earth",12.812,0.161,0,"1954","2012",0.28565,13.31645,"Uncontrolled","19/10/2020","6",42.4,"Low","Fair","2020-05-15",0.0591,349.9,111.6,7.3,12.812,0.161,0,NA,1,NA,1,"2012"
"SOAD16436","Flumevale","Yes","Irrigation","Earth",8.244,0.293,22816,"1965","",0.30338,7.98987,"Uncontrolled","22/08/2019","6",4.86,"Low","Not Rated",NA,0.0389,685.2,323.9,41.3,8.244,0.293,0,22816,0,10.0352611511456,0,"Unknow"
"SOAD20247","Flumevale","Yes","Irrigation","Earth",6.713,0.717,52524,"1881","1981",0.31126,0,"Uncontrolled","21/04/2022","6",4.86,"Low","Unsatisfactory","2022-10-18",0.0938,675.3,724.7,41.4,6.713,0.717,0,52524,0,10.8690445257132,1,"1981"
"SOAD02973","Flumevale","Yes","Water Supply","Earth",16.043,0.277,104059,"2012","",0.29156,2.66329,"","06/04/2022","1",NA,"Significant","Satisfactory","2017-09-01",0.108,630.4,31.2,18.4,16.043,0.277,0,104059,0,11.5527229348443,0,"Unknow"
"SOAD17133","Flumevale","Yes","Flood Risk Reduction","Earth",22.965,0.128,116000,"1964","",0.20291,146.48095,"","22/07/2022","1",0,"High","Satisfactory","2017-09-01",0.0859,26.1,120.6,NA,22.965,0.128,0,116000,0,11.661354090741,0,"Unknow"
"SOAD08698","Flumevale","Yes","Water Supply","Earth",7.83,0.115,8000,"1900","",0.6304,85.22528,"","09/09/2021","0.5",NA,"Low","Satisfactory","2017-09-01",0.0749,559.2,19.8,58.1,7.83,0.115,0,8000,0,8.98732181285012,0,"Unknow"
"SOAD04556","Flumevale","Yes","Recreation","Earth",5.801,0.073,2216,"1906","",0.26989,50.60251,"Uncontrolled","18/10/2022","6",33.45,"Low","Satisfactory","2020-08-28",0.0307,438.6,52.8,9.4,5.801,0.073,0,2216,0,7.70391020961631,0,"Unknow"
"SOAD06078","Flumevale","Yes","Flood Risk Reduction","Earth",8.986,0.357,42970,"1963","",0.30929,50.60251,"","03/04/2019","3",11.63,"Low","Not Rated",NA,0.1108,415.8,114.5,NA,8.986,0.357,0,42970,0,10.6682807485485,0,"Unknow"
"SOAD20172","Flumevale","Yes","Water Supply","Earth",9.502,0.027,16050,"1927","",0.31126,5.32658,"","08/12/2021","1",NA,"High","Satisfactory","2017-09-01",0.087,550,702.1,31.9,9.502,0.027,0,16050,0,9.68352643191322,0,"Unknow"
"SOAD06669","Flumevale","Yes","Fish and Wildlife Pond","Earth",18.125,0.743,20000,"1968","",0.10441,0,"Uncontrolled","11/06/2019","6",1.54,"Low","Not Rated",NA,0.0987,47.1,887.3,NA,18.125,0.743,0,20000,0,9.90353755128617,0,"Unknow"
"SOAD09924","Flumevale","Yes","Hydroelectric","Earth",21.61,0.173,NA,"1907","",0.52599,2591.38117,"Uncontrolled","28/06/2023","1",NA,"High","Fair","2023-09-29",0.1091,675,547.5,NA,21.61,0.173,0,NA,1,NA,0,"Unknow"
"SOAD04560","Flumevale","Yes","Water Supply","Earth",14.036,0.341,11000,"1972","",0.0985,0,"Uncontrolled","30/09/2016","6",3.3,"Low","Satisfactory","2018-12-11",0.0306,47.1,729.8,60.2,14.036,0.341,0,11000,0,9.30574145673943,0,"Unknow"
"SOAD05588","Flumevale","Yes","Irrigation","Earth",4.709,0.213,NA,"1882","2009",0.44916,0,"Uncontrolled","10/11/2022","2",0,"Significant","Satisfactory","2022-11-10",0.1061,343.8,508.5,1.2,4.709,0.213,0,NA,1,NA,1,"2009"
"SOAD18822","Flumevale","Yes","Water Supply","Earth",30.023,0.193,122000,"1963","",0.11623,0,"","08/06/2022","1",NA,"Significant","Satisfactory","2017-09-01",0.1369,30.1,66.8,69.2,30.023,0.193,0,122000,0,11.7117845204031,0,"Unknow"
"SOAD12137","Flumevale","Yes","Unknow","Earth",11.994,0.02,0,"Unknow","",0.1379,NA,"Uncontrolled","28/08/2020","6",15.01,"Low","Not Rated",NA,0.0952,39.9,285.8,NA,11.994,0.02,0,NA,1,NA,0,"Unknow"
"SOAD04593","Flumevale","Yes","Irrigation","Earth",9.715,0.24,NA,"1930","",0.21473,13.31645,"Uncontrolled","02/09/2022","1",25.16,"High","Satisfactory","2022-09-02",0.0762,47.2,454.1,28.7,9.715,0.24,0,NA,1,NA,0,"Unknow"
"SOAD09044","Flumevale","No","Other","Earth",22.698,0.367,NA,"Unknow","",NA,NA,"","","Unknow",3.3,"High","Not Available",NA,0.1026,949.6,706.5,NA,22.698,0.367,0,NA,1,NA,0,"Unknow"
"SOAD03090","Flumevale","Yes","Water Supply","Earth",13.972,0.063,NA,"1891","",0.20685,29.29619,"Uncontrolled","02/06/2021","2",67.58,"Significant","Fair","2021-06-02",0.1482,8.6,200.4,29.2,13.972,0.063,0,NA,1,NA,0,"Unknow"
"SOAD08417","Flumevale","No","Water Supply","Earth",13.453,0.267,NA,"Unknow","",NA,NA,"","","Unknow",0,"High","Not Available",NA,0.1309,658.8,483.2,15.6,13.453,0.267,0,NA,1,NA,0,"Unknow"
"SOAD19087","Flumevale","Yes","Irrigation","Earth",5.407,0.533,65196,"1882","2004",0.32111,7.98987,"","06/11/2012","6",10.09,"Low","Fair","2022-04-25",0.0417,279.3,309.3,17.7,5.407,0.533,0,65196,0,11.0851687345862,1,"2004"
"SOAD00681","Flumevale","Yes","Irrigation","Earth",9.469,0.333,32066,"1901","1947F;1947H;1947M;1947O;1947S",0.19897,42.61264,"Uncontrolled","24/06/2021","2",10.86,"Significant","Fair","2021-06-24",0.149,19.1,330.2,6,9.469,0.333,0,32066,0,10.3755827429421,5,"1947"
"SOAD06837","Flumevale","Yes","Water Supply","Earth",7.78,0.133,11430,"1953","",0.62252,47.93922,"","25/05/2022","0.5",NA,"Low","Satisfactory","2017-09-01",0.0814,477.5,14.3,16.8,7.78,0.133,0,11430,0,9.34408424202578,0,"Unknow"
"SOAD01169","Flumevale","Yes","Water Supply","Earth",28.126,0.108,91000,"1939","",0.11229,26.6329,"","07/12/2021","1",3.93,"High","Satisfactory","2017-09-01",0.0901,13,300.3,37.8,28.126,0.108,0,91000,0,11.4186257744496,0,"Unknow"
"SOAD05894","Flumevale","Yes","Irrigation","Earth",6.285,0.067,2861,"1893","1970H;1970M;1970S",0.16154,0,"Uncontrolled","08/08/2018","6",17.12,"Low","Unsatisfactory","2018-09-19",0.0965,32.2,257.7,42.5,6.285,0.067,0,2861,0,7.9592759601164,3,"1970"
"SOAD07439","Flumevale","Yes","Flood Risk Reduction","Earth",4.699,0.467,0,"1975","2012",0.38612,29.29619,"Uncontrolled","20/06/2012","3",6.48,"Low","Fair","2018-09-19",0.0893,392,461.9,NA,4.699,0.467,0,NA,1,NA,1,"2012"
"SOAD18652","Flumevale","Yes","Water Supply","Earth",14.365,0.26,97000,"1985","",0.28959,NA,"","25/01/2022","1",0,"High","Satisfactory","2017-09-01",0.0927,255,821.8,15.6,14.365,0.26,0,97000,0,11.4824765667107,0,"Unknow"
"SOAD02354","Flumevale","Yes","Recreation","Earth",13.981,0.142,17707,"1964","",0.1379,13.31645,"Uncontrolled","28/07/2021","6",4.81,"Low","Satisfactory","2016-06-08",0.0593,28.2,722.7,3.9,13.981,0.142,0,17707,0,9.78177179385203,0,"Unknow"
"SOAD07885","Flumevale","Yes","Flood Risk Reduction","Earth",16.931,0.183,85800,"1960","",0.2364,29.29619,"","21/04/2022","1",0,"High","Satisfactory","2017-09-01",0.0871,21.5,826.7,NA,16.931,0.183,0,85800,0,11.3597859404198,0,"Unknow"
"SOAD18407","Flumevale","Yes","Other","Earth",16.844,0.24,79100,"1976","",0.17139,26.6329,"","12/11/2021","0.5",NA,"Low","Satisfactory","2017-09-01",0.0821,38.8,18.5,NA,16.844,0.24,0,79100,0,11.2784807959009,0,"Unknow"
"SOAD18248","Flumevale","Yes","Water Supply","Earth",8.541,0.948,NA,"1901","",0.2167,0,"Uncontrolled","21/06/2022","1",0,"High","Fair","2022-06-21",0.1266,9.5,660,41.8,8.541,0.948,0,NA,1,NA,0,"Unknow"
"SOAD18875","Flumevale","Yes","Irrigation","Earth",8.05,0.047,3500,"1890","1970S",0.25807,0,"Uncontrolled","11/08/2022","2",14.13,"Significant","Fair","2022-08-11",0.1302,569.8,139,29.5,8.05,0.047,0,3500,0,8.16080392095467,1,"1970"
"SOAD20160","Flumevale","Yes","Flood Risk Reduction","Earth",23.354,0.165,NA,"1972","2006",0.16351,0,"Uncontrolled","20/05/2021","3",3.07,"High","Satisfactory","2021-05-20",0.114,12,218.7,NA,23.354,0.165,0,NA,1,NA,1,"2006"
"SOAD10025","Flumevale","Yes","Irrigation","Earth",6.11,0.075,NA,"1947","2000",0.31914,0,"","20/10/2021","6",26.18,"Low","Satisfactory","2021-05-25",0.0473,597.5,427.6,28.2,6.11,0.075,0,NA,1,NA,1,"2000"
"SOAD14019","Flumevale","Yes","Water Supply","Earth",7.918,0.423,33000,"2000","",0.11229,NA,"","24/03/2022","1",0.16,"High","Satisfactory","2017-09-01",0.1069,13,189.1,58,7.918,0.423,0,33000,0,10.4042931430198,0,"Unknow"
"SOAD11530","Flumevale","Yes","Irrigation","Earth",8.53,0.133,25145,"1907","",0.49447,0,"Uncontrolled","19/08/2020","6",9.2,"Low","Fair","2018-10-18",0.0581,478.6,465.7,38.8,8.53,0.133,0,25145,0,10.1324541171531,0,"Unknow"
"SOAD15358","Flumevale","No","Fire Protection, Stock, Or Small Fish Pond","Earth",3.261,0.333,NA,"1975","",NA,29.29619,"Uncontrolled","01/08/2011","10",NA,"Low","Not Rated",NA,0.055,7.3,18.2,NA,3.261,0.333,0,NA,1,NA,0,"Unknow"
"SOAD07855","Flumevale","Yes","Debris Control","Earth",9.663,0.819,204000,"1998","",0.22655,39.94935,"","23/02/2022","1",0.16,"High","Satisfactory","2017-09-01",0.1017,32.4,541,NA,9.663,0.819,0,204000,0,12.2258801747751,0,"Unknow"
"SOAD11004","Flumevale","Yes","Flood Risk Reduction","Earth",17.412,0.555,0,"1996","",0.17336,21.30632,"","23/05/2022","3",9.51,"High","Satisfactory","2022-05-23",0.0839,5.3,256.1,NA,17.412,0.555,0,NA,1,NA,0,"Unknow"
"SOAD03153","Flumevale","Yes","Other","Earth",10.901,0.567,45000,"Unknow","",0.34475,2.66329,"","24/05/2022","1",NA,"High","Satisfactory","2017-09-01",0.0828,373.8,577.6,NA,10.901,0.567,0,45000,0,10.7144399907278,0,"Unknow"
"SOAD18144","Flumevale","Yes","Flood Risk Reduction","Earth",13.814,0.285,64800,"1961","",0.18715,42.61264,"","28/09/2020","3",24.65,"Low","Not Rated",NA,0.0947,7,408.9,NA,13.814,0.285,0,64800,0,11.0790763143201,0,"Unknow"
"SOAD04838","Flumevale","Yes","Irrigation","Earth",13.625,0.267,NA,"1956","",0.27777,21.30632,"Controlled","25/10/2021","6",117.86,"Low","Not Rated",NA,0.0702,236.4,67.8,6,13.625,0.267,0,NA,1,NA,0,"Unknow"
"SOAD05779","Flumevale","Yes","Fire Protection, Stock, Or Small Fish Pond","Earth",21.655,0.13,NA,"1981","",0.17336,0,"Uncontrolled","27/09/2022","2",28.93,"Significant","Fair","2022-09-27",0.1395,27.7,129.8,NA,21.655,0.13,0,NA,1,NA,0,"Unknow"
"SOAD05844","Flumevale","Yes","Water Supply","Earth",13.28,0.107,20000,"1950","",0.22852,23.96961,"","22/02/2022","1",NA,"Significant","Satisfactory","2017-09-01",0.1261,44.8,279.8,28.4,13.28,0.107,0,20000,0,9.90353755128617,0,"Unknow"
"SOAD02780","Flumevale","Yes","Hydroelectric","Earth",5.141,2.067,NA,"1990","",0.24822,NA,"Uncontrolled","19/05/2022","3",16.22,"Low","Satisfactory","2023-09-29",0.0756,398.3,194.9,94.5,5.141,2.067,0,NA,1,NA,0,"Unknow"
"SOAD02929","Flumevale","Yes","Water Supply","Earth",6.263,0.633,32545,"1959","",0.5516,26.6329,"","26/04/2022","0.5",NA,"Low","Satisfactory","2017-09-01",0.0757,36.6,22.1,57.6,6.263,0.633,0,32545,0,10.3904097522206,0,"Unknow"
"SOAD07829","Flumevale","Yes","Water Supply","Earth",7.689,0.055,0,"1905","",0.47477,2.66329,"","31/05/2022","0.5",NA,"Low","Satisfactory","2017-09-01",0.058,66.7,11.8,26.2,7.689,0.055,0,NA,1,NA,0,"Unknow"
"SOAD17496","Flumevale","Yes","Irrigation","Earth",6.594,0.057,3825,"1935","1985S;1993H;1993S;2000M;2000S",0.20488,47.93922,"Uncontrolled","24/05/2021","2",8.17,"Significant","Fair","2021-05-24",0.1303,15.3,250,3.1,6.594,0.057,0,3825,0,8.2495751500002,5,"2000"
"SOAD01018","Flumevale","Yes","Water Supply","Earth",6.462,0.45,6110,"1939","",0.25019,0,"Uncontrolled","08/06/2022","1",3.2,"High","Unsatisfactory","2022-06-08",0.1258,445.5,564.2,40,6.462,0.45,0,6110,0,8.71784570489492,0,"Unknow"
"SOAD13369","Flumevale","Yes","Flood Risk Reduction","Earth",11.801,0.262,52425,"1958","",0.24428,29.29619,"Uncontrolled","06/10/2020","3",25.82,"Low","Fair","2018-10-25",0.0951,41.2,190.1,NA,11.801,0.262,0,52425,0,10.8671579304571,0,"Unknow"
"SOAD14763","Flumevale","Yes","Water Supply","Earth",12.732,0.167,59000,"1953","",0.2758,2.66329,"","01/12/2021","1",0,"High","Satisfactory","2017-09-01",0.0924,635.4,521.7,33.9,12.732,0.167,0,59000,0,10.9853096718968,0,"Unknow"
"SOAD02427","Flumevale","Yes","Irrigation","Earth",6.241,0.053,3500,"1899","1970H;1970M;1970S",0.23837,0,"Uncontrolled","09/08/2018","6",14.9,"Low","Fair","2020-10-16",0.0751,46.9,403.4,42.1,6.241,0.053,0,3500,0,8.16080392095467,3,"1970"
"SOAD11645","Flumevale","Yes","Irrigation","Earth",6.11,0.32,29282,"1900","",0.38218,0,"Uncontrolled","16/06/2022","6",1.58,"Low","Unsatisfactory","2012-07-09",0.0887,617.9,206.7,24.6,6.11,0.32,0,29282,0,10.2847624218431,0,"Unknow"
"SOAD13055","Flumevale","Yes","Water Supply","Earth",6.967,0.777,48331,"1935","1956;1976;2004",0.24034,0,"Uncontrolled","26/09/2022","1",3.22,"High","Fair","2022-09-26",0.1194,13.8,427.8,45.9,6.967,0.777,0,48331,0,10.7858491461472,3,"2004"
"SOAD16301","Flumevale","Yes","Irrigation","Earth",7.216,0.167,0,"1954","",0.24231,7.98987,"Uncontrolled","11/08/2020","6",21.11,"Low","Fair","2019-07-30",0.0466,12.8,155.9,30.5,7.216,0.167,0,NA,1,NA,0,"Unknow"
"SOAD00050","Flumevale","Yes","Fish and Wildlife Pond","Earth",11.541,0.167,11481,"1912","",0,7.98987,"Uncontrolled","29/06/2017","10",17.46,"Low","Not Rated",NA,0.0706,22.2,244.5,NA,11.541,0.167,0,11481,0,9.34853587072758,0,"Unknow"
"SOAD12201","Flumevale","Yes","Water Supply","Earth",13.818,0.16,58500,"1960","",0.22064,2.66329,"","10/02/2022","1",0.84,"High","Satisfactory","2017-09-01",0.0882,45.1,701.2,28.3,13.818,0.16,0,58500,0,10.9767991270909,0,"Unknow"
"SOAD11715","Flumevale","Yes","Water Supply","Earth",14.499,0.082,21600,"1998","",0.2167,0,"Uncontrolled","27/07/2021","2",38.83,"Significant","Satisfactory","2021-07-27",0.1126,33.6,229.1,52.6,14.499,0.082,0,21600,0,9.98049488889691,0,"Unknow"
"SOAD12458","Flumevale","No","Fire Protection, Stock, Or Small Fish Pond","Earth",3.437,0.125,2467,"1907","",NA,143.81766,"Uncontrolled","29/09/2015","5",NA,"Significant","Not Rated",NA,0.0864,463.7,192.2,NA,3.437,0.125,0,2467,0,7.81116338502528,0,"Unknow"
"SOAD04460","Flumevale","Yes","Water Supply","Earth",6.461,1.912,16637,"1925","2022",0.29156,0,"Uncontrolled","19/05/2022","1",3.35,"High","Satisfactory","2022-05-19",0.0947,370.5,323.2,54.2,6.461,1.912,0,16637,0,9.71944451484383,1,"2022"
"SOAD14056","Flumevale","Yes","Water Supply","Earth",10.029,0.233,0,"Unknow","",0.42749,7.98987,"","09/12/2021","1",NA,"Significant","Satisfactory","2017-09-01",0.1333,35.6,69.6,30.7,10.029,0.233,0,NA,1,NA,0,"Unknow"
"SOAD14509","Flumevale","Yes","Flood Risk Reduction","Earth",19.42,0.115,75065,"1963","",0.14972,50.60251,"Uncontrolled","15/09/2022","3",4.91,"Low","Fair","2004-05-21",0.0851,21.7,96.9,NA,19.42,0.115,0,75065,0,11.2261230055455,0,"Unknow"
"SOAD18240","Flumevale","Yes","Recreation","Earth",14.572,0.293,64890,"1938","2009",0.23246,173.11385,"Uncontrolled","17/10/2022","2",37.43,"Significant","Fair","2022-10-17",0.1369,26.6,222.5,6.3,14.572,0.293,0,64890,0,11.0804642181915,1,"2009"
"SOAD18319","Flumevale","Yes","Irrigation","Earth",7.035,0.473,35764,"1949","",0.20488,7.98987,"","01/01/1998","0",25.23,"Low","Fair","2019-07-30",0.0948,14.4,403.6,14.3,7.035,0.473,0,35764,0,10.4847250405425,0,"Unknow"
"SOAD11165","Flumevale","Yes","Flood Risk Reduction","Earth",30.941,0.233,436000,"1989","",0.13396,5.32658,"","05/05/2022","1",0,"High","Satisfactory","2017-09-01",0.0991,36.1,423.7,NA,30.941,0.233,0,436000,0,12.9853998159065,0,"Unknow"
"SOAD20139","Flumevale","Yes","Other","Earth",5.849,3.175,36609,"1981","1998",0.32308,0,"","23/10/2015","6",4.63,"Low","Not Rated",NA,0.0459,159.5,151.7,NA,5.849,3.175,0,36609,0,10.5080767061143,1,"1998"
"SOAD05465","Flumevale","Yes","Flood Risk Reduction","Earth",14.805,0.3,85000,"1954","",0.20488,37.28606,"","09/03/2022","1",0,"High","Satisfactory","2017-09-01",0.0949,34.1,513.1,NA,14.805,0.3,0,85000,0,11.3504183001091,0,"Unknow"
"SOAD14683","Flumevale","Yes","Water Supply","Earth",13.806,0.15,0,"1915","",0.21079,21.30632,"Uncontrolled","12/05/2021","6",14.63,"Low","Satisfactory","2022-03-23",0.0489,40.9,276.1,41.7,13.806,0.15,0,NA,1,NA,0,"Unknow"
"SOAD10639","Flumevale","Yes","Recreation","Earth",20.788,0.197,NA,"1959","",0.18124,45.27593,"","14/12/2021","6",72,"Low","Not Rated",NA,0.0763,17,220.2,5.6,20.788,0.197,0,NA,1,NA,0,"Unknow"
"SOAD13278","Flumevale","Yes","Water Supply","Earth",12.096,0.092,21000,"1956","",0.26398,0,"","01/06/2022","1",1.16,"High","Satisfactory","2017-09-01",0.0962,109.7,562.1,66.2,12.096,0.092,0,21000,0,9.95232533461943,0,"Unknow"
"SOAD17658","Flumevale","Yes","Water Supply","Earth",21.022,0.212,51300,"1991","",0.21473,0,"","02/11/2021","1",3.33,"High","Satisfactory","2017-09-01",0.0948,22.8,163,67.2,21.022,0.212,0,51300,0,10.8454655241463,0,"Unknow"
"SOAD14712","Flumevale","Yes","Recreation","Earth",10.898,0.5,37781,"1937","",0.22458,0,"","17/05/2016","6",4.79,"Low","Satisfactory","2022-10-06",0.0234,21.3,424.3,7.6,10.898,0.5,0,37781,0,10.5395880777168,0,"Unknow"
"SOAD14250","Flumevale","Yes","Other","Earth",12.39,0.333,61000,"1935","",0.50629,306.27835,"","01/12/2021","1",0,"High","Satisfactory","2017-09-01",0.0865,590.2,353.8,NA,12.39,0.333,0,61000,0,11.0186455364637,0,"Unknow"
"SOAD19510","Flumevale","Yes","Irrigation","Earth",9.069,0.47,74553,"1900","2005",0.56342,7.98987,"Uncontrolled","12/05/2022","1",1.63,"High","Satisfactory","2022-05-12",0.1019,346.6,105.8,32.3,9.069,0.47,0,74553,0,11.2192789740184,1,"2005"
"SOAD02726","Flumevale","Yes","Irrigation","Earth",7.063,0.15,13393,"1966","",0.44128,0,"","14/07/2020","6",38.5,"Low","Not Rated",NA,0.0719,314.2,80.9,40.5,7.063,0.15,0,13393,0,9.50256212447,0,"Unknow"
"SOAD19858","Flumevale","Yes","Irrigation","Earth",12.876,0.123,489,"1996","2009",0.15366,7.98987,"Uncontrolled","16/06/2020","2",30.8,"Significant","Fair","2020-06-16",0.1678,45.4,163.8,39.2,12.876,0.123,0,489,0,6.19440539110467,1,"2009"
"SOAD00841","Flumevale","Yes","Water Supply","Earth",42.238,0.157,0,"1976","1997",0.0985,7.98987,"Uncontrolled","29/06/2016","6",24.96,"Low","Not Rated",NA,0.0379,44.3,377.7,61.7,42.238,0.157,0,NA,1,NA,1,"1997"
"SOAD06031","Flumevale","Yes","Water Supply","Earth",4.393,1.667,75000,"1951","",0.85695,7.98987,"","15/06/2022","0.5",NA,"Low","Satisfactory","2017-09-01",0.063,347.5,13.7,36.8,4.393,1.667,0,75000,0,11.2252567257629,0,"Unknow"
"SOAD12262","Flumevale","Yes","Irrigation","Earth",4.812,0.042,2642,"1892","",0.34475,0,"Uncontrolled","06/08/2015","6",17.94,"Low","Fair","2021-05-14",0.0553,77,431,24.1,4.812,0.042,0,2642,0,7.87966991460429,0,"Unknow"
"SOAD15916","Flumevale","Yes","Water Supply","Earth",24.088,0.388,96720,"1970","",0.20685,7.98987,"","11/05/2022","2",7.72,"Significant","Satisfactory","2022-05-11",0.1031,39.5,148.5,55.9,24.088,0.388,0,96720,0,11.4795858243585,0,"Unknow"
"SOAD00388","Flumevale","Yes","Fish and Wildlife Pond","Earth",13.984,0.24,NA,"1892","",0.14578,29.29619,"Uncontrolled","12/05/2022","1",16.22,"High","Unsatisfactory","2022-05-12",0.1442,24.2,180.3,NA,13.984,0.24,0,NA,1,NA,0,"Unknow"
"SOAD09753","Flumevale","Yes","Flood Risk Reduction","Earth",14.765,0.13,40000,"1940","",0.24034,47.93922,"","31/08/2022","0.5",NA,"Low","Satisfactory","2017-09-01",0.077,7.7,5.4,NA,14.765,0.13,0,40000,0,10.5966597327836,0,"Unknow"
"SOAD18754","Flumevale","Yes","Recreation","Earth",10.755,0.787,34463,"1961","",0.16351,0,"Uncontrolled","12/05/2022","1",0,"High","Satisfactory","2022-05-12",0.0882,15.8,440.8,6.7,10.755,0.787,0,34463,0,10.4476705799561,0,"Unknow"
"SOAD19086","Flumevale","Yes","Irrigation","Earth",7.391,0.388,49819,"1961","",0.20488,0,"","03/10/2022","6",26.95,"Low","Satisfactory","2020-08-26",0.0284,28.1,205.2,11.3,7.391,0.388,0,49819,0,10.8161717888162,0,"Unknow"
"SOAD04445","Flumevale","Yes","Water Supply","Earth",20.698,0.13,45000,"1985","",0.18321,NA,"","12/04/2022","1",3.38,"Significant","Satisfactory","2017-09-01",0.1219,30.7,913.8,28,20.698,0.13,0,45000,0,10.7144399907278,0,"Unknow"
"SOAD00041","Flumevale","Yes","Water Supply","Earth",23.062,0.258,NA,"1937","",0.15169,42.61264,"Uncontrolled","15/08/2016","6",57.12,"Low","Fair","2022-09-15",0.0804,36.5,89.6,31.5,23.062,0.258,0,NA,1,NA,0,"Unknow"
"SOAD05528","Flumevale","Yes","Irrigation","Earth",21.202,0.06,17314,"1964","",0.15563,85.22528,"Uncontrolled","11/10/2021","2",27.24,"Significant","Unsatisfactory","2021-10-11",0.1765,38.4,286.9,20.3,21.202,0.06,0,17314,0,9.75932845683652,0,"Unknow"
"SOAD14528","Flumevale","Yes","Fire Protection, Stock, Or Small Fish Pond","Earth",10.12,0.167,81855,"1904","",0.18321,0,"Uncontrolled","01/08/2022","2",6.45,"Significant","Fair","2022-08-01",0.1244,30.2,208.7,NA,10.12,0.167,0,81855,0,11.3127168849385,0,"Unknow"
"SOAD18415","Flumevale","Yes","Water Supply","Earth",38.481,0.247,331000,"1954","",0.1182,5.32658,"","01/09/2022","0.5",NA,"Low","Satisfactory","2017-09-01",0.0529,40.6,16.7,70.6,38.481,0.247,0,331000,0,12.7098766755027,0,"Unknow"
"SOAD01116","Flumevale","Yes","Irrigation","Earth",7.919,0.358,112000,"1908","1963S;2003H;2003S",0.27777,15.97974,"Uncontrolled","20/04/2022","1",4.63,"High","Satisfactory","2022-04-20",0.0942,444.6,802.5,9.1,7.919,0.358,0,112000,0,11.6262630788088,3,"2003"
"SOAD17467","Flumevale","Yes","Water Supply","Earth",7.61,0.115,15343,"1923","",0.394,34.62277,"","22/06/2022","0.5",NA,"Low","Satisfactory","2017-09-01",0.0651,290,12.1,63.6,7.61,0.115,0,15343,0,9.63847979712322,0,"Unknow"
"SOAD19645","Flumevale","Yes","Water Supply","Earth",21.785,0.158,62000,"1957","",0.21079,2.66329,"","15/02/2022","0.5",NA,"Low","Satisfactory","2017-09-01",0.0588,38.1,12.5,41.4,21.785,0.158,0,62000,0,11.0349057929294,0,"Unknow"
"SOAD05847","Flumevale","Yes","Recreation","Earth",4.23,0.133,7243,"1930","2005H",0.42749,0,"Uncontrolled","28/06/2019","6",11.78,"Low","Not Rated",NA,0.0408,308.3,362.2,6.5,4.23,0.133,0,7243,0,8.8879288190033,1,"2005"
"SOAD05498","Flumevale","Yes","Water Supply","Earth",5.901,1.2,NA,"2012","",0.14775,0,"Uncontrolled","14/07/2015","6",9.64,"Low","Fair","2017-08-28",0.0637,33.4,109.5,45.8,5.901,1.2,0,NA,1,NA,0,"Unknow"
"SOAD13290","Flumevale","No","Recreation","Earth",6.79,0.175,NA,"1928","",0.38218,1219.78682,"Uncontrolled","31/05/2023","3",0,"High","Fair","2023-05-31",0.0918,188.1,605.3,9.3,6.79,0.175,0,NA,1,NA,0,"Unknow"
"SOAD11792","Flumevale","Yes","Irrigation","Earth",8.854,0.09,12089,"1955","",0.2364,0,"Uncontrolled","10/08/2021","2",19.18,"Significant","Fair","2021-08-10",0.1513,32.7,282,38,8.854,0.09,0,12089,0,9.40013394360884,0,"Unknow"
"SOAD20161","Flumevale","Yes","Fish and Wildlife Pond","Earth",7.554,0.433,NA,"1973","",0.38021,74.57212,"","04/06/2010","6",11.1,"Low","Not Rated",NA,0.0848,146.8,247.5,NA,7.554,0.433,0,NA,1,NA,0,"Unknow"
"SOAD01135","Flumevale","Yes","Water Supply","Earth",14.246,0.135,25900,"1939","",0.29353,7.98987,"","22/06/2022","0.5",NA,"Low","Satisfactory","2017-09-01",0.0792,59.3,10.8,29.1,14.246,0.135,0,25900,0,10.1620368569809,0,"Unknow"
"SOAD20267","Flumevale","Yes","Irrigation","Earth",3.48,0.267,NA,"1907","",0.44128,21.30632,"Uncontrolled","01/12/2022","6",18.39,"Low","Not Rated",NA,0.0907,152.2,203.2,35,3.48,0.267,0,NA,1,NA,0,"Unknow"
"SOAD03359","Flumevale","Yes","Fire Protection, Stock, Or Small Fish Pond","Earth",11.701,0.052,10402,"1968","",0.22852,0,"Uncontrolled","10/06/2022","6",19.89,"Low","Not Rated",NA,0.073,15.8,149.4,NA,11.701,0.052,0,10402,0,9.24984950507089,0,"Unknow"
"SOAD08742","Flumevale","Yes","Irrigation","Earth",12.047,0.103,4e+05,"2008","",0.20094,109.19489,"Uncontrolled","19/05/2021","6",35.48,"Low","Fair","2021-02-02",0.048,29,70,14.8,12.047,0.103,0,4e+05,0,12.899222326087,0,"Unknow"
"SOAD10169","Flumevale","Yes","Water Supply","Earth",6.66,0.283,NA,"1900","2005",0.55948,7.98987,"Uncontrolled","12/05/2022","1",0,"High","Satisfactory","2022-05-12",0.0893,164.4,826.1,30.2,6.66,0.283,0,NA,1,NA,1,"2005"
"SOAD19227","Flumevale","Yes","Irrigation","Earth",7.582,0.6,NA,"1901","",0.51023,0,"","16/05/2019","6",73.84,"Low","Fair","2022-10-18",0.0561,70.6,60.5,18.1,7.582,0.6,0,NA,1,NA,0,"Unknow"
"SOAD02035","Flumevale","Yes","Irrigation","Earth",5.428,0.367,35347,"1885","",0.12805,50.60251,"Uncontrolled","28/10/2016","6",7.95,"Low","Fair","2017-10-19",0.0355,35.1,303.6,42.5,5.428,0.367,0,35347,0,10.4729970926379,0,"Unknow"
"SOAD05006","Flumevale","Yes","Other","Earth",19.059,0.265,28836,"1880","",0.66192,175.77714,"","22/09/2021","1",4.76,"High","Satisfactory","2017-09-01",0.0832,52.4,383.6,NA,19.059,0.265,0,28836,0,10.2694145637968,0,"Unknow"
"SOAD07460","Flumevale","Yes","Water Supply","Earth",30.673,0.233,24032,"1965","",0.10244,74.57212,"Uncontrolled","30/06/2022","1",10.73,"High","Satisfactory","2022-06-30",0.0988,39.4,359.7,61.8,30.673,0.233,0,24032,0,10.0871831648832,0,"Unknow"
"SOAD04167","Flumevale","Yes","Water Supply","Earth",8.39,0.33,0,"1948","",0.40188,NA,"","10/09/2021","0.5",NA,"Low","Satisfactory","2017-09-01",0.0654,289.3,16,13.7,8.39,0.33,0,NA,1,NA,0,"Unknow"
"SOAD01771","Flumevale","Yes","Water Supply","Earth",17.019,0.3,85700,"1955","",0.23443,5.32658,"","19/04/2022","0.5",NA,"Low","Satisfactory","2017-09-01",0.0697,27.7,11.1,21.9,17.019,0.3,0,85700,0,11.3586197731292,0,"Unknow"
"SOAD05919","Flumevale","Yes","Flood Risk Reduction","Earth",12.577,0.718,NA,"1959","",0.2955,13.31645,"Uncontrolled","20/07/2020","3",3.28,"Low","Fair","2014-06-25",0.1001,133.5,187.4,NA,12.577,0.718,0,NA,1,NA,0,"Unknow"
"SOAD20282","Flumevale","Yes","Water Supply","Earth",30.056,0.225,NA,"1968","",0.13002,29.29619,"Uncontrolled","09/08/2022","6",59.13,"Low","Not Rated",NA,0.059,10.8,187.3,20.3,30.056,0.225,0,NA,1,NA,0,"Unknow"
"SOAD16088","Flumevale","Yes","Irrigation","Earth",7.725,0.976,25318,"1904","",0.32505,0,"Uncontrolled","26/06/2017","6",7.8,"Low","Not Rated",NA,0.0284,128.7,473.5,15.8,7.725,0.976,0,25318,0,10.1393103810074,0,"Unknow"
"SOAD05374","Flumevale","Yes","Water Supply","Earth",5.534,2,90000,"1975","",0.28565,NA,"","","1",NA,"High","Not Rated","2022-03-18",0.1293,385.6,940.9,40.4,5.534,2,0,90000,0,11.4075760603618,0,"Unknow"
"SOAD15959","Flumevale","Yes","Water Supply","Earth",5.634,0.083,130,"1928","",0.56933,15.97974,"","11/05/2021","1",NA,"Significant","Satisfactory","2017-09-01",0.1409,77,178.4,38.4,5.634,0.083,0,130,0,4.87519732320115,0,"Unknow"
"SOAD05277","Flumevale","No","Recreation","Earth",5.067,0.167,NA,"1928","",0.38809,NA,"","31/05/2023","3",0,"High","Fair","2023-05-31",0.1205,193.3,891.1,5,5.067,0.167,0,NA,1,NA,0,"Unknow"
"SOAD08597","Flumevale","Yes","Flood Risk Reduction","Earth",17.476,0.21,81150,"1964","",0.21079,58.59238,"","05/04/2019","3",4.62,"Low","Not Rated",NA,0.0983,9.1,314.4,NA,17.476,0.21,0,81150,0,11.3040668957257,0,"Unknow"
"SOAD13388","Flumevale","Yes","Irrigation","Earth",16.017,0.293,77958,"1957","",0.20094,42.61264,"Uncontrolled","14/06/2022","1",10.88,"High","Fair","2022-06-14",0.1182,39.4,247.4,23,16.017,0.293,0,77958,0,11.2639383264484,0,"Unknow"
"SOAD01468","Flumevale","Yes","Water Supply","Earth",36.684,0.29,NA,"1954","1984",0.10244,0,"Uncontrolled","21/04/2022","1",0,"High","Satisfactory","2022-04-21",0.1019,19.5,934.1,17.1,36.684,0.29,0,NA,1,NA,1,"1984"
"SOAD04802","Flumevale","Yes","Irrigation","Earth",5.968,0.4,72525,"1902","",0.38218,0,"Uncontrolled","12/12/2008","6",17.55,"Low","Satisfactory","2021-04-29",0.0452,538.6,98.1,15.8,5.968,0.4,0,72525,0,11.1917003972434,0,"Unknow"
"SOAD01080","Flumevale","Yes","Water Supply","Earth",10.148,0.167,53000,"Unknow","",0.27186,5.32658,"","31/05/2022","0.5",NA,"Low","Satisfactory","2017-09-01",0.0708,642.4,16.7,38.2,10.148,0.167,0,53000,0,10.8780660602808,0,"Unknow"
"SOAD08128","Flumevale","Yes","Water Supply","Earth",12.403,0.228,35142,"1946","",0.31323,50.60251,"","06/09/2022","1",0.79,"High","Satisfactory","2017-09-01",0.1025,212.9,268.9,39,12.403,0.228,0,35142,0,10.4671807308916,0,"Unknow"
"SOAD08562","Flumevale","Yes","Flood Risk Reduction","Earth",10.631,0.863,NA,"1963","",0.3349,37.28606,"Uncontrolled","20/07/2020","3",20.11,"Low","Fair","2016-06-24",0.0789,100.2,145.6,NA,10.631,0.863,0,NA,1,NA,0,"Unknow"
"SOAD03326","Flumevale","Yes","Irrigation","Earth",10.401,0.361,52821,"1935","1955",0.41961,0,"Uncontrolled","30/07/2015","6",38.97,"Low","Satisfactory","2010-07-02",0.0323,202,196.2,36.7,10.401,0.361,0,52821,0,10.8746830495796,1,"1955"
"SOAD01899","Flumevale","Yes","Irrigation","Earth",5.02,0.333,26669,"1907","",0.43931,21.30632,"Uncontrolled","01/12/2022","6",16.85,"Low","Not Rated",NA,0.0622,334.6,308.7,32.2,5.02,0.333,0,26669,0,10.1912946171761,0,"Unknow"
"SOAD01909","Flumevale","Yes","Flood Risk Reduction","Earth",15.1,0.39,88744,"1979","",0.19306,13.31645,"Uncontrolled","29/09/2021","3",0,"High","Not Rated",NA,0.1439,13.2,226.6,NA,15.1,0.39,0,88744,0,11.3935223677224,0,"Unknow"
"SOAD15147","Flumevale","Yes","Irrigation","Earth",6.209,0.031,0,"1891","2004",0.3349,7.98987,"Uncontrolled","19/07/2022","6",18.12,"Low","Fair","2019-09-13",0.0673,517.9,101.3,17.5,6.209,0.031,0,NA,1,NA,1,"2004"
"SOAD20804","Flumevale","Yes","Fish and Wildlife Pond","Earth",8.153,0.467,NA,"1974","",0.36839,0,"","31/08/2022","6",87.18,"Low","Satisfactory","2022-11-21",0.0349,78.6,83.3,NA,8.153,0.467,0,NA,1,NA,0,"Unknow"
"SOAD02737","Flumevale","Yes","Water Supply","Earth",10.033,0.6,97800,"1951","",0.38612,13.31645,"","27/07/2022","1",0.16,"High","Satisfactory","2017-09-01",0.1038,405.5,749.5,66.3,10.033,0.6,0,97800,0,11.4906900809195,0,"Unknow"
"SOAD04717","Flumevale","Yes","Irrigation","Earth",5.354,0.087,NA,"1967","1989",0.24428,0,"Uncontrolled","13/07/2015","6",8.25,"Low","Not Rated",NA,0.0923,701.1,280.5,2.2,5.354,0.087,0,NA,1,NA,1,"1989"
"SOAD14810","Flumevale","Yes","Irrigation","Earth",5.105,0.458,34378,"1906","",0.33293,0,"Uncontrolled","14/09/2022","2",0,"Significant","Satisfactory","2022-09-14",0.1392,655.2,947.5,7.3,5.105,0.458,0,34378,0,10.4452011918355,0,"Unknow"
"SOAD02498","Flumevale","Yes","Other","Earth",17.158,0.132,75000,"1870","",0.50826,45.27593,"","01/09/2022","1",0,"High","Satisfactory","2017-09-01",0.0976,163.7,568.4,NA,17.158,0.132,0,75000,0,11.2252567257629,0,"Unknow"
"SOAD07912","Flumevale","Yes","Irrigation","Earth",12.282,0.083,27983,"1940","",0.18518,0,"Uncontrolled","22/09/2021","2",15.08,"Significant","Satisfactory","2021-09-22",0.1238,27.2,108.4,47.1,12.282,0.083,0,27983,0,10.2393881972584,0,"Unknow"
"SOAD12290","Flumevale","Yes","Water Supply","Earth",18.694,0.31,170000,"1910","",0.15366,NA,"","17/03/2022","1",NA,"High","Satisfactory","2017-09-01",0.1119,13,588.3,56.7,18.694,0.31,0,170000,0,12.043559598368,0,"Unknow"
"SOAD05121","Flumevale","Yes","Irrigation","Earth",16.083,0.2,53215,"1913","",0.30535,21.30632,"Uncontrolled","26/05/2022","6",38.47,"Low","Satisfactory","2021-06-08",0.0437,552,48.5,29,16.083,0.2,0,53215,0,10.8821143819927,0,"Unknow"
"SOAD10608","Flumevale","Yes","Water Supply","Earth",20.193,0.077,63726,"1936","",0.21079,18.64303,"","31/08/2021","1",4.73,"High","Satisfactory","2017-09-01",0.0886,43.8,556,31.1,20.193,0.077,0,63726,0,11.0623636136086,0,"Unknow"
"SOAD01172","Flumevale","Yes","Irrigation","Earth",4.373,0.12,3674,"1959","",0.45113,0,"","23/07/2019","6",43.44,"Low","Not Rated",NA,0.0813,394.2,201.8,19.1,4.373,0.12,0,3674,0,8.20930841164694,0,"Unknow"
"SOAD13465","Flumevale","Yes","Irrigation","Earth",15.939,0.317,59393,"1914","",0.0591,0,"","22/03/2017","6",40.72,"Low","Satisfactory","2021-09-09",0.0323,5,67.5,1,15.939,0.317,0,59393,0,10.9919484901479,0,"Unknow"
"SOAD10287","Flumevale","Yes","Fire Protection, Stock, Or Small Fish Pond","Earth",7.317,0.25,9771,"1916","",0,15.97974,"Uncontrolled","05/09/2013","10",0,"Low","Not Rated",NA,0.0681,24.4,948.4,NA,7.317,0.25,0,9771,0,9.18727643237763,0,"Unknow"
"SOAD05472","Flumevale","Yes","Water Supply","Earth",34.782,0.209,187000,"1982","",0.13593,2.66329,"","24/08/2022","0.5",NA,"Low","Satisfactory","2017-09-01",0.0699,28.1,14.6,32,34.782,0.209,0,187000,0,12.138869243416,0,"Unknow"
"SOAD15277","Flumevale","Yes","Recreation","Earth",4.989,0.59,NA,"1896","",0.50629,0,"","02/11/2015","6",15.62,"Low","Satisfactory","2018-09-05",0.0403,467.3,380.1,7.8,4.989,0.59,0,NA,1,NA,0,"Unknow"
"SOAD06173","Flumevale","Yes","Irrigation","Earth",10.989,0.619,NA,"1907","",0.26201,0,"Uncontrolled","12/09/2022","2",8,"Significant","Satisfactory","2022-09-12",0.1185,565.4,318.7,8.8,10.989,0.619,0,NA,1,NA,0,"Unknow"
"SOAD11517","Flumevale","Yes","Irrigation","Earth",9.113,0.533,0,"1888","",0.2167,0,"Uncontrolled","13/05/2020","6",6.21,"Low","Not Rated",NA,0.0498,31.2,394.8,7,9.113,0.533,0,NA,1,NA,0,"Unknow"
"SOAD01988","Flumevale","Yes","Hydroelectric","Earth",2.424,0.137,1800,"1860","",0.28565,7.98987,"Uncontrolled","28/06/2022","1",40.85,"High","Satisfactory","2023-09-29",0.1148,690.4,127.5,47.7,2.424,0.137,0,1800,0,7.49609734517596,0,"Unknow"
"SOAD05511","Flumevale","Yes","Water Supply","Earth",29.498,1.14,0,"1994","",0.14184,0,"Uncontrolled","18/05/2022","1",0,"High","Satisfactory","2022-05-18",0.0996,40.5,276.9,38.8,29.498,1.14,0,NA,1,NA,0,"Unknow"
"SOAD09640","Flumevale","Yes","Irrigation","Earth",8.868,0.167,30658,"1888","2000S",0.29156,0,"Uncontrolled","18/04/2022","2",6.5,"Significant","Fair","2022-04-18",0.1456,506.4,100.2,6.7,8.868,0.167,0,30658,0,10.3306815361079,1,"2000"
"SOAD10314","Flumevale","No","Fire Protection, Stock, Or Small Fish Pond","Earth",2.832,0.237,NA,"1975","",NA,10.65316,"Uncontrolled","31/08/2010","10",NA,"Low","Not Rated",NA,0.0618,21.9,21.1,NA,2.832,0.237,0,NA,1,NA,0,"Unknow"
"SOAD03709","Flumevale","Yes","Water Supply","Earth",9.505,0.35,75000,"1940","",0.23837,0,"","15/06/2022","0.5",NA,"Low","Satisfactory","2017-09-01",0.0636,21.6,5,64,9.505,0.35,0,75000,0,11.2252567257629,0,"Unknow"
"SOAD03690","Flumevale","Yes","Other","Earth",24.003,0.528,105000,"1996","",0.28565,0,"Uncontrolled","24/05/1996","0",39.39,"Low","Not Rated",NA,0.0759,710.9,143.6,NA,24.003,0.528,0,105000,0,11.5617251529038,0,"Unknow"
"SOAD12149","Flumevale","Yes","Water Supply","Earth",8.813,1.536,NA,"2009","",0.19897,0,"Uncontrolled","14/07/2022","1",3.17,"High","Satisfactory","2022-07-14",0.0878,34.8,785,28.6,8.813,1.536,0,NA,1,NA,0,"Unknow"
"SOAD11324","Flumevale","Yes","Irrigation","Earth",2.835,0.617,32891,"1879","",0.66783,0,"Uncontrolled","21/04/2022","6",19.57,"Low","Not Rated",NA,0.0652,406.6,218.1,20.1,2.835,0.617,0,32891,0,10.4009847460908,0,"Unknow"
"SOAD08034","Flumevale","Yes","Irrigation","Earth",15.622,0.187,67,"1957","",0.17336,21.30632,"","01/07/2008","6",66.29,"Low","Not Rated",NA,0.064,34.8,177.9,27.6,15.622,0.187,0,67,0,4.21950770517611,0,"Unknow"
"SOAD15300","Flumevale","Yes","Irrigation","Earth",7.535,0.325,51552,"1951","",0.12017,7.98987,"","18/07/2013","6",15.93,"Low","Not Rated",NA,0.0611,40.6,445.4,18.9,7.535,0.325,0,51552,0,10.8503656836781,0,"Unknow"
"SOAD20539","Flumevale","Yes","Flood Risk Reduction","Earth",13.39,1.383,322000,"2017","",0.20882,NA,"","17/02/2022","1",0,"High","Satisfactory","2017-09-01",0.0853,24.9,858.5,NA,13.39,1.383,0,322000,0,12.6823099301118,0,"Unknow"
"SOAD00247","Flumevale","Yes","Hydroelectric","Earth",10.598,0.067,2000,"1860","",0.26792,7.98987,"","28/06/2022","1",38.89,"High","Satisfactory","2023-09-29",0.0905,76.8,55.9,56.6,10.598,0.067,0,2000,0,7.60140233458373,0,"Unknow"
"SOAD16647","Flumevale","Yes","Fish and Wildlife Pond","Earth",7.266,0.472,15133,"1941","",0.36051,314.26822,"Uncontrolled","01/01/2001","0",24.02,"Low","Satisfactory","2020-10-13",0.0702,181.3,107.9,NA,7.266,0.472,0,15133,0,9.62469914725447,0,"Unknow"
"SOAD00134","Flumevale","Yes","Irrigation","Earth",14.346,0.297,28323,"1957","",0.25807,0,"","17/08/2016","6",27.85,"Low","Not Rated",NA,0.0688,118.2,292.3,45.1,14.346,0.297,0,28323,0,10.2514647807717,0,"Unknow"
"SOAD12737","Flumevale","Yes","Water Supply","Earth",23.749,0.163,85000,"1940","",0.27974,26.6329,"","07/01/2022","1",1.58,"High","Satisfactory","2017-09-01",0.0916,31.2,943.8,35.8,23.749,0.163,0,85000,0,11.3504183001091,0,"Unknow"
"SOAD04480","Flumevale","Yes","Irrigation","Earth",13.916,0.175,20118,"1950","2001",0.17336,0,"Uncontrolled","19/05/2021","6",33.97,"Low","Not Rated",NA,0.0446,12.8,156.1,16.1,13.916,0.175,0,20118,0,9.90941992118924,1,"2001"
"SOAD11855","Flumevale","Yes","Irrigation","Earth",5.701,0.527,40781,"1906","",0.40188,956.12111,"Uncontrolled","16/09/2016","6",26.1,"Low","Fair","2022-10-06",0.0683,477.6,176.3,27.9,5.701,0.527,0,40781,0,10.6159960865747,0,"Unknow"
"SOAD00599","Flumevale","Yes","Other","Earth",8.065,1.479,0,"1982","",0.23443,NA,"","20/01/2022","0.5",NA,"Low","Satisfactory","2017-09-01",0.06,35.7,23.5,NA,8.065,1.479,0,NA,1,NA,0,"Unknow"
"SOAD01171","Flumevale","Yes","Water Supply","Earth",17.027,0.15,74000,"1992","",0.29747,5.32658,"","31/08/2021","0.5",NA,"Low","Satisfactory","2017-09-01",0.064,597.9,18.6,12.1,17.027,0.15,0,74000,0,11.2118338856085,0,"Unknow"
"SOAD14307","Flumevale","Yes","Water Supply","Earth",10.614,0.617,150000,"2011","",0.21079,5.32658,"","15/11/2022","1",5.84,"High","Fair","2021-01-08",0.122,5.3,328.5,43.9,10.614,0.617,0,150000,0,11.9183972397228,0,"Unknow"
"SOAD05281","Flumevale","Yes","Irrigation","Earth",8.096,0.123,10400,"1909","1985H;1985M;1985S",0.31717,7.98987,"Uncontrolled","20/10/2021","1",14.95,"High","Fair","2021-10-20",0.0964,644.8,405.4,3.9,8.096,0.123,0,10400,0,9.24965723435313,3,"1985"
"SOAD01414","Flumevale","Yes","Irrigation","Earth",7.597,0.16,9880,"1894","1956",0.3349,0,"Uncontrolled","08/07/2021","6",15.99,"Low","Unsatisfactory","2004-05-21",0.0885,660.3,417.9,6.2,7.597,0.16,0,9880,0,9.19836900019496,1,"1956"
"SOAD09758","Flumevale","Yes","Water Supply","Earth",15.109,0.162,150000,"1966","",0.33687,NA,"","24/02/2022","1",0.66,"High","Satisfactory","2017-09-01",0.0895,276.3,466.3,16.9,15.109,0.162,0,150000,0,11.9183972397228,0,"Unknow"
"SOAD05370","Flumevale","Yes","Water Supply","Earth",12.166,0.178,NA,"1955","2014",0.23837,77.23541,"Uncontrolled","23/08/2018","6",15.77,"Low","Satisfactory","2019-10-10",0.036,11.3,175.2,50.6,12.166,0.178,0,NA,1,NA,1,"2014"
"SOAD18528","Flumevale","Yes","Water Supply","Earth",22.513,0.088,40000,"1954","",0.18518,2.66329,"","03/05/2022","1",0,"Significant","Satisfactory","2017-09-01",0.1056,36.3,740,62.7,22.513,0.088,0,40000,0,10.5966597327836,0,"Unknow"
"SOAD04396","Flumevale","Yes","Irrigation","Earth",7.706,0.35,0,"1922","",0.32308,0,"Uncontrolled","22/06/2022","2",0,"Significant","Satisfactory","2022-06-22",0.1212,238.3,291,18,7.706,0.35,0,NA,1,NA,0,"Unknow"
"SOAD12987","Flumevale","Yes","Other","Earth",7.935,1.494,1713000,"1999","",0.25019,0,"","24/02/2022","0.5",6.47,"Low","Satisfactory","2017-09-01",0.0507,409,203.4,NA,7.935,1.494,0,1713000,0,14.3537573610772,0,"Unknow"
"SOAD01960","Flumevale","Yes","Irrigation","Earth",7.91,0.096,5550,"1896","1985H;1985M;1985S",0.34475,7.98987,"Uncontrolled","20/10/2021","1",15.66,"High","Satisfactory","2021-10-20",0.0937,300.9,156.5,30.5,7.91,0.096,0,5550,0,8.62173337069016,3,"1985"
"SOAD18408","Flumevale","Yes","Irrigation","Earth",37.687,0,0,"1900","",0.17533,0,"","09/09/1985","0",17.92,"Low","Not Rated",NA,0.0981,34.2,438.7,21.8,37.687,NA,1,NA,1,NA,0,"Unknow"
"SOAD20710","Flumevale","Yes","Water Supply","Earth",20.611,0.3,790,"1968","",0.29156,0,"Uncontrolled","20/10/2022","1",5.02,"High","Fair","2022-10-20",0.098,71.5,333.5,58.8,20.611,0.3,0,790,0,6.67329796776765,0,"Unknow"
"SOAD19250","Flumevale","Yes","Water Supply","Earth",11.602,0.153,28000,"1959","",0.39597,53.2658,"","13/04/2022","0.5",NA,"Low","Satisfactory","2017-09-01",0.0719,48.1,7.2,64.3,11.602,0.153,0,28000,0,10.2399955028053,0,"Unknow"
"SOAD00682","Flumevale","Yes","Irrigation","Earth",6.059,0.263,11750,"Unknow","",0.50038,945.46795,"Uncontrolled","15/09/2016","6",28.03,"Low","Fair","2018-09-21",0.0615,508.4,138.4,27.3,6.059,0.263,0,11750,0,9.37169362233394,0,"Unknow"
"SOAD04997","Flumevale","Yes","Water Supply","Earth",19.898,0.21,70000,"1923","",0.2561,7.98987,"","15/09/2022","1",13.52,"High","Fair","2012-05-10",0.1023,132.9,241.2,53.4,19.898,0.21,0,70000,0,11.1562648066437,0,"Unknow"
"SOAD13368","Flumevale","Yes","Water Supply","Earth",15.571,0.322,83000,"1962","",0.31914,5.32658,"","31/08/2021","0.5",NA,"Low","Satisfactory","2017-09-01",0.0696,326.9,15.4,61.5,15.571,0.322,0,83000,0,11.3266079348989,0,"Unknow"
"SOAD02511","Flumevale","Yes","Flood Risk Reduction","Earth",14.294,0.796,NA,"1959","",0.26398,29.29619,"","15/10/2020","3",5.04,"Low","Not Rated",NA,0.0868,707.6,214,NA,14.294,0.796,0,NA,1,NA,0,"Unknow"
"SOAD08876","Flumevale","Yes","Irrigation","Earth",6.431,0.6,1100,"1920","",0.30535,0,"","22/04/2021","6",4.81,"Low","Fair","2020-06-30",0.0659,141.1,891.9,23.1,6.431,0.6,0,1100,0,7.00397413672268,0,"Unknow"
"SOAD16257","Flumevale","Yes","Irrigation","Earth",12.227,0.085,12335,"1952","",0.20488,7.98987,"Uncontrolled","31/07/2017","6",31.04,"Low","Satisfactory","2006-10-13",0.0476,20.6,184.6,26.5,12.227,0.085,0,12335,0,9.42027709580311,0,"Unknow"
"SOAD05045","Flumevale","Yes","Water Supply","Earth",20.539,0.693,195000,"1995","",0.197,0,"Uncontrolled","03/05/2022","1",4.91,"High","Satisfactory","2022-05-03",0.0708,43.3,691.9,5.8,20.539,0.693,0,195000,0,12.1807599657379,0,"Unknow"
"SOAD04959","Flumevale","Yes","Irrigation","Earth",13.23,0.237,50431,"1970","",0.16745,15.97974,"Uncontrolled","24/03/2022","1",0,"High","Satisfactory","2022-03-24",0.1075,7.1,276.9,4.4,13.23,0.237,0,50431,0,10.8283811732176,0,"Unknow"
"SOAD16002","Flumevale","Yes","Flood Risk Reduction","Earth",23.985,0.5,196931,"1928","",2.92939,23.96961,"","16/11/2021","1",0.47,"High","Satisfactory","2017-09-01",0.1077,828,829.5,NA,23.985,0.5,0,196931,0,12.1906137704676,0,"Unknow"
"SOAD03374","Flumevale","Yes","Water Supply","Earth",7.28,0.217,7167,"1949","",0.46492,7.98987,"","26/08/2020","6",24.3,"Low","Fair","2018-08-23",0.0521,401.8,186.6,52.2,7.28,0.217,0,7167,0,8.87738195465477,0,"Unknow"
"SOAD09631","Flumevale","Yes","Irrigation","Earth",6.457,1.652,NA,"2018","",0.33884,0,"Uncontrolled","22/06/2022","1",NA,"High","Satisfactory","2022-06-22",0.0902,683.4,742,47.4,6.457,1.652,0,NA,1,NA,0,"Unknow"
"SOAD07260","Flumevale","Yes","Recreation","Earth",15.311,0.284,79029,"1979","",0.3743,0,"","20/10/2022","2",103.96,"Significant","Fair","2022-10-20",0.1368,523.4,228.1,8.5,15.311,0.284,0,79029,0,11.277582806199,0,"Unknow"
"SOAD12573","Flumevale","Yes","Water Supply","Earth",7.26,0.15,7910,"1923","",1.03622,101.20502,"","25/05/2022","0.5",5.53,"Low","Satisfactory","2017-09-01",0.0662,587.6,271.9,5.9,7.26,0.15,0,7910,0,8.9760094750214,0,"Unknow"
"SOAD05947","Flumevale","Yes","Water Supply","Earth",18.659,0.767,3e+05,"1988","",0.20882,0,"","22/04/2022","1",1.69,"High","Satisfactory","2017-09-01",0.0993,13,589.5,10.5,18.659,0.767,0,3e+05,0,12.6115410869661,0,"Unknow"
"SOAD17469","Flumevale","Yes","Flood Risk Reduction","Earth",13.251,1.033,197000,"1994","",0.31914,53.2658,"","10/03/2022","1",0,"High","Satisfactory","2017-09-01",0.0698,305.6,397.7,NA,13.251,1.033,0,197000,0,12.1909640838494,0,"Unknow"
"SOAD01970","Flumevale","Yes","Irrigation","Earth",10.412,0.09,NA,"1928","",0.27974,74.57212,"Uncontrolled","21/09/2021","2",48.66,"Significant","Fair","2021-09-21",0.1256,482.3,76.2,20.9,10.412,0.09,0,NA,1,NA,0,"Unknow"
"SOAD07491","Flumevale","Yes","Irrigation","Earth",9.692,0.407,NA,"1942","1998;1998S",0.40188,114.52147,"","01/07/2005","4",3.33,"Significant","Not Available",NA,0.1555,152.6,923.7,41.6,9.692,0.407,0,NA,1,NA,2,"1998"
"SOAD02171","Flumevale","Yes","Water Supply","Earth",10.103,0.36,40000,"1918","",0.44128,37.28606,"","22/06/2022","1",NA,"Significant","Satisfactory","2017-09-01",0.118,642.1,125.3,43.1,10.103,0.36,0,40000,0,10.5966597327836,0,"Unknow"
"SOAD12216","Flumevale","No","Fish and Wildlife Pond","Earth",4.673,0,0,"1911","",NA,0,"","06/07/2023","Unknow",NA,"Significant","Not Available",NA,0.1511,299.9,89.9,NA,4.673,NA,1,NA,1,NA,0,"Unknow"
"SOAD14179","Flumevale","Yes","Irrigation","Earth",13.406,0.208,84126,"1959","",0.1379,13.31645,"","20/08/2021","6",22.35,"Low","Satisfactory","2021-04-22",0.0433,5,217.4,40,13.406,0.208,0,84126,0,11.34008284081,0,"Unknow"
"SOAD07737","Flumevale","Yes","Water Supply","Earth",34.222,0.317,450000,"1996","",0.10835,0,"Uncontrolled","19/05/2022","1",9.44,"High","Satisfactory","2022-05-19",0.1033,10.4,413.8,31.5,34.222,0.317,0,450000,0,13.0170050839663,0,"Unknow"
"SOAD12846","Flumevale","Yes","Irrigation","Earth",8.195,0.321,NA,"1947","",0.44325,114.52147,"","15/10/2010","6",25.34,"Low","Satisfactory","2021-05-25",0.0321,57.4,239.3,13.3,8.195,0.321,0,NA,1,NA,0,"Unknow"
"SOAD12938","Flumevale","Yes","Irrigation","Earth",12.286,0.1,NA,"1894","",0.19109,7.98987,"Uncontrolled","13/10/2022","1",3.11,"High","Fair","2022-10-13",0.1251,15.2,115.2,22.6,12.286,0.1,0,NA,1,NA,0,"Unknow"
"SOAD00639","Flumevale","Yes","Flood Risk Reduction","Earth",13.632,0.609,NA,"1973","",0.38415,21.30632,"Uncontrolled","07/10/2021","3",4.7,"Significant","Satisfactory","2021-10-07",0.1185,39.3,601.2,NA,13.632,0.609,0,NA,1,NA,0,"Unknow"
"SOAD15796","Flumevale","Yes","Water Supply","Earth",18.382,0.235,63900,"1957","",0.2167,135.82779,"","28/06/2022","0.5",NA,"Low","Satisfactory","2017-09-01",0.0802,44.2,9.9,60.4,18.382,0.235,0,63900,0,11.0650902896954,0,"Unknow"
"SOAD15643","Flumevale","Yes","Recreation","Earth",13.962,0.145,33067,"1969","",0.31126,21.30632,"Uncontrolled","23/07/2019","6",61.61,"Low","Not Rated",NA,0.0759,100.8,72.4,5.9,13.962,0.145,0,33067,0,10.4063213263726,0,"Unknow"
"SOAD20183","Flumevale","Yes","Other","Earth",20.324,0.24,130000,"1930","",0.2364,197.08346,"","19/01/2023","1",0,"High","Fair","2019-08-30",0.1011,33,288.1,NA,20.324,0.24,0,130000,0,11.7752974217158,0,"Unknow"
"SOAD04451","Flumevale","Yes","Irrigation","Earth",6.743,0.23,14930,"1900","1990",0.51614,0,"Uncontrolled","29/07/2022","1",15.7,"High","Fair","2022-07-29",0.1078,480.6,287.4,12.3,6.743,0.23,0,14930,0,9.61119486752666,1,"1990"
"SOAD17796","Flumevale","Yes","Water Supply","Earth",20.645,0.172,49500,"1967","",0.27777,34.62277,"","05/04/2022","1",18.42,"High","Satisfactory","2017-09-01",0.1077,169.1,270.9,39.3,20.645,0.172,0,49500,0,10.8097481503729,0,"Unknow"
"SOAD11411","Flumevale","Yes","Water Supply","Earth",7.72,0.392,36700,"1900","",0.67965,135.82779,"","29/06/2022","0.5",NA,"Low","Satisfactory","2017-09-01",0.0754,498.2,5.1,32.5,7.72,0.392,0,36700,0,10.5105592816278,0,"Unknow"
"SOAD16902","Flumevale","Yes","Irrigation","Earth",2.75,0.15,3437,"1944","",0.3546,0,"Uncontrolled","14/05/2021","6",20.13,"Low","Not Rated",NA,0.1046,626.7,406.6,42.2,2.75,0.15,0,3437,0,8.1426451859428,0,"Unknow"
"SOAD11798","Flumevale","Yes","Water Supply","Earth",14.172,0.513,43705,"1972","",0.34081,2.66329,"","28/01/2022","1",3.22,"High","Satisfactory","2017-09-01",0.0759,237.5,505.5,10.7,14.172,0.513,0,43705,0,10.6852406714301,0,"Unknow"
"SOAD11854","Flumevale","Yes","Flood Risk Reduction","Earth",12.803,0.357,NA,"1964","",0.39203,15.97974,"Uncontrolled","10/05/2022","3",3.28,"Significant","Satisfactory","2022-05-10",0.1326,401.7,250.9,NA,12.803,0.357,0,NA,1,NA,0,"Unknow"
"SOAD07269","Flumevale","Yes","Water Supply","Earth",4.047,0.103,0,"Unknow","",0.73481,45.27593,"","18/11/2021","0.5",NA,"Low","Satisfactory","2017-09-01",0.0635,344.2,13.2,44.8,4.047,0.103,0,NA,1,NA,0,"Unknow"
"SOAD09588","Flumevale","No","Fire Protection, Stock, Or Small Fish Pond","Earth",3.504,0.412,NA,"1980","",NA,34.62277,"Controlled","31/08/2010","10",NA,"Low","Not Rated",NA,0.0461,11,23.5,NA,3.504,0.412,0,NA,1,NA,0,"Unknow"
"SOAD00714","Flumevale","Yes","Recreation","Earth",13.748,0.433,NA,"1952","",0.27974,47.93922,"","11/10/2017","6",10.89,"Low","Satisfactory","2022-07-11",0.0442,320.1,100.7,3.8,13.748,0.433,0,NA,1,NA,0,"Unknow"
"SOAD06335","Flumevale","Yes","Irrigation","Earth",9.432,0.363,NA,"1903","",0.394,0,"Controlled","20/04/2022","2",16.57,"Significant","Not Rated",NA,0.1474,305.5,372.1,23.6,9.432,0.363,0,NA,1,NA,0,"Unknow"
"SOAD19452","Flumevale","Yes","Fish and Wildlife Pond","Earth",10.355,1.333,785,"1964","",0.38218,0,"","05/11/2020","6",1.58,"Low","Satisfactory","2018-10-05",0.0514,673.4,187,NA,10.355,1.333,0,785,0,6.66695679242921,0,"Unknow"
"SOAD02194","Flumevale","Yes","Water Supply","Earth",6.837,0.5,61460,"1969","",0.4728,0,"","19/07/2021","6",24.88,"Low","Satisfactory","2017-06-26",0.0475,583.5,101.3,44.9,6.837,0.5,0,61460,0,11.0261581062973,0,"Unknow"
"SOAD05739","Flumevale","Yes","Water Supply","Earth",25.849,0.117,57000,"1928","",0.17927,29.29619,"","16/06/2022","1",10.12,"Significant","Satisfactory","2017-09-01",0.1247,13.1,163.6,12.8,25.849,0.117,0,57000,0,10.9508240905224,0,"Unknow"
"SOAD16541","Flumevale","Yes","Flood Risk Reduction","Earth",11.729,0.333,60990,"1965","",0.3152,74.57212,"","11/04/2018","3",37.94,"Low","Not Rated",NA,0.1068,187.8,157.1,NA,11.729,0.333,0,60990,0,11.0184815912866,0,"Unknow"
"SOAD16699","Flumevale","Yes","Irrigation","Earth",4.744,0.433,40750,"1949","",0.3743,0,"","23/07/1980","6",16.67,"Low","Not Rated",NA,0.0473,362.7,301.1,30.1,4.744,0.433,0,40750,0,10.6152356582452,0,"Unknow"
"SOAD17842","Flumevale","Yes","Irrigation","Earth",14.256,0.193,58000,"1912","1953",0.16154,0,"Uncontrolled","29/08/2022","1",12.28,"High","Fair","2022-08-29",0.1264,6.2,165.2,35.5,14.256,0.193,0,58000,0,10.9682155307592,1,"1953"
"SOAD19949","Flumevale","Yes","Other","Earth",20.537,0.281,145000,"1949","",0.23837,NA,"","13/06/2022","1",NA,"High","Satisfactory","2017-09-01",0.11,37.5,620.8,NA,20.537,0.281,0,145000,0,11.8844959179307,0,"Unknow"
"SOAD20059","Flumevale","Yes","Fish and Wildlife Pond","Earth",6.422,0.1,NA,"1879","",0.2955,0,"Uncontrolled","08/10/2021","2",35.22,"Significant","Satisfactory","2021-10-08",0.1259,667.1,108.9,NA,6.422,0.1,0,NA,1,NA,0,"Unknow"
"SOAD16103","Flumevale","Yes","Irrigation","Earth",3.19,NA,NA,"2016","",0.32899,NA,"","","0",NA,"Low","Not Rated",NA,0.0646,495.7,16.7,18.9,3.19,NA,1,NA,1,NA,0,"Unknow"
"SOAD13305","Flumevale","Yes","Irrigation","Earth",9.592,0.085,15603,"1953","",0.29156,15.97974,"Uncontrolled","24/06/2022","1",13.76,"High","Fair","2022-06-24",0.1202,230.4,182.5,11.7,9.592,0.085,0,15603,0,9.65528257062655,0,"Unknow"
"SOAD15925","Flumevale","Yes","Water Supply","Earth",18.098,0.4,206500,"1980","",0.15957,0,"","26/10/2021","1",0.16,"High","Satisfactory","2017-09-01",0.0875,9.9,449.3,50.9,18.098,0.4,0,206500,0,12.2380605339865,0,"Unknow"
"SOAD17166","Flumevale","Yes","Water Supply","Earth",35.464,0.173,8243,"1924","",0.13199,42.61264,"Uncontrolled","19/07/2022","1",23.38,"High","Satisfactory","2022-07-19",0.0918,22.3,223.9,36.6,35.464,0.173,0,8243,0,9.01724094201035,0,"Unknow"
"SOAD13186","Flumevale","Yes","Irrigation","Earth",20.238,0.083,33500,"1956","",0.25413,175.77714,"","02/08/2022","6",18.79,"Low","Satisfactory","2021-11-12",0.0351,313.4,168.7,12.1,20.238,0.083,0,33500,0,10.4193305681139,0,"Unknow"
"SOAD11660","Flumevale","Yes","Water Supply","Earth",4.515,0.347,10700,"1941","",1.15048,7.98987,"","16/06/2022","0.5",NA,"Low","Satisfactory","2017-09-01",0.0774,77.9,8.1,41.4,4.515,0.347,0,10700,0,9.278092474027,0,"Unknow"
"SOAD05742","Flumevale","Yes","Fire Protection, Stock, Or Small Fish Pond","Earth",7.672,0.22,30759,"1914","",0.52205,793.66042,"Uncontrolled","12/06/2023","1",6.26,"High","Unsatisfactory","2023-07-07",0.1386,295.8,255,NA,7.672,0.22,0,30759,0,10.3339704236196,0,"Unknow"
"SOAD08175","Flumevale","Yes","Water Supply","Earth",23.234,1.275,508000,"1959","",0.18124,0,"","20/01/2022","1",NA,"High","Satisfactory","2017-09-01",0.0782,38.4,540.4,21.9,23.234,1.275,0,508000,0,13.1382386950626,0,"Unknow"
"SOAD11871","Flumevale","Yes","Recreation","Earth",22.233,0.25,NA,"1973","",0.28171,0,"Uncontrolled","06/04/2022","1",0,"High","Satisfactory","2022-04-06",0.0919,201.7,247.1,5.6,22.233,0.25,0,NA,1,NA,0,"Unknow"
"SOAD18421","Flumevale","Yes","Irrigation","Earth",5.703,0.333,28733,"1973","2001H;2001S",0.36642,0,"Uncontrolled","02/09/2021","2",1.64,"Significant","Satisfactory","2021-09-02",0.0999,50.1,122,29.1,5.703,0.333,0,28733,0,10.2658363695707,2,"2001"
"SOAD18457","Flumevale","Yes","Recreation","Earth",6.938,0.467,35557,"1909","",0.43537,0,"Uncontrolled","22/06/2022","2",1.54,"Significant","Satisfactory","2022-06-22",0.1334,658,314.2,5.8,6.938,0.467,0,35557,0,10.4789204450765,0,"Unknow"
"SOAD09682","Flumevale","Yes","Irrigation","Earth",5.145,0.17,NA,"1923","",0.38809,0,"Uncontrolled","18/08/2020","2",16.77,"Significant","Fair","2020-08-18",0.1305,496,215.7,36.8,5.145,0.17,0,NA,1,NA,0,"Unknow"
"SOAD01711","Flumevale","Yes","Irrigation","Earth",12.315,0.2,23360,"1899","1960H;1960M;1960S;1975S;1989H;1989M;1989S",0.34672,0,"Uncontrolled","21/10/2021","1",13.5,"High","Fair","2021-10-21",0.0984,198.7,231.5,12.1,12.315,0.2,0,23360,0,10.0588232442451,7,"1989"
"SOAD04217","Flumevale","Yes","Water Supply","Earth",4.387,0.033,2033,"1903","",0.41764,0,"","20/08/2015","6",4.99,"Low","Not Rated",NA,0.1001,295,443.8,28.3,4.387,0.033,0,2033,0,7.61775957660851,0,"Unknow"
"SOAD11851","Flumevale","Yes","Fire Protection, Stock, Or Small Fish Pond","Earth",3.467,0.43,NA,"1904","",0.76239,0,"","25/09/2017","6",33.13,"Low","Not Rated",NA,0.073,260.1,138.5,NA,3.467,0.43,0,NA,1,NA,0,"Unknow"
"SOAD13273","Flumevale","Yes","Irrigation","Earth",8.961,0.457,NA,"1907","",0.30141,0,"Uncontrolled","08/10/2021","2",18.73,"Significant","Fair","2021-10-08",0.1403,687.3,424.9,1.1,8.961,0.457,0,NA,1,NA,0,"Unknow"
"SOAD05868","Flumevale","Yes","Water Supply","Earth",7.058,0.16,17865,"1942","1997H;2000S",0.45901,7.98987,"Uncontrolled","04/08/2022","1",14.18,"High","Satisfactory","2022-08-04",0.1021,636.6,227.4,55.2,7.058,0.16,0,17865,0,9.79065474426178,2,"2000"
"SOAD04450","Flumevale","Yes","Fish and Wildlife Pond","Earth",4.943,0.13,3650,"1888","",0.34869,0,"Uncontrolled","10/09/2021","2",46.48,"Significant","Satisfactory","2021-09-10",0.1415,60.8,196.2,NA,4.943,0.13,0,3650,0,8.20275638165564,0,"Unknow"
"SOAD14540","Flumevale","No","Irrigation","Earth",3.099,0.323,NA,"1980","",NA,66.58225,"Controlled","31/08/2010","10",NA,"Low","Not Rated",NA,0.0582,16.4,6.2,44.5,3.099,0.323,0,NA,1,NA,0,"Unknow"
"SOAD13783","Flumevale","Yes","Water Supply","Earth",59.24,0.267,479500,"1963","",0.12017,0,"","07/01/2022","1",2.41,"High","Satisfactory","2017-09-01",0.1001,35.4,176.4,42.8,59.24,0.267,0,479500,0,13.0805012588092,0,"Unknow"
"SOAD03730","Flumevale","Yes","Fish and Wildlife Pond","Earth",5.124,0.125,NA,"1940","",0.51811,151.80753,"Uncontrolled","07/06/2022","2",61.88,"Significant","Fair","2022-06-07",0.1586,81.7,97.6,NA,5.124,0.125,0,NA,1,NA,0,"Unknow"
"SOAD19194","Flumevale","Yes","Water Supply","Earth",13.219,0.12,21357,"1955","",0.27186,7.98987,"","24/07/2015","6",80.06,"Low","Fair","2007-06-14",0.0401,212.9,97.7,59.5,13.219,0.12,0,21357,0,9.96918165573149,0,"Unknow"
"SOAD05436","Flumevale","Yes","Flood Risk Reduction","Earth",5.056,0.467,NA,"1942","1973;1973S",0.73284,66.58225,"","01/07/1983","4",5.23,"Significant","Not Available",NA,0.1061,229.8,432.1,NA,5.056,0.467,0,NA,1,NA,2,"1973"
"SOAD12834","Flumevale","Yes","Fish and Wildlife Pond","Earth",12.073,0.083,NA,"1907","",0.33884,42.61264,"Uncontrolled","01/09/2022","1",12.9,"High","Satisfactory","2022-09-01",0.076,202.3,396.6,NA,12.073,0.083,0,NA,1,NA,0,"Unknow"
"SOAD06408","Flumevale","No","Fire Protection, Stock, Or Small Fish Pond","Earth",2.831,0.023,400,"1960","",NA,NA,"Controlled","01/08/2011","10",NA,"Low","Not Rated",NA,0.0287,22.6,21.7,NA,2.831,0.023,0,400,0,5.99396142730657,0,"Unknow"
"SOAD18231","Flumevale","Yes","Water Supply","Earth",32.302,1.167,496111,"1983","",0.13987,0,"","09/06/2022","1",0,"High","Satisfactory","2017-09-01",0.0847,17.3,501.1,37.5,32.302,1.167,0,496111,0,13.1145569866682,0,"Unknow"
"SOAD09371","Flumevale","Yes","Irrigation","Earth",16.884,0.257,90942,"1950","2016",0.27186,0,"","06/10/2022","1",13.4,"High","Fair","2022-10-06",0.1137,201.3,308,33.1,16.884,0.257,0,90942,0,11.4179882156187,1,"2016"
"SOAD17532","Flumevale","Yes","Water Supply","Earth",43.599,0.154,224887,"1985","",0.14775,2.66329,"","29/04/2022","1",0,"High","Satisfactory","2017-09-01",0.0991,8.1,295.7,62.7,43.599,0.154,0,224887,0,12.3233577794763,0,"Unknow"
"SOAD14460","Flumevale","Yes","Irrigation","Earth",11.929,0.333,NA,"1909","",0.33293,13.31645,"","14/11/1991","0",115.61,"Low","Satisfactory","2019-09-24",0.0723,341.5,60.2,15,11.929,0.333,0,NA,1,NA,0,"Unknow"
"SOAD19683","Flumevale","Yes","Water Supply","Earth",25.497,0.322,239184,"1938","",0.19503,0,"","09/09/2022","1",0.16,"High","Satisfactory","2017-09-01",0.0758,12,594.3,53,25.497,0.322,0,239184,0,12.3849925900622,0,"Unknow"
"SOAD03213","Flumevale","Yes","Water Supply","Earth",12.769,0.13,12000,"1926","",0.24034,7.98987,"","02/06/2022","0.5",NA,"Low","Satisfactory","2017-09-01",0.0655,26.4,4.9,28.5,12.769,0.13,0,12000,0,9.39274525863144,0,"Unknow"
"SOAD05491","Flumevale","Yes","Recreation","Earth",15.786,0.188,35949,"1974","",0.2167,101.20502,"Uncontrolled","29/04/2022","2",17.2,"Significant","Fair","2022-04-29",0.1292,18.3,400.5,6.9,15.786,0.188,0,35949,0,10.4898843631492,0,"Unknow"
"SOAD04105","Flumevale","Yes","Fish and Wildlife Pond","Earth",8.136,0.075,58388,"1879","",0.27383,0,"Uncontrolled","08/10/2021","2",33.58,"Significant","Satisfactory","2021-10-08",0.1342,542.6,170.3,NA,8.136,0.075,0,58388,0,10.9748827949107,0,"Unknow"
"SOAD07436","Flumevale","Yes","Water Supply","Earth",18.356,0.117,39500,"1948","",0.34672,2.66329,"","05/01/2022","0.5",NA,"Low","Satisfactory","2017-09-01",0.0698,499.4,7.5,64.1,18.356,0.117,0,39500,0,10.5840812670245,0,"Unknow"
"SOAD15812","Flumevale","Yes","Fish and Wildlife Pond","Earth",3.123,0.056,NA,"1879","",0.2955,0,"Uncontrolled","24/09/2013","2",34.11,"Significant","Satisfactory","2013-09-24",0.1341,265.4,176.5,NA,3.123,0.056,0,NA,1,NA,0,"Unknow"
"SOAD02496","Flumevale","Yes","Irrigation","Earth",11.276,0.21,52713,"1911","",0.32308,7.98987,"Uncontrolled","19/09/2018","6",6.42,"Low","Fair","2021-06-03",0.0491,49.7,147.9,13.6,11.276,0.21,0,52713,0,10.8726363538985,0,"Unknow"
"SOAD14341","Flumevale","Yes","Water Supply","Earth",14.057,0.417,1e+05,"2004","",0.17533,0,"Uncontrolled","03/05/2022","1",3.11,"High","Satisfactory","2022-05-03",0.0988,10.4,299.5,47.1,14.057,0.417,0,1e+05,0,11.5129354649202,0,"Unknow"
"SOAD12876","Flumevale","Yes","Flood Risk Reduction","Earth",10.542,0.611,NA,"1965","",0.41961,15.97974,"Uncontrolled","10/05/2022","3",3.15,"Significant","Satisfactory","2022-05-10",0.1441,165.2,307.9,NA,10.542,0.611,0,NA,1,NA,0,"Unknow"
"SOAD12227","Flumevale","No","Flood Risk Reduction","Earth",12.789,1.55,0,"1968","",0,0,"Controlled","","6",0,"Low","Not Available",NA,0.0518,22.3,749.1,NA,12.789,1.55,0,NA,1,NA,0,"Unknow"
"SOAD13540","Flumevale","Yes","Flood Risk Reduction","Earth",12.969,0.452,17830,"1957","",0.33687,50.60251,"Uncontrolled","05/09/2013","3",9.49,"Low","Not Rated",NA,0.0966,205.6,379.3,NA,12.969,0.452,0,17830,0,9.78869379453405,0,"Unknow"
"SOAD05294","Flumevale","Yes","Recreation","Earth",10.801,0.23,NA,"1954","2005",0.42749,0,"Uncontrolled","09/04/2021","2",0,"Significant","Satisfactory","2021-04-09",0.1237,592.5,197.3,5.2,10.801,0.23,0,NA,1,NA,1,"2005"
"SOAD17228","Flumevale","Yes","Recreation","Earth",3.418,0.483,NA,"1889","",0.58115,50.60251,"","02/07/2020","6",76.94,"Low","Not Rated",NA,0.0512,562.4,101.3,8.3,3.418,0.483,0,NA,1,NA,0,"Unknow"
"SOAD02358","Flumevale","No","Fire Protection, Stock, Or Small Fish Pond","Earth",2.532,0.183,NA,"1931","",NA,NA,"Uncontrolled","01/08/2011","10",NA,"Low","Not Rated",NA,0.0419,21.8,14.4,NA,2.532,0.183,0,NA,1,NA,0,"Unknow"
"SOAD10644","Flumevale","Yes","Water Supply","Earth",15.747,0.183,28500,"1959","",0.51023,37.28606,"","21/04/2022","0.5",16.07,"Low","Satisfactory","2017-09-01",0.067,317,338.6,21.6,15.747,0.183,0,28500,0,10.2576944533605,0,"Unknow"
"SOAD09017","Flumevale","Yes","Water Supply","Earth",24.598,0.133,17837,"1939","1993F;1993H;1993M;1993O;1993S;2008",0.23837,7.98987,"Uncontrolled","16/06/2022","1",11.78,"High","Satisfactory","2022-06-16",0.1017,42.5,360,8.5,24.598,0.133,0,17837,0,9.78908629222615,6,"2008"
"SOAD10657","Flumevale","Yes","Irrigation","Earth",26.883,0.141,96554,"1889","",0.15957,37.28606,"","25/05/2021","1",10.93,"High","Fair","2021-05-25",0.1252,20.6,197.3,20.1,26.883,0.141,0,96554,0,11.4778680731548,0,"Unknow"
"SOAD13913","Flumevale","Yes","Water Supply","Earth",30.347,0.107,83000,"1907","",0.19897,15.97974,"","15/09/2022","1",1.66,"High","Satisfactory","2017-09-01",0.1029,6.4,160,19.4,30.347,0.107,0,83000,0,11.3266079348989,0,"Unknow"
"SOAD05898","Flumevale","Yes","Water Supply","Earth",7.568,0.207,7136,"1906","",1.00273,7.98987,"","06/05/2022","1",6.23,"High","Satisfactory","2017-09-01",0.093,41.5,396.4,12.6,7.568,0.207,0,7136,0,8.87304779897107,0,"Unknow"
"SOAD15387","Flumevale","Yes","Irrigation","Earth",11.024,0.365,28302,"1901","2010",0.28171,7.98987,"Uncontrolled","26/07/2022","1",14.46,"High","Fair","2022-07-26",0.1232,122.1,470.9,10.6,11.024,0.365,0,28302,0,10.2507230850801,1,"2010"
"SOAD01577","Flumevale","Yes","Irrigation","Earth",7.081,0.332,34841,"1920","",0.51811,21751.08943,"Controlled","26/03/2018","5",0,"High","Not Rated",NA,0.0748,188.1,847.7,16.7,7.081,0.332,0,34841,0,10.4585788346001,0,"Unknow"
"SOAD04198","Flumevale","No","Fire Protection, Stock, Or Small Fish Pond","Earth",3.119,0.763,NA,"1974","",NA,NA,"Uncontrolled","15/07/2010","10",NA,"Low","Not Rated",NA,0.0339,19.3,11.6,NA,3.119,0.763,0,NA,1,NA,0,"Unknow"
"SOAD13982","Flumevale","Yes","Recreation","Earth",4.704,0.067,6448,"1958","",0.90029,7.98987,"Uncontrolled","11/10/2018","6",1.67,"Low","Fair","2015-08-27",0.051,65,314.6,3.6,4.704,0.067,0,6448,0,8.77168035901038,0,"Unknow"
"SOAD17673","Flumevale","Yes","Irrigation","Earth",8.755,0.478,88768,"1911","",0.28368,482.05549,"Uncontrolled","14/04/2016","6",6.42,"Low","Fair","2015-07-30",0.059,408.1,230.3,35.1,8.755,0.478,0,88768,0,11.3937927689319,0,"Unknow"
"SOAD15192","Flumevale","Yes","Irrigation","Earth",21.213,0.338,49272,"1950","",0.26792,0,"Uncontrolled","07/10/2022","1",11.1,"High","Fair","2022-10-07",0.1098,273.9,261.4,12.5,21.213,0.338,0,49272,0,10.8051315426634,0,"Unknow"
"SOAD15350","Flumevale","No","Irrigation","Earth",46.426,0.08,328000,"1952","",0.13987,7.98987,"Uncontrolled","27/08/2020","1",3.17,"High","Not Available",NA,0.1363,44.8,305.8,10.7,46.426,0.08,0,328000,0,12.7007719361421,0,"Unknow"
"SOAD16374","Flumevale","Yes","Irrigation","Earth",9.032,0.165,NA,"1906","",0.24428,0,"Uncontrolled","18/07/2017","6",24.94,"Low","Not Rated",NA,0.0361,146.7,207.5,37.3,9.032,0.165,0,NA,1,NA,0,"Unknow"
"SOAD04446","Flumevale","Yes","Water Supply","Earth",19.31,0.207,72551,"1947","",0.3546,79.8987,"Uncontrolled","11/08/2021","1",37.31,"High","Fair","2021-08-11",0.1217,387.3,178.8,58.6,19.31,0.207,0,72551,0,11.1920588251274,0,"Unknow"
"SOAD14944","Flumevale","Yes","Irrigation","Earth",16.533,0.438,NA,"1961","",0.26004,0,"","11/10/2011","6",14.67,"Low","Not Rated",NA,0.1006,701.6,290.3,11.2,16.533,0.438,0,NA,1,NA,0,"Unknow"
"SOAD10938","Flumevale","Yes","Water Supply","Earth",17.051,0.297,110000,"1980","",0.26201,2.66329,"","17/02/2022","1",1.13,"High","Satisfactory","2017-09-01",0.0965,391.8,161.1,45.8,17.051,0.297,0,110000,0,11.6082447356423,0,"Unknow"
"SOAD16325","Flumevale","Yes","Irrigation","Earth",18.678,0.127,89448,"1959","",0.2955,7.98987,"","14/06/2022","6",20.5,"Low","Satisfactory","2014-01-14",0.0443,29.1,161.8,4.2,18.678,0.127,0,89448,0,11.4014239094445,0,"Unknow"
"SOAD14350","Flumevale","Yes","Irrigation","Earth",13.133,0.272,25600,"1956","",0.35854,21.30632,"","25/08/2022","1",17.07,"High","Fair","2022-08-25",0.1075,44.1,97.2,31,13.133,0.272,0,25600,0,10.1503866922047,0,"Unknow"
"SOAD02532","Flumevale","Yes","Irrigation","Earth",10.469,0.2,60000,"1939","",0.46689,7.98987,"Uncontrolled","04/11/2014","6",10.88,"Low","Satisfactory","2022-10-06",0.0403,350.8,362.1,47,10.469,0.2,0,60000,0,11.002116507732,0,"Unknow"
"SOAD08674","Flumevale","Yes","Irrigation","Earth",20.115,0.305,NA,"1965","2003H",0.26792,13.31645,"Uncontrolled","27/09/2022","2",32.71,"Significant","Fair","2022-09-27",0.1335,66.1,140.5,7.2,20.115,0.305,0,NA,1,NA,1,"2003"
"SOAD17192","Flumevale","Yes","Flood Risk Reduction","Earth",13.927,0.479,NA,"2015","",0.27974,53.2658,"Uncontrolled","20/04/2021","3",3.27,"High","Fair","2021-04-20",0.0908,286.6,604.2,NA,13.927,0.479,0,NA,1,NA,0,"Unknow"
"SOAD18717","Flumevale","Yes","Water Supply","Earth",20.873,0.142,35,"1929","",0.17139,85.22528,"Uncontrolled","23/08/2018","6",13.85,"Low","Not Rated",NA,0.0983,6.7,303.2,54.1,20.873,0.142,0,35,0,3.58351893845611,0,"Unknow"
"SOAD20688","Flumevale","Yes","Hydroelectric","Earth",22.964,1.369,350000,"1913","",0.19897,NA,"Uncontrolled","22/08/2023","1",4.71,"High","Satisfactory","2023-09-29",0.0926,21.6,645.2,92.6,22.964,1.369,0,350000,0,12.7656912906044,0,"Unknow"
"SOAD08490","Flumevale","No","Irrigation","Earth",2.458,0.508,NA,"1977","",NA,26.6329,"Controlled","07/09/2010","10",NA,"Low","Not Rated",NA,0.0684,23.7,22.2,44.8,2.458,0.508,0,NA,1,NA,0,"Unknow"
"SOAD20587","Flumevale","Yes","Recreation","Earth",4.509,0.107,3081,"1906","1976F;1976H;1976O;1976S",0.51614,53.2658,"Uncontrolled","18/10/2022","6",33.24,"Low","Satisfactory","2013-09-23",0.0444,428.1,197.3,7.2,4.509,0.107,0,3081,0,8.03333401588006,4,"1976"
"SOAD07042","Flumevale","Yes","Irrigation","Earth",12.018,0.267,NA,"1893","",0.33884,42.61264,"Uncontrolled","28/10/2021","6",23.23,"Low","Not Rated",NA,0.0831,99.7,388.3,10.1,12.018,0.267,0,NA,1,NA,0,"Unknow"
"SOAD02074","Flumevale","Yes","Flood Risk Reduction","Earth",8.524,0.267,32002,"1906","",0.39006,58.59238,"Uncontrolled","05/10/2010","6",78.5,"Low","Not Rated",NA,0.0497,620.9,225,NA,8.524,0.267,0,32002,0,10.3735849273876,0,"Unknow"
"SOAD05910","Flumevale","Yes","Fish and Wildlife Pond","Earth",4.301,0.445,NA,"1911","",1.00273,111.85818,"Uncontrolled","07/06/2022","2",59.58,"Significant","Fair","2022-06-07",0.1466,416,85.2,NA,4.301,0.445,0,NA,1,NA,0,"Unknow"
"SOAD05644","Flumevale","Yes","Irrigation","Earth",9.01,0.315,58121,"1974","",0.40385,0,"Uncontrolled","29/08/2019","6",8.06,"Low","Not Rated",NA,0.04,268.7,476.6,23.7,9.01,0.315,0,58121,0,10.9702995286544,0,"Unknow"
"SOAD19320","Flumevale","Yes","Water Supply","Earth",21.946,0.177,93433,"1990","",0.27186,18.64303,"","26/10/2021","1",NA,"High","Satisfactory","2017-09-01",0.1049,218.6,661.7,56.7,21.946,0.177,0,93433,0,11.4450105836716,0,"Unknow"
"SOAD09674","Flumevale","Yes","Hydroelectric","Earth",7.752,0.207,2500,"1856","",0.55554,13.31645,"Uncontrolled","07/09/2023","1",NA,"High","Satisfactory","2023-09-29",0.0772,500,687.7,NA,7.752,0.207,0,2500,0,7.82444593087762,0,"Unknow"
"SOAD07933","Flumevale","Yes","Water Supply","Earth",19.026,0.168,25000,"1850","",0.24231,5.32658,"","13/04/2022","0.5",NA,"Low","Satisfactory","2017-09-01",0.0711,8.8,5.7,54.3,19.026,0.168,0,25000,0,10.1266711030504,0,"Unknow"
"SOAD02097","Flumevale","Yes","Water Supply","Earth",9.566,1.153,121000,"1948","",0.38809,0,"","30/06/2022","0.5",NA,"Low","Satisfactory","2017-09-01",0.0636,67.5,12,65.5,9.566,1.153,0,121000,0,11.7035540890075,0,"Unknow"
"SOAD01232","Flumevale","Yes","Irrigation","Earth",12.262,0.233,54660,"1910","1986",0.0925899999999999,37.28606,"Uncontrolled","02/08/2004","6",22.62,"Low","Fair","2009-10-27",0.0489,42.4,138.6,17.9,12.262,0.233,0,54660,0,10.9089057542287,1,"1986"
"SOAD13038","Flumevale","Yes","Flood Risk Reduction","Earth",16.662,1.333,0,"1991","",0.22655,NA,"","24/05/2022","1",1.96,"High","Satisfactory","2017-09-01",0.1053,8,309.7,NA,16.662,1.333,0,NA,1,NA,0,"Unknow"
"SOAD20689","Flumevale","Yes","Irrigation","Earth",3.03,0.117,5104,"1908","",0.13002,0,"Uncontrolled","24/09/1996","6",11.01,"Low","Not Rated",NA,0.061,42.5,172.7,5.7,3.03,0.117,0,5104,0,8.53797573059877,0,"Unknow"
"SOAD06704","Flumevale","Yes","Water Supply","Earth",6.393,0.075,0,"Unknow","",0.40582,NA,"","04/05/2022","0.5",NA,"Low","Satisfactory","2022-08-05",0.0686,56,20.5,45.6,6.393,0.075,0,NA,1,NA,0,"Unknow"
"SOAD06032","Flumevale","Yes","Irrigation","Earth",7.827,0.267,38822,"1887","2009",0.41567,7.98987,"Uncontrolled","13/10/2021","2",38.2,"Significant","Unsatisfactory","2021-10-13",0.1727,257.6,163.4,33.4,7.827,0.267,0,38822,0,10.5667681334898,1,"2009"
"SOAD05442","Flumevale","Yes","Irrigation","Earth",5.67,0.195,16457,"Unknow","1966",0.24034,7.98987,"Uncontrolled","19/07/2019","2",1.67,"Significant","Fair","2019-07-19",0.1388,47.6,389.5,10.7,5.67,0.195,0,16457,0,9.70856696016566,1,"1966"
"SOAD18646","Flumevale","Yes","Debris Control","Earth",14.19,1.2,0,"1964","",0.52599,NA,"","20/04/2022","1",NA,"High","Satisfactory","2017-09-01",0.0945,671.9,920.3,NA,14.19,1.2,0,NA,1,NA,0,"Unknow"
"SOAD03989","Flumevale","Yes","Fish and Wildlife Pond","Earth",8.963,0.08,0,"1906","",0.00788,0,"Uncontrolled","13/06/1989","6",3.35,"Low","Satisfactory","2021-09-09",0.0378,19.4,625.9,NA,8.963,0.08,0,NA,1,NA,0,"Unknow"
"SOAD08141","Flumevale","Yes","Flood Risk Reduction","Earth",7.113,0.7,NA,"2006","",0.00788,415.47324,"Uncontrolled","09/08/2022","3",1.67,"High","Satisfactory","2022-08-09",0.0868,14.8,718,NA,7.113,0.7,0,NA,1,NA,0,"Unknow"
"SOAD18060","Flumevale","Yes","Irrigation","Earth",9.008,0.292,25902,"1893","1952S",0.16942,7.98987,"Uncontrolled","11/08/2022","2",13.97,"Significant","Fair","2022-08-11",0.1324,21,100,19.3,9.008,0.292,0,25902,0,10.1621140710957,1,"1952"
"SOAD18334","Flumevale","Yes","Irrigation","Earth",7.596,0.19,9400,"1901","",0.32505,21.30632,"Uncontrolled","21/07/2021","2",43.6,"Significant","Fair","2021-07-21",0.1486,374.3,232.6,4.1,7.596,0.19,0,9400,0,9.14857134557855,0,"Unknow"
"SOAD13425","Flumevale","Yes","Irrigation","Earth",13.89,0.337,1050,"1952","",0.2758,0,"Uncontrolled","12/07/2022","1",11.83,"High","Fair","2022-07-12",0.1282,287.1,193.8,26.1,13.89,0.337,0,1050,0,6.95749737087695,0,"Unknow"
"SOAD19343","Flumevale","Yes","Irrigation","Earth",10.446,0.443,NA,"1902","",0.34672,0,"Uncontrolled","26/04/2019","6",13.39,"Low","Not Rated",NA,0.0519,336.4,280.9,20,10.446,0.443,0,NA,1,NA,0,"Unknow"
"SOAD00847","Flumevale","Yes","Irrigation","Earth",9.692,0.32,NA,"1902","",0.34869,0,"Uncontrolled","26/04/2019","6",12.7,"Low","Fair","2018-10-05",0.0458,698.8,217.5,44.8,9.692,0.32,0,NA,1,NA,0,"Unknow"
"SOAD12387","Flumevale","Yes","Recreation","Earth",18.001,0.157,NA,"1945","",0.23246,98.54173,"Uncontrolled","29/11/2021","2",24.42,"Significant","Fair","2021-11-29",0.138,29.9,318,5.3,18.001,0.157,0,NA,1,NA,0,"Unknow"
"SOAD06887","Flumevale","Yes","Water Supply","Earth",11.617,0.193,46500,"1946","",0.43537,10.65316,"","23/05/2022","0.5",NA,"Low","Satisfactory","2017-09-01",0.061,198.6,6.9,40.1,11.617,0.193,0,46500,0,10.7472290967206,0,"Unknow"
"SOAD04165","Flumevale","Yes","Flood Risk Reduction","Earth",6.29,0.533,78360,"1975","",1.60358,82.56199,"","06/05/2022","1",2.33,"Significant","Satisfactory","2017-09-01",0.1331,398.7,763,NA,6.29,0.533,0,78360,0,11.2690816335901,0,"Unknow"
"SOAD09632","Flumevale","Yes","Irrigation","Earth",10.06,0.2,NA,"1912","",0.25413,13.31645,"Uncontrolled","13/09/2022","2",50.36,"Significant","Satisfactory","2022-09-13",0.1179,292.3,96,33.7,10.06,0.2,0,NA,1,NA,0,"Unknow"
"SOAD15542","Flumevale","Yes","Flood Risk Reduction","Earth",10.345,0.482,NA,"1959","",0.42552,37.28606,"Uncontrolled","15/10/2020","3",3.09,"Low","Fair","2016-09-22",0.0764,421.8,852.8,NA,10.345,0.482,0,NA,1,NA,0,"Unknow"
"SOAD19565","Flumevale","Yes","Recreation","Earth",17.057,0.09,21273,"1957","",0.1773,103.86831,"Uncontrolled","26/08/2022","2",27.71,"Significant","Not Rated",NA,0.1426,10.8,453.1,4,17.057,0.09,0,21273,0,9.96524094881161,0,"Unknow"
"SOAD13302","Flumevale","Yes","Irrigation","Earth",16.835,0.718,NA,"1971","1971",0.28762,21.30632,"","24/03/2022","2",0,"Significant","Satisfactory","2022-03-24",0.1091,239.8,953.3,12.7,16.835,0.718,0,NA,1,NA,1,"1971"
"SOAD10421","Flumevale","Yes","Irrigation","Earth",9.051,0.627,NA,"1963","",0.50629,7.98987,"Uncontrolled","19/09/2018","6",44.6,"Low","Unsatisfactory","2016-02-19",0.0827,668.4,165.8,27.6,9.051,0.627,0,NA,1,NA,0,"Unknow"
"SOAD06465","Flumevale","No","Other","Earth",6.681,1.4,NA,"Unknow","",NA,NA,"","","Unknow",6.32,"Low","Not Available",NA,0.1215,19.5,135.2,NA,6.681,1.4,0,NA,1,NA,0,"Unknow"
"SOAD09459","Flumevale","Yes","Irrigation","Earth",10.679,0.2,27200,"1906","",0.5319,0,"","22/09/2021","2",26.71,"Significant","Fair","2021-09-22",0.1425,671.5,199,29.6,10.679,0.2,0,27200,0,10.2110090163142,0,"Unknow"
"SOAD19553","Flumevale","Yes","Water Supply","Earth",17.009,0.425,360445,"Unknow","",0.27777,0,"","28/04/2022","1",0,"High","Satisfactory","2020-12-01",0.075,500.6,735.3,7.5,17.009,0.425,0,360445,0,12.7950974325316,0,"Unknow"
"SOAD05421","Flumevale","Yes","Irrigation","Earth",5.713,0.667,57945,"1899","1989",0.43537,0,"Uncontrolled","23/09/2021","2",15.14,"Significant","Satisfactory","2021-09-23",0.1211,94.1,344.1,24.2,5.713,0.667,0,57945,0,10.967266821364,1,"1989"
"SOAD00447","Flumevale","Yes","Recreation","Earth",12.201,0.142,20541,"1947","2002H;2002S",0.3546,93.21515,"Uncontrolled","11/08/2022","1",22.99,"High","Satisfactory","2022-08-11",0.0889,249.3,240.1,4.1,12.201,0.142,0,20541,0,9.93022684972575,2,"2002"
"SOAD19961","Flumevale","Yes","Fire Protection, Stock, Or Small Fish Pond","Earth",8.121,0.467,NA,"1913","",0.97712,111.85818,"","04/12/1992","0",128,"Low","Not Rated",NA,0.0933,677.7,199.7,NA,8.121,0.467,0,NA,1,NA,0,"Unknow"
"SOAD06785","Flumevale","Yes","Fire Protection, Stock, Or Small Fish Pond","Earth",6.58,0.327,24958,"1971","",0.61858,998.73375,"Uncontrolled","09/11/2012","6",41.42,"Low","Not Rated",NA,0.0494,531.8,115.6,NA,6.58,0.327,0,24958,0,10.1249897575782,0,"Unknow"
"SOAD03931","Flumevale","Yes","Water Supply","Earth",13.526,0.108,36870,"1887","1971",0.23443,47.93922,"Uncontrolled","08/05/2017","6",3.23,"Low","Not Rated",NA,0.0598,30.7,675.8,25.5,13.526,0.108,0,36870,0,10.5151806131821,1,"1971"
"SOAD02917","Flumevale","Yes","Other","Earth",9.177,0.152,13300,"1952","",1.02637,98.54173,"","28/04/2022","0.5",NA,"Low","Satisfactory","2017-09-01",0.0792,162.4,20.9,NA,9.177,0.152,0,13300,0,9.4955944993533,0,"Unknow"
"SOAD02360","Flumevale","Yes","Recreation","Earth",13.642,0.089,39248,"1978","",0.27383,42.61264,"Uncontrolled","13/09/2019","6",39.28,"Low","Satisfactory","2020-05-15",0.0489,489,226.6,8.4,13.642,0.089,0,39248,0,10.577681245179,0,"Unknow"
"SOAD04204","Flumevale","Yes","Water Supply","Earth",18.594,0.263,116300,"1973","",0.27974,2.66329,"","09/02/2022","1",NA,"High","Satisfactory","2017-09-01",0.0769,501.4,855.5,42.5,18.594,0.263,0,116300,0,11.6639369369221,0,"Unknow"
"SOAD18433","Flumevale","Yes","Flood Risk Reduction","Earth",10.228,0.15,22810,"1935","",0.5122,13.31645,"","20/01/2022","1",NA,"High","Satisfactory","2017-09-01",0.0993,153.3,948.4,NA,10.228,0.15,0,22810,0,10.0349981547383,0,"Unknow"
"SOAD04578","Flumevale","Yes","Irrigation","Earth",5.114,0.321,4504,"1892","",0.26201,0,"Uncontrolled","01/05/2009","6",26.42,"Low","Fair","2018-09-05",0.0524,458.9,170.6,31.2,5.114,0.321,0,4504,0,8.41294317004244,0,"Unknow"
"SOAD12662","Flumevale","Yes","Flood Risk Reduction","Earth",12.34,0.427,98000,"1962","",0.52993,55.92909,"","08/09/2021","1",NA,"High","Satisfactory","2017-09-01",0.1006,570.1,484.7,NA,12.34,0.427,0,98000,0,11.4927329616823,0,"Unknow"
"SOAD19626","Flumevale","Yes","Irrigation","Earth",9.313,0.158,14060,"1956","",0.39203,0,"Uncontrolled","23/08/2021","2",21.53,"Significant","Fair","2021-08-23",0.1324,148.9,384.7,47.6,9.313,0.158,0,14060,0,9.55116028659082,0,"Unknow"
"SOAD18111","Flumevale","Yes","Irrigation","Earth",11.693,0.227,37280,"1903","1952F;1952H;1952M;1952S;1995M",0.4137,7.98987,"Uncontrolled","24/08/2022","1",16.8,"High","Fair","2022-08-24",0.1127,159.3,186.5,15.8,11.693,0.227,0,37280,0,10.5262390924741,5,"1995"
"SOAD17317","Flumevale","Yes","Irrigation","Earth",4.818,0.325,22470,"1885","",0.55948,0,"Uncontrolled","24/06/2022","2",3.38,"Significant","Satisfactory","2022-06-24",0.1296,477.7,477.4,45.3,4.818,0.325,0,22470,0,10.0199808679719,0,"Unknow"
"SOAD18189","Flumevale","Yes","Water Supply","Earth",21.955,0.243,156000,"1896","",0.21473,0,"","05/04/2023","1",0,"High","Poor","2022-01-05",0.1247,22.6,605.4,11.8,21.955,0.243,0,156000,0,11.9576176964675,0,"Unknow"
"SOAD12389","Flumevale","Yes","Water Supply","Earth",19.532,0.117,37300,"1957","",0.2955,10.65316,"","16/06/2022","0.5",NA,"Low","Satisfactory","2017-09-01",0.0662,192.4,10.5,6.1,19.532,0.117,0,37300,0,10.526775414924,0,"Unknow"
"SOAD19869","Flumevale","Yes","Irrigation","Earth",9.075,0.143,7948,"1951","1980",0.38021,0,"Uncontrolled","05/10/2021","6",36.32,"Low","Satisfactory","2013-09-05",0.0641,371.3,89.1,34.2,9.075,0.143,0,7948,0,8.98080141357311,1,"1980"
"SOAD12989","Flumevale","Yes","Irrigation","Earth",8.012,0.6,19295,"1912","",0.50629,58.59238,"Uncontrolled","02/07/2008","6",8.43,"Low","Not Rated",NA,0.0598,160.5,337.8,24.1,8.012,0.6,0,19295,0,9.86765309952691,0,"Unknow"
"SOAD00765","Flumevale","Yes","Water Supply","Earth",10.411,0.247,50000,"1957","",0.42749,5.32658,"","10/02/2022","1",1.58,"Significant","Satisfactory","2017-09-01",0.1065,687.1,925.5,68.1,10.411,0.247,0,50000,0,10.8197982842103,0,"Unknow"
"SOAD00141","Flumevale","Yes","Irrigation","Earth",4.404,0.517,42484,"1888","",0.42749,0,"Uncontrolled","06/07/2005","0",0,"Low","Not Rated",NA,0.0865,265.5,758.9,33.5,4.404,0.517,0,42484,0,10.6569063514376,0,"Unknow"
"SOAD00229","Flumevale","Yes","Unknow","Earth",11.512,0.35,NA,"Unknow","",0.26792,0,"","","6",4.88,"Low","Not Rated",NA,0.0823,607.2,593.9,NA,11.512,0.35,0,NA,1,NA,0,"Unknow"
"SOAD17505","Flumevale","Yes","Recreation","Earth",4.535,0.323,NA,"1889","",0.78012,55.92909,"","02/07/2020","6",76.19,"Low","Satisfactory","2021-12-03",0.0387,546.9,139.9,5.2,4.535,0.323,0,NA,1,NA,0,"Unknow"
"SOAD11106","Flumevale","Yes","Flood Risk Reduction","Earth",16.163,0.769,94620,"1980","",0.75451,53.2658,"Uncontrolled","09/06/2021","3",8.11,"Low","Satisfactory","2018-07-13",0.0718,74.5,424.9,NA,16.163,0.769,0,94620,0,11.4576347177194,0,"Unknow"
"SOAD13205","Flumevale","Yes","Water Supply","Earth",14.273,0.237,30000,"1957","",0.49447,98.54173,"","18/04/2022","1",NA,"High","Satisfactory","2017-09-01",0.081,388,802.7,46.7,14.273,0.237,0,30000,0,10.3089859934221,0,"Unknow"
"SOAD10444","Flumevale","Yes","Irrigation","Earth",9.361,0.41,81496,"1908","1950;1987",0.3152,0,"Uncontrolled","23/11/2021","1",0,"High","Unsatisfactory","2021-11-23",0.1288,627.8,835.1,20.4,9.361,0.41,0,81496,0,11.3083214887355,2,"1987"
"SOAD04272","Flumevale","Yes","Debris Control","Earth",21.374,0.515,470274,"1936","",0.46689,71.90883,"","03/11/2021","1",0,"High","Satisfactory","2017-09-01",0.0788,143.2,373,NA,21.374,0.515,0,470274,0,13.0610729089612,0,"Unknow"
"SOAD16480","Flumevale","Yes","Irrigation","Earth",8.546,1.584,0,"1892","1902M;1953M;1960S;1995S",0.45113,0,"Uncontrolled","03/03/2022","1",0,"High","Unsatisfactory","2022-03-03",0.1354,309.5,300.7,6,8.546,1.584,0,NA,1,NA,4,"1995"
"SOAD06525","Flumevale","Yes","Irrigation","Earth",7.849,0.171,15094,"1893","1993",0.54175,77.23541,"Uncontrolled","19/10/2021","1",19.95,"High","Satisfactory","2021-10-19",0.0884,341.5,113.1,23.2,7.849,0.171,0,15094,0,9.62211884214094,1,"1993"
"SOAD06250","Flumevale","Yes","Flood Risk Reduction","Earth",15.081,0.467,74200,"1962","",0.36642,82.56199,"","10/04/2018","3",15.16,"Low","Unsatisfactory","2018-04-23",0.1066,697.5,160.5,NA,15.081,0.467,0,74200,0,11.2145329061536,0,"Unknow"
"SOAD02725","Flumevale","Yes","Water Supply","Earth",12.407,0.333,27200,"1943","",0.49447,7.98987,"","10/06/2022","1",34.21,"High","Fair","2022-06-10",0.1063,681.6,115.5,40.3,12.407,0.333,0,27200,0,10.2110090163142,0,"Unknow"
"SOAD12905","Flumevale","Yes","Water Supply","Earth",5.47,1.233,48000,"1947","",0.63631,10.65316,"","07/06/2022","0.5",0,"Low","Satisfactory","2017-09-01",0.0555,527.7,298.2,67.8,5.47,1.233,0,48000,0,10.7789771230064,0,"Unknow"
"SOAD08713","Flumevale","Yes","Recreation","Earth",17.415,0.141,NA,"1974","",0.19503,197.08346,"Uncontrolled","28/05/2021","2",56.96,"Significant","Satisfactory","2021-05-28",0.1098,27.2,71.9,5.7,17.415,0.141,0,NA,1,NA,0,"Unknow"
"SOAD17706","Flumevale","Yes","Irrigation","Earth",8.961,0.2,15724,"1963","",0.40976,0,"","14/05/2020","6",38.31,"Low","Not Rated",NA,0.0778,518.7,218.1,5.5,8.961,0.2,0,15724,0,9.66300708156864,0,"Unknow"
"SOAD16696","Flumevale","Yes","Water Supply","Earth",5.053,0.633,15729,"1909","1990",0.4137,0,"Uncontrolled","22/07/2022","1",8.24,"High","Satisfactory","2022-07-22",0.0827,231.8,291,58.6,5.053,0.633,0,15729,0,9.66332499605232,1,"1990"
"SOAD20141","Flumevale","Yes","Other","Earth",27.824,0.4,146700,"1966","",0.24034,29.29619,"","16/02/2022","1",NA,"High","Satisfactory","2017-09-01",0.0878,21.7,859,NA,27.824,0.4,0,146700,0,11.8961517807404,0,"Unknow"
"SOAD05460","Flumevale","Yes","Hydroelectric","Earth",7.87,0.07,3000,"1870","",0.46492,2.66329,"Uncontrolled","12/08/2019","3",NA,"Low","Satisfactory","2023-09-29",0.0739,200.1,12,NA,7.87,0.07,0,3000,0,8.00670084544037,0,"Unknow"
"SOAD04124","Flumevale","Yes","Water Supply","Earth",8.29,1.567,144882,"1959","",0.93772,5.32658,"","18/05/2022","1",11.63,"High","Satisfactory","2017-09-01",0.0987,566.7,321.9,66.3,8.29,1.567,0,144882,0,11.8836817991347,0,"Unknow"
"SOAD05837","Flumevale","Yes","Recreation","Earth",17.093,0.083,NA,"1956","",0.3546,37.28606,"Uncontrolled","07/06/2022","1",80.26,"High","Unsatisfactory","2022-06-07",0.1351,489.9,209.8,7.1,17.093,0.083,0,NA,1,NA,0,"Unknow"
"SOAD14547","Flumevale","Yes","Irrigation","Earth",7.094,0.343,44084,"1890","",0.45507,0,"","19/07/1990","0",3.27,"Low","Unsatisfactory","2021-06-09",0.1073,179.1,497.5,8,7.094,0.343,0,44084,0,10.6938748675211,0,"Unknow"
"SOAD02177","Flumevale","Yes","Flood Risk Reduction","Earth",10.76,1.1,1050,"1954","",0.30535,63.91896,"Uncontrolled","07/12/2021","3",0,"High","Satisfactory","2021-12-07",0.1027,528.4,368.8,NA,10.76,1.1,0,1050,0,6.95749737087695,0,"Unknow"
"SOAD14397","Flumevale","Yes","Irrigation","Earth",3.555,0.354,19470,"1903","",0.33687,7.98987,"","04/09/2019","6",36.62,"Low","Not Rated",NA,0.0635,285.3,70,8.2,3.555,0.354,0,19470,0,9.87668145811562,0,"Unknow"
"SOAD17738","Flumevale","Yes","Water Supply","Earth",4.565,1.733,110000,"1981","",0.87862,18.64303,"","28/02/2022","0.5",1.54,"Low","Satisfactory","2017-09-01",0.0588,281.4,394,18.6,4.565,1.733,0,110000,0,11.6082447356423,0,"Unknow"
"SOAD11577","Flumevale","Yes","Water Supply","Earth",9.891,0.425,26145,"1959","",0.79391,15.97974,"","07/06/2022","0.5",NA,"Low","Satisfactory","2017-09-01",0.0678,51,22.6,24.7,9.891,0.425,0,26145,0,10.1714514941218,0,"Unknow"
"SOAD11607","Flumevale","Yes","Irrigation","Earth",10.075,0.333,21565,"1896","",0.24428,0,"Uncontrolled","07/12/2020","2",3.23,"Significant","Satisfactory","2020-12-07",0.1354,706.4,400.9,25.1,10.075,0.333,0,21565,0,9.97887327944202,0,"Unknow"
"SOAD02591","Flumevale","Yes","Flood Risk Reduction","Earth",5.002,1.233,0,"1989","",0.71905,21.30632,"","11/02/2022","1",0,"Significant","Satisfactory","2017-09-01",0.1264,242.6,668.1,NA,5.002,1.233,0,NA,1,NA,0,"Unknow"
"SOAD13511","Flumevale","Yes","Irrigation","Earth",3.202,0.267,21318,"1892","",0.53584,0,"Uncontrolled","22/06/2022","2",26.37,"Significant","Unsatisfactory","2022-06-22",0.1773,228.7,163.1,4.2,3.202,0.267,0,21318,0,9.96735397286454,0,"Unknow"
"SOAD08997","Flumevale","Yes","Water Supply","Earth",16.192,0.17,33242,"1971","",0.47083,420.79982,"","25/05/2022","1",NA,"Significant","Satisfactory","2017-09-01",0.1138,104.4,216,67.9,16.192,0.17,0,33242,0,10.4115994976044,0,"Unknow"
"SOAD09672","Flumevale","Yes","Irrigation","Earth",12.314,0.167,27300,"1960","",0.35066,37.28606,"Uncontrolled","20/07/2022","2",19.92,"Significant","Fair","2022-07-20",0.122,627.3,376.4,34.4,12.314,0.167,0,27300,0,10.2146786105388,0,"Unknow"
"SOAD02492","Flumevale","Yes","Water Supply","Earth",8.768,0.467,105000,"1978","",0.53781,2.66329,"","16/11/2021","1",0.16,"High","Satisfactory","2017-09-01",0.0909,356.4,875.7,26.6,8.768,0.467,0,105000,0,11.5617251529038,0,"Unknow"
"SOAD13415","Flumevale","Yes","Water Supply","Earth",62.17,0.322,1377500,"2012","",0.13396,0,"","26/10/2021","1",0.8,"High","Satisfactory","2017-09-01",0.071,35.7,365.5,23.5,62.17,0.322,0,1377500,0,14.1357815459618,0,"Unknow"
"SOAD14718","Flumevale","Yes","Flood Risk Reduction","Earth",15.369,0.403,12196,"1959","2022",0.03546,141.15437,"Uncontrolled","28/09/2020","3",16.33,"Low","Unsatisfactory","2021-07-28",0.1244,9.6,394.3,NA,15.369,0.403,0,12196,0,9.40894529884324,1,"2022"
"SOAD14026","Flumevale","Yes","Irrigation","Earth",6.729,0.036,3411,"1944","",0.35854,13.31645,"Uncontrolled","28/09/2016","6",27.77,"Low","Unsatisfactory","2022-06-21",0.0806,462.1,358.9,26.3,6.729,0.036,0,3411,0,8.13505390861157,0,"Unknow"
"SOAD17062","Flumevale","Yes","Flood Risk Reduction","Earth",20.43,1.167,685000,"1987","",0.21867,31.95948,"","24/05/2022","1",0.77,"High","Satisfactory","2017-09-01",0.1036,21.2,363.7,NA,20.43,1.167,0,685000,0,13.4371755770973,0,"Unknow"
"SOAD19900","Flumevale","Yes","Irrigation","Earth",3.7,0.667,26171,"1887","",0.30732,0,"Uncontrolled","24/09/2013","6",1.69,"Low","Not Rated",NA,0.0777,548.5,195.7,5.9,3.7,0.667,0,26171,0,10.1724454159896,0,"Unknow"
"SOAD06751","Flumevale","Yes","Recreation","Earth",15.969,0.17,NA,"1969","",0.36051,45.27593,"Uncontrolled","20/07/2022","1",9.48,"High","Satisfactory","2022-07-20",0.1083,87.1,345.5,4.2,15.969,0.17,0,NA,1,NA,0,"Unknow"
"SOAD17651","Flumevale","Yes","Flood Risk Reduction","Earth",13.856,0.501,NA,"1972","",0.41961,34.62277,"Uncontrolled","07/10/2021","3",4.84,"Significant","Satisfactory","2021-10-07",0.128,551.7,608.2,NA,13.856,0.501,0,NA,1,NA,0,"Unknow"
"SOAD10914","Flumevale","Yes","Water Supply","Earth",10.288,0.323,68916,"1963","",0.50235,7.98987,"","05/10/2021","2",26.31,"Significant","Fair","2021-10-05",0.143,376.4,214.2,37.4,10.288,0.323,0,68916,0,11.1406581609655,0,"Unknow"
"SOAD18872","Flumevale","Yes","Recreation","Earth",12.687,0.167,NA,"1953","",0.28565,21.30632,"Uncontrolled","13/10/2022","1",25.66,"High","Satisfactory","2022-10-13",0.0787,713.1,417.3,5.3,12.687,0.167,0,NA,1,NA,0,"Unknow"
"SOAD13012","Flumevale","Yes","Irrigation","Earth",9.765,0.607,38200,"1905","1931F;1931H;1931M;1931S;1974H;1974S",0.32899,0,"Uncontrolled","20/12/2022","1",0,"High","Fair","2022-12-20",0.099,538.8,485.8,45.2,9.765,0.607,0,38200,0,10.5506169722625,6,"1974"
"SOAD17207","Flumevale","Yes","Flood Risk Reduction","Earth",10.432,0.448,NA,"1959","",0.48462,29.29619,"Uncontrolled","15/10/2020","3",1.61,"Low","Not Rated",NA,0.0701,211.2,355.9,NA,10.432,0.448,0,NA,1,NA,0,"Unknow"
"SOAD18281","Flumevale","Yes","Irrigation","Earth",14.936,0.197,93318,"1907","1967S;2012H;2012S",0.20094,21.30632,"Uncontrolled","23/06/2017","6",26.48,"Low","Satisfactory","2013-04-25",0.0421,39.3,318.2,21.7,14.936,0.197,0,93318,0,11.4437790102614,3,"2012"
"SOAD02669","Flumevale","Yes","Irrigation","Earth",5.954,0.4,0,"1946","",0.73678,7.98987,"Uncontrolled","25/06/2020","6",13.47,"Low","Not Rated",NA,0.0835,475.6,207.2,36.3,5.954,0.4,0,NA,1,NA,0,"Unknow"
"SOAD03294","Flumevale","Yes","Irrigation","Earth",20.594,0.168,525,"1952","2016",0.43734,7.98987,"Uncontrolled","08/07/2022","1",21.93,"High","Fair","2022-07-08",0.0993,457.5,381.2,15.4,20.594,0.168,0,525,0,6.26530121273771,1,"2016"
"SOAD12176","Flumevale","Yes","Flood Risk Reduction","Earth",23.968,0.143,NA,"1971","",0.25413,13.31645,"Uncontrolled","20/05/2021","3",4.91,"Significant","Satisfactory","2021-05-20",0.1167,256.1,214.1,NA,23.968,0.143,0,NA,1,NA,0,"Unknow"
"SOAD00363","Flumevale","Yes","Water Supply","Earth",5.869,0.633,464000,"1989","",0.27777,NA,"","10/02/2022","1",7.96,"Significant","Satisfactory","2017-09-01",0.1274,247.9,245.3,11.6,5.869,0.633,0,464000,0,13.0476419863785,0,"Unknow"
"SOAD01174","Flumevale","Yes","Water Supply","Earth",17.146,0.127,12000,"1927","1980S",0.31914,719.0883,"Uncontrolled","16/11/2022","1",0,"High","Fair","2022-11-16",0.105,425.8,447.9,55.5,17.146,0.127,0,12000,0,9.39274525863144,1,"1980"
"SOAD09830","Flumevale","Yes","Fish and Wildlife Pond","Earth",10.926,0.07,NA,"1953","",0.31914,13.31645,"Uncontrolled","08/06/2022","1",26.13,"High","Fair","2022-06-08",0.1164,316.5,442.9,NA,10.926,0.07,0,NA,1,NA,0,"Unknow"
"SOAD12074","Flumevale","Yes","Irrigation","Earth",3.509,0.167,880,"Unknow","1960",0.58115,21.30632,"Uncontrolled","10/08/2022","2",1.59,"Significant","Satisfactory","2022-08-10",0.1208,211.7,788.1,46,3.509,0.167,0,880,0,6.78105762593618,1,"1960"
"SOAD15133","Flumevale","Yes","Flood Risk Reduction","Earth",4.119,0.045,0,"1994","",0.58509,21.30632,"","12/01/2022","1",0.16,"High","Satisfactory","2017-09-01",0.1056,124.5,111,NA,4.119,0.045,0,NA,1,NA,0,"Unknow"
"SOAD03363","Flumevale","Yes","Water Supply","Earth",20.028,0.833,310000,"1988","",0.25413,NA,"","16/03/2022","1",0,"High","Satisfactory","2017-09-01",0.0978,595.8,305.3,11.8,20.028,0.833,0,310000,0,12.6443308022626,0,"Unknow"
"SOAD16917","Flumevale","Yes","Water Supply","Earth",23.933,0.367,116600,"1956","",0.34278,7.98987,"","23/05/2022","0.5",NA,"Low","Satisfactory","2017-09-01",0.0539,520.7,21.3,45.8,23.933,0.367,0,116600,0,11.6665131291911,0,"Unknow"
"SOAD10959","Flumevale","Yes","Hydroelectric","Earth",5.121,0.091,3000,"1855","",0.77027,7.98987,"Uncontrolled","12/08/2019","3",15.29,"Low","Satisfactory","2023-09-29",0.0727,238.8,339.4,75.9,5.121,0.091,0,3000,0,8.00670084544037,0,"Unknow"
"SOAD10743","Flumevale","Yes","Irrigation","Earth",18.359,0.351,68698,"1969","",0.42355,66.58225,"Uncontrolled","11/10/2013","6",18.41,"Low","Not Rated",NA,0.1004,448.8,403.6,44.9,18.359,0.351,0,68698,0,11.1374899220637,0,"Unknow"
"SOAD16252","Flumevale","Yes","Water Supply","Earth",4.372,0.4,0,"1923","",1.80452,844.26293,"","28/06/2022","0.5",NA,"Low","Satisfactory","2017-09-01",0.0797,451.4,22.5,31.9,4.372,0.4,0,NA,1,NA,0,"Unknow"
"SOAD06759","Flumevale","Yes","Irrigation","Earth",8.407,0.22,34120,"1965","",0.46492,13.31645,"Uncontrolled","14/06/2022","1",14.82,"High","Fair","2022-06-14",0.1089,457,312.6,34.8,8.407,0.22,0,34120,0,10.4376683094997,0,"Unknow"
"SOAD11680","Flumevale","Yes","Water Supply","Earth",11.018,0.433,230000,"1976","",0.57524,18.64303,"","10/02/2022","1",0,"Significant","Satisfactory","2017-09-01",0.0992,81.9,813.3,29.6,11.018,0.433,0,230000,0,12.345838935722,0,"Unknow"
"SOAD16680","Flumevale","Yes","Irrigation","Earth",2.75,0.233,7006,"1952","",1.85968,0,"","01/01/1998","0",3.15,"Low","Not Rated",NA,0.0871,635.9,518.5,5.9,2.75,0.233,0,7006,0,8.85466492837053,0,"Unknow"
"SOAD10153","Flumevale","Yes","Irrigation","Earth",13.672,0.228,11253,"1930","",0.30535,111.85818,"Uncontrolled","29/08/2018","6",167.32,"Low","Not Rated",NA,0.0625,363.7,190,32.1,13.672,0.228,0,11253,0,9.32847889999322,0,"Unknow"
"SOAD13995","Flumevale","Yes","Water Supply","Earth",24.034,0.293,790,"1966","",0.22852,0,"","29/06/2022","1",24.7,"High","Satisfactory","2022-06-29",0.0862,18.4,278.7,7.1,24.034,0.293,0,790,0,6.67329796776765,0,"Unknow"
"SOAD10551","Flumevale","Yes","Irrigation","Earth",13.489,0.308,9523,"1951","",0.7092,173.11385,"Uncontrolled","02/06/2022","2",32.05,"Significant","Fair","2022-06-02",0.1558,660.7,143.7,33.5,13.489,0.308,0,9523,0,9.16157020760675,0,"Unknow"
"SOAD03874","Flumevale","Yes","Recreation","Earth",10.46,0.815,6465,"1865","",0.46492,0,"Uncontrolled","25/10/2022","1",0,"High","Satisfactory","2022-10-25",0.0785,356.7,558.9,7.9,10.46,0.815,0,6465,0,8.77431295828538,0,"Unknow"
"SOAD02651","Flumevale","Yes","Water Supply","Earth",17.78,0.183,220500,"1969","",0.32308,5.32658,"","26/01/2022","1",10.72,"High","Satisfactory","2017-09-01",0.0835,329.1,380.1,22.6,17.78,0.183,0,220500,0,12.3036575090061,0,"Unknow"
"SOAD06857","Flumevale","Yes","Unknow","Earth",2.529,0.005,111,"Unknow","",1.92469,0,"","","0",0,"Low","Not Rated",NA,0.0797,532.6,533.2,NA,2.529,0.005,0,111,0,4.71849887129509,0,"Unknow"
"SOAD03663","Flumevale","Yes","Water Supply","Earth",13.148,0.14,0,"Unknow","",0.35263,10.65316,"","31/05/2022","0.5",NA,"Low","Satisfactory","2017-09-01",0.0832,587.1,17.7,33.3,13.148,0.14,0,NA,1,NA,0,"Unknow"
"SOAD07268","Flumevale","Yes","Irrigation","Earth",6.457,0.498,55642,"1903","2001",0.52402,0,"Uncontrolled","29/07/2022","1",0,"High","Not Rated",NA,0.1262,569.8,346.2,41.4,6.457,0.498,0,55642,0,10.9267115626284,1,"2001"
"SOAD15307","Flumevale","Yes","Irrigation","Earth",13.598,0.833,0,"1908","1940;1969",0.48659,0,"Uncontrolled","30/03/2022","1",0,"High","Unsatisfactory","2022-03-30",0.1299,465.4,567.2,36.8,13.598,0.833,0,NA,1,NA,2,"1969"
"SOAD07887","Flumevale","Yes","Flood Risk Reduction","Earth",11.143,0.492,NA,"1960","",0.54372,34.62277,"Uncontrolled","20/07/2020","3",11.46,"Low","Not Rated",NA,0.1192,401.1,227.7,NA,11.143,0.492,0,NA,1,NA,0,"Unknow"
"SOAD00992","Flumevale","Yes","Irrigation","Earth",12.187,0.75,89083,"1955","",0.33096,79.8987,"","18/11/2021","6",37.41,"Low","Not Rated",NA,0.0735,386.5,162.7,22.5,12.187,0.75,0,89083,0,11.3973350238207,0,"Unknow"
"SOAD05749","Flumevale","Yes","Water Supply","Earth",6.4,0.873,51814,"1962","",0.51417,0,"Uncontrolled","16/11/2021","2",11.31,"Significant","Satisfactory","2021-11-16",0.1213,495.5,466.8,46.8,6.4,0.873,0,51814,0,10.8554349616183,0,"Unknow"
"SOAD08741","Flumevale","Yes","Flood Risk Reduction","Earth",12.014,0.667,2000,"1985","",0.43734,21.30632,"Uncontrolled","09/06/2021","3",8.16,"Low","Not Rated",NA,0.0715,661.6,252.9,NA,12.014,0.667,0,2000,0,7.60140233458373,0,"Unknow"
"SOAD00956","Flumevale","Yes","Debris Control","Earth",15.353,0.762,1020741,"2001","",0.64813,NA,"","15/12/2021","1",13.45,"Significant","Satisfactory","2017-09-01",0.1053,389.3,122.3,NA,15.353,0.762,0,1020741,0,13.8360403717766,0,"Unknow"
"SOAD16413","Flumevale","Yes","Water Supply","Earth",22.777,0.183,654475,"1972","",0.36248,5.32658,"","06/06/2022","1",1.17,"High","Satisfactory","2017-09-01",0.0876,525.6,608.1,37.3,22.777,0.183,0,654475,0,13.3915901944466,0,"Unknow"
"SOAD02697","Flumevale","Yes","Water Supply","Earth",26.739,0.217,220000,"1976","",0.27974,2.66329,"","28/01/2022","1",2.12,"High","Satisfactory","2017-09-01",0.0945,289.7,834.2,16.4,26.739,0.217,0,220000,0,12.3013873707787,0,"Unknow"
"SOAD06929","Flumevale","Yes","Irrigation","Earth",8.213,0.508,23486,"1928","",0.31323,0,"Uncontrolled","23/06/2022","2",14.92,"Significant","Satisfactory","2022-06-23",0.1018,472.1,415.9,37.8,8.213,0.508,0,23486,0,10.064202355576,0,"Unknow"
"SOAD13869","Flumevale","Yes","Water Supply","Earth",12.18,0.253,NA,"1893","",0.43143,15.97974,"","23/08/2017","6",67.71,"Low","Not Rated",NA,0.0825,325,195.9,21.3,12.18,0.253,0,NA,1,NA,0,"Unknow"
"SOAD11877","Flumevale","Yes","Irrigation","Earth",8.018,0.22,18015,"1892","1973H;1973S",0.33293,0,"Uncontrolled","11/08/2022","2",15.03,"Significant","Fair","2022-08-11",0.1322,447.9,436.1,1.6,8.018,0.22,0,18015,0,9.79901553093942,2,"1973"
"SOAD17097","Flumevale","Yes","Irrigation","Earth",14.418,0.265,8070,"1935","",0.50038,7.98987,"","25/07/2022","6",34.77,"Low","Satisfactory","2015-07-14",0.0297,634.3,145.9,12,14.418,0.265,0,8070,0,8.99603266932437,0,"Unknow"
"SOAD05253","Flumevale","Yes","Hydroelectric","Earth",30.102,0.55,227000,"1962","",0.39991,2.66329,"Uncontrolled","22/08/2023","1",1.67,"High","Satisfactory","2023-09-29",0.0789,498.8,809.3,76.7,30.102,0.55,0,227000,0,12.3327097017402,0,"Unknow"
"SOAD17104","Flumevale","Yes","Irrigation","Earth",8.686,0.525,61632,"1931","",0.74663,239.6961,"Uncontrolled","21/06/2022","2",3.17,"Significant","Satisfactory","2022-06-21",0.1219,281.8,209.5,19.9,8.686,0.525,0,61632,0,11.0289527203637,0,"Unknow"
"SOAD19344","Flumevale","Yes","Water Supply","Earth",9.932,1.861,450000,"1975","",0.31717,0,"","30/08/2022","1",3.27,"High","Satisfactory","2017-09-01",0.0867,428.4,383.3,9.8,9.932,1.861,0,450000,0,13.0170050839663,0,"Unknow"
"SOAD02509","Flumevale","Yes","Other","Earth",12.194,0.217,32954,"1979","",0.64616,0,"","01/01/1991","6",26.77,"Low","Not Rated",NA,0.046,384.8,440.9,NA,12.194,0.217,0,32954,0,10.4028982734868,0,"Unknow"
"SOAD03418","Flumevale","Yes","Water Supply","Earth",3.806,0.733,2200,"1985","",0.25216,0,"Uncontrolled","11/10/2022","1",1.58,"High","Satisfactory","2022-10-11",0.0808,430.1,597.6,11.5,3.806,0.733,0,2200,0,7.69666708152646,0,"Unknow"
"SOAD08977","Flumevale","Yes","Irrigation","Earth",8.662,0.09,16000,"1904","",0.38612,21.30632,"Uncontrolled","29/08/2018","6",15.67,"Low","Unsatisfactory","2013-09-24",0.0895,603.8,240.5,40.6,8.662,0.09,0,16000,0,9.68040649926887,0,"Unknow"
"SOAD04057","Flumevale","Yes","Irrigation","Earth",10.431,0.58,9302,"1965","",0.11229,0,"Uncontrolled","15/07/2021","2",11.36,"Significant","Fair","2021-07-15",0.1359,33.9,257.7,18.5,10.431,0.58,0,9302,0,9.13809220776856,0,"Unknow"
"SOAD02519","Flumevale","Yes","Irrigation","Earth",11.875,0.298,68022,"1949","",0.40976,0,"","28/07/2022","1",19.58,"High","Fair","2022-07-28",0.0889,482.1,349.5,11.1,11.875,0.298,0,68022,0,11.1276011622637,0,"Unknow"
"SOAD04168","Flumevale","Yes","Water Supply","Earth",10.377,0.417,83000,"1971","",0.73087,7.98987,"","06/04/2022","1",16.01,"High","Satisfactory","2017-09-01",0.0998,644.3,214.7,4.9,10.377,0.417,0,83000,0,11.3266079348989,0,"Unknow"
"SOAD16071","Flumevale","Yes","Irrigation","Earth",10.066,0.267,NA,"1906","",0.46492,0,"Uncontrolled","16/03/2022","1",0,"High","Satisfactory","2022-03-16",0.0898,684.2,897.7,2.2,10.066,0.267,0,NA,1,NA,0,"Unknow"
"SOAD01585","Flumevale","No","Water Supply","Earth",46.873,0.18,469000,"1951","2006E",0.21473,7.98987,"Uncontrolled","27/08/2020","1",1.56,"High","Not Available",NA,0.1074,34.3,329.6,26.6,46.873,0.18,0,469000,0,13.0583601796223,1,"2006"
"SOAD06735","Flumevale","Yes","Irrigation","Earth",10.221,0.3,89337,"1945","",0.49447,109.19489,"Uncontrolled","06/11/2014","6",4.68,"Low","Not Rated",NA,0.1045,34.9,182.9,24.5,10.221,0.3,0,89337,0,11.4001822082665,0,"Unknow"
"SOAD18057","Flumevale","Yes","Water Supply","Earth",15.08,0.112,30000,"1929","",0.27186,2.66329,"","01/06/2022","0.5",NA,"Low","Satisfactory","2017-09-01",0.0718,613.8,6,26.1,15.08,0.112,0,30000,0,10.3089859934221,0,"Unknow"
"SOAD01964","Flumevale","Yes","Water Supply","Earth",8.274,0.117,15272,"1963","",0.55948,21.30632,"Uncontrolled","09/09/2010","6",28.56,"Low","Unsatisfactory","2021-10-12",0.0747,384.2,349.8,18.9,8.274,0.117,0,15272,0,9.63384184257045,0,"Unknow"
"SOAD10467","Flumevale","Yes","Water Supply","Earth",7.246,1.967,354200,"Unknow","",0.35066,NA,"","30/08/2022","0.5",15.08,"Low","Satisfactory","2019-04-10",0.0609,87,380.9,31,7.246,1.967,0,354200,0,12.7776198275906,0,"Unknow"
"SOAD14756","Flumevale","Yes","Recreation","Earth",8.094,0.056,165,"1974","",0.38218,0,"Uncontrolled","07/07/2022","1",20.71,"High","Fair","2022-07-07",0.1066,696.6,450,4.7,8.094,0.056,0,165,0,5.11198778835654,0,"Unknow"
"SOAD17671","Flumevale","No","Fire Protection, Stock, Or Small Fish Pond","Earth",2.86,0.142,NA,"1955","",NA,23.96961,"Controlled","31/08/2010","10",NA,"Low","Not Rated",NA,0.0423,9.6,22.5,NA,2.86,0.142,0,NA,1,NA,0,"Unknow"
"SOAD20297","Flumevale","Yes","Water Supply","Earth",39.921,0.3,550000,"1967","",0.17139,0,"","21/02/2022","1",0.8,"High","Satisfactory","2017-09-01",0.1059,14.6,727.8,59.6,39.921,0.3,0,550000,0,13.2176753753888,0,"Unknow"
"SOAD04726","Flumevale","Yes","Flood Risk Reduction","Earth",6.113,2.206,0,"1990","",1.53266,NA,"","12/01/2022","1",0,"High","Satisfactory","2017-09-01",0.0894,385.5,301.3,NA,6.113,2.206,0,NA,1,NA,0,"Unknow"
"SOAD15644","Flumevale","Yes","Flood Risk Reduction","Earth",13.703,0.507,150000,"1981","",0.69738,50.60251,"","10/08/2022","1",0.79,"High","Satisfactory","2017-09-01",0.071,71.4,813.8,NA,13.703,0.507,0,150000,0,11.9183972397228,0,"Unknow"
"SOAD06206","Flumevale","Yes","Irrigation","Earth",17.107,0.284,NA,"1893","2002",0.2561,226.37965,"Uncontrolled","14/05/2021","2",0,"Significant","Satisfactory","2021-05-14",0.1349,274.3,821.5,40.3,17.107,0.284,0,NA,1,NA,1,"2002"
"SOAD07356","Flumevale","Yes","Flood Risk Reduction","Earth",14.648,0.972,143000,"1958","",0.72496,NA,"","21/04/2022","1",1.32,"High","Satisfactory","2017-09-01",0.0885,620.4,886.2,NA,14.648,0.972,0,143000,0,11.8706069022246,0,"Unknow"
"SOAD15927","Flumevale","Yes","Recreation","Earth",8.759,0.171,NA,"1895","1947;1955",0.33884,29.29619,"Uncontrolled","08/12/2021","2",20.84,"Significant","Satisfactory","2021-12-08",0.1299,221.3,405.6,6,8.759,0.171,0,NA,1,NA,2,"1955"
"SOAD07954","Flumevale","Yes","Irrigation","Earth",11.069,0.107,32853,"1908","",0.64616,7.98987,"Uncontrolled","06/07/2021","2",13.97,"Significant","Satisfactory","2021-07-06",0.1165,483.5,297.4,32.2,11.069,0.107,0,32853,0,10.3998287821011,0,"Unknow"
"SOAD11769","Flumevale","Yes","Irrigation","Earth",5.458,0.267,24442,"1885","2006",0.7486,0,"Uncontrolled","12/08/2022","2",13.21,"Significant","Satisfactory","2022-08-12",0.1176,335.5,418.4,25,5.458,0.267,0,24442,0,10.1040991553433,1,"2006"
"SOAD18741","Flumevale","Yes","Flood Risk Reduction","Earth",18.882,0.144,47350,"1965","",0.44719,79.8987,"","15/09/2022","3",23.81,"Low","Fair","2020-08-31",0.0879,531.7,278.9,NA,18.882,0.144,0,47350,0,10.7653432177154,0,"Unknow"
"SOAD16800","Flumevale","Yes","Flood Risk Reduction","Earth",15.061,0.733,81000,"1978","",0.27974,21.30632,"Uncontrolled","02/12/2021","3",0,"High","Satisfactory","2021-12-02",0.0956,663.5,510.3,NA,15.061,0.733,0,81000,0,11.3022167792574,0,"Unknow"
"SOAD12941","Flumevale","Yes","Flood Risk Reduction","Earth",13.954,0.467,72000,"2014","",0.38612,NA,"","09/03/2022","1",1.66,"High","Satisfactory","2017-09-01",0.0824,67.6,274.7,NA,13.954,0.467,0,72000,0,11.1844352867906,0,"Unknow"
"SOAD08782","Flumevale","Yes","Flood Risk Reduction","Earth",14.31,0.722,151000,"1988","",0.48462,29.29619,"Uncontrolled","09/06/2021","3",8.14,"Low","Fair","2021-04-05",0.0766,241.7,435.6,NA,14.31,0.722,0,151000,0,11.9250417382917,0,"Unknow"
"SOAD03531","Flumevale","Yes","Recreation","Earth",6.691,0.175,NA,"1895","1947;1955",0.35263,29.29619,"Uncontrolled","08/12/2021","2",23.54,"Significant","Satisfactory","2021-12-08",0.1163,194.8,341,5.4,6.691,0.175,0,NA,1,NA,2,"1955"
"SOAD16022","Flumevale","Yes","Hydroelectric","Earth",7.021,0.085,2700,"1852","",0.61464,2.66329,"Uncontrolled","26/09/2022","3",NA,"Low","Satisfactory","2023-09-29",0.0743,107,23.8,NA,7.021,0.085,0,2700,0,7.90137735379262,0,"Unknow"
"SOAD03431","Flumevale","Yes","Water Supply","Earth",21.199,0.287,134787,"1912","",0.41567,50.60251,"","13/06/2022","1",0.32,"High","Satisfactory","2017-09-01",0.1033,625.8,575.5,37.8,21.199,0.287,0,134787,0,11.8114584527262,0,"Unknow"
"SOAD15566","Flumevale","Yes","Irrigation","Earth",11.125,0.88,NA,"1964","",0.60873,135.82779,"","15/10/2010","6",24.49,"Low","Not Rated",NA,0.0815,696.3,402.1,46.1,11.125,0.88,0,NA,1,NA,0,"Unknow"
"SOAD16625","Flumevale","Yes","Water Supply","Earth",9.413,1.2,95000,"1973","",0.49053,2.66329,"","12/10/2021","1",0,"High","Satisfactory","2017-09-01",0.1025,700.4,315,10.1,9.413,1.2,0,95000,0,11.4616426968431,0,"Unknow"
"SOAD12039","Flumevale","Yes","Water Supply","Earth",11.258,0.108,17328,"1938","",0.35263,10.65316,"","22/06/2022","0.5",NA,"Low","Satisfactory","2017-09-01",0.0644,444.3,7.7,54.1,11.258,0.108,0,17328,0,9.76013667764025,0,"Unknow"
"SOAD04563","Flumevale","Yes","Water Supply","Earth",13.351,0.133,15950,"1973","",0.52205,612.5567,"Uncontrolled","18/08/2022","1",8.19,"High","Fair","2022-08-18",0.1013,505.7,464.9,57.6,13.351,0.133,0,15950,0,9.67727680217245,0,"Unknow"
"SOAD16424","Flumevale","Yes","Water Supply","Earth",23.769,0.197,106975,"1930","",0.32899,2.66329,"","02/11/2021","1",5.21,"High","Satisfactory","2017-09-01",0.0841,472.8,282.9,44.7,23.769,0.197,0,106975,0,11.5803597892198,0,"Unknow"
"SOAD05404","Flumevale","Yes","Irrigation","Earth",12.956,0.899,59891,"2013","",0.55357,0,"Uncontrolled","09/03/2021","1",1.54,"High","Satisfactory","2021-03-09",0.082,612.2,455,35.6,12.956,0.899,0,59891,0,11.0002982192576,0,"Unknow"
"SOAD10239","Flumevale","Yes","Water Supply","Earth",14.508,0.123,0,"1926","",0.3743,2.66329,"","01/06/2022","0.5",NA,"Low","Satisfactory","2017-09-01",0.077,394.6,18.7,55.3,14.508,0.123,0,NA,1,NA,0,"Unknow"
"SOAD15981","Flumevale","Yes","Irrigation","Earth",18.446,0.175,52904,"1960","",0.30338,29.29619,"Uncontrolled","02/06/2022","2",34.26,"Significant","Fair","2022-06-02",0.1206,493.1,211.9,41.5,18.446,0.175,0,52904,0,10.8762531313383,0,"Unknow"
"SOAD01257","Flumevale","Yes","Irrigation","Earth",8.5,0.429,28000,"1966","",0.68162,7.98987,"Uncontrolled","16/10/2020","6",31.99,"Low","Not Rated",NA,0.059,327.1,72.8,44,8.5,0.429,0,28000,0,10.2399955028053,0,"Unknow"
"SOAD06284","Flumevale","Yes","Flood Risk Reduction","Earth",37.591,0.167,272350,"1922","",0.18321,7.98987,"","04/10/2021","1",0.16,"High","Satisfactory","2017-09-01",0.0917,35.5,393.3,NA,37.591,0.167,0,272350,0,12.514846954551,0,"Unknow"
"SOAD05198","Flumevale","Yes","Other","Earth",13.151,0.583,125400,"1949","",0.77027,817.63003,"","06/06/2022","0.5",NA,"Low","Satisfactory","2017-09-01",0.0629,243.2,12.9,NA,13.151,0.583,0,125400,0,11.7392718816308,0,"Unknow"
"SOAD02823","Flumevale","Yes","Water Supply","Earth",38.483,0.297,80,"1965","",0.21276,21.30632,"Uncontrolled","12/09/2017","6",26.45,"Low","Not Rated",NA,0.0674,39.2,271.7,36.9,38.483,0.297,0,80,0,4.39444915467244,0,"Unknow"
"SOAD19603","Flumevale","Yes","Irrigation","Earth",6.904,0.933,90111,"1976","",0.53978,2415.60403,"Uncontrolled","29/08/2016","6",31.18,"Low","Satisfactory","2020-11-17",0.0473,380.9,66.9,10.6,6.904,0.933,0,90111,0,11.4088086200777,0,"Unknow"
"SOAD18388","Flumevale","Yes","Water Supply","Earth",29.634,0.035,6e+06,"1995","",0.30535,42.61264,"Uncontrolled","12/05/2023","3",1.59,"Low","Satisfactory","2023-09-29",0.0665,358.3,117.6,52.6,29.634,0.035,0,6e+06,0,15.607270193859,0,"Unknow"
"SOAD19766","Flumevale","Yes","Other","Earth",26.027,0.07,35000,"1982","",0.38021,7.98987,"","03/02/2022","1",15.7,"High","Satisfactory","2017-09-01",0.0767,385.7,166.3,NA,26.027,0.07,0,35000,0,10.463131911492,0,"Unknow"
"SOAD17145","Flumevale","Yes","Water Supply","Earth",26.297,0.608,9844,"1961","",0.26201,0,"Uncontrolled","29/09/2022","2",58.5,"Significant","Satisfactory","2022-09-29",0.1108,118.6,168.7,54.9,26.297,0.608,0,9844,0,9.19471899107323,0,"Unknow"
"SOAD05545","Flumevale","Yes","Water Supply","Earth",7.358,0.096,4100,"1896","",1.14457,95.87844,"","22/04/2022","0.5",NA,"Low","Satisfactory","2017-09-01",0.0637,378.9,16.7,38,7.358,0.096,0,4100,0,8.31898612539206,0,"Unknow"
"SOAD07525","Flumevale","Yes","Water Supply","Earth",13.624,1.317,NA,"2019","",0.42946,0,"Uncontrolled","06/05/2022","1",3.09,"High","Fair","2022-05-06",0.1068,489.8,808.6,32.7,13.624,1.317,0,NA,1,NA,0,"Unknow"
"SOAD07297","Flumevale","Yes","Water Supply","Earth",40.768,0.148,135000,"1925","",0.43143,58.59238,"","08/12/2021","1",NA,"Significant","Satisfactory","2017-09-01",0.1345,401.5,189.8,51,40.768,0.148,0,135000,0,11.8130374648005,0,"Unknow"
"SOAD04537","Flumevale","Yes","Irrigation","Earth",7.236,0.667,25000,"1904","",0.57721,0,"Uncontrolled","17/06/2022","1",3.15,"High","Satisfactory","2022-06-17",0.0917,201.2,336.8,26.1,7.236,0.667,0,25000,0,10.1266711030504,0,"Unknow"
"SOAD13991","Flumevale","Yes","Water Supply","Earth",6.086,0.342,39306,"1968","",0.89438,82.56199,"","24/03/2022","0.5",NA,"Low","Satisfactory","2017-09-01",0.0806,689.4,10.9,50.3,6.086,0.342,0,39306,0,10.5791578990447,0,"Unknow"
"SOAD01871","Flumevale","Yes","Irrigation","Earth",8.676,0.37,95910,"1863","",0.59691,0,"Uncontrolled","27/07/2022","1",0,"High","Unsatisfactory","2022-07-27",0.1506,619.7,284.5,17.7,8.676,0.37,0,95910,0,11.4711759571091,0,"Unknow"
"SOAD15665","Flumevale","No","Hydroelectric","Earth",8.053,0.055,NA,"Unknow","",NA,NA,"","11/07/2023","3",NA,"Low","Satisfactory","2023-09-29",0.0636,6.4,12.6,NA,8.053,0.055,0,NA,1,NA,0,"Unknow"
"SOAD08577","Flumevale","Yes","Flood Risk Reduction","Earth",8.887,0.402,51616,"1937","",1.14654,15.97974,"Uncontrolled","25/09/2013","3",28.13,"Low","Satisfactory","2022-05-26",0.0665,582.8,149.8,NA,8.887,0.402,0,51616,0,10.8516063545748,0,"Unknow"
"SOAD05306","Flumevale","Yes","Hydroelectric","Earth",24.1,0.988,NA,"1944","",0.39991,29.29619,"Uncontrolled","26/07/2023","1",3.15,"High","Fair","2023-09-29",0.1084,178.1,858.2,85.3,24.1,0.988,0,NA,1,NA,0,"Unknow"
"SOAD11653","Flumevale","Yes","Fish and Wildlife Pond","Earth",5.985,0.027,NA,"1906","",1.15442,7.98987,"","22/09/2021","6",72.9,"Low","Fair","2021-04-21",0.0802,707.3,198.4,NA,5.985,0.027,0,NA,1,NA,0,"Unknow"
"SOAD17924","Flumevale","Yes","Water Supply","Earth",12.687,1.633,37937,"1965","",0.0925899999999999,0,"Uncontrolled","25/05/2021","6",3.11,"Low","Not Rated",NA,0.0582,34.8,882,46.8,12.687,1.633,0,37937,0,10.5437085272867,0,"Unknow"
"SOAD08951","Flumevale","Yes","Irrigation","Earth",10.652,0.21,90999,"1921","",0.56145,29.29619,"Uncontrolled","03/08/2021","2",3.28,"Significant","Satisfactory","2021-08-03",0.1224,686.8,477.4,28.5,10.652,0.21,0,90999,0,11.418614785499,0,"Unknow"
"SOAD17813","Flumevale","Yes","Water Supply","Earth",9.608,0.3,25000,"1929","",0.93772,7.98987,"","06/05/2022","1",NA,"Significant","Satisfactory","2017-09-01",0.112,713.5,135.7,71.3,9.608,0.3,0,25000,0,10.1266711030504,0,"Unknow"
"SOAD15043","Flumevale","Yes","Water Supply","Earth",4.161,0.1,4000,"1926","",3.91833,53.2658,"","07/06/2022","0.5",NA,"Low","Satisfactory","2017-09-01",0.0599,809.4,8.1,9.9,4.161,0.1,0,4000,0,8.29429960885724,0,"Unknow"
"SOAD07993","Flumevale","Yes","Irrigation","Earth",14.18,0.242,87241,"1910","",0.49841,21.30632,"Uncontrolled","10/06/2022","1",4.97,"High","Satisfactory","2022-06-10",0.0929,696.1,185.3,21.4,14.18,0.242,0,87241,0,11.3764411453164,0,"Unknow"
"SOAD19514","Flumevale","Yes","Water Supply","Earth",23.066,0.253,75000,"1970","",0.32308,388.84034,"","25/05/2022","1",22.83,"High","Satisfactory","2017-09-01",0.1056,343.1,363.5,46.4,23.066,0.253,0,75000,0,11.2252567257629,0,"Unknow"
"SOAD15160","Flumevale","Yes","Water Supply","Earth",29.564,0.192,0,"1894","",0.52796,21.30632,"","31/08/2022","1",NA,"High","Satisfactory","2017-09-01",0.087,340.1,527.3,66.5,29.564,0.192,0,NA,1,NA,0,"Unknow"
"SOAD15602","Flumevale","Yes","Irrigation","Earth",40.268,0.28,255300,"1974","",0.20685,13.31645,"Uncontrolled","12/08/2022","1",12.71,"High","Fair","2022-08-12",0.1042,40.5,178.9,32.9,40.268,0.28,0,255300,0,12.4501985201823,0,"Unknow"
"SOAD10699","Flumevale","Yes","Other","Earth",18.899,0.193,111100,"1932","",0.52008,NA,"","23/02/2022","1",0.16,"High","Satisfactory","2017-09-01",0.0925,123.4,750.7,NA,18.899,0.193,0,111100,0,11.6181949764873,0,"Unknow"
"SOAD08242","Flumevale","Yes","Flood Risk Reduction","Earth",16.699,0.373,70000,"1964","",0.39203,79.8987,"Uncontrolled","23/05/2022","3",20.23,"High","Satisfactory","2022-05-23",0.091,504.3,412.8,NA,16.699,0.373,0,70000,0,11.1562648066437,0,"Unknow"
"SOAD05714","Flumevale","Yes","Irrigation","Earth",23.367,0.047,8048,"1950","",0.26595,183.76701,"","03/10/2018","6",60.34,"Low","Not Rated",NA,0.0408,287.9,215.9,1.4,23.367,0.047,0,8048,0,8.99330313909373,0,"Unknow"
"SOAD10753","Flumevale","Yes","Irrigation","Earth",13.212,0.415,1230,"1946","",0.60873,7.98987,"Uncontrolled","12/07/2022","1",11.46,"High","Fair","2022-07-12",0.1209,115.5,260.7,15.5,13.212,0.415,0,1230,0,7.11558212618445,0,"Unknow"
"SOAD20420","Flumevale","Yes","Water Supply","Earth",11.84,0.45,126807,"1974","",0.65404,5.32658,"","12/10/2021","1",0,"High","Satisfactory","2017-09-01",0.0979,446.9,490,53,11.84,0.45,0,126807,0,11.7504294104777,0,"Unknow"
"SOAD17975","Flumevale","Yes","Fire Protection, Stock, Or Small Fish Pond","Earth",3.558,2.033,NA,"1901","",1.379,0,"","14/09/2012","6",54.35,"Low","Fair","2019-08-07",0.0631,303.4,195,NA,3.558,2.033,0,NA,1,NA,0,"Unknow"
"SOAD01217","Flumevale","Yes","Tailings","Earth",7.602,0.417,47000,"2006","",0.59297,2.66329,"","03/05/2022","0.5",NA,"Low","Satisfactory","2017-09-01",0.0674,560.6,7.1,NA,7.602,0.417,0,47000,0,10.7579241570616,0,"Unknow"
"SOAD03608","Flumevale","Yes","Irrigation","Earth",24.978,0.783,65933,"2000","",0.36839,7.98987,"Uncontrolled","19/05/2022","1",18.57,"High","Fair","2022-05-19",0.1092,255.4,426.2,3.3,24.978,0.783,0,65933,0,11.096409520675,0,"Unknow"
